,text,class,summary,cleaned
138318,I wrote another love story  enjoy lonely redditors I go to her house to pick her up  She s wearing sweatpants and an oversized pink hoodie  She s the cutest thing I ve ever seen  I try not to blush while walking to our car  We drive to the zoo on a chilly day  We go in and there is a long entrance  We go to see the monkeys first  The monkeys are swinging from branch to branch  screaming  Some of them are getting close to others so they can keep warm  Throughout the zoo  we take lots and lots of pictures  I can t stop smiling  even when my mouth is hurting  We see the elephants and hippos on a little safari trip through the outside of the zoo  We hold hands while the bumpy road is continuing  Her laugh and her smile is the best  After the ride we take her to her favorite place  the birds  She gleams  Small  big  colourful  loud birds all around us  Her voice gets high and cute when she tries to pet one  I try to help but we knock eachother down  I give her my hand  and she holds on tight as I pick her up  Another photo of giggling faces  We eat at the overpriced restaurant  and see a couple of statues  I let her feed the giraffe  and seeing his purple younger makes her laugh  Hours pass as it feels like seconds  We are back in the car  driving home  No music  just enjoying our company together  I drop her off at her house  She tells me she wants to hold my hand a little longer Grab my hand  Grab my whole life too  For I can t help falling in love with you,0,I wrote another love story for lonely redditors. I picked her up from her house and we went to the zoo together. We took a lot of pictures together. She wants to hold my hand a little longer. I can't help falling in love with her. ,write love story lonely redd tor pick house go zoo take lot picture want hold hand little long not help fall love
138319,Why does life have to suck during your teenage years  Seriously  it seems like every teen has to deal with a shit ton of homework  some sort of crazy mood swings  a touch of depression  and the unstoppable horniness  Why the hell did nature intend this,0,Why does life have to suck during your teenage years  Seriously  it seems like every teen has to deal with a shit ton of homework  some sort of crazy mood swings  a touch of depression  and the unstoppable horniness  Why the hell did nature intend this,life suck teenage year seriously like teen deal shit ton homework sort crazy mood swing touch depression unstoppable horniness hell nature intend
138320,im a third wheel to my crush and my best friend it hurts seeing such a good relashonship unfold before my eyes and i just want to cry every time im around them i cant even get a girlfirend and i try a fuckton im always their for for evyone and their therapist i even try to study on therapy to help them but whenever i ask them out im friend zoned im this young and this deprresed everytim im around them i just shut down and try not to cry i used to be so happy around them im mean just yesterday i was sitting their feeling like a creep because their being affectionate towards eachother and then we get the dab pen and start getting high its all going good untill they ask me to get down so she can loose her vcard and i go down sit down and start crying i dont have anyone hell my own brother doesnt fucking like me why would a girl,0,"There is a relashonship between his crush and his best friend. He is jealous because he can't get a girlfriend. His brother doesn't like him. He studies therapy to help him, but he is still friend zoneed.",relationship crush good friend jealous not girlfriend brother not like study therapy help friend zone
138321,How to get access to a gun I ve made some serious and irreparable mistakes in life  I m essentially one big f ck up  unable to forgive myself for past errors  I ve been contemplating suicide  but one of my mistakes includes a felony for theft  which if found guilty  would impede me from buying a gun  I am unlikely to commit suicide any other way  so how would it be possible to access a gun further down the road  I want to have the option so it s important that I have access to a firearm,1,"How to get access to a gun. I have made serious mistakes in life and want to commit suicide. I want to have the option to kill myself, so it's important that I have access to the firearm. If I am found guilty of theft, I won't be able to buy a gun, so I need to find a way to access it later.",access gun mistake life want commit suicide want option kill important access firearm find guilty theft not able buy gun need find way access later
138322,Help me get rid of my bowl cut Hi  some im    been w i d e most my life  so after loosing shite loads of weight recently  I want to get an actual hair style thats not just an average   year old bowl cut  There s some people in my classes that I kinda want to replicate  it is like short on the side and back  kinda like a   bowlcut half way up and then its like kinda thin but all spikey on the fringe  I want it  it looks cool  I ve got no idea what it is or how to ask for it so pls help  If it helps  im     kinda skinny and definitely don t lift  Thank you PS  Ollie  stop stalking my account you weirdo and close the car window next time,0,Ollie wants to get rid of his bowl cut but doesn't know what it is or how to ask for it. He is skinny and doesn't lift. Ollie will stop stalking his account and close the car window next time.,ollie want rid bowl cut not know ask skinny not lift ollie stop stalk account close car window time
138323,I want to dieFor the past few months every morning when I wake up I fantasize about walking off a bridge  shooting myself  etc  I stopped wearing seatbelts in case the car crashes and i fucking die   I didn t think I was depressed I have things going for me  I guess  I m in my  s and I want to fucking die,1,For the past few months every morning when I wake up I fantasize about walking off a bridge shooting myself. I stopped wearing seatbelts in case the car crashes and I die. I didn't think I was depressed because I have things going for me. ,past month morning wake fantasize walk bridge shoot stop wear seat belt case car crash die not think depressed thing go
138324,This is the worst day of my life  and its only   am  losing reasons to liveI feel hopeless  Nobody loves me  Im going to die alone  I m thinking about jumping off a bridge  no one would care  My head is killing me  I hope I don t pussy out this time  Whatever,1,This is the worst day of my life  and its only   am  losing reasons to liveI feel hopeless  Nobody loves me  Im going to die alone  I m thinking about jumping off a bridge  no one would care  My head is killing me  I hope I don t pussy out this time  Whatever,bad day life lose reason live feel hopeless love go die thinking jump bridge no care head kill hope don pussy time
138325,It s my fricken birthday My last year of being a teenager starts today  I got woken up at SIX AM because my mother was cleaning out the bath like   and I have no friends who are gonna say happy birthday  I have to work   hrs today  probably doing something I hate  My boyfriend is halfway across the world snd the presents he sent me haven t arrived  What a sucky birthday,0,It's my birthday today. My last year of being a teenager starts today. I have no friends to wish me happy birthday and I have to work long hours. My boyfriend is halfway across the world and his presents haven't arrived yet.,birthday today year teenager start today no friend wish happy birthday work long hour boyfriend halfway world present not arrive
138326,Fuck this lifeGrew up doing nothing  No one did nothing with me  have no friends no one wants to talk to me  Currently spent my entire life playing video game and barely eating  Game is the only thing that makes me happy p  Now family and threating to take my stuff away  get a job and shit even tho I can t because I live in the smallest place ever and no ones hiring   I m so fucking miserable and have nothing worth to live for,1,Grew up doing nothing. Spent his entire life playing video games and barely eating. His family is threatening to take his stuff away. Can't get a job because he lives in the smallest place ever and no one is hiring.,grow spend entire life play video game barely eat family threaten stuff away not job live small place no hire
138327,For everyone who likes shiny things  what s your favorite gemstone and or metal  Mine are fluorescent diamonds and bismuth because they look really cool,0,For everyone who likes shiny things  what s your favorite gemstone and or metal  Mine are fluorescent diamonds and bismuth because they look really cool,like shiny thing favourite gemstone metal fluorescent diamond bismuth look cool
138328,Gays can t do math Am the bisexual  Math is my least favorite subject  I am failing and going to fail the semester  Yayyyy  Colleg no fun,0,Gays can t do math Am the bisexual  Math is my least favorite subject  I am failing and going to fail the semester  Yayyyy  Colleg no fun,gay match bisexual mathis favourite subject fail go fail semester college no fun
138329,I think I killed somebodyIt would be my fault  they didn t have to kill themselves  Its been two weeks and I havent heard from them  I can t cope with this  I ve been waking up yelling in my sleep   nights in a row now,1,I think I killed somebodyIt would be my fault  they didn t have to kill themselves  Its been two weeks and I havent heard from them  I can t cope with this  I ve been waking up yelling in my sleep   nights in a row now,think kill somebody fault kill week not hear cope wake yell sleep night row
138330,i need help  m I might as well state right off the bat  suicide currently isn t an option for me yet  despite believing that s hands down my easiest way out at this point and as much as I want it to be an option Everything has lost meaning in my life  My will to go to university  to work  to further myself in life  Why it could possibly be important to wake up in the morning is beyond me  I just don t see the point of every single fucking day  all the negative shit  how everything good comes to an end  it s just this perpetual cycle  I d explain my story  but I truthfully don t see the point  it just doesn t matter  and i m feeling beyond hopeless I ve spoken to counselors and psychologists over the past few months and nothing seems to be helping me  Anti depressants aren t helping  especially due to my issues being entirely situational here s the problem  I hate being alone  i m always trying to get my feelings or decisions reaffirmed by people  and most of all  I don t love myself  partially due to being treated poorly and discarded   ghosted from a near   year relationship  when I was extremely mentally and physically healthy  I guess  I m just tired and I don t know what to do anymore  I don t know how to fix myself anymore,1,"Suicide isn't an option for me yet, but I don't see the point of living. I hate being alone and I hate feeling rejected by people. I was ghosted from a relationship when I was mentally and physically healthy. I'm tired and don't know what to do anymore.",suicide not option not point living hate hate feel reject people ghost relationship mentally physically healthy tired not know anymore
138331,My friend attempted suicide today  and I worry he might try it again soon My friend has been struggling with depression  and his parents are very judgemental  From what he s told me  they let him do whatever he wants  but they also mock him for everything he does  which has taken a toll on him  He wanted to join the army to escape them  but in the end he was guilt tripped into staying  He also dropped out from college and has had no luck  finding a job       Today  he told me he almost shot himself  I want to do something for him  I ve been trying to convince him that he s depressed and he needs to seek help  but he always either deflects it or says his parents say he has no reason to be depressed        He went to a therapist once  but he just said some bullshit and left  never to come back again  His reasoning was that it felt  fake  to say he had depressive thoughts       I don t know what else to add  I don t know him IRL  we re online friends  but still it is devastating to see someone I care about going through this  The formatting and flow of this post will probably be extremely shitty as I m typing this out in a hurry  but I m really desperate  What should I do,1,Today my friend almost shot himself. He is depressed and his parents are judgemental. He tried to join the army to escape them but was guilt tripped into staying. He dropped out of college and has had no luck finding a job. He went to a therapist once but he left and never came back.,today friend shoot depressed parent judgemental try join army escape guilt trip stay drop college no luck find job go therapist leave come
138332,SuicideHow to die easily,1,SuicideHow to die easily,suicide die easily
138333,I kinda wish I was laying on some titties rn   That s it that s the post,0,I kinda wish I was laying on some titties rn   That s it that s the post,kind wish lay titty right post
