,text,class,summary,cleaned
29934,I changed my pfp on FB and a bunch of people reacted  gah I m ugly why this happening I already got enough shit to stress out about wtf is going on I just changed my pfp from  th grade to a current pic   years later  stop seeing it people fuck off,0,I changed my pfp on FB and a bunch of people reacted  gah I m ugly why this happening I already got enough shit to stress out about wtf is going on I just changed my pfp from  th grade to a current pic   years later  stop seeing it people fuck off,change pop feb bunch people react gay ugly happen get shit stress whf go change pop grade current pic year later stop see people fuck
29935,The day my friend brought a GUN to school So  this happened when I was   the guy M  I m talking about was not my friend at the time actually he had no friends  my other classmates used to make fun of him  because he had a slightly below average IQ he was a simpleton or so everyone thought he used to sit behind me so I used to have a few conversations with him in a day   One day I noticed that he was looking weird  like he was watching his classmates weirdly as if he was thinking of doing something also he kept checking his bag from time to time  That day  he had been teased by a few guys so I thought it might be about that  I asked him if there was a problem he took me to a secluded corner of the classroom and told me in fearful tones  I have a gun in my bag I was shocked to say the least  my first thought was that he was lying but I had noticed him being weirdand checking his bag  I told him to prove it and in lunch break he took me outside and lo behold there was a gun in his hand now I asked him calmly even tho I was panicking inside  what was he trying to do with a gun he just said nothing i told him to keep his gun hidden  I could have gone to the teachers but he reminded me of my brother who also was simple minded  I knew if he had wanted to he could have shot us so I kept quiet about this for the whole day   Next day  he came to me and thanked me for not telling the teachers  in return I introduced him to some of my friends and told him to not do anything as foolish from today onwards I know I did the right thing because he was just a simple fool who didn t know the consequences of his actions and if I had complained  it would have ruined his life,0,M's friend brought a gun to school. M didn't tell the teachers because he reminded him of his brother. M introduced the friend to some of his friends and told him not to do anything as foolish from today onwards. M's brother also had a gun.,friend bring gun school not tell teacher remind brother introduce friend friend tell not foolish today onward brother gun
29936,okay but low key drinking milk and eating a donut while playing among us is a mood and then I spilled milk on my phone and the s key takes about   tries to type,0,okay but low key drinking milk and eating a donut while playing among us is a mood and then I spilled milk on my phone and the s key takes about   tries to type,okay low key drinking milk eat donut play mood spill milk phone key take try type
29937,In the style of the sentences below  please connect a brand to something in myth  legend  or religion  God works for Tesco mobile and when you pray to him successfully you hear  hello this is Tesco mobile how may I help you Rolls Royce cars are made by dwarves using children s teeth they got from their contract with the tooth fairy,0,"In the style of the sentences below, connect a brand to something in myth legend or religion. For example, God works for Tesco mobile and when you pray to him successfully, you hear Tesco on the phone. Rolls Royce cars are made by dwarves using children's teeth.",style sentence connect brand myth legend religion example god work test mobile pray successfully hear test phone roll royce car wave child tooth
29938,Is there something i should know before i hang myself Is there any chance i survive  How can i avoid it What are the chances i get some kind of permanent damage,1,Is there something i should know before i hang myself Is there any chance i survive  How can i avoid it What are the chances i get some kind of permanent damage,know hang chance survive avoid chance kind permanent damage
29939,New Reddit buttons and icons  ew,0,New Reddit buttons and icons  ew,new geddit button icon new
29940,Stop telling me I m being selfishGod please stop fucking telling me I m being selfish  That doesn t fucking help   Stop telling me that I should ve been stronger and asked for someone for support because they re the ones who suffer  I don t give a fuck if they suffer  If you didn t support me or make me feel comfortable to come and talk to you  that s on YOU and I don t give a fuck if you suffer  I literally have nobody in my life who emotionally supports me   You don t know how others feel or their situations so stop fucking telling them they re being selfish  You make me want to end it quicker than I already do,1,"Nobody in my life emotionally supports me. I don't want to talk to people anymore because they make me want to end it quicker than I already do. God, don't tell me I'm being selfish, because I have nobody who supports me emotionally. ",life emotionally support not want talk people anymore want end quick god not tell selfish support emotionally
29941,I want to die so badI want to die so bad  but I won t commit suicide My entire life I ve felt pain  my youth was quite shit  I was always scared when I was at my dads house  I thought I might had to kill my dad one day to protect my little brother     I ve always tried to be happy  but I can t pretend anymore When I look at this generation it becomes worse I wish I was born in   so I could have fought for all the stuff I believe in But everything I believe is looked down upon  There is no place in the world where I can be the real me I just want to go,1,I want to die but I won't commit suicide. I wish I was born in a better generation. Everything I believe is looked down upon in this generation. There is no place in the world where I can be the real me and I just want to go.,want die not commit suicide wish bear well generation believe look generation no place world real want
29942,im a bad motherfucker good at fucking dads tho,0,im a bad motherfucker good at fucking dads tho,bad motherfucker good fucking dad
29943,I got the necessary thingsAs I have mentioned  I m killing myself on my birthday  which is rapidly approaching  Only a couple weeks away  I m young  a minor  and do not have access to things like guns or pills or maybe a rope or anything  I finally convinced my mom to get me melatonin because I can t sleep  She got a  nd bottle for downstairs  too  When the day comes  I ll take the  nd bottle from downstairs and eat all of it along with the bottle in my room  too  God  I m so fucking excited  It s days like this where I get sad  and then remember how I will die  finally  My tears of pain and hatred stop instantly when I remember that it doesn t even matter  They ll all be fucking sorry,1,"As I have mentioned, I'm going to kill myself on my birthday which is approaching. My mom bought melatonin and a bottle for downstairs and one for upstairs. I'll eat the downstairs bottle and keep the upstairs bottle in my room. ",mention go kill birthday approach mon buy melatonin bottle downstair upstairs eat downstairs bottle upstairs bottle room
29944,A joke I once had a friend who wanted to be killed by a steam train When it finally happened  he was chuffed to bits,0,A joke I once had a friend who wanted to be killed by a steam train When it finally happened  he was chuffed to bits,joke friend want kill steam train finally happen chuff bit
29945,Can t Move on from thisDon t wanna do into detail but my abusive ex has ruined my life  The only people who both know about my previous marriage and don t think I was an abuser are my family  friends  and therapist and OF COURSE they all dont think I was the abuser and that my ex was  I don t want to go into detail but I got into some local community stuff due to the quarantine and everything was going fine until someone found the stuff my ex said  and now I m alone again  Nobody wants to hear what I have to say  Honestly I have no reason to live anymore  Everyone thinks I m this terrible abusive asshole and there s nothing that can change the what anyone seems to think  I don t have the money for a legal battle to get to internet stuff taken down  No one is going to listen to me anyways  Nobody cares,1,My abusive ex ruined his life and I can't move on from it. I got into some local community stuff due to the quarantine and someone found the stuff his ex said and now I'm alone again. Nobody wants to hear what I have to say and I have no reason to live anymore. ,abusive sex ruin life not get local community stuff quarantine find stuff sex say want hear no reason live anymore
29946,Give me your favorite songs and I ll rate them   Sorry if i can t rate them all today it s late here  and also if it s a below   rating I ll explain why,0,Give me your favorite songs and I ll rate them   Sorry if i can t rate them all today it s late here  and also if it s a below   rating I ll explain why,favourite song ill rate sorry rate today late rating ill explain
29947,Who is Ard and why is he Rich  Haha punny joke also why did my phone autocorrect Ard to sex,0,Who is Ard and why is he Rich  Haha punny joke also why did my phone autocorrect Ard to sex,ard rich hama funny joke phone auto correct ard sex
29948,When it s really fucking hot  https youtu be R BEw pqvAo,0,When it s really fucking hot  https youtu be R BEw pqvAo,fucking hot youtube davao
29949,Reasons to not commit suicide   We d miss you  Your pets would miss you  I m just bullshitting  I really dont care about you guys  I m just karma whoring  And so is anyone else who makes these kinds of posts  Contact a professional if you want help  Stop falling for these posts  Also stop falling for all the  ThIs WoNt GeT aTtEnTiOn BeCaUsE iM nOt A gIrL  because they are also karma whoring,0,"Stop falling for karma whores' reasons to commit suicide. Contact a professional if you want help instead of falling for their posts.   .     ""Th is WoNt GeT aTtEnTiOn BeCaUsE ",stop fall karma whore reason commit suicide contact professional want help instead fall post not attention
