,text,class,summary,cleaned
170216,I know I should try harderBut I really just want to end it all  My anxiety  depression  and derealization have all combined to skullfuck the hell out of my brain  I can t cope with day to day life anymore  Nothing my therapist and psychiatrist are doing is helping me  I can t summon the energy to de stress myself    To give a background  the last year I ve been suffering from derealization and depersonalization brought on by my anxiety  The last few months I ve developed into this suicidal  sluggish  lazy  physically sick shell of the happy girl I used to be  My psychiatrist recently had me committed to a mental hospital when I told him about my plans to kill myself  They let me out after a week and I thought I was better  I  felt  better I came back home only to contract some suckass virus and went back to high school only to be confronted with a shitload of homework and tests to make up  a pile which continues to grow  and it s all way too much for me  All the stress of everything has put my anxiety into overdrive  All I can do is put myself in a fetal position and sob on my mother s shoulder  I can t do this  I want to die  Please talk to me,1,"Anxiety, depression and derealization have combined to cause depression and anxiety in the last year. The last few months she's developed into this suicidal sluggish lazy, physically sick shell of the happy girl she used to be. Her psychiatrist recently had her committed to a mental hospital when she told him about her plans to kill herself. They let her out after a week. She came back home and got sick. She went back to high school and was confronted with a lot of homework and tests. This put her anxiety into overdrive.",anxiety depression de realization combine cause depression anxiety year month develop suicidal sluggish lazy physically sick happy girl psychiatrist recently commit mental hospital tell plan kill let week come home get sick go high school confront lot homework test anxiety overdrive
170217,Im so fucking ready to die and theres literally nothing stopping me No one will mind that I m gone,1,Im so fucking ready to die and theres literally nothing stopping me No one will mind that I m gone,fucking ready die literally stop no mind gone
170218,It s that time of the year,0,It s that time of the year,time year
170219,Frog guy i need ur frog Thats all if you are there please i bloody love frogs Seriously tho things like the poison dart frag are so cute and I just wanna pet a frog but I havent  Any tiem i see an image of a toad I just chuck myself out of a window cos I think  why would someone choose this over a frog,0,"Frog guy wants to know if he can bring a frog to pet her. She doesn't want a poison dart frog, she wants a frog. She would rather have a toad than a frog, because she hates them. ",frog guy want know bring frog pet not want poison dart frog want frog toad frog hate
170220,i just wanted to be lovedi really don t understand relationships  friendships anything  ive yearned for the feeling of someone to just care about me for once  it feels like everything i do is meaningless  i have no one i can rely on  no one to cry to  ive heard people saying that things get better  and that you ll regret it  but i regret not killing myself  i hate existing and experiencing all these emotions  its come to the point where id rather be crying than smiling  i found comfort in the very thing destroying me internally  i want it to end  im so much of a fucking coward  i cant do anything  im so fucking tired of everything  i just want to sleep,1,"""I yearned for the feeling of someone to just care about me for once"" ""I hate existing and experiencing all these emotions. I found comfort in the very thing that was destroying me internally. I want it to end. ",yearn feeling care hate exist experience emotion find comfort thing destroy internally want end
170221,Why is it so hard to die when I ve made peace with it Is it so unreasonable to want some certainty in death  I just want to know that if I try to kill myself  it will work  This is one of the biggest things that I struggle with  I don t want to be found passed out and bleeding in a tub  or have a rope break on me and have to go to the hospital or wake up after getting my stomach pumped   The otherwise of the difficulty is the impact it ll have on the people around me  I ve isolated myself so much that outside of the people I work with  less than a handful of people will know  but there always seems to be something  My brother got married  my mom was depressed  my brother is having a baby  my grandfather died today  my mom s birthday is next week  It s just a neverending litany of impacts my death will have on their lives that I don t want   I feel so stuck  so helpless  and yet I have to keep chugging along each day  relying on substance abuse to make it from one to the next   It s getting closer and closer to the point where I feel like I should just try and hope I get lucky  I m at work with what feels like a black hole in my abdomen threatening to disintegrate my carefully constructed composure and this is the only way I know to make it another few minutes until it s time to leave   I wish someone could save me  or at least care for me,1,"It's hard to know when to commit suicide. I don't want to be found passed out and bleeding in a tub or have a rope break on me and have to go to the hospital. My brother got married, my mom was depressed, my brother is having a baby, my grandfather died today and my mom's birthday is next week. I feel helpless and rely on substance abuse to get by.",hard know commit suicide not want find pass bleed tub rope break hospital brother got marry mon depress brother have baby grandfather die today mod birthday week feel helpless rely substance abuse
170222,Ask a trans girl some questions   It s been a bit since I ve really been active so umm  hi Btw because   of the questions are like this anyways  Trans girl means I was assigned male at birth and now identity as a girl Anyways  ask away,0,Ask a trans girl some questions   It s been a bit since I ve really been active so umm  hi Btw because   of the questions are like this anyways  Trans girl means I was assigned male at birth and now identity as a girl Anyways  ask away,ask tran girl question bit active hmm hi way question like anyways trans girl mean assign male birth identity girl anyways ask away
170223,HiBeing lonely is hard  Knowing you re alone is even harder  People are always there for you  and there s always support  but none of that matters  I just want friends again  I just want to be her friend again  I was so abusive without even knowing it  so caught up in believing my popularity could save me from any situation  I m   and doubtful that I ll make it to   I have plans  and I know things do get brighter and better but I have no internal happiness  Nothing makes me happy  I smile  I laugh  but it doesn t matter  It s so dramatic  Living is hard  dying is easy,1,Loneliness is hard. People are always there for you and there's always support but it doesn't matter when you're alone. I want to be her friend again. I was abusive. I have plans but I have no internal happiness. ,loneliness hard people support not matter want friend abusive plan no internal happiness
170224,Hey  you Yeah you You re awesome You re a good person  Just because you failed doesn t mean you ve failed indefinitely Try and try again and you ll master it I believe in you Now go get that escaped child  and make sure to lock the basement door next time,0,Hey  you Yeah you You re awesome You re a good person  Just because you failed doesn t mean you ve failed indefinitely Try and try again and you ll master it I believe in you Now go get that escaped child  and make sure to lock the basement door next time,hey yeah awesome good person failed mean fail indefinitely try try master believe escape child sure lock basement door time
170225,Hey girl are you winter  Cuz I really like you but your only there for like three months,0,Hey girl are you winter  Cuz I really like you but your only there for like three months,hey girl winter cut like like month
170226,SurvivingHow does anyone make it from one day to the next  And what s the point,1,SurvivingHow does anyone make it from one day to the next  And what s the point,survive day point
170227,Goodnight  filler filler  I m going nighty night,0,Goodnight  filler filler  I m going nighty night,goodnight filler filler go nighty night
170228,Quick vent  If you guys don t want to listen about other people s problems please skip this post So I feel horrible I m constantly stressed and tired and I can t keep going with school I feel constantly irritated and my mental state is getting worse in matter of hours I become so sensitive and fragile that even smallest things make me incredibly angry and sad To the point where a small error or failure makes my day bad I can t handle all this stress tirednes angrines and sadnes I just feel horrible I m starting to miss how good and calm my life was   years ago when I was a happy and social person Boi it s bad,0,Boi is stressed and tired because of school. He misses his old life when he was happy and social. He is starting to miss how good and calm his life was years ago when he used to be a happy person. He feels horrible. ,box stress tired school miss old life happy social start miss good calm life year ago happy person feel horrible
170229,I used to make fun of my friend because he liked pink But now I like pink I ll admit I was a shitty kid  I won t be the same kid as I was   years ago,0,I used to make fun of my friend because he liked pink But now I like pink I ll admit I was a shitty kid  I won t be the same kid as I was   years ago,fun friend like pink like pink ill admit shitty kid will not kid year ago
170230,Running away as an alternative to suicide I ve decided that instead of killing myself im going to wait till I graduate and run away  I m going to pack everything thing I need in a bag  take my car  and head out west  I ll just go wherever the wind takes me  I ll just go until I can t go anymore  I figure this will hurt my family less than suicide  And if it doesn t work out I ll just kill myself  It s not like I hate my family or anything I just figure I ll go out with a bang  One last adventure,1,"As an alternative to suicide, I'm going to wait till I graduate and run away. I'll pack a bag and take my car and head out west. I figure this will hurt my family less than suicide. If it doesn't work out, I'll kill myself. ",alternative suicide go wait till graduate run away pack bag car head west figure hurt family suicide not work kill
170231,Bruh many schools are closing in my country and we still open Every day there is news about a school or   shuttijg down due to having at least   case of covid one school actually is very close to where i live thank fully i am not it but i aslo have a school that i am in it and its clise to the area that the other school had a case like why dont we go to online learning until this fucking thing blow over,0,Many schools are closing in my country and we are still open. One of them is very close to where I live. I have a school that is in the same area as the other one. I think we should go to online learning until the situation blows over.,school close country open close live school area think online learning situation blow
170232,I lost NNN big time Beat my meat like   times in one day recently Yeah I have a depressing pathetic life,0,I lost NNN big time Beat my meat like   times in one day recently Yeah I have a depressing pathetic life,lose big time beat meat like time day recently yeah depressing pathetic life
170233,I feel like what I do is never enough  school  I m talking about school here  I swear I try my absolute fucking best but I still feel like an idiot  My parents expect all A s from me and that can get pretty stressful  I study all fucking day for an exam and I get   That may sound decent but to me it isn t  I know this ain t anything new but I  Hate  Schoooooll  Thx for reading if u did,0,I hate school because I feel like I don't do enough. My parents expect all A's from me. I study all day for an exam and I get an A. I know it's not new but I hate Scholl. ,hate school feel like not parent expect study day exam know not new hate school
