,text,class,summary,cleaned
60831,I have one hour until my college application deadline and I can t get my ACT scores to send and my parents went out and aren t answering their phones so I guess I ll sit here and die,0,I have one hour until my college application deadline and I can t get my ACT scores to send and my parents went out and aren t answering their phones so I guess I ll sit here and die,hour college application deadline act score send parent go agent answer phone guess ill sit die
60832,Social anxiety  depression  self hatred What s the point of going around and torture myself everyday with this shit  I ve been like this as long as I can remember  Everyday is like new visit in the torture chamber  Wouldn t it be better to just end it  Am I masochist or what,1,Social anxiety  depression  self hatred What s the point of going around and torture myself everyday with this shit  I ve been like this as long as I can remember  Everyday is like new visit in the torture chamber  Wouldn t it be better to just end it  Am I masochist or what,social anxiety depression self hatred point go torture everyday shit like long remember everyday like new visit torture chamber well end masochist
60833,When i grow up I want to be just like the wallstreet bets guys  I want to become rich based on the purchase of risky stocks that give no guarantee of giving back money spent on this stuff,0,When i grow up I want to be just like the wallstreet bets guys  I want to become rich based on the purchase of risky stocks that give no guarantee of giving back money spent on this stuff,grow want like wall street bets guy want rich base purchase risky stock no guarantee give money spend stuff
60834,I have a oral physics test in   mins I am so stressed  please help,0,I have a oral physics test in   mins I am so stressed  please help,oral physics test mind stressed help
60835,I tried  lt This year has really kicked my ass  I lost all my friends   I couldn t keep a job no matter how hard I tried and I failed all of my midterms  It feels like I m suffocating everyday and I can t bring myself to do anything anymore  My parents think I m lazy but at this point  but I m just numb  The reality that I m not going to make it to see   is setting in and I m okay with that  Im only disappointed because I tried so hard my entire life to be a good student and a good daughter just for everything to crash and burn  I never even had any fun in highschool  I was just depressed because of how much work I had to do and never had any fun  I just want to be young and dumb for a couple of months before I end it,1,"This year has really kicked my ass. I lost all my friends, I couldn't keep a job and I failed all of my midterms. I tried so hard my entire life to be a good student and a good daughter just for everything to crash and burn. ",year kick ass lose friend not job fail midterm try hard entire life good student good daughter crash burn
60836,Is this other people too  Ok so I ve been bullied so much and insulted so much that I no longer care when I get insulted  Like people will say things like  you re really annoying  or  you re so stupid lmao  or  bruh why are you talking to me  just to my face and I no longer care  I mean I do care about what they say but I ve normalized it  It s gotten to a point where if someone compliments me on ANYTHING i think they are being sarcastic cuz I m so used to being bullied  Idk is this just me,0,"I no longer care when I get insulted because I've been bullied too much.    If someone compliments me on anything, I think they're being sarcastic because I'm used to being bullied. Is this just me or is it other people too?",no long care insult bully compliment think sarcastic bully people
60837,i m ready to diethere s nothing here for me,1,i m ready to diethere s nothing here for me,ready die
60838,Why the hell does school esixst Itz juat sooo f ing annoying  the tests are just memory checkers  everyone there s a d head  the teachers suck  For   hours everyday you waste your life getting nothing done and getting humiliated and annoyed and bullied  It  Just  Sucks  I say we quit  school and focus on anything else,0,It's annoying to go to school. The tests are just memory checkers. The teachers suck. You waste your life getting nothing done and getting humiliated and annoyed and bullied. I say we quit school and focus on something else. ,annoying school test memory checker teacher suck waste life get getting humiliate annoy bully quit school focus
60839,I hate myself  rant  Im a failure and Im useless  all I do is complain and cry  Im also a hypocrite  I have really few friends and no chance to get a girlfriend  And all of this is because of the decisions my past self did  Im my worst enemy but blame it all on luck,0,I hate myself  rant  Im a failure and Im useless  all I do is complain and cry  Im also a hypocrite  I have really few friends and no chance to get a girlfriend  And all of this is because of the decisions my past self did  Im my worst enemy but blame it all on luck,hate rant failure useless complain cry hypocrite friend no chance girlfriend decision past self bad enemy blame luck
60840,Can y all send stuff to make me feel good  Feel like crap and need to have some good feels,0,Can y all send stuff to make me feel good  Feel like crap and need to have some good feels,send stuff feel good feel like crap need good feel
60841,dm me if you want to and I will talk tomorrow  m yeah be sure that you will be awake tomorrow so we can talk and stuff,0,dm me if you want to and I will talk tomorrow  m yeah be sure that you will be awake tomorrow so we can talk and stuff,want talk tomorrow yeah sure awake tomorrow talk stuff
60842,anyone wanna play the number game or just talk about random stuff Idk it s   and I m rlly sleepy but sleeping is boring so anyone wanna idk talk I guess,0,anyone wanna play the number game or just talk about random stuff Idk it s   and I m rlly sleepy but sleeping is boring so anyone wanna idk talk I guess,want play number game talk random stuff not know sleepy sleep bore want not know talk guess
60843,Seeking advice  I ruined my life within a year and I m too coward to move forward TDLR I ve messed up my life but it can be fixed if I suck it up  I just don t seem to have that courage Long Second semester of my first year of college  there were all the preindicators that I wasn t going to graduate  I didn t buy my books  i torrented them  I rarely showed up to class  I isolated myself  Turns out  those reasons made me take a leave That leave made me see how naive I once was  I thought college was stupid  and people with low self esteem went there for validation  Well  wasn t I in for a rude awakening I am one of of those stupid  low self esteem people LOL  I ve spent the whole semester outside of school  in my house on reddit  My mom wants me to get a job but I can t even get out of bed  The dream of being a successful entrepreneur dropout was all in my head The friends I made weren t and that hurts  They were real and when I left  life progressed there they toughed their sophomore year out together  Those times I ll never get back  I ve lost my rank and while that doesn t matter  it kind of does friends were what kept me going when I couldn t go  I m stubborn so it s hard to see clearly rn and I m out of the loop  several don t text me back  i m inactive on facebook and it s bad what s worse  my anxiety has skyrocketed  i feel hopeless  and i realize I had it all just a year ago a wide eyed   year old with a full paid scholarship So why won t i just swallow my pride and return  before i left  i wrote this girl a love letter and showed it to her  she never responded and im afraid of seeing her again  what if she hates me  what if shes afraid of me  what if she doesnt even remember and ive been thinking for nothing im such a coward i might end my life over this semester  i know college isnt the answer  but its the question  Can you endure  I m not sure anymore,1,"A year ago at college, he ruined his life within a year. He didn't buy his books, he torrented them, he rarely showed up to class, he isolated himself, he spent the whole semester in his house on reddit, he wrote a love letter to a girl but she didn't respond, he lost his rank, he's out of touch with his friends, he can't find a job and he's depressed. ",year ago college ruin life year not buy book torment rarely show class isolate spend semester house geddit write love letter girl not respond lose rank touch friend not find job depressed
60844,F feeling behind on life I m going to uni in a few weeks and I ve never done any of the typical teenager things like drinking or partying etc  I went to a girls school so I had minimal contact with boys  although others in my year didnt because of where they lived or clubs they went to  and my friendship group wasn t really like that I d always kind of reassured myself that it was a family thing as to why I d never done it before but today I found out my older sister did more even before my age  which has made me feel even worse  I feel so bad about myself and how I m behind everyone else and I m worried im going to be so awkward at uni and will have to force myself out of my comfort zone to get by it s not that I don t want to go to parties at all but because it would be my first time trying it seems even more pitiful  any advice on how I can stop feeling so insecure about this,0,F is going to uni in a few weeks and she's worried she's going to be awkward at uni because she's never done the typical teenager things like drinking or partying. She went to a girls school so she had minimal contact with boys. Today she found out that her older sister did more before her age.,go uni week worried go awkward uni typical teenager thing like drink party go girl school minimal contact boy today find old sister age
60845,Today is Finally my Birthday   D I finally turn   and I m so happy,0,Today is Finally my Birthday   D I finally turn   and I m so happy,today finally birthday finally turn happy
60846,call me caramel im a sweetheart,0,call me caramel im a sweetheart,caramel sweetheart
60847,because calling the suicide hotline wasn t enough im a fuck up  i thought calling would help even just a little but it made things worse  and now my mom is worried  like  fuck  i dont know what to do anymore  someone please talk to me,1,because calling the suicide hotline wasn t enough im a fuck up  i thought calling would help even just a little but it made things worse  and now my mom is worried  like  fuck  i dont know what to do anymore  someone please talk to me,call suicide hotline want fuck think call help little thing bad mon worried like fuck not know anymore talk
60848,Gamers are homophobic I m so glad I stopped gaming amp x B Fuck gamers they can rot in hell,0,Gamers are homophobic I m so glad I stopped gaming amp x B Fuck gamers they can rot in hell,gamer homophobic glad stop game amp fuck gamer rot hell
60849,Uncontrollable urgeI have huge drive to kill my self right now and I don t know what to do  I ve been planning it out since yesterday and I don t think I can stop my self  The feeling keeps getting stronger and I m afraid I m almost to the point   I don t know what I should do,1,Uncontrollable urgeI have huge drive to kill my self right now and I don t know what to do  I ve been planning it out since yesterday and I don t think I can stop my self  The feeling keeps getting stronger and I m afraid I m almost to the point   I don t know what I should do,uncontrollable urge huge drive kill self right don know plan yesterday don think stop self feeling keep get strong afraid point don know
