,text,class,summary,cleaned
66500,How are you  Be honest  Only if you want to tho,0,How are you  Be honest  Only if you want to tho,honest want
66501,Fuck my life final textWatching people go Places You Can t afford  watch Them buy stuff You Can t afford  do things You Can t afford  over and over Just to feel a artifical need for acceptance  I m tired of my life  i m stuck and Can t do shot  I m ending it soon  Fuck girls that sell themself online   i Can t do shit  fuck SJWS  where is my voice  i m the one sitting at home no one cares About me  i m thinking About Doing a crime  i m tired of whores that lure men and deluted mods on Twitch That silence us who are right  Fuck it i m Doing it,1,"""I'm tired of my life and I'm ending it soon"" is the final text of a blog post written by a man who is fed up with his life and wants to end it soon. He's tired of whores that lure men online and deluted mods on Twitch. ",tired life end soon final text blog post write man feed life want end soon tired whore lure man online delete mod twitch
66502,My mom is being nice So recently my mother has had it in for me or something idk  but she came home yesterday and wanted to hug me and said something sweet  The only problem is bc of the past I m conditioned to just not like my family members  So she loved me but I don t love her,0,My mom is being nice So recently my mother has had it in for me or something idk  but she came home yesterday and wanted to hug me and said something sweet  The only problem is bc of the past I m conditioned to just not like my family members  So she loved me but I don t love her,mon nice recently mother not know come home yesterday want hug say sweet problem past condition not like family member love don love
66503,Most native English speakers are Americans that refuse to learn a second language Wtf Americans  technically I think I would be in the speaks a second language category  I was probably an a  in German at some point but I have Since forgotten everything about grammar and like half the words so I don t really  I m trying learn Swedish though  I was learning Norwegian but I realized it would be completely useless and it s mutually intelligible with Swedish  the us sucks and I want to move ASAP and Sweden seems great  relatively  I have family in Switzerland and Germany and I want to be as far away from my aunt as possible  being close to the other   would be nice but it s not worth being close to my aunt  so my only options are Northern Europe  Canada or Australia  sorry the rest of Europe your either not freedom enough  there s a slim chance I could run into my aunt or your the uk or Ireland  so either way I m going to be either in Australia or cold,0,Most native English speakers are Americans that refuse to learn a second language. I want to move to Sweden as soon as possible. I have family in Switzerland and Germany. I don't want to be close to my aunt. I'm considering Canada or Australia. ,native english speaker americans refuse learn second language want sweden soon possible family switzerland germany not want close aunt consider canada australia
66504,Is life even real  Well  evidence points to that life is a simulation made of code and so        please don t take this seriously,0,Is life even real  Well  evidence points to that life is a simulation made of code and so        please don t take this seriously,life real evidence point life simulation code don seriously
66505,leave a comment n ill tell u something i like about u easy peasy lemon squeezy,0,leave a comment n ill tell u something i like about u easy peasy lemon squeezy,leave comment ill tell like easy easy lemon squeeze
66506,So I got to the reddit to post some suicide jokes,1,So I got to the reddit to post some suicide jokes,get geddit post suicide joke
66507,Where can i find girls that arent high maintenance and want to have sex all the time Because it be hard for a nigga ti find that nowadays,0,Where can i find girls that arent high maintenance and want to have sex all the time Because it be hard for a nigga ti find that nowadays,find girl not high maintenance want sex time hard nigga find nowadays
66508,Working on my planHi all  My previous attempt was failed  Now I m trying to make sure I do it this time The only way I can feel ok is when I m high I m tired of living high  I m tired of living  I m hopeless,1,Working on my planHi all  My previous attempt was failed  Now I m trying to make sure I do it this time The only way I can feel ok is when I m high I m tired of living high  I m tired of living  I m hopeless,work plan previous attempt fail try sure time way feel high tired live high tired live hopeless
66509,I m going either tonight or tomorrow nightNothing much to say  the title says it all  Bye,1,I m going either tonight or tomorrow nightNothing much to say  the title says it all  Bye,go tonight tomorrow night title say bye
66510,Is anything going to happen  Someone has made multiple Instagram accounts telling one person  or rather a few people  to kill themselves to die  These accounts are anonymous  even though there are a few suspects  Will anything happen legally,0,Is anything going to happen  Someone has made multiple Instagram accounts telling one person  or rather a few people  to kill themselves to die  These accounts are anonymous  even though there are a few suspects  Will anything happen legally,go happen multiple inst gram account tell person people kill die account anonymous suspect happen legally
66511,I just finished my suicide note I don t know what to do anymore  I m on meds  I see a therapist  I m doing the  right  things and I feel like I m alone I ve tried reaching out to friends  They don t seem to care  They never reply to my messages or texts  despite being online and on Facebook all the time and they never see how I m doing My own boyfriend  who is deployed  doesn t even seem to care some days  Part of me thinks he s tired of my depression and it just hurts how he s not engaged the moment I bring up being sad I m not sure how much longer I can last  but it isn t long   I finished my note today  I don t have concrete plans  I just know I don t want to be here,1,"Suicide note has been written by a depressed woman. She is on medication and seeing a therapist. Her boyfriend is deployed and doesn't seem to care about her depression. She doesn't know how long she can last, but she doesn't want to be here any more.",suicide note write depressed woman medication see therapist boyfriend deploy not care depression not know long not want
66512,I don t know how to deal with this I m not sure how to go about talking about something like this  but here we go   Every while or so  I get in a certain mood that gives me thoughts  Those thoughts come up in many different ways   Sometimes it involves me dying by the hands of someone who s an evil character  Like a robber  or a thug  or a serial killer  More often it s me killing myself  I see myself eating pills  or jumping from a very high ledge and then i m just gone  These thoughts used to get me highly upset  but over time it s just not as effective anymore   I sometimes will break down and cry my eyes out  Sometimes for no reason  sometimes because ill feel like nothing  Im always hearing how upset my mother is in regards of my actions  and that definitely makes it worse  It s not like I can talk to her about it because she ll just tell all the details of our conversation to her friends and our family and I don t like that kind of reputation  With her I feel unattractive  I feel like a pig and its all because of how she talks about me to her friends  I feel like a brat for even thinking like this  I know its my fault  I know im the reason to be talked about in that fashion  and honestly I ve given up trying to prevent it   I know that no matter what I do I ll always upset someone  Im Bad at conversation  I can never give the Right advice  And I m always trying to fit in with THR crowd  Even typing this J didn t wanna seem like I m craving attention   I keep telling myself I m Young and it ll get better  but keeping everything in seems to make this worse   Can someone tell me what to do,1,Every time I get in a bad mood I think about killing myself. I can't talk to my mother about it because she would tell all the details of their conversation to her friends and her family. I feel like a brat for even thinking like this. ,time bad mood think kill not talk mother tell detail conversation friend family feel like brat think like
66513,just me talking about squishy feelings stuff so i was just studying  and listening to music  when kimi no sei  the opening for rascal does not dream of bunny girl senpai  played  its radically different from the punk rock that is   of my playlist so it stood out  and then i was just hit by this wave of feeling  like the song is just a cute j pop song that serves as a perfect opening to a show like bunny girl senpai  but its not really just that  maybe something changes in translation but in english the chorus is  its your fault  your fault  your fault  that im so weak and pathetic  that line is just so good  and whenever i hear the song i feel like im in on a joke because the lyrics are actually really self deprecating when the song is so happy  and then i really wanted to tell someone about this  and i ran down the list of my friends  and the only person who i can talk to about feelings and stuff is my crush best friend  i have posted about my  relationship  with her several times if you care that much  but i cant really tell her about this because my feelings for her are so mixed up in my feelings about this song and the show its from  and the re zero episode  from zero  but thats unrelated  i feel like the person in this song could so easily be me  but im just strong enough to not become weak and pathetic just because a girl doesnt like me  and this show helped me dislodge my cranium from my rectum and start to at least like myself a little bit  if you only have one takaway from this it should be go watch bunny girl senpai please for the love of god anyway it just got me really hard that i didnt really have anyone i could talk to about this and i felt the need to say it somewhere  i know this post probably isnt very readable  and doesnt really have a point  and im sorry for that  and thank you to this community for letting me vent like this  i seriosly love you guys,0,Kimi no sei by Rascal does not dream of bunny girl senpai is the opening for Rascal's new album. It's a cute j pop song with self-deprecating lyrics. The only person who can talk to him about his feelings is his crush best friend.,kim no rascal not dream bunny girl sendai opening rascal new album cute pop song self deprecating lyric person talk feeling crush good friend
66514,Posting a picture gif of something getting crushed each day until my cousin asks his crush out  Day    Crushed Stressball https imgur com a VO cPz,0,Posting a picture gif of something getting crushed each day until my cousin asks his crush out  Day    Crushed Stressball https imgur com a VO cPz,post picture getting crush day cousin ask crush day crush stress incur com cp
66515,A piece of advice for fellow teens here Self harm is not cool  I had some friends who thought that having scars in wrists would  make them look cooler  They had to face a lot of problems  Later they regret doing it and now they hide thier scars,0,A piece of advice for fellow teens here Self harm is not cool  I had some friends who thought that having scars in wrists would  make them look cooler  They had to face a lot of problems  Later they regret doing it and now they hide thier scars,piece advice fellow teen self harm not cool friend think have scar wrist look cool face lot problem later regret hide scar
66516,Why is there a video called  dicks are so cute  but not a  vaginas are so cute  I feel discrimination against me  An  heterosexual white male that identifies hims as a female,0,Why is there a video called  dicks are so cute  but not a  vaginas are so cute  I feel discrimination against me  An  heterosexual white male that identifies hims as a female,video call dick cute not vaginas cute feel discrimination heterosexual white male identify him female
66517,Fucked up dreams fuck me upI have SUPER vivid  repetitive and fucked up dreams  This causes me to feel dissociated questioning if the dream world is even actual less  real  than our  real world  because my memories from there seem just as real to me if not moreso  This really bothers me though  especially accidentally lucid dreaming was very scary for me  so I ve basically become an insomniac because I m so afraid of having dreams that make me feel even more confused and dissociated  And it seems that the only way I do not remember and dreams is to smoke a lott of weed  Does anyone something that might resemble and explanation or good advice  Thank you,1,Fucked up dreams make me feel confused and dissociated. The only way I remember them is to smoke a lot of weed. I've become an insomniac because I'm afraid of having lucid dreams that make me even more confused.,fuck dream feel confused dissociate way remember smoke lot weed insomniac afraid have lucid dream confused
66518,nothing is workingI want everything to stop  I can t take it anymore  please just let me go,1,nothing is workingI want everything to stop  I can t take it anymore  please just let me go,work want stop anymore let
66519,People always say think about your friends and family before doing anythingBut common they are not one suffering I am the one whose suffering,1,People always say think about your friends and family before doing anythingBut common they are not one suffering I am the one whose suffering,people think friend family common not suffer suffer
66520,Streaming atm Streaming rocket league at https twitch tv crash grey  come and join,0,Streaming atm Streaming rocket league at https twitch tv crash grey  come and join,stream atm stream rocket league twitch crash grey come join
66521,Lies  ALL LIES  THIS IS THE DAY OF LIES,0,Lies  ALL LIES  THIS IS THE DAY OF LIES,lie lie day lie
66522,Self hate and RejectionI asked my mother for a scarf  and she berated me for having short hair in the first place  My parents both think I can just stop pulling out my hair by myself  I m only doing this for attention  For the past   years  Yeah  okay   Because I want to look like this  Because I want to be someone with no self confidence  And when I do have the gumption to tell a guy how I feel  because no one would ever come up to me  I get rejected  Or when I try to break out of my shell  it gets thrown in my face I m really fucking tired of being here  I just want to pay off my loans and be done with this   Why should I care  When I m dead I m dead  I won t have to worry about my family s financial crisis then  I ll be dead  No need to consider the impact it ll have on others   I ll be dead I m such a bitter waste of space,1,I asked my mother for a scarf. She berated me for having short hair in the first place. I want to be someone with no self confidence. I just want to pay off my loans and be done with this. ,ask mother scarf berate have short hair place want no self confidence want pay loan
66523,In a   interview Director George Miller was asked if he had any plans for Happy Feet   He responded by saying  this is the actual quote btw   If you put a gun to my head and said  you have to come up with a story for Happy Feet   I d say shoot me,0,In a   interview Director George Miller was asked if he had any plans for Happy Feet   He responded by saying  this is the actual quote btw   If you put a gun to my head and said  you have to come up with a story for Happy Feet   I d say shoot me,interview director george miller ask plan happy foot respond say actual quote way gun head say come story happy foot d shoot
66524,oi I m a true nerf war veteran   I m the real og   don t even call yourself a pro if you didn t use poop as battle camo and cum as substitute bullets,0,oi I m a true nerf war veteran   I m the real og   don t even call yourself a pro if you didn t use poop as battle camo and cum as substitute bullets,true nerf war veteran real don pro use poop battle come cum substitute bullet
66525,We did it boys I m no longer a single man I found someone more idiotic than myself and they asked me out It turns out I am capable of love,0,We did it boys I m no longer a single man I found someone more idiotic than myself and they asked me out It turns out I am capable of love,boy no long single man find idiotic ask turn capable love
66526,Title is  like life  pointlessTwo days ago it was my  rd birthday   happy birthday  man   Thanks for the wishes  those  really  elevate my mood so  what did you do on such occasion   Oh  I had plans  but I didn t follow them up   how come  What happened  I couldn t get up of bed lol   i can definitely relate to that  Who doesnt  We are not normies  are we  p  what s a normie  You know a fucker that doesn t plan on overdosing on his birthday for example   I see you re typing this  so things worked out well in the end  I guess so   fourtermore there is a positive side to what happened to you  There always is    Oh gosh  please  enlighten  me see  if you consider the delta between your lowest moments and the highest  you re find out that you ll experience a bigger spectrum of emotion than a normal person    You assumed the bad experiences just add up to the positive ones  I could argue that they cancel each other   why the fuck do you always have to be such a pessimist  I see reality for what it is  I d love to be delusional and have a reason to wake up eveyday   so whats the result of our conversation  Are we agreeing to disagree    Our conversation  like both our existences   is pointless as fuck  almost as life itself  But I guess It served for me to stop thinking about thinking of darker thoughts for a little  So there s that,1,"It was my birthday two days ago. I didn't follow up on the wishes I got from people, because I couldn't get out of bed. I had a conversation with a friend, and we agreed that life is pointless. ",birthday day ago not follow wish get people not bed conversation friend agree life pointless
66527,I am a monster and I should probably get this over and done with I m   Everyone hates me  I m beginning to lose my friends because they re slowly beginning to realise that I used to be a cutter  My parents hate me and I give them nothing but grief and my dad said he s waiting until the day I die  I know he was angry and didn t mean it but that s so true   My sister thinks I ll kill my grandma or her even though I have no intention of doing so but I m angry and she thinks I ll snap  She s scared of me and she d be more mentally stable if I just ended it  The only reason I m alive now is because I thought she d be fucked up if I died  but I ve already fucked her up enough I know that I m never going to be happy again  and I ve completed everything I want to complete in my life and I m ready to go  I know the world will be better off without me  and nobody s gonna love me because I m a fat  pathetic  ugly  useless bitch who can t do anything right and I think it s just the right time for me to leave before I make things worse,1,Everyone hates me. I used to be a cutter. My parents hate me. My sister thinks I'll kill my grandma or her even though I have no intention of doing so. I know the world will be better off without me and nobody will love me. ,hate cutter parent hate sister think kill grandma no intention know world well love
66528,Alcohol saved me tonightThis has been one of my worst lows I ve ever gone through  I wrote out letters and just wanted to numb the feeling before then  I drank a lot of alcohol  but it made me sleepy and I m about to pass out as I type this   Depression is a bitch  It doesn t discriminate and will affect any and everyone  I have a decent life from the outside  but I am drowning inside  If you re reading this and contemplating tonight  please stay another night with me  Go to sleep and fight another day,1,"Alcohol saved me tonight. Depression is a bitch. It doesn't discriminate and will affect any and everyone. I have a decent life from the outside but I am drowning inside. If you're reading this and contemplating tonight, please stay another night with me.",alcohol save tonight depression bitch not discriminate affect decent life outside drown inside read contemplate tonight stay night
66529,ATTENTION EVERYONE   Thank you for your attention,0,ATTENTION EVERYONE   Thank you for your attention,attention thank attention
66530,Hi hey Hi,0,Hi hey Hi,hi hey hi
66531,Please Take Away My Dreams and Hopes It hurts too much to have Dreams that I cannot ever achieve  It s only a few years past the idealism of youth  I realized I ve never had a chance in the first place  Limitations in ability  opportunity  family  resources  poverty  and now lack of energy means I might never even finish my art  I don t want to shame  disappointment  and anguish  I was fed false dreams  and I deluded myself thinking I had a chance  I was never a contender  The fight was rigged from before even the start  Our hopes and dreams are just impossibly dangled in front of us so that we work the mouse wheels that power the engine of capitalism  It s so cruel of them to let us smell the cheese without so much as a nibble   If I could be an unthinking unconscious philosophical zombie and not be aware of my circumstances it would be okay  If  I die that would be okay too  I cannot fight anymore  Lay me to rest  Let me lie and die dreaming,1,It hurts too much to have dreams that I can't achieve. I was fed false dreams and deluded myself thinking I had a chance. The fight was rigged from before even the start. If I could be an unthinking unconscious philosophical zombie and not be aware of my circumstances it would be okay.,hurt dream not achieve feed false dream delude think chance fight rig start unthinke unconscious philosophical zombie not aware circumstance okay
66532,i have literally nobodygod i m so fucking alone  there s literally not a single person i can talk to i just want to be hugged and held by someone i don t know if all the pills in my drawer will be enough but i ll just hope for the best,1,i have literally nobodygod i m so fucking alone  there s literally not a single person i can talk to i just want to be hugged and held by someone i don t know if all the pills in my drawer will be enough but i ll just hope for the best,literally god fucking literally not single person talk want hug hold don know pill drawer ill hope good
66533,Failing my HSC year  I ve got no hope and I really don t want to live if I don t go to universityI m so sick of this year  I ve failed so many tests despite studying all the time and I know that my final marks for this year aren t going to be good enough to go to university  I just sat an exam today and didn t understand anything  My parents have stopped pushing me to do better and are just disappointed in me  I ve got no friends and or SOs to talk about these issues with  I don t know what I ll do if I don t get into university and am entirely planning on killing myself when I get my results back,1,This year I've failed many tests and I know that I won't get into university. I just sat an exam today and didn't understand anything. My parents have stopped pushing me to do better and are disappointed in me. I don't know what I'll do when I get my results.,year fail test know not university sit exam today not understand parent stop push well disappoint not know result
66534,NotesPlanning in a couple of months  should I leave one note or a bunch of notes each for one person,1,NotesPlanning in a couple of months  should I leave one note or a bunch of notes each for one person,note plan couple month leave note bunch note person
66535,This got removed before because i used the serious flair  Maybe I ll be tracer Maybe I ll be tracer I m already tracer  What about widowmaker  I m already widowmaker  I ll be bastion  Fuck bastion You re right so Winston I wanna be Winston  I guess I ll be genji  I m already genji  Then I ll be mccree  Ok,0,"This got removed before because of the serious flair. Winston wants to be Winston, genji, McCree or Widowmaker. He is already a tracer, so he will be either one or both of those things.  ",got remove flair winston want winston genii decree widow maker tracer thing
66536,How much is one reddit year Like is it   months and   days Or   days or   days,0,How much is one reddit year Like is it   months and   days Or   days or   days,geddit year like month day day day
66537,Life needs an abort mission button XDI was gonna make some long dumbass speech but none of it matters  It s all a big fucking joke  This life is a joke,1,Life needs an abort mission button XDI was gonna make some long dumbass speech but none of it matters  It s all a big fucking joke  This life is a joke,life need abort mission button xii go long dumb ass speech matter big fucking joke life joke
66538,what parts of europe still like star wars,0,what parts of europe still like star wars,part europe like star war
