,text,class,summary,cleaned
49650,The Chinese government rn    This mf u worstestgrammar just bought them a whole fucking platoon of tanks  probably spent enough that they can buy at least   or   new concentration camps,0,The Chinese government rn    This mf u worstestgrammar just bought them a whole fucking platoon of tanks  probably spent enough that they can buy at least   or   new concentration camps,chinese government right worsted grammar buy fucking platoon tank probably spend buy new concentration camp
49651,Merry Christmas from Australia  Hope you have a good one and hopefully next year isn t has horrible,0,Merry Christmas from Australia  Hope you have a good one and hopefully next year isn t has horrible,merry christmas australia hope good hopefully year horrible
49652,IM FINALLY OVER MY EX WOOOOOO She broke up with me three months ago and up until this weekend  it was destroying me  After the breakup  everything in my life went downhill Then I started texting this girl and it was awesome  it was fun as hell  and for the first time  somebody made me feel the way my ex did when I first started texting her  She asked for a song recommendation  so I gave her my favorite  which my ex recommended to me  Age of Consent by New Order  and while texting her I listened to it and couldn t stop smiling  It was the first time I could listen to it in the last three months without crying This made me realize that if someone else could make me feel this way then it doesn t have to be my ex The girl has since stopped texting me for whatever reason  which is a bit sad  but there ll be someone else out there  I just know it I lost all remaining hold I had on her right there laying in my bed listening to that song and it was such an amazing feeling,0,My ex-girlfriend broke up with me three months ago. I started texting a new girl. She asked for a song recommendation and I gave her New Order's Age of Consent by New Order. It was the first time I could listen to it in the last three months without crying. ,sex girlfriend break month ago start texte new girl ask song recommendation give new order age consent new order time listen month cry
49653,Me and my Friend made a dumb Insta group chat anybody wanan join  Its just smth dumb to do cuz we bored af  eh we just gonna use it to mess around say good morning and just send memes and shit  no girl allowed tho  PM me for the,0,Me and my Friend made a dumb Insta group chat anybody wanan join  Its just smth dumb to do cuz we bored af  eh we just gonna use it to mess around say good morning and just send memes and shit  no girl allowed tho  PM me for the,friend dumb inst group chat anybody wanna join smith dumb cut bore go use mess good morning send meme shit no girl allow pm
49654,Tonights the nightI m though putting up with the bulls hit  at midnight tonight  I m killing myself  Fuck all of you  Fuck the world  and Fuck women in particular,1,Tonights the nightI m though putting up with the bulls hit  at midnight tonight  I m killing myself  Fuck all of you  Fuck the world  and Fuck women in particular,tonight night put bull hit midnight tonight kill fuck fuck world fuck woman particular
49655,No matter what you re like now  if you got bullied in middle school for watching anime you re not a poser  It s facts  And honestly I see more girls as posers than anyone  A lot of them are like  i m such a weeb  and they ve only watch   episodes of naruto,0,No matter what you re like now  if you got bullied in middle school for watching anime you re not a poser  It s facts  And honestly I see more girls as posers than anyone  A lot of them are like  i m such a weeb  and they ve only watch   episodes of naruto,no matter like got bully middle school watch anime not poser fact honestly girl poser lot like web watch episode auto
49656,Prithee be careful I don t want to see m work squandered,0,Prithee be careful I don t want to see m work squandered,prithee careful don want work squander
49657,Painful to exist I can t really describe how I feel sometimes   I have been feeling very dark moods lately   All the abuse as a child by my father just seems to haunt me   I overweight   I haven t had a girlfriend in   yeasa and have been to psych word at least a dozen times at   different locations   I have a disfunctional fily that I can t say I feel love from anymore for the last few years   I feel paranoid almost all the time and I think about a suicide daily and almost hourly lately   Depression is strong on my mother s side and her sister took her own life   years ago   I really just want a real connection in my life   Someone to talk to and share my love for   Feelings of self doubt cloud my already racing mind   I try to go on stupid sites like chat roulette to try to find someone to talk to bit get mostly nothing   If I could be like my young self I would take it in a heart beat   I used to be carefree but as I got out of highschool my life went way downhill   I tried to go to school but was often depressed and had terrible anxiety  I just wish my life was better  I know I m not bad off as I am on disability but I feel no self worth anymore and I ve never been able to get a job   I just want to find someone to talk me out of this downward spiral of a life,1,"As a child, I was abused by my father. I haven't had a girlfriend in yeasa and I've been to psych wards at least a dozen times. I used to be carefree, but after high school I got depressed and anxious. I'm on disability and I can't get a job. ",child abuse father not girlfriend yeast psych ward dozen time carefree high school get depressed anxious disability not job
49658,my text that i wrote did not save and my laptop just turned back on  pain IDK WHAT I WROTE,0,my text that i wrote did not save and my laptop just turned back on  pain IDK WHAT I WROTE,text write not save laptop turn pain not know write
49659,How hard is it to be realistic People are always on me about being negative  or something like that  but I m just looking at things in the way that seems most likely to me  Looking at depression posts  I can see how they  generally  think  and how illogical it is too  Just be realistic bro  No  not everyone likes you  but I highly doubt everyone you know is only there to use you,0,"It's hard to be realistic. Not everyone likes you, but no one is out to use you.   He's just looking at things in the way that seems most likely to him and he can see how people generally think. ",hard realistic not like no use look thing way likely people generally think
49660,Shy boys  gt gt gt gt gt gt gt gt gt gt gt gt gt  confident boys,0,Shy boys  gt gt gt gt gt gt gt gt gt gt gt gt gt  confident boys,shy boy confident boy
49661,I cant take it anymoreI lost all hope  Im literally a worthless shit  and my family knows it and tells me how shit and useless I am everyday  I fail at everything  and my family doesnt want me sometimes  I literally cant take this shit anymore  I would pull the trigger right fucking now if I had a gun  or cyanide  or rope  I dont care  I just want to end it for my own and my family s good,1,I lost all hope. I fail at everything and my family doesn't want me. I would kill myself if I had a gun or cyanide or rope. I just want to end it for my own and family's good. ,lose hope fail family not want kill gun cyanide rope want end family good
49662,I wish I had the courage to go through with itIt s too hard to keep going but I don t have it in me to stop  I feel so trapped,1,I wish I had the courage to go through with itIt s too hard to keep going but I don t have it in me to stop  I feel so trapped,wish courage tit hard go don stop feel trapped
49663,what should i name leopard gecko  help i m getting it in like a week or two meme like names are acceptable if you need inspiration for names i m currently pretty obsessed with mcyt but i doubt that s helpful unless ur really creative lmao,0,what should i name leopard gecko  help i m getting it in like a week or two meme like names are acceptable if you need inspiration for names i m currently pretty obsessed with mcyt but i doubt that s helpful unless ur really creative lmao,leopard gecko help get like week meme like name acceptable need inspiration name currently pretty obsessed doubt helpful creative lao
49664,I can t do anything because my brothers are depressedI moved across the country and I want to die  I m so lonely  I ended a four year relationship and I don t have many friends here  I ve started cutting myself even though I feel like I m too old to do that  I think about jumping off the bridge or into traffic almost every day but then I ll feel fine the next  bipolar   no one checks in on me  my family never asks how I am and friends don t either  most of my friends from my hometown haven t bothered even texting me since I moved  My brothers have both struggled with depression in the past  my little brother is having a lot of trouble right now many states away from me  I check in on him and call  I can t do anything while he s having so much trouble it would be a bad example to set   But it hurts that no one checks in on me or takes me being suicidal seriously  Even therapists  I don t know what to do  I never pictured being this old  I was abused as a kid and feel like I just wasn t mentally snapped in and present until college and sometimes I snap out again,1,I moved across the country and I want to die. I ended a four year relationship and I don't have many friends here. I was abused as a kid and I wasn't mentally present until college. My little brother is having a lot of trouble and I check in on him and call him.,move country want die end year relationship not friend abuse kid not mentally present college little brother have lot trouble check
49665,I just cut myself for the first time in over a year  I want to keep going  but I feel disgusted This just happened  I m panicking  and don t quite know who to go to or what to do rn  I wanna keep cutting but I know I shouldn t so I guess I m writing this instead  I am in therapy and I have a good S O that s very loving and supportive but I don t wanna tell them  He would be so disappointed in me  but I don t know how to hide it from him or if I should  I cut on my thighs  I feel so disgusting and ashamed  but I want to keep doing it  I forgot how much of a relief I got from hurting myself  it s honestly comforting but that makes me feel so messed up  Why do I find comfort in threatening my life  I don t even wanna die but I do wanna kill myself  But fuck  that doesn t even make sense  I wanna be alive and see where my future will head but I have the most overwhelming feeling to end my life  I ve been doing really well the past year without any kind of self harm  and I m so mad at myself for breaking that promise I made to myself and my boyfriend  I just feel like I m spiraling and I don t know what to do  I don t want to tell my S O I harmed myself and I don t wanna tell my therapist either  I m afraid to be admitted  I just don t know,1,I just cut myself for the first time in over a year. I want to keep cutting but I know I shouldn't. I am in therapy and I have a good S O that is loving and supportive. I don't want to tell him or the therapist that I harmed myself. ,cut time year want cut know not therapy good love supportive not want tell therapist harm
49666,I need helpI want to see a psychiatrist for my thoughts on suicide  but I don t know how  I am   years old  I am afraid to tell my parents because I fear that  They won t take me seriously  It will be embarrassing  I don t want to worry stress them So what do I do  I m always told suicide is wrong  but nobody has proved it to me yet  I feel if I don t see a professional  I never will be convinced and I will proceed with suicide  Right now it sounds pretty nice No more problems  Just nothingness  I simply won t exist  so nothing would matter  Sounds pleasant One side of me tells me suicide is wrong  the other side tells me it s peaceful,1,I want to see a psychiatrist for my thoughts on suicide. I am afraid to tell my parents because I fear they won't take me seriously. I'm always told suicide is wrong but nobody has proved it to me yet. I feel if I don't see a professional I'll be convinced and proceed with suicide. ,want psychiatrist thought suicide afraid tell parent fear not seriously tell suicide wrong prove feel not professional convince proceed suicide
49667,Life going nowhere so might as well quitI am a   year old college student whose family is in financial hell and is several thousand dollars in debt I am majoring in history which will not put me in a good position when i graduate  I wont be able to get a job good enough to support myself  Probably looking at the last   years of my life at burger king if i don t end up dead I have severe depression and anxiety  and i cannot afford a doctor s visit to get medication   And the last time I did  my physician gave me an arbitrary medication that did nothing to help me   I literally see no way out of this   I m poor  my family is poor  so I m going to live my entire life poor and die poor and I literally cannot afford to be alive anymore  On top of that I do not want to burden my family more and cause them further expenses when I could just be dead and out of their lives The only thing I have going for me are my friends and my boyfriend  But they are nowhere close to understanding my issues and I feel like I cant talk to them about it because they have never had to deal with shit like this   For a life as worthless and doomed as mine  is suicide really such a disagreeable option,1,A college student whose family is several thousand dollars in debt is considering suicide. He has severe depression and anxiety and he can't afford medication. He doesn't want to burden his family more and cause them further expenses. His friends and his boyfriend don't understand his problems.,college student family dollar debt consider suicide severe depression anxiety not afford medication not want burden family expense friend boyfriend not understand problem
49668,I m afraidI am afraid of the fact that we will all inevitably die one day  I often stay awake at night because of my thoughts on this I want to die  but I m afraid of death I want everything to just go away  yet I don t want it to I want to be able to feel nothing anymore  but I don t want to leave my girlfriend behind The thought of killing myself has become more frequent and more possible in my mind  But I m still afraid of death I want to die now  to get it over with  I also want to die now because I can t be happy anymore  There s nothing now that can make me as Happy as I was before Honestly I just want it all to end I m sorry if this was confusing Just needed to let it out,1,I am afraid of the fact that we will all inevitably die one day. The thought of killing myself has become more frequent and more possible in my mind. I want to die now to get it over with and also because I can't be happy anymore.,afraid fact inevitably die day thought kill frequent possible mind want die not happy anymore
49669,Being ugly and a virgin is the worst thing ever F I know boys shouldn t be a priority in my life but i can t help but cry over the fact i will be a virgin for the rest of my life  Never held a guys hand  hugged  kissed I ve never even made contact with a guy before the only time was a accidental shoulder brush  I sound so lame and disgusting but i just feel so depressed  It s not like I m purely looking for sex   i just want to simply hold someone s hand and feel loved and cared about  So many people have already  had sex and kissed and i haven t done anything remotely close to that  No guy has even glanced at me or talked to me  I m not  attractive and I know that s the reason behind all of this  I have ash brown hair  blue eyes  pale skin    and quite petite  which isn t attractive in this generation especially America  So many things about me make me very unattractive  I m very shy and i don t know how to talk to people  which has made me quite friendless and made me appear weird to everyone  I m not looking for the  Your so young just wait until you re older  I just wanted to write this to let it out,1,"Being ugly and a virgin is the worst thing ever. I know boys shouldn't be a priority in my life but I can't help but cry over the fact I will be a virgin for the rest of my life. I have never held a guys hand, hugged kissed or even made contact with a guy before. I'm shy and I don't know how to talk to people.",ugly virgin bad thing know boy not priority life not help cry fact virgin rest life hold guy hand hug kiss contact guy shy not know talk people
49670,Whoever is on the school board shall burn   hells for this So me and the bois get our new school laptops right  We soon figure out that we can download free VPN and other unblocking tools on Firefox  So after loading our government properly with a definitely not malware we try to see what we can access  The results are astounding  youtube  netflix  xbox  steam  minecraft   pornhub  all unblocked  everything  Except one  coolmath games  tried it many times  didn t work  coolmath has been blocked for   years in my district  and we thought we had just liberated it  But no  Of all the websites of the entire internet   coolmath games  was locked down tighter than my crush s pussy  Just why  What has the world come to when I can LITERALLY BUY SOMEONE OFF THE BLACK MARKET BEFORE I CAN PLAY FUCKING RUN   If I ever find out who did this I ll make the Berkeley bike lock dude look like fuckin Gandhi,0,The coolmath games website has been blocked for years in my district. Whoever is on the school board is going to be punished for blocking the website. The website was bought off the black market and blocked by someone who wanted to play games.,cool game website block year district school board go punish block website website buy black market block want play game
49671,It s late in a shitplace where i live  but we have a great humour for our generation Even if we re depressed a lot and a lot us just want to die  we provide the most humour than maybe ever in our time  Every day we create thousends if not millions of memes  we laugh from everything  literally everything like from racism  gay people  history and even depression  We even laugh at simple images with little to meaning  Just the idea that one young person can create a clever joke that thousands of people can see is awesome in my mind  Just look at youtube  look how funny a lot of this shit is We re maybe the dumbest and most depressed generatian  but for me for sure the funniest,0,There is a lot of humour in the generation of young people. They create millions of memes every day. They laugh at everything from racism to gay people history to depression. They are the dumbest and most depressed generation but also the funniest.,lot humour generation young people create million meme day laugh racism gay people history depression dumb depressed generation funniest
49672,Holy fuck how do you even live for so longHow do people find the will to live until their  s or something  I m   and this shits already become unbearable,1,Holy fuck how do you even live for so longHow do people find the will to live until their  s or something  I m   and this shits already become unbearable,holy fuck live longbow people find live shit unbearable
49673,considering killing myself this nightLife sucks anyway  I ll never be able to make it out of boring and mundane modern life,1,considering killing myself this nightLife sucks anyway  I ll never be able to make it out of boring and mundane modern life,consider kill nightlife suck ill able boring mundane modern life
49674,The water looked really invitingSo I have been struggling with my inner demons for quite a while now and do fantasise about suicide but never do anything towards it  However a couple of weeks ago when out drinking at a large party I slipped away  it is hard for me to keep up the appearance of being happy for too long  and went on a walk I went to the river  as it was night the water looked black and murky but yet so inviting to me  I stared at it for what must have be an hour fantasising about leaping in and breathing in the water  filling my lungs with the blackness   But I didn t do it  I didn t want anyone to think this was just some drunken accident  that I was a fool  But for the time I was thinking about drowning myself  it one of the only moments of peace I have felt this past year  All my problems and worries would vanish  I would fear no monsters  I would be gone When I returned to the party only one person even noticed I was missing  only God knows how long it would have been before someone found me I know I will never do it but I still don t know how to feel about this event  An event no one else knew anything about  nobody knows I am not happy,1,A couple of weeks ago when out drinking at a large party I slipped away and went for a walk to the river. For an hour I fantasized about jumping into the river and drowning myself. When I returned to the party only one person noticed I was missing.,couple week ago drink large party slip away go walk river hour fantasize jump river drown return party person notice miss
49675,Rip my hero Alex died I ve never been so sad over the death of someone whos not my grandma,0,Rip my hero Alex died I ve never been so sad over the death of someone whos not my grandma,rip hero alex die sad death not grandma
49676,I feel like i can t fall in love with a person  is this feeling normal   Okay I m almost   and I just started college  So basically I have liked guys attractive and have liked guys from afar like celebrities or people I have never talked too but I have never liked someone for their personality in a romantic way  Like the guys I would have crushes on  I had this fake idea of who they were and I thought I was in love with their perosnality but I just ended up making up who I thought they were  I just don t understand what it feels like to fall in love with someone s personality I guess  I m gay and in the closet so I ve never dated but I m just scared I ll never be in a true relationship because I feel like I m incapable for falling in love with someone  The relationship would just end up feeling like a friendship  Does anyone have any advice,0,I am gay and in the closet. I have never been in a romantic relationship. I don't understand what it feels like to fall in love with someone's personality. I am scared I won't be able to find a true relationship. ,gay closet romantic relationship not understand feel like fall love personality scared not able find true relationship
49677,Me when psych go tells me im mentally ill,0,Me when psych go tells me im mentally ill,psych tell mentally ill
49678,Another breakup another state where I just want to end it  Love is just way too much bullshit for me,1,Another breakup another state where I just want to end it  Love is just way too much bullshit for me,breakup state want end love way bullshit
49679,someone just informed me i like hitler just because i m not a stalinist  thanks for telling me  i never knew i was a fucking fascist scumbag edit he just tried to mansplain what socialism is to me but he doesn t know what socialism is,0,someone just informed me i like hitler just because i m not a stalinist  thanks for telling me  i never knew i was a fucking fascist scumbag edit he just tried to mansplain what socialism is to me but he doesn t know what socialism is,inform like hitler not stalinist thank tell know fucking fascist scumbag edit try man plain socialism know socialism
49680,Stop treating Johnny Depp like some hero he was also abusive The court case in London was to prove whether or not calling him a  wife beater  was a lie  It was proved it was not a lie  he beat his wife  No wonder he is getting axed from a childrens franchise after that the whole court case just made him look worse Amber Heard is also a terrible person and was abusive but it s not like Johnny is some poor innocent victim  It was a toxic relationship it went both ways he literally spoke to his friend about wanting to burn her  drown her and then fuck her corpse together to make sure she s dead If you want  justice  focus on bringing down Amber Heard  not idolising Depp,0,Johnny Depp beat his wife Amber Heard. Depp is getting axed from a childrens franchise after the London court case.  He talked to his friend about wanting to burn her and drown her and then have sex with her corpse. ,johnny depp beat wife amber hear depp getting axe child franchise london court case talk friend want burn drown sex corpse
49681,I wanna throw nuts at the cars in my street Don t ask why,0,I wanna throw nuts at the cars in my street Don t ask why,want throw nut car street don task
