,text,class,summary,cleaned
213172,amgiving it ten years i guess none of yall have to take me seriously sincei am not a threat but this year has been absolute hell and part of that is because i realized that things have hell for years i just always ignored it or didnt realize what was wrong theyve been bad for my 21 years a quarter of my life so why should they get any better thats just not how my life works apparently soi amgiving it ten years if its not better by theni amout my five year plan involves getting a real job moving out of my hometown and away from the family who has caused me so much pain and getting married hopefully to my current partner five years is the goal but i amgiving it ten just to be safe id like to leave the country by the end of my ten years but i dont know if thats my deciding factor in whether or not i will off myself like i mentioned my family has absolutely ruined my life my childhood was taken away and now the prime of my life is being ruined too i hate them all except maybe my sister they cant help me my partner already listens to enough of my bitching about mental health and i know its going to push him away if i keep it up i started seeing a therapist a few weeks back but hes not really helpful progress so far has been disgustingly slowi ambetter off coping on my ownim just so sick of fightingi am so fucking tired of hoping and dreaming that one day i will be happy and then when i finally feel like things may be getting better something bad happens and its all stolen violently away i just want to be happy please fuck let me be happy if i cant be happy in ten years which is such a long time away then i dont see the point in prolonging the suffering ,1,"This year has been hell for her. She is giving it ten years to get better. She wants to leave the country by the end of her ten years. She started seeing a therapist a few weeks ago, but he's not helping.",year hell give year well want leave country end year start see therapist week ago not help
213173,i almost got the baker act god fucking hates me i get iti am tired of swimming upstreami amready for the shitshowof a lifei amliving in o come to an end my existence is interfering with the happiness of others and i amdutifully prepared to end my life for the greater good fuck you god fuck you you fucking self righteous cunt i used to not believe in god but now i know god exists because god fucking hates me and i experience its hate consistently ive had enough hate if got hates me so much and wont kill me i will take care of it myselfi am sorry i wasnt better than i turned out to be good luck,1,"God hates me. I used to not believe in god but now I know god exists because god hates me and I experience its hate consistently. If god doesn't hate me so much and won't kill me, I will take care of it myself. ",god hate not believe god know god exist god hate experience hate consistently god not hate not kill care
213174,need urgent help friend just took 5 nurofen and panodol mixed together down with alcohol he just told me this after hes done it could he die should i call someone need help,1,need urgent help friend just took 5 nurofen and panodol mixed together down with alcohol he just told me this after hes done it could he die should i call someone need help,need urgent help friend take euro fen pan dol mix alcohol tell s die need help
213175,ive never felt more free in my life than knowingi am going to die tonight not gonna put my whole sob story out there because you all have enough to deal with i just know its the right thing to do tonight i told someone i was going to kill myself and he said that i was too much to handle i think hes right but i just needed to say goodbye to someone i dont even have anybody to leave a note to goodnight goodbye all and i truly hope you find a different path than mine ,1,"I am going to kill myself tonight. I told someone I was going to do it and he said that I was too much to handle. I don't want to put the whole sob story out there, but it's the right thing to do. ",go kill tonight tell go say handle not want sob story right thing
213176,whats the point things get better just so they can get even worse were expected to contribute to society but in the end all we get is death everything ive given has gone to waste i have nothing left i have no love to give i dont want to exist anymore ,1,whats the point things get better just so they can get even worse were expected to contribute to society but in the end all we get is death everything ive given has gone to waste i have nothing left i have no love to give i dont want to exist anymore ,point thing well bad expect contribute society end death give go waste leave no love not want exist anymore
213177,tonight or maybe tomorrow i have wanted it to be over for ages food tastes like dust the concern of others is irritating the instence of the doc that it gets better reads like so much bullshit i have no more little lies to tell myself to get myself out of bed in the weekend i dont have it in me to go on and get better whatever that means if its anything like losing weight i no longer have the capacity for that mental effortthe train lines below are dark and quiet at night a few more hours and i may go and lie down on one will be interesting what if anything comes next if it isnt nothing,1,Tonight or tomorrow she will go and lie down on one of the train tracks to get some relief from the pain. She doesn't have it in her to get up and go to the doctor at the weekend. She is tired of the doctor's promises that it will get better.,tonight tomorrow lie train track relief pain not doctor weekend tired doctor promise well
213178,i justi cant anymore there is nothing that is going to bring me out of this holei am in i tried so hard to be happy on my own be my own happiness because its foolish to expect anything out of othersi amtwenty two years old i know how fickle and awful people can be i just want this stop i want everything to stop i dont want any of this anymore i cant do it i cant be the person everyone expects me to bei am too fragile confused and tired i can hardly take care of myself anymore i just want this to be over i dont care who i leave behind at this point go ahead and call me selfish fuck you fuck you for thinking everyone else is somehow still more important to me i cant do this i cant keep pretendingi amhappy or that everything is going to be just finei am so angry and tired at my core anything would be better then this i wish i could have stopped myself from even being born i give up,1,"There is nothing that will bring me out of the hole I am in. I am angry and tired. I wish I could have stopped myself from even being born. I know how fickle and awful people can be, but I can't be the person everyone expects me to be. ",bring hole angry tired wish stop bear know fickle awful people not person expect
213179,cant live with or without her we had a falling out because of drama and nowi am not going back to her because of various reasons it hurts a lot to talk to her but after 2 years of friendship i dont think i can stand being without her anyway she is a bit toxic but i was going through a really bad time when she came to my life when i was alone almost all the time and she was the first person i actually spoke to in a while i dont know how to put the past 2 yrs of friendship in words because she really means a lot to me even though she was a pain to talk to at the same timei ampretty conflicted because i feel like i would do better if i cut her out of my life but at the same time i feel like i lost something really important that i will never get back again and it feels like it because in comparison to her everyone else seems awful they dont even want to try to be similar to her at 20 i have been seriously considering suicide because everything seems really awful and painful without her in my life i wont get her back so whats the pointi always think about how the scenario could have been different but it just makes it worse,1,"After 2 years of friendship, she and him had a falling out because of drama. He doesn't want to talk to her anymore because she is toxic. She came to his life when he was going through a bad time and he was alone. She was the first person he spoke to in a while.",year friendship fall drama not want talk anymore toxic come life go bad time person speak
213180,i wanna do it dont do it just talk to me,1,i wanna do it dont do it just talk to me,want not talk
213181,here s my note is this it i ve just written my suicide note i don t know what to do anymore it s directed at my best friend who has slowly destroyed me over the past month ,1,here s my note is this it i ve just written my suicide note i don t know what to do anymore it s directed at my best friend who has slowly destroyed me over the past month ,note write suicide note don know anymore direct good friend slowly destroy past month
213182,now i understand that even family isnt enough to keep me going surei amstuck at home helping care for a sick physically disabled mother will be for years more yet its not enough for me to want to go oni amperpetually teetering on bankruptcy due to high expenses a low income and limited cash reserves i have little chance of finding any other kind of work than my shitty part time job thanks to a useless degree and only 2 jobs in my experience i cant afford to take on another loan for another college degree because my income is that lowi amall alone most of the time with no friends or girlfriend thanks to how shit i am with people i simply have no place in this world at all worst of all my depression diagnosis turned out completely wrong its actually dysthymiai quite simply dont have much longer to livei am tired,1,"i am teetering on bankruptcy due to high expenses, a low income and limited cash reserves. I have a useless degree and only 2 jobs in my experience. I can't afford to take on another loan for another college degree. My depression diagnosis turned out to be dysthymia.",teeter bankruptcy high expense low income limited cash reserve useless degree job experience not afford loan college degree depression diagnosis turn dysthymia
213183,amjust really tiredi am not going to commit suicide so maybe this is being posted in the wrong place but if a car were to hit me or if someone shot me dead or if some other event were to end my life i wouldnt complain guess that meansi amjust a coward who hopes to pin my death on someone other than myself but at the point where i am i dont feel sad depressed angry alone or any other feelings that people who have it much worse than i have i just feel so tired from when i wake up to when i go to bed tired of life tired of who i am as a person tired of what a waste ive become and just tired in general and i am really tired of being tired,1,"I am not going to commit suicide, but I am really tired and I would not complain even if I were to die. I am tired of life, tired of who I am as a person and tired of what I have become. ",not go commit suicide tired not complain die tired life tired person tired
213184,it doesnt feel like theres any other way out theres honestly just too much to even fit into one post i have work tomorrow and i amafraid to leave because i dont want my father to hurt my sister again i just wish i could acquiesce this burden but if id either have to drop out of school to live comfortably on my own in new york take a slower course schedule and overwork myself while i go to school i could barely handle 25 hours a week with schooli amjust going to be here for years having to stand in between them and defuse every fightdying just seems like the fastest way to not have to be responsible somethings going to happen to her and its going to be my fault i just dont want to be there to see it happen and i dont want to deal with what happens after,1,"It's too much to fit into one post. She has work tomorrow and she's afraid to leave because she doesn't want her father to hurt her sister again. If she had to drop out of school, she wouldn't be able to live comfortably on her own in New York.",fit post work tomorrow afraid leave not want father hurt sister drop school not able live comfortably new york
213185,i feel like i don t have a choice anymore i ve been dealing with depression and suicidal thoughts for half my life now lately i ve been reading a lot of stories from people that tried and failed and suddenly now wanted to live i m really wondering if that might be the only way to stop thinking about it so much maybe i need to give it a serious attempt before i can get betteri ve come so close a few times the past few weeks everything is horrible in my life right now and it keeps getting worse all the timethe way i m looking at it if i succeed then no more problems if i fail maybe i ll want to get better anything has to be better than what i m dealing with nowhonestly i don t think i ll ever get better but this makes sense to me maybe it ll prove me wrong if i don t succeedidk what to do,1,"Suicide might be the only way to stop thinking about depression and suicidal thoughts. If he succeeds, he will want to get better, if he fails, he might want to try again. He doesn't think he will ever get better.",suicide way stop think depression suicidal thought succeed want well fail want try not think well
213186,22 m my last weeki amdonei am going to die by the end of next week and theres nothing that can stop me university is awful i never should have enrolled i only did it because my family wanted me to now in my last year due to financial reasons i have to live with my emotionally abusive sibling who makes me feel worse than trash every day no matter what i do waking up feels like a crime my parents know how i feel about the situation and they agree its awful but refuse to do anything about it my closest friends know thati amat my breaking point and they arent okay with it but theyre decent people who will accept my decision if its what i want i know this will destroy my family and friends and i care but not enough to suffer through this anymore my dpdr combined with natural lucid dreaming make this world feel fake all i want is to die so i can start over in some other life if i die my student debt goes away and i dont have to feel like this anymorei am not gonna wake up crying every day anymore goodbye i guess,1,University is awful. My family wanted me to go there in my last year due to financial reasons. I have an emotionally abusive sibling who makes me feel worse than trash every day. My closest friends know that I am at my breaking point and they are okay with it. ,university awful family want year financial reason emotionally abusive sibling make feel bad trash day close friend know breaking point okay
213187,mental i willness hope guysi am trying really hard really damn hardi ampouring tears right now i have intrusive thoughts that dont leave me ive been having the for 67 months from waking up to sleeping i think about the same thing all day i had to quit working and nowi amskipping school i have no friends and i amrottingi amuselessi aminsane i have held a rifle muzzle to my mouth but never took the shot i have held knifes to my wrist and stomach but never punctured myself i have tried really hard i live with my mom and i live her for how she has helped me but i really have no hope ive tried meds self therapy i dont know what else to try i am going insane i want to end my life before i become a maniac without a soul i dont want to be selfish with my life and take it for granted but granted you were in my shoes you would bot consider this a life you would consider this hell please how do i muster up the courage to end my life help please,1,"""I want to end my life before I become a maniac without a soul"" ""I live with my mom and I live her for how she has helped me but I have tried meds self therapy and I don't know what else to try. ",want end life maniac soul live mon live help try bed self therapy not know try
213188,my heart is telling me to go through with it i thought this year would be differentbut my chest is tight and i feel like something is just telling me to get it over with,1,my heart is telling me to go through with it i thought this year would be differentbut my chest is tight and i feel like something is just telling me to get it over with,heart tell think year different chest tight feel like tell
213189,i been having thoughts dark thoughts i am planning my way out the pressure hope people s eyes focused on me i can t take it i am indian living in uk i was brought here by my parents for a better life but i can t have one to have friends i need to drink with them party with them but i am not allowed too it s lonely when you friends hang out and youcan t i can t disobey my parents because i know what they say is for my own good i love them and i can t disappoint them if it s hard for me it s hard for them too they don t have a friends they live their lives in a loop i can t i can t ever disappoint them i can t understand the english language very well but i do my best i am starting my university course when people see my they think and say you are smart you don t have to try as hard as us they re wrong i try my hardest when they get stuck they ask their parents to help them when i get stuck i can t ask them because don t english so i try harder for them and for myself iiam starting my course it s going to be hard i might even fail this will disappoint my parents i can t take that i can t take the fact i have to pay 13k just because i have leave to remain not irl that s my story that s my ending rather have my parents spend their saving on me i should kill my self anyways even with all that saving they only support me for a year so i can t finish my course which is 4 years so this is my end thank you,1,Indian living in the UK was brought here by his parents for a better life. He is starting his university course. He doesn't understand the English language very well but he tries his best. His parents support him for a year so he can't finish the course.,indian live bring parent well life start university course not understand english language try good parent support year not finish course
213190,i talk to my friends to get better but almost no ones responding and i really need someone i can talk toi amalways there when they need to talk why isnt anyone around when i seriously need one to talk to my family is shit and all my friends neglected me my three best friends didnt text me back whats the point now,1,There is no one to talk to when you need to talk. My three best friends didn't text me back. I really need someone I can talk to to help me deal with my family issues. I talk to my friends to get better but almost no one is responding.,no talk need talk good friend not text need talk help deal family issue talk friend well no respond
213191,time to go despite supposedly things going well i think it is time to go the thought of continuing another year with a mental i willness that has convinced me that i am inherently a failure and will continue to do so sounds pretty unbearable i have no idea why i continue a life that is inherently worthless i dont want to anymore so now its time to plan the end,1,It's time to plan the end for me as I don't want to continue living the way I do and I'm not sure why I continue living a life that makes me feel worthless anymore.   i don't know why I keep living a worthless life. ,time plan end not want continue live way not sure continue live life make feel worthless anymore not know live worthless life
213192,this is it there is no hope goodbye nicole marvin you were my only love,1,this is it there is no hope goodbye nicole marvin you were my only love,no hope goodbye nicole marvin love
213193,tomorrow i wrote a letter to my family in which i mentioned thati amtransgender and bisexual googled a bunch of suicide related things such as how long does it take to bleed out all i have to do now is to inform my online friends that i will disappear and might not come online ever again hopefully they wont be asking too many questions i dont want to make them panic i just want to disappear i am afraid to be honesti am not afraid of dying but instead of what would happen if i were to survive it somehow its all or nothing tomorrow on september 23rd i will hopefully finally die ,1,"Tomorrow she wrote a letter to her family informing them that she is transgender and bisexual. Tomorrow on September 23rd she will contact her online friends to inform them she might not come online for some time. She is not afraid of dying, but of what would happen if she were to survive.",tomorrow write letter family inform transgend bisexual tomorrow september contact online friend inform not come online time not afraid die happen survive
213194,i always just use reddit to stall i need to just delete this stupid throwaway and finish the job before i convince myself to suffer another few months until i end up back here again its always the same,1,i always just use reddit to stall i need to just delete this stupid throwaway and finish the job before i convince myself to suffer another few months until i end up back here again its always the same,use geddit stall need delete stupid throwaway finish job convince suffer month end
213195,i m about to _ _,1,i m about to _ _,
213196,i know i deserve it whenever i mess up i like to punish myself other than the obvious like cutting sometimes i dont eat for hours even thoughi amhungry my record is 22 hours but i eventually caved because i almost fainted sometimes i force myself to walk home alone in the cold and rain because i dont deserve warmth or human company when theres a voice saying that i deserve punishment for being a terrible person on repeat any timei amsuffering it makes the pain a lot easier to bearmaybe one of these days that voice telling me i dont deserve to live will become loud enough that i will actually have the balls to end it all ,1,"Whenever I mess up, I punish myself. Sometimes I force myself to walk home alone in the cold and rain because I don't deserve warmth or human company. The voice in my head tells me that I deserve punishment for being a terrible person on repeat any time I am suffering.",mess punish force walk home cold rain not deserve warmth human company voice head tell deserve punishment terrible person repeat time suffer
213197,i dont know what i expected of tonight heres to everyone to have a better tomorrow goodnight everyone we are all important in life,1,i dont know what i expected of tonight heres to everyone to have a better tomorrow goodnight everyone we are all important in life,not know expect tonight well tomorrow goodnight important life
213198,was just diagnosed with pdd does anyone have any advice for someone who had been trying his best to deal with long term depression 10 years now i can barely make myself be around people even family seem faceless to mei need some advice on how to deal with this in a healthy way so far its been me working two jobs so i dont have to make friends and self medicating untili am in oblivion,1,I was just diagnosed with pdd. I've been depressed for 10 years. I'm working two jobs and self medicating. I need some advice on how to deal with this in a healthy way. I can barely make myself be around people.,diagnose add depress year work job self medicate need advice deal healthy way barely people
213199,one good day that s what i had yesterday the first good day in a very very long time is that what i m fighting for one day where i don t hate myself is it worth staying alive for 1 good day a year i don t think so and now i just don t wanna be here,1,one good day that s what i had yesterday the first good day in a very very long time is that what i m fighting for one day where i don t hate myself is it worth staying alive for 1 good day a year i don t think so and now i just don t wanna be here,good day yesterday good day long time fighting day don hate worth stay alive good day year don think don want
213200,i just want someone to talk to just a human i can freaking talk to and hugi am so alone i just need someone it hurts so so bad being without a someone for such a long period of time plz help me,1,i just want someone to talk to just a human i can freaking talk to and hugi am so alone i just need someone it hurts so so bad being without a someone for such a long period of time plz help me,want talk human freak talk huge need hurt bad long period time ply help
