,text,class,summary,cleaned
160384,My existence is misery Why does everyone leave me  Why am I such a failure,1,My existence is misery Why does everyone leave me  Why am I such a failure,existence misery leave failure
160385,HoursIts too much  being alive  Im done thinking about it  post phoning it  I m dying today  School  family  and friends suck  No one will remember me  so im at least posting one last thing on this account  I hat existing  If anyone has a good reason for me to stay  now s your chance,1,HoursIts too much  being alive  Im done thinking about it  post phoning it  I m dying today  School  family  and friends suck  No one will remember me  so im at least posting one last thing on this account  I hat existing  If anyone has a good reason for me to stay  now s your chance,hour alive think post phone die today school family friend suck no remember post thing account hat exist good reason stay chance
160386,i have a bad habit of needing to scroll through tiktok and reddit before i go to bed it s like mandatory i can t sleep without it even though it causes me to go to sleep later than i planned,0,i have a bad habit of needing to scroll through tiktok and reddit before i go to bed it s like mandatory i can t sleep without it even though it causes me to go to sleep later than i planned,bad habit need scroll tito geddit bed like mandatory sleep cause sleep later plan
160387,Hmmm  today I will   does that evil laugh from hotel mario,0,Hmmm  today I will   does that evil laugh from hotel mario,hmm today evil laugh hotel mario
160388,pe was such a straight people subject   like bruh they would always put in so much effort,0,pe was such a straight people subject   like bruh they would always put in so much effort,straight people subject like brush effort
160389,Life sucksLike a lot of you  I ve also thought a lot about ending it  Never been able to do it though and life is a constant struggle  I wish there was just a button to end it all  Click it and you just die  Abusive parents are one of the biggest reasons why I am what I am today  Always wanted the best  never really loved me  shouted  screamed  criticized Maybe I m the problem  Nothing but a disappointment  A useless creature no one will ever give a shit about  Can t stop having pity on myself  Can t stop crying  Can t do anything good  Anyone have any ways to end it  Simple and painless if possible,1,Abusive parents are one of the biggest reasons why I am what I am today. Life is a constant struggle and I wish there was a button to end it all. Anyone can help me find a simple and painless way to end my life.,abusive parent big reason today life constant struggle wish button end help find simple painless way end life
160390,No friends  controlling family  no cause  no career  never had a relationship  What is the point of living Title says it all  I feel like my life is ticking away  I don t understand why I have to stay here  The few people who care about my well being would be upset but at the same time they never check up on me  I am sick of always having to be the one to put effort into being a good friend  The best friends I ever had were the ones who would seek me out to do something but they have all moved away  At this age  I can forget about ever having a relationship  I see no point in living  Someone please either help me or give me the means to end it,1,Title says it all. He doesn't understand why he has to stay here. He's sick of always having to be the one to put effort into being a good friend. The best friends he ever had were the ones who would seek him out to do something but they have all moved away.,title say not understand stay sick have effort good friend good friend one seek move away
160391,I think im gonna get some hate because of this I don t like Friends the sitcom,0,I think im gonna get some hate because of this I don t like Friends the sitcom,think go hate don like friend sitcom
160392,Help getting over a breakup I need to stop thinking about her but the more I do it the sadder I become  Any tips on what I should do to clear my mind concience,0,Help getting over a breakup I need to stop thinking about her but the more I do it the sadder I become  Any tips on what I should do to clear my mind concience,help get breakup need stop think sadder tip clear mind conscience
160393,What is ping  Ok so this is random but what one earth is ping in gaming  I didn t know where to ask this but I figured I d get answers here,0,What is ping  Ok so this is random but what one earth is ping in gaming  I didn t know where to ask this but I figured I d get answers here,pe random earth pe gaming know ask figure d answer
160394,I wish I could make new memories Irs  am and I shuffled my entire music library and a whole bunch of songs came up I haven t listened to in a year  I ve never really been the most socially interactive person so the only people I d consider my best friends have been mostly through messaging And I m sitting here listening to these songs that I was told about by my old friends who don t talk to me anymore and it puts into perspective how solitary I am  I ve wasted my time being a teenager by being alone  I ve never had a real best friend because I have zero experiences and real memories  My only valid one is smiling at my best friend whenever she got on my old bus and having her smile back  Bittersweet  But other than that my life has been a screen with no real human interaction and it sucks I want a real friend,0,"I haven't listened to a lot of music in a year because I haven't had any real human interaction. My best friend is Bittersweet, but other than that my life has been a screen and I want a real friend. ",not listen lot music year not real human interaction good friend bittersweet life screen want real friend
160395,mfs really get super sad out of nowhere uts me im mfs,0,mfs really get super sad out of nowhere uts me im mfs,mrs super sad uts mrs
160396,How to deal with a toxic coworker  I can t slap the bitch she annoys the hell out of me like she s   and is already married like wtf marriges and kids are canceled   peace out,0,How to deal with a toxic coworker  I can t slap the bitch she annoys the hell out of me like she s   and is already married like wtf marriges and kids are canceled   peace out,deal toxic coworker slap bitch annoy hell like marry like whf marriage kid cancel peace
160397,Maybe if I kill myself and finally meet God he can reincarnate me as woman Fuck life why did I have to be born as a man,1,Maybe if I kill myself and finally meet God he can reincarnate me as woman Fuck life why did I have to be born as a man,maybe kill finally meet god reincarnate woman fuck life bear man
160398,I don t know how to tell my SO that I m suicidalI love him so much and I don t want him to blame himself if he ever knew that I was suicidal  I also can t let him know that some days  he is the only thing keeping me on this earth  That s too much pressure to place on a partner   My suicidal thoughts feel like a secret  He knows so much about me  but he doesn t know about this demon looming over me at all times,1,I don't know how to tell my partner that I'm suicidal. I love him so much and I don't want him to blame himself if he ever knew that I was suicidal. Some days he's the only thing keeping me on this earth. ,not know tell partner suicidal love not want blame know suicidal day thing keep earth
160399,I often feel like I want to be alone  I know I ve got friends whom I can count on to talk about things whenever I m feeling down and they also include me into their plans which I am thankful for but here I am lying on bed  alone with my intrusive thoughts and would rather be alone than to interact with people Idk man I just feel drained all the time and it s not like I am intentionally pushing everyone away  I feel so fucking bad whenever I m in one of these moods again  which seems to be a never ending cycle,0,I often feel like I want to be alone. I know I have friends who talk to me when I'm feeling down and include me in their plans. But I would rather be alone than interact with people. I feel so bad whenever I m in one of these moods again.,feel like want know friend talk feel include plan interact people feel bad mood
160400,Is Elon Musk a bad person  removed View Poll https www reddit com poll i kat,0,Is Elon Musk a bad person  removed View Poll https www reddit com poll i kat,leon musk bad person remove view poll geddit com poll kat
160401,What is your least favorite class  I fucking hate science class lol  How about y all,0,What is your least favorite class  I fucking hate science class lol  How about y all,favourite class fucking hate science class low
160402,My school needs funding quite urgently so we re having a raffle  Any donations are greatly appreciated  Also if you know any subreddits for this kinda stuff pls let me know   We re having a raffle to get funds   https go rallyup com dcgs grand draw Please enter student code  T   if you donate Thanks If you can t donate and still want to help please  share this so more people can help,0,"My school needs funding urgently and is having a raffle to raise money. Please enter student code T if you donate. If you can't donate, but still want to help, please share this so more people can help. ",school need funding urgently have raffle raise money enter student code donate not donate want help share people help
160403,My school does temperature checks every morning but the thermometers are never correct so it s just this fake sense of security Every morning you get your temp checked before you re allowed in the school  but also every morning every single person that lines up never had a temperature above like   which is already hypothermia levels and not accurate at all  Twice now I ve gotten a temperature of   and the teachers just act like it s perfectly normal  The temperature checks are a nice idea but with the forehead ones they just don t work at all  It s like the TSA is working at my school like it only exists to make people think they re safe smh,0,The school does temperature checks every morning but the thermometers are never correct. It's like the TSA is working at my school to make people think they're safe. The temperature checks are a nice idea but with the forehead ones they don't work at all.,school temperature check morning thermometer correct like tea work school people think safe temperature check nice idea forehead one not work
160404,I cry when I m shown motherly affection IDK if this is the right place but I ve been listening to ASMR  and when I listened to something relating to motherly care  I ended up crying uncontrollably  does anyone know why because I sure don t,0,I cry when I m shown motherly affection IDK if this is the right place but I ve been listening to ASMR  and when I listened to something relating to motherly care  I ended up crying uncontrollably  does anyone know why because I sure don t,cry show motherly affection not know right place listen astr listen relate motherly care end cry uncontrollably know sure don
160405,Never Gonna Give You Up is one of the few  s songs that teens these days are exposed to Just saying  because being the only one in class who enjoys  s music really makes me feel out of place       And when I see teens discuss music  the only  s song I consistently hear them bring up is Never Gonna Give You Up,0,"Never Gonna Give You Up is one of the few songs that teens these days are exposed to. Being the only one in class who enjoys s music makes me feel out of place. When teens discuss music, the only s song they bring up is Never Gonna Get You Up.",go song teen day expose class enjoy music make feel place teen discuss music song bring go
160406,I feel my heart is broken There s a physical pit in my chest  I know this sounds silly and dramatic but when i m anxious and sad  it s difficult to breath  The feeling causes my chest to tighten up and it genuinely feels like I have a broken heart,1,I feel my heart is broken There s a physical pit in my chest  I know this sounds silly and dramatic but when i m anxious and sad  it s difficult to breath  The feeling causes my chest to tighten up and it genuinely feels like I have a broken heart,feel heart break physical pit chest know sound silly dramatic anxious sad difficult breath feeling cause chest tighten genuinely feel like broken heart
160407,Can I just talk to someone Can I just talk to someone I dont see how I can keep doing this  i feel so hopeless  I feel like this should be the end I have no one to talk to  I make things difficult for everyone  Im sick of everything  I dont see the point,1,Can I just talk to someone Can I just talk to someone I dont see how I can keep doing this  i feel so hopeless  I feel like this should be the end I have no one to talk to  I make things difficult for everyone  Im sick of everything  I dont see the point,talk talk not feel hopeless feel like end no talk thing difficult sick not point
160408,I used to have a huge crush on my best friend  but the feelings are fading  Still wanna tell her doe  does it sound like a bad idea  Okay so me and this girl are really great friends  but I had have a crush on her  My feelings used to be much stronger but now they are not the same  I want to let her know that I used to like her like her because in a way I feel like I owe her that  If I tell her and she tells me that she s interested too  then I would be very happy  but if I tell her and she does not feel the same  then it really doesn t matter  Would it be weird telling a girl that you used to have a crush and that you still do  but that the feelings are fading  Would it even be a possible good outcome of that  I feel like it makes it less weird if my feelings are unreciprocated if I tell her that the crush is starting to disappear  What are your advice Reddit,0,"I used to have a crush on my best friend, but the feelings are fading. I want to tell her that he used to like her, but he doesn't know if it's a good idea. Reddit has some advice on the matter.",crush good friend feeling fade want tell like not know good idea geddit advice matter
160409,less gooo the amber alert scared the shit outta me,0,less gooo the amber alert scared the shit outta me,goo amber alert scare shit outta
160410,Hello reddit  this is my first post and i want to die Hello everyone  i ve only recently been diagnosed with bipolar disorder  which actually explains a lot  but doesn t explain why i want to die A lot has gone on the past few weeks  namely a break up with my girlfriend  i wont lie i do have a problem with drinking and my refusal to deal with my mental health was a massive factor  i have been trying to deal with it all on my own terms but the NHS are absolute nancies  i ring my doctors everyday and i keep being told to wait for my letter with my appointment despite all the times i ve tried to kill myself  even recent events  the NHS is good  but for mental health it fucking sucks   i dont know where to go know as i seek for answers  should i end it all  should i persevere i feel so lost  confused and unwanted  suicide seems like the best option PS i have a long history of self harm,1,"After a break up with his girlfriend, he wants to kill himself. He was recently diagnosed with bipolar disorder. The NHS is good for physical health but not for mental health. He has a long history of self harm and wants to end it all.",break girlfriend want kill recently diagnose bipolar disorder nos good physical health not mental health long history self harm want end
160411,Tired againEver hear the song alone again naturally   I wish I could hold the people I loved  Most of them are dead  When you re   and your serious boyfriend of four years dies on his kitchen floor from an overdose dying at age  I was a broken woman  I always will be  The following year my father died  Inbetween having friends of mine die from overdose  Many I fear my best friend will die any day and I pray he doesn t  I ve lost so much of how the world and daily life used to be  All I look forward to is a car accident where I m the only one killed  I might want to have my last drunken night somewhere  give away my poems  my music my art  My friends and bf all died too young even my dad  I cannot stand existing I thought I could make a difference  I do love myself and some abilities but when you have no drive left without a choice I m surprised I m not physically dead yet,1,The song is about a woman whose boyfriend died of an overdose and her father died from an overdose. She is sad because her friends and boyfriend all died too young. She would like to have her last drunken night somewhere and give away her art. ,song woman boyfriend die overdose father die overdose sad friend boyfriend die young like drunken night away art
160412,I honestly don t believe I ll ever be happy I don t know what to do  I don t feel like I m about to kill myself  but I really don t see the point of continuing I ve wasted my entire young adult life   being depressed  I went to an excellent expensive school  but I was too depressed to actually take advantage of what made it good and expensive  I put a huge financial burden on my family for nothing  and it tore my family apart  I m at a joke of a job  and I don t know how I can possibly set out on a successful career  I keep getting depressed  and I can t job search  and I sure couldn t live up to my potential as a highly intelligent person I haven t been able to make friends  Sure  I ve got acquaintances  but barely any friends  The few that I do have are put through hell with all of my mood swings and drama  I ve got all sorts of emotional issues that get in the way of friendships  My entire being is a knot of defense mechanisms  I turn on people and passionately hate them when they aren t there for me when I need them  I ve been like this for years  and I don t know if I can change  I can see how my behavior is unhealthy  but I really think the  emotional protection  it s giving me is necessary My core beliefs are so cynical  Having people you can depend on makes you weak  Love is weakness  The cynicism is getting worse  With every relationship I tear down  I m that much more hesitant to trust someone At this point  I don t think I ll ever have a fulfilling career  I ll never have a successful romantic relationship because I have such a hard time getting close to people and I don t really love myself  I ll never be comfortable with a group of friends The only reason I have for living is that killing myself would hurt my family  but I m such an emotional drain on them that I d be saving them decades of frustration I just want to have hope that one day I ll be happy,1,I don't see the point of living. I went to an expensive school but I was too depressed to take advantage of it. I put a lot of financial burden on my family for nothing and it tore them apart. I haven't been able to make friends. I turn on people and hate them when they aren't there for me when I need them. ,not point living go expensive school depressed advantage lot financial burden family tear apart not able friend turn people hate not need
160413,I ve grown to hate therapists Having been in and out of therapy for the majority of my life  all I have found it to do is make me hang onto life instead of committing suicide  That does not sound too bad at face value  but then I released no matter what else we worked on nothing else would change  So I would be hanging on to a life I fucking hated because of all the therapy  without ever seeing any progress in making things better in every other aspect of my life  Without it  I most likely would have ended it a while ago now  and honestly I wish I did   Fear of death being instilled in me doesn t make this life any better  it only prolongs it  which is so much worse  This realization only occurred recently  and because of this I doubt I will be around much longer,1,For most of his life he has been in and out of therapy. He has grown to hate it as it has made him hang onto life instead of committing suicide. He would have ended his life a long time ago without therapy.,life therapy grow hate hang life instead commit suicide end life long time ago therapy
160414,I need supportI ve been depressed for a while and my girlfriend  the most important person in my world  are on the brink of breaking up and honestly might as well be When I get bad all I do is bruise myself or sometimes cut myself in a way that look like a rash  I really don t like talking to people about my depression because I hate bothering people and have them worry about me  especially my parents who have done so much for me in their life and I don t them to have another suicide scare Can someone please just talk to me and help me in this moment  I so badly want to commit suicide and I know I shouldn t but I don t know what else to do to end my pain  Please just help me I need someone to be there for me now,1,I am depressed and want to commit suicide. My girlfriend is on the verge of breaking up with him. He doesn't want to talk to people about his depression as he doesn't like to worry about his parents. He is afraid his parents will worry about him.,depressed want commit suicide girlfriend verge break not want talk people depression not like worry parent afraid parent worry
160415,Entitlement and narcissism has overtaken America In   liberals screamed  not my president  and it is hilarious seeing so called  conservatives  yell the same thing in  America has become a nation of entitled narcissists How can this nation be the light in a dark world again  How can America led the free world against the Communist Chinese genocide of the Uyghurs  How can they led humanity into space again,0,America has become a nation of entitled narcissists. America led the free world against the Communist Chinese genocide of the Uyghurs. America has led humanity into space again. Liberals screamed not my president. Conservatives yell the same thing. ,america nation entitle narcissists america lead free world communist chinese genocide uighur america lead humanity space liberal scream not president conservative yell thing
160416,Belt around my neckIt s cutting off bloodflow but not air  I hope it s enough,1,Belt around my neckIt s cutting off bloodflow but not air  I hope it s enough,belt neck cut blood flow not air hope
160417,Idk how many of you need to hear this but Please shower with soap regularly Everyone around you can tell you haven t used soap for a month  Self care and hygiene isn t a bad thing  Please i don t wanna smell you from the other side of the class,0,Idk how many of you need to hear this but Please shower with soap regularly Everyone around you can tell you haven t used soap for a month  Self care and hygiene isn t a bad thing  Please i don t wanna smell you from the other side of the class,not know need hear shower soap regularly tell haven soap month self care hygiene bad thing don want smell class
160418,Here is a fun fact  holding the accelerate button harder doesn t make you go faster in racing games I m putting text here so the post doesn t get removed,0,Here is a fun fact  holding the accelerate button harder doesn t make you go faster in racing games I m putting text here so the post doesn t get removed,fun fact hold accelerate button hard fast racing game putting text post remove
160419,Jugular veinIf you got stabbed in the jugular vein how long would it take to die,1,Jugular veinIf you got stabbed in the jugular vein how long would it take to die,jugular vein got stab jugular vein long die
160420,Only   days to goA couple of days ago I decided to do it  Today in   days will be the day where I end my suffering  My life is really shit  I fought for over   years and I m done today  Everyday things are still getting worse That was everything I wanted to say,1,Only   days to goA couple of days ago I decided to do it  Today in   days will be the day where I end my suffering  My life is really shit  I fought for over   years and I m done today  Everyday things are still getting worse That was everything I wanted to say,day goa couple day ago decide today day day end suffer life shit fight year today everyday thing get bad want
160421,years ago my mother said  what could be so bad I remember when I was   my freshmen year of college I was hospitalized for Valentine s Day for a suspected suicidal ideation I lived very far from my parents and it wasn t practical for them to come and visit  They were going to come  but I made sure to convince them it was all a mistake and they stayed home  I told them over skype the hospitalization was a mistake  My mother said to me  I ll never forget  I don t know what could be so bad The words sting in my head  I lied  I had every intentions of killing myself  but I didn t have  an answer to her question I don t have an answer for you mom  I really don t  I don t really know what s so bad,1,"In college I was hospitalized for Valentine's Day for a suspected suicidal ideation. My parents were going to visit me, but I convinced them it was all a mistake and they stayed at home. My mother will never forget it.",college hospitalize valentine day suspect suicidal ideation parent go visit convince mistake stay home mother forget
160422,I m violently insaneAlberta Health services destroyed my life and I want to kill psych ward staff next time I m there,1,I m violently insaneAlberta Health services destroyed my life and I want to kill psych ward staff next time I m there,violently insane alberta health service destroy life want kill psych ward staff time
160423,confused as to why i am alivei wouldn t mind sleeping all the time  especially if i had the chance to never wake up,1,confused as to why i am alivei wouldn t mind sleeping all the time  especially if i had the chance to never wake up,confuse alive mind sleep time especially chance wake
