,text,class,summary,cleaned
160634,Stealing money from straight white people s bank accounts is fun filler filler filler filler filler filler filler filler filler filler filler filler,0,Stealing money from straight white people s bank accounts is fun filler filler filler filler filler filler filler filler filler filler filler filler,steal money straight white peoples bank account fun filler filler filler filler filler filler filler filler filler filler filler filler
160635,these kinds of people still exist  this is my physics teachers s reaction for showing him a mistake  i just told him that the spelling of the video is wrong and now he removed from the college group   https imgur com a xKwajCu https imgur com a xKwajCu,0,these kinds of people still exist  this is my physics teachers s reaction for showing him a mistake  i just told him that the spelling of the video is wrong and now he removed from the college group   https imgur com a xKwajCu https imgur com a xKwajCu,kind people exist physics teacher reaction show mistake tell spelling video wrong remove college group incur com watch incur com watch
160636,Two fish are in a tank One says to the other  do you know how to drive this thing,0,Two fish are in a tank One says to the other  do you know how to drive this thing,fish tank say know drive thing
160637,Does anyone else have a set date for when they want to end their life by I m   and all the way since I was   I told myself  I will end my life by the age of   I take antidepressants and I get counseling but nothing feels like it helps and I still want to end it in   years  I ve never been admitted to the hospital or anything but I ve cut a few times and held plastic bags over my head  I just am too weak to go through with it but by setting the date of age   it gives me a little more pressure to do it  Is this weird,1,I want to end my life by the age of 30. I take antidepressants and I get counseling but nothing helps. I have cut a few times and held plastic bags over my head before. I haven't been admitted to the hospital. ,want end life age antidepressant counselling help cut time hold plastic bag head not admit hospital
160638,I always feel miserable around my birthdayI just don t get the point of why I should live this long,1,I always feel miserable around my birthdayI just don t get the point of why I should live this long,feel miserable birthday don point live long
160639,How young is too young for a relationship  I ve been getting close with a girl lately and wanted to ask her out on a date  She s   and I m only   that is were the problem arises  I think I might be a bit too young but am still not sure  We have been getting to know each other pretty well and I think it could work out  I hope   What do you all think about this age gap  is it too big or does anyone think it might detour her away  Thanks  lt,0,"How young is too young for a relationship? I want to ask a girl out on a date, but I think I might be a bit too young. I have been getting to know her well and I think it could work out. ",young young relationship want ask girl date think bit young get know think work
160640,Geneva convention  More like bucket list This isn t a joke  I m wanted in   different countries in Europe and the middle East for my numerous war crimes,0,Geneva convention  More like bucket list This isn t a joke  I m wanted in   different countries in Europe and the middle East for my numerous war crimes,geneva convention like bucket list joke want different country europe middle east numerous war crime
160641,pov you re tryna find a good title  amp x B https preview redd it kxnxxiib we jpg width amp format pjpg amp auto webp amp s edcbb f f add d b b e bd,0,pov you re tryna find a good title  amp x B https preview redd it kxnxxiib we jpg width amp format pjpg amp auto webp amp s edcbb f f add d b b e bd,nov try find good title amp preview redd xxx ii mpg width amp format pop amp auto web amp ebb add
160642,How have my texting skills decreased lmao  When I was like   I used to text with people nearly everyday but now it s a struggle to get a conversation going lol  Feels awkward to try start a conversation with some of my newer friends now I m older idk  Anyway just miss that shit oof,0,How have my texting skills decreased lmao  When I was like   I used to text with people nearly everyday but now it s a struggle to get a conversation going lol  Feels awkward to try start a conversation with some of my newer friends now I m older idk  Anyway just miss that shit oof,texting skill decrease lao like text people nearly everyday struggle conversation go low feel awkward try start conversation new friend old not know miss shit oof
160643,Do people on this sub not know how to take a joke  FeMiNaZI,0,Do people on this sub not know how to take a joke  FeMiNaZI,people sub not know joke fem nazi
160644,I didn t expect to still be hereI really thought today was the day  I ve felt so low for the last month  Yesterday I knew I d have the opportunity today and I decided I d do it  Suddenly I felt calm and optimistic  But in the end I didn t do it  I tied the rope and I must have spent three hours sat there looking at it  I felt calm  but I guess I m just not quite there yet I m still here but so are my problems  I ve been hit hard this year with three huge issues  My health is bad at the moment and that makes everything ten times harder  Work is toxic and my boss is unsupportive and I m thinking of just quitting  And then I have a serious legal issue hanging over me which may or may not turn into something It s all just too much and it feels like I m delaying the inevitable,1,"Today was supposed to be the day when he decided to kill himself, but in the end he didn't do it. He has been hit hard this year with three issues: work, health and a legal issue. He's thinking of quitting.",today suppose day decide kill end not hit hard year issue work health legal issue think quit
160645,Tried calling the hotlineApparently my service provider won t let me reach that line  I really should just fucking die,1,Tried calling the hotlineApparently my service provider won t let me reach that line  I really should just fucking die,try call hotline apparently service provider will not let reach line fucking die
160646,Still hereI just don t want to exist anymore  it hurts too much  my medication is the only thing keeping me alive The first thought in my head in the morning is always  why am i still here  I just can t do it anymore  i m sorry  this is probably my last post,1,Still hereI just don t want to exist anymore  it hurts too much  my medication is the only thing keeping me alive The first thought in my head in the morning is always  why am i still here  I just can t do it anymore  i m sorry  this is probably my last post,don want exist anymore hurt medication thing keep alive thought head morning anymore sorry probably post
160647,I hate what happened and I cannot bare it no more I m   years old and I m done living  I ve lived   decades but it feels like   I cannot bare my past  I cannot accept what happened nor do I want to confront it  I ve been smoking weed getting high daily for   years just to numb the fucking pain  I hate being pilled up  I hate the feelings of being overheated cooked from the inside  I hate loneliness  I hate literally everything  Idk why I dont kill myself now  I want to but I dont want to put my parents through it  I just want to die  I do not find pleasure in living at all  I dont know what to do anymore and I m ready to die,1,"I hate what happened. I want to kill myself but I don't want to put my parents through it. I smoked weed daily for years to numb the pain. I hate being pilled up, I hate loneliness and I hate everything. ",hate happen want kill not want parent smoke weed daily year numb pain hate fill hate loneliness hate
160648,I m just so I don t even know,1,I m just so I don t even know,don know
160649,I have not had food or water for over   hours and it s staying that way until it kills me I don t care how uncomfortable or painful it gets  I m sitting here and sleeping until I die of dehydration  I ll spare you my sob story  but I ve tried to be a good person  it s hard to keep that up when life treats you like this  I just want out,1,I haven't had any food or water for over hours and I want to die of dehydration. I've tried to be a good person but it's hard when life treats you like this. I just want to get out. ,not food water hour want die dehydration try good person hard life treat like want
160650,this is the best thing ever  courtesy of u esberat  https gfycat com untimelyseparatecob https gfycat com untimelyseparatecob,0,this is the best thing ever  courtesy of u esberat  https gfycat com untimelyseparatecob https gfycat com untimelyseparatecob,good thing courtesy ebert cat com untimelyseparatecob cat com untimelyseparatecob
160651,I wish  some thoughts I quickly wrote down I wish I had a friend  someone who genuinely listened to my pain and my reasons for not wanting to remain here Who wouldn t try to convince me to change my mind Who loved me enough to see all my failed attempts at taking my own life and take it for me Why does no one love me enough Sending love out to you all  I know you need it,1,"I wish I had a friend who would listen to my pain and try to convince me to change my mind. Why does no one love me enough? I send love to all who need it, as I know they need it. ",wish friend listen pain try convince change mind no love send love need know need
160652,I hate being self conscious Some can just go and do what they want without having a second though and I ll just be sitting alone in my house wondering if I m breathing out of my nose too loudly,0,I hate being self conscious Some can just go and do what they want without having a second though and I ll just be sitting alone in my house wondering if I m breathing out of my nose too loudly,hate self conscious want have second ill sit house wonder breathing nose loudly
160653,Tired Eyes and a tired mind Long story short  I ve been unemployed since graduation in   I got a   in Business  I m nearly   will be in May  I ve taken care of family for over a year  near two before I signed on late   I now volunteer have done for over a year with two charities for references   I sincerely am trying   I ve got in contact with the Samaritan  and CALM to speak up and it s helped to an extent I just recently I hate waking up after eight hours sleep and still feeling tired   I hate having a broken sleep  where I wake up repeatedly after five hours  I hate thinking the futures hopeless  I hate thinking about funeral costs  I ve even had suicidal thoughts once again  And reading up on it is something that I just can t help   I ve had to make a conscious effort to not be alone  I make sure my bedroom door is open   My concentration is shot  and it s just frustrating   I honestly am at a loss how to handle this  I don t even know what I m asking for  This depression and cycle of I m a fuck up and the there s no hope thoughts is wearing us down   I know I m not the only one in my situation it s just hard to see past my own failings  I already feel I ve let my family down  I just don t know where to go from here,1,"Unemployed since graduation, depressed and depressed. Volunteered for over a year with two charities for references. Had suicidal thoughts once again. Has to make conscious effort to not be alone and make sure his bedroom door is open. He feels he has let his family down.",unemployed graduation depress depress volunteer year charity reference suicidal thought conscious effort not sure bedroom door open feel let family
160654,Where are all the depressed loner girls who do drugs  I m lonely  Depressed  And do drugs  I need a friend or sum,0,Where are all the depressed loner girls who do drugs  I m lonely  Depressed  And do drugs  I need a friend or sum,depressed loner girl drug lonely depressed drug need friend sum
160655,Questioning morality I guess that title s pretty vague  What I mean is that I worry sometimes about if I m actually a decent human being  I don t know if I do what I do based on my own moral perceptions  or just because I listen to my parents   who ARE good people  guidance  Am I actually doing what  I  think is right  or deep down am I vile and my parents  are the ones keeping me afloat and doing what s right The only way I can know is when I am out of my parents  influence  It can be grueling I ve had this talk with my mom  and she says that because I even have these thought proves were my morality is  Others have told me the same thing in response to general moral questing  outside of the child to parent dynamic  This has helped me  but sometimes I still worry I know that was kinda brusque  but I felt I should share in the case that anyone else here has experienced the same ordeal EDIT  spacing,0,I wonder if I am a decent human being or if I do what I do based on my own moral perceptions or just because I listen to my parents. The only way I can know is when I am out of my parents influence.,wonder decent human base moral perception listen parent way know parent influence
160656,Felt really depressed a while back made this CAUTION THIS MAY BE DISTURBING This is what I drew Front  https ibb co Rg bfHj Back  https ibb co PGZTdN,1,Felt really depressed a while back made this CAUTION THIS MAY BE DISTURBING This is what I drew Front  https ibb co Rg bfHj Back  https ibb co PGZTdN,feel depress caution disturb draw bib co baht bib co
160657,I made like half of a song Anyone here rap and wanna help me out,0,I made like half of a song Anyone here rap and wanna help me out,like half song rap want help
160658,AITA for wanting to take a break from my relationship with my boyfriend because I m mentally exhausted Sorry in advance for any grammatical atrocities english isn t my mother tongue    For context my boyfriend and I have been together for a year  I love him a lot but our relationship is starting to exhaust me  Even before we were a thing he told me a lot that happened to him  Without getting into the details he was bullied a lot and made multiple attempts to kill himself   Once every week I have to convince him not to take his life or the sabotage his future  I try every day to help him find more healthy coping mechanisms than chain smoking and cutting yourself  I try to encourage him to eat more and to see doctors that will help him but he doesn t want me nor anyone to help him because I feels like it s to late and he s already a lost cause   I have my own battles with mental illness but I can t take care of my problems and his at the same time   Everyday I wake up I m scared that he killed himself and that I wasn t there to help him when he needed it   Can you please help me I don t know who to talk to and what to do,1,Aita wants to end her relationship with her boyfriend because she's mentally exhausted. Aita and her boyfriend have been together for a year and Aita tries to help him cope with his mental illness but she's afraid he'll kill himself. ,rita want end relationship boyfriend mentally exhausted rita boyfriend year rita try help cope mental illness afraid kill
160659,So how are y all coping with the fact that we all just lost a year of our teens Especially any seniors  I m still sad I lost senior year  which was supposed to be like closure  I feel like I ll forever feel like a junior,0,So how are y all coping with the fact that we all just lost a year of our teens Especially any seniors  I m still sad I lost senior year  which was supposed to be like closure  I feel like I ll forever feel like a junior,cope fact lose year teen especially senior sad lose senior year suppose like closure feel like ill forever feel like junior
160660,hey so i m genuinely terrified right now so a while ago i was walking home from the store and it was pretty dark out  and of course by then i was already terrified  i mean i m a teenaged girl walking home alone at night  a million things could go wrong  so i m walking fairly quickly and very alert  and notice this guy walking towards me  he looks like he s not paying attention but it s just me and this one other man who s twice my size  so my fears aren t exactly calmed  i try to quickly pass him but right as i go by he grabs my ass  and tries to whisper in my ear  before he has the chance i try my best to push him away and book it  as i m running i  swear  i heard footsteps behind me  but i wasn t about to look back and check  i get home  slam the door  lock it  and look out the window  it was fairly dark but i could see he was still out there  just looking  it doesn t help that i m now home alone  so i m hiding in my moms room with all the doors and windows locked  sobbing and texting my mom to get home as quickly as she can  idk if he s still out there but i can t look and risk him seeing me,0,A teenage girl was walking home alone at night. She was approached by a man twice her size. He grabbed her ass and tried to whisper in her ear. She ran home and locked all the doors and windows. Now she's hiding in her mom's room.,teenage girl walk home night approach man twice size grab ass try whisper ear run home lock door window hide mod room
160661,It came floodingMy life was never meant to be like this  I based all of my hopes on having a family  Now because of infidelity and an arrest for drugs my life has crashed because my wife wanted a divorce   years later It s been two years since the divorce  I ve settled into misery and let my addiction continue to control me  I can t keep a steady job so no health insurance even though my meds and therapy are essential Tonight  it s all come back to me  Our wedding  our honeymoon  the birth of our children  Holy shit it s so painful to see what I fucked up and then threw away  I had a job  a wife  a family  Now I have none  Instead  I ve had to move back into my abusive parents  house  Maybe I can get a job despite my shitty work history and background check  but I ll never have the most important part again  My God  I d been with my wife for half of my life at the time of her proposing divorce  I was a stay at home dad for   years  I miss my ex wife so bad  I miss seeing my girls every day instead of occasional weekends I repeat that I never meant for my life to be like this  The future looks so blank and empty  especially as tears stream down my face and Juice WRLD whispers in my ear  I ruined everything I had ever been looking forward to  There is no way for my life to ever be clear and complete  I ve only continued living because I don t want to hurt my daughters  but as they become more and more mature  I won t be able to hide who I really am from them  They ll know I m a piece of shit junkie who fucked everything up  Beyond that  I m not sure how much longer I can keep living this miserable  pointless  and lonely life  They call suicide selfish but what if it s the only way to end the suffering  Flip it around too  isn t it selfish to demand I stay alive just because you d be sad if I was dead Fuck this life,1,"After his wife wanted a divorce two years ago, he lost all hope of having a family. Now he has no job, no health insurance and he's living in an abusive parents house. He misses his ex wife and misses seeing his daughters every day.",wife want divorce year ago lose hope have family no job no health insurance live abusive parent house miss sex wife miss see daughter day
160662,Curiosity kills the cat My runaway cat named Moose once said The saying thay goes  curiosity kills the cat  is a conspiracy theory popularised by humans to validate their willful ignorance and proliferate their stupidity  That s why they think we re vessels for witches and devils and that s why they label dogs as  best friends  not us  like we even want to be friends with morons  Dogs are dumb enough to learn their tricks and do their bidding  We re just indifferent  waiting for the collapse of their civilization that will be caused by themselves  Homo sapiens my ass  more like homo slut iens Disclaimer  This post is not meant to trigger anyone  I just made this because lately this subreddit has just all been about gender slender  how guys are scum and how girls are mentally imbalanced or they re shit  I just want to get us to talk something different  It s okay if i didn t do it properly  but at least i tried,0,Curiosity kills the cat is a conspiracy theory popularised by humans to validate their willful ignorance and proliferate their stupidity. Humans are indifferent waiting for the collapse of their civilization that will be caused by themselves. This post is not meant to trigger anyone but to get people to talk about something different.,curiosity kill cat conspiracy theory popularise human validate wilful ignorance proliferate stupidity human indifferent wait collapse civilization cause post not mean trigger people talk different
160663,I m a useless  friendless piece of shit  Every day that passes  I feel my thinking skills and motor finesse slowly getting worse I don t even know how people make friends  I tried  but I always fail  I m tired  I m fucking tired  There s nobody in my house now  it d be the perfect moment to do it,1,I m a useless  friendless piece of shit  Every day that passes  I feel my thinking skills and motor finesse slowly getting worse I don t even know how people make friends  I tried  but I always fail  I m tired  I m fucking tired  There s nobody in my house now  it d be the perfect moment to do it,useless friendless piece shit day pass feel thinking skill motor finesse slowly get bad don know people friend try fail tired fucking tired house perfect moment
160664,How can I leave my family without hurting them or getting them in trouble Over the   years of my life  I have caused tremendous pain and suffering upon my family  At the tender age of   I was molested by a relative and again at the age of   the first one was caught but the second is still breathing  This has caused me to go through a lot of shit  and inflict harm on the people around me  Believe me when I tell you that I am a horrible human being  I have done unspeakable things  And it is the main reason that I want to end it  I have harmed both children  adults  and animals  I shouldn t be alive   I remember  after my millionth suicide attempt  my mom looked at me with tired eyes and told me that if I wanted to die  that I should do it outside   If you want to leave  just leave  No ones holding you back  It was meant for a different context but I have taken this as a support  that it s okay to leave  But believe me  my family is amazing  They have gave me everything in life that I could ever have  And I will pay them back as I have a check waiting for me once I reach the age of     thousand dollars sits  I turn   in   days  I hope that they can still access it when I m gone   Ways that I have planned   I have a rope ready and prepared  I have a tree a couple kilometers waiting for me   I have the blade inside my pencil sharpener   I have the knife in the kitchen I have the bleach under the sink I have the pills in the cabinet   I have gotten them to slowly hate me  despise me so that hopefully it can be easier  They are scared of me  I can see it   amp x B I am serious  I am not crying  I am not a mess  I am calm   amp x B I need to leave  For them  For me  For the people that I ve hurt  I need to take responsibility for my actions   amp x B Please tell me  out of all the options   amp x B which is the best way to go that will not get them in trouble,1,At the tender age of I was molested by a relative. I have harmed both children adults and animals. I want to leave my family. I will pay them back when I reach the age of thousand dollars. I am going to kill myself.,tender age molest relative harm child adult animal want leave family pay reach age dollar go kill
160665,Don t want to get betterHad depression for a few years and I was trying to get better  But now I don t feel like trying or even that I want to  Friends and family are supportive and have good advice  Paying for therapy  listening to me when I have a bad episode  But recently I have realised that I am not actually doing anything to help myself get better  It s more like I am simply paying lip service to myself and others to convince myself them that I am going to put in effort  I attended therapy a few times but I didn t really try  Spoke about my low self esteem but when she tried to convince me that I shouldn t have low self worth it doesn t ring true for me  It s the same when other people try  I have people that care about me and want me to feel better about myself but I just can t take it on board I think that now I don t even want to feel better  It s become normal now and I m more comfortable that way  It s easier than trying and I m not convinced I deserve to feel good anyway with the way I treat others and the selfish thoughts I often have I don t want to kill myself because I can t be bothered to  But hopefully I ll die sometime soon  I know a lot of suicidal people say that they don t kill themselves because their family would be heartbroken  But I barely even think about that and I m not sure I care  I think I m just a bad and selfish person,1,Had depression for a few years and attended therapy a few times but didn't really try to get better. Now he doesn't feel like trying or even that he wants to. He's not convinced he deserves to feel good anyway with the way he treats others and selfish thoughts. ,depression year attend therapy time not try well not feel like try want not convinced deserve feel good way treat selfish thought
160666,People are like jokes Some people can t take the dark ones That joke was so dark the cops shot it,0,People are like jokes Some people can t take the dark ones That joke was so dark the cops shot it,people like joke people dark one joke dark cop shoot
