,text,class,summary,cleaned
164984,Good night y all Gooooooooooooooooooooooooooooooooooooooooooodddddddddddd night to everyone in Europe its  pm so yeah bye bye and sweet dreams im also gonna sleep,0,Good night y all Gooooooooooooooooooooooooooooooooooooooooooodddddddddddd night to everyone in Europe its  pm so yeah bye bye and sweet dreams im also gonna sleep,good night good night europe pm yeah bye bye sweet dream go sleep
164985,So apparently i m not allowed to get crunchyroll to watch anime legally  But my parents are cool with me pirating it   Not related to title  this rule of needing a minimum character count to post to stop spam is so fucking stupid before people would say random shit that popped into their head bow i need to meet a character count   FUCKING BULLSHIT,0,"According to Crunchyroll's rules, I can't watch anime legally, but my parents are cool with me pirating it. The rule of needing a minimum character count to post to stop spam is stupid and ridiculous.  ",accord crunch roll rule not watch anime legally parent cool pirate rule need minimum character count post stop spam stupid ridiculous
164986,The  ButterflyBesides two sharp objects we re impailed to my core of Spain leaving me with the consequences that the lack of energy and enthusiasm and mind would bit by bit make me break apart cuz I no longer had control over life after being impailed and I m sure there was a cosmic will under it saying you must diminish from existence  in the worst way  Let s not forget the two broken knees by chance again that they also created a different reality for me it s all written on the spirit and the energy body how a critical damage takes everything from you even a alternative reality of hell is waiting for you that you don t know  And hey  The butterfly s fly forever now not just these two they were made by other butterfly s from family  So overall  Everyone else had a choice but after studying the flaws inside my will caused by surgery the will to act then it was too late   I wish I was never borned   and I didn t wanted to I m sure I would never want something like this if I were to see things in my early life before I come here I m sure I wouldn t So it wasn t my choice  Life was just a sick joke,1,The Butterfly was impaled by two sharp objects and two broken knees. He feels he no longer has control over life. He wishes he was never borned and he didn't want to come to Spain. He didn't see things in his early life before coming here.,butterfly impale sharp object broken knee feel no long control life wish bored not want come spain not thing early life come
164987,here is some indian cartoons  https youtu be BHJpJ uCyuc https youtu be BHJpJ uCyuc,0,here is some indian cartoons  https youtu be BHJpJ uCyuc https youtu be BHJpJ uCyuc,indian cartoon youtube hope club youtube hope club
164988,As time goes onIt s been about a year and a half since my wife committed suicide  It was going up for a bit but I m starting to feel the slow decline again  I don t think there s gonna be a next time it s starting to feel hopeless now,1,As time goes onIt s been about a year and a half since my wife committed suicide  It was going up for a bit but I m starting to feel the slow decline again  I don t think there s gonna be a next time it s starting to feel hopeless now,time go unit year half wife commit suicide go bit start feel slow decline don think going time starting feel hopeless
164989,Hello everyone I thought I d just say I love you all  and happy December lol,0,Hello everyone I thought I d just say I love you all  and happy December lol,hello think d love happy december low
164990,I m scared of myselfI m so close to the edge  no one is home and I really want to hang myself  No one cares about me  I sure as hell don t,1,I m scared of myselfI m so close to the edge  no one is home and I really want to hang myself  No one cares about me  I sure as hell don t,scared close edge no home want hang no care sure hell don
164991,Help please hi reddit  i haven t tell anyone this because i was too scared to tell anyone because all my friends and family are homophobic and i am afraid they will judge me and the internet seems like to only way i can tell people so can you guys give me advice on how i can tell my parents that i am lesbian  i will really appreciate it,0,Reddit is looking for advice on how to tell her parents that she is lesbian. She doesn't want to tell anyone because all her friends and family are homophobic. She is afraid they will judge her and the internet is the only way she can tell them.,geddit look advice tell parent lesbian not want tell friend family homophobic afraid judge internet way tell
164992,My friend made a big mistake the other day He asked me   What is Hololive Context  I think this was a little over a week ago  but I told my friends I was gonna watch an unarchived live stream so I couldn t hang out with the boys in discord  One of my friends asked what stream I was gonna watch  I kept trying to say that s it s just a stream that I needed to watch but he just kept asking  So I just said  that it was a singing stream from a vtuber I watch  He just asked me a quick question before I went to go watch the stream on which was  vtubers are those anime girls right  I just said yeah and he told me that I had my priorities straight Fast forward to a few days ago  he asked me  What is Hololive  Apparently he went and searched up a little more about vtubers ever since that day and found out about Hololive  And so  I brought him into the vtuber rabbit hole with me I just kinda wanted to share this cuz it felt great to show someone else about the things that I watch  The stream was Gawr Gura s unarchived singing live stream for those who were wondering,0,A few days ago one of my friends asked me What is Hololive. I told him that I was going to watch Gawr Gura's unarchived singing live stream so he couldn't hang out with the boys in discord. He went to look for more information about vtubers and found out about Hololives.,day ago friend ask hollie tell go watch gar gurus archive singe live stream not hang boy discord go look information tuber find holly
164993,I DON T GET IT  WHY tf are Americans hating on asians  they re fucking awesome  Their culture  FOOD  and the women especially  SMH ppl,0,I DON T GET IT  WHY tf are Americans hating on asians  they re fucking awesome  Their culture  FOOD  and the women especially  SMH ppl,don americans hate asians fucking awesome culture food woman especially sch people
164994,Something terrible happened today The boys haven t stepped their game up and the girls have taken over my best friends list on Snapchat  This isn t good,0,Something terrible happened today The boys haven t stepped their game up and the girls have taken over my best friends list on Snapchat  This isn t good,terrible happen today boy haven step game girl take good friend list snap chat good
164995,day   of telling yall to have a great day night have a great day night fellow teens,0,day   of telling yall to have a great day night have a great day night fellow teens,day tell great day night great day night fellow teen
164996,Is there something wrong with me  My aunt who has been a pretty big part of my life just passed away because of covid  I just found out and I literally have no emotions  I really cared about her and she took care of me all the time when I was younger  I almost want to feel sad about it but I just have no emotions towards it,0,"My aunt passed away because of cancer. I have no emotions towards it. I really cared about her and she took care of me all the time when I was younger. I almost want to feel sad about it, but I just don't. ",aunt pass away cancer no emotion care take care time young want feel sad not
164997,Why am I such a piece of shit Why am I incapable of being a normal human fucking being  Why can I just not be lonely  All I do is feel this extreme loneliness and reach out to my friend for some company and I get irritated when they say no and it just pushes them away from me  Today I think I ve finally broke the last straw of our friendship and when they eventually end it later today or tomorrow I will no longer be bound to my promise I made to not kill myself and I will be free to go forth with my plan and end my pain  I can t lie the thought of not feeling anything is so appealing right now as I can t see my life getting any better due to me being an incapable piece of shit  Everything is all my fault but I will soon rectify my mistakes and remove myself from this existence  I really wish I didn t feel this pain and I wish I could be happy but I know it s not possible because I don t have the willpower to do anything about it,1,"When his friends break up with him later today or tomorrow, he will be free to kill himself. The thought of not feeling anything appeals to him. He doesn't see his life getting any better due to him being an incapable piece of shit. ",friend break later today tomorrow free kill thought not feel appeal not life get well incapable piece shit
164998,I hate myself for being such a failure Apologies if there are some typos  I m shaking right now For my entkre life  I ve been a straight A student in advanced classes and I even advanced a grade  Last year my grades slipped a bit and I felt like a failure  but now I have   missing assignments  four F s and my highest grade is a C  and I hate myself so much for it  I don t even know how I got to this point  I m pulling an all nighter tonight to get my graces up but I hate myself fo much for getting to this point  How did I even do it  If I told my younger self I wpild be like this right now  they would be disgusted and I m disgusted too  Because my grades slipped a little bit last hear  I m in regular math instead of advanced math yet I m still failing all because I m a lazy fuck  And I want to take AP classes nect year  I m in  th grafe  because I ll feel like a stupid failure if I don t but I know my teachers are going to think I m an idiot and i dont know if I can do it i f I m really this lazy  I m going to get my grades now up but I m so disappointed in myself for getting to this point and making eccuses and I ll never be able to change the past,0,Last year my grades slipped a bit and I felt like a failure. Now I have missing assignments four F s and my highest grade is a C. I want to take AP classes this year but I'm afraid the teachers will think I'm an idiot.,year grade slip bit feel like failure miss assignment high grade want class year afraid teacher think idiot
164999,Fuck luckshit just doesn t get better  doesn t matter what I do I ll never be enough  Will I always be compared all my life  Tired of being lonely  tired of being nothing  too useless to be something  I promise you it doesn t matter what I put out there  None of it fucking matters  Everyday I feel like I become less and less of a person  I don t see myself living much longer and that s the truth  I know there are times when I go silent and don t talk about what s really going on  but these thoughts are really catching up to me and it s taking its toll  There s nothing I can do about it at this point  I feel stupid for even trying to live in this world knowing I don t belong  I ve never stopped wishing death upon myself  How unlucky I was to be brought to this world,1,Luckshit is lonely and depressed. He doesn't see himself living much longer. He feels stupid for even trying to live in this world knowing he doesn't belong. He has never stopped wishing death upon himself. He thinks he's unlucky to be brought to this world.,luck shit lonely depressed not live long feel stupid try live world know not belong stop wish death think unlucky bring world
165000,This post is hacked  Only people with crippling depression can upvote this  Now where is my upvotes and awards,0,This post is hacked  Only people with crippling depression can upvote this  Now where is my upvotes and awards,post hack people crippling depression vote vote award
165001,UniversityHey there reddit  For the past two years I had a reason to live  And everything was great  Whenever my depression got too bad i was able to control it because i was hoping that things would get better if i got into university for illustration  Its the only thing i care about  Today my first rejection letter came in and im still waiting for the other two responses  I will probably get rejected from both of them since i was rejected by my  d choice which is an easier school to get into than the other   Im not sure if i cant handle being rejected by all the universities i applied to  Im not sure if I ll be able to find the motivation and reapply next year  I know its a very mundane problem to have  But i dont have anything else in my life that gives me a reason to continue living and art is the only thing i thought i was good at,1,"For the past two years, Daniel has been able to control his depression. He applied for university for illustration. Today his first rejection letter came in and he's waiting for the other two responses. He will probably get rejected from both of them as he was rejected by his d choice school. Daniel doesn't know if he can handle being rejected by all the universities. ",past year daniel able control depression apply university illustration today rejection letter come wait response probably reject reject choice school daniel not know handle reject university
165002,School Burnout Ok who else is getting incredibly burnt out from school Like  I wouldn t call it exhaustion because it s not about my energy  it s more like my ability to do schoolwork with resolve is getting weathered away  I m losing my ability to focus  to care  to work hard  I m just getting worn out  I really need another break,0,"School burnout is not about energy but about the ability to focus and focus on schoolwork. She really needs another break.       .   ""I wouldn't call it exhaustion. It's more like my ability to do schoolwork with resolve is getting weathered away""",school burnout not energy ability focus focus schoolwork need break not exhaustion like ability schoolwork resolve getting weather away
165003,My taste in music is bipolar as fuck One minute it could be some dark trap like TrippyThaKid and next it s some  s shit like Judas Priest or Kix and then it s some fuckin anime music like I can t just make up my mind,0,My taste in music is bipolar as fuck One minute it could be some dark trap like TrippyThaKid and next it s some  s shit like Judas Priest or Kix and then it s some fuckin anime music like I can t just make up my mind,taste music bipolar fuck minute dark trap like triptych aid shit like judas priest fuck anime music like mind
165004,oi mate would you like to join a discord server  If you want to join just dm me there is a pretty good amount of people in here it s just about vibing and talking to people,0,oi mate would you like to join a discord server  If you want to join just dm me there is a pretty good amount of people in here it s just about vibing and talking to people,mate like join discord server want join pretty good people vike talk people
165005,I m a   yo divorced man w   kids and a dog a ma Text text text text text text text text text text text text text text text,0,I m a   yo divorced man w   kids and a dog a ma Text text text text text text text text text text text text text text text,divorce man kid dog text text text text text text text text text text text text text text text
165006,Posting every letter of the Alphabet until I either get bullied or through the entire Alphabet  Day five E,0,Posting every letter of the Alphabet until I either get bullied or through the entire Alphabet  Day five E,post letter alphabet bully entire alphabet day
165007,I m streaming  If you want to just chill and hangout  come swing by  twitch tv nuggswyd,0,I m streaming  If you want to just chill and hangout  come swing by  twitch tv nuggswyd,streaming want chill hangout come swing twitch bug d
165008,I m such a cowardHow can I kill myself without having any fear I have sleeping pills hiding in my room but I m scared I m a disappointment to everyone my parents and brother are tired of me I wanna end this emotional pain,1,I m such a cowardHow can I kill myself without having any fear I have sleeping pills hiding in my room but I m scared I m a disappointment to everyone my parents and brother are tired of me I wanna end this emotional pain,coward kill have fear sleep pill hide room scared disappointment parent brother tired want end emotional pain
165009,i carried her home tonight we are young so lets set the world on fire we can burn brighter than the sun,0,i carried her home tonight we are young so lets set the world on fire we can burn brighter than the sun,carry home tonight young let set world fire burn brighter sun
165010,It took   and a half hours of usage for my phone to get from   to   And it took another   hours to from   to   Smh batteries,0,It took   and a half hours of usage for my phone to get from   to   And it took another   hours to from   to   Smh batteries,take half hour usage phone take hour sch battery
165011,Looked for helpI am very depressive and finally looked for help  My boyfriend broke up with me and i feel even more worse than ever  He said he would like to take a break with me  So it be  But in my mind i remember how he said he would support me and help me  Now he is isn t by my side anymore  Idk how to feel about it  Yeah  But this is not the point   My sisters looked for help for my  Finally  I couldn t reach out alone for help  I am grateful for having them  Cheering me up and pulling me out of my bed  I want to write how my theapy goes one  Starting tomorrow i will be taking some medicine  Antidepressiva I really scared but i hope for the best outcome  I shouldn t be alone for the first few weeks  Idk what that mean  Okay maybe those pills could kill me if i wanted to and i have more pills   Did you knew that overdosis can t kill pepole  Most of them are not that harmful  Just vomitting and having an arching belly Nothing more  nothing less Lets see if i am getting better after this whole thing  Wish me luck please,1,My boyfriend broke up with me and now I feel depressed. I will start taking Antidepressiva starting tomorrow. I'm scared but I hope for the best. I shouldn't be alone for the first few weeks. I have more pills.,boyfriend break feel depressed start take antidepressive start tomorrow scared hope good not week pill
165012,This is just stupid at this point Ups and downs  same pattern of happiness and self worth and then a crash of anger and depression It s getting so boring and tiring  Just keep on getting kicked when I m already down Life just wants to see me fail and suffer The worst thing that could ve happened to me did  It s my greatest fear that came true today and I m scared I m all alone and in the dark  It feels like no one is really on my side  It s not fair  Nothing is fucking fair Why can t life be kind enough and just stop trying to murder me when I m already fucking dead I just don t fucking get it anymore   why me,1,There's a pattern of ups and downs in my life. I keep getting kicked when I'm already down. Life just wants to see me fail and suffer. The worst thing that could have happened to me came true today and I'm scared. ,pattern up down life getting kick life want fail suffer bad thing happen come true today scared
165013,if you re a fellow BEN  comment down below all bens are seggcy  cute  hung  and pussy magnets,0,if you re a fellow BEN  comment down below all bens are seggcy  cute  hung  and pussy magnets,fellow ben comment ben legacy cute hung pussy magnet
165014,Life is hellEveryday is a nightmare I try to be happy but I just end up failing and doing something I regret and there is so much bad stuff in this world and no matter what it will always exist and things are probably just going to get worse,1,Life is hellEveryday is a nightmare I try to be happy but I just end up failing and doing something I regret and there is so much bad stuff in this world and no matter what it will always exist and things are probably just going to get worse,life hell everyday nightmare try happy end fail regret bad stuff world no matter exist thing probably go bad
165015,Trying to help a suicidal friendI m not sure if this was the right place to post this  but it seemed appropriate  A person I met online a few weeks ago has been saying some very concerning things about wanting to kill himself  He s bulimic and eats less than   calories a day  and a couple of days ago he started uncontrollably shaking due to low blood sugar  at least  that was his assessment  I m not certain on all of the details  as he doesn t want to talk about his personal life beyond the obvious cries for help he makes on a daily basis  but I have made a few educated guesses  everything from here on should be taken with a grain of salt  He lives with his parents  who don t appear to like him very much by his account  has no job  and essentially no education  He feels like a leech with nothing to contribute and genuinely believes the world would be a better place without him  He said his parents would get over his death in a year and would have more freedom and money without him leeching  He used to be extremely overweight and lives in fear of becoming that way again  Unfortunately I can only talk to him online  and he doesn t like to show his face at all and he hates his voice  I don t know much about him or what his specific thoughts are but I want to help him any way I can  I genuinely believe he may do it,1,A person I met online has been saying some concerning things about wanting to kill himself. He is bulimic and eats less than calories a day. He lives with his parents who don't like him and has no job or education. He used to be extremely overweight and lives in fear of becoming that way again. He doesn't like to show his face and he hates his voice. I want to help him any way I can.,person meet online say concern thing want kill bulimic eat calorie day live parent not like no job education extremely overweight live fear way not like face hate voice want help way
165016,I m broken inside and can t see things ever getting any better I m   I m planning to end things tonight  Of course  I ve said this to myself hundreds of times before  wrote countless suicide notes and cried so many tears  However  this time feels different  Instead of hysterically crying while listening to sad songs in the dark  a strange sense of eery calm was washed over me  It almost seems to tell me that my time has come   I ve been cutting myself since I was   and until recently that was almost enough to quash the pain  It s not anymore though  I just want life to stop  I m not cut out for this world  I don t fit in  and life has shown me this again and again I have no one  not really  My parents divorced and don t give a shit anymore  They work all day and go out most nights  only stopping to yell at me when I ve done something wrong  which happens frequently as I m a useless piece of shit  I ve no friends  just acquaintances whose lives won t change in the slightest whether I live or die  I have nothing going for me  I m average looking  I m not smart  I m probably a really bad conversationalist  no one really cares about me  and I have no hope of having a successful future  My grades are shit  If I somehow make it to adulthood I ll probably end up a homeless crack addict on the side of the street  But I can t do this anymore  The tears are coming now  I guess these are my last words,1,I'm going to kill myself tonight. I don't fit in and I have no one. I have been cutting myself since I was a child. My parents divorced and don't give a shit about him. He has no friends and no hope of having a successful future.,go kill tonight not fit no cut child parent divorce not shit no friend no hope have successful future
165017,MY CRUSH LIKES ME BACK I am actually just so happy right now I never thought the day would come,0,MY CRUSH LIKES ME BACK I am actually just so happy right now I never thought the day would come,crush like actually happy right think day come
165018,I m done  years old  I ve smoked weed basically every day since I was   and there is absolutely no traction in my life  I don t want to do anything  I just want to get high  I enrolled in law school but went to like   classes this semester  My anxiety is way too fucking high around other people  and with the growing depression  I don t care enough to push through it I don t care about a job  I don t care about meeting other people  I want to be alone  or  preferably  to not exist  I ve had this thought for years  and it keeps getting louder and louder My life feels like a self fulfilling prophecy of failure  I ve been avoiding it more than living it for   years  Basically half my life  I ve been a non person as long as I ve been a person  So who gives a fuck if I end it,1,I'm 30 years old and I smoke weed every day. I enrolled in law school this semester but I don't want to go to classes. I want to be alone or preferably to not exist. My life feels like a self-fulfilling prophecy.,year old smoke weed day enrol law school semester not want class want preferably not exist life feel like self fulfil prophecy
