,text,class,summary,cleaned
66539,I m drunk and covered in blood  I can t live like this anymore  I cry everyday  I cut myself every day  I have to drink myself to sleep every night in order to avoid the UNFUCKINGRELENTING thoughts and memories  That s the absolute worth thing  The memories  Fuck them  Fuck my brain for not forgetting  I want a gun in my mouth so bad  I can t live with this weight in my chest anymore  I need to be free  Life is my prison  Death is my salvation  No more pain   No more memories  No more anything it brings a smile to my face just thinking about it  That s the only thing that makes me smile  A shotgun in my mouth  I m never going to know love  I m never going to know peace  I m never going to know tranquility  All I know is hate and disgust and conflict  Before you tell me to go to a therapist  I did  She told me I have post traumatic stress disorder  I stopped going after that  I m not strong enough to face that demon  I m surprised I made it this far but it s only a matter of time now  Soon I will sleep  I will know peace  I will fade into the deep of space  All will be forgotten  A clean slate  Purgatory  Heaven,1,"Drunk and covered in blood, he drinks to sleep every night in order to avoid the memories. He has post traumatic stress disorder. He wants a gun in his mouth to kill himself and forget the past. He is surprised to have made it this far.",drunk cover blood drink sleep night order avoid memory post traumatic stress disorder want gun mouth kill forget past surprised far
66540,How do you eat your steak  Blue  rare  med rare  medium  medium well  or well done  Those are your options and only   of them are acceptable,0,How do you eat your steak  Blue  rare  med rare  medium  medium well  or well done  Those are your options and only   of them are acceptable,eat steak blue rare med rare medium medium option acceptable
66541,I used to think about suicide  Then I realized death is nothingnessMy reasons for thinking about suicide might be silly for others  My reasons were boredom and mediocrity  When I was young  everybody including myself  believed I had great potential for success  But family circumstances prevented me from reaching that potential  I live a normal life  struggling like most people  I felt that that equated to failure  I wanted to die instead of having to work until I am   and just getting by  That s how I saw my future and I felt it wasn t worth living I still enjoy the little things though  A comfortable bed  watching my favorite shows  good food  a few treasured friends  If I kill myself  then what  Nothing  I  unlike others who want suicide  am healthy and not in pain  Would I really want to exchange those little things to nothingness  Even if at times I am burdened with regrets and self pity  there are still things worth living for and I only recently realized that it doesn t have to be those big things in life like a successful career or expensive travels  It s amazing that I am able to release myself from suicidal thoughts because of the little things  Those little things that I won t exchange from the nothingness of death,1,"I used to think about suicide. Now I realize that there are still things worth living for and I am able to release myself from suicidal thoughts because of the little things like comfortable bed, good food and treasured friends. I am healthy and not in pain.",think suicide realize thing worth live able release suicidal thought little thing like comfortable bed good food treasure friend healthy not pain
66542,In a bad placeI don t even know what to say I just feel terrible right now  I have for years but It s worse now  I think I am falling behind in my school work because I often skip classes because  I m too anxious and depressed  Yesterday I missed an exam that s worth a big portion of my grade and I m losing points because I keep missing classes   If I fall below a   GPA I ll lose my scholarship and get even more depressed but I just cant bring myself to do work or even attend because I just want to die  It would be better If I could get a job to pay for it if I did lose my Scholarship but I can t even get a job   I have been trying for years  I have failed every interview because I have extreme anxiety and aspergers syndrome  That s another reason why I want to die   I hate being a useless freak  I can t even make friends in real life and I can hardly even speak  I also feel like a horrible person because I had this guy  friend who was into me and I was finally honest with him and told him I was gay and it crushed him  I feel like a demon doing that to him when he s already going through tough times  Basically the gist of what I m saying is that I don t deserve to live and I m a failure and I want to die  I have tried getting help  Medicine and therapy and being hospitalized didn t do anything for me  I m just draining my mom s resources and being a pathetic burden  Even she s getting sick of me  I feel completely alone  I have a bottle of pills and alcohol and my brain is just screaming at me to do it  Im sorry for the long post,1,In a bad place. I feel terrible right now. I am falling behind in my school work because I often skip classes because I'm depressed and anxious. Yesterday I missed an exam that was worth a big portion of my grade and I'm losing points because I keep missing classes. If I fall below a GPA I'll lose my scholarship and get even more depressed. I can't get a job because I have extreme anxiety and aspergers syndrome. I had a guy friend who was into me and I told him I was gay and it crushed him. I have a bottle,bad place feel terrible right fall school work skip class depressed anxious yesterday miss exam worth big portion grade lose point missing class fall spa lose scholarship depressed not job extreme anxiety asperger syndrome guy friend tell gay crush bottle
66543,Is this normal  For some reason I haven t had a crush since I was   years old and a girl asked me out and since I didn t know what to do I had to tell her that I didn t feel like I was boyfriend material since I had no idea what I was doing two weeks later but I feel like I may have hurt her by doing that  Was I right to break up with her or did I screw up,0,"A girl asked him out but he didn't feel like he was boyfriend material, so he broke up with her two weeks later. He doesn't know if it was right to do that or if he has hurt her. He hasn't had a crush since he was a child.",girl ask not feel like boyfriend material break week later not know right hurt not crush child
66544,Tired and spentI don t think that anyone around me realizes just how serious my apathy is  Everyone hopes that I m  just going through a sad stage  but the truth is that I ve always been like this I ve taught and made myself believe that my sole purpose in life is to suffer  For whom and why  it didn t matter  I just needed to suffer in order to atone for whatever sins I may had done  My guilt and all of my rotten pleasures I feel so demoralized and alone in this world  I have yet to meet someone who knows and understands the meaning of causes Maybe I ve spent too much time alone  but I m starting to realize just how nihilistic everyone is  I m starting to see just how people revel in their ironic laughter at their  values  To be aware of just how empty their words are  and yet not understand them  It is madness I don t know what to do Change  I cannot change  it s my best trait  I avoided a fate more horrible than death by not changing for the sake of companionship  You don t have to believe me  and I m probably making a big fuss about it  but my isolated lifestyle gave me insight into things that the  socially trained  mind cannot pick up  It s what made me a better person  albeit naive I loved the idea of an orderly and just society more than I ve ever loved myself  I lived most of my life thinking about how I could do my part for the whole  Yet  if I die now  the negative impact on my little world would outweigh any good that I ve done Yet  I cannot live  I m too broken  Too insane with dissapointment  Drifting,1,"Tired and spent, she feels demoralized and alone in this world. She is starting to realize how nihilistic everyone is. She has always been like this. Her isolated lifestyle gave her insight into things that the socially trained mind cannot pick up. ",tired spend feels demoralize world start realize nihilistic like isolated lifestyle give insight thing socially train mind not pick
66545,How do you like you Marshmallows  Im just wondering,0,How do you like you Marshmallows  Im just wondering,like marshmallow wonder
66546,Swallowed a bottle of ibuprofenNot sure how much was left of it  I want to die  My only reason for living walked out the door  I m just so tired,1,Swallowed a bottle of ibuprofenNot sure how much was left of it  I want to die  My only reason for living walked out the door  I m just so tired,swallow bottle ibuprofen not sure leave want die reason living walk door tired
66547,My mum tried to kill herselfI m  F and last night my mum went to different bridges to kill herself but a woman stopped her so not sure what to do to help her,1,My mum tried to kill herselfI m  F and last night my mum went to different bridges to kill herself but a woman stopped her so not sure what to do to help her,mum try kill night mum go different bridge kill woman stop not sure help
66548,The loneliness is about to cause me to have another mental breakdown and honestly I can t take it anymoreLemme start this out with a few things I m   almost   I have seen no less than   different therapists  none have helped so I don t even bother anymore Now to the real meat of this insane rambling I ve been alone for a long time  I ve never had an irl relationship  I ve had several long distance ones but not in years  I m so fucking lonely I can t even meet people online anymore because I m so socially retarded that everyone who strikes a conversation with me gets bored and ignores me after like   exchanges  I hate myself  I hate having the personality of wet white paint  I m honestly considering just letting this mental breakdown happen  People are  of course going to tell me to work on myself but I fucking can t cause I m so goddamn lonely  I just want to not be lonely goddamnit  I m also broke so hooker are out of the question especially since where I live they re expensive as fuck  If I m going to die alone and unloved romantically  why suffer another   years,1,Loneliness is about to cause another mental breakdown for the lonely man. He has never had an actual relationship and he's been lonely for a long time. He can't meet people online because he's socially retarded. He's broke and hooker are out of the question as they're expensive.,loneliness cause mental breakdown lonely man actual relationship lonely long time not meet people online socially retarded broke hooker question expensive
66549,This has been really weird Like every single week day these past   months  would wake up at   eat a waffle  cry  get a blanket  sitting on my ass for   hours  doing any homework I need  then going to sleep for an hour or two  waking up and eating dinner  then go back to sleep  But now that I m on a break I have   idea what to do,0,"Every week I would wake up, eat a waffle, do homework, sleep, eat dinner and go back to sleep. Now that I'm on a break, I don't know what to do.    - ",week wake eat waffle homework sleep eat dinner sleep break not know
