,text,class,summary,cleaned
108233,Guess who s going to have to say awake for the reast of the day now  It s yeah boi  My sleep schedule is fucked and I can t sleep because I feel like someone is watching me  I m so much of a failure I can t even sleep right  I got to bed and my brain was like   Yeah  you know that built in feature your body is able to use direct after birth  Well  we can t do that  Maybe should try it again in   hours,0,"Boi's sleep schedule is messed up and he can't sleep. He will be awake for the rest of the day now. He should try to sleep again in hours.   .       ""I feel like someone is watching me"" ",boy sleep schedule mess not sleep awake rest day try sleep hour feel like watch
108234,I ve decided to end my miserable life today This may come off in a cheesy way but ever since I broke up with my High school girlfriend  I ve never been the same person I was and I have never been able to communicate or spark a conversation with any girl properly  I get curved every time I do make an attempt and each trial only makes me more nervous and anxious for the next  I consider myself to be a genuinely nice person but  yesterday was my very last attempt and I ve embarrassed myself to the limit  It s been   years since and the problem only gets worse   My friends have stopped talking to me as they think I m avoiding them but in reality I m only avoiding myself from making a bigger embarrassment of me  I ve got no one to go to or talk to about my self esteem and I m very emotional when it comes to these things and yesterday only made me realise I m just another useless  waste of human matter  who s got no hope in reality or life   My parents are too busy with their construction business and they hardly have time to listen to my problems  adding on to this matter is the fact that I m their least favourite child  unemployed and goalless  My only company is my cousin brother  who upon revealing my plan to end my life tonight  suggested me to make a post on this page  Now I doubt any of you would read this but I d really like to know what kind of scope I honestly have for the future  All the  There s definitely someone perfect out there who s waiting to meet you  crap is pointless to say as I ve lost my faith in it  given the number of people I ve talked to,1,"After breaking up with his High school girlfriend, he has never been able to communicate or spark a conversation with any girl properly. Yesterday was his last attempt and he embarrassed himself to the limit. His friends have stopped talking to him and he has no one to talk to about his self esteem. He is unemployed and his only company is his cousin brother.",break high school girlfriend able communicate spark conversation girl properly yesterday attempt embarrass limit friend stop talk no talk self esteem unemployed company cousin brother
108235,Holy shit I heard something It was from my top bunk right fucking above me  It was like a loud snapping noise  I am terrified for no reason  very much so an overreaction,0,Holy shit I heard something It was from my top bunk right fucking above me  It was like a loud snapping noise  I am terrified for no reason  very much so an overreaction,holy shit hear bunk right fucking like loud snapping noise terrify no reason overreaction
108236,Losing my will to continueI don t know if this is the right place to even post this  I have slowly drifted apart from all of my family members and my close friends  I find myself putting on a front every day pretending that I am happy but inside I feel nothing  My good days are marked with complete apathy and lack of feeling and on bad days i feel non stop anxiety and can t stop thinking about how I let those who are close to me down   I don t know exactly how to explain it  but I can feel a sense of despair  greif  and coldness start creeping in hours before I fall into a sense of depression which lasts from a few days to weeks at a time  One of the problems is that I do a very good job of appearing happy and well composed  but on the inside I m dead  I rack my brain thinking of how none of my friends truly like me  how i am a disappointment to my family  and I have failed at life This swing between complete apathy and roller coasters of emotions is extremely taxing and I am ready for it to be over  I feel guilty that there has been no major cause for me to be depressed and empty inside  I do not even deserve to feel depressed as I have not even faced a major crisis or any life changing occurrence that would warrant depression  I have no control over these emotions and they run my life  I have no one to talk to about these issues and I can not take it anymore   I feel like I am beyond repair and will never be able to   gain control over my life  I have fought thoughts of ending my life for years  but they grow ever stronger  Ending everything seems like the only way to stop this from occurring,1,I have lost touch with all of my family and close friends. I put on a front of being happy but inside I feel nothing. I have a swing between complete apathy and roller coasters of emotions. I want to end my life. ,lose touch family close friend happy inside feel swing complete apathy roller coaster emotion want end life
108237,Need advice on how to open upHow the hell am I supposed to tell my family about my suicidal thoughts so that I can get some help  I m young so I need their financial support for therapy and all that but I just can t imagine telling them about my problems  especially since I would seem like a little bitch for complaining about this shit since I haven t had a hard life at all  Also things would probably never be the same if they knew I felt this way and I would feel awkward as hell with them knowing this  I feel like even a therapist would tell me to stop being a pussy if I were to open up  Just need some advice,1,How am I supposed to tell my family about my suicidal thoughts so that I can get some help? I am young and need their financial support for therapy. I can't imagine telling them about my problems. I feel like even a therapist would tell me to stop being a pussy.,suppose tell family suicidal thought help young need financial support therapy not imagine tell problem feel like therapist tell stop pussy
108238,Looking for more options First time posting  First time talking about this at all  Ive been thinking about suicide for years  I have no job  Im about to be kicked out of college  and in return ill be kicked out of the house  No money and nowhere to go  Im not a smart man  I cant think straight and i havent been able to for years  I plan on parking my car in my garage and just listening to music before the monoxide gets to me  I said i dont mind dying  but I still want to live for alyssa and jake  i dont know what to do,1,"It's the first time someone has talked about suicide on a blog. It's because he has no job, he's about to be kicked out of college and he wants to live for his children. He wants to park his car in his garage and listen to music before the carbon monoxide kills him.",time talk suicide blog no job kick college want live child want park car garage listen music carbon monoxide kill
108239,Why is everyone   on this sub now Everywhere I look I see   flairs what happened,0,Why is everyone   on this sub now Everywhere I look I see   flairs what happened,sub look flair happen
108240,my only sibling is a therapist  amp  is horrible towards me but posts social media stories about helping others every single daythat s all  they make me want to die  i hate social media  amp  i hate my life,1,my only sibling is a therapist  amp  is horrible towards me but posts social media stories about helping others every single daythat s all  they make me want to die  i hate social media  amp  i hate my life,sibling therapist amp horrible post social medium story help single day want die hate social medium amp hate life
108241,Don t know any better subreddit to ask this so here I goes What s all this about daft punk on Reddit this week Edit  Damn  you guys have answered real fast  don t y all have anything better to do   not that I m one to talk though  I m here after all,0,Don t know any better subreddit to ask this so here I goes What s all this about daft punk on Reddit this week Edit  Damn  you guys have answered real fast  don t y all have anything better to do   not that I m one to talk though  I m here after all,don know well sub edit ask go daft punk geddit week edit damn guy answer real fast don well not talk
108242,Waifus count as partners I ain t single  I m committed to our relationship I can love her  You can t stop me,0,Waifus count as partners I ain t single  I m committed to our relationship I can love her  You can t stop me,waif count partner ain single committed relationship love stop
108243,guys my doctor told me that I had alzheimers also I want to mention I learned that I have alzheimers before I say anything else  I want to tell you that I am diagnosed with alzheimers guys I just wanna mention that I have alzheimers before finishing this post   also I learned that I had alzheimers today  just wanted to briefly say it,0,"Before finishing the post, I want to mention that I have been diagnosed with alzheimers and that my doctor told me that I had alzheimer's today as well. I just wanted to briefly say it to inform people that I am diagnosed.",finish post want mention diagnose alzheimer doctor tell alzheimer today want briefly inform people diagnose
108244,Girls are so sexy   like seriously girls are incredibly sexy  Idk why girls have been so attractive the past few weeks  Guys are good and all  but have you seen girls,0,Girls are so sexy   like seriously girls are incredibly sexy  Idk why girls have been so attractive the past few weeks  Guys are good and all  but have you seen girls,girl sexy like seriously girl incredibly sexy not know girl attractive past week guy good see girl
108245,Depressed exfiance  Hi guys  throw away account here  just looking for some advice here   I ve known my exfiance for about   years of my life and we ve been dating for half of that  engaged for the past year  I ve known he s been battling depression about   years ago  but after   suicide attempted  he got help and everything seems to have been ok since  But since we broke off the engagement  he s been so closed off  and whenever we speak  it s with increased irritability  indifference  and I know he s suffering from insomnia again   We were supposed to move to the east coast together  and he just told me the other day he doesn t feel well and thinks that by the time we were supposed to move  he won t be around to go with me  He admits that he thinks some of the symptoms seem to have resurfaced and I don t know what to do   Any advice would help  thank you,1,"My fiancé has been depressed since we broke off the engagement. He has insomnia again and he doesn't feel well. We were supposed to move to the east coast together, but he thinks he won't be around to go with me.",fiance depress break engagement insomnia not feel suppose east coast think not
108246,I want to give up on life I am   gay  jobless  and single  I moved from India to the States hoping to give myself a fresh start after a rather tumultuous childhood and teenage years trying to identify myself and pushing myself to fit in among people who dismissed me as being different  Among a Muslim family who do not know that I am gay  I am jobless today in a foreign land surviving on the last couple dollars I have and I keep getting rejected at job interviews  And for the record I have a masters in Electrical Engineering  something that I am not so passionate about but was hoping to switch careers once I gained my grounding here in the US  Nothing that sort happened  Life just pushed me back into the darkness yet again  I don t feel like going back home because I failed myself  my parents  and everyone who hoped that I would make it big  Never happened  I feel like a corpse starting to rot  No one to talk to about how I feel  I am lonely as shit  I try pushing myself with hope but things just don t seem to be happening I want to give myself some rest  I am drained both mentally and physically  Giving up is the only option I see for some reason,1,"After a tumultuous childhood and teenage years, he moved from India to the US hoping to give himself a fresh start. He is jobless, single and unemployed. He has a masters in Electrical Engineering and wanted to switch careers once he gained his grounding in the US.",tumultuous childhood teenage year move india hope fresh start jobless single unemployed master electrical engineering want switch career gain grounding
108247,Nou gaan jy weer Jy s  jy wil jou vryheid h  Wel wie is ek om jou onder te hou Dit is net regverdig dat u dit moet doen Speel hoe jy voel Maar luister mooi na die klank Van u eensaamheid Soos  n hartklop maak dit jou mal In Nou gaan jy weer Jy s  jy wil jou vryheid h  Wel wie is ek om jou onder te hou Dit is net regverdig dat u dit moet doen Speel hoe jy voel Maar luister mooi na die klank Van u eensaamheid Soos  n hartklop maak dit jou mal In die stilte van onthou wat jy gehad het En Nou gaan jy weer Jy s  jy wil jou vryheid h Wel wie is ek om jou onder te hou Dit is net regverdig dat u dit moet doen Speel hoe jy voel Maar luister mooi na die klank Van u eensaamheid Soos  n hartklop maak dit jou mal In die stilte van onthou wat jy gehad het En wat jy verloor het En wat jy gehad het En wat jy verloor het O donderweer dit gebeur net as dit re n Spelers  ek is lief vir jou net as hulle speel Hulle s  vroue  hulle sal kom en gaan As die re n jou reinig  sal jy weet Jy sal weet Nou hier gaan ek weer  sien ek Die kristalvisie Ek hou my visioene Dit is net ek wat wil Draai u drome op en Het u  n droom wat u wil verkoop Drome van eensaamheid Soos  n hartklop maak dit jou mal In die stilte van onthou wat jy gehad het En wat jy verloor het En wat jy gehad het Ooh  wat het jy verloor Donder  dit gebeur net as dit re n Spelers  ek is lief vir jou net as hulle speel Vroue  hulle sal kom en gaan As die re n jou reinig  sal jy weet O donderweer dit gebeur net as dit re n Spelers  ek is lief vir jou net as hulle speel Hulle s  vroue  hulle sal kom en gaan As die re n jou reinig  sal jy weet Jy sal weet Jy sal weet Ag  jy sal weet,0,Nou gaan jy weer Jy s jy wil jou vryheid. Luister mooi na the klank Van u eensaamheid Soos n hartklop maak dit jou mal. ,gain weer lister molina blank van mensa soon hart lop mark dit
108248,I just told my friend that I want to die and she left me on readMy family and my friends wouldn t even care if I was gone  I called my mother to tell her that I was having a bad depressive episode and she told me that she wish that  for once  we didn t have to talk about my feelings  I guess I should start thinking up a plan at this point,1,"My family and friends wouldn't care if I was gone. My mother wishes she didn't have to talk about my depression. I should start thinking up a plan now.       .   ""I want to die"". ",family friend not care go mother wish not talk depression start think plan want die
108249,I got sexualized for the first time yesterday  I gotta say  I did not hate it  So I m a femboy  Yesterday I bought my first pair of thigh highs socks and wanted to share it with the world  so I did on r femboy  A few hours later  some guy commented that I looked sexy in the stockings  I gotta say  I m not against that  Should I feel different about it  I m genuinely not sure  I think the worst part about this is that it s the nicest compliment I ve gotten in the last   months  So do any of you guys have any input,0,Femboy got sexualized for the first time yesterday. He bought his first pair of thigh highs socks and wanted to share it with the world so he did on r femboy. A few hours later a guy commented that he looked sexy in the stockings.,fem boy get sexual zed time yesterday buy pair thigh high sock want share world fem boy hour later guy comment look sexy stocking
108250,How moral it would be to blow half of my house to shits with gas I am probably going to a lot of lists with this one but things are fucked  so am I  so is my family  I can t get into their heads and maybe it is low serotonin or other chemical shit  but the amount of crippling depression terrorizing our tiny wee household is unbearable  The only reason I am still alive is because for my family things would only get a multitude of times worse  and I won t be able to rest peacefully knowing that because of this dumb and egoistical action some of the only people I hold dear will suffer much worse  Maybe blowing everyone up is a viable course of action  Must sound fucked  but it can spare a lot of trouble  I live in an apartment building  so I am wondering if the explosion would reach the neighbours and if there is any way to avoid that  Maybe give gas less time to fill the rooms up,1,Half of the house would be destroyed in a gas explosion to save the family from depression. The family lives in an apartment building and the explosion would probably reach the neighbours. It might be better to give the gas less time to fill the rooms up.,half house destroy gas explosion save family depression family live apartment building explosion probably reach neighbour well gas time fill room
108251,so  i told my crush i liked them  the title says it all  last night  at around   AM  i just said  i love you  i explained it further  and it kinda just happened  it felt really weird tbh because i honestly didn t expect my fantasies to come true  their response  though  was preeetty cool  it was kinda shakey  but i did it  it became reality  i guess i m pretty happy  nervous  too  hell  i m still confused that it even happened  it felt and still feels like a fever dream   so my advice to thee  do it  coward  set a deadline  however small or large it is  i just aligned it to the crescendo of my favourite song  though i replayed it a bit  as a mini deadline of fanfare and terrifying terrific trembles  don t be a pussy   this will self destruct in   seconds to   minutes to   hours,0,"Last night at around AM, she told her crush that she loved them. The response was cool, but it was a bit shakey. She still feels like a fever dream. She replayed the crescendo of her favourite song as a mini deadline.",night tell crush love response cool bit shake feel like fever dream replay crescendo favourite song mini deadline
108252,It feels like my life has come to an end I have been abusing DXM for this past week but I took a lot one night  a lot for me  and I am okay with dying now  While intoxicated I felt like I had died and I was a spirit  This feeling was very nice a brought peace to me   Obviously I am aware that when I actually die is I ll feel nothing  but I am still happy with dying  Nothing feels real anymore and I think that s because I am now living in a time I wasn t supposed to exist in I am in possession of around  mg of benadryl and I can use that to end my life I am sober now and have been since yesterday but I still feel this way  I have become emotionally disconnected from the world around me and I want to peacefully exit this life I still want to write some notes for people and some instruction on what I want done with my body so I wont die yet  I do not plan on abusing substances anymore either I will never be truly happy alive so I feel like this is the best option for me  I just wanted to share this before I do anything,1," DXM made him feel like he had died. He is sober now, but he still feels disconnected from the world around him. He wants to write some notes for people and give instructions on how to end his life. He doesn't plan on abusing substances anymore.",dam feel like die sober feel disconnect world want write note people instruction end life not plan abuse substance anymore
108253,It s been exactly   months  May   since  it  happened  and I m finally taking initiative to write my suicide note My plan is to write one huge all encompassing suicide note that closes off all loose ends with people  let s them know how much I loved them and that I forgive them for any rough spots we had  includes some form of informal will  where my possessions go  what to do with my body  etc  some suggestions for my funeral  although I ll mostly leave it up to then since funerals are for the living  some of my thoughts leading up to death  a link to some songs  a description of where I m going in heaven to make them feel like I m safe  and much much more  It s gonna be a lot of work  but it s my last big project before I die so I need to hit it home,1,It's been exactly months since it happened and I'm taking initiative to write my suicide note. It's going to be a lot of work but it's my last big project before I die so I need to hit it home. ,exactly month happen take initiative write suicide note go lot work big project die need hit home
108254,I may have committed a crime  suicide is better than jailI haven t been able to sleep or eat for two weeks  The paranoia is overwhelming that I m being investigated or the police are on their way to arrest me  I can t live like this,1,I may have committed a crime  suicide is better than jailI haven t been able to sleep or eat for two weeks  The paranoia is overwhelming that I m being investigated or the police are on their way to arrest me  I can t live like this,commit crime suicide well jail haven able sleep eat week paranoia overwhelming investigate police way arrest live like
108255,THE WI FI STILL AIN T ON A DUMBASS CRASHES INTO DA POLE  NOW THE WIFI FOR MY AREA IS BROKEN,0,THE WI FI STILL AIN T ON A DUMBASS CRASHES INTO DA POLE  NOW THE WIFI FOR MY AREA IS BROKEN,wifi ain dumb ass crash pole wifi area break
108256,So EmptyI made an alt  not that the only person in my life that knows my regular account gives a fuck to look at it  I ve just had a long and frank conversation with my I guess ex GF  on and off for the better part of a decade  She feels we have no future together  She s felt that way a long time  She doesn t trust me because I wanted to get close to her  I called it getting close  She maintains that I m clingy and I crush boundaries  She put up some  creative  boundaries too and I constantly seem to run afoul of them  The thing is  she can t enumerate them until I ve trounced all over them  I ve been trying so hard  Fuck  I let my friend die of cancer so I could look after her when she decided to quit eating  I should ve been there for him  but I was busy nursing her through her melancholy  Not even a thanks  no understanding for my viewpoint  just  nothing  Now I feel empty too  Like  why suffer more  You re laboring under a delusion  I ve been carrying this  mm round in my pocket for   months now  I told her I threw it away  but I may still have need of it  I don t always think about using it  but lately it seems the only remedy for my pain  My mind is in agony  my body slowly failing  My heart  busted into little pieces  I ve tried until there was nothing left to give  She took some of what I offered and threw the rest into the trash  I wish she d have tried  Or at least been more up front that she was just going to let me wear myself out trying  Now  the temptation to step out back and blow the top of my head off just seems  like the last option  Like I ve ground myself down  sequestered myself from other friends just trying to have something with her  and she let me think what i wanted  I hate feeling stupid  And that s about all I feel anymore  So fuck  maybe this  x  parabellum will clear my mind  I hate to leave such a mess on the porch  but she ll have her space,1,My ex girlfriend doesn't trust me anymore. She thinks I'm clingy and I crush boundaries. I let a friend die of cancer so I could look after her. She took some of what I offered her and threw the rest into the trash. ,sex girlfriend not trust anymore think clingy crush boundary let friend die cancer look take offer throw rest trash
108257,Every time i say i like boys with blonde hair and blue eyes they say  are you hitler    Bruh it s true tho blue eyes and like curly or poofy blonde hair is perfect,0,Every time i say i like boys with blonde hair and blue eyes they say  are you hitler    Bruh it s true tho blue eyes and like curly or poofy blonde hair is perfect,time like boy blonde hair blue eye hitler brush true blue eye like curly goofy blonde hair perfect
