,text,class,summary,cleaned
123833,Advice on friend grp ejection So i am part of a friend group of   people  One of the boys in the group and I had a relationship for over a year that recently ended   The issue is is that he was extremely possessive and manipulative and everyone only kept him around for my sake   I honestly have the most supportive friends ever  However now that we aren t together they really don t want him around  They despise him and now that I ve taken a step back I see why  He passed negativity to everyone   I don t want to make things worse so any ideas on ejecting him gently,0,One of the boys in the group and I had a relationship for over a year that recently ended. He was possessive and manipulative and everyone only kept him around for my sake. Now that we aren't together they don't want him around. He passed negativity to everyone.,boy group relationship year recently end possessive manipulative keep sake not not want pass negativity
123834,Anthony Bourdain s long burning suicidal wick  in his own words Anthony Bourdain s long burning suicidal wick  in his own words  https drive google com open id c xJS S XvS CXagIeQsg D vaWoW https drive google com open id c xJS S XvS CXagIeQsg D vaWoW,1,Anthony Bourdain s long burning suicidal wick  in his own words Anthony Bourdain s long burning suicidal wick  in his own words  https drive google com open id c xJS S XvS CXagIeQsg D vaWoW https drive google com open id c xJS S XvS CXagIeQsg D vaWoW,anthony board long burn suicidal wick word anthony board long burn suicidal wick word drive google com open d xes tvs cage wow drive google com open d xes tvs cage wow
123835,Day   of random questions What s your opinion on tipping,0,Day   of random questions What s your opinion on tipping,day random question opinion tip
123836,Is it possible to get a gf  This IS a genuine question as it seems no one i know has had a proper gf  Also I might be kinda  maybe just a lil lonely sooo,0,Is it possible to get a gf  This IS a genuine question as it seems no one i know has had a proper gf  Also I might be kinda  maybe just a lil lonely sooo,possible genuine question no know proper kind maybe oil lonely
123837,i hate this i hate thisi m so fucking stupid i can t do anything right i m too dumb for anything i hate myself more than anything,1,i hate this i hate thisi m so fucking stupid i can t do anything right i m too dumb for anything i hate myself more than anything,hate hate fucking stupid right dumb hate
123838,I think I m ready to die   EXISTENTIAL CRISIS I can t stop thinking about the paradox of free will  and I want to kill myself so I can stop thinking about it  Is there another way to remove individual thoughts from my brain edit  It says there is a comment on this post  but I guess the commenter must have been shadowbanned  because I can t see anything,1,There is a comment on this post but I can't see it because the commenter has been shadowbanned. I want to kill myself so I can stop thinking about the paradox of free will and edit the post to do it. ,comment post not commenter shadow ban want kill stop think paradox free edit post
123839,I m really confused like really fucking confusedI don t even know  I hate but love life at the same time  Kinda like a game and I m just a role  I also feel like my depression is fake  If I really wanted to I could snap out of it and I m just overreacting  I m finding humor in everything atm and constantly laughing my ass off  I don t take shit serious anymore  Unlike before I feel very light and frothy instead of emo and depressed  I don t feel real anymore like everything is fake at this point and I m kinda just going with the flow  It s like I m going insane  But every once in a while I snap back into reality and it all breaks down and I get a rush of intense emotions and become really suicidal and miserable but the next day I m totally fine  Like a zombie I feel like this day has been on repeat for the last   months  and it was like this before quarantine  Anyway my mental state is very inconsistent and I can t tell what I feel anymore   Did I mention that I let myself go this year and gained probably   pounds this year to my   self  To give you some background I was very much obsessed with my weight last year and lost a ton of weight unhealthily  I feel like shit about my body at the moment and that only causes me to stress eat and worsen the self hate cycle  I m suicidal but at the same time I m just chilling and enjoying lazying at home  But not very much enjoying since it s mostly self loathing  this was really repetitive but you get the gist The point of this was to kinda understand what I m going through cause I can t get through anything right now and I m in denial and am refusing to get therapy  If I keep going like this I think I ll mess up everything and end up in a hospital again if I go down this path and that inconveniences everyone because of my selfishness  I don t want to be fucked up the rest of my life,1,I'm confused. I hate and love life at the same time. My mental state is inconsistent and I can't tell what I feel anymore. I let myself go this year and gained probably pounds this year to my self. I'm depressed and suicidal. I refuse to go to therapy.,confused hate love life time mental state inconsistent not tell feel anymore let year gain probably pound year self depressed suicidal refuse therapy
123840,Put on a happy face  We live in a society,0,Put on a happy face  We live in a society,happy face live society
123841,Everything has gone to shitHonestly everything has really gone to shit  It all started out with my grandpa dying last month  My girlfriend showed no sympathy and when I asked her for some time alone she kept yelling that I was making excuses to fuck other girls  I would never cheat on her  My girlfriend of   years who broke up with me and now   weeks later is already seeing a bunch of other guys    days after  my dog died  She was my bestfriend since she was born five years ago and is now gone  I took the next day off work to build a casket for her and bury her  I didn t let my boss know and he fired me because of my performance for the last week which I had just been sad over because of my girlfriend which I completely understand  I have been looking for a job this past week and still nothing  I m not going to be able to pay rent this month and soon I ll be out on the streets  My family is all in Mexico so I have no help plus I don t want to ask them seeing as they sent me to this country to become successful and am now dirt poor  I m going to have to sell my grandpas motorcycle which he gave me when he died last month  Honestly  I have no reason to keep going  I want to end it all,1,Everything has gone wrong for him recently. His grandpa died last month. His girlfriend broke up with him weeks later. His dog died. He took the next day off work to build a casket for her and bury her. He was fired because of his performance. He can't pay rent this month. He's going to have to sell his grandpa's motorcycle.,go wrong recently grandpa die month girlfriend break week later dog die take day work build casket bury fire performance not pay rent month go sell grandpas motorcycle
123842,No intentions on hurting myself  but I just feel so alone in lifeBasically Im   with no friends outside of work  I have no one to talk to about problems  leading to me bottling everything up  I can hardly talk to other people  cant make friends let alone get a girlfriend  My partner at work has a great life  and always is talking about her friends dates  This is just a constant reminder of how much my life sucks and I ll be forever alone All I want in life is a friend and maybe a hug  Is that too much to ask for   I know a lot of you guys have it worse than me  just needed to vent for a minute,1,I feel so alone in life. I have no one to talk to outside of work. I can't make friends or get a girlfriend. My partner at work has a great life and always talks about her friends dates. I just want a friend and a hug.,feel life no talk outside work not friend girlfriend partner work great life talk friend date want friend hug
123843,Ayo can i get your hentai recommendations Regular  yaoi  yuri doesn t really matter,0,Ayo can i get your hentai recommendations Regular  yaoi  yuri doesn t really matter,ago yentai recommendation regular yuri matter
123844,I M SO HAPPY OH MY GOD I HOSTED AN AMONG US GAME AND LITS OF OF PROPLE PLAYED AND THERE WERE   PEOPLE WHO STAYED AND WE BECAME FRIENDS   OERSON HAD A TIK TIK SO I FOLLOWED THEM  ABD THE ITHER HAD A YOUTUBE CHANNEL SO I SUBBED  NOW WE CAN TALK TO EACH OTHER  I M SO HAPPY I DIDN T LOSE THEM,0,I M SO HAPPY OH MY GOD I HOSTED AN AMONG US GAME AND LITS OF OF PROPLE PLAYED AND THERE WERE   PEOPLE WHO STAYED AND WE BECAME FRIENDS   OERSON HAD A TIK TIK SO I FOLLOWED THEM  ABD THE ITHER HAD A YOUTUBE CHANNEL SO I SUBBED  NOW WE CAN TALK TO EACH OTHER  I M SO HAPPY I DIDN T LOSE THEM,happy god host game people play people stay friend person tip tip follow youtube channel sub talk happy lose
123845,I m doneNo matter how hard I try  I fail  My kids are at school and my gas electric just got shut off  I m not sure how I made it this long anyways  I think my kids would be better off with their grandparents anyways,1,I m doneNo matter how hard I try  I fail  My kids are at school and my gas electric just got shut off  I m not sure how I made it this long anyways  I think my kids would be better off with their grandparents anyways,moreno matter hard try fail kid school gas electric got shut not sure long anyways think kid well grandparent anyways
123846,Problem solvingAll my life I ve been told things can be fixed  things will get better  They do not  Do not ever believe anyone who says you can lead a happy life because they re wrong  They re just talking about their own ambition  not what could happen to you  You have to know that nobody cares about  you  They care about the effect on them  what they ll lose if you leave  You re truly the only person who has a proper interest in your life and if you don t feel like you can change then you re stuck  Forever,1,"Nobody cares about you. Nobody cares about the effect on them what they'll lose if you leave. If you don't feel like you can change, then you're stuck forever.    .      i",care care effect lose leave not feel like change stick forever
123847,what are the weirdest  SFW  subreddits you know  i don t want to know about p n subreddits  or gore subreddits  or anything like that  i just want to see some plain weird ones,0,what are the weirdest  SFW  subreddits you know  i don t want to know about p n subreddits  or gore subreddits  or anything like that  i just want to see some plain weird ones,weird see sub edit know don want know sub edit gore sub edit like want plain weird one
123848,I m not gonna die today but I certainly don t want to live I m not gonna die today I can tell you that  I always make posts on here but always seem to come back thanks to my survival instincts and shouts from my father bringing me back haha  Honestly I just feel such pain  I feel guilt  sadness  anger  I feel like whatever I do I ruin everything in my path  I m never good enough and I can t simply just love myself  I feel like I m gonna become like Ronald in the movie Bad Ronald  the isolation and pain is really getting to me,1,The isolation and pain is getting to me. I always make posts on here but always seem to come back thanks to survival instincts and shouts from my father bringing me back. I feel like I'm never good enough and I can't love myself. ,isolation pain get post come thank survival instinct shout father bring feel like good not love
123849,I really don t see the point anymoreI mostly post here to vent and whine at  am but no one ever responds because of the time so I guess this will just be a meaningless post  I just don t see the point  My life only leads up to hospitalizations because I m too pussy to kill myself and my therapist always threatens to have me court ordered to a psych hospital  But to be completely honest I usually don t think I have the balls to do anything  Well tonight I m completely considering it  I m a waste of space  I started cutting and smoking again because I can t deal with the crippling anxiety  depression  and PTSD  No one wants to hear it and no one is able to help  I know if I ended it I would end the good times too  but if there s all this suffering in between the good times then what s the point  I have friends and family that are loving and supportive and I know it would kill them to see me gone but I don t know how much longer I can do this,1,"I started cutting and smoking again because I can't deal with the crippling anxiety depression and PTSD. My therapist always threatens to have me court ordered to a psych hospital, but I don't have the balls to do anything. I have friends and family that are loving and supportive.",start cut smoke not deal crippling anxiety depression pt therapist threaten court order psych hospital not ball friend family love supportive
123850,Happy Birthday to anyone born on April  st I will do this everyday as long as I remember  I live in Australia so it will be a bit early for you guys but idrc  enjoy,0,Happy Birthday to anyone born on April  st I will do this everyday as long as I remember  I live in Australia so it will be a bit early for you guys but idrc  enjoy,happy birthday bear april st everyday long remember live australia bit early guy dec enjoy
123851,I feel like I ll never be taken seriously unless I attempt suicideThe title says it all  I ve been in the system for   years  I ve never had a formal diagnosis for some reason  guess I m not worth it  I ve been in therapy for two years and haven t made any progress  The therapist knows that I struggle with social anxiety  and that the issues surrounding that are what drive me to feel suicidal  He refuses to work on it with me  I saw a new psychiatrist today and told her the same thing  She prescribed zoloft even though I told her I have taken in before and it did not help  I didn t get anything for anxiety  I ll admit that I m looking for a benzo because I ve tried all the other anti anxiety meds  The funny thing is that I know drug addicts who were able to get benzos  as well as people who don t even have anxiety  I m not sure why I m getting a  fuck you  but here I am I feel like I won t be taken seriously unless I do something drastic  I don t want to  but I have no other choice at this point,1,I have been in therapy for two years and haven't made any progress. The therapist knows that I struggle with social anxiety and that the issues surrounding that drive me to feel suicidal. I saw a new psychiatrist today and she prescribed zoloft for anxiety. I'm looking for a benzo.,therapy year not progress therapist know struggle social anxiety issue surround drive feel suicidal see new psychiatrist today prescribe zoloft anxiety look benz
123852,i don t deserve to be happy rn  im failing   classes and i woke up having an anxiety attack yesterday was probably the worst anxiety i ever felt but today im fucking happy af No one ever had much nice to say I think they never liked you anyway,0,i don t deserve to be happy rn  im failing   classes and i woke up having an anxiety attack yesterday was probably the worst anxiety i ever felt but today im fucking happy af No one ever had much nice to say I think they never liked you anyway,don deserve happy right fail class wake have anxiety attack yesterday probably bad anxiety feel today fucking happy no nice think like
123853,when do you know to get helpI m afraid I m going to kill myself  I see a therapist regularly and have confessed these feelings to her  but I feel them so intensely now that I m afraid for myself especially in the coming days  I m afraid what a hospitalization would do to my family  but I feel like I need help  I already deal with self harm and relapsed today  I m   please help,1,I'm afraid I'm going to kill myself. I see a therapist regularly and have confessed these feelings to her. I already deal with self harm and relapsed today. I'm afraid what a hospitalization would do to my family. ,afraid go kill therapist regularly confess feeling deal self harm relapse today afraid hospitalization family
123854,why is new so dead today are yall ok,0,why is new so dead today are yall ok,new dead today
123855,plz comment anything  thanks i just want to be entertained   cheered up right now,0,plz comment anything  thanks i just want to be entertained   cheered up right now,ply comment thank want entertain cheer right
123856,It s pretty clear  I either wipe the slate and move out  Or I kill myself  HelpI just can t stand it anymore,1,It s pretty clear  I either wipe the slate and move out  Or I kill myself  HelpI just can t stand it anymore,pretty clear wipe slate kill help stand anymore
123857,My Dad  the AssholeHey everybody  I m fairly new to Reddit still and trying to find the appropriate place to write  Hopefully I m in the right area Anyway  I am   years old  I am attending college right now and live with my parents and five other siblings  My dad is the issue though because he is never happy about anything  not even his own kids  I m   percent sure he s bipolar as well as schizophrenic and severely depressed  He became disabled in   when his diabetes took his sight to the extent that he can no longer drive nor work  He s never happy for any body though and he s always complaining about my mom and how she never does anything at work  My mom is a personal care assistant and thus  takes care of elderly people who need assistance in being cared for  I think he has no room to talk because he no longer works and whatever he does contribute to the family is monetary  Money is great though  I guess I m just trying to ask about different coping techniques to practice  How can I ignore him   Before you suggest moving out  I can t  I left my job last June and am aware of the huge mistake I have made for myself  I can t concentrate well enough to pass the driving test to get a license even  I have become so stressed to the point of leaving all my friends in reality and secluding myself due to embarrassment of my lack of achievement  I m not trying to compare myself to them but when your own father is a huge piece of shit who isn t happy for anyone and one day yells at you  calls you retarded  doesn t recognize your sexual orientation and then another day  is completely fine and dandy playing video games on his tablet  it becomes a crippling thing  I have no sense of identity and no motivation I m not suicidal but I don t know where else to put this  Thanks for reading,1,"My dad is bipolar, schizophrenic, severely depressed and disabled. He's never happy for anyone, not even his own kids. My mom is a personal care assistant who takes care of elderly people. She left her job last June. She can't concentrate well enough to pass the driving test to get a license even though she's stressed.",dad bipolar schizophrenic severely depressed disabled happy not kid mon personal care assistant take care elderly people leave job june not concentrate pass drive test license stress
123858,I tried my hardest I really did I tried socializing more  exercising more  cleaning myself more and my dirty room as well but none of it helps  I m sick of hearing the same old things from my psychologist  she doesn t understand the crippling loneliness and depression I m going through  if it was just as easy as going out and putting a smile on my face then I d be cured ages ago but no  I am ill and I have been for years  let s face it it probably wont get much better in the future either  If I kill myself they ll call me lazy and selfish  but I tried my best I really did  waking up every god damn morning  having to force a smile for the teacher who never appreciates me and trying to fit in with groups of people who didn t even want me there  Honestly I m so sick of it all  why me  why,1,"Loneliness and depression are the main reasons why I suffer from depression. I tried everything to help but it doesn't help. I'm sick of feeling lonely and depressed. I don't want to kill myself, but if I do, people will call me lazy and selfish.",loneliness depression main reason suffer depression try help not help sick feel lonely depressed not want kill people lazy selfish
123859,Im internally angry without much reason  any tips on calming down  im just pissed and idk why,0,Im internally angry without much reason  any tips on calming down  im just pissed and idk why,internally angry reason tip calm pissed not know
123860,I ll probably buy rope tomorrowIf the weather s good I ll run downtown and pick some up  I ve been telling myself the same thing every night this past week  but this time I think I ll actually do it    I m just not getting better  and in fact  I don t even want to get better  I m just done  with everything    Although I know this is all just gonna end with me backing out at the last second for the umpteenth time    But I hope this time is different,1,"Tomorrow if the weather is good, I'll go downtown and buy rope. I'm not getting better and I don't even want to get better. I know it's just going to end with me backing out at the last second for the umpteenth time.",tomorrow weather good downtown buy rope not get well not want well know go end back second umpteenth time
123861,I m bored and lonely and tired  Anyone down to talk  Or play the number game  I might fall asleep soon but I m lonely as fuck and am looking for a distraction   f  Dm if you want,0,I m bored and lonely and tired  Anyone down to talk  Or play the number game  I might fall asleep soon but I m lonely as fuck and am looking for a distraction   f  Dm if you want,bored lonely tired talk play number game fall asleep soon lonely fuck look distraction want
123862,Blue eyed people are the weakest links to society They re so overdramatic and for what,0,Blue eyed people are the weakest links to society They re so overdramatic and for what,blue eyed people weak link society dramatic
123863,It s   your in the peek of your  s  you and your goth gf bf lay down on the couch and turn on your favorite ghibli film while slowly falling asleep In each other s arms  Life gonna be alright for a while,0,It s   your in the peek of your  s  you and your goth gf bf lay down on the couch and turn on your favorite ghibli film while slowly falling asleep In each other s arms  Life gonna be alright for a while,peek goth lay couch turn favourite chilli film slowly fall asleep arm life go alright
123864,Can a boy and a girl be friends,0,Can a boy and a girl be friends,boy girl friend
123865,If my personality is SOOOOO bad Then why did this girl tell me that i have a rly good personality and she likes me  She just happened to be blind enough to find me attractive and that proves its all about looks,0,If my personality is SOOOOO bad Then why did this girl tell me that i have a rly good personality and she likes me  She just happened to be blind enough to find me attractive and that proves its all about looks,personality bad girl tell good personality like happen blind find attractive prove look
123866,These are not my thoughts and feelings  They re ruining my life Please help me  I feel like I m being invaded every time this happens  I want to be happy  I am usually happy  My life is great   So why do I have such horrible thoughts  Why do I fight with everyone and keep thinking about killing myself I feel like I m trapped in my own head  I call the resources but I can t explain anything  My life is good  Why don t I want it anymore Edit  please help me understand  I need a name or something  What do I tell doctors  I have no hunger  no position I m in is comfortable  I have headaches and cramps  My skin feels like it s hypersensitive  it hurts when I tOuch it  And these thoughts  I m trying so hard to leave my house  I m making every excuse to get away from the things I could use to hurt myself  But I m so tired  I tried reaching out to friends but I can t express why I need them  They think I m just bored  Please help me  I need this to stop  It s ruining my life I can t keep doing this,1,My life is good but I keep thinking about killing myself. I don't know what to do about it. I can't explain why I have these horrible thoughts. I'm tired of fighting with everyone and trying to escape from the things I could hurt myself.,life good think kill not know not explain horrible thought tired fight try escape thing hurt
123867,Anyone gone for a life reset instead of going through with it I m talking like cut all ties and sell everything you can to pick up and go restart somewhere else  To me  both options feel similar in outcome even though clearly they are different,1,Anyone gone for a life reset instead of going through with it I m talking like cut all ties and sell everything you can to pick up and go restart somewhere else  To me  both options feel similar in outcome even though clearly they are different,go life reset instead go talk like cut tie sell pick restart option feel similar outcome clearly different
123868,Lonely plz help I m really akward around others and struggle with social interactions  I m usually just the friend who is there but doesn t so much  I never get invited to do anything and I don t know how to get more popular  more social  Any tips on how to think  what to do to get out my lonely bubble,0,Lonely girl is looking for advice on how to get out of her lonely bubble and be more social with others. She doesn't know how to become more popular and social.    She is lonely and feels awkward around others.,lonely girl look advice lonely bubble social not know popular social lonely feel awkward
