,text,class,summary,cleaned
213151,i hope to see her when i sleep when her arms come up and rest upon my neck and her lips purse to a peck who is this girl i see at night i may never see her once i awake so no chances i will take i will sleep until i cant no moreim sorry,1,i hope to see her when i sleep when her arms come up and rest upon my neck and her lips purse to a peck who is this girl i see at night i may never see her once i awake so no chances i will take i will sleep until i cant no moreim sorry,hope sleep arm come rest neck lip purse peck girl night awake no chance sleep not no sorry
213152,i just dont wanna fight myself anymore ive felt this way since i was a kid i know life has made me strong i know i can keep going but i dont want to i just want it to be over i dont want to hurt the people in my life but i dont want to be here life has given me no reason to believe its ever going to be anything more than what it has been i have no hope for the future and i dont want to keep getting hurt i think about this stuff all the time i try to talk to people about it but ive heard it all before nothing anyone says can make me feel any different i just dont feel like the good is worth all the bad,1,Life has made me strong but I just want it to be over. I have no hope for the future and I don't want to keep getting hurt. I try to talk to people about it but they don't help. ,life strong want no hope future not want get hurt try talk people not help
213153,i feel like its all been a lie i just want to get my thoughts out i dont know who to go to i dont need reply or care reallyi am18 i just graduated high school and ive seemed to have always lived with depression everyone always said it will get better life gets better and in a way they werent wrong my urge and need to die has lessened though i really wish it hadnt my life has completely gone to shiti amliving paycheck to paycheck trying to finance moving in with my girlfriend after she gets home from basic training for the army ive never gone to bed hungry until recently ive never limited myself to one meal a day because i cant afford it i lay at home wheni am not working waiting for my motivation to come home because shes the only thing that makes me feel good for anything greater than a fleeting momenti am so disappointed in myself for not attending college yet and i dont know if i ever will though i know i wont find life meaning without pursuing science its my only career interesti am looking forward to an empty life knowing theres only one option i know i could end all the problems and seemingly endless suffering right now but i am too scaredi amonly hoping i reach a breaking point and it gets the better of me i dont want to watch myself get any worse but theres really nothing i want to do i want to pursue a career in something i love but then i realize i dont love any of it anymorei am so hollow ive become a man but my soul never grew with mei ambasing everything i enjoy by the fact i used to please let tonight be my last or give me the strength to make it so,1,"18-year-old is struggling with depression. He wants to move in with his girlfriend after she gets home from basic training for the army. He is disappointed in himself for not attending college yet. He would like to pursue a career in something he loves, but he doesn't love any of it anymore.",year old struggle depression want girlfriend get home basic training army disappoint not attend college like pursue career love not love anymore
213154,realisation time to vanish were to startive got bipolar and whilst writing thisi amon a serious down so its a struggle to even attempt to express my feelings but i feel kinds hopeless i believei amonly truly happy when ive got something to look forward too that thing was university this has suddenly been snatched from me as i was not invited to join back the second year of my college course reasoning behind this is because i work 50 odd miles away from the college and unlike students therei amolder 21 so have responsibilities and such luckily ive been offered a position at another college to do their send year this means though my job i currently have wouldnt be possible to do anymore as its too much of a journey so that part is really getting me down and also ive had a really rough time whilst being at my parents house my mother despises me and my farther left before i was born and refuses to acknowledge my existence meaning the 2 people who are meant to be there for me dont give a shit it sucks because me and my mum used to be inseparable and she was like my best friend now she wont even answer me when i talk to her just ignores me so leaves me feeling alone i also have a girl ive been seeing but because of my bipolar it makes not so hard to even show emotion towards her i dont miss her and that worries me but i just dont feel it i wouldnt be upset if she left me but i dont want her too i just want to feel normal and not a emotionless twatfeel like theres nothing left we live we die whats the point of waking up unhappy ,1,At university he was not invited to join the second year of his college course. Now he has been offered a position at another college to do their send year. He works 50 miles away from the college and has responsibilities. His parents don't accept him and his girlfriend doesn't care about him. He is bipolar.,university not invite join second year college course offer position college send year work mile away college responsibility parent not accept girlfriend not care bipolar
213155,i just want someone to talk to i dont want to do this alone i finally built the courage to tell the one person that i can go to that i was going to kill myself he blew me off now i have nobody i know its pathetic but i just need someone to talk to i just dont want to be completely alone when it happens,1,"After telling the one person that she can go to that she was going to kill herself, he blew her off. Now she has nobody to talk to. She doesn't want to be completely alone when it happens, she just wants someone to help her.",tell person go kill blow talk not want completely happen want help
213156,nothing changes i used to be a drug addict and dealer i hated my life and everyday i hope i would find the drive to kill myself or overdose one day i thought it was my rock bottom nowi am sober and somehow managed to get to a job the pays extremely well but i still want to die more now than back then every single day for most of the day i think about it i look at myself in the mirror and i want to put a bullet through that persons headi amscum and i dont deserve life love happiness friends and family i cant keep on like this for much longer i already have for far too long,1,"I used to be a drug addict and dealer. Now I am sober and I have a job, but I still want to kill myself every day. I look at myself in the mirror and want to put a bullet through someone's head. ",drug addict dealer sober job want kill day look mirror want bullet head
213157,how to stay happy i have posted on here several times before each time i have been talked out of killing myself however i am tired of being talked out of it i want to either stop being miserable or just die i recently quit my job at mcdonalds because it was making me more suicidal than ever and have been going to college i am scared of my horrible grades as i think i may go on academic probation after that i will have large student loans pilled up on my head no job and no way to ever get a job that isnt a dead end job that makes me want to kill myself therefore i have decided if i go on probation i will kill myself i have gotten obsessed with the idea of death lately i think about what death would be like and ways i could quickly die about 70 of the day what is bothersome to me is that other people who have the same situation or even worse situations are able to stay happy this is frustrating to me not because these people are happy but because i feel like i am completely missing something that these people are is it genetic is it a mindset if it is either how could we ever change our mindsets or genetics after all we are who we aretldr i am extraordinarily unhappy because of many situations and am likely going to kill myself at the end of the semester unless i can find a way to stay happy i am tired of being talked out of it this is a final decision instead i want advice to be happy,1,"At the end of the semester, if she doesn't get better grades at college, she will kill herself. She wants advice on how to stay happy, because she is unhappy and wants to stop being miserable or die. She thinks about death about 70% of the day.",end semester not well grade college kill want advice stay happy unhappy want stop miserable die think death day
213158,i think ive realized what hurts the most about all of this and thats that i didnt even get a choice i was born with this difference disorder i willness whatever you want to call it i didnt get to choose to be normal and even if i had started the treatment options earlier my body and mental health would have always been fucked i cant stand being trans if i wake up tommorow still feeling dysphoria i might really end it ,1,"If she wakes up tomorrow still feeling dysphoria, she might end it. She doesn't want to be trans anymore because she was born with this difference disorder and she didn't get to choose to be normal. If she had started the treatment options earlier, her body and mental health would have always been in decline.",wake tomorrow feel dysphoria end not want tran anymore bear difference disorder not choose normal start treatment option early body mental health decline
213159,i think my mom is going to kill me i dont want to die right now i love my friends too muchbut i might have to my sisters boyfriends mom wants to talk to me i am in a mental health awareness club that my mom doesnt know about and so is my sisters boyfriend my mom is deep in denial that i have any kind of mental i willness and has invalidated me mocked me screamed at me and threatened to hurt me for showing signs i wasnt supposed to let anyone at school know i have to find places to hide ifi am going to break down at school because if the counselor knows my mom will somehow find outmy moms on the phone with his mom right now the club is the only thing my sisters boyfriend and i have in common if my mom finds outi am not sure what shell doi am going to try to tell her its just for leadershipto help friends but i am really scared my mom screamed at me and called me a lazy ass because i told her i was slightly anxious about school i dont know whats going to happen and i dont want to live in an environment where its not safe for me in any way i dont want to live thinkingi amalone in this if my mom finds out i think i will have to or i could just not live at allto whoever is reading this i love youi am sorry you were brought to this sub and i hope with all my heart things get better for you i am going to do my best to stay alive for my friends and i hope youll find a reason as wellill try to update thisthank you for listeningedit it was a false alarm she wanted to talk about something elsei am so relieved but my heart is still racing it sucks to be living in an environment that scares me as much as it does but thank you for caring you guys were there even when i thought i was going to die that means a lot to me thank you i love you guys,1,My mom wants to talk to me about the fact that I'm in a mental health awareness club. My mom is in denial that I have any kind of mental illness. My sister's mom is on the phone with her boyfriend's mom right now. I don't want to live in an environment where it's not safe for me. ,mon want talk fact mental health awareness club mon denial kind mental illness sister mon phone boyfriend mon right not want live environment not safe
213160,i am tired of being transgender my biggest problem with being trans is that i feel no one believes me even cis people that understand or say theyre an ally it feels like everyone around me thinksi amcrazyi am not really a woman trapped in a male body i just think i am and you know what maybe its truebut that doesnt make it hurt any less every time i see a group of girls talking about nothing knowing that i will never join them never be one of them it feels like being punched in the gut and it doesnt go away everyday again and again ifi amjust crazy its damned persistenteverything i see online and at work tells me that the trans community will never be accepted feminists see us as men and dont want us anywhere near them lesbians see us as men and i amattracted to girls lucky me s men just see us as gay gay guys want to drop the t from lgbt altogetherthe only treatment for being transgender is to transition but asi amconstantly reminded that wont make me a real woman so whats the pointand so this is why i want to kill myself its become increasingly obvious to me that trannies have no place in this world i have no place in this world and i amdone fighting my dysphoria everyday only to be mocked and told thats its not realits just not worth it anymore,1,"Transsexuals have no place in this world. Transsexuals are not accepted by feminists, lesbians and gay men. The only treatment for being transgender is to transition, but that doesn't make me a real woman so I don't see the point.",transsexual no place world transsexual not accept feminist lesbian gay man treatment transgend transition not real woman not point
213161,i hope i get killed before i kill myself someone pm me please i dont want to do iti dont want to die at all i just want the pain to end if i die i want it to be quick like a car crash i could handle that because at the end of the day my mom wouldnt be the mom with the depressed kid shed be the unlucky mom there wouldnt be anything she couldve done to prevent it i dont want my friends beating themselves up over a problem they couldnt fix theyd remember the good qualities i had the school wouldnt have any class about depression and how to tell the signs theyd just hold a small vigil no one would go to and id be forgotten as quick as the crash was ,1,"If I die, I want it to be quick like a car crash. I don't want my friends beating themselves up over a problem they couldn't fix. The school wouldn't have any class about depression and how to tell the signs.",die want quick like car crash not want friend beat problem not fix school not class depression tell sign
213162,amstarting to have suicidal thoughts ive always told myself that i wouldnt succumb to my emotions especially after my brother took his own life a couple of years back my thoughts on the topic of suicide have gradually grown over timeim sustaining myself with a job ive worked for 3 years now and i amcurrently enrolled in college ive had to see every single one of my friends go on to do better things while i sit here doing the same old shit and have the feeling thati am not making progress i lost the best girl i ever had in my life because i let my anxiety get the best of me and ruin the relationshipi tend to talk to myself and sort issues out and i try to tell myself that its all temporary but i amstarting to lose faith i found myself today planning it all out in my head while i was at work i dont know if id actually go through with it but i actually thought of how and when and should i write a notei dont know whats wrong with me and it might just be a phase but its getting worse,1,My brother took his own life a couple of years ago. I have been working for 3 years and enrolled in college. I lost the relationship because I let my anxiety get the best of me and ruined the relationship. I am starting to have suicidal thoughts.,brother take life couple year ago work year enrol college lose relationship let anxiety good ruin relationship start suicidal thought
213163,i want to die but i ama coward i have been suicidal since the age of 6 but never went through with it why because i am a fucking coward i dont have the balls to do anything including killing myself the only reason that i have lived this long is becausei ama fucking pussy well ive found a way to get past all that when i get extraordinarily high in combining whatever the fuck i have on me that fear disappears all i want to do is die and i amready to do it all i have to do is pop those pills drink a ton while tripping and i amgood to pull the fucking trigger itll be quick i wont feel a damn thingi ama failure as a human being and i dont belong in the gene pool the sooner i kill myself the sooner itll all be over and nothing will matter at all by thenwhat is the fucking point of living like this,1,"Suicide has been a problem for him since the age of 6 but he's never gone through with it because he's a coward. When he gets high, he's able to kill himself. He doesn't have the balls to do anything.",suicide problem age go coward get high able kill not ball
213164,i feel likei amlosing my friend and idk what to do so my friend has recently lost friendship with his best friend it looked complicated and she was very in love with him they stopped being friends for unrelated reasons he is very depressed and doesnt take his depression seriously or believes he is i feel like hes pushing everything back and acting tough so he does not get help for him self and hes had a suicidal history ever since losing his friend his personality is nonexistent now he was down and depressed looking before they met but i thought it was his regular personality after he met her he would actually smile occasionally and be in a completely different mood so it finally clicked and i realized he shouldnt be that way now hes way worse than beforei amafraid hes not taking care of himself hes closed off so idk how to go about asking him without making things worse idk any close friends of his who i can tell idk what to do and i amafraid time is ticking any suggestions,1,My friend has recently lost his friendship with his best friend. She was very in love with him and they stopped being friends for unrelated reasons. Now he is depressed and isolated. He doesn't take his depression seriously. He has a history of suicidal thoughts. ,friend recently lose friendship good friend love stop friend unrelated reason depressed isolated not depression seriously history suicidal thought
213165,amafraid to go the my therapist in college abroad and after a week of my exam i got my results and i amdevastated luckilyi am not failing but my grades are lower than what i expectedi amjust hoping that i can manage until the end of the semester ive tried to handle the start of my college and it has been difficult the worst part is thati amafraid to go to classes because once everything crams together its going to be difficult for me to handle ive been going to my counselor frequently and i took this suicide test or something it felt kind of useless since it follows through a score or something and she advises me to schedule an appointment with a therapist or a psych the hard part is thati amafraid to hear the result thati amfilled with anxiety or even depression,1,"After a week of her exam, she got her grades. She is not failing but her grades are lower than she expected. She has been going to her counselor frequently. She advises her to schedule an appointment with a therapist or a psych. Now she is afraid to go to classes.",week exam get grade not fail grade low expect go counselor frequently advise schedule appointment therapist psych afraid class
213166,can someone talk to me ca i called the hotline a bunch of times and they tele me to to therapy or dont bother them is there anyone at all who would be willing to talk to me dm for my phone number,1,can someone talk to me ca i called the hotline a bunch of times and they tele me to to therapy or dont bother them is there anyone at all who would be willing to talk to me dm for my phone number,talk call hotline bunch time tell therapy not bother willing talk phone number
213167,wanting to end it all soon in a week or so because of what happened i fucking almost got myself and dad in an accident while i was practicing driving i cant handle driving anymore its too dangerous for me and i ama whimp i also tried self harming and attempted to scratch my arms but there was little white marks that had minor pain because of i was a pussy of doing so one of the scariest shit happened to me when i was driving so the light turned yellow then to red and i stopped in the middle of an intersection luckily the car packed up and then i hit park got all nervous and hit drive my dad got so pissed and said you stupid you shouldnt have stopped in punjabi for stupid i am not stupid though i legit panickedi am sorry for posting here again all these mistakes are killing me its best if i dont drive at all its not very safe for me and riskyi am really selfish in this and lately ive been giving people attitude i dont deserve to live i want to end it soon some of the posts here unanswered makes me feel really sad ,1,"In a week or so, when she was practicing driving, she almost got herself and her dad in an accident. She also tried self harming and attempted to scratch her arms. She is sorry for posting here again, because some of the posts make her feel sad.",week practise drive get dad accident try self harm attempt scratch arm sorry post post feel sad
213168,i think my friend killed herselfi am in vacation right now my third day here my friend always told me since i mentioned the trip that i shouldnt go jokingly or at least i thought i found out yesterday as she told me that she didnt eat all day and cut herself she was now at the hospital and i wasnt that worried because it seemed like she was going to be fine i couldnt sleep last night so ive been sending her many messages hopping shell react with a smile as she wakes up but i amafraid she wont one of the last things she told me is that they gave her something the doctors and she was feeling dizzy i feel like just maybe that wasnt a good sign i never cry because i cant but i now am tearing up a little i hope that shes actually just sleeping but i have no idea and that is killing mei am honestly thinking of killing myself if she does it whats the point she was and hopefully is my best friend even though i hate classifying my friends we kissed before i left and i honestly like her i just dont want her to be gone i cannot wait to get back to my home country to hopefully see heredit i got a text from her facebook account it said that she had passed away however like five minutes later she said it was just a prank and even though that is one of the worse pranks ever at the end i loved it a prank because it meant that she was still living,1,"My friend cut herself and is in hospital. She was on vacation with me. I kissed her before I left and I like her very much. She texted me that she had passed away, but five minutes later she said it was a prank.",friend cut hospital vacation kiss leave like texte pass away minute later say prank
213169,jumping ive gotten so obsessed with jumping i cant go 15 minutes without thinking of jumping i just wanted to get this off my chest while i ruminate more on jumping,1,jumping ive gotten so obsessed with jumping i cant go 15 minutes without thinking of jumping i just wanted to get this off my chest while i ruminate more on jumping,jump get obsessed jump not minute thinking jump want chest ruminate jump
213170,to those who stopped before attempting suicide what made you stop i will share my story since i asked the questionfor me i was sitting in my restroom at home with a loaded visa card looking to buy carbon monoxide when i found it i started shaking uncontrollably and after i started crying i realized i wasnt going to go through with the actwas wondering do you guys have a point in time where you just stopped and decided you were going to try this thing called life again thanks,1,"To those who stopped before attempting suicide, what made you stop? I will share my story since I asked the question. I was sitting in my restroom at home with a loaded visa card looking to buy carbon monoxide when I started shaking uncontrollably and after I started crying, I realized I was not going to go through with the act. ",stop attempt suicide stop share story ask question sit restroom home loaded visa card look buy carbon monoxide start shake uncontrollably start cry realize not go act
213171,i just am so tired i know ive posted a lot on herei am really sorry but i am15 and i amjust so tired of this depression its been three months 3 suicide attempts and my family really emotionally abuses mei am so exhausted of fighting this i cannot even breathei ambreaking down just sobbing becausei am so so depressed i have been 16 days clean from self harming and its been hell i just dont know how to handle this depressioni amdrowning please any suggestions ,1,"15-year-old has been depressed for 3 months and has tried to commit suicide 3 times. She has been clean from self harming for 16 days now, but she is still depressed. She doesn't know how to deal with her depression.",year old depress month try commit suicide time clean self harm day depressed not know deal depression
