,text,class,summary,cleaned
49682,I m Officially Done  I think I m cursedI have no skills  I m struggling to grow a business because I have no money  I can t deliver with postmates because my parents started door dashing  Because apparently both of them having jobs isn t paying the fucking bills  I can t get a job either because it will take forever and I ll have to take a bus or Uber there  because like I said I have no money I don t even know why I try  I tried every way to make money  I tried to think positive and find ways around it  None of it worked  So I m done thinking positive and I m done trying  I m just going to keep failing if I try  I won t make any results I ve been trying for months  but now I think I m borderline cursed  By some black magic or something  There is no other cause  It can t be coincidence  I can t fail THIS many times  I m at the point where I have ZERO ways to make money All I can do now is ask the internet for money Like that will ever happen If you want to help me the least you can do is tell me how to end my life quickly and painlessly without spending money DO NOT try to help me  DO NOT pity me  I want to die  I know no one will listen so anyone that does this is going to really get it,1,Neither of her parents has a job and she has no money. She can't deliver with postmates because her parents started door-dashing. She doesn't know why she keeps trying to make money even though she's been trying for months. She thinks she's cursed by some black magic or something.,parent job no money not deliver post mate parent start door dash not know keep try money try month think curse black magic
49683,I m bored Pm if you want just typing so my post doesn t get removed now,0,I m bored Pm if you want just typing so my post doesn t get removed now,bored pm want type post remove
49684,I don t want to die  I just want to stop existing I don t want to live anymore  but I do not want to hurt the people who love me  I don t even know why I feel like this  I just feel like I want to be gone forever  I have a family who loves me  a boyfriend who daily tells me that I mean the world to him  but still I feel like everyone would be better of without me  I ve tried reaching out to doctors  counselors  but no one seem to have any appointments for me  sick I know  I just don t know what to do  Please help me,1,"I don't want to live anymore. I have a family who loves me and a boyfriend who tells me that I mean the world to him, but I feel like everyone would be better of without me. I don't know what to do.",not want live anymore family love boyfriend tell mean world feel like well not know
49685,i have   daysPlan is to skateboard down my road to a bridge above the motorway at  am  I have exams this week which apparently are going to pan out my entire future  I cant pretend to be motivated anymore  The future scares me  I don t want mine to be shaped by my mistakes now and somehow the only solution in my mind is to end it now  My brother killed himself last year and i ve seen how it effects people  I am how it effects people  I cant talk to any friends about it because they ll tell my family and i don t know if i could cope with seeing how my mother would act after what happened with my brother  Im a trans boy who s currently closeted at an all girls school   Help,1,The future scares him and he wants to end it now. His brother killed himself last year. He is closeted at an all girls school. He can't talk to his friends about it because they will tell his family. He has exams this week.,future scare want end brother kill year closet girl school not talk friend tell family exam week
49686,Things cant stop going wrong     My dad died recently from a car accident  my mom and I cant afford to keep the house  I m losing all my friends just because I need time to compose myself  My whole world is crumbling so quickly  All the sudden it s just me and mom  besides that I m alone        I can nearly scratch up enough money for us to eat  I just cant take the pain anymore  the only reason I m still here is because I know mom would be destroyed if I just killed myself  Nobody in our family will help us  We just getting put in a deeper hole  I cant go to college and get a degree  all I can do is just work at low pay jobs and work myself into exhaustion  When I dont work I find better jobs when I dont do that I m at home trying to find some sort of excuse to just get my life over with  I need someone anyone just to talk to me and say everything will be ok,1,Dad died recently in a car accident and now it's just mom and mom alone. They can't afford to keep the house and they can't go to college. They work low-paying jobs and work themselves into exhaustion. When they don't work they find better jobs.,dad die recently car accident mon mon not afford house not college work low pay job work exhaustion not work find well job
49687,My parents can t treat me equally I don t know where else to post this as I don t want get my friends involved   the few I have I m sick and tired of not being able to not be treated equally by my parents They throw fits   slam doors  yell   click their tongues and have attitudes all the time  But the moment I m in a bad mood or irritated  I get yelled at   punished and apparently have an attitude and is disrespectful The worst part is that I am depressed and get easily irritated  and they KNOW I am depressed but refuse to acknowledge it because it apparently doesn t affect how a person feels and behaves They say because I m not an adult   years old That I can t be Irritated and they can do what ever they want because it s their house  I just needed to write this down  Thanks,0,"My parents treat me badly and punish me when I'm in a bad mood. I'm depressed and get easily irritated, but they refuse to acknowledge it. They say because I'm not an adult, I can't be irritated.",parent treat badly punish bad mood depressed easily irritated refuse acknowledge not adult not irritated
49688,I ve attempted suicide twice and I failed both times I always hear that people that fail regret it afterwards and appreciate life again For some reason I don t  I don t want to be alive I didn t ask for this  What is wrong with me,1,I ve attempted suicide twice and I failed both times I always hear that people that fail regret it afterwards and appreciate life again For some reason I don t  I don t want to be alive I didn t ask for this  What is wrong with me,attempt suicide twice fail time hear people fail regret appreciate life reason don don want alive task wrong
49689,faking itis it even possible to fake such excruciating pain   i m so confused i just want it all to be over  this confusion is making my head hurt i just can t stand it anymore i don t know who i am,1,faking itis it even possible to fake such excruciating pain   i m so confused i just want it all to be over  this confusion is making my head hurt i just can t stand it anymore i don t know who i am,fake possible fake excruciating pain confused want confusion make head hurt stand anymore don know
49690,My school still closed and will be for a long time A teacher told my class the whole situation and probably my school will stay closed for a couple months still She said that school only will open if they can provide a safe environment for all students and thats not the case at the moment  The options my school is discussing about are split classes would help a lot not whole school break at the same time logical sence mask mandated in class some people are against it bla bla bla  people dont use their common sence sadly provide stuff for protection against corona etc i dont think they will do that because of the costs And according to my teacher it will take some weeks for someone makes a decision and to do everything it will take like   months Am happy  online school is way better than at home  I can cheat at tests now,0,My school is still closed and probably will stay closed for a couple of months. The school is discussing split classes. It will take some weeks for a decision to be made. Online school is better than at home as I can cheat at tests now.,school close probably stay closed couple month school discuss split class week decision online school well home cheat test
49691,I let a hole in the wall of my apartment and I believe my life is over I live on SSI in a low income unit   I don t know what s going to happen   Family is too far away to help   I just want to give my cat to my family and kill myself   I need to know this ll work out  but I don t think it will,1,I let a hole in the wall of my apartment and I believe my life is over I live on SSI in a low income unit   I don t know what s going to happen   Family is too far away to help   I just want to give my cat to my family and kill myself   I need to know this ll work out  but I don t think it will,let hole wall apartment believe life live ski low income unit don know go happen family far away help want cat family kill need know work don think
49692,For my birthday I wished to dieIt s my  th birthday today and I ve been looking back at how horrible life is  I have no real friends  I don t get along with my family  and I have nothing to live for  I m so lonely that I wish I were never born,1,For my birthday I wished to dieIt s my  th birthday today and I ve been looking back at how horrible life is  I have no real friends  I don t get along with my family  and I have nothing to live for  I m so lonely that I wish I were never born,birthday wish diet birthday today look horrible life no real friend don family live lonely wish bear
49693,It s different in everyoneSuicidal feelings are different for all people and that s something important to note  You may see a post and think  I must be faking it  just because you can t relate to what they re saying  Some people have full on breakdowns and others such as myself have quick intrusive thoughts and so on  Everyone s trauma is different and will be expressed differently but regardless the people all deserve to be listened to and helped  even if it doesn t seem serious  just one thought can be enough to remove another good person from this planet Stay safe all,1,Suicidal feelings are different for all people. Some people have full breakdowns and others have quick intrusive thoughts. Everyone's trauma is different and will be expressed differently. People deserve to be listened to and helped even if it doesn't seem serious.,suicidal feeling different people people breakdown quick intrusive thought trauma different express differently people deserve listen help not
49694,I want a solution to this pain no bullshit excuseI m a   year old boy and I want a permanent solution to the pain every one has caused me  Every one has abandoned me and say I deserve to die everyday for no reason or at least I don t remember at all I know I have fucked up a few times but they weren t so serious to be treated like this honestly sometimes I feel like meant to commit suicide like how others are meant to do something great or something else  I know I have it easier than most but it still hurts it hurts so much  I have a few friends they don t know I m suicidal they just know I m annoying the only reason I m annoying is because I m trying to cover up the fact that I am suicidal  Sometimes I think they know and are only here with me is because they pity me and that fucking sucks  My mom my dad and my brother would probably be so heartbroken if i killed myself but I still want to die I know I can t go to a hospital because it ll be hell im so scared please help me,1,"A one-year-old boy is suicidal and wants to kill himself. He has a few friends who pity him, but most of them don't know he's suicidal. He can't go to a hospital because it would be hell.",year old boy suicidal want kill friend pity not know suicidal not hospital hell
49695,How many cans will get me drunk at   lbs  I m   lbs and I just want to know how much I need to drink,0,How many cans will get me drunk at   lbs  I m   lbs and I just want to know how much I need to drink,can drunk lbs lbs want know need drink
49696,Imagine getting your glasses robbed Then you d really be getting robbed blind  Fillerfillerfillerfilleri,0,Imagine getting your glasses robbed Then you d really be getting robbed blind  Fillerfillerfillerfilleri,imagine get glass rob getting rob blind fillerfillerfillerfilleri
49697,Why I should die So I came with some of my own reasons  I ve been depressed for three years  mostly just laying in bed doing nothing  I ve been in a mental hospital   times  I haven t even finished high school  all I did was leech of my parents  I m a pedophille  i have aspergers syndrome diagnosed i didn t make it up  psychosis and depression  Everyday I take   kinds of medication and none of them help  I ve though about cannibalism eating people  I ve hit my mother couple of times  I tortured a girl who had a history of depression  every body pretty much hates me  i m the lowest form of a human being  I cannot concetrate enough to even read a book  my memory is completely shot and all connections lost  I m also a necrophille and have a bunch of other pariphillias  i m all horrible traits combined in one human being  There is not a single redeeming quality that I have  I ve stolen money from my mom and other people  i ve leeched of of governemnt programs in my country and I have one failed suicide attempt  Also I like Adolph Hitler  I think he s really inspiring  I watch his speeches and read his autobiography  so i m practically a neo nazi Good luck everyone  Or save me  say I can change,1,"There are many reasons why I should die. I haven't finished high school, I'm a pedophile, I have aspergers syndrome, psychosis and depression. I've hit my mother and tortured a girl. I stole money from my mom and government programs. I like Adolph Hitler. ",reason die not finish high school paedophile asperg syndrome psychosis depression hit mother torture girl steal money mon government program like adolph hitler
49698,FRENCH FACT     french fact are better than ireland fact,0,FRENCH FACT     french fact are better than ireland fact,french fact french fact well ireland fact
49699,what does my dream mean  i had a dream last night i was in a car and saw Danny devito walking so i said  wow that s Danny devito  what s up  and he said    i m Danny devito  then i woke up      can anyone tell me what it means    my theory is that Danny devito is god and he blessed me cuz im having a positive day,0,"Danny Devito was in a dream last night and he said he was Danny Devito. According to his theory, Danny devito is god and he blessed him because he is having a positive day.    He said that he is Danny devitto.",danny devi dream night say danny devi accord theory danny devi god bless have positive day say danny devi
