,text,class,summary,cleaned
80871,I want to move out asap Living at home sucks for me  For years I have wanted to escape from this hellhole called home  There are many reasons why  I m   and many people my age are moving to dorms apartments and I will eventually have to do that anyway so I can become an independent person  I don t want to end up like some random   year old still stuck in his parents  basement  My family is weird af  My parents pamper me too much and I have a little brother who does absolutely nothing but play video games all day  And the family also has a cat that I m afraid could attack me at any moment  And I m afraid that they could judge me at any moment  No wonder I really want to live by myself or a roommate  My room is small as fuck and gets messy really easily  My major requires me to purchase a lot of big equipment and my room simply doesn t have the space for that  Even worse is that I want to move some stuff into the closet but my mom has clothes there and refuses to move them  Also the walls are green and blue and the lights are yellow and it s wayyy too colorful  My house doesn t have a pool and neither does the neighborhood  while all the other apartment complexes in my town have pools  Man I wish I could just go change into my bathing suit one day and take a swim one day when I have free time  without having to drive miles to a public pool when it could be just a walk away  No wonder I want to move out asap Well  the only thing preventing me from moving out is that I don t have a car or a driver s license  But since I m taking driver lessons and saving up for a car by working my job I think it s possible that I could move out within the next year  But for now I m stuck in this shitty house with a weird af family without a pool or any way to enjoy the hot sun outside,0,I want to move out of my parents' house asap. My room is too small and messy. I don't have a car or a driver's license. I'm taking driver lessons and saving up for a car. I could move out within the next year.,want parent house soon possible room small messy not car driver license take driver lesson save car year
80872,I admitted to my female friends  including my crush  that I have watched porn  It was for a truth or dare  and idk if I made the right decision  Also it seems like my crush has been avoiding me lately and I don t know if this is the reason or not   help,0,I admitted to my female friends  including my crush  that I have watched porn  It was for a truth or dare  and idk if I made the right decision  Also it seems like my crush has been avoiding me lately and I don t know if this is the reason or not   help,admit female friend include crush watch porn truth dare not know right decision like crush avoid lately don know reason not help
80873,you have to take off your clothes to have sex  what  my trousers  are staying on  thanks,0,you have to take off your clothes to have sex  what  my trousers  are staying on  thanks,clothe sex trouser stay thank
80874,I just want to dieI have been struggling all my life and I am just ready to give up  First it was my cousin sexually assaulting me and then my father  He never apologized but did say that he was feeding me and giving me clothing so that was the perk he could get it  He did this for   years  Now I have been able to escape and find my own place for   years now  I was barely making ends meet but I managed  I am very unattractive and no one loves me  My so called  friends  only talk to me when they need something  I am the nicest person I know but yet the worse happen to me   I just lost my job a few hours ago and I failed my last college test  I have just tried and tried  If someone would like to kill me  please let me know  I m Christian so I cannot do it because it is a sin  Although  I am starting to reconsider being a Christian as I have nothing but bad things happening to me for a person who s God is suppose to save them,1,"After being sexually assaulted by her father and her cousin, she was able to escape and find her own place. She lost her job a few hours ago and failed her last college test. She is starting to reconsider being a Christian as she has bad things happening to her.",sexually assault father cousin able escape find place lose job hour ago fail college test start reconsider christian bad thing happen
80875,What if I just bought a sword and told everyone it was Excalibur  Sure  most people aren t gonna believe me but I ll still be remembered as that person that claimed to have Excalibur,0,What if I just bought a sword and told everyone it was Excalibur  Sure  most people aren t gonna believe me but I ll still be remembered as that person that claimed to have Excalibur,buy sword tell excalibur sure people agent go believe ill remember person claim excalibur
80876,I don t want to exist anymoreI m tired of existing  I m tired of continuing this shit parade called a life  For as long as I can remember  I ve never been happy or satisfied  Society told me that kids are stupid and it gets better when you get older  I m   now  life is still bleak and disappointing I almost flunked out of high school and community college because I could barely get up in the morning  Everyone is always pointing out how I m not good enough  My friends and family always make fun of me  even though they know I m insecure  Why don t you have a girlfriend yet  Why do you work your shitty minimum wage job  Do they want me to just come out and say it  I am emotionally vulnerable  mutt ugly  short  poor  socially anxious  and stupid My friends and family are so happy and full of purpose  They live such rewarding lives  They have careers  lovers  goals  and I m just sitting here trying to find a reason to continue holding on  Life has taught me one thing so far  It doesn t get better  My family doesn t deserve the pain  but dying seems like the only way out of this mess  I just don t know how to go about ending this final chapter of my life,1,"As long as I can remember I haven't been happy or satisfied in my life. I almost flunked out of high school and community college because I couldn't get up in the morning. My friends and family make fun of me even though they know I'm insecure and insecure. I work a minimum wage job. I am emotionally vulnerable, short, poor, socially anxious and stupid. My family doesn't deserve the pain but dying seems to be the only way out of this mess. ",long remember not happy satisfied life flunk high school community college not morning friend family fun know insecure insecure work minimum wage job emotionally vulnerable short poor socially anxious stupid family not deserve pain dying way mess
80877,Yo i just realised It s been a whole year since i first joined reddit  so thanks you those who made my year this much easier  trully been an eventfull year  filled with memorable events  Anyway  back to the silent majority now or will i,0,Yo i just realised It s been a whole year since i first joined reddit  so thanks you those who made my year this much easier  trully been an eventfull year  filled with memorable events  Anyway  back to the silent majority now or will i,realise year join geddit thank year easy truly eventful year fill memorable event silent majority
80878,I failedI m such a dumb fuck that I didn t take into account how low the ceiling beams in my house are  I set everything up and realized that it wouldn t work but I still tried and all that happened was me feeling like a huge idiot  My neck is sore and it kinda hurts to swallow but I m  unfortunately  still here It was kind of surreal going to my parent s house right after and everything being so normal  I could have been dead but instead I had dinner with my family like nothing had happened and then everyone just went on with their day I could tell my mom  She d freak out and get mad  she takes my depression personally for some reason  but she d take me to the hospital and maybe they would lock me up until I stopped wanting to kill myself  I m kind of a coward  though  so I don t think I can face her right now  I don t know what to do It s almost   a m  here so I m going to sleep  Here s hoping I don t wake up in the morning,1,"The ceiling beams in the house are too low for the device to work. The neck is sore and it hurts to swallow, but he's still alive. After dinner he went to his parents and they had dinner as if nothing had happened. He doesn't want to tell his mom about his depression.",ceiling beam house low device work neck sore hurt swallow alive dinner go parent dinner happen not want tell mon depression
80879,august burns red is an underrated band I highly recommend if you are a metal head,0,august burns red is an underrated band I highly recommend if you are a metal head,august burn red underrated band highly recommend metal head
80880,I found my old Reddit account after like   million years  Big gae,0,I found my old Reddit account after like   million years  Big gae,find old geddit account like year big game
80881,How excited you were about turning into a teenager  Ngl I am   now  basically the last year of teenage and lemme tell you  it s not gonna be oh the most amazing years of your life lmao  All the best PS  I never said they are not gonna be worthwhile  Have a good ride,0,How excited you were about turning into a teenager  Ngl I am   now  basically the last year of teenage and lemme tell you  it s not gonna be oh the most amazing years of your life lmao  All the best PS  I never said they are not gonna be worthwhile  Have a good ride,excited turn teenager nil basically year teenage let tell not go amazing year life lao good say not go worthwhile good ride
80882,Anybody want to play among us  It s nice to play with literate people rather than random   year olds  The code is RMNWJF  Come join me peoples,0,Anybody want to play among us  It s nice to play with literate people rather than random   year olds  The code is RMNWJF  Come join me peoples,anybody want play nice play literate people random year old code run come join people
