,text,class,summary,cleaned
176720,m  very lost at the moment My girlfriend and I have been together for four years  we re both   and recently we ve taken a break away from each other  Not seeing other people or anything  but just getting some time apart  We ve been a bit distant from each other before the break  but we re both studying and are fairly stressed with that  so I just put it down to that   I ve always had depression symptoms  and never really went and saw anyone about them  but about a month ago  a week after the break started  I was diagnosed with depression and anxiety  and now I can t stop thinking about ending my life  I ve been struggling with being separated my partner  and she s told me the other day that she s not sure she want s us to be together anymore   My life just doesn t feel worth it at the moment  and I don t know what to do  The more I try and take my mind off it  the more I think about it and I get into these places where I just can t control my emotions at all and nothing at all can cheer me up   I want to sort myself out before I get back with her  but at the moment I feel like if I take the time to do that  she won t be there at the other end  and I m not sure that s something that I can handle   I m not sure what I m really asking here  but I just needed somewhere to write this because I feel like I have no outlet at the moment,1,Girlfriend and I have been together for 4 years. Recently we took a break to spend some time apart. A week after the break I was diagnosed with depression and anxiety. Now I can't stop thinking about ending my life. My partner doesn't want to be with me anymore. ,girlfriend year recently take break spend time apart week break diagnose depression anxiety not stop think end life partner not want anymore
176721,life is kinda wack sometimes tho or maybe I just need some sleep It s like  am  goodnight,0,life is kinda wack sometimes tho or maybe I just need some sleep It s like  am  goodnight,life kind wack maybe need sleep like goodnight
176722,My Talking Angela Theories Still Freak Me Out When I was a kid  I really had the app  I was   years old  in grade   and this was in   before I ever heard of the rumours  I remember the cat asking me invasive questions  I remember her asking me where I live  I also remember her asking me what the weather s like  which could seem innocuous but in this light  it s creepy  I don t remember much else of what she said,0,"As a kid, when he was in grade, he used to have a talking cat app. The cat asked him invasive questions. He doesn't remember much else from the app except for what she asked him about his location and the weather.",kid grade talk cat app cat ask invasive question not remember app ask location weather
176723,Ok new game guys join if you wish Among us CODE  TDSXVF Server  NORTH AMERICAAA,0,Ok new game guys join if you wish Among us CODE  TDSXVF Server  NORTH AMERICAAA,new game guy join wish code save server north american
176724,Painless end In the last five years or so I have felt some changes in my body  It s like part of my brain has shut down in a way  I ve struggled with memory loss  lost some of my vocabulary and its like I dont care about anything any more  I ve realized that i have a dementia related disease at the age of   with to children of   and   years old  That bitter pill is hard to swallow  The funny thing is that im not depressed about this  I m more annoyed by the fact that i will not be around the help the girls when they struggles with day to day issues like homework and boys  Before i got this disease i had a lot of anxiety attack and i have always been so scared of dying and not exist  now It s different  I feel nothing about ending my life  I ve decided that ending my life would be a natural step and i want to do this before the disease have taken full control on me  It is important to me that my girls remembered be as i am today and not who i would be in let say five years time  This turned out to be a long intro  but do anybody know ways to end a life without any pain  What is the best way to do this without going to a suicide clinic in switzerland,1,In the last 5 years I have noticed some changes in my body. I have a dementia related disease. I want to end my life before the disease has taken full control of me. I don't want to be around to help the girls when they struggle with day to day issues like homework and boys.,year notice change body dementia relate disease want end life disease take control not want help girl struggle day day issue like homework boy
176725,just drank too much cough syrupif I live I will try again if I don t my mom will be so sad I don t know how to deal with this pain I love my doggie goodbye everyone im sorry I didnt live up to my potential,1,just drank too much cough syrupif I live I will try again if I don t my mom will be so sad I don t know how to deal with this pain I love my doggie goodbye everyone im sorry I didnt live up to my potential,drink cough syrup live try don mon sad don know deal pain love doggie goodbye sorry not live potential
176726,LOVE  amp  DEATH I WANNA DIEMy Gf is pushing me towards suicide  she s getting me mad on purpose everyday and i tell her that i wanna kill myself because she s literally hurting me emotionally  she s lying to me and hiding shit from me i don t trust her  she threatens me and i don t feel safe anymore i feel like i can t escape from her  She s really trying to kill me because she keeps breaking my heart and fucking me over and i can t leave  she s emotionally abusive she makes me feel like scum saying you ll never be with anyone else but me i m the only person who will love you and makes me feel worthless makes me question if living is even worth it  Fuck love because i feel so used an manipulated by her  i give her my heart and all she says is that i don t love her which just breaks me  she constantly tells me i m not enough for her and that she wants guy friends i can t love anyone else but her because she s brought down my self esteem  every time i try opening up to her she shows little respect and makes me shut up  i tell her i wanna kms everyday and i just need to talk to her but all she has to say is stop being selfish but how am i being selfish when i just need her attention  She s made me cut off everyone in my life and i m trapped  i feel like death is the only option,1,Gf is pushing him towards suicide. She keeps breaking his heart and fucks him over. She's emotionally abusive and manipulates him. He's cut off everyone from his life because of her. He wants to kill himself. ,push suicide keep break heart fuck emotionally abusive manipulate cut life want kill
176727,I wish I was a child  I F CKING HATE THIS SYSTEM  I feel like I don t belong anywhere here Life were so easy when I was a child living with my parents  My room was so chill  I was feeling so happy literally everyday  I miss the old days  I miss my parents home  I miss being a child again  Once I became     whole world turned against me  Im   right now and I don t want to keep doing this  I m sorry   I want to visit my parents for just one more time  Sleep in my room in peace  Have breakfast with them for a week   And than I ll end it God damn it I m going to cry so bad,1,I miss the old days when I was a child living with my parents. I want to visit my parents for one more time and have breakfast with them for a week. I don't want to keep doing this. I'm going to cry.,miss old day child live parent want visit parent time breakfast week not want go cry
176728,So for half a year I ve failed at finding the balls to end it I ve become an alcoholic  I m literally becoming everything I always swore to never be  I m committing self harm on a daily basis  my driving is probably the most lethal thing in this situation  I don t see the point in life anymore as there is no purpose  What do I do   r suicidewatch  And before you start about family  That s where it all started years ago  My mom doesn t want me  my dad abandoned me and my sister knows nothing about me  I have very few friends and none of them would care of I disappeared  as I often completely go offline and off radar  I m in debt  I have nothing that s keeping me back anymore  especially since my recent breakup  I have no idea how I m still here  why I m still trying  what is keeping me from  Well  Killing myself  I m not looking for an  Oh  you don t have it that bad  or a  Look at life in a bright light  I literally can t  I ve been in a car crash and if the physical trauma hadn t done it  the mental trauma would ve  but my receptors are FUCKED  I run at about   to   of the  happy juices  a normal person does and my doctor s given up trying  I m desperate to find someone to talk some sense into me  To stop me from taking myself out of existence  I ve got nothing and no one  no reason to go on  no reason to find  I m going nowhere  my music s going nowhere  my books are going nowhere  my education s going nowhere and all day I m tired  I m tired of fighting  I m tired of getting shit on  I m tired of never getting back what I sacrifice  I m tired of always hearing everyone doing well while I m doing shit  I m tired of always working but never seeing anything for it  I m tired of crying myself to sleep at night and to wake up wishing I didn t  I m tired of being tired  I m just  So  Tired  I want to sleep and never wake up,1,"For half a year I've been trying to kill myself. My family doesn't want me, my dad abandoned me, I have very few friends, I often go offline and off radar, I'm in debt, I've had a recent breakup and I'm tired. I want to die. ",half year try kill family not want dad abandon friend offline radar debt recent breakup tired want die
176729,Imagine if the US took over the world We would use a machine alone the idea of a gigantic magnifying glass in space where it would focus on the sun to burn down cities and towns   It would work by focusing on the sun s rays to reach the Earth s surface  It would be programmed to face any direction we d like and with the scorching heat from the sun we d aim it at an enemies territory,0,The US would use a gigantic magnifying glass in space to burn down cities and towns. It would be programmed to face any direction and with the scorching heat from the sun it would aim it at an enemies territory. It works by focusing on the sun rays to reach the Earth's surface.,use gigantic magnifying glass space burn city town program face direction scorch heat sun aim enemy territory work focus sun ray reach earth surface
176730,I don t know if anyone else here has autism and has this problem with people but I kinda want to rant about it If you ever get compared to fictional characters don t you just hate it  Like people just act like they know you better because they have a better perspective of the character due to how it s being told  Welp idk FHA s the end,0,"People compare autistic people to fictional characters and they act like they know them better than they really do. I don't know if anyone else has autism and has this problem with people, but I want to rant about it.  ",people compare autistic people fictional character act like know well not know autism problem people want rant
176731,What is the first thing that comes to your mind when you see my profile  Don t worry  I won t hold it against you unless you say the forbidden statement,0,What is the first thing that comes to your mind when you see my profile  Don t worry  I won t hold it against you unless you say the forbidden statement,thing come mind profile don worry will not hold forbidden statement
176732,A girl just told me over FaceTime that she likes me  I am very happy  The rest is just a filler filler filler filler filler filler filler filler filler filler filler filler filler filler filler filler filler filler filler filler filler filler filler filler filler filler filler filler filler filler filler filler filler filler filler filler filler filler filler filler filler filler filler filler filler filler filler filler filler filler filler filler filler filler filler filler filler filler filler filler filler filler filler,0,"A girl told him over FaceTime that she likes him. He is very happy. The rest is just a filler filler filler. filler filler, filler filler,. filler filler and filler filler for the rest of the story.  ",girl tell face time like happy rest filler filler filler filler filler filler filler filler filler filler filler rest story
176733,I have finished Spanish on Duolingo I can feel the Spanish flow through my veins  Duo has released my family  I am more powerful than ever,0,I have finished Spanish on Duolingo I can feel the Spanish flow through my veins  Duo has released my family  I am more powerful than ever,finish spanish duo lingo feel spanish flow vein duo release family powerful
