,text,class,summary,cleaned
194830,AHS is a curse it changes how you look at songs The song  Tonight You Belong To Me  I see as a creepy song when thats not what its meant to be  It was first written by  Billy Rose https youtu be PFsybEWpg  in   You can t even find it by him on spotify  The only recording I can find are really bad ones on youtube  Then there s   by  Gene Austin https youtu be S HoFhLRuO  and boy is the tone so much different  Also  Roger Wolfe Kahn https youtu be ctqlO aeRUk  which is crackly and has a different tone  Now were in the   with  Frankie Laine https youtu be nZ x dDiQ o  which has a chorus and sung much louder  Next were on  Patience  amp  Prudence https youtu be fOjVjc vJ I    which sounds like how I know the song  But were not done this song has more history  Still    Lawrence Well with The Lennon Sisters https youtu be n bmXG MtPI  it sounds close to the one I know  but different  The history continues now by  George Maharis https youtu be iX tV D NY    sounds close to the one I know just its a duo now  Now onto  Dottie West https youtu be iW xG LRSgk  the tone is more joyful and has chorus of men in the background   And thats the history of this song sorry I m bored and looked into this and wanted to share  Sorry I m bad at describing songs tones and stuff so I tagged all the versions of this song as I listed them,0,"Tonight You Belong To Me was written by Billy Rose. It was recorded by Gene Austin, Roger Wolfe Kahn, Frankie Laine, Lawrence Well, The Lennon Sisters, George Maharis, Dottie West and others have recorded the song.",tonight belong write billy rise record gene austin roger wolfe kahn frankie line lawrence lennon sisters george malaria dottie west record song
194831,Anyone here present symptoms of hyper sexuality  I ve been hearing a lot about this recently and how it isn t really normal  any of you guys deal with it  And if so  how do you keep it under control   Also  I m asking this in a non weird way lmao,0,Anyone here present symptoms of hyper sexuality  I ve been hearing a lot about this recently and how it isn t really normal  any of you guys deal with it  And if so  how do you keep it under control   Also  I m asking this in a non weird way lmao,present symptom hyper sexuality hear lot recently normal guy deal control mask non weird way lao
194832,Hi  My friend just made IG for her awesome art and was kinda shy and anxious about it so I figured out you might help me to brighten her day  She thinks it was a bad idea and I totally disagree  She was sick a lot lately but despite that made some pretty nice stuff  She is very talented  I ll post link in comments  Please check it out,0,My friend made IG for her awesome art. She is shy and anxious about it. She thinks it was a bad idea and I totally disagree. She was sick a lot lately but despite that made some nice stuff. I'll post link in comments.,friend awesome art shy anxious think bad idea totally disagree sick lot lately despite nice stuff post link comment
194833,Help with a girl There is this girl i like and shes smart nice and  funny but I dont know how to ask her out  We get along and are preatty good freinds but i dont know how to ask her out  Any advice,0,Help with a girl There is this girl i like and shes smart nice and  funny but I dont know how to ask her out  We get along and are preatty good freinds but i dont know how to ask her out  Any advice,help girl girl like smart nice funny not know ask pretty good friend not know ask advice
194834,Looked at my dads phone  very big mistake I was trying to study for a school assignment  and the doorbell went off  My dad went to answer and it was our neighbour who loves to chat about everything under the sun  His phone started to ring and he has it set so it never goes to voicemail  so it just kept ringing  and ringing  I decided to go shut it off because it was fucking annoying after like   minutes  It ended up being a bot call from some telemarketing company so I shut it off  It went back to the lock screen and it showed he was watching a video called Baby sitter caught on camera playing with  Now i would like to say that I walked away and never thought about it again  but I was intrigued as my dad is not the sort of person you would think would do that kind of thing  I opens the phone and not only was there a porn video  but there was like   tabs in incognito mode of this random sketchy looking porn site  Apparently my dad doesn t know that you have to manually clear incognito tabs  they don t just go away when you shut safari  I am now horrified  and I can t get the image of my dad watching porn out of my head  Please help me,0,The doorbell went off so my dad went to answer it. It was his neighbour. His phone started to ring so he shut it off. It turned out to be a bot call from some telemarketing company. On the lock screen it showed he was watching a porn video called Baby sitter.,doorbell go dad go answer neighbour phone start ring shut turn bot telemarketing company lock screen show watch porn video call baby sitter
194835,Something wrong with my headI think there is something wrong with my head I have thinking about killing me self tester day,1,Something wrong with my headI think there is something wrong with my head I have thinking about killing me self tester day,wrong head think wrong head think kill self tester day
194836,A friend of mine has been ignoring me for the past   months  and it s starting to make me doubt myself I met her in an online class over the summer  She s in grad school across the country and has a boyfriend We did all of the homework together  and after the class  we regularly texted for a couple months  She s a pretty cool person  and I ve gotten a lot of valuable advice from her Some time in October she just  stopped replying to my messages  I didn t say anything weird or strange  her last message to me was  Thanks seccret   obviously using my real name I see her online on discord  but she ignores me  I feel like shit cause I don t know why she s ignoring me  and I don t know whats going on with her What can I do  Nothing,0,A friend of mine has been ignoring him for the past months. He met her in an online class over the summer. She is in grad school across the country and has a boyfriend. They did all of the homework together and after the class they regularly texted for a couple months. In October she stopped replying to his messages.,friend ignore past month meet online class summer grad school country boyfriend homework class regularly texte couple month october stop reply message
194837,Idiot girl in my class thinks quenn elizabeth is going to die soon    okay  so i go to a high school in norway and its this one girl thats always very annoying  she dances in class sings badly and thinks she is very cool  today i listened to what she was saying in class and she suddenly syas  did you know that queen elizabeth owns   of the worl and then she said but it wont matter because she is gonna die soon  what an idiot  everyone knows she is immortal,0,"There is a girl at school in Norway who thinks Queen Elizabeth is going to die soon. She is annoying and thinks she is cool, but everyone knows that Elizabeth is immortal. She said it won't matter because she is gonna die soon, because Elizabeth owns of the worl. ",girl school norway think queen elizabeth go die soon annoying think cool know elizabeth immortal say not matter go die soon elizabeth own world
194838,I LL KILL HER THEN MYSELFSHE DOESNT DESERVE YOU  YOU RE SUPPOSED TO BE MINE  SCREW EVERYONE No one deserves my goodbye  I was too good for this world  You all contributed  I ll kill everyone who hurt me  ALL THE PEDOPHILES  ALL MY RAPISTS  FUCK YOU   And of course thank you to my boyfriend who is trying his hardest   I ll meet you in the afterlife  I love you  I said I would get help  I need to get this out  Then I ll go get help  Of course I cant actually do what I say  That s who I am  Fake      Isn t life beautiful  I think that life is beautiful,1,Everyone deserves my goodbye. I was too good for this world. I will kill everyone who hurt me. I love my boyfriend. I need to get this out and then I will go get help. I am Fake. Life is beautiful.,deserve goodbye good world kill hurt love boyfriend need help fake life beautiful
194839,i need to vent oh no everyone saw me vent im gonna get voted off,0,i need to vent oh no everyone saw me vent im gonna get voted off,need vent no see vent go vote
194840,So  to everyone who needs to hear it  I hope you re doing okay  If you ever need anything  tell me  Actually  Tell me how you re feeling right now  Be honest,0,So  to everyone who needs to hear it  I hope you re doing okay  If you ever need anything  tell me  Actually  Tell me how you re feeling right now  Be honest,need hear hope okay need tell actually tell feel right honest
194841,i found the worst horror game of all   i m fucking horrified https kypello itch io kill the ice age baby adventure the game,0,i found the worst horror game of all   i m fucking horrified https kypello itch io kill the ice age baby adventure the game,find bad horror game fucking horrify yellow itch kill ice age baby adventure game
194842,In a holeI dropped out of college  can barely hold a job  haven t had sex in years and find it hard to see a future worth living  I always get really optimistic about something and within a few days I just want to end it all  It s like a cycle I just want to end  I don t want to be in my thirties living with my mom with no friends because I m not confident enough to follow through with anything  At first I thought I had ADHD but now I m pretty sure I have depression  It might have sprung up as a commordity disorder  Idk Like I said I try to be positive but I keep on getting depressed  I ve started to isolate myself as well  I ve deleted all of my social media and am thinking of running away from my family and leaving my cellphone  I ll go somewhere where I wouldn t be able to get back home from  Then I ll be forced to make myself commit suicide  I also know that I d probably think myself out of it but if life keeps going like this I feel like I ll eventually just end it,1,"I dropped out of college and can't hold a job, I haven't had sex in years and I'm depressed. I try to be positive but I keep on getting depressed and I've deleted all of my social media. I'm thinking of running away from my family and leaving my cellphone. ",drop college not hold job not sex year depress try positive get depressed delete social medium think run away family leave cellphone
194843,i know the sacred texts Guys i found out how to respond to  lol  and  lmao here s the link to the video  https youtu be oHg SJYRHA,0,i know the sacred texts Guys i found out how to respond to  lol  and  lmao here s the link to the video  https youtu be oHg SJYRHA,know sacred text guy find respond low lao link video youtube org syria
194844,I can t do thisF  I can t do this anymore  It s too hard  I m thinking about suicide constantly  scared that I ll have a quick impulse some day and do it  looking for someone to just talk to and vent,1,I can t do thisF  I can t do this anymore  It s too hard  I m thinking about suicide constantly  scared that I ll have a quick impulse some day and do it  looking for someone to just talk to and vent,anymore hard thinking suicide constantly scare ill quick impulse day look talk vent
194845,Genuine question  how do girls feel about being called  chicks  I don t really know  hence why I wanna know,0,Genuine question  how do girls feel about being called  chicks  I don t really know  hence why I wanna know,genuine question girl feel call chick don know want know
194846,Guys I did it  I  the socially awkward  extremely quiet kid  is kinda not single  I have a Minecraft girlfriend  I m slightly less single now  Wow,0,Guys I did it  I  the socially awkward  extremely quiet kid  is kinda not single  I have a Minecraft girlfriend  I m slightly less single now  Wow,guy socially awkward extremely quiet kid kind not single min craft girlfriend slightly single wow
194847,Body image issues push me towards suicideI hate my body  I hate myself because of my body  I am so uncomfortable in my skin and I feel like I am living inside of an ugly alien  I hate my face  my teeth  my hair  my pasty skin  my tiny boobs  my gangly limbs  My boyfriend had a crush on this girl early in our relationship with massive tits and a gorgeous curvy body  it makes me feel inadequate having the body of a child  im not enough for anyone  i want to kill myself because i canr stand living in this ugly body anymore  i have been hating my body for   years and i think i want to destroy it,1,"Body image issues push me towards suicide. I hate my face, teeth, hair, pasty skin, tiny boobs and gangly limbs. My boyfriend had a crush on a girl with massive tits and a curvy body early in their relationship. I feel inadequate having the body of a child. ",body image issue push suicide hate face tooth hair pasty skin tiny boob jangly limb boyfriend crush girl massive tit curvy body early relationship feel inadequate have body child
194848,I feel dumb In Human geo today my teacher asked me where all life is And it had all the spheres like atmosphere and biosphere and I go I don t know this one but seconds late I figured it out,0,I feel dumb In Human geo today my teacher asked me where all life is And it had all the spheres like atmosphere and biosphere and I go I don t know this one but seconds late I figured it out,feel dumb human geo today teacher ask life sphere like atmosphere biosphere don know second late figure
194849,Intrusive thoughts about swallowing a month s worth of ProzacI can t get out of my head  I m not as good as I thought I was in my journey to recovery and I keep having intrusive thoughts about self harm and overdosing and driving my car into traffic  I hate it  it s scary and I can t turn it off when I m stuck in a depressive loop like tonight,1,I keep having intrusive thoughts about self harm and overdosing and driving my car into traffic. I can't turn it off when I'm stuck in a depressive loop like tonight. I hate it. I'm not as good as I thought I was.,have intrusive thought self harm overdose drive car traffic not turn stick depressive loop like tonight hate not good think
194850,Help a boy out So all my friends have something to talk about whether it be  k followers on TikTok or  k subs on YouTube  I wanna ask the boys  or the girls  if they can help blow this up  I wanna be able to say that I have some clout,0,Help a boy out So all my friends have something to talk about whether it be  k followers on TikTok or  k subs on YouTube  I wanna ask the boys  or the girls  if they can help blow this up  I wanna be able to say that I have some clout,help boy friend talk follower tito sub youtube want ask boy girl help blow want able clout
