,text,class,summary,cleaned
6684,Why can t there be an easy and peaceful way to die I ve wanted to kill myself for a while now  but I m afraid of suffering or being in a panicked situation even if it s only for the brief moment  Why are the only options inhumane methods  It s so stupid that society is against assisted suicide  especially because what s the harm with it  Some might say it s unethical  well it s also unethical to force someone to kill themselves inhumanely  I hate this,1,"There should be an easy and peaceful way to die. Society is against assisted suicide. It's unethical to force someone to kill themselves inhumanely, as some might say.    i hate society's attitude towards assisted suicide, because it's stupid. ",easy peaceful way die society assisted suicide unethical force kill inhumanely hate society attitude assisted suicide stupid
6685,How do you get a clown off a swing  Shoot it,0,How do you get a clown off a swing  Shoot it,clown swing shoot
6686,i can tell i m going to do it soon  fman it hurts so much thinking about everything i ve fucked up    rape victim  ex drug addict  depressed  working a miserable job  attending college online  i had so much fucking potential  i know they say that to all of us but i almost felt it too  i remember winning poetry awards and getting published then i moved after high school and disappeared  i feel like i m holding my boyfriend back from his full potential or even being happy  i m so sick all the time and he has to pick up my slack  he would never say this but i know i m wearing him down  arent i saving him more pain in the long run  today he did something adorable and right when he left the room i started crying because i thought about how many moments i ll miss like that  i m going to miss you to my family that has no idea who i am  i don t know how you ll react  i hope you never find out i m bisexual  non christian  pot smoking  living with my boyfriend  etc  i hope i m strong enough to do this before any damning information comes to light and i disappoint you   i feel calm  like the same feeling you get when you find out a suffering loved one has died  just acceptance  i m going to end my life by suicide  it s just now a game of how much i can take before i do,1,"After high school she moved after high school and disappeared. Now she's depressed, depressed and depressed. She's bisexual, non Christian, pot smoking, living with her boyfriend and she's going to kill herself. She feels like she's holding her boyfriend back from his full potential.",high school move high school disappear depress depressed depressed bisexual non christian pot smoking live boyfriend go kill feel like hold boyfriend potential
6687,Alright I fucking admit it I m an emo fuckkk ksjsjsbdbkdksbsbjejdnfn,0,Alright I fucking admit it I m an emo fuckkk ksjsjsbdbkdksbsbjejdnfn,alright fucking admit man emo fuck ksjsjsbdbkdksbsbjejdnfn
6688,Not sure how long i can keep postponing I keep telling myself not to commit suicide because things might get better  but they only get worse every damn time  It s so painful and exhausting to be in this position and there are a lot of people who don t understand that  Just needed to throw this here because I have no one else to say it to,1,There is no one else to talk to when it comes to suicidal thoughts. It's painful and exhausting to be in this position and there are a lot of people who don't understand it. It might get better but things only get worse every time. ,no talk come suicidal thought painful exhausting position lot people not understand well thing bad time
6689,I may be easy to make happy But I can also get sad bc of something small Why am I like this,0,I may be easy to make happy But I can also get sad bc of something small Why am I like this,easy happy sad small like
6690,I am an attack helicopter Brrrrrrrrrrrrrrrrrrrrrrrrrrrrrrrrrrrrrrrrrrrr,0,I am an attack helicopter Brrrrrrrrrrrrrrrrrrrrrrrrrrrrrrrrrrrrrrrrrrrr,attack helicopter brr
6691,I think I finally have the ability to do it There s a point on my commute where you merge onto a different highway and there s   empty lanes overlooking a big field far below  Sometimes I like to play chicken with myself and close my eyes and see how far I can drift across the lanes until I get too scared   I ve always had one off thoughts of suicide since my childhood  but this year has really pushed me further and further to the point where I have daily fantasies about killing myself  I don t think anyone has ever fully understood who I am and what I go through  and people I have tried to open up to are always unwilling to accept that I m mentally ill or pushed away by me   I ve had constant chills through the past months  My anxiety and depression are wrecking my health and my ability to be a productive person  I can t focus on tasks or achieve anything of worth  It s hard to go outside  I m at the age of applying for college and I ve barely done anything because I don t believe that I ve ever had anything worth developing  I m a failure  Everyone around me is unaware of my thoughts  and I m worthless compared to all of them  My only worth has been accrued through what I ve done for others  looking back  it s like I ve never been my own person at all   I don t think anyone really knows me as a person  There s nothing to care about anyways  I m not really sure what the point of this post is  I guess it s the cry for help that I m too scared to do in real life  I don t know if it ll be today or tomorrow or next week  but I think sooner than later I m going to close my eyes and let my car careen off the highway and carry me to the only fate I think I deserve,1,Anxiety and depression are wrecking my health and I can't focus on tasks or achieve anything of worth. I don't think anyone fully understands who I am and what I go through. I'm applying for college and I haven't done anything worth developing. ,anxiety depression wreck health not focus task achieve worth not think fully understand apply college not worth develop
6692,I got my supplies todayI m sitting in my room with about   gallons of anesthetic gas by volume and some miscellaneous household stuff  I m going to do something that will probably kill me  If it doesn t  and I m not too brain damaged to move  I ll try again with a blade   I m here because I m disabled  Also  I ve been heavily abused by my family  Also  there is no part of me that is willing to live in this nightmare any longer   I m not really sure why I m posting here  but I ve got a little time before the last thing I need gets dropped off   I wish life offered me more than constantly being taken advantage of  I wanted to help people and do good  Everytime I get enough to be stable and start my life  someone takes it all from me  It s because of what s wrong with me  It s because I cannot interact with people without somehow telegraphing that I can t defend  Some one walked into my living room through my locked door while I typed this  I couldn t even say it was rude much less a problem  Oh well  It ll be done soon,1,"I got my supplies today. I'm sitting in my room with about gallons of anesthetic gas by volume and some miscellaneous household stuff and I'm going to do something that will probably kill me. If it doesn't, I'll try again with a blade. I've been abused by my family and disabled.",get supply today sit room gallon aesthetic gas volume miscellaneous household stuff go probably kill not try blade abuse family disabled
6693,Ending it all I give up on life  don t help me at all I ll see you all soon,1,Ending it all I give up on life  don t help me at all I ll see you all soon,end life don help ill soon
6694,I hate school and lifeSchool has been so fucking ruff this year  In previous years I have hated it  this year I have had weeks of pure studying just to get a b on a test  Last week I gave myself no free time and when I was finished I felt no joy or excitement I was just dull and tired  I recently did a final and didn t do well on it and threw my computer and tried to hurt myself  I keep saying that I m going to kill myself  but I just end up not doing it  I feel like my life is fucking repeat  with me going to school and then coming home and then working or doing nothing  When my family asks me how school Was I always answer   the same  because it is  I feel like It will always be like this  My life is so average that I just know when grow up  I m going to work a   job and casually always hating it  but doing nothing about it   always struggling with money  but never to the point where I lose my house that I will be paying for the rest of my life and giving my children the same fate  I just feel trapped and out of options at this point  we grow up to feel special and then shut down when the inevitable truth hits you  Fuck this,1,This year school has been hard for me. I hate going to school and coming home and then working or doing nothing. I feel trapped and out of options. I know when I grow up I'm going to work a job and hate it. ,year school hard hate go school come home work feel trap option know grow go work job hate
6695,It s been quite some time Hi reddit   I find myself in a headspace I thought I had left behind   I m on the other side of a meltdown  panic attack or whatever and I feel exhausted   I m drained but cant sit still   I feel frozen to inaction but feel an unstoppable need to change something   My thoughts all focus on not wanting this anymore   I m so tired of the struggle   Struggle to pay Bill s  stay groomed  keep the place clean  car  insurance  social life  work  dad time  sleep   Everything is a struggle   Nothing feels smooth or easy going It s all so hopeless   I ve been so lonely since my wife left   I just had my first rejection post divorce and it hurt me way more than I expected    I was foolish to think I d be stronger for what I went through    The ativan are kicking in hard   I ll try and get some sleep and hope my mind can leave the darkest thoughts behind by the time I wake up  Sorry for the rambling,1,It's been quite some time since the last post. He's been depressed since his wife left him. The ativan is kicking in and he's going to try and sleep it off. He had his first rejection after his divorce.,time post depress wife leave van kick go try sleep rejection divorce
6696,I want to cryI m just tired of being lonely and feeling terrible  I got nothing to really lose  So what s the point,1,I want to cryI m just tired of being lonely and feeling terrible  I got nothing to really lose  So what s the point,want crim tired lonely feel terrible get lose point
6697,What do I do I ve tried killing myself before but I failed  at this point I have an extreme fear of death  so I m too scared to kill myself  But I hurt so much and honestly don t see myself having any sort of remotely good life  I feel stuck not wanting to live whatsoever and not wanting to die whatsoever  I ve tried therapists and medication and none of it worked  What do I do,1,"I hurt so much and I don't see myself having any sort of remotely good life. I have tried killing myself before but I failed. I've tried therapists and medication and none of them worked. I'm scared to kill myself, but I want to die.",hurt not have sort remotely good life try kill fail try therapist medication work scared kill want die
6698,I used to run a show for my group chat It was called the nocturnal meme show  My friend designed a logo  I presented memes every night and generally things were good  UNTIL dramatic pause  I got burned out  Now the meme show group chat is just a place that people occasionally share memes  I might reboot it one day  start season   That s all folks  go about your reddit browsing,0,I used to run a meme show for my group chat. Now it's just a place where people share memes. I might reboot it one day and start a season.    .   i.e. the meme show group chat is now a place that people occasionally share memes,run meme group chat place people share meme reboot day start season meme group chat place people occasionally share meme
6699,I should take action for once The holidays are always bad but these ones have been extra brutal  I ve done nothing but cry  sleep and eat myself into oblivion for the past two days  Things are too late and I m too late   I need to return someone s sweater  I want to jump in front of a car  I don t know how else to get it done  I really think this is the best option for me   It s just never going to get better than this,1,"The holidays have been hard for me. I need to return someone's sweater. I want to jump in front of a car to get it done. It's never going to get better than this, so I should take action. ",holiday hard need return sweater want jump car go well action
