,text,class,summary,cleaned
49484,I realized somethingthe only way to fix this is either a miracle or killing myself and I m gonna give myself a whole year,1,I realized somethingthe only way to fix this is either a miracle or killing myself and I m gonna give myself a whole year,realize way fix miracle kill go year
49485,I m curious who recognises me   Sorry I just saw someone ask this and I wanted to know as well lol,0,I m curious who recognises me   Sorry I just saw someone ask this and I wanted to know as well lol,curious recognise sorry see ask want know low
49486,Update  Holy shit I got a match on Tinder  Yeah so I told her a joke and she never responded afterwards Can I get an F in the chat bois,0,Update  Holy shit I got a match on Tinder  Yeah so I told her a joke and she never responded afterwards Can I get an F in the chat bois,update holy shit get match tinder yeah tell joke respond chat boy
49487,Flexeril     Xanax     Norcos   You still fucking wake up I am in so much pain  Physical and mental  Everyone I love has left me  Last night I took   Flexeril    Xanax and   Norcos and I still woke up  Tonight I double it,1,Flexeril     Xanax     Norcos   You still fucking wake up I am in so much pain  Physical and mental  Everyone I love has left me  Last night I took   Flexeril    Xanax and   Norcos and I still woke up  Tonight I double it,flex oil anal no cos fucking wake pain physical mental love leave night take flex oil anal no cos wake tonight double
49488,Ending my life at midnightI don t know what awaits me  Is it a better life  after death  I don t know  But  I have to take my chances  I only see dead ends wherever I look  The best thing about my death tho  no hearts will be broken  I lived l alone and will die alone,1,Ending my life at midnightI don t know what awaits me  Is it a better life  after death  I don t know  But  I have to take my chances  I only see dead ends wherever I look  The best thing about my death tho  no hearts will be broken  I lived l alone and will die alone,end life midnight don know await well life death don know chance dead end look good thing death no heart break live die
49489,I m on the verge of suicide after weeks of sleep deprivation and lack of meds and overwhelming life changes and being insulted by my therapist and a suicide number hotline  I m planning to go to the pysch ward next week  I need some advice  I m at my worst state I ve been in in years  I can t take care of myself because I m addicted to my phone and don t sleep until  am to  pm  and the lack of sunlight is putting my body in shock  But lately I ve been barely sleeping at all  I want to buy some books to bring with me to the pysch ward to keep me busy because I need to be nursed back to health in a safe environment that reinforces healthy body schedules like the hospital But my grandpa s funeral service is this Tuesday and burial on Wednesday  I want to pull through long enough to attend that and perform some music for that  and immediately after I ll turn myself in  My family doesn t like me going to the hospital and they re against doctors and shit and think I m putting myself in trouble while they re the ones responsible for my major depression and post traumatic stress disorder and insomnia I want to buy some books off Amazon  one about origami so I can fold some origami  a fiction book that ll keep me happy  and maybe a self help book on depression or managing my emotions I also wanna write down a list of funny jokes from r Jokes to bring with me because everytime I ve been to the psych ward the nurses have good laughs with me cuz I m pretty chill and humorous and not violent towards anyone And also keep a list of phone numbers of my friends that I can call  my best friends that still support me  in case I want to talk to them I m worried my mom won t take good care of my dog even tho she feeds him  very rarely the dog will get out the house cuz of her negligence and I m the one who always brings him back   or that my parents will get angry at me for going to the hospital and they might try and stop me  need some advice on that,1,"After weeks of sleep deprivation and lack of meds, I'm planning to go to the pysch ward next week. My grandpa's funeral service is this Tuesday and burial on Wednesday. I want to attend that and perform some music. After that, I'll turn myself in to the hospital. My family doesn't like me going to a hospital.",week sleep deprivation lack bed plan psych ward week grandpas funeral service tuesday burial wednesday want attend perform music turn hospital family not like go hospital
49490,I m done with my first University semester  Got any questions  And I didn t even fail a class  Way to go me   So yeah  Do ya have any questions,0,I m done with my first University semester  Got any questions  And I didn t even fail a class  Way to go me   So yeah  Do ya have any questions,university semester get question fail class way yeah question
49491,Everything is difficult and nothing is worth itI hope I can do it tonight,1,Everything is difficult and nothing is worth itI hope I can do it tonight,difficult worth hope tonight
49492,Dude I fucking stayed up didn t even sleep so I can go out and eat food outside in the sun  The fucking sun was out and it was warm  But I got food now it s cold asf and raining  And I spent   to eat in the cold when I could have stayed home and slept,0,Dude I fucking stayed up didn t even sleep so I can go out and eat food outside in the sun  The fucking sun was out and it was warm  But I got food now it s cold asf and raining  And I spent   to eat in the cold when I could have stayed home and slept,dude fucking stay sleep eat food outside sun fucking sun warm get food cold rain spend eat cold stay home sleep
49493,Day   of pick up lines until I lose my virginity Your lips look lonely do they want to see mine,0,Day   of pick up lines until I lose my virginity Your lips look lonely do they want to see mine,day pick line lose virginity lip look lonely want
49494,This is the second time I ve thought of killing myself this weekI m not sure how much longer I can hold out from doing it,1,This is the second time I ve thought of killing myself this weekI m not sure how much longer I can hold out from doing it,second time think kill week not sure long hold
49495,A teacher I despise lost his mother So I had this teacher a couple years ago and he is SO mean  He was a big jerk  Every boy hated him  because he was also a big simp and favored girls  But I just got an email that his mother passed away and I m not really sure how to feel  I m not thinking  he deserved it  or anything but I feel bad for him because that must be really hard to deal with  I really am not sure how to take this,0,"A teacher whose son died has lost his mother. The boy who used to hate him is not sure how to feel about it. He was mean to other boys and favored girls, but the boy feels bad for the teacher who lost his mom. ",teacher son die lose mother boy hate not sure feel mean boy favor girl boy feel bad teacher lose mon
49496,Final good bye  Sorry familyFuck life  Im cant stop this  I felll to deep  I putted suicide off i Didn t want to hurt you mom brother nan uncle hurts me knowing itll hurt you  I cant  I love all im sorry for everything i did wrong so many things  Goodbye everything,1,Final good bye  Sorry familyFuck life  Im cant stop this  I felll to deep  I putted suicide off i Didn t want to hurt you mom brother nan uncle hurts me knowing itll hurt you  I cant  I love all im sorry for everything i did wrong so many things  Goodbye everything,final good bye sorry family fuck life not stop fall deep putt suicide want hurt mon brother nan uncle hurt know hurt not love sorry wrong thing goodbye
49497,My dog My IRL dog was killed by a creeper  He was defending me from the creeper and went of a cliff taking the creeper with him  Sadly the creeper exploded anyway so I died  I lost my diamond sword to herobrine because of this This was meant to be a post making a joke about the over the top story s and it when to far I am so sorry,0,My dog was killed by a creeper. I lost my diamond sword to herobrine because of it.    It was meant to be a joke but turned out to be too serious and I am sorry. ,dog kill creeper lose diamond sword brine mean joke turn sorry
49498,Hi I want to die My name is Heather and I really hate myself  I m pretty damn drunk and I want to die  Idk how  Maybe overdosing on something but that would just fuck up my liver  I m trans and it seems like everyone hates me besides other trans people  I m just so miserable and I want to be better  I have therapy on Thursday and my first appointment with a psychiatrist the Wednesday after that  I just want to either be dead or happy  I hate myself so much and I need companionship and affection and love and attention  Blah blah blah blah you ve heard it all before  Im a failure and no one will never be proud of me  I m a problem and my friends are sick of me  hence the public thread on my main account haha  I m fucking miserable  Someone please help me  I m drunk and I want to overdose  I want to die  Life is so hard Update  It s the morning and I m sober and I m safe  Thank you to everyone who helped me through that last night  I m going to do my best to stay strong until I see my mental health professionals,1,Heather is depressed and suicidal. She has therapy on Thursday and her first appointment with a psychiatrist the Wednesday after that. Heather is trans. Heather's friends and family are sick of her. Heather will stay sober until she sees her mental health professionals.,heather depressed suicidal therapy thursday appointment psychiatrist wednesday heather trans heather friend family sick heather stay sober see mental health professional
49499,orange house and I ll make my crush uncomfortable I need filler ok ok ok ok ok ok ok ok ok ok ok,0,orange house and I ll make my crush uncomfortable I need filler ok ok ok ok ok ok ok ok ok ok ok,orange house ill crush uncomfortable need filler
