,text,class,summary,cleaned
206201,The final nail in the coffin was overhearing my parents talk about me behind my backM   I ve been depressed for about a year and a half with my parents denying I have a problem  They call me  lazy  unmotivated  useless I don t have much of a social life so I spend most of my days either at school or alone at home  It s been worse and worse and I think just last week was my  th or  th suicide attempt This afternoon  I overheard my parents talk about me  I don t have much of a connection with my dad so I thought mom was the one I could usually go to  but I heard her say  he s definitely grown up to be much worse than I expected   he can t even get out of bed  and to think that I was working from   and he can t even do his assignments  She seems supportive to me but I know now how she truely feels  Now  I know I can be free  Yeah  she ll be sad  but I m a failure of a child and I wasn t gonna amount to anything anyway  Even if I do end up getting depression medication  I ll just overdose on it  I can really see my existence coming to a close soon  there s nothing here for me,1,"M has been depressed for about a year and a half. His parents call him lazy, unmotivated and useless. He spends most of his days at school or alone at home. Last week he tried to commit suicide. He overheard his parents talking about him behind his back.",depress year half parent lazy unmotivated useless spend day school home week try commit suicide overhear parent talk
206202,All these mfs be like   Fortnite is for kids  PUBG is for men  Girls can t play games amp x B amp x B fuck off and join my Minecraft server  no one cares who plays what    SO SHUT UP  christ,0,All these mfs be like   Fortnite is for kids  PUBG is for men  Girls can t play games amp x B amp x B fuck off and join my Minecraft server  no one cares who plays what    SO SHUT UP  christ,mrs like footnote kid pub man girl play game amp amp fuck join min craft server no care play shut christ
206203,Going through a rough patch  need someone to talk to Been going through a rough patch for the past few days  I was able to keep it together but a financial loss has triggered me back into a massive depressive spiral  I know the financial loss itself is actually small  and money is nothing to ever get worried about  But it pushed the snowball of madness down the hill again and it just stop  I m keep thinking of all my mistakes and failures in life  This financial loss wasn t external  it was due to my mistakes  and that s probably why i m panicking right now  What if i do it again  etc etc etc I think i m having an anxiety attack that won t go away  I can t eat and barely sleep  I m kinda freaking out right now for no good reason  I m finding it hard to breath I don t really need a solution  there is none  I just don t want to feel alone right now  Anyone out there  how are your lives going,1,"A financial loss has triggered a depression in him. He can't eat and barely sleep. He keeps thinking of his mistakes and failures in life. He doesn't really need a solution, he just doesn't want to feel alone.",financial loss trigger depression not eat barely sleep keep think mistake failure life not need solution not want feel
206204,Just feeling shitty I would rather be alone than feel alone around people  i hate being around people that just put me down for anything I do,0,Just feeling shitty I would rather be alone than feel alone around people  i hate being around people that just put me down for anything I do,feel shitty feel people hate people
206205,Are most of your guys  dads kinda shitty  A lot of ppl I know also have shitty dads  is this very common  I mean I get it they have their traumas that s why they behave way they do and I get it  but that doesn t justify their behavior  Idk what to think of it  I totally get it we re all human but I just wish I had some sort of fucking guidance   Raising yourself is exhausting it s like building a LEGO set based only on the box and no instructions  Are most people s dad s shitty,0,"A lot of people I know have bad dads. Raising yourself is exhausting and I wish I had some sort of guidance from my dad. I get it they have their traumas, but that doesn't justify their behavior. ",lot people know bad dad raise exhausting wish sort guidance dad trauma not justify behavior
206206,Just a reminder Chala head chala spanish intro  gt  every single anime opening,0,Just a reminder Chala head chala spanish intro  gt  every single anime opening,reminder chalk head chalk spanish intro single anime open
206207,What s up with all the otters  I just got my phone back from the repair place and half the posts here have or reference otters  I m guessing I missed something,0,What s up with all the otters  I just got my phone back from the repair place and half the posts here have or reference otters  I m guessing I missed something,otter get phone repair place half post reference otter guessing miss
206208,Anyone want free complements  Giving out complements for free  it comes with serotonin as well,0,Anyone want free complements  Giving out complements for free  it comes with serotonin as well,want free complement give complement free come serotonin
206209,Has anyone ever read something in their head with a British accent  Just curious cause I have multiple times  unintentionally,0,Has anyone ever read something in their head with a British accent  Just curious cause I have multiple times  unintentionally,read head british accent curious multiple time unintentionally
206210,I wish I could be convinced its worth it  but its notIt s not like I want to kill myself  I couldn t do that to my parents or brother  I know how much suicide affects family and friends and I could never do that  But  like if there was a car speeding towards me I know I wouldn t step away  If someone pointed a gun at me I wouldn t fucking argue  I smoke for the cancer and drink for the poison  Sometimes I push on my arm just to feel pain  pressing so hard onto the marks I make into my skin that I bleed  I don t like pain but I fucking deserve it  I don t deserve to exist happily and healthily in this fucking world  My life is meaningless because I am a human piece of garbage that isn t worth the fucking time of day  My friends pretend to like me  my parents are brainwashed into  loving  me  I have no future so why not just fucking die now  before I can disappoint the whole world even more   I know I m only   but shouldn t I end it now before I have to fucking fail at life and school and love  Life is terrible and mine is hopeless and meaningless  People have tried to convince me otherwise but they don t know  I am in pain all the time  my mind hurts me  I am constantly miserable and tired and fucking sad  It sucks  I can t like like this anymore,1,Suicide is not an option for her. She doesn't want to hurt her family or friends. She is in pain all the time and is constantly miserable and tired. She wants to end it now before she disappoints the whole world even more.,suicide not option not want hurt family friend pain time constantly miserable tired want end disappoint world
206211,Playing the piano used to be so fun but now it just makes me want to kill myselfI haven t played in like   months and I just tried it but it makes me so emotional and nostalgic and it s bringing up a lot of bad memories  I want someone to please hurt me  I can t believe I m still alive  Someone please kill me,1,Playing the piano used to be fun but now it makes me want to kill myself. I haven't played in months and I just tried it. It makes me so emotional and nostalgic and it brings up a lot of bad memories. Someone please hurt me. ,play piano fun make want kill not play month try make emotional nostalgic bring lot bad memory hurt
206212,I can t decide if I want to keep going or just quit now while I m ahead   Crosspost from  r depression I ve been trying to find a job  and I actually got hired about   months ago now at Arby s but they have yet to put me on schedule or anything so I haven t worked or earned any money yet  And probably won t according to the manager now until sometime next week  I ve already used the   that was given to me at    r assistance that was supposed to be for gas because I was supposed to have started working last week but they keep pushing me around  So now I m broke with a job that I don t even work at   miles away I may be failing my interpersonal communications class  I hate it  the teacher there doesn t even speak English properly  If I fail I lose my Pell Grant but I don t even know what I want to do anymore  I m thinking about taking a short term course for web development I still miss my ex girlfriend  I m in pain every day and think about her constantly even though it s been almost a year and we only dated for   months  but it was the only real relationship I ve ever been in  and   months after we started dating I moved into her new apartment with her and lived with her there until she broke up with me Between not working even though I have a job  being   and living with my mom again  not knowing what to make out of my life  and being still madly and hopelessly in love and constantly reminded of someone who doesn t even talk to me anymore and is dating someone else  I m thinking maybe it would be easier if I just killed myself  Cause I don t know what else to do,1,I got hired at Arby's months ago but I haven't started working yet and I'm broke. I miss my ex girlfriend. She broke up with him a year ago. I'm still in love with her. I don't know what to do with my life.,got hire army month ago not start work broke miss sex girlfriend break year ago love not know life
206213,Night is fun One time I spent an entire night just watching minecraft stuff  I watched like minecraft animations because I was bored and couldn t sleep  I just wanted to  I can t believe it s been   months since I did this,0,Night is fun One time I spent an entire night just watching minecraft stuff  I watched like minecraft animations because I was bored and couldn t sleep  I just wanted to  I can t believe it s been   months since I did this,night fun time spend entire night watch min craft stuff watch like min craft animation bored sleep want believe month
206214,Literally what do i gain from livingif nobody cares and there isn t anything to get out of living anymore because i know i m not getting anywhere in life then whats the point,1,Literally what do i gain from livingif nobody cares and there isn t anything to get out of living anymore because i know i m not getting anywhere in life then whats the point,literally gain live care live anymore know not get life point
206215,PussiesCome on jump you pussies,1,PussiesCome on jump you pussies,pussy come jump pussy
206216,I let everyone in my life down  My life feels like one big failure I have severe mental health issues that my parents will never be receptive about  I can t take care of myself  I opened a business with my fianc  who I just repeatedly let down over and over again because I can t remember things  My dad is drowning in his business and I m supposed to take the work load from him  but I can t keep up with it  So I m just letting him down too  I have dissociative amnesia  which means I lose entire days to dissociation and I forget important tasks  I have been struggling to stay alive for so many years  And I am so fucking tired I find out I have DID  which is a whole new level  I started having these flashbacks of my being abused as a kid  which I have no memory of  So  I could be making it all up  but I ll never know for sure  I can t find a therapist who knows how to treat me  and my last one thought that working on  suppressing my DID  would be a good idea  which it isn t  I just had another flashback not even   minutes ago  and then I come into work only for my dad to start screaming at me because I forgot to do something  yet again  He doesn t know how bad I m doing  He doesn t know I have amnesia  or that I am so  Close  To just checking myself into a hospital  I am so fucking tired of suffering  I m so tired,1,I have severe mental health issues. I have dissociative amnesia. I lost entire days to dissociation and I forget important tasks. I started having flashbacks of being abused as a kid. I can't find a therapist who knows how to treat me. ,severe mental health issue dissociative amnesia lose entire day dissociation forget important task start have flashback abuse kid not find therapist know treat
206217,Why did it take so long to ban boiboiboiboi Does anyone have some unsee juice for me,0,Why did it take so long to ban boiboiboiboi Does anyone have some unsee juice for me,long ban bobbi bobbi unseen juice
206218,Hey jesus monke Hi,0,Hey jesus monke Hi,hey jesus monkey hi
206219,somebody on here told me they knew me as the  person who kept pissing off straight people  and i gotta say this is a very good title this makin me think about the person who called me heterophobic coz i posted a screenshot of somebody selling carts   for lgbt   amp    for cishets omg this website is so funny,0,Someone called me heterophobic because I posted a screenshot of a website selling carts for gay people and for cishets. The website is so funny.    i think this title is a very good title. i think it makes me think about the person who called me. ,call hetero phobic post screenshot website sell cart gay people wish website funny think title good title think make think person call
206220,i can t do it anymorei ve wanted to kill myself for years now i ve just never had the courage  my mum is terminally ill and i have to care for her part time and my friends treat me like shit  with my  best friend  making me cry and have panic attacks every single night  i feel so isolated but i can t do anything about it because i can t move schools or classes so i have to see my friends and her tomorrow and  every day for the next year and a half  i tried telling my best friend how i feel and more specifically how she makes me feel and she turned it on me and blamed me once again i can t stand her but i can t leave her because she s the only person i can hold a conversation with  i ve planned out running  away so many times i can t count but i know i would never survive and i don t want my parents to know that i m somewhere out there not coming home  at least if i kill myself they know there s no way i m coming back  the only thing that keeps me going sometimes is my dog or my little brother both of which wouldn t understand if i just disappeared  i don t want to let everyone down but at the same time i know that no one cares now why should they afterwards  i don t know how i m going to do it as i live in the uk so no guns or ceiling fans for me to hang myself off of but i know i don t want to be here tomorrow  if you re reading this i hope you re stronger than me,1,My mum is terminally ill and I have to take care for her part time. My best friend makes me cry and has panic attacks every night. I want to kill myself but I can't leave her because she's the only person I can hold a conversation with.,mum terminally ill care time good friend make cry panic attack night want kill not leave person hold conversation
206221,She said maybe I asked a girl if she would ever consider dating me and she said maybe  I know this Isn t much at all but damn it feels good  this is a girl who if it was a straight up never she would say it so I m so happy man  although I m not getting my hopes up just yet,0,She said maybe I asked a girl if she would ever consider dating me and she said maybe  I know this Isn t much at all but damn it feels good  this is a girl who if it was a straight up never she would say it so I m so happy man  although I m not getting my hopes up just yet,say maybe ask girl consider date say maybe know damn feel good girl straight happy man not get hope
206222,BRAND NAME IDEAS aight so i m trying to make a brand  i m a magician and cardist so i m going to have playing cards as products  for now  more stuff later  anyways i have ideas  but not a good catchy name  i m looking for something that you ll remember  but also relevant to us  gen z s  so maybe like a meme or something in the brand name  i wanted  Virgin Playing Cards  but there are big company s with  Virgin  as their name  so my fellow teenagers fuck  that sounded cringe  any name ideas,0,A magician and a cardist wants to start a brand called Virgin Playing Cards. He is looking for a good catchy name that is relevant to his generation and relevant to people of his generation. He doesn't want to use Virgin as the brand name.,magician card st want start brand call virgin playing card look good catchy relevant generation relevant people generation not want use virgin brand
206223,I really want to kill myself but I have too many obligationsI couldn t do that to my parents and I am supposed to be moving into a place with my friends soon  I just want to hang myself now before I build more obligations and it seems like waiting for my parents to die would take too long  How do I deal with this  I can t escape without hurting anybody  It s been seven years and I am tired,1,I want to kill myself but I have too many obligations. It's been seven years and I am tired. I want to hang myself now before I build more obligations and waiting for my parents to die would take too long. I can't escape without hurting anybody. ,want kill obligation year tired want hang build obligation wait parent die long not escape hurt anybody
206224,Well I m Stuck My family was taking a road trip and our rv broke down in the middle of nowhere,0,Well I m Stuck My family was taking a road trip and our rv broke down in the middle of nowhere,stick family take road trip break middle
206225,Im  I want a way out thats not suicide and im to weak to talk to someone in person so what,1,Im  I want a way out thats not suicide and im to weak to talk to someone in person so what,want way not suicide weak talk person
206226,Bipolar madnessI ve been plagued with mental health issues since I was a teenager  and I guess it runs in the family since my father was an abusive and horrible alcoholic  Mom tried to commit suicide when I was   years old because of all the violence she was enduring   Fast forward to today  I am   years old and barely able to function  I have a full time job  have had full time jobs in the past and even graduated from a top tier university  But I can t keep holding it together  I ve been a caretaker  an administrator for an organization  and I just can t do anything for a long period of time without falling apart  I had a period of about   years where I did  well  still had my downs where I would sit for hours in my car to just cry  but as the years pile on  my condition becomes more and more debilitating   I was hospitalized  x last year for suicidal ideation and an attempt that took me to the ICU  But I m still here and I can t handle it anymore  I can t do anything without falling apart  I m grasping at straws for hope where there is none and I m tired of it  I m starting to slip up and my new job and it s only been a month  I feel like a complete and utter failure because I went to college to make something more of myself and I can t function anywhere for more than a few months at a time  I hate myself for being alive right now and I screwed up this big event at work  I can t do anything when I m like this  and I m like this a lot  I ve gone to therapy  seen various doctors  tried natural and cultural remedies  but for what  To fail constantly  This is no way to live and I wish people could understand that I can t handle it  I don t want to put my family in a bad place financially because of a cosign I have on a lease  but I know I m going to do it  Maybe tonight  maybe later in the day,1,Bipolar disorder has been a problem for me since I was a teenager. I was hospitalized last year for suicidal ideation and an attempt that took me to the ICU. I feel like a failure because I went to college to make something more of myself. I don't want to put my family in a bad place financially because of a cosign I have on a lease.,bipolar disorder problem teenager hospitalize year suicidal ideation attempt take ice feel like failure go college not want family bad place financially cosign lease
206227,Help I really dont know how to start tbh  on Reddit for a while now but never posted anything  I m   years old from germany pls excuse my bad english  So i tried to take my life atleast   times now wich failed obvs  first try was like   years ago by jumping out of my bedroom window at my parents house of course my parents noticed so they send me to see a therapist he told me that i m just confused and too young so after going there a few times i got told to grow up and get over it so i did i finished school and started to be an adult  But a few weeks later i tried to kill myself again and it almost worked my sister found me and told my parents so i got rushed to the hospital and they saved me  After all off that i really did my best and it went well i thought i had everything i needed and my family is proud of me wich never happend  The past   years been the worse for me i tried to overdose on painkillers cut myself etc  I have a really good friend well tbh my bestfriend over in England she saved my life more then once  more then i ever told her  she is fighting Depression herself for a long time now and i do my best to be there and help where i can  She really means alot to me  My friends here dont understand why i feel like this and why i tried to kill myself they just tell me to stop beeing a pussy cause my life cant be that bad  So i thought true it s not that bad and yeah i can do it but nope this month i wanted to die more then ever  i hurt myself almost everyday by punching a wall so bad that my hands bleed and i cant move em for hours sometimes  i started to isolate myself from my family and most of my  friends  Honestly  i m gonna do it again tonight  I dont want to be a bourden to anyone anymore,1,I'm from Germany and I've been on Reddit for a while now but never posted anything. I've tried to kill myself several times in the past. I have a good friend in England who saved my life more than once. ,germany geddit post try kill time past good friend england save life
206228,Hotline just hung up on meIn the middle of me talking about how I felt like no one cared about me  She had given some advice but I explained further and then she suddenly went dead silent  I waited about two minutes and then the call hung itself up  We weren t even   minutes into the conversation Lmao guess no one does care about me  even a professional can t pretend to care for   minutes,1,Hotline just hung up on me in the middle of a conversation. I was talking about how he felt like no one cared about him and she suddenly went dead silent and didn't respond for two minutes. It wasn't even minutes into the conversation.,hotline hang middle conversation talk feel like no care suddenly go dead silent not respond minute not minute conversation
206229,T s advice brought me back to suicidal thoughtsI hadn t had suicidal thoughts in a long time and T wanted me to push my boundaries and said I HAD to do it   minutes a day no matter what  Within   I was crying  within   I was having my first panic attack in months  I was set on continuing because T said I had to but my partner got mad at me for it which just made everything worse  My brain is screaming at me to die and there s nothing I can do,1,T's advice brought me back to suicidal thoughts. My partner got mad at me for following T's advice. I was having my first panic attack in months. My brain is screaming at me to die and there's nothing I can do. ,advice bring suicidal thought partner get mad follow advice have panic attack month brain scream die
206230,I m about to lose everythingI married my high school sweetheart   years ago   I ve never been with anyone else  I ve never wanted to   We had a baby right after high school  he kind of freaked out and left me for another girl  He was madly in love with her but for whatever reason things didn t work out between them  Two years later he found his way back to me and we were married We ve had our problems and worked through them   I thought we were doing okay until I found out he is back in touch with her and is trying to work on a relationship with her   I m devestated   I don t know how to be anything but his wife   I ve been a stay at home mom and homemaker this entire time   I don t know how to start my life over   I don t want a life without him   Over and over the only answer I come up with is suicide,1,After high school he left his wife for another girl. Two years later he found his way back to her and they were married. Now he's back in touch with her and trying to work on a relationship with her. She's devastated and wants to commit suicide.,high school leave wife girl year later find way marry touch try work relationship devastate want commit suicide
206231,Light mode is better  Fight me  Or just change my mind,0,Light mode is better  Fight me  Or just change my mind,light mode well fight change mind
