,text,class,summary,cleaned
160667,i keep tryingto work up the courage to just jump  i ve been standing at this tall building at my uni for everyday now  i don t know how to make it better anymore  i just want it to stop,1,i keep tryingto work up the courage to just jump  i ve been standing at this tall building at my uni for everyday now  i don t know how to make it better anymore  i just want it to stop,try work courage jump stand tall building uni everyday don know well anymore want stop
160668,No one cares about me anymore  I m living for nothingI feel like I m going mad  My words are gonna sound funny I m gonna crack jokes I m just trying to cope really hard I don t even know what I m doing  The friends I have I can t even vent to them  What does venting even do  I feel so fucking useless every time I breathe and walk and wake up  I m just a burden on everyone a pure waste of space and I know that if I killer myself rn my siblings would be happy to get my bedroom  to get my clothes and my ukulele  and my egg chair  They d sell all my stuff and forget about me I feel valued by nobody  Nobody values me  I tried to talk to my mom and I can t even do that without being scared from fuckign childhood trauma  Every time I fail she threatens to take everything away from me  She threatens to sel my dog  And my dads even worse  All he does is yell   My friends are so happy  Liek they don t even talk to me anymore  No one talks to me anymore  I always have to intimate everything  they find problems in everything I say  And it s not as simple as find new friends because every time I do they just end up blocming me and I adding me and I don t get why I m doing wrong  What am I doing wrong  Why is everything I do and say such a problem  Why am I just so repulsive that people don t even wanna talk to me  Why do I bomb every relationship romantic and platonic   I talk to my therapist but she always says the same thing and the same techniques aren t even working anymore I m hitting a fucking road block  My mom doesn t respect me,1,"No one cares about me anymore. My mom doesn't respect me. My friends don't talk to me anymore, because they find problems in everything I say. I try to talk to my therapist, but she doesn't help. ",no care anymore mon not respect friend not talk anymore find problem try talk therapist not help
160669,Alive alive butI ve been suicidal  And I can t help but think how things will still be okay  Once I m gone  The sun will still rise and fall  My friends will still have school  Thanksgiving and Christmas will still be here  Life will still be here  They will still smile  They will still laugh  They will still cry  Theyre gonna continue with life  Meet new people  New adventures  New people to love  After I m gone  Can anyone talk about this with me  I m not blind to the fact my absence will be different and unsettling  BUT LIFE WILL ALWAYS GO ON  Whether I m alive or in a grave  Any thoughts  I apologize if this came off triggering for others,1,"After I'm gone, I'll meet new people, have adventures and find new people to love. Life will go on whether I'm alive or in a grave. I apologize if this came off triggering for others, but I'm not blind to the fact. ",go meet new people adventure find new people love life alive grave apologize come trigger not blind fact
160670,hi fello homo sapiens and hetero sapiens  discord server and my friends r trying to get  new peoplee  we chat  send memes  play games like minecraft among us overwatch all that stuff  and such going on  is not a commitment  guys and girls welcome  dm for link  D,0,hi fello homo sapiens and hetero sapiens  discord server and my friends r trying to get  new peoplee  we chat  send memes  play games like minecraft among us overwatch all that stuff  and such going on  is not a commitment  guys and girls welcome  dm for link  D,hi hello homo sapiens hetero sapiens discord server friend try new people chat send meme play game like min craft watch stuff go not commitment guy girl welcome link
160671,Should I do more shitty photoshop in the future I was wondering if anyone was interested on having their shitty ideas materialized,0,Should I do more shitty photoshop in the future I was wondering if anyone was interested on having their shitty ideas materialized,shitty photo shop future wonder interested have shitty idea materialize
160672,My dog is a Karen help    Idk what to do guyzzzz,0,My dog is a Karen help    Idk what to do guyzzzz,dog karen help not know guy
160673,Did I fail nnn  I nutted but I swallowed it and it s back in my system so i technically never failed,0,Did I fail nnn  I nutted but I swallowed it and it s back in my system so i technically never failed,fail net swallow system technically fail
160674,I planned to do it today I w as gonna do it today  One of my friends asked to hang out with me on vacation  I brought her along because I know I wouldn t do it with her here  I still think about it though  Right now I m in Hawaii I ve had a blast here but I feel like if someone came up to me and put a gun to my head I would just breathe and close my eyes  I don t think I m going through half of what anyone here is  This Reddit has been of help to me  Please just find a reason even if it s for one day  My reason was allowing my friend to hang out with me during the holidays tomorrow I will find a new one  Just find a reason everyday   I was gonna hang myself that was my plan  Not tonight though,1,"Reddit has been of help to him. He is in Hawaii. He allowed his friend to hang out with him during the holidays. He will find a new reason to hang himself tomorrow. He was going to do it today, but changed his mind. ",geddit help hawaii allow friend hang holiday find new reason hang tomorrow go today change mind
160675,of school is useless Change my mind  Filler filler filller filler filler filler filller filler filler,0,of school is useless Change my mind  Filler filler filller filler filler filler filller filler filler,school useless change mind filler filler filler filler filler filler filler filler filler
160676,How often do you think about suicide Just a question  as I think about it every day  Is it normal to think about suicide often  Probably not  I d just like to hear other s thoughts about the issue   As a sidenote I m not going to ever pull through with it I m just wondering if it s as normal as I think it may be,1,"Is it normal to think about suicide often? I would like to hear other people's thoughts about the issue. I'm not going to commit suicide, but I wonder if it's as normal as I think it may be. ",normal think suicide like hear people thought issue not go commit suicide wonder normal think
160677,Should I go to the hospital for suicidal thoughts Lately  I m thinking of cutting myself and I tried a couple of times  It hurt so I stopped  But  I m afraid that I will try to cut deeper sometime  I think of suicide every day  I ve gone to the hospital before but I was discharged too early for me to be admitted to the psych ward  I have no support from my family and the crisis center  my pastor  therapist  and medication has failed me  I don t mind going but I m aftaid there s going to be no hospital beds because of corona  What should I do  I m tired of feeling like shit every day,1,"There will be no hospital beds because of Christmas, so I don't know if I should go to the hospital for suicidal thoughts. I tried cutting myself a couple of times but it hurt so I stopped. I think of suicide every day and I have no support from my family and the crisis center.",no hospital bed christmas not know hospital suicidal thought try cut couple time hurt stop think suicide day no support family crisis center
160678,when the imposter is sus,0,when the imposter is sus,imposter
160679,Come to think of it Darting your homie is like using two in one shampoo and conditioner,0,Come to think of it Darting your homie is like using two in one shampoo and conditioner,come think dart homie like shampoo conditioner
160680,Great questionWhy should I live,1,Great questionWhy should I live,great question live
160681,I don t want to live anymoreI m   years old  been in the army for four years I have   months left with no idea what I m going to do when I get out   I am deployed currently  Tonight I ruined things with my girlfriend and she left me  I ve had depression my whole life and thought of suicide often for as long as I can remember and attempted it once with pills in highschool  I only hurt the people I m around and I constantly lie to the ones I love and I make people feel bad about themselves and them bad for me with pity  I don t want to feel pain anymore and I won t want to give anyone any more pain  I wish i would get killed out here so the burden of suicide wouldn t hurt my family and loved ones  I don t want to feel anything and I wish I could stop existing without hurting people as well,1,Tonight my girlfriend left him. He has been in the army for 4 years and is currently deployed. He is depressed and has tried to kill himself in high school. He doesn't want to live anymore. He wants to be dead.,tonight girlfriend leave army year currently deploy depressed try kill high school not want live anymore want dead
160682,sat on my window for half an hour and came back downstill living with my parent at the age of   have an low pay job for   yrs  been asked for doing so called  scientific research  which in my eyes are total bullshit  Don t want to produce pieces of crap anymore  don t know what I am really capable of either  Don t even dare to quit my job Don t want to go any further in the path that will lead to my mental death  but when I sat on the window of my bedroom I just lacked the strength to make the final jump Now I allow myself for another morning  for there s some trivial job at workplace to be done,1,"At the age of 25, she is still living with her parents and has a low pay job doing scientific research. She doesn't want to work anymore and doesn't know what she is capable of. She sat on her window for half an hour and came back down.",age live parent low pay job scientific research not want work anymore not know capable sit window half hour come
160683,I Think I ve SnappedFuck   Fuck fuck fuck   I think I ve fucking snapped   This isn t even suicidal ideation at this point as much as it is   years worth of keeping shit buried   I think something inside me snapped yesterday and now the floodgates are open and I m on the brink of madness I don t know if I can weather this   I need to weather this but I don t know that I m strong enough   This is something that ll probably take years of therapy to fix if I m lucky   And that s if my family is understanding Why d it have to fucking happen now   Of all times   When people are counting on me the most   I mean I want to live but goddamn   Brain chemistry is winning I don t think I can go back to fully being a normal person   I ve got anxiety  PTSD  and disassociation up the whazoo but I ve never been diagnosed so nobody fucking realizes this except my girlfriend and the one time I tried to talk about this shit with my parents as a kid they blew it off    Part of me wants to just walk in one direction and never look back   Fuck everything   Fuck responsibility   I m tired of being the only one holding things together and having to pretend I m fine and dandy throughout it   I m tired of being a fucking doormat and punching bag for people to vent with   When the fuck do I get my venting session  When the fuck do I get to be the weak one   Fuck   The entire fucking universe is trying to kill me it feels like and all people have to comment on is what a shit job I m doing when it comes to surviving And I feel stupid about this   Like I should have been able to weather this shit but then my brain got in the way Fuck,1,I think something inside me snapped yesterday and now the floodgates are open and I'm on the brink of madness. I have anxiety PTSD and disassociation but I haven't been diagnosed. I want to live but I don't know if I'm strong enough.,think inside snap yesterday floodgate open brink madness anxiety pt disassociation not diagnose want live not know strong
