,text,class,summary,cleaned
131984,I have reached procrastination levels that should not be possible I was literally procrastinating walking   steps to get to my computer to play minecraft  I was just lying there on my bed  I didn t even have my phone Fuck,0,I have reached procrastination levels that should not be possible I was literally procrastinating walking   steps to get to my computer to play minecraft  I was just lying there on my bed  I didn t even have my phone Fuck,reach procrastination level not possible literally procrastinate walk step computer play min craft lie bed phone fuck
131985,depressionI ve been in this state many times  even when I am out of it and functioning perfectly healthy the feeling of pessimism and depression always lingers around me  I know i m prone to depression  After all this meaningless existence I end up not giving  a damn about life  I m quite ready and quite tired  My grandmother is in a sickly state  fighting multiple myeloma  I see her and I think she s had a pretty good life and now dying soon  may be couple years at most  I don t know  The end is near  why fight it  I know i can fight on but I don t give a damn  so i reason that people like me don t deserve to be alive  All i do is cause others trouble  Fuck life,1,After all this meaningless existence I end up not giving a damn about life. My grandmother is in a sickly state fighting multiple myeloma. She's had a pretty life and is now dying soon. I know I can fight on but I don't give a damn.,meaningless existence end not give damn life grandmother sickly state fighting multiple myeloma pretty life die soon know fight not damn
131986,I need someone  anyone to talk to  I m so alone I have no support in my personal life and I m feeling trapped  I want it to end but it just won t,1,I need someone  anyone to talk to  I m so alone I have no support in my personal life and I m feeling trapped  I want it to end but it just won t,need talk no support personal life feeling trap want end will not
131987,Someone to talk toI just want someone in life I can talk to  It just feels like all my my  friends  don t really care about me  They only ever hit me up when they need something  The other day my friend was asking me for something and I was unable to get it for him but I definitely expressed interest in joining him and my friends that night  But of course  I wasn t invited when they found it on their own  I just feel like everyone forgets about me  they just have better things to think about then me and I m always just being left out to dry  There s this girl I really fucking like  But I just can t seem to figure out how she feels about me  I struggle a lot with social anxiety  so I don t have the balls to just make a move on her anything  But I hate seeing her slip away and I wish I just knew how she felt about me  I hate this stupid life  I hate feeling so all alone all the time  I just want someone that I can talk to about my problems  someone to vent to and someone that can understand me  I lay in bed last night just think about how my life has been one upset after another  I realized there was nothing worth me living for anymore  I realized that I d rather just be dead than live through this dumb awful life,1,"All my friends don't really care about me. They only call me up when they need something. There's a girl I really like, but I struggle with social anxiety and I don't have the balls to make a move on her.",friend not care need girl like struggle social anxiety not ball
131988,What should I randomly text her about You know who,0,What should I randomly text her about You know who,randomly text know
131989,my mother caught me smoking weed Hello i am an   yrs old student from germany Last night i was smoking a joint and my mom smelled it when she smelled it  she immediately got pissed off and wanted me to open my door After hiding my things I opened my door and she wanted to look into my eyes  my eyes looked normal she asked me what i had smoked and i said it was a cigarette but she didn t believe me apart from smell  there is no evidence of consumption now i don t know what to do so please help m what should I do every advice helps EDIT Folks the problem has been solved i spoke to my mother and I lied so well she believed me All in all i now know i am a bad person and i need to stop smoking weed,0,My mother caught me smoking weed last night. I lied to her that I had smoked a cigarette. Now I know I am a bad person and I need to stop smoking weed.    i spoke to my mother and she believed him. ,mother catch smoking weed night lie smoke cigarette know bad person need stop smoking weed speak mother believe
131990,Though it s the end of the worldDont blame youself,1,Though it s the end of the worldDont blame youself,end world ont blame
131991,What s with the  u  is my favorite redditor thing  I m not complaining  just curious  Also can I be someone s favorite redditor,0,What s with the  u  is my favorite redditor thing  I m not complaining  just curious  Also can I be someone s favorite redditor,favourite redd tor thing not complain curious favourite redd tor
131992,Im the kid that has wanted to play Overwatch for   years now  can finally get it in   but is terrified to Because the people I would play with  my friends on xbox  have been playing for years and the way that I am says that if I m not close enough to their level  I feel like everytime we loose a match its my fault   Ive wanted to play with them for a while  but I am terrified to let them see i play it until I am close enough to their level to let them see that I do  At least xbox has the  be seen as offline  thing that I can turn on when I do for a few weeks,0,The kid who has wanted to play Overwatch for years can finally get it in but is afraid to because the people he would play with his friends on Xbox have been playing for years and he doesn't want to lose a match to them.,kid want play watch year finally afraid people play friend box play year not want lose match
131993,Pretty poeticI talked her down and convinced her to stay halfway through December  we were together for four years  She left me mentally in March  officially in August after she told me she didn t love me anymore  Now here I am  where she was when we met  Pretty poetic ending  I wish it hadn t ended,1,Pretty poeticI talked her down and convinced her to stay halfway through December  we were together for four years  She left me mentally in March  officially in August after she told me she didn t love me anymore  Now here I am  where she was when we met  Pretty poetic ending  I wish it hadn t ended,pretty poetic talk convince stay halfway december year leave mentally march officially august tell love anymore meet pretty poetic ending wish tend
131994,Guys wtf Why do the snoo teens get me acting up  Tf,0,Guys wtf Why do the snoo teens get me acting up  Tf,guy whf snow teen act
131995,My girlfriend is planning to kill herself and I need help I don t want to post too many details here in case she sees this  but I will pm anyone who wants to help with more information  I really appreciate it I m in high school  and so is my girlfriend  She s been a victim of many rapes and crimes since age   and struggles with ptsd anxiety  depression  and severe anorexia  She is the sweetest  kindest girl  but I can t concvince her to eat more than a little each day  and I can t convince her to stay alive  I need advice  I d rather not say anything to her parents or any authorities RIGHT NOW  simply because she has no plans to kill herself immediately  just sometime down the line in a few months  But I want this to turn around right now  Please  tell me what to do  If any of you people have an interest in helping me and what more information or want to discuss things  please pm me  I d appreciate it so much,1,My girlfriend is planning to kill herself and I need help. She's been a victim of many rapes and crimes since age and struggles with ptsd anxiety depression and severe anorexia. I can't convince her to eat more than a little each day and I don't want to say anything to her parents or authorities.,girlfriend plan kill need help victim rape crime age struggle pts anxiety depression severe anorexia not convince eat little day not want parent authority
131996,I don t know if I can last   days alone I m not suicidal and I haven t been having suicidal thoughts  but I don t know where else to put this Every moment of my life is spent thinking about how alone I am  I d do anything to have someone to cuddle up with and just spend time with  but there s a few big obstacles in my way  I m in high school  I have no social skills and am incredibly introverted  and I m into BDSM  I can t be in a relationship with someone who isn t also kinky  but I m not in much of a position to be picky  Even ignoring that  I still have no way to find a partner   I see a therapist every few weeks on my own dime during school to keep me from going crazy with loneliness  but the session cab cost is getting to be too much to handle  It s damn good that I m already taking Prozac for unrelated reasons  or else I can t imagine how depressed I d be right now I won t be depressed in   days or so  I m counting down the days until I m   because I know that that s when I ll start to be happy again  When I m   I can try meeting people on dating sites  I can go to BDSM munches  meetups  and I can fully explore my sexuality  But I don t know if I can last three years  At the very least  I know I can t last three years alone,1,"Every moment of his life is spent thinking about how alone he is. He's in high school, has no social skills and is introverted. He has no way to find a partner. He sees a therapist every few weeks on his own dime during school, but the cost is too much. He takes Prozac for unrelated reasons.",moment life spend think high school no social skill introvert no way find partner see therapist week dime school cost take prozac unrelated reason
131997,baguette baguette the rain is wet baguette baguette I stole your pet,0,baguette baguette the rain is wet baguette baguette I stole your pet,baguette baguette rain wet baguette baguette steal pet
131998,My penis is two inches erect That s a lie  don t believe everything on the internet you dirty cumslut,0,My penis is two inches erect That s a lie  don t believe everything on the internet you dirty cumslut,penis inch erect lie don believe internet dirty cum slut
131999,i am horny and i have a silver to give away so the horniest comment on this post wins a silver,0,i am horny and i have a silver to give away so the horniest comment on this post wins a silver,horny silver away horny comment post win silver
132000,Late night thoughts What if an alternate version of you or someone similar to you was on Reddit and like you talked to them not knowing that they are actually similar to you or are you alternatively if that makes sense Anyways  goodnight,0,Late night thoughts What if an alternate version of you or someone similar to you was on Reddit and like you talked to them not knowing that they are actually similar to you or are you alternatively if that makes sense Anyways  goodnight,late night thought alternate version similar geddit like talk not know actually similar alternatively make sense anyways goodnight
132001,How am I to last here  I do not think I am depressed but I yearn for the release of death My thoughts may one day get the best of me  everyday has become a civil war in my brain between rational and irrational thoughts  this civil war had ended for   days last week  my head was clear  I was happy for   days  but it went to shit again,1,"There's a civil war in my brain between rational and irrational thoughts. I don't think I'm depressed, but I yearn for the release of death. I was happy for days last week, but it went to shit again. ",civil war brain rational irrational thought not think depressed yearn release death happy day week go shit
132002,Sister might be suicidal so im a college student that is returning home in the next few days  and my mom is worried that my sister may be suicidal  she is a sophomore and had a rough academic semester juggling basketball  a big big passion of hers  and academics  that my mom stresses a lot   her friends at school have reported her to the counselor for trying to overdose on medication that wasn t prescribed to her  and my mom has found random pills in her room that aren t hers  a friend of ours also recently hosted a christmas party  that my sister didnt go to claiming she was  sick  aside from her basketball friends  she has shut herself off from the rest of the family and has my mom worried sick  for some reason  my dad keeps downplaying her fears though on top of this  she recently bought two books that both deal with dark topics like suicide and depression  she s reading It s Kind of a Funny Story and   Reasons Why   do you guys think these signs are enough to show suicidal thoughts or at least depression   ill be back home soon  but i dont know where to start in comforting my mom and consoling my sister  any advice would be nice,1,My mom is worried that her sophomore daughter might be suicidal. Her friends at school have reported her to the counselor for trying to overdose on medication and for taking random pills. She has shut herself off from the rest of the family and has recently bought two books with dark topics like suicide and depression.,mon worried sophomore daughter suicidal friend school report counselor try overdose medication take random pill shut rest family recently buy book dark topic like suicide depression
132003,Insecure and horribleI am very insecure   I need constant assurance and validation   I am acutely aware of how I act but am powerless to stop how I feel   If a friend talks to another friend  I get insecure  feeling I ve been abandoned It s soo stupid  and I really despise myself for feeling like this and acting like this  I m so close to texting everyone saying I m going to end it all  sorry for everything I m supposed to be better than this  I m   I m supposed to be mature,1,"Insecure and horrible. She needs constant assurance and validation. If a friend talks to another friend, she feels abandoned. She is close to texting everyone saying she's going to end it all. She's supposed to be better than this.",insecure horrible need constant assurance validation friend talk friend feel abandon close texte say go end suppose well
132004,Goodbye virgins  deleting reddit for now see ya l er i spend too much time here its not good  i deleted youtube a little while ago and it was useful but now i ve transitioned fully to reddit and it ain t that great either  i can t delete it on my computer tho for obvious reasons so i m not fully gone  but anyways cya,0," virgins are no longer deleting reddit because they spend too much time here.    They can't delete it on their computer.  It's not that useful. It's still not deleted on their computers, so they're not fully gone. ",virgin no long delete geddit spend time not delete computer not useful not delete computer not fully go
132005,u WortestGrammar Hello  Nice to meet you  I can t stop seeing your name in New  What s up dude,0,u WortestGrammar Hello  Nice to meet you  I can t stop seeing your name in New  What s up dude,corte grammar hello nice meet stop see new dude
132006,Today was bad Today i hung myslef twice rn i cant breath correctly my head is pounding rn,0,Today was bad Today i hung myslef twice rn i cant breath correctly my head is pounding rn,today bad today hang twice right not breath correctly head pound right
132007,I ve low key been sick thinking about how awkward it s gonna be for my date to homecoming  I asked her to hoco even though we haven t regularly seen each other in over a year  I had to ask her over email because she doesn t have a phone  We hadn t really talked much until around a week or so before I asked her to the dance  She went to my old school and she doesn t know anyone that goes to my school  so I m worried it s gonna be a super awkward evening for her  Her school wouldn t have had hoco anyway  and I m pretty sure she at least  somewhat  likes me  so I m really not sure if my concern is misplaced  Either way  I just needed to tell someone  What can I do to make it as comfortable for her as possible,0,"My date is going to the homecoming dance with me. She went to my old school and doesn't know anyone from my school. She doesn't have a phone, so I had to ask her over email. She likes me. ",date go homecoming dance go old school not know school not phone ask email like
132008,Anyone from the west coast  Oregon gang rise up  But be careful  because if one of you manages to goof and start another fire I will hunt you down,0,Anyone from the west coast  Oregon gang rise up  But be careful  because if one of you manages to goof and start another fire I will hunt you down,west coast oregon gang rise careful manage goof start fire hunt
132009,I just need a girl in my lifeI have a void that isnt filled  I ve been alone since I was a kid and my life has no purpose  I need someone to love  Someone to care about  Someone I can cuddle and watch a movie with and tell her I love her,1,I just need a girl in my lifeI have a void that isnt filled  I ve been alone since I was a kid and my life has no purpose  I need someone to love  Someone to care about  Someone I can cuddle and watch a movie with and tell her I love her,need girl life void not fill kid life no purpose need love care cuddle watch movie tell love
132010,Good news I guess  For the longest time I have been feeling mentally worse and worse yet tried to not really show it to people  After today where I had a good conversation with a like minded individual  I have come to a conclusion that I ve got to get myself together so now I will try to look at less dark things since that is one of the things that was degrading me  I shall also stop hating myself since it is one of the main things I ve been having an issue with  From now on I want to get a hold of myself and change  I have only one thing that I should ask and that is what are some ways to help with self love  Thank you for reading and I hope you have a good day  I also wish to thank all of you people just cuz why not Sorry if I chose the wrong flair I didn t know what to choose,0,"After a conversation with a like minded individual, he has decided to change his lifestyle and focus on less dark things. He will also try to stop hating himself as it is one of the main things he has been having an issue with.",conversation like minded individual decide change lifestyle focus dark thing try stop hate main thing have issue
132011,Do you guys think its gonna work I m thinking in going somewhere where no one can find me and die from dehydration,1,Do you guys think its gonna work I m thinking in going somewhere where no one can find me and die from dehydration,guy think go work thinking go no find die dehydration
132012,Just need someone who knowsRight now I m giving myself no more than two weeks  I ve been only getting worse lately and I don t think I can handle it any longer  I feel like my own body doesn t belong to me and everything I have could ve been used so much better by anyone else who somehow can deal with how it all is  On one hand I want to live and experience what I can have living on my own which I really long for  on the other I just feel this strong urge and desire to end it  the very thoought of it feels so peaceful  like a happy ending  Everyone around me thinks that i s enough to  change the way I think  they say it s all my fault  blame me for everything I feel  they don t understand that I ve been trying for years now  did all I could to keep trying and going forward and I just can t anymore  it d be so much easier if they just  stopped saying that  let me sort things out on my own  but now it s not yet possible and I won t be able to wait long enough I think I just need someone who understands and knows how does it feel like and that  being positive  doesn t change shit  either that or I ll just ask to be locked up in a hospital  I just want someone to help me after all this time  part of me doesn t want to just die,1,Right now I'm giving myself no more than two weeks to get better. I feel like my own body doesn't belong to me and everything I have could have been better used by someone else. I want to live and experience what I can have living on my own but I also want to end it. ,right give no week well feel like body not belong well want live experience live want end
132013,Life just seems too hardI feel like life just always finds a way to beat me down when I m starting to feel good about things  I feel it s all trivial too  People have real problems and all mine seem small and insignificant  I have never been great with money but recently I have stated to get a head just a little bit  Then last Friday after a particular good day I m driving and boom my car just stalls out  Find out it s going to be a somewhat pricey fix so it s going to wipe me out and then I had to borrow money from my parents to finish paying for it  It just feels that every time I m starting to get ahead in anyway shape or form life decides to punch me in the balls and remind me of my place  I also feel that I m being over dramatic  Life just seems to hard for me someday and I feel like I would better off not here  Well that s my rant thanks for reading,1,Life always seems to beat me down when I'm starting to feel good about things. People have real problems and all mine seem small and insignificant. Life just seems to hard for me someday and I feel like I would better off not here.,life beat start feel good thing people real problem small insignificant life hard someday feel like better not
132014,DAE ever have a really shitty day and think to themselves  There s always suicide  and it brings a smile to their face just knowing that there s a way out of this hell Just wondering,1,DAE ever have a really shitty day and think to themselves  There s always suicide  and it brings a smile to their face just knowing that there s a way out of this hell Just wondering,date shitty day think suicide bring smile face know way hell wonder
132015,IdkI think it s time I think I m going to do it  I m posting this now because there s never people on at night but if there is anyone on I ll talk for a little,1,IdkI think it s time I think I m going to do it  I m posting this now because there s never people on at night but if there is anyone on I ll talk for a little,d think time think go post people night ill talk little
132016,what a waste of sperm I amwoah,1,what a waste of sperm I amwoah,waste sperm amway
132017,I dont deserve to be aliveMy whole life has been a waste  and I hate it I dont deserve to be alive  I dont do nothing  I dont produce or do anything worthy of living  I hate being here because its either stressfulness all day or being bored as fuck  I try learn new things but cant even grasp the simplest of concepts  everything is too hard for me and I need to constantly ask people for help  my social anxiety is too high   My future is already finished  Dream job and career all gone down the drain  In a few weeks I might have to be taught via home school which will cripple any chance of finding friends  gf   If only I could have the courage to off myself instead of being a pussy  there is a bridge near my house but the fear of surviving is too scary of a thought My future will just be more pain and misery  Ive failed everything in college this year and lost   of the closest people in my life  I want to be next  nothing seems to be going right no matter how much I try  one problem turns into   with no solutions  if this isnt a big enough sign Idk what else is,1,"Everything in his life has been a waste and he hates being alive. He has failed everything in college this year and lost his closest friends. He might have to be taught via home school in a few weeks, which will cripple his chances of finding a girlfriend.",life waste hate alive fail college year lose close friend teach home school week cripple chance find girlfriend
