,text,class,summary,cleaned
201183,i m taking a shit rn that s all i wanted to say   thanks for coming to my ted talk,0,i m taking a shit rn that s all i wanted to say   thanks for coming to my ted talk,take shit right want thank come ted talk
201184,Off my chestI plan on committing suicide soon  I ve  premeditated it  bought everything I need for it  I feel relief more than sadness I just wanted to get this off my chest so I don t burden myself with guilt  I don t have anyone who will miss me  but I feel like I m failing myself  I know it s ok though,1,I plan on committing suicide soon. I feel relief more than sadness. I don't have anyone who will miss me but I feel like I'm failing myself. I want to get this off my chest to relieve myself of guilt. ,plan commit suicide soon feel relief sadness not miss feel like fail want chest relieve guilt
201185,Failing everything  againCheers to my first semester,1,Failing everything  againCheers to my first semester,fail cheer semester
201186,Day   Of Posting Until I Get A Girlfriend Yes I still am posting,0,Day   Of Posting Until I Get A Girlfriend Yes I still am posting,day post girlfriend yes post
201187,Forget it  I m doing it today I posted earlier today  I thought I was going to kill myself on Thursday or Friday  but I just listened to some cool music on You Tube and went through Facebook and found an awesome picture of my ex that made me happy to see  and it s time   I m doing it right now   No one even cares enough on here to do anything about it   I was posting on here to keep me preocupied today because I m off from work and I don t have friends but nobody even wants to talk to me on the internet   This has been the dumbest life   I quit,1,"Nobody wants to talk to me on the internet. I'm off from work and I don't have any friends. I was going to kill myself on Thursday or Friday, but I found a picture of my ex on Facebook and I'm doing it now. ",want talk internet work not friend go kill thursday friday find picture exon facebook
201188,i just got a free award thing comment something and i ll give u it idk,0,i just got a free award thing comment something and i ll give u it idk,get free award thing comment ill not know
201189,Where my light mode homies atttt  Am I the only one I genuinely don t know a single other person on light mode,0,Where my light mode homies atttt  Am I the only one I genuinely don t know a single other person on light mode,light mode homie att genuinely don know single person light mode
201190,Suicidal user in r advicehttps www reddit com r Advice comments j nlw what are some good escape methods,1,Suicidal user in r advicehttps www reddit com r Advice comments j nlw what are some good escape methods,suicidal user advice geddit com advice comment new good escape method
201191,Tomorrow s my birthday  Should I just delete my account and make a new one,0,Tomorrow s my birthday  Should I just delete my account and make a new one,tomorrow birthday delete account new
201192,Culmination of things came to a head tonight  years really meant nothing  because I just ignored the signs  Tonight my LTR is finally over  It was ugly and physical    years of fighting these invasive thoughts and I knew they would always win  It s who I am  I m not going to do it now  I just wanted to say I m really sad but also want to say how much I appreciate the fact I m not alone and we re here for each other  No one can ever understand suicidal thoughts ideation if they ve never been here  but we understand what it is  It s weird when the most destructive impulses offer the most comfort,1,Tonight my LTR is over. It was ugly and physical years of fighting these invasive thoughts and I knew they would always win. I appreciate the fact I'm not alone and we're all here for each other. No one can ever understand suicidal thoughts ideation.,tonight ltd ugly physical year fight invasive thought know win appreciate fact not no understand suicidal thought ideation
201193,I m in shock Someone I did consider a close friend just sent me a video of someone stomping on a chick  It was on snap and it was two things the first was just a picture of it the next was someone doing it I feel like I m going to throw up I even responded aww to the first message  I ve never removed someone as a friend so fast in my life I feel so disgusting  The worst bit is I m pretty confident they made the video  Fuck that last frame of it I can t get it out of my head it s horrible,0,Someone sent a video of someone stomping on a chick to a close friend. The last frame of the video makes her feel sick. She removed the person as a friend very quickly. She's pretty sure the person made the video.,send video stomp chick close friend frame video make feel sick remove person friend quickly pretty sure person video
201194,Ready As I ll Ever BeI m going to try and kill myself later tonight  Its not a situation of impulse as this will be my  rd attempt in   years  I ve already tried to get help and it didn t work  What I need and am missing is the human connection  Most people get that from their family or from a SO if they don t really have a family  I ve had neither in my life and have just pretty much been left to be by myself  Of course I ve physically been around people my whole life  but I ve always felt completely alone and miserable  Its always been like that  but I can t and won t take this anymore  No matter how much work I do personally  that will never affect the people  or lack thereof  around me  I hate this place and the emptiness inside of me is completely fucking unbearable,1,I'm going to try and kill myself later tonight. It will be my rd attempt in years. I hate this place and the emptiness inside of me is unbearable. I can't and won't take it any more. ,go try kill later tonight attempt year hate place emptiness inside unbearable not not
201195,Bro how do you fucking text people Like  What the fuck do you say  What do yall talk about  Tf How did i even get this far without knowing how to text anyone,0,Bro how do you fucking text people Like  What the fuck do you say  What do yall talk about  Tf How did i even get this far without knowing how to text anyone,bro fucking text people like fuck talk far know text
201196,i have an obsession with saying uwu out loud uwu,0,i have an obsession with saying uwu out loud uwu,obsession say usu loud usu
201197,I hate meI m a terrible person  My depression makes me lazy and selfish  My girlfriend nearly broke up with me because of it  And she can t live with me because I ve let my depression get the most of me   I m so scared of losing her  I m smothering her  I m just a bad person  I don t know what I d do if we broke up  And I know we will break up if I don t get better  I just want to fucking die  I don t know how people get up and do things everyday  I m moving in with my parents  I just hate everything  I  hate everything   I hate myself  I don t even hate life  I just hate me  I hate me  I ve never even kind of liked me  At best I ve tolerated myself    Nothing is good  Everything is hard  Fuck this  Why try,1,My depression makes me lazy and selfish. My girlfriend nearly broke up with him because of it. He's moving in with his parents because he doesn't want to live with his girlfriend anymore. He doesn't know how people get up and do things everyday. ,depression make lazy selfish girlfriend nearly break move parent not want live girlfriend anymore not know people thing everyday
201198,have you guys ever talked with someone everyday  but then something happens and y all stop talking and you feel sad  idk if that makes any sense  i just need a place to rant a lil bit  but i m sad and lonely rn  probably gonna sleep so yeah,0,have you guys ever talked with someone everyday  but then something happens and y all stop talking and you feel sad  idk if that makes any sense  i just need a place to rant a lil bit  but i m sad and lonely rn  probably gonna sleep so yeah,guy talk everyday happen stop talk feel sad not know make sense need place rant oil bit sad lonely right probably go sleep yeah
201199,tittie s are amazing dude thats it thats the whole post i just had to appreciate them since it made my night,0,tittie s are amazing dude thats it thats the whole post i just had to appreciate them since it made my night,titty amazing dude post appreciate night
201200,I think it s time I didn t want to actually do it but I feel like I have to now  I ruined my life  I did something terrible and horrible all because I m mentally fucked up  I have no sense of identity  I have issues with my gender  I probably have personality issues  I m depressed  I m always anxious  I m always paranoid  And now it seems like everything I did is coming back to get me and I see no way out of it except to end it  Because if everyone finds out the truth then the idea that everyone thinks I m crazy will finally come true  I don t know what to do anymore  I feel like I have no other choice  I wanted it to be okay  But I know it s not going to be  So I think it s about time now,1,"I want to end my life because everything I did ruined my life. I have mental issues, I have issues with gender and personality, I'm depressed, anxious and paranoid. I don't know what to do anymore, I feel like I have no other choice but to end it.",want end life ruin life mental issue issue gender personality depress anxious paranoid not know anymore feel like no choice end
