,text,class,summary,cleaned
176684,I m not creativeI m starting to realize I have absolutely no useful skills as a human to point Death would be a preferable alternative,1,I m not creativeI m starting to realize I have absolutely no useful skills as a human to point Death would be a preferable alternative,not creative starting realize absolutely no useful skill human point death preferable alternative
176685,Genuine question If I make an account on amogus will the quick chat go away,0,Genuine question If I make an account on amogus will the quick chat go away,genuine question account gus quick chat away
176686,Check out my playlist So I made a short playlist on Spotify  It has love songs of all types  There s everything from Billy Joel to James Arthur  I would really appreciate if some of y all checked it out lol  https open spotify com playlist xP W PFZ CzqbUnZ K si rXcAkynGS GWnak yXXA,0,Check out my playlist So I made a short playlist on Spotify  It has love songs of all types  There s everything from Billy Joel to James Arthur  I would really appreciate if some of y all checked it out lol  https open spotify com playlist xP W PFZ CzqbUnZ K si rXcAkynGS GWnak yXXA,check playlist short playlist notify love song type billy joel james arthur appreciate check low open notify com playlist pfc buzz rock yes weak xxx
176687,humanity needs to be removed if you search r portal    of the   results are porn subs,0,humanity needs to be removed if you search r portal    of the   results are porn subs,humanity need remove search portal result porn sub
176688,I just need somebody to talk to  I m slipping into a depression  I don t want to kill myself  I m too scared to kill myself  I just need a friend  Somebody to talk to  But  I have nobody  I can t talk to my boyfriend  My family won t listen  I don t have any friends  I just need somebody  anybody to talk to before it s too late  I m sorry for wasting your time with this cry for help,1,"I am depressed and need someone to talk to before it's too late. I don't want to kill myself, but I can't talk to my boyfriend or her family, and I have no friends. I'm sorry for wasting your time with this cry for help. ",depressed need talk late not want kill not talk boyfriend family no friend sorry waste time cry help
176689,Least painful way to kill your self Just tryna do it fucking quick  Maybe tonight even if I can,1,Least painful way to kill your self Just tryna do it fucking quick  Maybe tonight even if I can,painful way kill self try fucking quick maybe tonight
176690,I don t think I have depression  but I just wanna die I ve been self harming myself to forget certain things and just to make me feel something  Every night  I couldn t stop the thought of killing myself  and has become sort of my lullaby that sings me to sleep  My ex boyfriend left me almost   months ago and my life kinda went down the hill ever since  One of my friend knew that I have been suicidal and advised me to refer a doctor for help  But  I don t think that I m sick of whatever  My ex boyfriend has been my driving fuel for me  Before meeting him  I m already feeling suicidal and self harming myself since I was     years ago  when I met my boyfriend  everything was mostly rainbows and unicorns  I even smile when heavy storms are passing through  Now  I don t know what I am  I planned to kill myself today at   am  where everyone is asleep but I couldn t find anything to hang my rope  It made me more furious  I did some more cuts on my forearms to chill myself down  I should ve died when I was still a little boy drowning in my local water park  I would have skipped all the miserable pain,1,"I don't think I have depression but I just want to die. My ex-boyfriend left me almost months ago and my life went down the hill ever since. I planned to kill myself today at am, but I couldn't find anything to hang my rope.",not think depression want die sex boyfriend leave month ago life go hill plan kill today not find hang rope
176691,Now I m kinda glad Some time ago they told us that we ll have online lessons for   next weeks  I wasn t very happy about it   Now tho  it s kinda nice  tho I got sick  I feel like absolute shit  hate this  so I won t miss school anyway   Also if someone would like to know  I don t have covid and it s probably just a flu  still  it s horrible,0,"There will be online lessons for next weeks. I'm sick, but I won't miss school anyway. I don't have covid and it's probably just a flu, but still it's horrible.     ",online lesson week sick not miss school not covid probably flu horrible
176692,I showered in the dark today and it was hella awesome its like you can t see anything  but you can feel the water   All your senses are blacked out by the lack of light and you can just FEEL the shower     highly recommend,0,I showered in the dark today and it was hella awesome its like you can t see anything  but you can feel the water   All your senses are blacked out by the lack of light and you can just FEEL the shower     highly recommend,shower dark today hello awesome like feel water sense black lack light feel shower highly recommend
176693,Dad jokes daily until I get a girlfriend   Why are teddy bears never hungry   Because they re always stuffed,0,Dad jokes daily until I get a girlfriend   Why are teddy bears never hungry   Because they re always stuffed,dad joke daily girlfriend teddy bear hungry stuff
176694,It s my birthday Now say happy birthday,0,It s my birthday Now say happy birthday,birthday happy birthday
176695,I can t decide what to do  Is it normal to go from  yest I must end this  to  I can hang on  in a span of   minutes Lately I have been collapsing in a heap of tears and terror because I absolutely cannot imagine existing  only to recover in a minute  I have struggled with depression but never told I was in danger by a professional  My suicidal thoughts only last from a range of   to   seconds  On one hand i think it is serious but on the other it is brief  Yeah  it is intense  but it s so short I worry that asking for help makes me look ridiculous  Do I need help  Is this something I should bring up with my biweekly counselor  Should I call   next time it happens,1,Suicidal thoughts only last from a range of seconds to a few minutes. I worry that asking for help makes me look ridiculous. I have struggled with depression but never told I was in danger by a professional. I should bring up the issue with my biweekly counselor.,suicidal thought range second minute worry ask help make look ridiculous struggle depression tell danger professional bring issue biweekly counselor
176696,Finishing the job after   yearsI m done with life  I tried to take it   years ago and didn t have the strength to neither drop it nor go through with it  I forfeited my life   years ago by not being able to follow through with any decision and have instead been a parasite  sucking time and resources out of those around me  Time to stop being a burden and finish my job,1,"After years of not being able to follow through with any decision, I'm done with life and it's time to stop being a burden and finish the job I've been working on for too long and I'm tired of wasting time and resources.",year not able follow decision life time stop burden finish job work long tired waste time resource
176697,Dad made me cry just because of two bad grades  It may not be suitable for this group  but I just have to talk to anyone about it There may be spelling mistakes because I haven t calmed down yet  sorry I may not learn very well  but I try my best  I only got two bad grades but I m going to correct them anyway  Fuck grades  I didn t cry because of some stupid grades   Because of my brother  my parents absolutely wanted to see my grades  I was a little nervous because every time I did something wrong  they yelled at me  Even for the smallest mistakes  And then they ask why I don t ask them for help in learning  Idk man  Maybe because every time I ask for help  they tell me to handle it on my own or they call me stupid  Maybe that s why anyway At least my mother let me explain why I got these grades  But my father started yelling at me  He even said I shouldn t be allowed to speak up or defend myself  He treated me like fucking shit because of those stupid grades  I m sick of this  Every fucking time I do something wrong  everyone in this  family  treats me like the worst litter Now  I locked myself in the room and cried  And he laughs about it  I can hear him The only thing I expect from them is any respect for me and my decisions in life   I m sick of it all  I m sick of them all  I just want peace for myself,0,Dad made me cry because of two bad grades. He yelled at me for the smallest mistakes. I locked myself in the room and cried. I'm sick of it all and want to talk to anyone about it. I may have made some spelling mistakes.,dad cry bad grade yell small mistake lock room cry sick want talk spelling mistake
176698,Can someone please talk to me Im not sober enough to write a paragraph explaining what I m going through I just need someone understanding to talk to  I feel like I m going to burst and end my life or commit a crime just to get locked up in jail forever,1,Can someone please talk to me Im not sober enough to write a paragraph explaining what I m going through I just need someone understanding to talk to  I feel like I m going to burst and end my life or commit a crime just to get locked up in jail forever,talk not sober write paragraph explain go need understand talk feel like go burst end life commit crime lock jail forever
176699,Did anyone ever notice that this emoji   Looks like someone giving Shrek a BJ,0,Did anyone ever notice that this emoji   Looks like someone giving Shrek a BJ,notice emo look like give shrek
176700,No idea what to sayHi I tried to look at other suicide help prevention online  but i don t want to talk over the phone and all the chat clients require to be in the US apparently I justg fuck up everything i try  and i m sure most people would be better off without me  I failed my school year  my parents had to help with money once again  It feels like my life is crumbling apart and i m the only responsible I m currently cuddling with my cat  but even she is getting tired of my bullshit Sorry  i m a non native english speaker  this post is probably a mess,1,"Suicide help is not available over the phone as chat clients need to be in the US. He failed his school year and his parents had to help him with money again. He is currently cuddling with his cat, who is tired of his nonsense. ",suicide help not available phone chat client need fail school year parent help money currently cuddle cat tired nonsense
176701,how many missing assignments you guys got i have   i think  it might be higher,0,how many missing assignments you guys got i have   i think  it might be higher,miss assignment guy get think high
176702,To some of the guys here  The fact that a girl replies to their snap doesn t mean that she s  or wants to be   vibing  with you,0,To some of the guys here  The fact that a girl replies to their snap doesn t mean that she s  or wants to be   vibing  with you,guy fact girl reply snap mean want vike
176703,I gave myself a lot of chances in lifeI still am fragile unstable unhappy  I am doing a lot of mistakes that I regret I m sorry Every time I think of killing myself I try to say there s another day but this time I feel like life s too tough for me Killing myself takes a lot of courage that I just can t  I wish I was never even born,1,"I regret a lot of things in my life. I wish I was never born. I want to kill myself, but it's too difficult for me to take the risk. I regret everything I've done in life and I'm sorry. ",regret lot thing life wish bear want kill difficult risk regret life sorry
176704,Kick back  and enjoy a nice metal song  Angra   Carry On https www youtube com watch v Uxrwti yLvs,0,Kick back  and enjoy a nice metal song  Angra   Carry On https www youtube com watch v Uxrwti yLvs,kick enjoy nice metal song angry carry youtube com watch rate yes
176705,I WANT TO DIE FUCk  all the crying is probably making my ass hurt worse  I have a hemorrhoid or something  but I j need to get it out  I don t want to be alive and I have a myriad of reasons for not wanting to live anymore that NO ONE gets   I HATE my family  I hate people  I just don t WANT IT no one understands that I d much rather be DEAD I want to DIE before Christmas,0,I want to die. I hate my family and I hate people. I don't want to be alive anymore. I have a myriad of reasons for not wanting to live anymore that no one understands. I want to kill myself before Christmas. ,want die hate family hate people not want alive anymore myriad reason not want live anymore no understand want kill christmas
176706,I like my women like I like the French Filler filler filler filler filler filler filler filler filler filler filler,0,I like my women like I like the French Filler filler filler filler filler filler filler filler filler filler filler,like woman like like french filler filler filler filler filler filler filler filler filler filler filler
176707,I m gonna give my height in miles instead of feet from now on Partially so people don t realise how short I am and partially out of spite for the imperial system,0,I m gonna give my height in miles instead of feet from now on Partially so people don t realise how short I am and partially out of spite for the imperial system,go height mile instead foot partially people don realise short partially spite imperial system
176708,LifeI ve been through alot  I don t know what to do anymore  At this point when I look back on my life all I see is pain  And I always think why I went through what I did  For what  Why am I here  It s pointless  Shit won t get better and that s a fact  It s set in stone now  The only way out is suicide,1,I don't know what to do anymore. Life is pointless. Suicide is the only way out for me. I don't understand why I went through what I did and I can't find a reason to live anymore.  ,not know anymore life pointless suicide way not understand go not find reason live anymore
176709,I ve made a huge mistake that possibly ruined one of the only things I sincerely care aboutI was on snap just chilling and having fun untill I sent a wrong snap to the wrong person  They responded once and I ve tried talking to them again but now they won t open my snaps or talk to me so idk what to do,1,"I sent a wrong snap to the wrong person. Now they won't open my snaps or talk to me, so I don't know what to do. I made a huge mistake and ruined one of the only things I care about.",send wrong snap wrong person not open snap talk not know huge mistake ruin thing care
176710,An easy way to off yourself Does anyone have any good ideas for an easy painless way to kill yourself,1,An easy way to off yourself Does anyone have any good ideas for an easy painless way to kill yourself,easy way good idea easy painless way kill
176711,I wish I didn t existI ve battled with depression on and off since I was an early teenager but I can honestly say that at this point  I m truly fed up with my life in every way  I no longer find enjoyment in anything  Yesterday my boyfriend   who truly was the only light in my dark world  has ended things with me  It didn t end nicely either  What s more soul crushing is the reasons he ended it stem from issues caused by a chronic condition that I suffer from and have completely no control over  He doesn t seem to understand that  He thinks I m selfish and inconsiderate because of this  This is the second time he s broken up with me in the past two months for the same reason  I ve had suicidal thoughts during a period last year for other reasons  and again this year after the break up  I just feel completely worthless and I have for a long time  Not even the person that I love wants to be around me anymore  I feel like the worse person in world  This is just the cherry on the cake because I don t see anything good or happy in my life anymore and I don t have any hope for the future  I think it s come to the time where I truly want to simply end my life and avoid the pain and misery that I m feeling I have no zest for life anymore and I m honestly ready to go,1,"After the break-up with her boyfriend, she feels depressed. She suffers from a chronic condition that she has no control over. It's the second time he's broken up with her in the past two months for the same reason.",break boyfriend feel depressed suffer chronic condition no control second time break past month reason
176712,I might not make it to tomorrow The only person that I have ever loved has been taken away from me to a mental health ward and whats worse is that I might not be able to see her again  I need to see her again without her I have nothing  you might say she isn t everything well she is to me  she is what I live for and without her I have nothing and no one to live for there is nothing else in my life and now that I have found myself in a place where I can actually kill myself I fear that I might not be able to make it to tomorrow  I said that I would wait for her to get out and that I wouldn t but I don t know anymore  It all seems so horrible now and I just can t take it  I guess I want someone to dissuade me from my current state of mind but that s probably not gonna happen  If only she called today then things might be okay or if her mum texted me back saying that I could see her but things didn t go that way so this is probably the way it s going to go,1,The only person that I have ever loved has been taken away from me to a mental health ward. I might not be able to see her again without her. She is what I live for and without her I have nothing and no one to live for. ,person love take away mental health ward not able live no live
176713,Are the mods doing their job   Rule   of  r teengaers  No personal attacks Any content that attacks other users  or could be potentially offensive  is not tolerated  While you may disagree with another user  you may not attack them for it  Correct their facts  discuss it  but keep it civil    r teenagers https www reddit com r teenagers  is a community in which everyone is welcome Click here for the extended version of this rule https www reddit com r teenagers wiki rules wiki no personal attacks u Thesavagepotato  was told that reporting to the police  reporting the user to Reddit  and contacting the mods r reddit com could help Lonely boy was banned also  u Thesavagepotato  can make a new account  I don t see how she should be unbanned because she broke a rule  This happened to an account with the named Glittering in it  She he said a person was a nazi and homophobic and she he gave out his name  She he was banned but people weren t saying she should be unbanned  Do the mods support Nazism for banning or removing he his post  HELL NO  Do the mods support pedophilia for what happened now  HELL NO  u Thesavagepotato  broke a rule and lonelyboy broke a rule  They were both banned  Now they need to handle it on their own,0,The mods banned Thesavagepotato and lonelyboy for breaking the rules of Reddit's rteengaers community. Glittering was also banned for breaking a rule. The mods need to handle the situation on their own.,mod ban thesavagepotato lonely boy break rule geddit teenager community glitter ban break rule mod need handle situation
176714,The gun is so close Just went and held my shotgun  It s so pretty  Took all the will power I have to put it back  I can hear it calling me  Wtf am I even doing  Last week I zoned out so bad I couldn t move  I was around other people  One of the few things I can remember is someone saying they were creeped out by how my eye looked glassy  No one talks to me anymore I think they think I m crazy  Which I guess I am haha  My parents stole my food again today wuptido  I am so going to snap someday  I feel so close to it too  In class a few days ago I ended up having to walk out everything was just so much  The teacher was pissed about me not understanding shit  Well ofc I don t understand shit my brain won t work right anymore  Worst part is feel like this just makes me laugh uncontrollably  Like wtf  I guess I m just a selfish bastard that wants the easy way out even though there are people who need me  Or maybe I m just trying to make myself feel better and no one needs me  Hope it s the later  It s all just too much haha,1,Last week he zoned out and couldn't move. Now he can't talk to anyone. His parents stole his food again today. In class a few days ago he had to walk out because he couldn't understand the teacher's lecture.,week zone not not talk parent steal food today class day ago walk not understand teacher lecture
176715,Need helpIm sitting in my car at work and i cant stop thinking blowing my head off would be the best option  so tired of this shit life not improving no matter how much effort i put,1,Need helpIm sitting in my car at work and i cant stop thinking blowing my head off would be the best option  so tired of this shit life not improving no matter how much effort i put,need help sit car work not stop think blow head good option tired shit life not improve no matter effort
176716,RECOMMEND A SONG I WILL LISTEN AND RATE IT recommend a song in the comments and i will listen to the full song and rate my enjoyment  bonus points if i add it to my playlist  fr any genre,0,RECOMMEND A SONG I WILL LISTEN AND RATE IT recommend a song in the comments and i will listen to the full song and rate my enjoyment  bonus points if i add it to my playlist  fr any genre,recommend song listen rate recommend song comment listen song rate enjoyment bonus point add playlist genre
176717,Help can t sign into Steam I can t ask for Steam help on r Steam so I m doing it here because fuck them Anyway  changed my password to the exact thing four times  Steam confirms it to be the right password because it sends me to the sign in screen  sign in with that password  says I m doing it incorrectly  despite putting in the username and password correctly  Please help I have like   dollars worth of games and like   dollars worth of DLC with about   years of progress on here and I don t want to be locked out,0,"After changing his password four times, Steam confirms it to be the right password, but sends him to sign in screen even though he put in the username and password correctly. He has dollars worth of games and DLC with years of progress on Steam and wants to use it.",change password time steam confirm right password send sign screen username password correctly dollar worth game dec year progress steam want use
176718,usd coin is a cryptocurrency with a   to   exchange rate with the us dollar if you re wondering why this exists it s cuz the government can t regulate usd coin  as far as the law is concerned usd coin is the same as anything else you own  so legally buying something with it might as well be trading candy bars that are worth exactly   for goods or services  the government doesn t take   of ur candy bars cuz it ain t money  and as far as their concerned no transaction happened cuz no usd was exchanged  tldr  it s not taxed  and it has a fixed exchange rate with the us dollar  and therefore the value is effectively regulated by a government  so it s stable,0,Udev coin is a cryptocurrency with a fixed exchange rate with the US dollar. The government can't regulate Udev coin as it's the same as anything else you own. It's not taxed and it's effectively regulated by a government.,use coin crypt currency fix exchange rate dollar government not regulate use coin not tax effectively regulate government
176719,ok  well im done ive tried everthing and thought of everything to sovle my problems and im done with it  i give up trying with what little i had left and i dont have anything left to even try to come up with solutions anymore  so now ive got a question to anyone willing to answer  what is the fastest least painfull way to kill myself  i dont have any firearms so thats out of the picture  im poor so anything i need to buy that i cant find in my home is out of the question  ive came up with the basics but im wondering if there are any less painful choices besides electrocution  severing the arteries  either the main arteries in the neck or the wrists  and overdosing  medications that kill quickle when overdosed on  so no sleeping pills  if you have intent on hassaling me on  well  me killing myself then look up my other posts first  its way to much to repeat  and if you think im an asshole  probably because of my comment replies  or my sarcastic talking  then use that anger to convince yourself to give me the info im seeking or just go about youre own buisness  preferably no ranting on my posts  and ignore the guidelines on the right  if you are worried about the ban then send me a message so that its impossible for the to know that you broke the guidlines  i really hope to get some ligitement answers because i dont wish to put off my suicide any further  ive put its off for too long,1,"In order to kill himself, he needs to find a less painful way than electrocution, severing the arteries, cutting the main arteries in the neck or wrists and overdosing on medications that kill quickle. He doesn't want to put off his suicide any further.",order kill need find painful way electrocution sever artery cut main artery neck wrist overdose medication kill quickly not want suicide
