,text,class,summary,cleaned
213825,cant get over the past my brother is 5 years older then me and when i was 13 i had a girl friend and she cheated on me with him and i cant get over iti am21 now it fills like it was yesterday they took everything from me friends family my school life was hell even the teachers thought it was funny they where a lot more popular then i was i was like 267 pounds and nowi am146 i use the anger from that day to drive me to this point but it still hurts i havent brought a girl home since i knowi amjust being a pussy but i dont think i can handle it if it happens again i cant trust no one and its killing my life with people i care a lot about help me plz talk me though it,1,"When he was 13, his girlfriend cheated on him with his brother. Now he's 21 and he's angry. He hasn't brought a girl home since then. He's afraid he won't be able to handle it if it happens again.",girlfriend cheat brother angry not bring girl home afraid not able handle happen
213826,not very interesting hi so this is my first reddit post and its not gonna be a very happy onei amlike crazy sad right now very lonely and feel completely worthless i started uni last year and had to drop out for mental health reasons and nowi amliving back in london on my own with a really shitty waitressing job and ive been lying flat on my kitchen floor for about an hour trying to muster up the courage to do anything i hate myself for dropping out all my friends stayed on at uni and are making successes of themselves and have friends and a social life and all i do is go to work go home drink and smoke ive got a mildly tragic backstory and a history of depression etc but i wont bore everyone with thati dont even know wherei am going with this sorryi guessi amjust looking for a tiny bit of hope i just kind of need someone to tell me that stuff might be okay and i am not going to be stuck here like this forever,1,Last year she dropped out of university for mental health reasons and now she lives back in London on her own with a waitressing job. Her friends stayed at university and have a social life. She is depressed and lonely. She has a history of depression. ,year drop university mental health reason live london waitressing job friend stay university social life depressed lonely history depression
213827,what do i do wtf do i do when nothing makes me happy anymore gaming going outside being with friends and family all of these things kept me going but now all of them feel like chores when my depression has taken over and nothing is making me happy then wtf do i do,1,what do i do wtf do i do when nothing makes me happy anymore gaming going outside being with friends and family all of these things kept me going but now all of them feel like chores when my depression has taken over and nothing is making me happy then wtf do i do,whf make happy anymore gaming go outside friend family thing keep go feel like chore depression take make happy whf
213828,it feels as if no one caresi amf17 depressed anxious and suicidal ama senior and i can barely make it through the days at school i cant stand it everyday is filled with pain that comes with the anxiety i feel ashamed worthless pathetic my parents know about my anxiety problems nothing is really done about it but this depression i havent told them about my father would straight up tell mei am not depressed thati amacting stupid and my mother would just stand there not saying anything when i look around know one really cares about anyone these teachers that walk around the doctors i see none of them actually care theyre just doing a job for the sake of money the only reason i havent killed myself is because i got tied up in a relationship before these severe thoughts came suicide to me is freeing everyone including myself i can only see my life in a negative light i cant get any helpi amlost no one is around me my boyfriend its online hes hundreds of miles away i promised him i wouldnt commit suicide soi amstuck here in pain because i dont want to cause him painyoud think after going through so much pain for so long youd grow numb to it but you dont you just suffer and suffer ,1,"Ama senior is depressed, anxious and suicidal. Her parents know about her anxiety problems, but they do nothing about it. Her boyfriend lives hundreds of miles away and she doesn't want to cause him pain. The only reason she hasn't killed herself is because she got tied up in a relationship.",senior depress anxious suicidal parent know anxiety problem boyfriend live hundred mile away not want cause pain reason not kill got tie relationship
213829,amtrapped each dayi amhaving a hard time justifying my own existence why i should even bother rolling out of bed in the morningcollectively in my household we have way too many bills piling up and nowhere near enough money we barely have 2 pennies to rub together it seems i do have a job but its like a hair above minimum wage and soulcrushing as all hell my free time is basically spent helping another family member pursue a dream a dream thati amless less convinced will actually come true i feel likei amtrapped and have nowhere to run or go to i feel so fucking alone likei amsuffocating i dont know what else to do except end it i feel like theres no real way out,1,"There are too many bills piling up and nowhere near enough money in the household. My family barely has 2 pennies to rub together. I have a job, but it's barely above minimum wage and my free time is spent helping another family member pursue a dream that I'm less convinced will come true. ",bill pile near money household family barely penny rub job barely minimum wage free time spend help family member pursue dream convinced come true
213830,how to die what would an overdose of oxycodone do to me,1,how to die what would an overdose of oxycodone do to me,die overdose codon
213831,i think ive come to terms that my life will always be miserablei ama worthless loser that will never get a girlfriend it eats me alive ive heard the whole you gotta be happy with yourself before you can be happy with somebody else spiel many times before ive tried a lot to just focus on me and it doesnt get rid of the pain of not having a girlfriend its obvious to me that i will never be able to accept no matter what i do so no matter what you sayi am not going to believe the whole learn to love myself thing it truly feels like that my destiny in life was to be nothing but suffering ive suffered for years cause of this ive been molded by it i dont try with girls anymore i know its a waste of my time my lifes going to be shit so whats the point in keeping on going,1,My life will always be miserable as I will never get a girlfriend.    I am not going to believe the whole learn to love myself thing.  I don't try with girls anymore as I know it's a waste of time.,life miserable girlfriend not go believe learn love thing not try girl anymore know waste time
213832,i want help but i ama minor and cant trust my parents to get it ive made multiple posts here and on and ive decided i want to seek a therapist as a quick recapi am12 years old hate public school i was once homeschooled think my mom is horrible at raising children with autism am 80 sure i have bipolar and nearly jumped off a wall last week the only problem is i dont really have someone i can open up to most of the time when i try to talk to my parents about serious matters i just get yelled at how dare you be suicidal jesus died so that you can live and to kill yourself would be to downright reject that gift committing suicide is the most selfish thing you can do and when i try to share my side they just nuke the conversation and because my school is an online school i cant seek help from a school counselor i cant call the suicide hotline because i dont have a phonei amlost hopeless and alone,1,12-year-old wants to go to a therapist as he is suicidal. He hates public school and his parents are not supportive when he tries to talk to them about his mental health issues. His school is an online school and he can't contact a counselor or a suicide hotline.,year old want therapist suicidal hate public school parent not supportive try talk mental health issue school online school not contact counselor suicide hotline
213833,just cant handle the anxiety and depression any more my anxiety is so bad that it is nearly crippling i actually felt good last night after so long and i thought i was making some progress new meds lost a little weight cut back on drinking i went to bed last night and i said i was going to have a good day off woke up at six with the anxiety back full force felt like i was going to vomiti am so tired of living like this i just wish i was single with no kids some times so i could just kill myself and not feel this way anymore i cant though becausei amafraid of what it would do to my family,1,"Anxiety and depression are crippling. She is afraid to kill herself because she is afraid of what it would do to her family. She lost a little weight and cut back on drinking, but woke up at six with the anxiety back full force.",anxiety depression cripple afraid kill afraid family lose little weight cut drinking wake anxiety force
213834,wondering why life is worth living i have not been diagnosed with depression nor do i think i have depression despite the thoughtsi amhaving however i think my thoughts would be suitable to post in this subreddit since these are the types of things you guys talk about often i havent been hating life but i see no point in it everyone arounds me preaches the gift of life but i dont see how it has any value and death is extremely desirable for me no more worrying or working or feeling bored or feeling sad just nothing i suppose you could consider it ultimate laziness but i see no shame in that i fantasize about death and committing suicide on a regular basis id just be interested in hearing other peoples opinions as to why life has any reason to continue it living so that i can make others happier doesnt count ps a lot of you might recommend that i see a therapist but ive gone over the rules and the law of confidentiality doesnt apply for expressing suicidal thoughts and i dont want my family to be contacted nor do i want to be hospitalised as they phrase it,1,"Asking why life is worth living is a common topic on the Redditors' discussion board. Some people recommend seeing a therapist, but she doesn't want her family to be contacted and she does not want to be hospitalised. ",ask life worth live common topic redd tor discussion board people recommend see therapist not want family contact not want hospitalise
213835,19 yo suicidal girl i dont want to spend 77 years of life battling a cycle of depression and anxiety i just dont wanna be here anymore,1,19 yo suicidal girl i dont want to spend 77 years of life battling a cycle of depression and anxiety i just dont wanna be here anymore,suicidal girl not want spend year life battle cycle depression anxiety not want anymore
213836,ive given up again two nights ago i went home after midnigh took a pair of scissors and cut off most of my hair kids never try this it looks awful i went to the barber the next morning cause i sucked at cutting my own hair it was stupid me and my friends were all happy but then i just felt lost i just suddenly felt that lack of control over my life suddenly all my bad memories came back like a tidal wave crashing down on me and the whole world felt so loud to me and thats when i took my scissors and cut away three months ago i already decided to cut myself off from all my friends because all i ever cause the people around me is heartaches sadness and wory i keep messing up i just want to cut it all off cut myself off from this world so that it could me send me into the bin i was meant to be ini amjust going to try one more time to end it all before the year ends ive got my eyes set on an exit to finally end this unending cycle ,1,Two nights ago he cut off most of his hair. The next morning he went to the barber. Three months ago he decided to cut himself off from all his friends. He wants to end it all before the year ends. ,night ago cut hair morning go barber month ago decide cut friend want end year end
213837,i dont want to die but i think i need to ive fucked up so much i screwed up my studies and i dont think i will ever graduate college because i keep failing classes i hate my major i feel like its the hardest major in the school and i shouldve switched out when i could have i know my parents love me but theyve pretty much given up on me they thinki ama compulsive liar which i might be who knows and they still dont know thati am not graduating in may i also have a lot of friends who care about me and i know killing myself will make them all miserable and potentially screw up their lives which is why i dont want to i want to get a job and get married and have kids and die happily old what i want is to be able to get a well paying job without a degree but i dont think thats possible what i want is to run away and figure my way through life but i cant live with myself disappointing my loved ones which is why i need to die i often find myself wishing that i would die in a car accident or develop a disease like cancer but thats not going to happeni havent picked when yet i want to be able to tie up all the loose ends to make it as easy as possible but i know nothing will make it easier for them ,1,"I want to die because I screwed up my studies and I don't think I will ever graduate college. I want to get a job and get married and have kids and die happily old, but I can't live with myself disappointing my loved ones. ",want die screw study not think graduate college want job married kid die happily old not live disappoint love one
213838,home alone and contemplating killing myself i think about killing myself or dying in some accident or getting a terminal i willness every day i take the stairs wheni amat my schooli have a class on the 4th floor i want to go all the way to the top and jump off i just feel so hopeless and misunderstood by my family and my boyfriendi amdisgusted with the way i look to the point of feeling sick whenever i look in the mirror and i dont take pictures of myself like the average person nowadays i wish i was brave enough to get it over withi am19i dont have a job my own place a car and i dont know how to drivei ama piece of shit ,1,"19-year-old wants to kill herself because she feels misunderstood by her family and her boyfriend. She doesn't have a job, a car or a place to stay and she doesn't know how to drive. She feels sick when she looks in the mirror and doesn't take pictures of herself.",year old want kill feel misunderstood family boyfriend not job car place stay not know drive feel sick look mirror not picture
213839,i cant trust my family and i have no one to talk about my problems i was raised mostly by my grandparentsall of my childhood is linked to themmy father was always kinda harsh to meand we had many problemsi tried to help out my father whenever i had the chanceany type of helpsometimes i helped only to win his favori tried to be the perfect soni salute all my neighborsim always polite and alli learned that from my gpbut stilli cant make my father to help me with my daily stuffor just to listen for a few secondshe cant give me any kind of attentionhe usually prefers to play games on his phone he owed my gps some money and he didnt gave it back since this nightwhen i spoke with grandma about my problems with himmy gm alsohad problems with himi think she is not ok thoughshe is a little bit unstable bc i told hershe got so upset that she felt very i will and called my fatheri dont know very much from the conversationbut somehow my father payed his debt to her but now he is madly upset to merepeating words from our past clashesmostly insultsno need for bad wordshe always made me feel like i was nothinglike i was his biggest shame he praised me only when i did what he wantedohand always made jokes about me in the front of his and my friends now i know that i cant trust my gps bc they always told my father about my complaints and so oni cant speak with my gpsbc they are likely to speak with my fathermy father is my main problemthe thing isthat my father always mistreated me and i always tried to love himbut i cant continue with thisi dont have any friends or other supporti feel likei amall aloneand everything goes so bad that it buries me alivei dont know if i want to live anymore bc i have nothing leftno family no friendsonly an asshole father who disappointedlied and even tricked me in every wayon a daily basis for 18 years he is the ruin of my lifemy friend and my enemy,1,My father mistreated me for the last 18 years. He owes my GPS some money and he didn't give it back since this night. My grandma also had problems with him. She got upset and called my father. He paid the debt to her. Now he's mad at her. She's upset with him because of their past clashes. ,father mistreat year owe gas money not night grandma problem got upset call father pay debt mad upset past clash
213840,every passing day i feel more and more like her retirement plan than her soni amdone i dont want to die i just want to not existi am tired of being manipulated emotionally abused and not being respectedi amheld back from leaving because they say how can i leave family but i cant do it anymore its everyday i think about now the thoughts get harder and harder to avoid i dont know what to do with myself anymore,1,"""I am tired of being manipulated emotionally abused and not being respectable. Every passing day I feel more and more like her retirement plan than her son. I am held back from leaving because they say how can I leave family"". ",tired manipulate emotionally abuse not respectable pass day feel like retirement plan son hold leave leave family
213841,i just dont feel like living really things are kinda grey and unexciting i can sometimes imagine a good life like i can imagine the life of some celebrity distant not mine but there somehow it used to bother me that i couldnt access it that nothing excites me anymore it feels likei amdragging it out like i played the game and now i scroll back and forth in the creditslist i know that theres a lot i havent seen or experienced but it feels like its not for me it didnt use to be like that there was a time when i was genuinely excited and exciting where i was in awe of what was in front of me and i was willing to struggle for it even though the world looked grey to me friends told me that talking to me was like dreaming how much they loved me etc now i cant bear to see them because i bore them to death i dont have anything to say to them theres nothing i want to share with them and nothing i want to hear from them i got really good at listening and thats what i can do nothing more nothing less i dont even talk to myself i dont have any hopes any dreams left sure i have goals but i dont care about them anymore still all of this feels wrong when i met my stepgrandfather lying fragily on his bed mustering whatever he still had inside of him that his parkinson hadnt destroyed yet to talk to me which he didnt even do when his own children or anyone else came to see him it felt like he passed on his torch to me like he knew what i was capable of and believed in me in a way that makes me a fundamental character in a story to be told id end it immediately if it wasnt for the feeling thati ammissing something that i didnt connect the dots on something that would be my purpose that echoes every so softly deep inside me somewhere even though i dont feel it i dont know i just dont feel really ,1,There was a time when she was excited and exciting and she was willing to struggle for what she wanted. Now she's bored and she doesn't have any hopes or dreams. She met her stepgrandfather and he passed on his torch to her.,time excited exciting willing struggle want bored not hope dream meet step grandfather pass torch
213842,am not okayi amdone trying,1,am not okayi amdone trying,not okay try
213843,life insurance does anyone know if i can take a life insurance policy out on myself and leave the proceeds to a family member after i go,1,life insurance does anyone know if i can take a life insurance policy out on myself and leave the proceeds to a family member after i go,life insurance know life insurance policy leave proceed family member
213844,bad people exist and i am really not convinced that i should stayim pushing people awayslowly but deliberatelyi enjoy being a jerkim not even sorryim pissed when people tell mei am not a bad person because thats the rep i am working forwhen they tell me i shouldnt kill myself because of iti meanim not killing myself because of that but its not a valid reason to die to all these life addicted brainwashed fucksim pissed when they tell me i can change for better because i dont want togood peoplenice people get on my nerves so muchim pissed when people try to stay right now the last friend speaking to me isnt responding and godi amhoping she realized what douchebag i am and leftthey call me toxicabusive and guess what its like ive been awardedan exfriend recently posted a journal about what i did to them and everyone in the comments telling them theyre glad theyre done with me made me feel satisfiedive broken the law and god did i enjoy itit was the best feeling in my lifeuncontrollable glee knowing that someone will be so pissed about me doing thisi enjoy destroying myselfbe it alchoholdrugsself harmthe satisfaction of knowing i destroyed another part of this life and body is greatstop fucking justifying bad peopleyou idiotsbad people exist and they know what they arewere not lost souls that need your help to become pathetic little goody two shoes shits,1,They call me toxicabusive and it's like I've been awarded. The last friend is no longer speaking to him. He's angry at people who try to convince him that he's not a bad person and that he should change for the better.,toxic abusive like award friend no long speak angry people try convince not bad person change well
213845,i hate my life and its not that i feel sad its that i feel nothing i feel like the empty shell of a person how i wish i could feel something that i wish i could even feel sad but i feel nothing the only reason i ever really talk to my boyfriend now is to feel sad because at least he makes me feel something it feels like he doesnt love me anymore and he doesnt want to be with me who would ever want to be but i am still so in love with him and the feeling that he doesnt love me back makes me feel pain at least its something i just want him to hold me admire me do something to show i matter to him but i dont get that just emptiness sometimes being around my mom helps i dont have to say anything about how i feel but she knows when i need her it must be some sixth sense shell cook me a warm meal take me shopping do whatever it is to see me feel even a bit more full i dont trust anyone not even my boyfriend i feel like i will be judged or brushed off whenever i try and say something it feels like my throat is closing like my body is physically stopping itself from reaching out no one wants to talk to me either even when they knowi amhiding something it feel like they dont care enough to ask but when they do i feel nothing but judgement and it feels like people are always trying to defend themselves all i want is a wonderfully warm hug someone to hold me and make me feel like nothing else matters a long meaningful hug something to make me feel like the birds are chirping again the rain is falling slower or even just a sign thati am still living not just alive but i am dead inside and i wish to be dead all around i hate my life i hate myself ,1,"I hate my life and I hate myself. I hate my boyfriend because he doesn't love me anymore. I don't trust anyone, not even my boyfriend. I feel like I will be judged or brushed off if I try to talk to anyone. I want a hug.",hate life hate hate boyfriend not love anymore not trust not boyfriend feel like judge brush try talk want hug
213846,id rather die in america than be sent back home growing up i always felt like an american i see this country as my home but legally ive never been an american and i know in the eyes of manyi am nothing more than a criminali amaware that i have no future either way but i would much rather die in my real home the us ,1,"As a child, I always felt like an American, but legally I have never been an American citizen. I would rather die in America than be sent back home. I know in the eyes of many, I am nothing more than a criminal, but I am aware that I have no future. ",child feel like american legally american citizen die america send home know eye criminal aware no future
213847,i need someone to talk to i feel like everyone i meet gives me the cold shoulder my friends seem to just move on without me my contact list is full but nobody wants me to be their friendi am not even a back up plan everyone else always has plans families relationships i try new hobbies and try to met nee people but everyone seems to not care about me as much as i care about them my story is so sad what do i do i know i need help,1,Everyone gives me cold shoulder. My contact list is full but nobody wants to be my friend. I am not even a back up plan as everyone else always has plans. I try new hobbies and try to meet people but everyone seems to not care about me as much as I care about them. ,give cold shoulder contact list want friend not plan plan try new hobby try meet people not care care
