,text,class,summary,cleaned
206232,I just want my life to end alreadyI ve been to   different psych wards  one I went   different times  and all they did was switch my medicine around  I didn t receive any type of counseling or therapy there  After two times at the psych  I got in to seeing a therapist and a psychiatrist regularly but nothing has helped  When I opened up to my therapist about feeling suicidal  I was just shoved away to a psych ward  I did try to commit suicide last year by overdose  but my ex called   and they took me to the hospital  then to a psych ward   I just want my life to end already  I lost the only person truly in my life last summer  my ex  He was literally my family  my best friend and my fianc  all in one  I have no family here  and I barely know any of my family  The closest relatives of mine live   miles away in across the country from me  I also have no friends  I have one person who talks to me regularly  but she s honestly not a  friend  since everything is about her,1,"After two visits to the psych ward, she got in to seeing a therapist and a psychiatrist regularly but nothing has helped her. She tried to commit suicide last year by overdose but her ex called the police and they took her to the hospital. She lost the only person truly in her life last summer.",visit psych ward get see therapist psychiatrist regularly help try commit suicide year overdose sex call police take hospital lose person truly life summer
206233,Day   of no masturbating First started May    pm  MNT Standard Time    Currently December    pm  MNT Standard Time    Running at   weeks    day    hour and   minutes What do you mean   days left of   Aren t we still in July,0,Day   of no masturbating First started May    pm  MNT Standard Time    Currently December    pm  MNT Standard Time    Running at   weeks    day    hour and   minutes What do you mean   days left of   Aren t we still in July,day no masturbating start pm int standard time currently december pm int standard time run week day hour minute mean day leave agent july
206234,I m not really aliveI think my family would be devastated if I died but they can t fill the void that exists in me  I want friendship  I want a reason to wake up  I want to do something  Anything  Absolutely any fucking thing I have anxiety  Every time I get anxious I can t stop thinking that the only solution is to put a knife in my stomach  But I know  realistically  that won t help  But maybe if I twist it  Maybe I should pull it out  Try again  Keep going and going and going until I m not anxious anymore  I probably won t be anything   I want to have friends  I want validation that they don t hate me  friends who ask me to hang out and talk to me once or twice a week  Just a  Hi  or even  How are you I ve got nothing but this feeling of being sick and this obsession to kill it and myself  How do you cope with that,1,"Anxious and depressed, he wants to kill himself and his family. He wants to hang out with his friends and talk to them once or twice a week. He doesn't know how to cope with his anxiety and he doesn't want to be alive.",anxious depressed want kill family want hang friend talk twice week not know cope anxiety not want alive
206235,I can t live anymore  There s no other possible solutionI can t deal with this isolation anymore  I m all alone  It won t mater once this isolation is over because I ll still be alone  I m homeschooled  So I m always alone  Even when you aren t having to practice social isolation due to the government  I have no friends who wouldn t abandon me for being gay  I have one friend who wouldn t but she s cut contact with everyone after getting in a fight with her mom  It doesn t matter anyways because I don t know how To hold a damn conversation anyway  I m so lonely and I can t do anything about it  There s so much screaming and yelling and fighting in my house and it s all stressing me out   None of my old coping mechanisms help  They just make me feel numb  I don t find joy in anything I used to enjoy  My parents brought me to a therapist for a while but they re just mad at me for not being better yet  They put me on two different types of antidepressants and it didn t help and now my mom keeps telling me how ungreatful I am for having a perfectly fine life with great parents and yet being so unhappy   Every single suggestion people give me is simply out of my reach and I feel useless and I m so tired of being alone  Please  Please I cannot do this I cannot be alone anymore,1,"Homeschooled, homeschooled and gay, she's lonely and depressed. Her parents put her on two different types of antidepressants, but they didn't help. She doesn't know how to talk to people and she doesn't find joy in anything.",homeschooler homeschooler gay lonely depress parent different type antidepressant not help not know talk people not find joy
206236,HurtingThese last few days have been really hard on me and I dont know if I can keep going  I m either numb or crying  Like ugly crying  Nothing holds joy to me anymore  Not even my children  They once saved my life  But now I fear nothing can save me  Not even my ex husband  The man I love to deeply and want back so bad  I dont want anything else anymore but he wont take me back  He couldn t love me  No one can  I m so lost and angry and sad  I feel like I have nothing left and that my world and life are over  Nothing can make me whole again  All I think about is death and killing myself  I tried to last night but was too scared too possibly wake up again  I dont want to wake up  I dont want to get out of bed or shower or eat anymore  My world is in black and white now  all the color has left my world  I dont want this anymore  I dont want to be strong anymore I just want to die  Please let me die,1,"The last few days have been really hard on me. I don't know if I can keep going. Nothing holds joy to me anymore. My children once saved my life, but now I fear nothing can save me. My ex-husband won't take me back. ",day hard not know go hold joy anymore child save life fear save sex husband not
206237,I m feeling better and I hate itI hate it because I know I m going to build up hope  but in a few days I ll be going through hell again  And it gets worse every time I go through one of these phases where I m still suicidal  but very moderately,1,I m feeling better and I hate itI hate it because I know I m going to build up hope  but in a few days I ll be going through hell again  And it gets worse every time I go through one of these phases where I m still suicidal  but very moderately,feeling well hate hate know go build hope day ill go hell get bad time phase suicidal moderately
206238,It s the most selfish thing anyone can do That s what my stepmother said about suicide  Nice dinner table conversation for a nice family gathering  celebrating one nameday and two birthdays  one of them my own  anyone else in a crisis because they didn t think they d live to be   Had to pretend the whole time I m normal  in no way involved or affected by the topic  haha  I had no idea the whole time how many people here even know I m seeing a psychologist and all that stuff  one of my stepbrother s seeing a psychiatrist  so it s not that they re judgemental  it s just that he s  valid   I had no idea how she could say such things  especially in the context of how she had thoughts about this  too  How she agrees that there might be times  where even if by being here we can help others  it s the most selfish thing in the world to give that oppurtunity up   What the FUCK One step brother and one other family member  who had an attempt herself  started to set her to rights  Meanwhile I was busy being a coward  trying not to show I was hurt  trying not to cry  poker face  Dad was sitting beside me and I lay on his shoulder for a long time  staying silent  He eventually asked me jokingly  are you falling asleep  It s better if he doesn t get the situation  and I just needed the contact  anyway   Only my psychologist knows  and I don t know how long I ll be seeing her   Well  and anyone on the internet who cares to know  and we joke about it with my friends  which I know might be harmful   but if we didn t laugh  we d cry   God  sorry for the rant  I m just so tired of pretending,1,Suicide is the most selfish thing anyone can do. My stepmother talked about suicide at the dinner table conversation. She had thoughts about suicide too. My father tried to comfort her. She is seeing a psychologist. She jokes about it with her friends.,suicide selfish thing stepmother talk suicide dinner table conversation thought suicide father try comfort see psychologist joke friend
206239,send help i m bored in class,0,send help i m bored in class,send help bored class
206240,Do y all ever think about suicide  I want to but at the same time my dog would be sad and my parents would too I guess but nothing makes me happy anymore and I just don t know what to do,0,Do y all ever think about suicide  I want to but at the same time my dog would be sad and my parents would too I guess but nothing makes me happy anymore and I just don t know what to do,think suicide want time dog sad parent guess make happy anymore don know
206241,The difference between the normal Everlong and acoustic version is crazy I personally like the acoustic version more because it gives a more fitting vibe to what was a very dark time for the band and their members  but the original song literally saved the band so can t hate,0,The difference between the normal Everlong and acoustic version is crazy I personally like the acoustic version more because it gives a more fitting vibe to what was a very dark time for the band and their members  but the original song literally saved the band so can t hate,difference normal overlong acoustic version crazy personally like acoustic version give fitting vibe dark time band member original song literally save band hate
206242,i dare you  i double dare u try to break my spell  comment smth for me to use it firsr,0,i dare you  i double dare u try to break my spell  comment smth for me to use it firsr,dare double dare try break spell comment smith use
206243,I will sum up my thoughts and experience regarding english class in one sentence  My english teacher is french,0,I will sum up my thoughts and experience regarding english class in one sentence  My english teacher is french,sum thought experience english class sentence english teacher french
206244,I dont think ill be alive for much longerIve attempted suicide last night and drank a lot of alcohol  I tried hanging myself in which i passed out while doing so  it broke free and i was completely a sleep until i woke back up and felt even more depressed  So now i have this ugly bruise like contour around my neck I ve been trying to hide it  Im,1,I tried to hang myself last night. I passed out and woke up with a bruise around my neck. I don't think I'll be alive for much longer. I've been trying to hide the bruise and hide my depression.,try hang night pass wake bruise neck not think alive long try hide bruise hide depression
206245,I think I won t make pass todayI can t even start to explain all that is wrong and all that makes this pain inside me grows  but I can tell that I m alone  I don t belive in the future  and I hate the pass  the present just gives me anxiety and depression  and the worse pain I have ever felt   I can t eat  I can t sleep  I can t think and even breathing is hard  ia like someone is already with their and on my neck making harder and painful to try to just stay alive   My pain come from being alive  and I m more convinced by it then ever before   I just want the pain to go away for good  I don t want more promises  more work  more expectations or trying   I have done all  things that they told me that would work  things that I shouldn t have done  things that I didn t wanted to do and things that I thought I wanted or need to do to be happy and better So I don t know what is going to happen  I just know that I need to kill this tha lives inside me since I know myself  I m not living  I m staying alive for the pain to consume me everyday  So there is no point more,1,"The present gives me anxiety and depression. I can't eat, sleep or think and even breathing is painful. I don't believe in the future and I hate the pass. I have done things that they told me that would work but I didn't. ",present give anxiety depression not eat sleep think breathe painful not believe future hate pass thing tell work not
206246,If you like mario galaxy then you ll probably like this video  https youtu be NkoOG r WtA,0,If you like mario galaxy then you ll probably like this video  https youtu be NkoOG r WtA,like mario galaxy probably like video youtube kong rita
206247,Update on my balls Hello all  today has been a good day  My balls feel back to normal after aching the last few days and i m very pleased as this means that I do not have to go to the doctors who will feel my balls  unless the pain comes back,0,Update on my balls Hello all  today has been a good day  My balls feel back to normal after aching the last few days and i m very pleased as this means that I do not have to go to the doctors who will feel my balls  unless the pain comes back,update ball hello today good day ball feel normal ache day pleased mean not doctor feel ball pain come
206248,I feel trapped in my head and suicidalI suffer with on and off depression and anxiety  I thought I was getting better  but since last week my dark thoughts are back and I feel suffocated I m stuck in a rural shit hole  I work as a coder from home  So dont have much social interaction  I desperately want to move away from this shitty place that I grew up in  But I m so depressed I cant even think properly I ve got a   year old son  and only my parents and sister  I ve lost my friends and I m terrified I m going to be left in this place old and alone Its sucking the life out of me  My anxiety and compulsive thoughts are wearing me down  I m so mentally tired I cant even think of how to make positive steps to get out of this place  I need help,1,I suffer from depression and anxiety. I live in a rural place with my family and a one-year-old son. I work as a coder from home and don't have much social interaction. I want to move away from the place where I grew up. ,suffer depression anxiety live rural place family year old son work coder home not social interaction want away place grow
206249,I feel like black people are very fairly represented in America considering their population vs the white population  We had a black president that everyone liked more than the white one now  Many black music artists everyone loves the most in their genre like Beyonce  Nicki Minaj  Lil Uzi Vert  etc text so automod doesn t remove the post,0,"Black people are fairly represented in America considering their population vs. the white population. Black music artists everyone loves the most in their genre like Beyonce, Nicki Minaj, Lil Uzi Vert etc text so automod doesn't remove the post.",black people fairly represent america consider population white population black music artist love genre like nick final oil uzi vert etc text auto mod not remove post
206250,I just realized my crush is never going to acknowledge my existence We are in the same class but he doesnt care about me  Yay,0,I just realized my crush is never going to acknowledge my existence We are in the same class but he doesnt care about me  Yay,realize crush go acknowledge existence class not care
