,text,class,summary,cleaned
28050,Comment a idea for a bot under this post and I will program the best one Any ideas are welcome  Shitposts included,0,Comment a idea for a bot under this post and I will program the best one Any ideas are welcome  Shitposts included,comment idea bot post program good idea welcome shit post include
28051,Not a  real  teenager  I ve wasted a big part of my life  I rarely drink  have never been to a party where alcohol was present and I don t vape  I ve only had   boyfriends  Never snuck out because my parents let me stay out as long as I want   And because of all these things i don t feel like a real teenager  I feel like a fake POS  Like I wasted my teen years  Why do I feel like this you may ask  Because all my sisters and all the movies I watch this is the criteria for teens  To have fun constantly  To create memories that when you re old you can look back on and be like  ah the good old days  And I do have fun  just not in the typical ways a teen should I guess  I ve skipped class a few times  smoke green   have a job  and license and am about to graduate HS with an associates degree  And just got accepted into University   I hang with freinds  go thrifting  go hiking  hang out with my dog   Obviously covid has put a stop to a big part of the highschool years  But i still feel like i wasted my life   Do any of you feel like you ve wasted the supposed  best years of your life,0,"Covid feels like he wasted his teen years. He skipped class a few times, smoked green, snuck out, had boyfriends, but he has a job and license and is about to graduate HS with an associates degree. He was accepted into University.",covid feel like waste teen year skip class time smoke green suck boyfriend job license graduate associate degree accept university
28052,whenever reddit sees that someone died,0,whenever reddit sees that someone died,geddit see die
28053,So  i din t got to sleep  so i made something  and i m pretty sure i liked  but i made on english and i m not good enough to make such a thing  so i m posting here for asking for help with my grammar  It s Already Morning The way the sun rises at four a m The pink and the blue and the purple And the white of the clouds But most of all  the silence My breath that comes and goes slowly The dirt on my back cause i was on the ground looking at the stars for the whole night My calm and softy song The moon that still apears cause it s too soon My mouth  dried of water and very hurted My skin  pale and faded The red of my blood on my fingers My silent sadness  that envolve me with the beauty of that sunrise The way i m huming the melody Again  the silence of the world And then  the song of the birds And the way it fits perfecly with my melody The goddamn cold My short and thin clothes The dirt on my feet  cause i walked in the garden while seeing the stars The tree outside the wall looking tired and sleepy The other music that starts on my cellphone That melancholichy symphony The smell of coffe of my neighbours  cause it s already morning It s already morning,0,"It's already morning and I didn't get to sleep. I made a song on English but I'm not good enough to make such a thing, so I'm asking for help with my grammar. It's Already Morning is about the way the sun rises at four a.m., the silence, the dirt on the back, the grass, the red of the fingers and the smell of coffee.",morning not sleep song english not good thing ask help grammar morning way sun rise silence dirt grass red finger smell coffee
28054,Ok but for real  Where is the male snoo in the logo Was he murdered by the female one amp x B i need to know,0,Ok but for real  Where is the male snoo in the logo Was he murdered by the female one amp x B i need to know,real male snow logo murder female amp need know
28055,My dog is going to have to be put down and it s tearing me apart She is a   year old English Mastiff named Brandy and I ve known her since I was   She s been with me through everything ranging from when my dad died to just bawling over studying  She s always been here to cheer me up at my lowest points  And now she s not gonna be here anymore and there s nothing else I can do to help her  I m dreading the day we are going to have to take her to the vet,0,"Brandy, a year old English Mastiff, is going to have to be put down. Brandy has been with her owner since she was a puppy. She cheer him up at his lowest points. He is dreading the day they have to take her to the vet.",brandy year old english mastiff go brandy owner puppy cheer low point dread day vet
28056,OMG  YOU WILL NOT BELIVE ME  Just ate pizza and yummi it was,0,OMG  YOU WILL NOT BELIVE ME  Just ate pizza and yummi it was,org not live eat pizza yummy
28057,NothingI m starting to feel nothing  I want to die but that s a constant thought now not just one that pops up here and there  I feel insane I don t feel emotion like I used to  I laugh and I find it funny that this is happening  I m starting to just not care  I don t get affected by much anymore which I guess is a good thing but I m also worried eventually all feelings will go and I m not sure you can bring them back  Had anyone noticed this happening to them and stopped it  Don t get me wrong I d love to feel less emotional I just don t want it to disappear completely  I don t value myself anymore  I don t care what happens to me or what I say  how I feel  what others say to me  I m scared but I m also not bothered it s so confusing and I know I need to sort it  I started planning my last day a week ago and I did everything for the last time  obviously I m still here but I ve started doing that more often and just switching off  I m slipping and I don t think I can stop it on my own,1,I don't feel anything anymore. I want to die. I started planning my last day a week ago and I did everything for the last time. I don't care what happens to me or what I say. I'm scared but I'm not bothered.,not feel anymore want die start plan day week ago time not care happen scared not bother
28058,R suicidology banned Suicidal ideations can often be coping mechanisms  one might not be intent to committing suicide but just the thought of knowing that the option is there mitigates the suffering of life   The reality is that people kill themselves everyday and have been doing so for hundreds of thousands of years  you can t stop it happening because it s a rational response to the bleak nature of life   I despise reddit for banning suicidology it was somewhere I could discuss my feelings and thoughts without stigma or people saying   don t do it    life gets better  type of rubbish  Free speech is a delusion  reddit has banned dozens of suicide sympathetic subreddits  Fuck reddit,1,Suicide is a rational response to the bleak nature of life. Suicidal ideations can be coping mechanisms. Suicidology was banned on reddit because it was a place where people could discuss their feelings without stigma or people saying don't do it.,suicide rational response bleak nature life suicidal ideation cope mechanism suicide ology ban geddit place people discuss feeling stigma people say not
28059,No longer a matter of if  but a matter of when I don t know what to do  I ve been suffering from depression and suicidal ideation my whole life  with some half assed attempts and failed medications   This time just seems so much worse  I want to give up  I m ugly  I hate how I look  I feel like a fucking idiot for ever thinking I was attractive or could model  Nobody likes my personality  I can t keep friends  nobody thinks I m funny or worth keeping around  I m on vacation but ive spent every day so far wanting to kill myself and holding back tears  I no longer believe there s a chance  more that there s either a couple more days or a couple less days  I want to die,1,Suicide is no longer a matter of if but when. I want to give up because I'm ugly and nobody likes me. I'm on vacation but I've spent every day wanting to kill myself. I don't know what to do. ,suicide no long matter want ugly like vacation spend day want kill not know
28060,Anyone in a long distance relationship  I m in a long distance relationship and was wondering if anyone else on here is  We re gonna be meeting soon and I m super nervous so meeting people in a similar situation would be cool,0,Anyone in a long distance relationship  I m in a long distance relationship and was wondering if anyone else on here is  We re gonna be meeting soon and I m super nervous so meeting people in a similar situation would be cool,long distance relationship long distance relationship wonder go meet soon super nervous meet people similar situation cool
28061,I have someone that loves me and cares for meYet I still go to sleep thinking about dying  imagining myself dying  wanting to die  Loneliness isn t what makes me want to die but I don t know what does   I m staying alive for her but I don t see myself alive much longer  I don t know what to do,1,I have someone that loves me and cares for meYet I still go to sleep thinking about dying  imagining myself dying  wanting to die  Loneliness isn t what makes me want to die but I don t know what does   I m staying alive for her but I don t see myself alive much longer  I don t know what to do,love care sleep think die imagine die want die loneliness make want die don know staying alive don alive long don know
28062,It hurts it hurts it hurts to feel so unlovedNot a single person cares  I m trying  So hard  So many cries for help but nobody fucking cares  I just wish I did it now  I feel like an absolute attention whore  All I want is help  someone to be there  I know it won t make a difference anyways  but why does nobody care  Am I really that worthless  That expendable  Is everyone else just better than me  Or is it just that people care  but it s never enough  I think so  I don t deserve to be missed when I m gone  I just wish someone would miss me,1,It hurts to feel unloved. She feels like an attention whore. She doesn't deserve to be missed when she's gone. She wants to help someone but nobody cares. She wishes someone would miss her when she dies. ,hurt feel unloved feel like attention whore not deserve miss go want help care wish miss die
28063,Loneliness is a crushing feelingTitle says it all  Long post  sorry about this  I can t fathom how I made it to   when I first attempted suicide when I was   I was kind of a loner throughout high school and hated it  College changed that where I had a group of friends  but since I realized my sexual abuse at the hands of my brother  my mental state plummeted  This was last October  and more than half a year later  have things really improved  Since the pandemic  I m isolated and alone at home  my friends are far away and I m holed up with my abuser and toxic parents  I have hope in that I am moving out of home  but I m not so sure the outside world is any kinder  My job prospects are awful  I don t know my eventual housemates  my love said no to staying at her place  and my friends are so far away  Now I eventually will be alone  like I was in high school  the second worst time of my life  Virtual meetings with friends only go so far I want someone to cuddle me  but the pandemic and many other factors are working against that  So where am I  At   I m left desperate for any love from friends  a loser  and just not worth anyone s effort  My parents are so awful  I cannot fathom why they made me  They worry about me  but for what  They are responsible for bringing my abuser home  destroying my confidence  and neglecting me in my adolescence   I feel so alone  So so alone from all my abuse  This was the case in high school  and I m reliving it now  My friends are physically absent and I feel no love from my surroundings  My friends love me  but I can t live with them  I get the message  universe  I am not worthy of being loved and cuddled  It s probably fine I accept it and just not live  I don t know what to do anymore  Why am I unworthy of love     My name is Aaron,1,Aaron was a loner in high school and college. He was sexually abused at the hands of his brother. Since the pandemic he is isolated and alone at home with his abuser and toxic parents. Aaron is moving out of home but he is not sure if the outside world is any better.,aaron loner high school college sexually abuse hand brother pandemic isolated home abuser toxic parent aaron move home not sure outside world well
28064,I m gonna kill myselfHi  I m   and I m a girl  even though it isn t so important to know  But I m currently struggling with my self image and school  I have no friends  I try to start up conversations  it never goes anywhere  I wanna get fit and be more prettier because maybe if I get abs and collarbones people will think I m cool  I wanna finish school and have a future  but it s too hard to go there and sit with stomach pain  I always try to sit straight and suck in my stomach  I never eat anything because I don t wanna get fatter  I will probably fail everything so I don t even know why I try bother living  I wanna live like everyone else  beautiful  smart and with an education  If I don t get better soon I will kill myself next year when I will get my grades  then I know if I m whorty or not  Thank you for reading   I m currently seeking help  but it doesn t work,1,A girl is struggling with her self image and school. She wants to get fit and be more prettier. She has no friends. She will kill herself next year if she doesn't get better soon. She is seeking help.,girl struggle self image school want fit pretty no friend kill year not well soon seek help
28065,I miss my grandma so much She was an important role in my childhood she sadly passed away recently  I missed her,0,I miss my grandma so much She was an important role in my childhood she sadly passed away recently  I missed her,miss grandma important role childhood sadly pass away recently miss
28066,I UNDERSTAND PERFECTLY WELL  THAT I AS THE LOW VALUE MALE VIRGIN LOSER I AM  WILL BE FORGOTTEN Footnote  This entire world is build on ignoring male suffering  especially of those who are unloved in every shape of love itself You an idiotic fool if you were to deny this,1,I UNDERSTAND PERFECTLY WELL  THAT I AS THE LOW VALUE MALE VIRGIN LOSER I AM  WILL BE FORGOTTEN Footnote  This entire world is build on ignoring male suffering  especially of those who are unloved in every shape of love itself You an idiotic fool if you were to deny this,understand perfectly low value male virgin loser forget footnote entire world build ignore male suffering especially unloved shape love idiotic fool deny
28067,Ayllo boys and girls  Do you want I chat  I am quite bored The title says it all  I am listening to music rn and I would like to talk with someone,0,Ayllo boys and girls  Do you want I chat  I am quite bored The title says it all  I am listening to music rn and I would like to talk with someone,boy girl want chat bored title say listen music right like talk
28068,This video is restricted  Try signing in with a G suite account  I cant watch certain videos because of this certain error  If it s blocked by my parents  is there a way to work around it  Ive never had a problem with this until now,0,This video is restricted  Try signing in with a G suite account  I cant watch certain videos because of this certain error  If it s blocked by my parents  is there a way to work around it  Ive never had a problem with this until now,video restrict try sign suite account not watch certain video certain error block parent way work problem
28069,My   year old sister is a ticking time bombI live in a very privileged family  my sister gets everything she s ever asked for so I m unsure how a   year old could be so incredibly unhappy She makes up fake personas for herself usually abused boys and acts as them online She is constantly lying about the smallest things and no matter who asks her in any sort of manner  doctors  family  therapists  etc  She will never come forth with the truth On top of not knowing how she s feeling because of this   she acts completely normal at home  She acts like the regular happy go lucky   year old  except maybe a bit too sensitive She s actually way too sensitive  she will explode and break down and cry or shut down over the smallest thing She was in the hospital for suicidal thoughts a few weeks ago  and now she is back again If they can t change her mindset I don t know what will happen  no amount of reassurance from us her family  no amount of money  no amount of support we give her she s too stubborn to change and she s too youngto realize that  Life is very beautiful and precious  this might be the wrong subreddit to say that on but it s what I feel and believe She doesn t listen to anything  she takes medication for depression  it s all just spiraling downward With her impulsive irradiate and over emotional behavior I feel like she would take her life if she were triggered enough She s in the mental hospital again today for mentioning suicide to someone at her middle school I feel hopeless and that maybe it s best to start mourning her now  nothing we do works Maybe it is best for her to stay in the hospital but they didn t seem to help her last time Sorry for the rant  r suicidewatch  I needed to get it off my mind and maybe someone here has been through something similar Why would a   year old want to take her life so badly,1,My year old sister is a ticking time bomb. She makes up fake personas for herself usually abused boys and acts as them online. She was in the hospital for suicidal thoughts a few weeks ago and now she's back again. She's in the mental hospital again today for mentioning suicide to someone at her middle school.,year old sister tick time bomb make fake persona usually abuse boy act online hospital suicidal thought week ago mental hospital today mention suicide middle school
28070,It just comes and goesOne day  I ll be having a great time out with friends  or playing games  Then other days I just want to cut off all ties with everything and stop existing,1,It just comes and goesOne day  I ll be having a great time out with friends  or playing games  Then other days I just want to cut off all ties with everything and stop existing,come go day ill have great time friend playing game day want cut tie stop exist
28071,My life will end in suicide I feel like it s an inevitability  My life so far has been a steady stream of getting rejected  failing to make friends or really accomplish anything  and my family not even caring how I feel  I m completely alone and nothing in this life makes me want to stay  and I don t see that changing anytime soon  So there s really no reason for me to keep living  It s just a matter of when I finally snap,1,Suicide is an inevitability for me as I don't see any reason to live. I am completely alone and nothing in this life makes me want to stay. I have no one to talk to and my family doesn't care how I feel.,suicide inevitability not reason live completely life make want stay no talk family not care feel
28072,I am here because I don t know how to tell anyone about thisMy heart feels cold  I feel so lonely  I have a beautiful family and so many loved ones who care for me  a good job  a wonderful life  and I still feel so miserable  I just want it to all end I don t do it because of my girls  my wife and daughter  But fuck it hurts just to live Thank you for listening  I really mean that  Thank you,1,"I have a beautiful family and a good job but I still feel miserable. I don't do it because of my wife and daughter, but because it hurts just to live. Thank you for listening to what I have been going through.",beautiful family good job feel miserable not wife daughter hurt live thank listen go
28073,DM OR ELSE  or else nothing just dm me and give me attention pwease,0,DM OR ELSE  or else nothing just dm me and give me attention pwease,attention
28074,How does hanging yourself work How does hanging work  What kills you  What makes you pass out  Is it painful  Can you do it wrong   I am not looking for someone to offer help or talk me out of it because it s annoying  not helpful  and I m not feeling suicidal right now  I m just curious,1,How does hanging yourself work How does hanging work  What kills you  What makes you pass out  Is it painful  Can you do it wrong   I am not looking for someone to offer help or talk me out of it because it s annoying  not helpful  and I m not feeling suicidal right now  I m just curious,hang work hang work kill make pass painful wrong not look offer help talk annoying not helpful not feel suicidal right curious
28075,Fucking kill mr already god I just got a fucking   on my fucking math test I fucking hate my self I m so fucking stupid just fucking kill me I want to fucking die I have fucking   minutes left in class and I want to fucking die fucking kill me i fucking hate my self fuck fuck fuck fuck fuck fuck fuck,0,There are only minutes left in the math class and I hate my self because I didn't do well on the math test. I want to kill myself. I have to take the test in a few minutes. I hate myself. ,minute leave match class hate self not match test want kill test minute hate
28076,Wish someone would help me I think about dying every single day  My heart hurts  my thoughts are all negative and hopeless and every day I have to endure it all by myself  No one to hug me or ask how I m doing  no one to tell me I matter  because I don t  I have no one and I m sure I never will  What s the point of constantly fighting these demons if there s nothing waiting for you,1,I think about dying every single day. I have no one to hug me or ask how I'm doing and I don't have anyone to tell me that I matter. I'm alone and I'm sure I never will. ,think die single day no hug ask not tell matter sure
28077,Haven t had a friend since the third gradeWhen I was in freshman year of high school I wouldnt want to go home because of my toxic parents and I would just walk around aimlessly for hours while on the verge of crying  I did this everyday for months because I wouldnt want to go home and that in my sick head I thought I would eventually make a friend  thinking back on this now makes me feel terrible  And then in sophmore year I had a lot of  friends  but they treated me like shit  I dont have that much money and they would make me use the last of my money to buy them drugs and stuff  and always told me to go away and reall did a lot of things that mentally broke me  but I had nobody else at the time i didnt know what to do  Now im in junior year of highschool and I stopped talking to them  and I have nobody  I have no friends  nobody likes me I am the most un likeable person  Im able to talk to people  well  but nobody wants to talk to me nobody likes me its not fair  Even If I just had   friend I would feel so much better but I dont even think thats going to happen  The last time I had friends who truly cared about me was litterally when I was in  rd grade  I dont know why people treat me like this I dont know why people treat me differently than others its not fair what did I do to deserve this  Nobody cares about me  the only way people will even give a fuck about me is when I kill myself  and even then  people would be sad for a couple days and then eventually get over it and then forget all about me,1,"In junior year of high school, he stopped talking to his friends and now he has no friends. He hasn't had a friend since the third grade. He doesn't know why people treat him differently than others. He wants to kill himself.",junior year high school stop talk friend no friend not friend grade not know people treat differently want kill
28078,What would be the last thing you say to a dying friend  What can you do to make those moments memorable  I am just curious  I wonder what would you do,0,What would be the last thing you say to a dying friend  What can you do to make those moments memorable  I am just curious  I wonder what would you do,thing die friend moment memorable curious wonder
28079,ThoughtsWhy shouldn t I hang myself Who would care if I killed myself Wouldn t the world be a better place for everyone if I did it   I m just a burden  I should help everyone by killing myself I should shoot my head off with a shotgun  Too bad I haven t got a gun Maybe I should step in front of a train Maybe I should travel as far away as I can and either starve myself or hang myself deep in some unknown forest     These kinds of thoughts  translated to English  are daily thoughts for me  It feels like these thoughts are completely normal  like doesn t everyone hate themselves as much as I do  Not one minute goes by in my life during which I don t think about suicide   It s the first thing I think about when I wake up  and throughout the day I think about it every couple of seconds  The thought is almost as automatic as breathing  Oftentimes when I go to the toilet  I look in the mirror and tell myself to kill myself,1,Suicide is the first thing I think about when I wake up and throughout the day. When I go to the toilet I tell myself to kill myself every time I look in the mirror. I don't have a gun and I can't kill myself. ,suicide thing think wake day toilet tell kill time look mirror not gun not kill
28080,Lost another friendAAAAAAAAAAAAAAAAAAAAAAAAAAAAAAAAAAAAAAAAAAAAAAAAAAAAAAAAAAAAAAAAAAAAAAAAAAAAAAAAAAAAAAAAAAAAAAAAAAAAAAAAAAAAAAAAAAAAAAAAAAAAAAAAAAAAAAAAAAAAAAAAAAAAAAAAAAAAAAAAAAAAAAAAAAAAAAAAAAAAAAAAAAAAAAAAAAAAAAAAAAAAAAAAAAAAAAAAAAAAAAAAAAAAAAAAAAAAAAAAAAAAAAAAAAAAAAAAAAAAAAAAAAAAAAAAAAAAAAAAAAAAAAAAAAAAAAAAAAAAAAAAAAAAAAAAAAAAAAAAAAAAAAAAAAAAAAAAAAAAAAAAAAAAAAAAAAAAAAAAAAAAAAAAAAAAAAAAAAAAAAAAAAAAAAAAAAAAAAAAAAAAAAAAAAAAAAAAAAAAAAAAAAAAAAAAAAAAAAAAAAAAAAAAAAAAAAAAAAAAAAAAAAAAAAAAAAAAAAAAAAAAAAAAAAAAAAAAAAAAAAAAAAAAAAAAAAAAAAA,1,,
