,text,class,summary,cleaned
197332,I JUST GOT A BF  As it turns out  he had a crush on me for a while  We re going on a date next week  Im so happy Just kidding  Thats all a lie But now that I have your attention  happy spooktober,0,I JUST GOT A BF  As it turns out  he had a crush on me for a while  We re going on a date next week  Im so happy Just kidding  Thats all a lie But now that I have your attention  happy spooktober,get turn crush go date week happy kid lie attention happy spook tower
197333,Sunday that s the dayI m making arrangements and planning on at least attempting on Sunday night  I ve got parties Friday and Saturday night to say goodbye  Just gotta make it to Sunday,1,Sunday that s the dayI m making arrangements and planning on at least attempting on Sunday night  I ve got parties Friday and Saturday night to say goodbye  Just gotta make it to Sunday,sunday day make arrangement plan attempt sunday night get party friday saturday night goodbye get sunday
197334,I might kill myself tomorrow  I don t know what to say to all my friends and family except   I love you I m going to hurt a lot of people when I pass  but hurt is inevitable  Death is a much better experience than living  I don t feel alive  anyway  I exist but I m not living,1,I might kill myself tomorrow  I don t know what to say to all my friends and family except   I love you I m going to hurt a lot of people when I pass  but hurt is inevitable  Death is a much better experience than living  I don t feel alive  anyway  I exist but I m not living,kill tomorrow don know friend family love go hurt lot people pass hurt inevitable death well experience live don feel alive exist not live
197335,I m about to start going to the psychiatristI m scared  I really am  I m   with   kids and going through separation with my wife  she left me  I ve been feeling depressed and suicidal since I was   years old  but the separation and the pandemic took me to a point where I was with a belt on my neck just about to suicide  but I decided to take another chance  because I was already going with a psychotherapist  and I told her all of my suicidal ideas which I had never talked about with anyone besides my wife  she told me that I might need medication  so I m ready to start not feeling anxious and depressed all day  Hopefully it will work  I ll try to keep my story and progress in here  because I think it will encourage people to get help  and be hopeful that we all can get through all that struggle,1,I'm about to start going to the psychiatrist. I've been depressed and suicidal since I was a child. My wife left him and he's separated from his kids. He was about to kill himself. He's already been to a psychotherapist. She told him he might need medication.,start go psychiatrist depress suicidal child wife leave separate kid kill psychotherapist tell need medication
197336,Don t really feel like going on anymore This is the first time on Reddit for me  somebody linked me to this place so I guess I could give it a try I m   and basicly I ve been depressed for about   years now I guess the depression started because my dad used to hit me  I got bullied at school  got a mild form of autism  Although it s barely noticable anymore I can handle those things and don t really mind them as much as before  but I dropped out of school like   years ago and never really got back into it  School is way too exhausting for me now  I also tried to do simple packaging work but even then I constantly get panic attacks for whatever reason Sometimes I feel like I don t even want to feel good  as if I just don t  want  to go to school  and just make it exhausting for myself  And at work force panic attacks So my main problem here is that I feel like I don t have a future at all  since I can t get an education or income That s what makes me feel like I should start cutting again  to destract myself from feeling hopeless  I mean I ve been depressed for so long now  People keep telling it gets better  but I hope you can see how that feels like a broken promise after all those years I do toy with the thought of suicide  but I m gonna be realistic here and just say I ll probably never do it  I don t have access to anything that makes it end quickly or without too much pain  so that s not gonna happen On a final note  I decided to write here at this hour because I keep getting panic attacks  even though I m at home with no pressure at all except for knowing that I don t really have a future So there ya go  I don t really know what to expect from this but I hope I find out soon,1,"For the first time, a person linked her to Reddit. She has been depressed for a long time. Her dad used to hit her, she got bullied at school and she has a mild form of autism. She dropped out of school years ago and she doesn't want to go to school anymore. She suffers from panic attacks at work. She doesn't have a future. She considers suicide.",time person link geddit depress long time dad hit got bully school mild form autism drop school year ago not want school anymore suffer panic attack work not future consider suicide
197337,I am worried sick and theres nothing i can doMy ex left me because of mistake i made in our relationship  the details dont matter but what does matter is the things she types on reddit My now ex fiance girlfriend has always suffered from intrusive thoughts  when we were together she tired to OD on pharmaceuticals and she was found with a weak pulse  The attempt she made left her with some minor damage to her memories and i worked with her everyday to get some of them back  Only an intense fight we had brought back the rest She is extremely depressed because of her own mental health  the things ive done and our relationship ending  She writes things about suicide and it terrifies me  I want to do everything to be there and help walk her through her problems but she has blocked me  and threatened me with the police if i were to go to her house again unannounced   I tried to watch from the distance and worry without intervening hoping that most would pass  after weeks of watching and holding my breath i finally had to tell her i knew about all the different things she wrote and i am worried and i would take her to the emergency room if it ment she would go with me  that back fired and she pushed further away  I want to be her support system but she refuses  Im so hurt with heartache and terrified that i cant do anything,1,My ex left me because of a mistake I made in our relationship. She is depressed and suicidal. She wrote about suicide on reddit. She blocked me and threatened the police if I were to visit her unannounced. I want to be her support system but she refuses.,sex leave mistake relationship depressed suicidal write suicide geddit block threaten police visit unannounced want support system refuse
197338,even on a support sub no one cares lolI knew life is a joke  it s all a test to see how and when I ll break,1,even on a support sub no one cares lolI knew life is a joke  it s all a test to see how and when I ll break,support sub no care coli know life joke test ill break
197339,All throughout childhood and adolescence  I was told that things would get easier after I turned   I m   now and nothing s getting better  I wanna give up on things changing I can t handle being at home with parents  I feel like I m constantly scared and have no where I can feel safe  Even getting high constantly isn t doing it anymore  I m constantly tense and never know how long until my parents start cursing at me or calling me disgusting  They ve been telling me to leave for a while now  and agreed to give me  k as long as I swear to never come into contact with them ever again  but it s starting to seem like they just want me to leave with nothing  I don t know what to do  I was supposed to take professional exams this year but I m having trouble completing basic assignments because of pretending to be asleep   hours a day,1,"After turning 18, she wants to leave her parents because she can't cope with living with them. She was supposed to take professional exams this year, but she's having trouble completing basic assignments because of pretending to be asleep hours a day.",turn want leave parent not cope live suppose professional exam year have trouble complete basic assignment pretend asleep hour day
197340,How can I stop being suicidal because I m not perfectRebellious not good with disagreements or being told the truth or corrected  I take things personally  I m self centered  emotional  obsessive  stubborn  aggressive  irritable  abusive I m not a happy person,1,How can I stop being suicidal because I m not perfectRebellious not good with disagreements or being told the truth or corrected  I take things personally  I m self centered  emotional  obsessive  stubborn  aggressive  irritable  abusive I m not a happy person,stop suicidal not perfect rebellious not good disagreement tell truth correct thing personally self enter emotional obsessive stubborn aggressive irritable abusive not happy person
197341,Pro tip  Sort by new in r aww and comment  unzips pants  and watch how people react,0,Pro tip  Sort by new in r aww and comment  unzips pants  and watch how people react,pro tip sort new raw comment unzips pant watch people react
197342,I ve given up  What s the best way to leave You can read my story on my previous post I just wanna know what the easiest way to go is without having access to ways restricted to adults,1,I ve given up  What s the best way to leave You can read my story on my previous post I just wanna know what the easiest way to go is without having access to ways restricted to adults,give good way leave read story previous post want know easy way have access way restrict adult
197343,whats wrong with meI feel like doing deserve the life I have I feel like my hormones when into overdrive and made my friend  uncomfortable  they were sending a Snapchat pic and I ask for poses that are extreme sexually I feel like I don t like I should live on anymore live for what iv done to them I have said sorry and they forgive me but it feels like the second voice in my head said they will never forgive you never not until the day you die I don t know what to do anymore I feel like giving up I feel like a monster  amp x B it s funny I want to die but at the same time I m scared,1,My hormones went into overdrive and I made a friend uncomfortable. I want to die but I'm scared they won't forgive me for what I've done to them. I don't know what to do anymore and I feel like giving up. ,hormone go overdrive friend uncomfortable want die scared not forgive not know anymore feel like give
197344,My Depression Is Winning TW  sexual assault I ve battled with depression since I was around   after I was assaulted by a family member  I m   now  but I haven t really gotten better  In middle school I started self harming  attempted suicide  and ended up in   mental hospitals  one long term  I kind of overcame my issues and was doing good until my senior year of hs  My school allows honors students to take college classes in place of most non state required classes so I did that  I did fairly well  but I had moved my junior year so hs wasn t really fun doing senior class stuff with people I didn t know  I realized how I was retracting so I forced myself to get a job  it s a shitty job but I have good coworkers Flash forward to now  I m a sophomore in college  one semester from an associates  but I ve goiter worse  I m no longer able to study or focus on work  I can t stop dissociating and feeling numb   I started back self harming and I know if the person I m  talking  to sees it he would be mad   It s gotten worse and I really have contemplated ending my life but I m scared  I don t know how to tell my parents,1,"After being sexually assaulted by a family member, Tristan started self harming in middle school and in high school. He was able to get a job, but his depression is getting worse and he's considering suicide. He doesn't know how to tell his parents.",sexually assault family member tristan start self harm middle school high school able job depression get bad consider suicide not know tell parent
197345,yeah I m emo edgy  mother  otter,0,yeah I m emo edgy  mother  otter,yeah memo edgy mother otter
197346,Why does nobody talk about the fact that norway and sweden form a penis  I feel like everybody should care about this more,0,Why does nobody talk about the fact that norway and sweden form a penis  I feel like everybody should care about this more,talk fact norway sweden form penis feel like everybody care
197347,Gosh darn it  I fricking hate racism  Racism is fricking stupid and also sexism is stupid too and homophobia and all that is so stupid and people who do this are so stupid,0,Gosh darn it  I fricking hate racism  Racism is fricking stupid and also sexism is stupid too and homophobia and all that is so stupid and people who do this are so stupid,gosh darn trick hate racism racism trick stupid sexism stupid homophobia stupid people stupid
197348,I feel so sad over the death of a little baby bird This happened around   minutes ago  I was walking my dog when I saw   baby sparrows  Those little birdies have fallen out of their nest  One of them was hurt and the other one seemed fine  I grabbed the hurt one in my hands and he started to close his eyes and die  I pet him and told him  Don t die little bird  Your parents are going to help you  in a soft voice  He died in my hands and I started to cry  I put him on the ground and then grabbed the other one  I tried to put him back to his nest but to no avail  He started to die too  I didn t know what to do  I was crying and I asked for help but nobody wanted to  So I walked and let that little baby bird to die because I couldn t do anything  If I brought that bird back home it would have been killed by my dog or my   year old cousin  I felt so powerless and guilty   I m sorry if I ruined your day but I had to tell someone  I can t bottle up my feelings like I usually do  I m so sorry  You can say anything to me  I know that in responsible for their deaths  I hope they ll be happy in heaven,0,"A baby sparrow fell out of its nest and died. The mother was walking her dog when she saw it. She pet the bird and tried to put it back to its nest, but it died. She cried and asked for help, but no one helped her.",baby sparrow fall nest die mother walk dog see pet bird try nest die cry ask help no help
197349,Yea sex is cool and all  But have you ever had a teacher use your work as an example of what to do,0,Yea sex is cool and all  But have you ever had a teacher use your work as an example of what to do,yea sex cool teacher use work example
197350,InsulinI am diabetic and I loaded up a bunch of insulin a bit ago  I m starting to feel the low hitting me with the shakes and nervousness  Fuck living  Hopefully it ends soon,1,InsulinI am diabetic and I loaded up a bunch of insulin a bit ago  I m starting to feel the low hitting me with the shakes and nervousness  Fuck living  Hopefully it ends soon,insulin diabetic load bunch insulin bit ago starting feel low hit shake nervousness fuck live hopefully end soon
