,text,class,summary,cleaned
164922,Please help I m going insane  This is the only place I could go,1,Please help I m going insane  This is the only place I could go,help go insane place
164923,No muscle to live another day What is the fucking point  As part of the youth  the future seems bleak and nothing matters  Wage slavery is inevitable and suicide just seems rational the more I live in mental hell  Graduating high school is not an achievement since that is expected and no lie it is easy I do not think there is anything wrong with me  I think the world is the problem and I may just eliminate myself  Literally cannot take the bullshit any longer  What good is asking for help when it is human nature to be selfish  Why bother for temporary help if I want a permanent solition to begin with  Existence is the problem for me  not living  No strength  no will to survive  Everyday is the fucking same Doubt you care and I do not blame you,1,"As part of the youth the future seems bleak and nothing matters. Graduating high school is not an achievement. It is human nature to be selfish. There is no strength and no will to survive. The world is the problem, not the person.",youth future bleak matter graduate high school not achievement human nature selfish no strength no survive world problem not person
164924,That moment when All you text them is  hi  and then beat yourself up about being a clingy bastard,0,That moment when All you text them is  hi  and then beat yourself up about being a clingy bastard,moment text hi beat clingy bastard
164925,Walking through a college campus is suicide fuelCouples are literally everywhere and everybody pretty much has their own group of friends they hang out with  I m an inferior human being shouldn t even exist  I should kill myself before I live an entire lifetime as an incel  I have zero interests other than laying in bed all day contemplating how I will harm and eventually kill myself  No one will care if I m dead,1,A college campus is suicide fuel for an incel. Couples are everywhere and everybody has their own group of friends they hang out with. Incels should kill themselves before they live an entire lifetime as incels. ,college campus suicide fuel intel couple everybody group friend hang inc el kill live entire lifetime inc els
164926,Y all except wierd   year olds  Just found this sub recently wondering if I m excepted,0,Y all except wierd   year olds  Just found this sub recently wondering if I m excepted,weird year old find sub recently wonder except
164927,I love feeding stray dogs near my home My dad and I have a peculiar habit of strolling at night  Either alone or with our dog  weeks ago  we decided to take a different path and after walking for a few minutes I found four stray dogs living outside a temple near my home  three puppies and their mother  They looked pretty starved and I felt bad for them Next day before going out  dad asked me to grab the leftover rice and roti   a round flatbread made of wholemeal  to feed the dogs I found them near the temple and went near them  I started by giving them rice and after that I gave them roti  They looked pretty happy The next day I asked mom to make extra rice for them  She was happy to do so After a few days of feeding  all four started to show up near the same place at same time as if it had become a routine  They have started to recognise me and all in all we are pretty happy Tl dr   Found four dogs near my home  started feeding them from the next and now everyone is happy,0,"Tl dr found four stray dogs living outside a temple near his home and started feeding them from the next day. They have started to recognise him and all in all, everyone is happy.    .   The next day mom made extra rice for them. ",find stray dog live outside temple near home start feed day start recognise happy day mon extra rice
164928,I think im depressed  yea so I like this girl  she is honestly the nicest  funniest girl I have ever met  but she has so many options better than me  and I feel like if I ask her out ill just make a fool of my self  and its putting me in this terrible mental health state  what should I do,0,I think im depressed  yea so I like this girl  she is honestly the nicest  funniest girl I have ever met  but she has so many options better than me  and I feel like if I ask her out ill just make a fool of my self  and its putting me in this terrible mental health state  what should I do,think depressed yea like girl honestly nice funniest girl meet option well feel like ask ill fool self put terrible mental health state
164929,It didnt get better I was   when I had my first panic attack  I didnt know then  that it would be   years of painful  debilitating chest pains and continued sickness My health continues to deteriorate  I develop new symptoms of anxiety  physical and mental  and the barriers to changing my reality are immense  financial  social  I am constantly sick  and my immune system is garbage  I can barely eat for health and anxiety reasons I just cant take this anymore  I don t want to be sick anymore  Objectively  I dont think a life like this is worth it  I havent been suicidal in years  It s like it was so far at the back of my head  I never considered it But this past semester at school has completely shattered me  And I dont want to be around for the next  All I can think about these past few weeks  almost manically  is killing myself I needed to get that out,1,This past semester at school has completely shattered me. I am constantly sick and my immune system is garbage. I can barely eat for health and anxiety reasons. I don't want to be sick anymore. I haven't been suicidal in years. ,past semester school completely shatter constantly sick immune system garbage barely eat health anxiety reason not want sick anymore not suicidal year
164930,Would anyone care I m gonna be honest  I m   and I ve definitely thought of it and I really thought I would and some points but right now I m not  Nothing much has changed for me but I don t want to put my family through this because of my shit  But the other day I was just thinking and o realised that apart from my family and about   or   close friends  I feel like people would forget me and move on  I had another good friend that died this time last year and he was very popular and people still talk about him a lot and I m not particularly introverted or anything  I d say I was quite lucky in life if anything and I definitely have quite a few friends  some good ones  but apart from my family and maybe four or five others  I don t think anybody would really care that much,1,I don't want to put my family through this because of my shit. I don't think anyone would really care about me apart from my family and a few close friends. I had another good friend that died this time last year and people still talk about him.,not want family shit not think care apart family close friend good friend die time year people talk
164931,My younger brother uses threats of suicide as leverage to get what he wants  What can I do My brother who is   threatens to commit suicide if he s ever put into situations he wouldn t like  He recently came to live with me out of state  There was no bad problems at home that caused him to leave our mom  I just wanted to help give him some guidance and have him stay with us for a school year  Our dad often isn t in the picture Now we re getting close to the time where he would be returning back home and he keeps saying that if he has to move back he s going to kill him self and he doesn t care what anyone says   He has a girlfriend here now he s been with for a few months who s he s unhealthily obsessed with When my mom tells him she wants him to come back home he tells her  no I swear I ll kill myself if you make me  and anytime it s brought up that s his go to Along with other situations like if his girlfriend were to leave him or if we were to have to move to a new state because of my job etc   It s always  I ll kill myself or I ll run away It s very frustrating because the people that would care about him killing himself are people that love him like myself and our mom and he s just using that love as leverage to get his way through these threats I m sorry if this is the wrong sub  please advise if there s somewhere better I should take this,1,"My younger brother uses threats of suicide as leverage to get what he wants. He recently came to live with me out of state. He has a girlfriend he's been obsessed with for a few months. If he has to move back home, he'll kill himself.",young brother use threat suicide leverage want recently come live state girlfriend obsess month home kill
164932,Old RegretsI should ve killed myself when I was   I was a coward then  I decided it was the best idea then  It would save my parents  myself  and every institution and person I came in contact with a tremendous amount of grief  I was afraid of God  dying and damaging the people around me  I made a promise to my younger self to  live it out  and see what changes    years later I am still not convinced my choice was the right one and I m bound by obligation  friendships  and debt  It was a terrible decision I do respect the people who s life i m a part of  They care  and they are unhelpful  My life is a zombie walk through unimpressive  mild failures and disappointments to myself and other people  I would like to stop inconveniencing everyone s life  I would like to kill my personality and memories and supplant it with one that would be happier being me  and better for the people I know  This is impossible  I am the living dead,1,"When I was younger, I wanted to kill myself, but I am still not convinced it was the right decision. I respect the people in my life, but they care and they are unhelpful. I would like to kill my personality and memories and replace it with one that would be happier.",young want kill not convince right decision respect people life care unhelpful like kill personality memory replace happy
164933,If I can t have a cuddle buddy or someone then I can t do this anymoreIf I can t have someone there to comfort me and make me feel loved then I m sorry but I can t do this  I can t move on in life not feeling cared for  If anyone near Lake Stevens  WA would help a   year old guy out it would help me immensely  But if I can t find a person like that to help me out then sorry but then I can t get motivated to do anything in life and it feels like I might as well just end it  I m having a really hard time and I m extremely lonley and because of the feelings I m dealing with and the emotions I have I can t do the things that everyone else can without feeling supported and like I m cared for  So sorry  That s the end of it  I guess I just wasn t meant to be in this world  I am not like all of you  I m completely different from everyone else  I m like an alien,1,"A year old boy from Lake Stevens WA is lonely and needs a cuddle buddy to comfort him. If he can't find one, he might as well end it as he doesn't feel supported and cared for. He is not like everyone else and feels like an alien.",year old boy lake steven lonely need cuddle buddy comfort not find end not feel support care not like feel like alien
