,text,class,summary,cleaned
29900,How are you supposed to deal with suicidal ideation I was diagnosed with suicidal ideation  my parents did nothing about it and guess what I did that weekend  I tried to kill myself  What a shocker  So big question  how do I deal with it,1,How are you supposed to deal with suicidal ideation I was diagnosed with suicidal ideation  my parents did nothing about it and guess what I did that weekend  I tried to kill myself  What a shocker  So big question  how do I deal with it,suppose deal suicidal ideation diagnose suicidal ideation parent guess weekend try kill shocker big question deal
29901,I m feeling extremely lonely I just can t find anyone that enjoys me as much as I do them  Just give me some help,0,I m feeling extremely lonely I just can t find anyone that enjoys me as much as I do them  Just give me some help,feeling extremely lonely find enjoy help
29902,It s an option I ve always had a fear of death  but I m starting to consider suicide as an option  All my life I ve been rejected  called weird  made fun of  etc  I m far from an inept human being  I like to think I m quite nice with reasonable exceptions  we all make mistakes  Not many people want to be friends with me  they just ignore me  I dislike my family due to a lifelong relationship issue  I m seventeen  about to graduate and stuff  I used to envision this moment being a magnificent time in the story of my life  but it overall seems mundane and crooked  I understand it could get better  but I ve made mistakes too  and I m not so sure if it s worth continuing this story called life,1,Suicide is an option for her as she is afraid of death and doesn't have many friends. She dislikes her family because of a lifelong relationship issue. She is about to graduate and she's not sure if it's worth continuing her life.,suicide option afraid death not friend dislike family lifelong relationship issue graduate not sure worth continue life
29903,Can t See a Point in ContinuingI am turning twenty this year  and have been fighting depression since I was twelve  I don t see a point in continuing the struggle any longer   I ve fought fought for a long time  developing good habits to make sure that  I wouldn t become an inconvenience in spite of my lack of grades  However  I couldn t fake relationships like I could fake an interest in work  I don t feel close to anyone  I have tried talking to mental health professionals and friends alike  but those interactions were either ineffectual or drove people away  I feel as though any relationship I have cultivated has been characterized almost entirely by my attempts to fight past my depression Honestly  I don t know what else to do  I ve lost my resolve to get myself through life any longer,1,I am turning 20 this year and have been fighting depression since I was 12. I don't see a point in continuing the struggle any longer. I can't fake relationships like I can fake an interest in work. I have tried talking to mental health professionals and friends alike but they either didn't help or drove people away. ,turn year fight depression not point continue struggle long not fake relationship like fake interest work try talk mental health professional friend alike not help drive people away
29904,Im a boy Let us band together and stop the simpness of the world,0,Im a boy Let us band together and stop the simpness of the world,boy let band stop simp ness world
29905,Battling myselfI m so not right tonight  i feel very ill  I m starting to battle with myself if I should kill myself or selfharm I m in bed just getting more and more depressed  Something will happen soon,1,Battling myselfI m so not right tonight  i feel very ill  I m starting to battle with myself if I should kill myself or selfharm I m in bed just getting more and more depressed  Something will happen soon,battle not right tonight feel ill start battle kill self arm bed get depressed happen soon
29906,Does anybody else think about the future and start to worry  Like I have to think about grades and university courses and money finances and a career path I would like and a job that pays well to keep me out of debt and then like personal life and having a family and it gets so overwhelming and it is pretty scary considering how messed up some things are and how they are so important to life it just seems imposible to even try to fit it all into my head at once that it just becomes stressful,0,There are a lot of things to think about in the future. It's overwhelming for a person to try to juggle all of them at once and not get stressed out. It seems impossible to fit everything into the head at once.,lot thing think future overwhelming person try juggle not stress impossible fit head
29907,What sexuality has bread I want to know what sexuality bread has,0,What sexuality has bread I want to know what sexuality bread has,sexuality bread want know sexuality bread
29908,I m getting discouraged gt This is a poem that I just wrote   gt This is one of the worst days of my life gt but one of the best because I m still alive gt I always thought things would change gt I always kept my hopes high  but now it s been eight years gt and I still want to die   gt Now I come to question if it really will change   gt or if I ve been told this to keep me slightly alive gt My heart still is beating  my lungs are still breathing gt but the numbness of this body won t seem to cease gt My body s decaying  somewhat already deceased gt The rest of me won t go gt The rest of me won t know how to give up on this life gt without help from gravity  surface tension  and a tall bridge gt gt The worst of this is getting worse  I don t feel worthy of this disease  I have no physical external illness to coincide  It feels that I don t have much of a reason to be so sad  but somehow I am  I feel nearly everyday that I should be better off dead,1,It's been eight years since I was diagnosed with cancer and I still want to die. I don't feel worthy of this disease because I have no physical external illness to coincide with it. I feel nearly everyday that I should be better off dead. ,year diagnose cancer want die not feel worthy disease no physical external illness coincide feel nearly everyday well dead
29909,There s a girl in my school who could potentially be vaping  what should I do  So basically  a girl at my school today said that they saw a female student  we ll call her Karen  who goes to our school walking home vaping with her friend  and she s asking us what we think she should do about it  we re still in middle school btw  in grade   After reading enough r AskReddit posts asking  What one huge mistake is that you ve made  where the top   answers are relating to drugs  I quickly responded  telling her that she should probably tell the principal or other staff members about it  However  many others listening in on the conversation told her that telling school officials could get Karen s parents sued and jailed and put Karen through unbearable stress  likely to the point of trying vaping again  They told her that Karen could ve been just trying it out once or just trying it out to escape from issues at home and that she really shouldn t report it unless she knows more about this   They told me that I probably shouldn t be telling her what to do and that it s her own choice to tell a school official about this  and I understand that this might just not be a problem that I m suited to handle  being a  year old idiot  She says that she isn t going to tell any authorities or staff members  which I disagree with but can t really object due to my ineptitude Although I ve been told countless times that Reddit is not a place to get advice like this  I can t help but worry about Karen and wonder if anyone thinks I should act on this  What should I do If you need any more information I ll try to be as active as possible on Reddit  although I didn t see this girl vape myself so I ll likely not have all the information about this tl dr  My friend caught a girl vaping  should I report the girl to the principal,0,A girl at Karen's school saw a girl who goes to their school walking home with her friend vaping. Karen is still in middle school and doesn't want to tell the principal or other staff members about it. Karen's parents could be sued and jailed if she tells them. ,girl karen school see girl go school walk home friend gape karen middle school not want tell principal staff member karen parent sue jail tell
29910,ONLY   DAYS LEFT I ve lost my temper I don t want this life anymore whatever I wanted I ve written it in my diary I am going to spend the last   days of my life in meditation  reading books  and crying for my own death  I d like to thank my parents for pushing me till my limits FOR DEATH the main reason of my suicide is my PARENTS,1,There are only days left until the end of my life. I will spend the last days in meditation reading books and crying for my own death. I would like to thank my parents for pushing me till my limits. The main reason of my suicide is my parents.,day leave end life spend day meditation reading book cry death like thank parent push till limit main reason suicide parent
29911,Oh no I m getting tired I m getting sleepy I don t wanna sleep please I don t want to sleep,0,Oh no I m getting tired I m getting sleepy I don t wanna sleep please I don t want to sleep,no get tired get sleepy don want sleep don want sleep
29912,No suicideI don t want to do it   I m just waiting for the day when I drop the beer and open a bottle of whiskey and die in my sleep   That s how I want it   Not intentionally  just accidentally,1,No suicideI don t want to do it   I m just waiting for the day when I drop the beer and open a bottle of whiskey and die in my sleep   That s how I want it   Not intentionally  just accidentally,no suicide don want wait day drop beer open bottle whisky die sleep want not intentionally accidentally
29913,I just need some help  someone to talk too Recently I ve been going through some real tough times  my parents got divorced and both moved away so I had to move into my own place  this was maybe   months ago  So me and my then girlfriend moved in together in our own place  she left me about two months ago because she wasn t happy  And now I m struggling at work with the hours I have  I am struggling with rent in an apartment I can t afford nor do I have time to move out because I m studying as well and my parents won t take me back in because they both moved far away back to their home towns  I just need someone to talk too  I m afraid I m going to be homeless in a few days and I m so worried  I m   and I ve tried everything  it s just really hard to co exist my University hours with my work hours in order to make money and still have time to study and now it s all backfired and I m going to somehow go to uni without money or a place to live  I just need someone to talk to  someone to help  Thanks guys,1,My parents got divorced and both moved away so I had to move into my own place. My girlfriend left me about two months ago. Now I'm struggling at work with the hours I have and with rent in an apartment I can't afford. My parents won't take me back in because they moved far away. I'm afraid I'm going to be homeless in a few days and I'm worried. ,parent get divorce move away place girlfriend leave month ago struggle work hour rent apartment not afford parent not move far away afraid go homeless day worried
29914,I really need help So my gf has been mentally abusing me for a solid   days now and I both want to end the relationship and don t at the same time  All of my friends are trying to help me end it but she won t talk to me at all so I m not sure if I should end it over text or not  can Reddit help,0,I really need help So my gf has been mentally abusing me for a solid   days now and I both want to end the relationship and don t at the same time  All of my friends are trying to help me end it but she won t talk to me at all so I m not sure if I should end it over text or not  can Reddit help,need help mentally abuse solid day want end relationship don time friend try help end will not talk not sure end text not geddit help
29915,I want to kill myself because I m ugly and I feel pathetic but I feel like it s the only way out of this lonliness and sadnessI just don t see the point anymore  Even as a kid o got picked on for my looks  I tried to make it for my parents but I don t think I can  I m thinking about buying a gun and ending it all,1,I want to kill myself because I'm lonely and pathetic. I want to buy a gun and end it all. As a kid I got picked on for my looks and I tried to make a gift for my parents but I don't think I can.,want kill lonely pathetic want buy gun end kid got pick look try gift parent not think
29916,Going mad with uncertaintyI have been suffering ever since I started school  and it hasn t stopped since  Constant bullying with no assistance despite my pleas to teachers  having so many friends betray me  even loved ones  even a sexual assault accusation which got me basically expelled  I ve had a couple  girlfriends  but almost all of them have just used me for sexual favours  with nothing in return  All I ve ever wanted was some loyal friends  a romantic relationship  a stable mindset and a hopeful future  All of those have been crushed  and I feel like I have nothing left to do with my life  The only path I have left to take that includes living is having constant meltdowns  failed attempts at love  taking prescription drugs every moment of the day and a broken uncertain future  This isn t the extend of my problems  such as over self awareness  worrying about everything I say or do  and isolation  but I d be droning on and on  and I m already taking up too much of your time  if you actually got this far  But I ve just given up at this point  I ve been told to keep going  to keep trying  but there s only so many second chances I can handle  The only thing holding me back from taking all my meds at once or finding a decent sharp object to finish what i should ve done years ago is false hope and made up futures  I ll edit this with any extra information that is required Thanks for bothering  people Kleo,1,Klo has been bullied since he started school. He was expelled from school because of a sexual assault accusation. He has had a couple of girlfriends but most of them used him for sexual favours. He is depressed and suicidal.,flo bully start school expel school sexual assault accusation couple girlfriend sexual favour depressed suicidal
29917,Goodbyecya round I guess I wanted to confess but I ll take this to the grave,1,Goodbyecya round I guess I wanted to confess but I ll take this to the grave,goodbye round guess want confess ill grave
29918,I hate myself  I am a useless person and just a detriment to this world I just don t have the will to live anymore  I drag down everyone I care about  I do not have a career going at all  My family  friends  even the woman that I love are all better off without me  With me dead  it will lift the weight off everyone s shoulders  Sure they will be sad for a while  but after that their lives will be better without me  I am sure of it  I am planning on setting a date and writing my goodbye letters  Goodbye cruel world  I get why you hate me,1,I hate myself. I don't have the will to live anymore and I drag down everyone I care about. I'm planning on setting a date and writing goodbye letters to the people I love. With me dead it will lift the weight off everyone's shoulders.,hate not live anymore drag care plan set date write goodbye letter people love dead lift weight shoulder
29919,How do i tell my mom that i want to skip online school tomorrow  I won t sleep a lot  it s  am  im anxious therefore can t sleep  and i really can t do shit if i didn t sleep a lot,0,How do i tell my mom that i want to skip online school tomorrow  I won t sleep a lot  it s  am  im anxious therefore can t sleep  and i really can t do shit if i didn t sleep a lot,tell mon want skip online school tomorrow will not sleep lot anxious sleep shit sleep lot
29920,I m Not Getting BetterI ve decided that it s just not going to get better  Try as I might  I can t get past what I ve been through  It s tearing me apart every single day  I don t want to feel this way anymore  I can t  If I had an easy method of doing it  I d be gone already  Won t be too long before I find one though,1,"It's tearing me apart every single day. I don't want to feel this way anymore. If I had an easy method of doing it, I'd be gone already. It won't be too long before I find one.",tear apart single day not want feel way anymore easy method go not long find
29921,Bye bye Goodbye r teenagers it s been a good run,0,Bye bye Goodbye r teenagers it s been a good run,bye bye goodbye teenager good run
29922,How did my life end like this Feeling so horrible  How can I keep going  My life is going nowhere on all fronts  Don t know what to do  I feel awful so often  and it s been going on for so long  How do you keep going,1,How did my life end like this Feeling so horrible  How can I keep going  My life is going nowhere on all fronts  Don t know what to do  I feel awful so often  and it s been going on for so long  How do you keep going,life end like feeling horrible go life go front don know feel awful go long go
29923,Wanted to make a post explaining BLM and racism So I saw a couple of posts in hot and people arguing about All Lives Matter and BLM  I just wanted to make this to explain it quickly  I m white but I support this All lives technically matter  But saying all lives matter is against the point   This comic I found online  https imgur com gallery lEABeYC  really helped explain it to me  Not that other lives aren t important  it s just that black lives need attention right now because they re being treated unfairly by everyone I know the BLM movement has some bad parts  like the rioting and looting which is terrible ofc but it also has a lot of good  Peaceful protests for black rights  That s amazing  All races are trying to change the system for the better  and that s really cool  But the reality is  black people are not treated equal right now  They should be  So the main focus right now is black lives mattering  Because white lives already matter  now we need to make black lives matter too  And every race  Thanks for coming to my ted talk,0,"All Lives Matter movement has some bad parts like rioting and looting, but also has a lot of good Peaceful protests for black rights. Black lives need attention right now because they are being treated unfairly by everyone. All races are trying to change the system for the better.",live matter movement bad part like rioting looting lot good peaceful protest black right black life need attention right treat unfairly race try change system well
29924,question for the girls you re on your period and a guy in your class asks u why you re taking your bag to the restrooms  what do u say,0,question for the girls you re on your period and a guy in your class asks u why you re taking your bag to the restrooms  what do u say,question girl period guy class ask take bag restroom
29925,This is the best place I could think of to ask I need some help finding good  edgy anime profile pictures  If you guys could help that d be great  Anime profiles in general also excepted,0,This is the best place I could think of to ask I need some help finding good  edgy anime profile pictures  If you guys could help that d be great  Anime profiles in general also excepted,good place think ask need help find good edgy anime profile picture guy help great anime profile general except
29926,i feel like i ll never find a friend or whoever that loves me as much as i love them seriously i really love all of my friends  obsessively  does anyone else feel like they love too much but their friends  love is too little,0,i feel like i ll never find a friend or whoever that loves me as much as i love them seriously i really love all of my friends  obsessively  does anyone else feel like they love too much but their friends  love is too little,feel like ill find friend love love seriously love friend obsessively feel like love friend love little
29927,I give up  Tonight is the nightIn a   yo female and this is More a rant than anything  I dont need advice or people telling me that i it ll get better  It wont  Or im being selfish  But iive done evrything  Ive talked to counsellors  Gonr to the hospital voluntarily   times   Another one wasnt my choice  posice also called on me   times  My friends  Hate me  Ive been assaulted many times and blackmailed into it  So yeah  This is the night  I have it all planned out,1,Tonight is the night I give up. I have been assaulted many times and blackmailed into it. I don't need advice or people telling me it will get better. I've talked to counsellors and went to the hospital voluntarily.,tonight night assault time blackmail not need advice people tell well talk counsellor go hospital voluntarily
29928,Holy shit I m a horrible person I m listening to an audiobook about manipulation and I frequently use every one of the tactics omg AAAAAAA,0,Holy shit I m a horrible person I m listening to an audiobook about manipulation and I frequently use every one of the tactics omg AAAAAAA,holy shit horrible person listen audio book manipulation frequently use tactic org
29929,Day   of posting a non amusing fact about me until I get laid  Fact  I m planning to do a face reveal on day   lol,0,Day   of posting a non amusing fact about me until I get laid  Fact  I m planning to do a face reveal on day   lol,day post non amusing fact lay fact planning face reveal day low
29930,no one left to talk tothere s no one i can confide in because of the intense intervention that occurs with suicidal ideation  last time i communicated my feelings i was assaulted by police  arrested for wanting to kill myself  and locked away for   days with actual schizophrenics and patients with psychosis  not to mention actual murderers  i trust no one but myself with my thoughts  until i live in a country where intervention doesn t involve prison   anywhere but USA  i m keeping it all to myself  i wish there weren t such insane consequences for vocalizing ones thoughts,1,"There is no one left to talk to because of the intense intervention that occurs with suicidal ideation. The last time he expressed his feelings, he was assaulted by police and locked away for days. He wishes there weren't such insane consequences for vocalizing one's thoughts.",no leave talk intense intervention occur suicidal ideation time express feeling assault police lock away day wish not insane consequence vocalize one thought
29931,I want to die and end my miseryHi m   and failure in life I quit my job I fucked up my relationship now he wants to leave me and is ghosting me from   days and all I m doing is crying and thinking about killing myself   I feel bad about my mother she dowsnt deserve this pain but I cant live anymore  Eveythn i do is mess  M a loser in life and life is hard  We r poor so another misery  I just cant stop cryin since my bf is ghosting me   I cant handle break up and I want to end this all now  I wanted to go live abroad I had dreams but m poor and I fucked up eveythn I can now m just waiting for the time to kill myself  I wanted to live a good life but my bad luck,1,I want to kill myself because I feel bad about my mother. My boyfriend wants to leave me and is ghosting me. I wanted to go live abroad but I'm poor and broke up with him because of his infidelity. ,want kill feel bad mother boyfriend want leave ghost want live abroad poor break infidelity
29932,I m Jay and I want to kill myselfI feel depressed whenever I go to classes  friends to me are just people who pity me and would try to leave my side after a few months  In my mind I think that no one in my life likes me  I have written a suicide note  I have never told anyone about this problem because well  I m too afraid to do it  I try to take my mind off it using the writing method but through some event during the day the thought always comes back to me,1,"Jay is depressed and wants to kill himself. He has written a suicide note but is afraid to tell anyone about it. He tries to take his mind off it using the writing method, but the thought always comes back to him. ",jay depressed want kill write suicide note afraid tell try mind writing method thought come
29933,I feel so aloneI m   and married  I have a child who is   almost   My husband was controlling at the beginning of the relationship before I was old enough to know better  Then we were pregnant and I thought having a child would bring me companionship  He is not affectionate  We work opposite schedules  He goes out twice a week  I have no friends  My job is at home  I don t leave he house other than for daycare or the grocery store or to fill up at the gas station  I have no family  Sometimes I just cry because I feel like I m worthless  I want to end how I feel but I can t help but feel so guilty because I have a child  I just feel financially trapped and emotionally drained  I m mentally exhausted  I attempted to talk to an old friend who was always there for me prior to my marriage  They said they had people over and were too busy  Please help,1,"Married and with a child. Husband was controlling at the beginning of the relationship. He is not affectionate. They work opposite schedules. He goes out twice a week. She has no friends, no family, and she works at home. She feels financially and emotionally drained.",marry child husband control beginning relationship not affectionate work opposite schedule go twice week no friend no family work home feel financially emotionally drain
