,text,class,summary,cleaned
6650,Teenagers i need your help  Okay so the girlfriend of a friend of mine  and my  ex  throws a sweet   party in   weeks and i am inevited  but I absolutely hate that girl  so at first i didnt wanna go  but now a girl i kinda like is also going and she asked me to with her  What should i do,0,Teenagers i need your help  Okay so the girlfriend of a friend of mine  and my  ex  throws a sweet   party in   weeks and i am inevited  but I absolutely hate that girl  so at first i didnt wanna go  but now a girl i kinda like is also going and she asked me to with her  What should i do,teenager need help okay girlfriend friend sex throw sweet party week invite absolutely hate girl not want girl kind like go ask
6651,Milestone Acheived I am   karma away from   karma My life is complete I would like to thank my mom  my dad  and twomad for helping me get here,0,Milestone Acheived I am   karma away from   karma My life is complete I would like to thank my mom  my dad  and twomad for helping me get here,milestone achieve karma away karma life complete like thank mommy dad mad help
6652,I hate being the problem I m done with this shit  I was the problem for making my family lives in hell because of me  my dad thinks he failed because of me  better I should suicide because its the last thing that will make me feel better  all my family works has gone to shit because of me,1,I hate being the problem I m done with this shit  I was the problem for making my family lives in hell because of me  my dad thinks he failed because of me  better I should suicide because its the last thing that will make me feel better  all my family works has gone to shit because of me,hate problem shit problem make family live hell dad think fail well suicide thing feel well family work go shit
6653,I have the wholesome award The Holy grail of all awards What will i do With it,0,I have the wholesome award The Holy grail of all awards What will i do With it,wholesome award holy grail award
6654,I ve never played Minecraft  I m on a tight budget and couldn t invest to but the Android version of Minecraft,0,I ve never played Minecraft  I m on a tight budget and couldn t invest to but the Android version of Minecraft,play min craft mon tight budget invest android version min craft
6655,Why I am good boyfriend material day   Pros  I m super chill   Everybody tells me I have a kind heart I m pretty tall like     I want someone to cuddle and protect  I don t know why but I have a major paternal instinct almost with people I love  Can cook Cons  I m a fatass  working on improving my health tho  At   I m going to the military so it ll be a while until you can see me when I join I m a tad adhd so I have a hard time staying on task sometimes Likes  Horses  Star Wars  classic cars  tractors  trucks  fishing  model trains  gorrilaz  lawn mowers  idk why I just do  video games  anime  and nature Dislikes  Whiny people  hitler  being told what to do when I was gonna do it anyways  rainy and cold weather  pedophiles  and getting my hands dirty  literally like I hate the cakey felling mad on your hands gives,0,"There are pros and cons to being a good boyfriend material. Pros: Super chill, tall, good looks, good personality, good sense of humor. Cons: He's fat, going to the military, adhd, doesn't stay on task well, dislikes rainy and cold weather, getting his hands dirty.",pro con good boyfriend material pro super chill tall good look good personality good sense humour con fat go military add not stay task dislike rainy cold weather get hand dirty
6656,I m cutting myselfI ve been cutting my shoulders for a long time  I cut them there so no one can see them no matter if I m wearing a long sleeved shirt or just a T shirt  but I want to know  what the best way to tell someone you ve been cutting yourself,1,I m cutting myselfI ve been cutting my shoulders for a long time  I cut them there so no one can see them no matter if I m wearing a long sleeved shirt or just a T shirt  but I want to know  what the best way to tell someone you ve been cutting yourself,cutting cut shoulder long time cut no no matter wear long sleeve shirt shirt want know good way tell cut
6657,someone got the   award  as a joke just to defy them are you genuinely kidding WHY ON EARTH WOULD YOU SPEND THAT MUCH MONEY ON  REDDIT,0,someone got the   award  as a joke just to defy them are you genuinely kidding WHY ON EARTH WOULD YOU SPEND THAT MUCH MONEY ON  REDDIT,get award joke defy genuinely kid earth spend money geddit
6658,Please helpFor the past three months I ve been unemployed  dropped out of school  gained   pounds  and moved back to my parents house  I haven t spoken to any of my friends for that time too  I have been so embarrassed of my appearance that I ve been avoiding everyone and avoiding going out except when I have to  I have struggled with binge eating for years and feel like I have tried everything out there to stop and I stopped confiding in friends because of my continued failure to quit binge eating and stop gaining weight rapidly  This is one of two times that I have ever felt close to suicidal the other time was almost   years ago  I am just so scared I will never stop binge eating and even if I did now I still am overweight now and it will take months then to get back to my normal weight  I don t see a way out and I just could use some advice since I have no one in my life I can talk to,1,"For the past three months, she's been unemployed, dropped out of school, gained weight and moved back to her parents house. She's been avoiding everyone and avoiding going out except when she has to. She has struggled with binge eating for years and she doesn't see a way out.",past month unemployed drop school gain weight move parent house avoid avoid go struggle binge eat year not way
6659,I m so tired I m tired of being depressed and having anxiety   I m broken and I can t be fixed   I m so tired of breathing and I m so tired of existing   I m not getting better  I m getting worse and I can t stand the constant weight of mere existence,1,I m so tired I m tired of being depressed and having anxiety   I m broken and I can t be fixed   I m so tired of breathing and I m so tired of existing   I m not getting better  I m getting worse and I can t stand the constant weight of mere existence,tired tired depressed have anxiety break fix tired breathing tired exist not get well get bad stand constant weight mere existence
6660,is   reddit followers good for a boy because it is undeniable that simps run rampant on reddit,0,is   reddit followers good for a boy because it is undeniable that simps run rampant on reddit,geddit follower good boy undeniable sim run rampant geddit
6661,Why does everyone try hack my Microsoft and Nintendo accounts First Russia now India   Its the wrong email I used to i cant even gjgbfbgbgbhb,0,Why does everyone try hack my Microsoft and Nintendo accounts First Russia now India   Its the wrong email I used to i cant even gjgbfbgbgbhb,try hack microsoft nintendo account russia india wrong email not gjgbfbgbgbhb
6662,My end is near  I feel content and relievedLong story short  my life has been a long long time of suffering  Fucked up childhood that fucked me up  I possibly have BPD  or at least very drastic symptoms towards it  bullying and long time depression and suicidal thoughts for the last seven years if not longer  I m writing this here because my friends and family are alarmed enough and well  I dont really want help  I just want to talk  To tell someone what I m feeling I ve tried to kill myself twice this year already  both time just being disappointed it didn t work  I dont see no way out  my moods wont stop and considering possible BPD and all the fucked up things that happen in my brain and the things I do I dont see it changing  I m hurting the people around me and I can see it  Me dying won t be easy and I know it s a void that will never be filled in many hearts of that I know  But at this point  I find it hard to care  I m at my happiest when I ve thought that I m finally dying  And with this  I won t be able to hurt those who I love anymore  Im terribly lucky to have them  to have such people love me  and they won t give up on me  I can t make them believe that I m a lost cause or maybe them give up  I ve realized  But I dont see myself backing out on this  I ve lost the fear I used to have for death  I m just very relieved it s all ending soon  I m very happy Thank you for reading  And thank you for doing what you do,1,"My life has been a long long time of suffering. I have suffered bullying, depression and suicidal thoughts for the last 7 years. I've tried to kill myself twice this year already and both times it didn't work. I don't see no way out. I'm at my happiest when I think I'm dying.",life long long time suffering suffer bullying depression suicidal thought year try kill twice year time not work not no way happy think die
6663,pleas help how should i use my christmas money,0,pleas help how should i use my christmas money,plea help use christmas money
6664,Day   Of Asking How Everyone Is Doing Filler filler filler jdkskjdd filler filler filler,0,Day   Of Asking How Everyone Is Doing Filler filler filler jdkskjdd filler filler filler,day ask filler filler filler disk add filler filler filler
6665,Decided to kill myself tomorrowMy thoughts have been getting really bad to the point I can t distract myself anymore   This is the last week of school before holidays and i can t bare the idea of the holidays  I ll be alone with my thoughts and I can t stand the idea of that   I just needed to vent I guess  sorry,1,It's the last week of school before holidays and I can't bear the idea of being alone with my thoughts during the holidays. Decided to kill myself tomorrow. I just needed to vent and I'm sorry.   ,week school holiday not bear idea thought holiday decide kill tomorrow need vent sorry
6666,I could take either Wow it s amazing how much I wanna be in a relationship where we sneak out at night to just walk around Or you know  just a relationship,0,I could take either Wow it s amazing how much I wanna be in a relationship where we sneak out at night to just walk around Or you know  just a relationship,wow amazing want relationship sneak night walk know relationship
6667,Why do you hate me My life has been nothing  Just going through it  I feel like everyone hates me  im a bother to everyone just by being alive  I want to die but its hard to kill myself  I dont know what im doing here  I hate myself  who I am  Im a good liar and I fake things about myself to others to make it seem like im better than what I am  I thought i found someone who loved me for who i was but love doesnt exist  Why cant I just be dead,1,Everyone hates me. I want to die but it's hard to kill myself. I thought I found someone who loved me for who I was but love doesn't exist. I'm a good liar and I fake things about myself to make it seem like I'm better than I am. ,hate want die hard kill think find love love not exist good liar fake thing like well
6668,this sub suckscompletely useless   I feel so alone,1,this sub suckscompletely useless   I feel so alone,sub suck completely useless feel
6669,Haven t Spoken To Him In Days I have a penpal who I met through reddit  We have been friends for just about a month now  and we basically talked every single day on Skype  He was gone through a lot in his life  dealing with depression  anxiety and Asperger s  About a week ago  he was messaging me tell me that he had overdosed on some medications he had  and his messages were getting weirder as time progressed  and they made less sense  He deleted me off Skype  and I haven t talked to him in over a week   A day or two after the incident  I had looked at his user profile and he had made a comment on a post he had made  three hours prior to when I had checked  I sent him a message on Skype  but he never responded  and soon after deleted the comments   He had told me he had very strong feelings for me as well  saying he believed he was in love with me I tried my hardest to always be there for him  and we had gotten into a couple arguments during our friendship  but nothing major He also lives in the UK   I live in the US  so I have really no way of knowing if he s alive or not I didn t know where else to post  and I m worried I know I shouldn t have waited a week to post  but I was hoping he was just busy with work or something,1,I have a penpal who I met through reddit. We have been friends for about a month and talked every day on Skype. Recently he deleted me off Skype and I haven't talked to him in over a week. He lives in the UK and I live in the US. ,pen pal meet geddit friend month talk day skype recently delete skype not talk week live live
6670,I m just getting worse Today is my birthday  I really should not have been here it felt like everything was in slow motion looking at my cake with the candles that my family got for a grown ass man  my thoughts were just stuck on wishing for my death I ve been to a hospital  therapy and even talked to my parents  who just tell me to go to church There is really no reason I am posting this but I can t talk to anyone about this When I m not self loathing in depression I m angry and irritable  my wife says she s scared of me because I am  unpredictable  and now I can t look at her the same and it makes me even more distant from her and I don t know what to do  I really don t know what to feel anymore I just don t want to be here anymore,1,Today is his birthday. He is depressed. He has been to a hospital therapy and talked to his parents. He can't talk to anyone about it. His wife is scared of him. He doesn't know what to do.,today birthday depressed hospital therapy talk parent not talk wife scared not know
6671,My willpower feels like it s being drainedHi  this isn t the first time I ve posted on here  I ve sat here deleted and rewritten everything a couple times now  I m   now and am going to college to be a radiology technician   I recently switched majors from IT  It has been   months since I was dumped and that has really been the trigger to how I feel at the moment  I have no real close friends left and my social anxiety has gotten worse  making it very difficult to express how I feel to my family  I attempted to take my life back in September  but ultimately decided I couldn t do it because the thought of my parents and brothers finding me terrifies me  But now I m starting to feel less and less okay about the idea of living  I really cannot find a purpose to keep on if I m going to remain unhappy forever  I can t find a point to slogging on through school  work  and life in general  I ve been told change something  I just wish I knew what I needed to change  I m too afraid to tell my parents the way I feel  I just feel so stuck and unmotivated to even help myself  It s pure laziness and I shouldn t even feel this way because I had a good childhood  plenty of friends  and a loving family  I just want to know what the fuck is wrong with me,1,"In September I tried to take my life, but I couldn't do it because the thought of my parents and brothers finding me terrifies me. Now I'm going to college to be a radiology technician and I switched majors from IT. I was dumped months ago and I have no close friends left. ",september try life not thought parent brother find terrify go college radiology technician switch major dump month ago no close friend leave
6672,what am i missingi saw something similar in the headline of another post here but really   what am i missing in life   like what is so fucking great about being here that anyone actually wants to stay here   and why do people keep telling me that i still have  so much to see in life  like they know there isn t anything for me to see   it s like they know my loss would be more of a financial inconvenience than a genuine loss and they just want to keep their pockets full,1,People keep telling me that I have so much to see in life but they know there isn't anything for me to see. They know my loss would be more of a financial inconvenience than a genuine loss and they just want to keep their pockets full. ,people tell life know not know loss financial inconvenience genuine loss want pocket
6673,Gosh I hate my father He s like  oh so you had plans for today  Well fyck you we goin on a ride to some nowhere because I said so  and when I say that I don t want to because I have some stuff to do he s like  cHiLd uR BrEaKiNg mY HeArT  Oh so this bitch got a heart  That s new,0,Gosh I hate my father He s like  oh so you had plans for today  Well fyck you we goin on a ride to some nowhere because I said so  and when I say that I don t want to because I have some stuff to do he s like  cHiLd uR BrEaKiNg mY HeArT  Oh so this bitch got a heart  That s new,gosh hate father like plan today fuck ride say don want stuff like child break heart bitch get heart new
6674,I m gonna do it i have no family anymore  they all died  Mom died from cancer my dad and my siblings died in a car crash i had to fucking see my baby brother die i have no friends any more and my grades are dropping it won t get better  I m gonna do it,1,I m gonna do it i have no family anymore  they all died  Mom died from cancer my dad and my siblings died in a car crash i had to fucking see my baby brother die i have no friends any more and my grades are dropping it won t get better  I m gonna do it,go no family anymore die mon die cancer dad sibling die car crash fucking baby brother die no friend grade drop will not well go
6675,What s the point I have been struggling all year in school except for last quarter  getting all B s  And even after getting those grades I feel like there s no point  this quarter I am doing well again but my parents have been making me feel worthless  Wanting me to get a job in a field I have no interest in always making me feel shitty when I tell them what I wanna be  I just have been waking up and going to school with zero motivation and feel as if I m just a waste of space  It s not like I m a shut in either I have many friends but lately I just get home and sleep cause I don t see any reason to be awake  Please help me,1,"Last quarter, she got all Bs in school. This quarter she is doing well again. Her parents want her to get a job in a field. She has no interest in always being told what she should do. She doesn't see any reason to go to school anymore.",quarter get school quarter parent want job field no interest tell not reason school anymore
6676,I feel alone I guessI ve only ever come close to suicide on few occasions  but it s on my mind a lot throughout the day  Knowing I could just slit my wrists and nothing will matter  Just nothing  No needs or desires needing to be satisfied  And I really don t know how the fuck imma cope with the rest of my life  I m too lazy to do anything in life an for most of the shit that just happens to happen to me it feels like I m fucking cursed  Like that s pushing it maybe but I only ever seem to notice when things go wrong but I m never able to appreciate what things are  I ve been trying to lose weight for months and I m growing overweight  It s been worrying to think it ll get worse and I ve not got much going for me already  I m lucky enough to have been born into a moderately wealthy family  But everything just seems so fragile for the future  These have been some of the hardest months of my life recently  I ve lost family  friends  the only meaningful relationship I ve had in years and there s no guarantee that anything will get better  And if it doesn t what the fuck am I gonna do about it  There s nobody to pick me up and when there is I don t think they understand  It s frustrating feeling like nobody understands  Even I struggle to put it into words but everything from environment of the community I ve been introduced to growing up to my own lazy shit head  everything just seems too much  And from the way things work at the moment  I m not sure I wanna be a part of the society I live in,1,I feel alone and depressed. Recently I lost the only meaningful relationship I've had in years. I've been trying to lose weight for months and I'm growing overweight. I was born into a moderately wealthy family but everything seems fragile for the future. ,feel depress recently lose meaningful relationship year try lose weight month grow overweight bear moderately wealthy family fragile future
6677,Oxygen is gay Proof am gay i breathe oxygen was inside me that s gay,0,Oxygen is gay Proof am gay i breathe oxygen was inside me that s gay,oxygen gay proof gay breathe oxygen inside gay
6678,Hello  I would like to say that my dad works at Coca Cola  That s it  and yes we do get free soda from his place,0,Hello  I would like to say that my dad works at Coca Cola  That s it  and yes we do get free soda from his place,hello like dad work coca cola yes free soda place
6679,fully clothed women make me so hard   send pics of your naked body i need to be turned off                             hahhahah jk                            unlesss                              but seriously please dont get mad at me im just joking nudes are bad,0,fully clothed women make me so hard   send pics of your naked body i need to be turned off                             hahhahah jk                            unlesss                              but seriously please dont get mad at me im just joking nudes are bad,fully clothe woman hard send pic naked body need turn hash hah seriously not mad joke nude bad
6680,Around   minutes ago  I took the pills Now  I m just kinda waiting for the pills to take effect Strangely  I ve never felt more calm and happy in my life  I think I ll finally be able to be at peace I m   years old  It s a shame I was never really able to enjoy my youth I never really had any good friends  My parents always thought I was overreacting when I said I was severely depressed  All my parents cared about were my grades  my looks and how many rewards I got  I was their  trophy  so to speak  Now that I m about to disappear from this world  I wonder how they re going to feel  Secretly  I hope they feel extremely guilty I ve been writing my note and revising it since I was   years old  I ve attempted suicide   times  excluding this time  I really hope this one will be my last,1,I took the pills and I'm waiting for them to take effect. I feel calm and happy. I've been writing a suicide note since I was a child. I have tried to kill myself several times before. I hope this time will be the last time.,take pill wait effect feel calm happy write suicide note child try kill time hope time time
6681,average r teenagers user on a date be like  hey girl wanna play the number game the what oh never mind i ll just ask you    and  what do u mean what s your height  and also do you prefer your guys circumcised,0,average r teenagers user on a date be like  hey girl wanna play the number game the what oh never mind i ll just ask you    and  what do u mean what s your height  and also do you prefer your guys circumcised,average teenager user date like hey girl want play number game mind ill ask mean height prefer guy circumcise
6682,From a nursing home employee  stay the f  home  This might be graphic  but i don t give a fuck   I m   the youngest employee at the nursing home where I work  I was hired after coronavirus began sweeping across the U S  and let me tell you about some of my experiences with COVID We don t allow visitors  Healthcare workers and employees are the ONLY people allowed inside the building  This means the residents haven t had physical contact with their loved ones  children  grandchildren  SPOUSES  since March of  I  know  these residents personally  I know about their husbands and wives  their past careers  their hometowns  and how they like their coffee  I ve seen the most lively people withered down to skin and bones  on their deathbed surrounded by healthcare workers because they can t see their fucking families   I ve arrived at work to find empty rooms from residents suddenly being whisked away to hospitals because of covid  never returning  and one day walking past the empty room to find the nameplate has been removed  they re not coming back   With the lockdown  you might ask  how are these people getting covid  because the employees lie about having symptoms  relatives drop off gifts after being exposed  and people just aren t being fucking safe   We have to wear masks   face shields for our entire shift  This isn t difficult  if I can do it in a hot  humid kitchen for   hours straight  you can do it in the grocery store for   minutes I am sick and fucking tired of people  ESPECIALLY young people like us  putting themselves at risk because they think they re invincible  It might not affect you  but it will kill your fucking grandma  STAY HOME  WEAR MASKS WHEN YOU ABSOLUTELY  have  TO GO OUT,0,At the nursing home where I work I was hired after coronavirus began sweeping across the U.S. I am sick and tired of people putting themselves at risk because they think they're invincible. I know the residents personally and I know them very well.,nursing home work hire corona virus begin sweep sick tired people put risk think invincible know resident personally know
6683,no guitar post today   dont know what to play that would be interesting to watch and the riff im currently working on learning is not quite there yet,0,no guitar post today   dont know what to play that would be interesting to watch and the riff im currently working on learning is not quite there yet,no guitar post today not know play interesting watch riff currently work learning not
