,text,class,summary,cleaned
182183,This is my goodbye In an hour  I will die  I will do it on purpose  I don t care anymore and it s all over how much   Doesn t matter  I won t become homeless again  I ve done everything to survive  Then the government literally fucks me over  I can t pay like   for one night of where I live so I can make other arrangements   I m not packing all of my shit again   I m not gong to starve again   I m not going to be attacked again   I m not going to worry again   I won t let them worry anymore   I ve come to the conclusion some of us are supposed to die  Some of us are supposed to fail  Some of us are supposed to lose  Why  Otherwise the world doesn t work  People all around you need to see disaster in order to stay in line or whatever you wanna call it  I think some of us are either arbitrarily picture just picked I don t know  I m a father of grown children the youngest sibling have a big family and she tell you all some thing that I can t turn to any of them  Am I bad guy  No  I don t think so  No no I think so but can I find a reason  Beside being worthless  Dealing with depression my whole life  Going through such an abusing divorce that I m not myself anymore   But it had to be something I did right  Otherwise why would I be sitting here messaging a bunch of strangers who aren t going to Think about this after the time they read it  Have I try to fix this  All day  But it s not gonna happen this time  So I look at it as maybe one less depressed person on the streets I ll I ll make it my best to make it look like it was an accident   Hopefully will help my kids  And I feel horrible one of them  But I can t think about it  If I do all I am doing needlessly suffering from something I can t fix and that is my being a failure   Im so sorry  baby girl   Sorry I can t write anymore  This is killing me alresdy,1,"Some of us are supposed to die, some of us to fail or to lose. I'm a father of grown children. The youngest sibling have a big family and she tell you all some thing that I can't turn to any of them. I've been depressed all my life. I went through an abusive divorce. I'll make it look like it was an accident.",suppose die fail lose father grown child young sibling big family tell thing not turn depress life go abusive divorce look like accident
182184,quarantine video project  plz help  so i m still doing distance learning  for my video production class i have to create an intro for a tv show  and it has to be about me or my idea  meaning i cant go around and film  a day in the life of my dog thor  it has to include me lol  i need ideas  life is so boring  unmotivating  and uninteresting i have NO idea what to film  i ve had a huge mental block with this class from the very beginning online school started and that s probably why i ve procrastinated on this project for so long  i ve thought about it for a bit but i don t even know what to do  anybody got any ideas,0,"For distance learning for her video production class, she has to create an intro for a tv show and it has to be about her or her idea. She doesn't know what to do. She's been procrastinating for a long time.",distance learn video production class create intro idea not know procrastinate long time
182185,Damn My mom just called me a disappointment today   oof,1,Damn My mom just called me a disappointment today   oof,damn mon call disappointment today
182186,if i was in  diary of a wimpy kid    i wouldve simply licked da C H E E S E off da floor   like  it would be so disgusting to eat after being on a dirty baseball court for months    i bet it would also give me diarrhea,0,if i was in  diary of a wimpy kid    i wouldve simply licked da C H E E S E off da floor   like  it would be so disgusting to eat after being on a dirty baseball court for months    i bet it would also give me diarrhea,diary wimpy kid simply lick day floor like disgusting eat dirty baseball court month bet diarrhoea
182187,This subreddit is either incels  virgins  or idiots There are also other people but damn  are there a lot of incels in the making,0,This subreddit is either incels  virgins  or idiots There are also other people but damn  are there a lot of incels in the making,sub edit inc els virgin idiot people damn lot inc els making
182188,My parents are fucking idiots My parents told me that starting tomorrow when school starts I won t be able to play my Xbox ds or laptop unless I get all  straight As  And they said if I do get all straight As I will only be aloud to play them for   hour a day  I m just going to sell them because I can t use them anymore,0,"Starting tomorrow when school starts, I won't be able to play my Xbox ds or laptop unless I get all straight As. If I don't get straight As, I will only be aloud to play them for one hour a day.",start tomorrow school start not able play box laptop straight not straight aloud play hour day
182189,Being me SUCKS   SUCKS SUCKS,1,Being me SUCKS   SUCKS SUCKS,suck suck suck
182190,Something I look forward toIt s possible they will allow Medical Assistance in Dying for those with mental illness in Canada in the future   It is being considered   We already have it for those with other serious illnesses,1,Something I look forward toIt s possible they will allow Medical Assistance in Dying for those with mental illness in Canada in the future   It is being considered   We already have it for those with other serious illnesses,look forward tit possible allow medical assistance die mental illness canada future consider illness
182191,I survive  So can youI am a survivor of depression and suicidal thoughts  I am a long time lurker of reddit  As it is December and a difficult time for many of us  I thought I might visit a bit and see if my experience could help anyone  I have lived with this condition all of my life  I am a   woman  I hope my experience may be of help to anyone fighting the fight  AMA  This is my first time here,1,It is December and a difficult time for many of us. I have lived with depression and suicidal thoughts all of my life. This is my first time on reddit. I am a woman and I hope my experience will help anyone.,december difficult time live depression suicidal thought life time geddit woman hope experience help
182192,Update on my couple of last posts Still listening to eminem idk what i can say more Listening to Hailie s song btw,0,Update on my couple of last posts Still listening to eminem idk what i can say more Listening to Hailie s song btw,update couple post listen eminem not know listen daily song way
182193,I don t get how so few people trust the covid    of people say they won t get the code vaccine cuz they don t trust it what s wrong with them don t they want to get back turn normal and stop ruining the economy,0,I don t get how so few people trust the covid    of people say they won t get the code vaccine cuz they don t trust it what s wrong with them don t they want to get back turn normal and stop ruining the economy,don people trust covid people will not code vaccine cut don trust wrong don want turn normal stop ruin economy
182194,I m happyFor the first   seconds when i wake up but then i remember who i am and start wishing id die in my sleep,1,I m happyFor the first   seconds when i wake up but then i remember who i am and start wishing id die in my sleep,happy second wake remember start wish d die sleep
182195,Girls of Reddit  what s a question you ve always wanted to ask a boy  I m male and will answer any question given to me  no matter how weird it is,0,Girls of Reddit  what s a question you ve always wanted to ask a boy  I m male and will answer any question given to me  no matter how weird it is,girl geddit question want ask boy male answer question give no matter weird
182196,it could just be so easy so why do i keep fighting the urgesi can t stop crying i m so mad at myself for everything  mainly for being alive  there just no fucking point to any of it but i ll never be taken seriously enough,1,it could just be so easy so why do i keep fighting the urgesi can t stop crying i m so mad at myself for everything  mainly for being alive  there just no fucking point to any of it but i ll never be taken seriously enough,easy fight urge stop cry mad mainly alive no fucking point ill take seriously
182197,Honestly I can t live in this world I can t function in this world because of my mental health such as anxiety  depression  suicidal feelings  gender dysphoria  body dysphoria  self hatred  you name it  I am genuinely a really stupid person and unable to do any basic math  write  etc  So going to school and having a successful career with a high paying job is impossible  Since I was born a man nobody gives a flying fuck about you  it s just a reality unfortunately  Plus I don t see a point in working everyday to achieve absolutely nothing  I can t get a relationship  so there s nobody to live for  I can t live in this world anymore it s just pain and a waste of time,1,"Because of his mental health, he can't function in this world. He is unable to do any basic math write. Since he was born a man nobody gives a flying fuck about him. He doesn't see the point in working everyday to achieve nothing and can't get a relationship.",mental health not function world unable basic match write bear man give fly fuck not point work everyday achieve not relationship
182198,Comment and I ll describe you by your pfp avatar Please be patient for your results,0,Comment and I ll describe you by your pfp avatar Please be patient for your results,comment ill describe pop avatar patient result
182199,im at the end of my fucking ropeFor the past   years I ve had the best  most fun   rocky  and my first romantic relationship  there were definitely ups and downs and a lot of passion fighting especially towards the end  we almost had a family and were set to get married then we lost the baby  Neither of us coped properly and wore each other down and i left  its the biggest fucking mistake I ve ever made  im alone  i have no one  I m neck deep in debt and I m back at my parents place as a failure  i feel nothing but regret for leaving the best thing that ll ever happen to me with no chance of ever getting it back  she moved on  I m currently trying to pry off the lock off of a gun and maybe then i can go back to home  maybe meet my kid  anything to wake up from this fucking nightmare,1,"After a rocky relationship, he lost the baby and now he's alone and broke up with his girlfriend. He's in debt and he's back at his parents' place. He wants to go back home and meet his kid. ",rocky relationship lose baby break girlfriend debt parent place want home meet kid
182200,Guys we need to stop fighting against anti maskers If they die they won t be spreading their genes so it s fine,0,Guys we need to stop fighting against anti maskers If they die they won t be spreading their genes so it s fine,guy need stop fight anti masker die will not spread gene fine
