,text,class,summary,cleaned
160424,Free   in VERSE   and use code  LDGNT https verse me invite LDGNT   Download Verse  use code  LDGNT  deposit and spend or send to your friend   and get back   instantly  Then you can just withdraw the   you got back,0,Free   in VERSE   and use code  LDGNT https verse me invite LDGNT   Download Verse  use code  LDGNT  deposit and spend or send to your friend   and get back   instantly  Then you can just withdraw the   you got back,free verse use code light verse invite light download verse use code light deposit spend send friend instantly withdraw get
160425,Since im bored lets play a game Ask me questions and after I answer edit the question to make me look horrible    amp x B and please dont do some low effort shit like   do you like racists     and then edit it to   do you like babies      amp x B like try to be a little creative,0,Since im bored lets play a game Ask me questions and after I answer edit the question to make me look horrible    amp x B and please dont do some low effort shit like   do you like racists     and then edit it to   do you like babies      amp x B like try to be a little creative,bore let play game ask question answer edit question look horrible amp not low effort shit like like racist edit like baby amp like try little creative
160426,The most annoying shit All the cute girls and boys are always in a different continent,0,The most annoying shit All the cute girls and boys are always in a different continent,annoying shit cute girl boy different continent
160427,It might be my last week alive I realise that I ve been posting here a lot  but I guess the things that a stranger on the internet says to comfort me are a lot nicer than the things I ve had said to me IRL I m just so lonely  I m pretty sure that I m going to die alone  Every relationship I ve had has ended because of how fucked up I am  Which fucks me up even more  No one wants me  I see all the people around me finding people and ending up in great relationships and I can t help but think of how no one wants me  If I m going to spend my life alone I might as well end it soon to save myself from further heartbreak down the road   I don t enjoy anything at all  Nothing makes me happy  I feel empty  I ve lived my life making others happy and doing stuff for others  but whenever I need someone I get nothing   I want to die  but I can t bring myself to do it  I planned on drinking a bottle of vodka and taking a handfull of pills the other night but all I did was drink  cry  and then fall asleep I don t want to do this anymore  I just want to end it all,1,It might be my last week alive. I'm lonely and depressed. Every relationship I've had has ended because of how messed up I am. No one wants me. I don't enjoy anything at all. I want to end it all. ,week alive lonely depress relationship end mess no want not enjoy want end
160428,it s difficult not being a people person idk why but I don t connect with others at all  around others the life goes out of me  no energy  conversation is difficult  rarely ever lasts longer than a minute and it s never interesting  around other is ironically when I feel most lonely  being in a crowd of people talking and me standing there looking stupid is unbearable  it sucks being like this  I have no one,1,It's difficult not being a people person because she doesn't connect with others. She feels most lonely when she's in a crowd of people talking and she feels like she's standing there looking stupid. She has no one to talk to.,difficult not people person not connect feel lonely crowd people talk feel like stand look stupid no talk
160429,Does it get better I ve been depressed and semi suicidal for almost five years  The only reason I ve been alive this long is because I always hoped it would get better  But it hasn t  It hasn t gotten a damn bit better and I care less about my life every day  Does it get better,1,Does it get better I ve been depressed and semi suicidal for almost five years  The only reason I ve been alive this long is because I always hoped it would get better  But it hasn t  It hasn t gotten a damn bit better and I care less about my life every day  Does it get better,well depressed semi suicidal year reason alive long hope well gotten damn bit well care life day well
160430,Would you rather have your weekends including Friday or no  it s best if we can make all   days of the week a weekend tho,0,Would you rather have your weekends including Friday or no  it s best if we can make all   days of the week a weekend tho,weekend include friday no good day week weekend
160431,what should i do i am bored at home what should i do i can drive other places,0,what should i do i am bored at home what should i do i can drive other places,bore home drive place
160432,How to beat NO NUT NOVEMBER Alright lads I may have out smarted NNN here how now  you can t cum right so what if we just beat are meat but don t cum it simple it has the word no nut we re not nutting were just beating,0,How to beat NO NUT NOVEMBER Alright lads I may have out smarted NNN here how now  you can t cum right so what if we just beat are meat but don t cum it simple it has the word no nut we re not nutting were just beating,beat no nut november alright lad smart cum right beat meat don cum simple word no nut not nut beat
160433,I twisted my ancle today I was jumping over posts as you do  while my condo was being evacuated  due to a fire in the parking garage  and I kept on jumping over them non stop and I was at somewhere like fifty posts  Then I started to get tired and my leg got hit and I toppled over  All the while my brother was pretending he was a personal trainer  thankfully he managed to carry me all the way back to to condo once the issue was done with  Bo now I ve been lying on my bed for   hours,0,There was a fire in the parking garage and the condo was evacuated. My brother carried me back to the condo after the issue with Bo was resolved. I've been lying on my bed for hours now.   . ,fire parking garage condo evacuate brother carry condo issue resolve lie bed hour
