,text,class,summary,cleaned
140033,Help please pleaseI ve been having on and off thoughts about hanging myself but now it s really advanced   I want to go to the E R but once I do  I can t ever join the military or become an officer because of that red flag in my records,1,Help please pleaseI ve been having on and off thoughts about hanging myself but now it s really advanced   I want to go to the E R but once I do  I can t ever join the military or become an officer because of that red flag in my records,help have thought hang advanced want join military officer red flag record
140034,Being rejected hurts a lot This is kinda long  Sorry             I m in high school  I have a semi medium sized friend group  but I think they all just hate me  Before now  it s just been little subtleties I sometimes noticed  that could ve meant nothing  But now one of my friends is having a party  and I was specifically not invited  They tried to whisper about it  but I still heard  I felt so crushed the whole day  On top of that  two of my closest friends are just completely shutting me out of our little subgroup  They didn t talk to me at all during class today even when I tried to talk to them  They seem so much closer to each other and I feel like an outcast  I wish it was easy for me to share affection so easily like they do      I think I m just annoying  I guess I d understand why everyone hates me  Even though it might be worse to have no friends period  I feel even more rejected like this because it s like they re just tolerating me  or even below that  secretly hating me and talking behind my back  When we all first became friends  we were so nice and we all hung out  I really felt like I was finally worth something to someone  I was stupid to think they cared about me  Putting all of my feelings into them was a dumb mistake  I crave for people s attention and approval  and they all just make me feel horrible about myself              Considering suicide over things like this makes me feel even more childish and unloveable  I feel like a brat because I m essentially upset that people don t like me  I wouldn t like me either  so I m not sure why I m blaming them  It just hurts to have it proven to me that I am extremely pathetic for continuing to be their friends  I couldn t ever be by myself because I m that dependent  I wish I was well loved  even by one friend  I feel that I have so much love to give  but I m not good enough for anyone to want to do the same and love me just the same   Thanks for reading this,1,"In high school, one of her friends is having a party and she was specifically not invited. Two of her closest friends are shutting her out of their subgroup. They didn't talk to her at all during class today even when she tried to talk to them.",high school friend have party specifically not invite close friend shut subgroup not talk class today try talk
140035,lost I have struggled for years secretly  crying myself to sleep every night   Then I broke apart  still somehow forcing my mind to fight through to meet people s expectations   At some point it did not work anymore  no matter how hard I tried   Even if I hated it so much I had no choice but to ask for help  support  advice and so I have asked family  professionals and mentors   But what did I get in return  Blame  hatred  oppression  yelling  violence  the feeling of being a total burden and disappointment and having heavy trust issues   After three more years of enduring this  I can barely breathe anymore  Like a little child I am even nearly unable to speak after getting punished for it several times   I m a little lost  It feels cold  dark and scary  Please help me,1,After three years of enduring this I can barely breathe anymore. I am nearly unable to speak after getting punished for it several times. I'm a little lost and it feels cold dark and scary. Please help me. I need help. ,year endure barely breathe anymore nearly unable speak getting punish time little lose feel cold dark scary help need help
140036,yo anyone wanna play minecraft im bored and im looking for a modded java server of anyone has one  i can run pretty much anything on my pc,0,yo anyone wanna play minecraft im bored and im looking for a modded java server of anyone has one  i can run pretty much anything on my pc,want play min craft bored look modded java server run pretty pc
140037,I m not able to see a future anymore  my SO is distant  coming home late from work and I m going to lose my mindI was homeless until he took me in  I ve lost nearly all contact with everyone since I became homeless  because I just wasn t  around  I guess  I try to make new friends  I try to get over my mothers N abusive behaviour and I m trying to work on my own issues and myself  but my SO who was supportive is pulling away  lately he even admits to staying away from home longer so he doesn t have to  deal  with me because I  need  him too much  I just wish he d see I only get mad because I don t know what to do  I don t know how to ask for help  he s broken up with me several times saying he doesn t want a relationship  saying he loves me  then he says that it was a mistake  but that he does see no future with us because of how I am  and I m sure it s me  because I m so fucking sad all the fucking time   I don t know what to do anymore  I only feel him pulling away from me   I have no family and no friends  not that I see or hear from often since they re all caught up in their own lives which is normal  I ve never really been open to anyone about how I really feel  because my SO is the only person I trust and I don t want anyone to make me hate him  I don t know what to do anymore  he s pulling away  coming home late  sitting in a different room than me  avoiding me  and sometimes he s really nice to me but I don t know what to think I have no one else  please help me,1,My boyfriend has broken up with me several times recently because he doesn't want a relationship with me. I was homeless until he took me in. I have lost all contact with everyone since I became homeless. I don't know what to do anymore.,boyfriend break time recently not want relationship homeless take lose contact homeless not know anymore
140038,help please hi everyone ok so this is what s going on  i met this girl on discord through my friends right  we ve been just playing minecraft and whatnot  just hanging out  and then a couple days ago my friend told me that she liked me  which was really obvious  come to think about it  BUT the problem is  she lives in a different state  about   miles away  i really like her but we re only   and theres no chance of us actually being together irl  i just dont know what to do  ik that it probably wouldn t work out if we tried long distance  but i want her so much  any advice will be appreciated,0,"A boy met a girl on discord through his friends. She told him that she liked him, but she lives in a different state about miles away and he doesn't know what to do about it. He doesn't want to try to meet her long distance.",boy meet girl discord friend tell like live different state mile away not know not want try meet long distance
140039,Online counseling rejected me  I m done I can t do it anymore  It felt like I had only enough strength to reach out one more time for help  and fucking BetterHelp said I needed face to face counseling  which I can t afford enough of  I m fucking done with mental healthcare in this country  Who the fuck REJECTS someone who is begging for help  I hate my life and job and I just want to feel nothing,1,"Online counseling rejected me. I hate my life and job and I just want to feel nothing. I'm done with mental healthcare in this country.    i.e. I need face-to-face counseling, which I can't afford. ",online counselling reject hate life job want feel mental healthcare country need face face counselling not afford
140040,I love the feeling when I ve made a planI do nothing for a few days and wallow in my own depression until I finally make the choice to end my life  Then everything feels so nice  I feel actual happiness that I almost never get   I ve made preparations  tied all my loose ends  and typed out a will left open on my computer so it will be found  This time I ll succeed  I know it  I ve failed many times in the past  but I was going about it the wrong way  I can t wait to be gone  I hope it works,1,I love the feeling when I have made a plan to end my life. This time I have tied all my loose ends and typed out a will. I have failed many times in the past but I was going about it the wrong way. ,love feeling plan end life time tie loose end type fail time past go wrong way
140041,I m completely doneI ve lost all my friends  I ve lost the love of my life  and now my friend just fucking died  I can t do this anymore  I could deal with shit when I had people  when I had at least a shoulder to cry on or fucking SOMEONE but now I m just fucking alone  I can t do this anymore  I can t deal with this anymore  I need my close friends  I need my ex  I really fucking miss my ex  Fuck you for leaving me I still don t know what I even did  I just give up  I m just going to do it eventually  and now my friend is dead  It wasn t ever her fault  she got hit by a car  It was a fucking pedestrian death  She didn t deserve it  I wish I could have taken her place  She impacted so many people while I ve been crying for   weeks straight,1,My friend died. She was hit by a car. She didn't deserve to die. I miss my ex. I wish I could have taken her place. I've been crying for weeks straight. I don't know what I did. ,friend die hit car not deserve die miss sex wish take place cry week straight not know
140042,I have a half bottle of pinot  a hard seltzer  and about  mg of Alprazolam Xanax  is that enough to end it a   pack of hard seltzer  I ODed   years ago but was found before it was too late  This time I am home alone for the next   hours and there is no one to stop me  But I want to make sure I do it right  How much would it take to kill me  and as fast as possible  I ve already started drinking,1,A half bottle of pinot a hard seltzer and about mg of Alprazolam Xanax is enough to end a person's life. I ODed years ago but was found before it was too late. This time I am home alone for the next hours and there is no one to stop me. ,half bottle pinot hard seltzer alpha slam anal end person life odd year ago find late time home hour no stop
140043,Why to use Microsoft edge instead of Chrome   Microsoft edge is faster than chrome  When you search something you can say you re edging instead of googling,0,Why to use Microsoft edge instead of Chrome   Microsoft edge is faster than chrome  When you search something you can say you re edging instead of googling,use microsoft edge instead chrome microsoft edge fast chrome search edge instead google
140044,Good morning Morning everyone just woke up how are you all,0,Good morning Morning everyone just woke up how are you all,good morning morning wake
140045,does anyone else get anxiety attacks from caffeine  question is in the title,0,does anyone else get anxiety attacks from caffeine  question is in the title,anxiety attack caffeine question title
140046,do u ever get upset just cus ur parents apologize my dad pointed out that i have a hole in my pants on my butt my poking it with the broom in his hand but then my mom told him to leave me alone and he apologized and now i m just upset and uncomfortable    like i d be fine and wouldn t give it a second thought if he hadn t apologized but since he did i feel upset like it s bigger than it is i hate my life i shouldn t be this upset fuckfuckfuck,0,"My dad pointed out that he has a hole in his pants on his butt, but when my mom told him to leave him alone, he apologized. Now he's upset and uncomfortable, because he didn't have to apologize. ",dad point hole pant butt mon tell leave apologize upset uncomfortable not apologize
140047,I can t take this shit anymore Like wtf covid is hitting hard here where i live  i suck at everything i do  school is stressing me out and i don t understand in general why i keep getting up everyday  I don t get any sleep  it s so fucking cold in school that im catching one cold after another and the sun is gone because of winter  I honestly don t know how i am supposed to survive this year  I can t speak to people due to social anxiety and the few friends i have don t really care about me,0,Covid is having a hard time at school because of the cold weather and social anxiety. He can't speak to people due to social anxiety and his few friends don't really care about him. He doesn't know how he's supposed to survive this year.,covid have hard time school cold weather social anxiety not speak people social anxiety friend not care not know suppose survive year
140048,Lizzo is actually not that bad Jeff Bezos was right Now I know why he is lizzo s no   fan She is very talented Highly recommend,0,Lizzo is actually not that bad Jeff Bezos was right Now I know why he is lizzo s no   fan She is very talented Highly recommend,lizzy actually not bad jeff bozos right know lizzy no fan talented highly recommend
140049,oucheyit hurts so bad        i want to end it all,1,oucheyit hurts so bad        i want to end it all,ouch hurt bad want end
140050,Anyone knows where I can watch the maltese falcon movie  I watched it in class but I didn t understand anything and I can t find it pls I need help,0,Anyone knows where I can watch the maltese falcon movie  I watched it in class but I didn t understand anything and I can t find it pls I need help,know watch maltese falcon movie watch class understand find plus need help
140051,Should I do this again  Second time a dude has dmed me on discord and just dumped a shit ton of problems onto me  I haven t even known them for a week and I already want to block them  It s not like I don t want to help or anything  it s just that I have no clue what to do when someone tells me this kind of stuff  At one point I can t console them anymore and I don t know what else to do  I can t manage their stability while keeping my own   The worst part is that they always expect me to talk to them for hours  I can understand sometimes  but the conversation has clearly run dry and I m a very busy person  Am I supposed to spend all my free time talking to them I m not even sure if I should because both times the dudes told me I m their only friend  Honestly I feel like they re expecting too much from me seeing that we just met  Is this even normal for discord friends  I m so confused and I just don t know what to do,0,"Dude dumped a lot of problems on her discord even though they haven't known each other for a week. She doesn't know what to do. They expect her to talk to them for hours, but she's busy and doesn't have time for that.",dude dump lot problem discord not know week not know expect talk hour busy not time
140052,I have been uncontrollably sobbing for half an hour now  this is what mental illness really looks like Maybe I m just speaking for myself  maybe this is just some desperate plea for understanding or a little bit of grace  but I m so tired  so so tired I m tired of people looking at me and invalidating my struggling because I have a smile on my face  I laugh when people say  aha mood  when I talk about my depression jokingly  knowing they ve never experienced anything close to what I go through on a daily basis I hate feeling like I m invalidating other people s pain when I think that  even though it may be true  I know that their  yeah my little brother broke my pallets the other day and I felt the same  will never be the same as my curled in a ball  clutching my heart to remind myself I m still alive while gasping for air  sobbing uncontrollably over pain that I constantly tell myself is no big deal   If I hurt myself  even if it s not with the intention to do irreversible damage  I feel like I ve failed and that I should be better  I should have just sucked it up when my father would yell at me that  everyone gets sad  and that  people that are really abused are  x worse than I am I hate that people think that I m doing it for attention whenever I rarely post something about it  wether it be for karma  snaps or otherwise I m in so much pain but I m still living  that feels like too much and not enough all at once,0,I'm depressed. I'm tired of people looking at me and invalidating my struggling because I have a smile on my face. I hate that people think that I'm doing it for attention whenever I rarely post something about it. ,depress tired people look invalidate struggling smile face hate people think attention rarely post
140053,You think you re embarrassing  Soooo what age did you have you re anti SJW phase at  I was   and thought that feminism was bad and was also an onision stan,0,You think you re embarrassing  Soooo what age did you have you re anti SJW phase at  I was   and thought that feminism was bad and was also an onision stan,think embarrass age anti saw phase think feminism bad sion stan
140054,Checking out of life Welp I think its finally time to just do it  I dont even know why I m typing this to be honest  If anyone I know finds this them I m sorry if I hurt you  I m just simply not able to do this anymore,1,Checking out of life Welp I think its finally time to just do it  I dont even know why I m typing this to be honest  If anyone I know finds this them I m sorry if I hurt you  I m just simply not able to do this anymore,check life help think finally time not know type honest know find sorry hurt simply not able anymore
140055,Anyone else click on a post just for it to be a long paragraph and then u exit cause aint nobody got time fo dat or is it just me with the low attention span,0,Anyone else click on a post just for it to be a long paragraph and then u exit cause aint nobody got time fo dat or is it just me with the low attention span,click post long paragraph exit not get time dat low attention span
140056,A week ago I was turning   and I asked you guys what it was like  You guys gave me multiple answers  but here are the most common  you will be depressed now  you will be   you will get more recognition And I have to say all of those pretty much happened  Yes  I m   now  Yes  people have noticed that I have aged a year  And yes  I ve been really depressed  The depressed one is probably the biggest  I wouldn t say I m depressed but more frustrated  On my birthday  last Monday  I got homework from   of my   teachers and basically worked for maybe   hours straight  Now this is ok because most of the work wasn t even due that night but still  My science teacher gave me   assignments over the week  which was actually not that bad since science is not really confusing to me and most were pretty short  However the same week we took these week long tests inside class that prohibited us from actually doing schoolwork  So I had barely any time to get homework done IN school  which most of my teachers let me do  and that means that I had a lot of work at home  At the same time my math teacher sent us a lot of homework assignments too  same with my English teacher  Nevertheless I barely had any free time at all which just made me sleep deprived and overall just sad  To make things even better my math teacher yelled at us constantly and basically said that only her class was important and piled on homework while we had multiple unavoidable tests given to us by the state Nevertheless I still had a good birthday  I ve reached the point where I only just want money  Kinda weird how Reddit predicted my week,0,Reddit predicted that a year ago he would be depressed. Now he's depressed but more frustrated. On his birthday last Monday he got homework from his teachers and worked for maybe hours straight. His science teacher gave him assignments over the week. The same week they took week-long tests inside the class. Math and English teachers also gave him homework assignments.,geddit predict year ago depress depressed frustrated birthday monday get homework teacher work maybe hour straight science teacher give assignment week week take week long test inside class match english teacher give homework assignment
140057,I accidentally bombed a zoom class So my friend usually is muted in zoom classes so I ll usually talk to her while she s in class and not feel weird about it  Anyways today I was trying on a super fuzzy shirt that was really comfortable  so naturally I went into her room and screamed   FEEL MY TITTIES  right as she was answering the teachers question  As soon as she turned around with an angry look on her face laughter erupted from her computer and I screamed and ran away,0,Today I accidentally bombed a zoom class. My friend is muted in zoom classes so I usually talk to her while she's in class. Today I went into her room and screamed FEEL MY TITTIES right as she was answering the teachers question.,today accidentally bomb zoom class friend mute zoom class usually talk class today go room scream feel titty right answer teacher question
140058,Grad school makes me want to kill myself  but I don t have another optionHonestly I ve got a laundry list of shit going on   Bipolar I  PTSD  history of abuse  domestic violence  and rape  realizing my parents see me as their therapist and not their child  partner lashing out due to grief   and the icing on the cake is i am stuck in a graduate program for a degree I already have in a department that enables homophobia and is not equipped to help me  I know so much of this is my own fault and I can t ask a university to fix me  but I m at the point where I feel like the only way out is to die  I feel like I ve hurt enough for a lifetime  so why not It s not like I can even leave  Leaving means no income and no insurance thousands of miles away from home  and if I can t afford my asthma and bipolar meds I ll just end up dead anyway  I can t take about this with anyone right now because I can t use people as my emotional tampons  so I guess I just wanted to say it somewhere I relapsed with self harming recently and stopped again  but I don t know why my piece of shit self even deserves to stay on the wagon or stick around  The universe doesn t seem to want me  and I just want to go,1,"Grad school makes her want to kill herself. She has a history of abuse, domestic violence and rape. She relapsed with self harming recently. She is stuck in a graduate program for a degree in a department that enables homophobia and is not equipped to help her.",grad school make want kill history abuse domestic violence rape relapse self harm recently stick graduate program degree department enable homophobia not equip help
140059,TO AAAARRRMSS UNDER ONE BANNER,0,TO AAAARRRMSS UNDER ONE BANNER,carr mss banner
140060,Entry  I don t want to kill myself  I m dreaming  I don t know how to wake up  Please  someone out there  Help me  Wake me up  I just want to wake up  I ve tried thinking as hard as I can  This brain is of immense power  I tried jolting myself awake through abrupt movement  I ve tried blinking myself up  Please  wake me up  I just want to return to my family  Please  Please  Please,1,"I don't want to kill myself, I just want to return to my family. I don't know how to wake up. I tried jolting myself awake through abrupt movement and blinking myself up, but it didn't help. ",not want kill want return family not know wake try jolt awake abrupt movement blink not help
140061,Too scared to even harm myselfWant to die sometimes but I don t even attempt to harm Myself,1,Too scared to even harm myselfWant to die sometimes but I don t even attempt to harm Myself,scared harm want die don attempt harm
140062,Anyone wanna chat Feeling a bit lonely right now,1,Anyone wanna chat Feeling a bit lonely right now,want chat feel bit lonely right
140063,Can u hold this for me I don t really want it anymore  L,0,Can u hold this for me I don t really want it anymore  L,hold don want anymore
140064,empathy machine brokelong story short  i see those  i don t want to hurt my friends family if i kill myself  and i can barely relate on a good day  i don t care if they d be hurt  i d be dead  what s it matter if they re hurting over someone who s already gone  who can t feel any guilt  and who can t offer any apologies   i dunno  i feel like i should be worried about killing myself when my dad says i m his  favorite   which is kinda a joke  kinda true  or that my sister would lose her support against our shitty mom  i guess they d miss me  and they would be hurt  but like  that only matters if we assume i can feel guilt after death  i don t think i ll be close enough to see any of it  if there s anything after life   idk  it s late and i m probably gonna just post this and go to bed  but i guess it s food for thought,1,"If I kill myself, I don't care if I hurt my friends family as I would be dead. My dad says I'm his favorite. I guess they would miss me and they would be hurt if they miss me. If there is guilt after death, I won't be close enough to see it.",kill not care hurt friend family dead dad say favourite guess miss hurt miss guilt death not close
140065,organization of american states should essentially become what the eu is We should have open borders and free trade among every country in the American continent,0,organization of american states should essentially become what the eu is We should have open borders and free trade among every country in the American continent,organization american states essentially eur open border free trade country american continent
140066,burger king really tweeted women belong in the kitchen  smh,0,burger king really tweeted women belong in the kitchen  smh,burger king tweeter woman belong kitchen sch
