,text,class,summary,cleaned
170184,To that duck who s commenting quack on every post You re great,0,To that duck who s commenting quack on every post You re great,duck comment quack post great
170185,It s my begging day  You know what that means,0,It s my begging day  You know what that means,beg day know mean
170186,that awkward moment when you re literally about to beat yakuza   but your mom tells you to go outside,0,that awkward moment when you re literally about to beat yakuza   but your mom tells you to go outside,awkward moment literally beat yakima mon tell outside
170187,I was happy for a few months after years of darkness and now I feel like Overdosing is my next stepI don t know how to say this  but I m genuinely sad about this recent exposure to sadness  I had an amazing   months away from sadness but now it seems like it s coming back again I don t know what can fix me,1,I was happy for a few months after years of darkness and now I feel like overdosing is my next step. I had an amazing months away from sadness but now it seems like it's coming back again and I don't know what can fix me. ,happy month year darkness feel like overdose step amazing month away sadness like come not know fix
170188,I really want to find a way to kill myself that will still pay out my life insurance to my wife There are concrete steps at work  part of the fire exit but they go down from the second floor to the basement   I fantasize about throwing myself down them somehow to look like I fell and killing myself in the process  but I know it d never work   I d just hurt myself and have to cover the medical cost and send my family through more turmoil I wish when I had my stroke I had it at work and I knew what was going on  I would have hidden in the bathroom  telling my coworkers I was just feeling sick before I snuck off   Dying at work would have paid out well,1,There are concrete steps at work part of the fire exit but they go down from the second floor to the basement. I fantasize about throwing myself down them to look like I fell and killing myself in the process. I wish when I had a stroke I had it at work.,concrete step work fire exit second floor basement fantasize throw look like fall kill process wish stroke work
170189,There are people posting wooden Legos then there s me Wiling away time  Anyone agree,0,There are people posting wooden Legos then there s me Wiling away time  Anyone agree,people post wooden leg wile away time agree
170190,I m not gonna tell anybody I m gonna kill myself this time  no note no calling anybody etc They just send the fucking police who are literally the worst people to handle these situations  Physically force you into an ambulance that costs a fortune and treat you like a criminal  handcuff you and hurt you if they need to because all police know is violence and aggression Send you to a prison at the hospital where nobody gives a shit about you and you re just a money pot for them  keep you there as long as they can to get the most money out of you  I ve never seen any  professional  at any psych unit who gave a damn about anybody there So this time I ll just do it  Not gonna tell anybody this time  It ll be a surprise to people but it shouldn t be I think this is the thing you realize after almost killing yourself so many times,1,This time I'm not going to tell anybody that I'm going to kill myself. I've almost killed myself many times before. The police are the worst people to handle these situations. They force you into an ambulance that costs a fortune and treat you like a criminal. They handcuff you and hurt you if they need to. They send you to a prison at the hospital where nobody gives a shit about you.,time not go tell anybody go kill kill time police bad people handle situation force ambulance cost fortune treat like criminal handcuff hurt need send prison hospital give shit
170191,My opinion  ok so I have an opinion on dating right  Like here it is  Just because the legal age of consent is   doesn t mean I cant date right  Im  Not  trying to lower the age of consent but I can still date people even if I am under the min req  Share your opinion on this post,0,My opinion  ok so I have an opinion on dating right  Like here it is  Just because the legal age of consent is   doesn t mean I cant date right  Im  Not  trying to lower the age of consent but I can still date people even if I am under the min req  Share your opinion on this post,opinion opinion date right like legal age consent mean not date right not try lower age consent date people min req share opinion post
170192,Im legit not ok mentally at all  I suffer from depression and idek what else and it effects me every minute of the day  I dont wanna do this anymore,0,Im legit not ok mentally at all  I suffer from depression and idek what else and it effects me every minute of the day  I dont wanna do this anymore,legit not mentally suffer depression idea effect minute day not want anymore
170193,megathiccc was perma banned F,0,megathiccc was perma banned F,mega thick ban
170194,What should I buy save up for  I have   black Friday is in   days  by that time I wouldve saved up another   I was planning on saving for a pc  but I realised after awhile that it s pretty expensive and it s not gonna happen Should I just save up and wait for something to come up that I like so I can get it  Or should I just spend it on stuff I like on black Friday,0,"Black Friday is in days. I was planning on saving for a pc, but it's too expensive. I should wait for something to come up that I like and buy it on Black Friday instead.   I don't know if I should save up or buy something.",black friday day plan save pc expensive wait come like buy black friday instead not know save buy
170195,A little bit of help would be appreciatedI imagine killing myself  writing my last words  I want to die I got into a fight with my parents  especially my mom  because I m so confused over my identity  I FUCKING DON T KNOW WHO I AM  AM I A GIRL  AM I A BOY  I DON T KNOW JUST LEAVE ME ALONE LET ME FIGURE IT OUT STOP TRYING TO FORCE ME INTO DOING SOMETHING I M NOT COMFORTABLE WITH  IT MAKES ME WANNA KILL MYSELF EVEN MORE I m so confused  All I ask from her is to stop bringing it up  I ll be going to uni and she just makes it so worse than it will be  I don t think I ll get beaten up by strangers just because I like to dress in a certain way  and if people make fun of me  fuck them  I m used to it I know I shouldn t be thinking about suicide  but it makes me feel so much worse when all I hear is be like this  don t be like that because you re a disgrace to our family  What would x think  FUCK X FUCK U FUCK ME FUCK IT,1,"I want to kill myself. I got into a fight with my parents. I don't know who I am. I want to go to uni. I like to dress in a certain way and if people make fun of me for it, I'll get beaten up. ",want kill get fight parent not know want uni like dress certain way people fun beat
170196,The only person who was ever kind to me  is me It wasn t always that way  I had a huge problem with self loathing for a looooong time  up until about   or   years ago  As is typical with people suffering suicidal ideation  In the past   or   years however I ve grown to really like myself  I became very involved in politics and found my footing on the compass  I found solidarity with the oppressed all around the world and cherished it  It even gave me a lot of hope for a brighter future However  with each passing day on this shit hole planet  my skin peels  I fucking hate everyone around me  All they do is make noise and fucking hurt me   The kindness I ve shown myself in the past few years is simply leagues better than the way I m treated by others  I just want to be alone with myself for the rest of eternity in the ground somewhere I want everyone else to fuck off forever  just leave me fucking be  I like myself and I m the only person I want in my life   The thought that everything could be over as soon as I will it to be so is so fucking attractive  The idea that all of existence as it is perceived by myself can me upended in one motion from my ring finger Its intoxicating  I could have everything I want out of existence  To rest alone for all eternity with the one being who ever dared see me as human  myself Inb  pLs dOnT dO iT Fuck off  like you even care  Farm virtue points off of someone else  The only reason I m posting here is because it s the closest thing to an actual suicide forum on reddit,1,The only person who was ever kind to me is me. I want to be alone with myself for the rest of eternity in the ground somewhere. I'm posting here because it's the closest thing to an actual suicide forum on reddit. ,person kind want rest eternity ground post close thing actual suicide forum geddit
170197,Want to watch me suffer with spicy wings during a charity stream  I m going to do a   hour live stream on the YouTube channel radgamerdads and I ll eat really hot wings so feel free to watch me suffer this weekend we also take donations for extra life and I will be the only one who isn t a dad and we were looking for more engagement during the stream,0,This weekend RadGamerdads is going to do a live stream on the YouTube channel RadGamerDads. He's going to eat spicy wings and take donations for extra life during the live stream. He will be the only person who isn't a dad during the stream.,weekend adam road go live stream youtube channel adam road go eat spicy wing donation extra life live stream person not dad stream
170198,Unpopular opinion  people Oreos are overrated  Change my friggin mind,0,Unpopular opinion  people Oreos are overrated  Change my friggin mind,unpopular opinion people ore overrate change frigging mind
170199,years let s gooo My life sucks thanks for being there reddit,0,years let s gooo My life sucks thanks for being there reddit,year let goo life suck thank geddit
170200,I m not sure what this post is about butI m a teen  and lord am I having a hard time with finding a will to live  I don t have really any close friends  maybe a couple  but I m not their first choice  It sucks being the last choice in your friend group  which is why I don t talk to anyone outside of school anymore  I don t have any motivation to do anything academic wise  it s not that I m dumb  I m kinda smart  just nothing interests me and everything s done last minute  I m ugly as hell  and I hate the fact that people have to look at me  I don t know what I have to live for  and I feel selfish for saying that  I don t have any mental or physical illness  and nothing traumatic has happened to me  I just don t want to live  I m not gonna do anything anytime soon  at least I think  because I don t want to be that one girl who killed herself in school  I don t want any bullshit memorials or any pictures of me hung up  My parents are proud of me for the first time in my life  because I m quiet and lock myself in my room  I don t want to end it while I m still living with them  Also a new season of one my favorite shows is coming out this year  and as stupid as it sounds  I have that to hold on to  I m trying to get better but once once I graduate  I m not sure how long I m gonna last  I don t even know if I m exaggerating everything or what I m really feeling  which is why I m not talking to anyone  besides this post i guess  As I said  I don t really know why I m posting this  I m think just frustrated and needed to vent somewhere  Anyways  to whoever might be reading this  thank you,1,A teen is frustrated and doesn't know what she has to live for. She doesn't talk to anyone outside of school and she doesn't have any motivation to do anything academic wise. Her parents are proud of her for the first time in her life. A new season of one of her favorite shows is coming out this year.,teen frustrated not know live not talk outside school not motivation academic wise parent proud time life new season favourite show come year
170201,I m doing it tonightPlease pray I die and go where there s peace,1,I m doing it tonightPlease pray I die and go where there s peace,tonight pray die peace
170202,bored in class tell me something I did all my work btw if y all where going to ask,0,bored in class tell me something I did all my work btw if y all where going to ask,bore class tell work way go ask
170203,I HAVE A BOYFRIEND YES HERE ARE SOME SCREENSHOTS HE TOOK  https imgur com a mUbFRRp https imgur com a mUbFRRp,0,I HAVE A BOYFRIEND YES HERE ARE SOME SCREENSHOTS HE TOOK  https imgur com a mUbFRRp https imgur com a mUbFRRp,boyfriend yes screenshot take incur com barry incur com barry
170204,Who s giving out all these fucking awards  Stop giving money to China smh,0,Who s giving out all these fucking awards  Stop giving money to China smh,give fucking award stop give money china sch
170205,I can t get these thoughts out of my headEven when I m not feeling too depressed I still get the thoughts in my head that I want to die and don t want to be here anymore,1,I can t get these thoughts out of my headEven when I m not feeling too depressed I still get the thoughts in my head that I want to die and don t want to be here anymore,thought head not feel depressed thought head want die don want anymore
170206,I feel like I m the only one looking out for me On the year anniversary of my mother s funeral  my husband got put on administrative leave in preparation for most likely being fired  And because of a really  really  REALLY stupid thing he did  He is our main breadwinner and insurance holder  My job doesn t even come close to our mortgage each month  let alone our bills I just went out to a festival event where I had a really bad time  in part due to the bad news  in part due to assholes flaunting the rules and festival staff doing nothing about it  I mentioned this on a Facebook group and ended up getting into it with an acquaintance that is my best friend s tennant  Now I no longer feel safe going over to her house because of that person being there  Well  we re even because she doesn t want to come to my house because she doesn t like my husband  So now we re best friends who refuse to visit the other s house  Great I ve come home to a shitshow  My husband is spiraling in and out of suicidality  I m going from despair to rage and back  I m ready to fucking delete Facebook  but that s the only way my family will bother to contact me anymore  is by liking a post  Or posting on my wall for my birthday  not even calling I feel like I m the only one who is here to look out for me  My husband and I are sitting here watching for the blade to fall with his job  We re both so emotionally fucked right now we can t even talk  We are both suicidal  but there is nothing to be done Oh and I ve relapsed into drinking  because my life isn t fucked enough,1,"On the anniversary of her mother's funeral, her husband got put on administrative leave. He is their main breadwinner and insurance holder. His job doesn't even come close to their mortgage each month let alone their bills. She had a bad time at a festival and got into a fight with her best friend's aunt. Now she doesn't want to come to her house because she dislikes her husband. ",anniversary mother funeral husband got administrative leave main breadwinner insurance holder job not come close mortgage month let bill bad time festival get fight good friend aunt not want come house dislike husband
170207,i have eaten baked ziti and garlic bread my life is slightly better than it was before i did that,0,i have eaten baked ziti and garlic bread my life is slightly better than it was before i did that,eat baked ziti garlic bread life slightly well
170208,Mom told me to dieNo one just cares about me  Toxic parents  Tried to make frd in clg I was doing my best to be good with them but they instead cheated etrayed me for money Only thing I lived for was frds I made online while playing pubgm but they left me cuz squad slots were full  I m bored of living,1,Mom told me to die. Dad cheated me for money. Dad left him because squad slots were full. Dad didn't want to make frds he made online while playing pubgm. Dad doesn't care about him.  ,mon tell die dad cheat money dad leave squad slot dad not want fed online play pub dad not care
170209,Tonight  Hello Reddit here s my  nd post I think up to now I m ready to kms today I have all planned I m planning on drinking meds I think around   capsules  Calm is that enough  Cause  you know  I don t really wanna wake up with a sh t in my mouth I already bought   pieces and today will add another  I plan to buy some food  burgers  Coke  amp  water go  under the bridge   lie there and fade away with sound of river seems cool to me hope there won t be anyone else  Reasons well first of all I m really tired of everything And tired physically and mentally I am not sociable  I m kind of a guy for whom it s better to be alone  I have a job  which I sometimes like but overall I m fed up with everyday same sh t I don t have enough to move or start anew  I have family bad situation  really so it maybe that I m escaping as well but anyway it s my choice ok why judge me it s my life  why I can t choose when to end it did I ask to be born I think this is life hell if I m wrong  I hope to go at a worse place I don t believe in afterlife but who knows I m just weak even now I m so much scared as time passes it s   hours till I m off the job hope nothing prevents my plan but part of me is so freaking scared  D my heart beats damn faster  D  but having like   minutes of smile in a whole week is not worth living for me I hope someday it will be a perfect world  where everyone has a purpose and don t suffer Someday Thanks Reddit amp See you all someday  if there s afterlife,1,"Today I'm going to go for a walk. I'm tired of everything and I'm not sociable. I have a job which I sometimes likes, but overall I'm fed up with it. I don't believe in afterlife. ",today go walk tired not sociable job like overall feed not believe afterlife
170210,I hope there is no afterlifeImagine an afterlife where you exist for eternity  Yeah you wont feel hunger  pain  I bet you ll be at peace  But you ll still exist  For what  And for fucking eternity  That is one scary fucking thought,1,I hope there is no afterlifeImagine an afterlife where you exist for eternity  Yeah you wont feel hunger  pain  I bet you ll be at peace  But you ll still exist  For what  And for fucking eternity  That is one scary fucking thought,hope no afterlife imagine afterlife exist eternity yeah not feel hunger pain bet peace exist fucking eternity scary fucking thought
170211,Who s ready for no fap September and no nut November I m going to try not to fap during those months let s see if I can actually control my urges to touch my self,0,Who s ready for no fap September and no nut November I m going to try not to fap during those months let s see if I can actually control my urges to touch my self,ready no map september no nut november go try not map month let actually control urge touch self
170212,I don t know what to do I ve been just looking up depression crap for the past couple of hours and I think that it is making it worse  My two finals are on Monday and Tuesday  and I know that no matter what I get on either of them I am going to fail  I literally quit my job this semester just to make sure that I pass these two classes  yet I still fucked up and failed  This will be the second time I ve failed a class twice and have had to take it a third time  and I ve retaken to many classes already  I ve been in college for nearly   years now and have not made any progress  Suicide is constantly at the edge of my mind no matter what I m doing  and I know that if I go to my parents for help it will probably make me commit suicide faster  I m thousands of dollars in debt and can t afford to go further into debt I also feel as if I m just making up these suicidal thoughts as an excuse to not get yelled at by family and friends for fucking up this badly,1,There are two finals on Monday and Tuesday and I know that I am going to fail both of them. This will be the second time I have failed a class twice and have had to take it a third time. Suicide is constantly at the edge of my mind no matter what I do. I am thousands of dollars in debt.,final monday tuesday know go fail second time fail class twice time suicide constantly edge mind no matter thousand dollar debt
170213,Survey on Hours spent on hobbies personal time Vs Average semester mark  Hello I am currently taking a data management class  For the final assignment  I chose to collect data on the average GPA and the hours spent doing personal time and hobbies each week It would be great if I could get some responses  the survey is two questions and takes under a minute to complete  If people are interested in the results  I may be able to post some graphs Insights Thank You  https forms gle ajodu MXW rvhHUg https forms gle ajodu MXW rvhHUg,0,For a data management class he wants to collect data on the average GPA and the hours spent doing personal time and hobbies each week. The survey is two questions and takes under a minute to complete. He will post some graphs based on the results.,data management class want collect datum average spa hour spend personal time hobby week survey question take minute complete post graph base result
170214,Can I just have one good reason not to commit suicide Today my father asked me   If you re never going to do anything with your life  why not just kill yourself  Not in an emotional knee jerk or angered sort of way  Very calm  Very matter of fact  This was something he had obviously given much advance thought before saying And it s true  I m   years old and there is no future for me  I still live with my father  and I don t plan on going back to college because there are literally no fields that interest me  I fully expect to work in retail for the reset of my life  On my days off I just get drunk and browse Reddit or play video games  never anything more  I ve never had a relationship and the only friends I have anymore are people I play video games with over Skype and have never and will never meet in real life I ve been medicating for depression for almost five years now and I still haven t found a single drug that does anything positive  I ve gone through a handful of therapists but they ve all been really shitty experiences  I ve never gotten the impression that they were doing anything more than trying to kill an hour of time so that I could leave and they could take my money I look at my life and I just don t see a single glimmer of hope in any of it  If ever there were an epitome of a worthless human being  it would be me  I have almost nothing to show for   years of life  That s so incredibly pathetic  Why continue with this sad excuse of an existence,1,Today his father asked him why he should kill himself. He is depressed and doesn't see any hope in his life. He doesn't want to go back to college and wants to work in retail. He's been medicating for depression for almost five years and hasn't found a drug that does anything positive.,today father ask kill depressed not hope life not want college want work retail medicate depression year not find drug positive
170215,it s gotten worse I feel like I am cornering myself  It gets worse and worse every day  I cannot control my thoughts and actions  I do stuff that I regret immediately  but it keeps happening  I have been crying all day long  Trying to distract myself  But it feels like I am burning from the inside  I can t talk to anyone  I want to lie and listen to silence  I d be so happy to go to a therapist  but I have no money at the moment   I feel like I am rotting  Like there is no tomorrow for me  Nothing,1,It's getting worse every day and I can't control my thoughts and actions. I want to go to a therapist but I don't have any money at the moment. I feel like I am rotting and there is no tomorrow for me. ,get bad day not control thought action want therapist not money moment feel like rot no tomorrow
