,text,class,summary,cleaned
194801,Why is men s mental health not talked about nearly enough  Why is men s mental health not talked about nearly enough I live in Australia and I wouldn t say I have a huge friend group in and outside of school but I still know that   friend of mine has attempted suicide  one cuts and my Dad committed suicide  yrs ago  All male  And I have not heard much at all in terms of awareness of men s mental health at my all boys school apart from the average  ooooh ask your friends if they are ok  like it s bullshit Is it that hard for the school to make time for us to miss one lesson every few weeks to educate us on things like this  Like what to do if your friend is self harming or wants to kill himself  Is it that important that we learn that one skill or can we learn skills that could literally save lives  Iv not always been in a good mental state either and literally no one knows because I just don t know how to talk about these thing I m not claiming to be an expert or how this would even be executed I m just sad that these things aren t taught to us by the institutions that are meant to prepare us for the future  Sorry for bad format I am on mobile,0,Men's mental health is not talked about enough at school in Australia. One of his friends has attempted suicide and his father committed suicide. He has not always been in a good mental state and doesn't know how to talk about these things.,man mental health not talk school australia friend attempt suicide father commit suicide not good mental state not know talk thing
194802,Do you guys ever feel like you just lose either way  Like am i gonna live with the loss just to save other it and just die in side or do i let someone else take the loss for me but i still take the guilt of not taking it Its really like im fucked either way unless i just pretend like nothings happening but sooner or later its all gonna come back to me just to tell its my fault,0,I don't know whether to live with the loss or let someone else take the loss for me. I take the guilt of not taking the loss. I feel like I either way is better than pretending like nothing is happening. ,not know live loss let loss guilt not take loss feel like way well pretend like happen
194803,Dvd player almost died no joke More one of my stories so yesterday my pc stoped  win   yeah i still use it  on that starting windows but before the   dots appeared it stopped turned off the pc appeared two options recovery mode and normal mode nothing worked   day later same thing several hours later  now  i was goingto remove all back cables and found something an usb my usb with games like skullgirls ktne  keep talking  i removed tried to turn on and IT WORKED THE PC WAS TRYING TO BOOT FROM THE F CKING PENDRIVE USB AND I WAS SO ANGRY I ALMOST THREW MY DVD PLAYER ON THE GROUND,0,Yesterday my PC stopped working. Today he found a USB with games on it that fixed the problem. He was angry because the PC was trying to boot from the USB USB. He almost destroyed the DVD player on the ground because of it.,yesterday pc stop work today find game fix problem angry pc try boot destroy player ground
194804,I am going to tell my story of depression and when i considered suicide tonightIf anyone is interested in listening in or wants to just talk about their experience or just share in the mistery of this life at times  im gonna tell my story tonight on stream just for the heck of it  If you want to tune in at   EST then feel free or toss a follow so ur notified  Thanks for your help and support reddit community twitch tv spidermojo https twitch tv spidermojo,1,"Tonight I'm going to tell my story of depression and when I considered suicide on twitch tv spidermojo at 8pm EST.    If you want to tune in, follow me on Twitter.  i.e. ",tonight go tell story depression consider suicide twitch spider mojo pm est want tune follow twitter
194805,What do I doI guess this is it  everything I thought would never have happened has happened  My whole world has come crumbling to the ground  I don t know what much longer this can go on  what s that saying  the straw that breaks the camels back and that  well that straw is inevitable I just wish it wasn t,1,Everything I thought would never have happened has happened. My whole world has come crumbling to the ground. I don't know how much longer this can go on. It's the straw that breaks the camels back. I wish it wasn't.,think happen happen world come crumble ground not know long straw break camel wish not
194806,I need helpOne of my online friends said they re going to commit suicide with a gun  I don t know any information of where they live so I can t call the cops so they can check on them  I ve had attempts in the past so it s helps that I can relate to them better but what should I say to make sure they stay safe and don t hurt themselves in a way that they can t repair,1,One of my online friends said they're going to commit suicide with a gun. I don't know where they live so I can't call the cops to check on them. I've had previous suicide attempts and I can relate to them better. ,online friend say go commit suicide gun not know live not cop check previous suicide attempt relate well
194807,SMP minecraft server I recently started a new smp minecraft server and am looking for more players  The ip is  Comment your username and I ll whitelist you,0,SMP minecraft server I recently started a new smp minecraft server and am looking for more players  The ip is  Comment your username and I ll whitelist you,sep min craft server recently start new sep min craft server look player comment username ill white list
194808,Why not Crippled  Alone  awkward  introverted  gay  obese  ugly and an useless asshole  Those are all the things I think about when I see myself  After being in an accident   years ago my life has been changed forever  I try to look happy on the outside and everyone things I cope with it well  I don t  I can t go out with friends that are like minded individuals or stay overnight because I need medical attention round the clock  So I mostly stay home with my barely Funtional family  I get what feels like blackmailed by them because no one works and my social security is the only income  I feel lost everyday and when home feels like a war zone all the time my only safe space is my room which can be easily taken advantage of because I need the help  All the stress depression and anxiety get bottled up and food is my only coping strategy  This has caused me to become obese and I hate how I look but I lack the motivation to change anything  I feel like the loop will cycle indefinitely and every night it hits me and makes me wonder why I want to live even though I m scared to die  I just want to disappear,1,After being in an accident years ago his life has been changed forever. He can't go out with friends or stay overnight because he needs medical attention round the clock. He stays at home with his barely functional family because no one works and his social security is the only income. He suffers from depression and anxiety and food is his only coping strategy.,accident year ago life change forever not friend stay overnight need medical attention round clock stay home barely functional family no work social security income suffer depression anxiety food cope strategy
194809,Just tired of being like this  I don t want this to be my life anymore Edit Well  not sure what I was expecting to get from this  Apparently  it turned out to be nothing  I guess I ll do some thinking  I really just feel too messed up  Not sure what I am supposed to do  Maybe some people cannot come out of depression and cannot receive help  I don t know,1,I don't want this to be my life anymore. I don't know what to do about it. Maybe some people can't come out of depression and can't receive help. I will do some thinking. I really just feel too messed up.,not want life anymore not know maybe people not come depression not receive help thinking feel mess
194810,Today was my  th birthdayYes  this is a novelty account  Figured I d start one for those times when I can t post under my own name  I turned   today  and for no particular reason  I m tempted to chase several beers with all the pills I have on hand  It seems like such an easy  peaceful way to just not wake up tomorrow  I m not going to do it  I have a family who need me  and most of the time I love my life and am not suicidal  Whaddaya think Reddit  Normal birthday malaise  Midlife crisis  Mental disfunction  Do I just need to get over myself,1,Today was my birthday. I started a novelty account to post under my own name. I'm tempted to drink too much alcohol and take pills. I have a family and I love my life and am not suicidal. I don't need to get over myself.,today birthday start novelty account post tempt drink alcohol pill family love life not suicidal not need
194811,I m lost and going down fast I haven t been on my antidepressants for about   months  Not by choice  just one thing after another  Forgot to make a doctor s appointment   new insurance won t cover the prescription   I ve been stressed from having to move  barely living paycheck to paycheck  and trying to go back to scool  Add to that work  Where my fellow managers can t talk to me about things  Like  I do something that upsets them and instead of telling me  they tell a fellow manager  This has gone on for a month before I was told  And not by the managers that are frustrated with me  This pisses me off because it puts the middleman in a terrible position and they feel they can t tell me  How am I suppose to change my behavior if you don t tell me it is wrong  I m sitting at work  trying not to cry  And I m going down the dark hole,1,"I haven't been on my antidepressants for months. The new insurance won't cover the prescription and I'm stressed at work. My fellow managers can't talk to me about things that upsets them and instead of telling me, they tell a fellow manager.",not antidepressant month new insurance not cover prescription stress work fellow manager not talk thing upset instead tell tell fellow manager
194812,StuckMy family is fucked because of my dad  He gets so mad over nothing today there was a huge fight because he couldn t find his fucking charger than my mom got mad and threatened to kick me out  I m only   years old I don t know what to do I want to commit suicide but I m scared  I just feel exhausted and done I wish I would get hit by a fucking car,1,My family is in trouble because of my dad. He got mad at his daughter today because he couldn't find his charger. His mom threatened to kick him out. I want to commit suicide. I'm only 17 years old. ,family trouble dad get mad daughter today not find charger mon threaten kick want commit suicide year old
194813,Real Suppleroot Hours   Who up Has your week gotten off to a good start,0,Real Suppleroot Hours   Who up Has your week gotten off to a good start,real suppl root hour week get good start
194814,You know your sad when  You know your sad when your discord status is listening to spotify  h elapsed,0,You know your sad when  You know your sad when your discord status is listening to spotify  h elapsed,know sad know sad discord status listen notify elapse
194815,Anyone got muffin recipes  So basically for the next two weeks I m going to be stuck at my house because someone in one of my classes at school tested positive for COVID  Today I got bored and made some easy muffins  but I am dissatisfied with how they turned out and want to expand my muffin horizons a bit  So for anyone sorting by new  do you have a good muffin recipe  Tell me your secrets,0,"Someone in one of my classes at school tested positive for COVID and I'm stuck at home for the next two weeks. I made some easy muffins today, but I'm dissatisfied with how they turned out and want to expand her muffin horizons. Anyone has a good muffin recipe?",class school test positive covid stick home week easy muffin today dissatisfied turn want expand muffin horizon good muffin recipe
194816,I want to ask something to everyone   I have been on Reddit for about a year now  and have read numerous incidents of parents abusing or kicking their children out and many more such incidents  However  me being in India have never seen such incidents hid the news  Is this something that is prevalent in the developed countries or is it some cultural thing   Adding to this  in India  the cases get reversed where parents are left out and abused in their older ages  and these incidents hit the headlines frequently  Is there some difference,0,"There are many incidents of parents abusing or kicking their children out on Reddit. However, in India such incidents are not covered in the news as much as in the developed countries. In India the cases get reversed where parents are left out and abused in their older ages.",incident parent abuse kick child geddit india incident not cover news develop country india case reverse parent leave abuse old age
194817,Work update   People call me boss now sometimes  Since when is this a thing  I ve been called boss probably   times and all by different people so I think I m just outta the loop Also some coworkers let me do laundry so I could see an attractive customer so that was cool,0,Work update   People call me boss now sometimes  Since when is this a thing  I ve been called boss probably   times and all by different people so I think I m just outta the loop Also some coworkers let me do laundry so I could see an attractive customer so that was cool,work update people boss thing call boss probably time different people think outta loop coworker let laundry attractive customer cool
194818,Confused It all went down hill years ago and I often feel depressed  nervous and trapped  I feel like everywhere I go I spread my depression  I have made plans to do some fun stuff in the future but after that I have literally nothing coming  I feel useless and I can t do anything physical anymore because of my intense back pain  I have thought about blowing my brains out into the river but the problem is I have no gun  I don t think I will make it past age   honestly  I am   now and don t say I have an entire life ahead of me because I don t  I have talked to many of my friends about this but they just say I shouldn t do it because I m a good person or whatever the fuck else  they never have a sufficient answer and the only reason I am here is because I don t have a hand gun and a bullet  As I stated above  I have nothing after meeting up with a friend to go around the country a little bit  I would end up living on the street  I have been there before and I wouldn t wish that loneliness upon anyone  I really feel like there is nothing left for me  One of the few people who I know IRL that genuinely cares about me is about to die  so there is that  And aside of that gun option  I could get rope and hang myself on my balcony pretty easily  What is there worth living anymore  We all die in the end  anyways,1,"Confused and depressed, he doesn't want to live past the age of 50. He has no money, he can't do anything physical, he has no gun and he has a lot of problems with his back pain. He would like to meet up with a friend to go around the country, but if he did, he would end up on the street.",confuse depressed not want live past age no money not physical no gun lot problem pain like meet friend country end street
194819,I know the world is better off with me in it  but so many bad things keep happening to me and I m afraid I ll never be allowed to be happy I have had a difficult life  There has never been a time where things were just  okay  when something new and worse wasn t happening  I recently tried to do the right thing  stand up for myself against my abusive husband and hold him accountable  and he has yet again retaliated against me  I thought I was doing the right thing  For years I have thought the things I have been through were teaching me lessons and making into a well rounded person  But this  This is my life  I want to have a successful future  where I can help people and make the world a better place  That s always been what I wanted  What he is doing can damage my future  I can t understand  if there is some lesson the universe wants me to learn  what is it  I just want to be happy  and I feel like I will never be allowed to be happy  He gets away with everything  I still have hope but I believe he can get away with this too Before now  I never contemplated suicidal thoughts no matter how bad things got  but I am so sad all the time with this  and scared  I have actually started thinking about ways to kill myself  A few days ago  I actually felt okay with going to the store and buying some kind of drug cocktail to take  I ve thought of what I would write in goodbye letters  I ve thought of packing up my apartment so my family won t have to do it  or who to ask to watch my cat for a while so he isn t here alone when it happens  I always had hope things would be okay before  I know there is so much I can offer the world and I get that things will be okay eventually  That s what everyone says  But I am tired of having lived my entire life so far waiting for the eventually,1,There has never been a time in her life when things were just okay. Recently she tried to stand up for herself against her abusive husband but he retaliated against her. She is afraid she won't be allowed to be happy in the future. She has considered suicide.,time life thing okay recently try stand abusive husband retaliate afraid not allow happy future consider suicide
194820,I ve been very suicidal and there s no real support from my bf or family I told them how I was feeling a month ago  I was in high distress  I almost slit my wrists until my bf had to send me to emergency  Eights hours of sitting in the emergency  we left with nothing  we we re waiting for a doctor for what seemed like hours   Then we get home  bf hides the knives and I head to my family s house for a couple of days  I tell them I m in high distress and I really wanna kill myself   They took it lightly  I think the only person who checked up on me  checked up on me once   I can t talk to anyone on how seriously it s affecting me  It s all I can think about  All I picture is how easily I can kill myself  Where I can kill myself  And I already prepared notes  I made a checklist  I made sure that whenever I did it  to atleast wait Valentine s day with my bf and to spend a weekend with my little sister   These thing have been checked out  Now it s time to look at the location  Which I am going to check out today   So I don t know  I think I ve gone too deep to ever come out of this,1,"A month ago, she almost slit her wrists and her boyfriend had to send her to the emergency. She went to her family's house for a couple of days because she wanted to kill herself. Now, she's going to check the location where she can kill herself today.",month ago slit wrist boyfriend send emergency go family house couple day want kill go check location kill today
194821,society is  doctors hope you get sick  lawyers hope you get sued  hospitals hope you get injured  but only a thief hopes you are rich,0,society is  doctors hope you get sick  lawyers hope you get sued  hospitals hope you get injured  but only a thief hopes you are rich,society doctor hope sick lawyer hope sue hospital hope injure thief hope rich
194822,bros let me give you a compliment,0,bros let me give you a compliment,bro let compliment
194823,I feel like i have no option but to kill myself or disappear without a trace foreverMy life is an absolute fucking prison  it has ground to a halt  I am a pathetic people pleaser and I m sick of the dysfunction in my family and the stifling mundanity of the shithole town I am in  I should just do myself in but I am afraid to If I wasn t such an empath  I wouldn t feel horrible pangs of guilt about leaving my family and friends in the dust  they know i m depressed but try and gaslight me into thinking everything is fine and that i m just  having a moan   If I didn t care about them so much  due to people pleasing  I would be living a carefree life in some other town where i could reinvent myself or rather actually BE myself People don t like me being me  bottom line  they like the collective idea of who they THINK I am  rather than face reality,1,My life is an absolute prison. I feel like I have no option but to kill myself or disappear without a trace forever. I am depressed because of the dysfunction in my family and the stifling mundanity of the shithole town I live in.,life absolute prison feel like no option kill disappear trace forever depressed dysfunction family stifle mendacity shit hole town live
194824,Dillema  Your family gets killed but you can prevent it if you have sex with your mom  but you can t rape her  What would you do  Would you bring booze or would you say something like  I ve never seen you as a real mom  How would you handle this I m sorry,0,Dillema  Your family gets killed but you can prevent it if you have sex with your mom  but you can t rape her  What would you do  Would you bring booze or would you say something like  I ve never seen you as a real mom  How would you handle this I m sorry,diploma family gets kill prevent sex mon rape bring booze like see real mon handle sorry
194825,Im jacking off rn I am and would appreciate a reccomendation d do you guys have any videos i can watch to jack off to pwease,0,Im jacking off rn I am and would appreciate a reccomendation d do you guys have any videos i can watch to jack off to pwease,jack right appreciate recommendation guy video watch jack
194826,Guys seriously  stop shitposting the same stuff WoaH DiD You kNow SeXIsM iS TO MeN tOo  iMma POst AbOuT hOw AnnNpYinG tHEsE pOSTS ARe bY shiTpoStiNG  This whole subreddit is just  We know men can have sexism  and  Stop being an incel  but seriously  stop karmawhoring  from one teen to another  I ve seen   fucking posts about it today  It doesn t make you smart or funny to do shit like that  people are stupid to like and support shit like that  I m not looking for karma  in fact if you have given me any from this post just undo that  I m just pissed off at the Sheer ammount of karma whoring in the subreddit,0,"There is a lot of karma whoring in the Redditors' discussion about men having sexism and being an incel. It doesn't make you smart or funny to do that, but people are stupid to like and support it. ",lot karma whore redd tor discussion man have sexism intel not smart funny people stupid like support
194827,Anyone wanna chat  We can play number game or just talk if u want just dm me,0,Anyone wanna chat  We can play number game or just talk if u want just dm me,want chat play number game talk want
194828,Bring up a topic for me to rant about I need a good rant about something good  sometimes I just want a podcast,0,Bring up a topic for me to rant about I need a good rant about something good  sometimes I just want a podcast,bring topic rant need good rant good want podcast
194829,I m just so sad Guys  why is every day the same I m a senior in high school and literally everything on the outside of my life looks great  but I hate all of it The only times I m  happy  during the day are when I m joking with my best friend at school or talking with my boyfriend at night  The latter always ends up ruining my already mundane day  Gosh  he doesn t know what he s doing wrong  Talking to him and hearing him misunderstand me reminds me how alone I am  I love him so much  but he s literally killing any semblance of peace I may have had during the day I can t look forward to the future  I think about dying every day to escape all of this  Suicide never leaves my mind some days  Everything is only going to get harder and I m so tired of crying alone in my bed every night  It s always the same  My heart will consistently and slowly build back up during the day  but it always breaks at night  These ups and downs are killing me  I m just waiting for the day I can buy a gun at this point  I have   more long years to get through,1,A senior in high school is frustrated with her life. She is angry with her boyfriend because he always misunderstands her and makes her feel alone. She wants to kill herself to escape all of this. She would like to buy a gun one day.,senior high school frustrate life angry boyfriend misunderstand make feel want kill escape like buy gun day
