,text,class,summary,cleaned
200551,How to stop thinking about death  I can t do it anymore Probably not the best place to ask because if we did know the answer  most of us wouldn t be on this sub  But I can t stop thinking about how death is better than life  Life is cruel and random  Filled with diseases that I m deathly afraid of  For example  Alzeihmer s  I won t even be able to kill myself then  crime  poverty and all that   Plus I m really afraid of losing my loved ones  I ve lost many already  and I don t think I can take it anymore,1,"How to stop thinking about death is not the best question to ask, because most people wouldn't be on this sub if they knew the answer. I'm afraid of Alzeihmer's disease, crime, poverty and losing loved ones.",stop think death not good question ask people not sub know answer afraid alzheimer disease crime poverty lose love one
200552,Happy Easter Everyone  I hope you guys have a great day with chocolate and eggs,0,Happy Easter Everyone  I hope you guys have a great day with chocolate and eggs,happy easter hope guy great day chocolate egg
200553,brass is such a wild nd sexy metal hard to tame  fights back  that s why i like working w it,0,brass is such a wild nd sexy metal hard to tame  fights back  that s why i like working w it,brass wild sexy metal hard tame fight like work
200554,I wanna just sleep the rest of my life awayfor now sleep is the next best thing until I finally enter this permanent state of unawareness in an eternal abyss of nonexistence,1,I wanna just sleep the rest of my life awayfor now sleep is the next best thing until I finally enter this permanent state of unawareness in an eternal abyss of nonexistence,want sleep rest life away sleep good thing finally enter permanent state unawareness eternal abyss nonexistence
200555,December  th   Journal Entry Ive been having so many dark thoughts recently i dont know what to do anymore  I will cry randomly throughout the day hoping that something bad will happen to me so i dont have to feel this way anymore  A freak accident is better then ending it myself because everyone will question why i did what i did this  The burden that would fall upon my family is too much and i can t do that to them  but I also feel terrible telling them everything is  fine  Every day these thoughts manifest in my mind more and more  I dont know how to approach my family about anything because I dont want to inflict mental anguish on them or make them think they did something wrong  Thats simply not the case  as all this has been because of my indecisiveness and lack of purpose in this world I wrote this about   months ago while I was in my worst state mentally ive ever been in  I was addicted to opiates and would sit in my room crying about how worthless I thought I was  debating just ending it some nights   Im now   months clean from opiates and am feeling better then I have been in years  It does get better everyone you just have to persevere through,1,There are dark thoughts in my mind recently. I don't know how to approach my family about anything. I used to be addicted to opiates. I am now clean from opiates and I am feeling better than I have been in years.,dark thought mind recently not know approach family addict opiate clean opiate feel well year
200556,if god wanted me to be a virgin till marriage he shouldn t have made me so goddamn sexy filler filler bo biller banana nana fo filler fe fi fo filler filler,0,if god wanted me to be a virgin till marriage he shouldn t have made me so goddamn sexy filler filler bo biller banana nana fo filler fe fi fo filler filler,god want virgin till marriage goddamn sexy filler filler miller banana anna filler filler filler
200557,I can t be happy no matter whatI mtf have no idea what I need to do to sort my life out  I get quite severely dysphoric  mostly about body hair  genitals and just general structure of the body  that sometimes gets to the point of self harm just to get my mind off it  There are some things I like about my body such as I m tall  have a good metabolism and have have quite nice thick black hair  but everything else about me I hate  I am an ugly shit and will never pass as a girl  no matter how much surgery I have or how many hormones I take  And even if I do begin transitioning  physically or surgery  I ll just loose all my friends and family because they re all extremely anti lgbt I get called a faggot every day just for growing my hair and it s not even that long yet  so I have no idea what to do  I ll never be a woman and I ll never be happy as a man  and even if I could become female I would still be an ugly shit and all my family would reject me  What the fuck should I do with my life  I feel like I m going to kill myself in the future no matter what  I can t be happy as a man and will never be a woman  I feel like the best thing I can do is pretend to be happy as I am for as long as I can just to please my friends and family  Everyone says women on HRT pass and are beautiful  but they clearly aren t  and even if some people are luckily enough to barely pass  I never will  because I have masculine features from my father that will never let me pass as a woman  What s the fucking point in anything anymore honestly,1,I hate my body and I don't know what to do with my life. I hate that I can't be happy no matter what I do. I have masculine features from my father that will never let me pass as a woman. I pretend to be happy as I am to please my friends and family.,hate body not know life hate not happy no matter masculine feature father let pass woman pretend happy friend family
200558,Okay  but here s the thing  have you been Vibin in the Ritz car,0,Okay  but here s the thing  have you been Vibin in the Ritz car,okay thing visit ritz car
200559,i can t do this anymorei m always alone  amp  feel sad everyday  it gets so much it hurts  amp  i cry all the time even in public  My friends all left me bc i m always sad  amp  tired  since i can t sleep  My family is abusive  amp  don t care about me  I have noone  I m too scared to talk to people i never get a word out  amp  panic so i ll never make friends  it ll never get better  I can t remember the last time i was happy  amp  i can t do this anymore  I ve been wanting to end my life for a very long time but now i feel closer than ever  I don t think i ll be here for more than another year at most  I went to counseling before but noone can help me,1,"I want to end my life because I'm lonely and depressed. I don't think I'll be here for more than another year at most. I went to counseling before, but no one can help me.   I can't remember the last time I was happy. ",want end life lonely depressed not think year go counselling no help not remember time happy
200560,I think im losing love in my bf He rarely texts me and hes always bussy,0,I think im losing love in my bf He rarely texts me and hes always bussy,think lose love rarely text s pussy
200561,Why  Is life even worth living anymore My life honestly doesnt have any meaning anymore  I am a student pilot about   hours in towards my   hours needed for an ATP and I literally seem to fail at doing everything but these two tasks in my life  Flying airplane and watching playing hockey  Every night I just want to die for one reason or another  Another friend abandoning me  Failing with another woman  Fucking up something else up  If I went on a solo tomorrow and I wrecked the airplane I could think of less than   people who would actually give a shit and my parents aren t even on that list  Each day is a repeat of the previous  My dad permanantly kicked my out of his house because I bought a hockey jersey he didn t like  T J  Oshie Team USA to be specific  and my mom won t let me see her without a girlfriend fiance or wife  Honestly everything is in the shitter and my life isn t worth living  My only escapes are flying and watching nhl games or playing in beer league matches but that can only do so much  Do I go to a doctor or one of those people who give a shit  Just end it  Pull a germanwings,1,A student pilot is about hours short of the hours needed for an ATP. His parents don't give a shit about him. His dad kicked him out of his house because he bought a hockey jersey. His mom won't let him see her without a girlfriend or wife. His only escapes are flying and watching hockey games.,student pilot hour short hour need parent not shit dad kick house buy hockey jersey mon not let girlfriend wife escape fly watch hockey game
200562,We re getting closer to the end of the school year guys  cmon we can do it,0,We re getting closer to the end of the school year guys  cmon we can do it,get close end school year guy mon
200563,u guys know that corpse guy   the one wit the voice   umm yes im obsessed   maybe i do like men,0,u guys know that corpse guy   the one wit the voice   umm yes im obsessed   maybe i do like men,guy know corpse guy wit voice hmm yes obsess maybe like man
200564,I ve worn my support system thin Family was never something that much soothed me to begin with  but my friends  hobbies  leisure both active and passive  and even my pets have done nothing but wear me down for the past few weeks  I imagine the feeling is becoming mutual at this point I sorta saw this coming in advance  It was a slow descent over the past two years  and I clued in on it half way through  I ve never been  sunny  per se  considering I have a few attempts under my belt already  but I haven t fallen this hard in my life  Since I m short all of the tools I d normally fall back on  I ve degraded to my old  autistic and frenzied childhood self  reclusive  cruel  fit throwing and self mutilating  Turns out the little retard who stimmed by beating his head against objects  who sabotaged himself at every corner  who  starved  himself in disgust at the person he was  would end up being pretty fucked up  And he s alive and well at the helm of my brain Acting like this  as a grown adult is disgusting in shameful  I used to feel that I was better than this  but knowing that I never really got over the obstacle that is myself is just downright  crushing  My childhood nightmare  myself  came true  and I m helpless to stop it  Helpless  abandoned and  secretly  hopeful that will be the one that finally does me in And at the very least  if I never find the courage to put myself down on my own terms  my  year life expectancy will rear its sweet  rotting head soon enough,1,"I've been depressed for the past two years. My friends, family and even my pets have worn me down. I've lost all of the tools I use to cope with the situation. I feel like I've fallen back to my childhood self-destructive behavior.",depress past year friend family pet wear lose tool use cope situation feel like fall childhood self destructive behavior
200565,I am almost not a stick anymore  I weighed myself  amp  I m now  lbs I m finally gaining weight again heck yea bois I did it,0,I am almost not a stick anymore  I weighed myself  amp  I m now  lbs I m finally gaining weight again heck yea bois I did it,not stick anymore weigh amp lbs finally gain weight heck yea boy
200566,My high school single handed my shut down all of my school systems servers for a week       So this started one night  a week ago  The Yearbook team sent out their   surveys for this years yearbook  but made a fatal flaw  The email was sent to everyone  but with replies left on  Being typical high schoolers  they all saw this as the perfect chance to spam the whole school  I remember getting over   emails in the first   minutes alone  Within maybe   hours  the server admin finally tried to fix it   but the damage was already done        By the time they got to it over   emails were already sent  and every time the servers came back up thousands more came through  It was complete and udder madness for a week where we literally got nothing done because we couldn t communicate  They finally just fixed it literally   minutes ago  after nearly   emails were sent   I hope the darn yearbook club learned their lesson TLDR    students in yearboook club sent out a survey while allowing replies  The school systems servers crashed for over a week whilst nearly   emails were sent,0,"The high school yearbook team sent out a survey with replies. The server crashed for over a week because of the spamming. It was fixed minutes ago after nearly 1,000 emails were sent. The yearbook club should have learned their lesson.",high school yearbook team send survey reply server crash week spamming fix minute ago nearly email send yearbook club learn lesson
200567,Is it enough     I have a friend whose his her birthday is like   days from now   and her sister is planning to make a compilation vidoe of all of her friends wishing her a happy birthday so I wanted to participate because she is a special friend of mine but I don t know what to say in my part of the vidoe   should I just wish her a happy birthday or should I add something extra   Is it enough,0,It's a special friend's birthday in a few days. Her sister is planning to make a compilation vidoe of all her friends wishing her a happy birthday. I want to participate but I don't know what to say in my part.,special friend birthday day sister plan compilation video friend wish happy birthday want participate not know
200568,Hey Cristina u hsgaggaf wants to talk with you  I m just helping to spread the word,0,Hey Cristina u hsgaggaf wants to talk with you  I m just helping to spread the word,hey cristina gag want talk help spread word
200569,HelloI m pretty sure I m going through with it this time  Original goal was to wait until the abuser was convicted but he only got   months the first time and society is on his side so I m to the part where I m thinking of painless ways to do it  Also therapy sucks and I don t want to go into details  Everyone has an adverse reaction when I bring it up so its like I can t talk about it and I don t think its worth trying to  be strong  because I m not and at this point I feel as though everybody else is selfish for not letting me kill myself  Time doesn t heal all wounds  it just haunts you  I don t want to be convinced otherwise at this point I just want a swift and discrete  no guns  way to do it,1,This time she's going to kill herself. She doesn't want to wait for the abuser to be convicted. Therapy doesn't help. She feels as though everybody else is selfish for not letting her kill herself and wants a swift and discrete no guns way to do it.,time go kill not want wait abuser convict therapy not help feel everybody selfish not let kill want swift discrete no gun way
200570,I m sorryI m sorry for everything I have done   Please forgive me,1,I m sorryI m sorry for everything I have done   Please forgive me,sorry sorry forgive
200571,Can t cope with thisI live in New Zealand and i m failing College  Which is High School for us  Grades are terrible i don t learn anything even if i give my   my Mother is disappointed in me she hoped id be the smart one  My Older brother has made nothing of himself  all i can do is play games to pass my time  when i m not in game i just feel so overwhelmingly disappointed and disgusted in myself  where i start crying  The one time i told my Mother about this she thought that it was attention seeking and depression is nothing  i have tried multiple times to kill myself by hanging myself but i m too tall for the rope to snap my worthless neck  In New Zealand if you don t pass the piss easy NCEA  Our qualifications  you ll basically be flipping burgers for your whole life because your a fucking idiot to society  I confronted my best friend he said  Suicide is selfish  and i ll get over it  It s like no one cares sure they will probably be a tiny bit sad for a week but then it will be like i never existed  What s the point of living when i have no future and no one will care,1,In New Zealand if you don't pass the piss easy NCEA you'll be flipping burgers for your whole life. My grades are terrible and I can't cope with it. I have tried to kill myself multiple times but I'm too tall for the rope.,new zealand not pass piss easy new flip burger life grade terrible not cope try kill multiple time tall rope
200572,Please man I want this to end  Its too long and hurts too much please help me m Please I ve gotten help from therapists by the thing has ended  I can t live like this with so much stress  I feel like I ve been doomed from the start ahh idk what to do,1,Please man I want this to end  Its too long and hurts too much please help me m Please I ve gotten help from therapists by the thing has ended  I can t live like this with so much stress  I feel like I ve been doomed from the start ahh idk what to do,man want end long hurt help mem get help therapist thing end live like stress feel like doom start ash not know
200573,im ready to dieeverything is my fault  i ruined my sister s birthday  my mom isnt talking to me bc i didnt have the guts to tell her i was suicidal  i m too scared to talk to my dad because im afraid itll be awkward  im fucking pathetic  i feel so alone  maybe its better that they hate me  so they wont care when im dead   school s starting soon  i have a feeling i wont make it  i somehow feel calm  knowing that i wont have to live in this hell anymore  everybody will be better off without me  m a burden to my family  i have no talent  ambition  hobbies  or hope for the future  whats the point of living  why do i need to try so hard everday just to barely get by  why should i work my ass of at school if i m going to end up with a shitty   job that ll barely pay my rent   life is so pointless  i m done trying to get better  evrytime things are looking up i fall into a deeper hole  i feel like everything i do is just an attempt to make others proud  i m not living for myself  i d much rather not be here in the first place  im ready to die  and i couldnt feel more at peace,1,"Everything is my fault. I ruined my sister's birthday. My mom is not talking to me because I didn't tell her I was suicidal. I have no talent, ambition, hobbies or hope for the future. School starts soon and I have a feeling I won't make it. ",fault ruin sister birthday mon not talk not tell suicidal no talent ambition hobby hope future school start soon feeling not
200574,I can t take the pain anymore I m sick of this  Life is a joke  I m planning on killing myself soon  Don t know when because I am afraid to die But I can t take all of the stress and pain anymore  I always dreamed of myself dying in my sleep and flying into outer space exploring other planets and all of my pain that I m going through will be lifted of my head  And if I do die Hopefully that will happen  I just want to be happy  And if I already killed myself and you are seeing this these are my last words  Goodbye  Hopefully I will be happy  Hopefully I will get my dream that I always wanted  Hopefully I can create my own world and have people love me  And the person that I have been known on the internet for  Power Wind  will be the end  This will most likely be my last post then I will disappear  Like no one ever cared about me  Sucks that this had to happen so soon   Goodbye,1,This is most likely going to be the last post of Power Wind. He is planning to kill himself soon. He always dreamed of dying in his sleep and flying into outer space exploring other planets. He wants to be happy and create his own world.,likely go post power wind plan kill soon dream die sleep fly outer space explore planet want happy create world
200575,english be like vomit  barf  throw up,0,english be like vomit  barf  throw up,english like vomit barf throw
200576,Posting dad jokes till I get a gf  Day   Fell In love with a girl who know only   vowels   She never knew I existed,0,Posting dad jokes till I get a gf  Day   Fell In love with a girl who know only   vowels   She never knew I existed,post dad joke till day fall love girl know vowel know exist
200577,I don t think there s someone out there that s capable of truly loving meI m   I don t think I m a terrible looking person  but every relationship I try just fails  I try to be a good person and caring and am accepting of faults  but it doesn t seem like there s someone out there that will accept me and my faults  I have PTSD and am a very anxious person  I really try to have a big offering heart  but it just seems like I scare off everyone dating wise with what I have and it s making me feel so worthless and so unimportant  I just want to feel desired,1,"Every relationship I try just fails. I don't think there's anyone out there that's capable of truly loving me. I have PTSD and am a very anxious person. I try to be a good person and caring, but I scare off everyone dating wise with what I have. ",relationship try fail not think capable truly love pt anxious person try good person caring scare date wise
200578,Twitch subreddit   bad I tried making a post on their asking for help  but apparently I violated their rules by stating my reddit username and not looking at their own tutorials  I not hating twitch  its must be so so  idk  please do not hate me  this is my own opinion and I m just saying this  because it is so dumb,0,"I tried to make a post on the Twitch subreddit asking for help, but I violated their rules by stating my reddit username and not looking at their own tutorials. I don't hate Twitch, I'm just saying this because it is so dumb.",try post twitch sub edit ask help violate rule state geddit username not look tutorial not hate twitch say dumb
200579,I was playing scribble with my crush today on a video call and she drew a heart even tho the word was not a heart  After that  i had the word muscle and i also drew a heart since the heart is a muscle  Should have i just told her that i like her or is ok what i did,0,I was playing scribble with my crush today on a video call and she drew a heart even tho the word was not a heart  After that  i had the word muscle and i also drew a heart since the heart is a muscle  Should have i just told her that i like her or is ok what i did,play scribble crush today video draw heart word not heart word muscle draw heart heart muscle tell like
200580,Wait can t you just cough on the first day of school and they ll send you back home  If everyone acts sick they ll close it again,0,Wait can t you just cough on the first day of school and they ll send you back home  If everyone acts sick they ll close it again,wait cough day school send home act sick close
200581,What are your parents  views on grades  Having asian parents  if I get an A  I get a lecture and normally scolding  Are other people s parents more lenient  I m just curious about other people,0,What are your parents  views on grades  Having asian parents  if I get an A  I get a lecture and normally scolding  Are other people s parents more lenient  I m just curious about other people,parent view grade have asian parent lecture normally scold people parent lenient curious people
200582,Things I find hot in boys  I love it when boys wear their masks over their mouths and noses and adhere to CDC approved social distancing guidelines   amp x B wear your mask  kids,0,Things I find hot in boys  I love it when boys wear their masks over their mouths and noses and adhere to CDC approved social distancing guidelines   amp x B wear your mask  kids,thing find hot boy love boy wear mask mouth nose adhere cd approve social distancing guideline amp wear mask kid
200583,Friend is cutting himself  he confided in mI really don t know what to do for my friend  I knew he was depressed and I ve tried to help him with advice about being positive and whatnot  But tonight he told me he had the urge to punish himself  so he decided to cut  I said exactly this to him   Hurting yourself won t solve anything  And you know that  I think you don t value yourself   his name  You think you re a piece of shit  that you re worthless  that you don t deserve what you have  I m crying right now  his name  I care about you a lot  and so do a lot of other people  You ARE worth something  You are loved  even if you don t think you are  You re one of the most genuine people I know  But not everything is fantastic on the other side of the fence  You re battling with yourself  You need to try to realize that you re not the scum of the earth  That you are LOVED  And it might be hard to do that but I ll be damned if I see you fall further down the rabbit hole Maybe this was the wrong thing to say  I don t know  He responded saying that it was a mistake for him to confide in me and to never tell anyone about it and to never bring it up to him ever again  He says he doesn t have actual suicidal thoughts  and even if that s true  those violent thoughts may develop into suicidal ones overtime  Any advice for him and I TL DR  Friend is depressed  has resorted to self harm   what should I do to help him,1,Friend is depressed and has resorted to self harm. He confided in me. I told him to never tell anyone about it and to never bring it up to him again. He responded by saying it was a mistake for him to confide in me and that he doesn't have actual suicidal thoughts.,friend depressed resort self harm confide tell tell bring respond say mistake confide not actual suicidal thought
