,text,class,summary,cleaned
197301,My last post here It has been a honor knowing all of you I will kill myself in a few weeks Nothing will change Everytime I see a hangman s knot  noose  I feel warmth  like it s something that loves me I hope I don t leave any hard feelings here,1,My last post here It has been a honor knowing all of you I will kill myself in a few weeks Nothing will change Everytime I see a hangman s knot  noose  I feel warmth  like it s something that loves me I hope I don t leave any hard feelings here,post honor know kill week change time hangman knot noose feel warmth like love hope don leave hard feeling
197302,Hopeless and helpless Sorry if my English and redaction is not that good I feel helpless  hopeless and abandoned  i just want do feel better but I feel like I have lost the only one person in this world that I trust  the only one who have been there for me every time I needed for three  she said that if I ever felt bad I could just tell her and she will help me  but I think I will just annoy her  this just happened yesterday  she told me she was feeling a little low and probably won t be able to talk to me for a time  and I know that s okay  but I don t have anyone to talk  I just don t want to be selfish but I just need to talk to her  I want to tell her all things I have been doing today because thats help me to get distracted of all the pain I have inside I have been thinking of ending my life today  but I don t want to die and I don t want to be selfish with her and just let her get better but at the same time I feel like I need her and don t know what to do  I have been crying for like half an hour  and I feel so stupid  I m probably overthinking everything and this is not that bad but I can t control my thoughts,1,She told me yesterday that she was feeling low and probably won't be able to talk to me for a time. She has been there for me every time I needed for three years. I want to tell her all the things I have been doing today to distract me from the pain inside. I've been crying for half an hour. ,tell yesterday feel low probably not able talk time time need year want tell thing today distract pain inside cry half hour
197303,I need an advice pleaseSo i am depperesed and i ve allready tryied hanging myself the rope i had snapped  I hope that someone will tell me some way to kill myself  without any pain    i dont want my mother to be scared that i ve died in pain and i would like to die in peace  i allready have some plans like i can go to a roof of my house and jump or take some pills and do it in school bathroom during lessons  So please any advise  I would like to die in peace,1,Deperesed wants to kill himself but doesn't want to cause his mother any pain. He has already tried hanging himself. He would like to go to the roof of his house and jump or take some pills and do it in the school bathroom during lessons.,depressed want kill not want cause mother pain try hang like roof house jump pill school bathroom lesson
197304,I got Corona Not sarcasm   I got it  I feel like absolute crap  Muscle aches  a lot of vision loss  head rush  so many symptoms  Ugh   sucks   but yeah  I feel like throwing up  Fun   Very fun  A lot of fun,0,I got Corona Not sarcasm   I got it  I feel like absolute crap  Muscle aches  a lot of vision loss  head rush  so many symptoms  Ugh   sucks   but yeah  I feel like throwing up  Fun   Very fun  A lot of fun,get corona not sarcasm get feel like absolute crap muscle ache lot vision loss head rush symptom ugh suck yeah feel like throw fun fun lot fun
197305,how do I close offim done with everything  I just don t want to feel anything anymore  there s no point  I ll never have a home for my heart   someone teach me how to be a cold hearted bastard,1,how do I close offim done with everything  I just don t want to feel anything anymore  there s no point  I ll never have a home for my heart   someone teach me how to be a cold hearted bastard,close don want feel anymore no point ill home heart teach cold hearted bastard
197306,I m so much happier now that I ve planned the day I end it allNext week  I m getting all my things in order  but I m finally going to do it  It s crazy that I seem actually more relieved  knowing this is my last week on this shithole  I just keep fucking everything up and I can tell which direction my life is going to and I don t want to end up there  I d rather end it now then end it later when I ve fucked even more things up  I don t want to grow old and reflect on my mistakes  I just need to end it now  I know it ll be hard for others but in the long run I know they ll forget about me and move on  It s honestly a relief I won t cost any more money for my family anymore,1,"Next week I'm getting all my things in order and I'm going to end it all. It's my last week on this shithole. I don't want to grow old and reflect on my mistakes. I know it'll be hard for others, but in the long run they'll forget about me.",week get thing order go end week shit hole not want grow old reflect mistake know hard long run forget
197307,I m killing myself if I fail the entrance exam for the school I m applying toIt s not the only reason for my demise  it would just be the last straw  I have been through the worst year of my life and not even my mother is supporting me through all of this  she doesn t even care about my future  I ve had suicidal thoughts for a few years now  I m   but I ve never got through with it because I always had a little bit of hope that things would actually get better  This school is my last hope to salvage my future  and I could never forgive myself if I fucked up once again I m just tired of being stupid I m tired of making bad decisions I m tired of being a failure,1,If I fail the entrance exam for the school I'm applying to it would be the last straw for me. I've been through the worst year of my life and not even my mother is supporting me. This school is my last hope to salvage my future. I'm tired of being stupid and making bad decisions.,fail entrance exam school apply straw bad year life not mother support school hope salvage future tired stupid make bad decision
197308,i want to kill myselfi feel like I ve lost everything now   the only person that I ve ever loved with all my heart has me blocked on EVERYTHING and has no intentions of talking to me ever again  he was my Only source of happiness and now i feel like i have nothing  I feel like I have no purpose in life without him  Someone please help me,1,The person I loved with all my heart blocked me on everything and has no intentions of talking to me ever again. I feel like I have no purpose in life without him. I want to kill myself. Someone please help me.,person love heart block no intention talk feel like no purpose life want kill help
197309,I masturbated to furry hentai No trowaway because of karma rules Yep  as u read it  I masturbation to furry porn Basically  about   hours ago i got horny and decided to search for some hentai  after opening an image i saw it  the furry hentai that turned me on  I decided to masturbate tomorrow  but i could not hold myself back  and i ended up Nutting to that specific image Thats it,0,I masturbated to furry hentai because I got horny and couldn't resist masturbating to the one image that turned me on. I will masturbate tomorrow to the same image that made me want to masturbate to. ,masturbate furry yentai get horny not resist masturbate image turn masturbate tomorrow image want masturbate
197310,Do you guys ever feel like theres a legitimate  non medical reason for someone to end their life  A circumstance  feeling  emotion or mind set that can be seen as reasonable or understandable Alot of people always say that things get better  or that they always regretted attempting the act if they survived  Medically assisted suicide is commonly accepted now  but do you guys think there are any other reasons that you think  even to the slightest degree  can be justified  Please no bias or BS  i want some honest un filtered opinions  If you genuinely think things can get better  please explain why or tell us your experience  otherwise what do you guys think,1,"Medically assisted suicide is accepted now, but do you have any other non medical reasons for someone to end their life that you think can be justified? If you think things can get better, explain why or tell us your experience otherwise.",medically assist suicide accept non medical reason end life think justify think thing well explain tell experience
197311,How difficult would it be for an average girl reading this to choke out a larger dude with the between her thighs choke move like hollywood always shows  Idk movies make it seem too easy  and also that is the only way women fight dudes in movies  It seems too over the top because any woman would not have that strong legs  opinion,0,It's too easy for a woman to choke out a man with the choke move from between her thighs as Hollywood always shows. Any woman would not have that strong legs as it's not the only way women fight men in movies.,easy woman choke man choke thigh hollywood show woman not strong leg not way woman fight man movie
197312,My account got hacked So my  account got hacked and he DMed many girls  or whom he felt were girls the messages were decent and seemingly friendly but the intention can be bad so please avoid it I changed my pwd so probably It ain t gonna happen  again Apologies to  u m imaimai  u eyebagsaredesigner u ImAmemeOK All the messages were fake and not to be believed,0,"Ameme's account got hacked and he sent inappropriate messages to many girls. He changed his pwd so it won't happen again. He is sorry to ImAmeme, but all the messages were fake and not to be believed.",meme account got hack send inappropriate message girl change pad not happen sorry imam message fake not believe
197313,I think i figured out how to kill myselfI m a total fuckup  no social life  crappy job with even more crappy payment  my family is ignoring me and my landlord is planning to sell the apartment where i live  I m panning to place knives between my chest and the steering wheel and just ram into a wall with my car  I guess it will be painful  but at least i can restart in my new life,1,"My family is ignoring me and my landlord is planning to sell the apartment where I live. I'm going to drive into a wall with my car and kill myself to restart in a new life. I guess it will be painful, but at least I can restart in my new life",family ignore landlord plan sell apartment live go drive wall car kill restart new life guess painful restart new life
197314,Remembered the way my mom sexually abused me my whole childhood  My schoolwork is late and my girlfriend is pissed  I just want to fucking kill myself Sorry for the bluntness in the title  But I was trying to sext and she made one comment and I just  froze  And it all came flooding back I dont even feel really suicidal  I just feel like it s the only way  I just cant deal with the missing schoolwork  Or my girlfriend who s off her meds and gets pissed at every little thing  Or the images of my mom making me stare at her naked I live in a nice house  dad has custody  I m a rich white kid who has it all at her fingertips  But there s always been this anger in my heart  This  i m going to quit  and then you ll all fucking see  anger It would be so satisfying to get drunk and order some razors tonight,1,"Suicide is the only way for him to deal with his missing schoolwork, his girlfriend who's off her meds and his mom sexually abusing him as a child. He lives in a nice house, his dad has custody and he's rich, but he's angry.",suicide way deal miss schoolwork girlfriend bed mon sexually abuse child live nice house dad custody rich angry
197315,I went out to do some errands for   minutes and some kids lit up barrels of gas less than  km from my home Nowhere else on earth istg They were supervised  like that means anything The smoke cloud was fucking huge,0,I went out to do some errands for   minutes and some kids lit up barrels of gas less than  km from my home Nowhere else on earth istg They were supervised  like that means anything The smoke cloud was fucking huge,go errand minute kid light barrel gas pm home earth stg supervise like mean smoke cloud fucking huge
197316,Going to make a third attemptI ve been massively depressed for three months  i have constant panic attacks  and can t sleep more than two hours a night  I can t stop thinking about dying  About inflicting pain on myself  or killing myself  or the ways I should do it that would cause the least problems for the few people who it would actually affect   I ve attempted suicide twice in the past and failed both times  unfortunately  If i d done it right things would ve been so much simpler   I hate everything about myself  I wake up every morning disappointed I didn t die in my sleep  I want to simply disappear from the world as if I never existed  I feel as though I m a constant burden to anyone and everyone I come in contact with  The world would be better off without me,1,Two previous attempts at suicide have failed and now he's going to make a third one. He's been depressed for three months and has constant panic attacks and can't sleep more than two hours a night. He hates everything about himself and would like to disappear from the world.,previous attempt suicide fail go depressed month constant panic attack not sleep hour night hate like disappear world
197317,Feel like my life is too good to justify killing myself  which makes me feel worse about wanting to dieI have a shit ton of problems too of course  like anyone else  but I also have a lot of good things going for me that I appreciate on a head level but not enough on a heart level  It s not like I don t feel happy or grateful sometimes  but at the end of the day  it always comes back to me wanting to die  And it s like  shit  Some people would kill to be in my shoes  I don t think anyone who loves me knows how dark it gets  but despite not having anyone in my life quite get me  I m not even that lonely  I m just sad as fuck  And the pain is mind numbing  like it feels like my brain is literally throbbing in my head  What the fuck is wrong with me  I feel like some other soul deserved to have the life I got so much more  They d appreciate it more  I m tired  I m fucking pathetic  And because I know I m blessed in a lot of ways  it makes me feel even worse and guiltier about wanting to off myself  Who else is in the same boat  What the fuck is wrong with us,1,There are a lot of good things in my life but at the end of the day it always comes back to me wanting to die. I feel like some other soul deserved to have the life I got so much more and would appreciate it more.,lot good thing life end day come want die feel like soul deserve life get appreciate
197318,I feel patheticEven though I m staying with people I like and doing things I d typically like to do  I still feel sad  I feel so pathetic that the only thing keeping me from killing myself is my cat  It makes me feel even worse when thinking about suicide or death because of it  He d be devastated if I left him  I ve been away from home for a few days and we both miss each other a lot  When I m away he always sits at the window waiting for me to come home and it makes me feel terrible thinking about how much he misses me now  He might feel like he had done something wrong and me leaving is punishment  I wish I didn t feel or think as much as I do,1,The only thing that keeps me from killing myself is my cat. I've been away from home for a few days and I miss him a lot. He always sits at the window waiting for me to come home. I wish I didn't feel as much as I do. ,thing keep kill cat away home day miss lot sit window wait come home wish not feel
197319,I don t wanna have sex I just wanna cuddle,0,I don t wanna have sex I just wanna cuddle,don want sex want cuddle
197320,I m back baby Do you even know who I am  do you any idea  any idea at all,0,I m back baby Do you even know who I am  do you any idea  any idea at all,baby know idea idea
197321,My mom listens to Justin Bieber Anyways my moms dead and I m on the run from the police,0,My mom listens to Justin Bieber Anyways my moms dead and I m on the run from the police,mon listen justin bibber anyways mod dead mon run police
197322,I am just going to become a burden  and I don t want thatHi I have a decent job  For now  I don t see myself being able to keep it for long  I can t work anymore  My arms become lead whenever I have to work  I can t move  It used to be from anxiety  but now it is more apathy than anything  I don t care  I can t will my arms to move I had a breakdown a few months ago  I spent some time in hospital  And then I had a month off of work  I though I was ready to come back  I was feeling less stressed But now I feel just as useless as I did before  I don t think it is the anxiety as much anymore  but a complete and total lack of motivation  Nothing motivates me at all My doctor has been trying me on several combinations of medication  but nothing has worked so far  If the last one he put me on doesn t work by next week  he is talking about taking me off of my job I won t be able to get a new job  I screwed up my post grad when I was studying  so I don t have the qualifications to get anything decent  And I don t see myself being in a mental state to do any job properly I am going to become a burden on my parents  And I don t want that  I know that they love me  And that they will support me  But I don t want to do that to them  It would be easier for everybody if I just disappeared,1,"I have a decent job, but I can't keep it for long because I am depressed and apathetic. I had a breakdown a few months ago and I spent some time in hospital. The doctor has been trying me on several combinations of medication but nothing has worked. If the last one doesn't work by next week he is talking about taking me off of my job. I screwed up my post grad so I don't have the qualifications to get anything decent. I am going to become a burden on my parents.",decent job not long depressed apathetic breakdown month ago spend time hospital doctor try combination medication work not work week talk take job screw post grad not qualification decent go burden parent
197323,Posting a song until I get a boyfriend day    Sex With A Ghost   Teddy Hyde https open spotify com track baoZlq nBee tcYbQYxV si jvTXpxuSSey z UrBnGUQ amp utm source copy link I m almost   gay  polyamorous and ok with an online relationship,0,Posting a song until I get a boyfriend day    Sex With A Ghost   Teddy Hyde https open spotify com track baoZlq nBee tcYbQYxV si jvTXpxuSSey z UrBnGUQ amp utm source copy link I m almost   gay  polyamorous and ok with an online relationship,post song boyfriend day sex ghost teddy hyde open notify com track bee try xxv jet pussy amp atm source copy link gay pol amorous online relationship
197324,Why do I get happy at the smallest things like if someone asks me to hang out together just makes me smile because ww they thought about  me  they want to spend time with  me,0,Why do I get happy at the smallest things like if someone asks me to hang out together just makes me smile because ww they thought about  me  they want to spend time with  me,happy small thing like ask hang make smile think want spend time
197325,goodbye everyoneeeee i ll be staying off of reddit for the week now i ve spent too much time on here lately t t have a nice week everyone spend it well,0,goodbye everyoneeeee i ll be staying off of reddit for the week now i ve spent too much time on here lately t t have a nice week everyone spend it well,goodbye ill stay geddit week spend time lately nice week spend
197326,Lunch in the morning So one time in an english class we had some practice for our social exam and one student didn t know the english word for breakfast and in a panic he blurted out  lunch in the morning  The whole class including my teacher broke down in laughter and we still joke about it today  Like lunch in the morning,0,In an English class one of the students didn't know the word for breakfast and in a panic blurted out lunch in the morning. The whole class including the teacher broke down in laughter. The class still jokes about it today.,english class student not know word breakfast panic blurt lunch morning class include teacher break laughter class joke today
197327,ik im probably gonna get bullied for this but does anyone wanna join my roblox group lol   https web roblox com groups Mullet Boys about https web roblox com groups Mullet Boys about,0,ik im probably gonna get bullied for this but does anyone wanna join my roblox group lol   https web roblox com groups Mullet Boys about https web roblox com groups Mullet Boys about,probably go bully want join rob lox group low web rob lox com group mullet boy web rob lox com group mullet boy
197328,Did you even have a childhood if you didn t have a hacked Wii with   games on it  Fr tho,0,Did you even have a childhood if you didn t have a hacked Wii with   games on it  Fr tho,childhood hack wii game
197329,Nothing is fun anymoreI ve just spent the past   days at a huge  incredibly fun amusement park  I screamed and laughed my ass off  and was excited to go on all the big rides and act like a four year old for a little while  It felt amazing to have that little rush of adrenaline spike through my chest as I was tossed from side to side like a rag doll  hung upside down  and spun in circles  I have arrived back today  and it has not been but about six hours and already everything is coming back  I think   ok  I went on all the rides  I had fun  Now what  And I don t know now what  Is this what life is  Just a series of tiny  fun moments that get my hopes up only to be shoved back down again  Because honestly I fucking hate it  I hated going on all those rides because now everything is just worse  Now I m so tired  and and have so much work to do  and I have no one to even help me or talk to  All I fucking want to do is die  I m tired of drowning only to be pulled up for half a breath of air  It would be less painful to just be held under and never feel anything but death  Then I would have no choice but to do something desperate  Honestly  I hope I get worse  I hope I get so bad I can t even lift my phone  So desperate I ll have no choice but to stab myself  or drown myself  I m only alive because I don t have access to things like guns or pills or bridges  So fuck you fun  Fuck you happiness  Just let me be miserable in peace  Just let me die already,1,Nothing is fun anymore. I spent the past days at an amusement park. I went on all the rides and I had fun. Now I'm tired and have a lot of work to do. I don't know what's wrong with me. ,fun anymore spend past day amusement park go ride fun tired lot work not know wrong
197330,Sorry couldn t crosspost but  u ReturnofSimba  might need helpHere is his her post  https www reddit com r islam comments qctdg leaving islam Reading from the comment history    year old with some health issues that are on going for years Hopefully I m not violating any rules,1,Sorry couldn t crosspost but  u ReturnofSimba  might need helpHere is his her post  https www reddit com r islam comments qctdg leaving islam Reading from the comment history    year old with some health issues that are on going for years Hopefully I m not violating any rules,sorry cross post return simba need help post geddit com islam comment actg leave islam reading comment history year old health issue go year hopefully not violate rule
197331,Just broke up with my gf and I regret it I M  just broke up with my gf  of six months a couple days ago and I kind of regret it  When we were dating it was great but there were always these little things that she did  or I guess didn t do that hurt me throughout our relationship  Like I would always be the one to say good morning and I would always tell her I loved her and that I appreciated her so much but she would never tell me those first  I would have to be the one to initiate those things  I just wanted some random affirmation sometimes  ya know  And whenever I would tell her those things and how I was hurting from the lack of effort she would just fall silent and not say anything at all  Anyways she recently got a job at a restaurant where she works with this guy  Now right away he started being weird with her  He would talk about how he s a virgin and how he smokes weed all the time and crap like that  Later on one of my gfs coworkers asked him if he likes my gf and he said he thought she was cute  A couple days later I noticed that they had added each other on Snapchat and have been talking a lot  I told her that I thought it was a little disrespectful that she had added someone who she knows likes her and is talking to him and she got super defensive and started to argue  Because of this argument and all the things I mentioned before I just kinda lost it and broke up with her  She was heartbroken about it  I m just not really sure what to do  I miss her a lot and I feel like I made a huge mistake by just jumping the gun and breaking up with her  Sorry this was so long but I had to get it all out there,0,I just broke up with my girlfriend of six months. She recently got a job at a restaurant where she works with a guy. He talked about being a virgin and smoking weed. She added him to Snapchat and they have been talking a lot. I told her it was disrespectful that she added someone who she knows likes her and is talking to him. They argued and I lost it and I ended the relationship.,break girlfriend month recently get job restaurant work guy talk virgin smoking weed add snap chat talk lot tell disrespectful add know like talk argue lose end relationship
