,text,class,summary,cleaned
165019,This is impossible  I need to talkIt has happened again  someone has posted a photoshopped image of PMs to try to embarrass me and that reddit post has   upvotes and people have been sending me messages about me being a moron and harassing me I don t know what to do  everyone believes the person who posted that is the one in the right and everyone is on his side while ignoring the fact that he has been harassing me for the past month and sending idiotic PMs to me to insult me  people just look at ONE side of the story and start hating me  I didn t think his post would get very far but it did and now I feel very down  he is one of the scummiest people on the internet and would go to any length to try to embarrass me infront of people who only look at one side of the story  it s sad and I don t know what to do  so many people just hate me now I have been considering suicide heavily because of the stupid amount of people that have been hating me and harassing me Also  I am getting irritated by the fact that nobody has responded after   minutes  I know this sounds whiny but I feel horrible right now,1,Someone has posted a photoshopped image of PMs to try to embarrass me on reddit. He has been harassing me for the past month. He is one of the scummiest people on the internet. I have been considering suicide because of the amount of people that hate me.,post photo shop image pm try embarrass geddit harass past month scum good people internet consider suicide people hate
165020,I m making a Quiplash Party public due to my lack of friends The code is  ZFHA  For those unfamiliar  Go to jackbox tv to join,0,I m making a Quiplash Party public due to my lack of friends The code is  ZFHA  For those unfamiliar  Go to jackbox tv to join,make quip lash party public lack friend code unfamiliar jack box join
165021,Need advice about buying katana  katana   I really want a katana and ive been looking around  https www trueswords com Swords Japanese Katana https www trueswords com Swords Japanese Katana  but I dont know if theyre quality  If any katana experts are lurking on this sub any help would be cool,0,Need advice about buying katana  katana   I really want a katana and ive been looking around  https www trueswords com Swords Japanese Katana https www trueswords com Swords Japanese Katana  but I dont know if theyre quality  If any katana experts are lurking on this sub any help would be cool,need advice buy katanga katanga want katanga look true sword com sword japanese katanga true sword com sword japanese katanga not know quality katanga expert lurk sub help cool
165022,How was this username not taken already  Y all uncreative,0,How was this username not taken already  Y all uncreative,username not take uncreative
165023,why r u awake sleep go to sleep or die,0,why r u awake sleep go to sleep or die,awake sleep sleep die
165024,Last post I am makingSo this is the last post I am gonna make so yeah to keep it brief I am ready to finally go  I went through my options and I am going to keep my method private  So I am ready to finally do you guys a favor you no longer have to have the misfortune of meeting a short ugly loser who in the end will do nothing for the world so YAY  So if you have any questions feel free to ask away even if it s your homework assignment all fair game  Ill stop answering them in an hour and then I will delete this app off and continue my next two days I have left,1,"This is the last post I'm making. I'm going to keep my method private. I'll stop answering questions in an hour and then I'll delete the app off and continue for the next two days. If you have any questions, feel free to ask away.",post make go method private stop answer question hour delete app continue day question feel free ask away
165025,THIS IS ONLY FOR BOYS How tf do you remove ass hair  Like  How  How do you know where you re cutting Also the area between the scrotum and the anus,0,THIS IS ONLY FOR BOYS How tf do you remove ass hair  Like  How  How do you know where you re cutting Also the area between the scrotum and the anus,boy remove ass hair like know cut area scrotum anus
165026,I just created a community It s called r notinteresting just in case you wanted to join you can post anything as long as it s not illegal of course,0,I just created a community It s called r notinteresting just in case you wanted to join you can post anything as long as it s not illegal of course,create community call not interesting case want join post long not illegal course
165027,i really just hate my life i feel like i ve been some type of social experiment my whole fucking life  it s unsettling really  like i don t understand and when i talk about it out loud i sound crazy as fuck  no one believes me  no one understands   i wish the people in my life didn t fuck with me  should have left me alone  like why did everyone choose me  what did i do to them   i just don t understand,1,"""I hate my life. I feel like I've been some type of social experiment my whole life. When I talk about it out loud, I sound crazy and no one believes me. I wish the people in my life didn't fuck with me.""",hate life feel like type social experiment life talk loud sound crazy no believe wish people life not fuck
165028,Almost got scammed great Whats the point  People are awful  liers  scammers  abusers  power hungry  egotistical  and i am tired of their bs  My needs and wants don t matter  and people clearly want the weak link gone  I m too broken to be mended  I want to leave this place  I m being tortured for being alone and weird every single day  Even sex cannot fix my sadness  I should go  Soon I hope,1,People are awful liers scammers abusers power hungry egotistical and I am tired of their bs. My needs and wants don't matter and people clearly want the weak link gone. I want to leave this place as I'm being tortured for being alone.,people awful lies scammer abuser power hungry egotistical tired need want not matter people clearly want weak link go want leave place torture
165029,What is your after school routine  Im sure everyone here has something they do to wind down after school  For me its just lying in bed  What about you guys,0,What is your after school routine  Im sure everyone here has something they do to wind down after school  For me its just lying in bed  What about you guys,school routine sure wind school lie bed guy
165030,I guess this is just a  I have no clue what to sayI want this to be a goodbye  I want to just go and slit my wrists again  Go pull the damn trigger  I want to so bad  You did this Jill  Fuck you Jill goddamn   I want to  I will eventually  I need to Edit  Deleted the last name for privacy purposes  I would leave it up  But  Ya know,1,"Jill wants to kill herself. She wants to slit her wrists again. She deleted the last name for privacy reasons, but she will eventually need to edit it again.  She will leave the name of the person who did this to her.",jill want kill want slit wrist delete privacy reason eventually need edit leave person
165031,ByeI have a tote full of my prescription meds  Waiting for everyone to fall asleep  I don t think I even care anymore  No note or anything  They all know anyway,1,ByeI have a tote full of my prescription meds  Waiting for everyone to fall asleep  I don t think I even care anymore  No note or anything  They all know anyway,tote prescription bed wait fall asleep don think care anymore no note know
165032,i made a new banner with my new name opinions filler text filler text filler text filler text filler text,0,i made a new banner with my new name opinions filler text filler text filler text filler text filler text,new banner new opinion filler text filler text filler text filler text filler text
165033,Running away or killing myself Don t really care for going into much detail but I have enough to go to one way and eat cheaply for maybe   days wherever I end up going yet nowhere to stay  But fuck it  it s better than all that s going on now  I could just end it all but why miss out on trying for an adventure  yeah  Or maybe end it all after my short lived adventure  Decisions amirite,1,There is no place to stay and no money to stay. He has enough money to go one way and eat cheaply for a few days. He could end it all after his short-lived adventure or he could try for an adventure again.,no place stay no money stay money way eat cheaply day end short live adventure try adventure
