,text,class,summary,cleaned
94726,thinking about committing suicide  exams in a few days  and not ready for them  if I fail any classes  I wont get a loan anymore and my parents will kill me  if that happens  might as well end my life,1,thinking about committing suicide  exams in a few days  and not ready for them  if I fail any classes  I wont get a loan anymore and my parents will kill me  if that happens  might as well end my life,think commit suicide exam day not ready fail class not loan anymore parent kill happen end life
94727,I don t support people who come out as lgbtq  Like dude  your illegal in   countries  That s a way better way to put it,0,I don t support people who come out as lgbtq  Like dude  your illegal in   countries  That s a way better way to put it,don support people come lgth like dude illegal country way well way
94728,Unpopular opinion  Millie Bobby Brown  and many other teen celebrities  isn t  mature  rather media trained  I mean  she s   But there s like perception around her that she s too mature for her age and she s   yr old trapped in kid s body Remember S  Joe from  You   Okay  watch this  https youtu be w F lFC U Now  She defended this on sm that   he isn t actually creepy  but in love with that girl Why we really gonna pretend like she s  mature  Is this a joke She s rather media trained,0,Millie Bobby Brown and other teen celebrities are perceived to be too immature for their age. She is rather media trained. She defended Joe from You by saying he's not creepy and he's in love with that girl.  ,millie bobby brown teen celebrity perceive immature age medium train defend joe say not creepy love girl
94729,Ok  I got   fucking awards today    Like  Why  I don t deserve them  I m just some dumb   year old  I feel so grateful  but like  Why me  I have this like fluttery feeling in my stomach  and I m on cloud   rn,0,Ok  I got   fucking awards today    Like  Why  I don t deserve them  I m just some dumb   year old  I feel so grateful  but like  Why me  I have this like fluttery feeling in my stomach  and I m on cloud   rn,get fucking award today like don deserve dumb year old feel grateful like like fluttery feeling stomach mon cloud right
94730,today was my first day of middle school i dabbed on the camera with my fortnite background and got written up,0,today was my first day of middle school i dabbed on the camera with my fortnite background and got written up,today day middle school dab camera footnote background got write
94731,It always boils down to thisI have undiagnosed aspergers syndrome along with a variety of mental health issues  The way i see it  i m a broken person  I m unable to fulfil my purposes as a human being due to all these issues and i m back to this big question  if i won t ever enjoy my life  If i won t ever lead a healthy life  and i ve tried for several years  then what purpose do i serve I have been stockpiling different pills  I don t know what i m waiting for  there are only   people i would miss    people that keep me on this Earth for selfish reasons  Why can t i just do it without the hassle  it ll happen  I want love the most in life  i want a particular person i can t have and it s frustrating  amongst other issues   I feel a bit less suicidal after venting  it ll come back though  and i m scared because i have access to a viable method,1,"I have undiagnosed aspergers syndrome and a variety of mental health issues. I have been stockpiling pills for several years. I want love the most in life, but I can't have it. I feel a bit less suicidal after venting. ",undiagnose asperger syndrome variety mental health issue stockpile pill year want love life not feel bit suicidal vent
94732,I m spiraling so hardI just feel So many things,1,I m spiraling so hardI just feel So many things,spiral hard feel thing
