,text,class,summary,cleaned
68950,A guide to understanding sexualities  comparing genders to hot drinks to make it easier to understand  Straight person  I like tea Gay person  I like coffee Bi sexual person  I like coffee and tea  and other drinks  but I like them for different reasons  Pan sexual person  I like coffee and tea  and other drinks  and the difference between them doesn t matter to me Asexual aromantic person  I actually don t like to drink and I don t need to  Demi sexual  I only like coffee tea demisexuals can be gay  bi  pan  or straight  if I have research on this drink and trust that it s not poison If there s any other sexualities people want me to add on I can  if this is really helpful I can try and do something like this for different genders  Lmk if I got something wrong,0,"A guide to understanding sexualities compares genders to hot drinks to make it easier to understand. Straight person likes tea, Gay person likes coffee, Bi sexual person like coffee and tea. Asexual person doesn't like to drink. Demisexuals can be gay bi pan or straight if they have research on this drink.",guide understand sexuality compare gender hot drink easy understand straight person like tea gay person like coffee bisexual person like coffee tea asexual person not like drink de bisexual gay pan straight research drink
68951,Guys don t watch porn It s about sex,0,Guys don t watch porn It s about sex,guy don watch porn sex
68952,I can t keep playing this gameI can t explain everything  It s just too much Im going to hang myself tonight,1,I can t keep playing this gameI can t explain everything  It s just too much Im going to hang myself tonight,play game explain go hang tonight
68953,Just made an account a few seconds ago   First post as well Long story  but I finally turned my life around completely  Everything was going so well for me but of course that never lasts long  Everything took a turn for the worst again  as usual  My depression has sky rocketed ever since  For the first time in my life I have been feeling suicidal  I feel worthless  I feel like I was never meant to succeed  Thoughts have been non stop crossing my mind for the past   days  today being the worst  Just felt like getting this off my chest to  somebody  I guess  I apologize if I m in the wrong section or if I am not posting properly With the guidelines and such Thanks,1,"Just made an account and posted first post. For the first time in his life, he feels suicidal and worthless. He apologizes if he's in the wrong section or if he is not posting properly as per the guidelines and such.",account post post time life feel suicidal worthless apologize wrong section not post properly guideline
68954,What the fuck am I doing Thoughts of suicide have been in my head for ta while  Hell  I ve made plans  preparations  I even wrote a note  I don t really want to live  but apparently don t have the fucking balls to kill myself either  Then there is this friend of mine who is also suicidal and also everything planned out  Only difference between me and him is that he actually has the balls to do it  Why the fuck am I trying to talk him out of it  It s hypocritical of me to do so in the first place  and second of all he goes through shit that makes my problems look trivial as hell  Just what the hell  nothing makes sense anymore,1,"Suicide thoughts have been in my head for a while. I made plans and even wrote a note. I don't want to live, but I also don't have the balls to kill myself. I have a friend who is also suicidal, but he has the guts to do it. I can't talk him out of it.",suicide thought head plan write note not want live not ball kill friend suicidal gut not talk
68955,Abused  Botched  Suicidal Was sexually abused by a family friend from the age   Fought hard to overcome my depression and ptsd  I recovered and became the strongest and happiest I ve ever been  I decided to do a cosmetic procedure for myself and was badly botched  I don t even look like myself and I have a deforming scar in the center of my face  I lost my job and moved home with my parents  For me  this pain is way more difficult to get over than being abused  Now I m wearing the trauma on my face for everybody to see  At least before I could put on a happy face and pretend like everything is okay  I could even have fun  Now I spend all my time in bed crying and thinking about suicide  I m terrified  I feel worthless,1,"Abused and sexually abused as a child, she suffered depression and ptsd. She decided to do a cosmetic procedure for herself and it was badly botched. She lost her job and moved home with her parents. Now she spends all her time in bed thinking about suicide.",abuse sexually abuse child suffer depression pt decide cosmetic procedure badly botch lose job move home parent spend time bed think suicide
68956,This is an among us code Join Europe ULSLCF trust me Good Time,0,This is an among us code Join Europe ULSLCF trust me Good Time,code join europe trust good time
68957,You know what  I might just lose my will to live and read   million comments Every fucking comment on Gangnam style This is completely reasonable,0,You know what  I might just lose my will to live and read   million comments Every fucking comment on Gangnam style This is completely reasonable,know lose live read comment fucking comment gang style completely reasonable
68958,Got my first job I m turning   in a few days and I just got my first job at a pub being a potwash  I start next week,0,Got my first job I m turning   in a few days and I just got my first job at a pub being a potwash  I start next week,get job turning day get job pub potash start week
68959,Am i the only one who feels like wanting to die but is too afraid of self harm I do have a partner that really loves me and cares for me  and so does some great friends  But more often than not  i just wanted to end my life  I just couldn t do self harm because i ve a very low pain tolerance and that i always wondered what if i do that and still get to live  if only i own a gun  i would ve ended my life sooner but then it s too expensive from where i am and that i needed to get licensed  I was thinking of medicine overdose as an alternative but chances are i d still get to live  Apart from that  i didn t want to be a burden to my gf and her family by letting them shoulder the expenses in case i die I m so sorry for posting this  It might not be approved or be removed but i have no one else to talk to about this  Some of you might say that I should discuss this with my gf or with my friends  but like I said  i didn t want to burden them with my own issues as they already have theirs  Besides  some will just ask  why  what s wrong  but then what s next  I feel like no one will understand and people are too busy to even check out on me and the worst things are that others will think i m just being overly dramatic and that this too shall pass I just want the pain to end  I want everything to end  But it s too damn complicated and idk what to do,1,Sometimes I want to end my life but I'm afraid of self harm. I don't want to burden my girlfriend and her family with the expenses in case I die. I'm not sure what to do about it. It might not be approved or removed. ,want end life afraid self harm not want burden girlfriend family expense case die not sure not approve remove
68960,an unforgettable memory I will never forget the time in sixth grade when i overheard some eighth graders talking when one of them said  What would you do if your dick was in your moms pussy an your dads dick was in your ass  Would you slide forward or back  to which another replied  dude i would slide back and forth like this   proceeds to preform thrusting motions this memory still is stuck in my brain to this day,0,"In sixth grade, he overheard some eighth graders talking about what they would do if their fathers' dicks were in their asses or in their pussies. One of them suggested sliding back and forth. The memory is stuck in his brain to this day.",sixth grade overhear eighth grader talk father dick ass pussy suggest slide forth memory stick brain day
68961,I refuse to keep living anymoreSeriously I m done  Nothing can make me change my mind  Family and friends  Fuck em  In a sense I want to die just to hurt them  the only thing I ll miss is their reactions to it  It ll be hilarious if I could see them crying their hearts out because they miss me so much I never cared about anyone but myself so this makes it all the more perfect  I don t plan on living past   All I need is a way to die  Maybe I ll get lucky and get run over by a train or speeding car or get cancer or something  Maybe I might even get murdered The possibilities are endless but they bring about an end  Ironic huh  Wow I am losing my sanity,1,I don't want to live anymore. I want to die and hurt my family and friends. The only thing I will miss is their reactions to it. I never cared about anyone but myself. I don't plan on living past. ,not want live anymore want die hurt family friend thing miss reaction care not plan live past
68962,I wish I was high like all the time  i hate myself and everything about being around I don t want to feel anymore and im too much of a coward to off myself  hopefully I ll just od one of these days,1,I wish I was high like all the time  i hate myself and everything about being around I don t want to feel anymore and im too much of a coward to off myself  hopefully I ll just od one of these days,wish high like time hate don want feel anymore coward hopefully ill day
68963,sktolasnfjsj  snejdhsjsjdjdid ahdneosut,0,sktolasnfjsj  snejdhsjsjdjdid ahdneosut,sktolasnfjsj snejdhsjsjdjdid
68964,I found my old Reddit account and that shit s a year old I made weird JoJo edits and said cringy shit   Also I ain t telling you what it was,0,I found my old Reddit account and that shit s a year old I made weird JoJo edits and said cringy shit   Also I ain t telling you what it was,find old geddit account shit year old weird mojo edit say cringe shit ain tell
68965,I wish I could disappear from the minds of everyone around meThen I could finally be free to just do it,1,I wish I could disappear from the minds of everyone around meThen I could finally be free to just do it,wish disappear mind finally free
68966,Last few hours as teenager Tomorrow is my birthday and i m turning   and i have never posted in this subreddit but today i felt like i had to I don t really have anything to share but i m gonna say that i always loved this subreddit and the people in it  Love you all   What should i do in these last moments as teenager,0,Tomorrow is my birthday. I have never posted in this subreddit but today I felt like I had to. I don't have anything to share but I will say that I always loved this subreddit and the people in it Love you all.,tomorrow birthday post sub edit today feel like not share love sub edit people love
68967,What music are you going to listen to before you  go Personally  I m going to listen to some spacey white noise no vocal music  Kinda like meditation music  so that I ll be even happier when I die  What about you  why are you going to listen to,1,What music are you going to listen to before you  go Personally  I m going to listen to some spacey white noise no vocal music  Kinda like meditation music  so that I ll be even happier when I die  What about you  why are you going to listen to,music go listen personally go listen spacey white noise no vocal music kind like meditation music ill happy die go listen
68968,Top   Dying Programming Languages of   Hey guys if your thinking of learning programming or how to code that s nice and all but please you d wanna stay away from some certain languages which are in a decline in   that is there isn t that much support for these languages in the current year and years to come Check out this video for full details     https www youtube com watch v F E iTUL EE amp t s https www youtube com watch v F E iTUL EE amp t s Hope you find this helpful,0,"Some programming languages are in decline and there isn't much support for them in the current year and years to come. Top Dying Programming Languages of are: F, E and E-T, E-I-T-E.",programming language decline not support current year year come die programming language
68969,Day   od recommending songs I like Inside out by eve   is kind of a chill song  Have a nice day  D,0,Day   od recommending songs I like Inside out by eve   is kind of a chill song  Have a nice day  D,day recommend song like inside eve kind chill song nice day
68970,Send me cat pictures I m feeling worthless right now and I just want to look at some cats,0,Send me cat pictures I m feeling worthless right now and I just want to look at some cats,send cat picture feel worthless right want look cat
68971,Is there a point in living if you don t enjoy itI have nothing I want to do in my life and don t want to live anymore  I don t have any friends to talk to and tried to get help in the past with nothing working  I don t see a point of continuing a life of pain,1,Is there a point in living if you don t enjoy itI have nothing I want to do in my life and don t want to live anymore  I don t have any friends to talk to and tried to get help in the past with nothing working  I don t see a point of continuing a life of pain,point living don enjoy want life don want live anymore don friend talk try help past work don point continue life pain
68972,Again I m sorry I m a little to fucked everybody makes this a competition it s disgusting,1,Again I m sorry I m a little to fucked everybody makes this a competition it s disgusting,sorry little fuck everybody make competition disgusting
68973,I feel like this is part of life and normalI feel like its normal for me wanting to kill myself and going through with it  Wasting your time and everyone s else s is not cool  People be telling you have so much to live for  and its all gonna be okay  asking for relationship advice  I just can relate to it If this is what it takes to end the suffering of other and myself  then so be it,1,I feel like it's normal for me to want to kill myself. I just want to end the suffering of others and myself so be it. People tell you you have so much to live for and it's okay to ask for relationship advice.,feel like normal want kill want end suffering people tell live okay ask relationship advice
68974,Thought anyone had my nude picture  Turns out i was wrongSo I accidentally uploaded a nude picture this summer  I wanted to send it to my ex  but I accidentally posted it  It was up for a couple minutes until a friend told me Time passes  nothing happens Today  I m with a friend  talking about this embarrassing pictures like the ones your friends take when you don t notice and stuff  And she says  your nude should be also very embarrassing  My blood freezes  I ask her about it  Someone screenshot my nude and all his friends have it  And their other friends  And the others I m   I m a fucking child  My life was getting so much better  Now this can make it all go nuts  It can destroy it   I got so anxious my friend got scared as fuck  She put in our class group chat a message like  you guys should delete Almu s nude because it can destroy her life Great  She had good intentions  but now even the people that didn t knew it does If my mother finds out  If this picture is leaked further  I ll do it  I m not scared  I m just sure  This can end fine  This can end in my death  Only two ways,1,"Almu accidentally uploaded a nude picture this summer. Someone screenshot it and all his friends have it. Almu's friend put a message in the class group chat that Almu should delete the picture because it can destroy her life. If his mother finds out, Almu will do something about it.",alma accidentally upload nude picture summer screenshot friend alm friend message class group chat alma delete picture destroy life mother find alma
68975,The cliche executioner image is the sexiest thing to me Big muscley dude with a black hood and loin cloth  fuck lingerie,0,The cliche executioner image is the sexiest thing to me Big muscley dude with a black hood and loin cloth  fuck lingerie,cliche executioner image sexy thing big muscle dude black hood loin cloth fuck lingerie
68976,My little brother on the other side of the country So I called my step dad yesterday  He lives in Philly  I m in Cali  to wish him a happy father s day and check in on my two little brothers    and soon to be   I found out that my   year old brother tried to kill himself about   weeks ago and was hospitalized from it  I didn t ask what he did cause I knew  when talking to my little brother  he was embarrassed about it  I feel so afraid of something happening  I cried in my girlfriend s arms last night about it  I love my brother and don t know what I can do to help him  Please give me advice,1,It's Father's Day and I'm in California. I called my step dad yesterday to wish him a happy father's day and check in on his two little brothers. One of them tried to kill himself weeks ago and was hospitalized.,father day california call step dad yesterday wish happy father day check little brother try kill week ago hospitalize
68977,My girlfriend of   years broke up with me out of the blue yesterday  I ve never had suicide thoughts until now Everything I see makes me think about her  Everything that happens to me makes me want to run and share with her  I desperately miss her  She was my best friend  I have no one else   Never again  is too much time for me  My heart is hurting so much   I never felt so much pain in my entire life,1,Girlfriend of years broke up with him yesterday. He misses her and wants to run and share his life with her. He has never felt so much pain in his entire life. He is considering suicide. He feels he has no time for anyone else. ,girlfriend year break yesterday miss want run share life feel pain entire life consider suicide feel no time
68978,The desire to be cuddlefuckdd rn Almost as big as my self esteem and anxiety issues,0,The desire to be cuddlefuckdd rn Almost as big as my self esteem and anxiety issues,desire cuddle fuck right big self esteem anxiety issue
68979,Hiding suicidal thoughts from loved ones Do you guys hide your suicidal impulses thoughts from your loved ones  friends  and family  How do I stay sane while doing this,1,Hiding suicidal thoughts from loved ones Do you guys hide your suicidal impulses thoughts from your loved ones  friends  and family  How do I stay sane while doing this,hide suicidal thought love one guy hide suicidal impulse thought love one friend family stay sane
68980,coffee is like cum sometimes it s bitter sometimes it s sweet but it s bitter most of the time sounds like life now that i think about it,0,coffee is like cum sometimes it s bitter sometimes it s sweet but it s bitter most of the time sounds like life now that i think about it,coffee like cum bitter sweet bitter time sound like life think
68981,if everything i ve ever posted and deleted here got publicized i don t think colleges would let me in tbh i post every single thought or rant i ever had it s just sad,0,if everything i ve ever posted and deleted here got publicized i don t think colleges would let me in tbh i post every single thought or rant i ever had it s just sad,post delete got publicize don think college let honest post single thought rant sad
68982,Do you have anything to say to someone who has suicidal thoughts about being circumcisedI know there are other pleasures in life to live for  such as food  looking at cute faces  the potential pleasure of social interactoin  curiosity pleasure of learning science  seeing what the  s will be like  etc  So im not gonna do it  but i still have mental pain every time i look at altered from nature penis  like holy shit this is my only reality and i m frickin stuck and there s no escape But i am so frickin fixated on the fact that circumcision robbed me of sexual pleasure  one of the best things about being a human  Nature gave us the gift of being able to experience pleasure bliss as a motivator to achieve biological goals  instead of us just being robots who automatically have sex without any feeling  and I cant experience that to the fullest  it would ve been so easy for my parents to just tell the doctor not to do it  My only existence has been altered from nature  natural human body is beautiful and it just had to be altered  i cannot believe this happened to me  Humans are supposed to derive happiness confidence from pride of their genitals  optimism due to ability to engage in pleasurable nature act  I am doing foreskin restoratoin  which provides psychological relief but it still takes many years to complete   Jews invented circumcision as a covenant to sacrifice sexual pleasure to show devotion to god or something like that,1,There are other pleasures in life to live for than being circumcised. Circumcision robbed him of sexual pleasure. Jews invented circumcision as a covenant to sacrifice sexual pleasure to show devotion to god. He is doing foreskin restoratoin which provides psychological relief.,pleasure life live circumcise circumcision rob sexual pleasure jews invent circumcision covenant sacrifice sexual pleasure devotion god foreskin restoration provide psychological relief
68983,I decided I will never commit straight sex The chance to get pregnant per year is like   right  Wel  I unboxed an item in a game with a   chance so I decided since this can happen  everything can happen  Now the gay shit  that s where it,0,I decided I will never commit straight sex The chance to get pregnant per year is like   right  Wel  I unboxed an item in a game with a   chance so I decided since this can happen  everything can happen  Now the gay shit  that s where it,decide commit straight sex chance pregnant year like right unbowe item game chance decide happen happen gay shit
68984,I m in love with my best friend and this is eating from the inside me day by dayFuck it  i can t take it anymore  i feel like i will end this for good since i don t have any clue about what to do So this friend  my best friend i ve got is one of the most wonderful person in the world  the kindest  the most helpful and non judgmental person i ever knew that was there for me even in my worst times  my darkest moments  HE WAS there for me  he did everything is his powers to help and i was there for him  we know every secret  everything there is to know and we are completely comfortable with one another but my love for him is killing me slowly and got worse this year  he is in relationship with someone great and i will never wish them anything bad and i know that i have no chances at anything and now i finally accepted the truth and it s terrible I can t detach from this  i really can t  i tried to view him in a bad light  i tried to distance  i tried to talk less but i always get back to him  the time spent with his is the best thing in my life and no other person could come close to this type of relationship closeness and i tried to find someone but i couldn t I m really scared that if i would tell him  our relationship will sour and i will lose my bestfriend  no other friend can come close to this type of connection  i feel i will be completely alone and that will destroy me too and here i am crying my thoughts on this sub,1,"I'm in love with my best friend. He's in a relationship with someone else. I don't know what to do. I tried to distance myself from him, but he's always there for me. I can't find someone who can come close to this closeness.",love good friend relationship not know try distance not find come close closeness
68985,I can t decide what s more important Sleep Or  Wasting time on reddit,0,I can t decide what s more important Sleep Or  Wasting time on reddit,decide important sleep waste time geddit
68986,I want to die I m tired  just want to rest forever,1,I want to die I m tired  just want to rest forever,want die tired want rest forever
68987,I have lost all my will to live I seem to have no purpose anymore  I don t think I m someone who s compatible with being a live  I wish I had never even existed in the first place,0,I have lost all my will to live I seem to have no purpose anymore  I don t think I m someone who s compatible with being a live  I wish I had never even existed in the first place,lose live no purpose anymore don think compatible live wish exist place
68988,you guys are annoying lmfao i wanna stalk your profile to see what you look like but i gotta go through your shitty memes for NOTHING,0,you guys are annoying lmfao i wanna stalk your profile to see what you look like but i gotta go through your shitty memes for NOTHING,guy annoying lao want stalk profile look like get shitty meme
68989,It s sadI  don t have anything to be sad about  I m a straight A s student  I have a wonderful mom  dad  and little sister  Yet each night is a battle  I want to end it  I want someone to tell me not to do it yet at the same time I don t want them to tell me that  It s not all the times that it s a battle at night  just most of the time  and tonight is so far the worst  it s a wonder if I ll make it through to see the morning,1,"It's a battle at night time for a straight A student. He has a wonderful family, a wonderful mom, dad and little sister. He wants someone to tell him not to do it, but he doesn't want them to say that.",battle night time straight student wonderful family wonderful mon dad little sister want tell not not want
