,text,class,summary,cleaned
94683,Whats your favorite way to unwind  I enjoy watching a show or working on my DnD campaign I swear if there is a  Post above me  post below me,0,Whats your favorite way to unwind  I enjoy watching a show or working on my DnD campaign I swear if there is a  Post above me  post below me,favourite way unwind enjoy watch work campaign swear post post
94684,Diagnosed This week I got officially diagnosed from a psychiatrist and prescribed me antidepressants    I m so happy to know that I m not faking it for attention or anything  and glad I ll be getting the help I need   It s been so long since I ve been happy I m eager to see the results    I may be having some side effects  I m really dizzy and my balance is off but hopefully this will work,1,"This week, a psychiatrist diagnosed her with depression and prescribed her antidepressants. She's been depressed for a long time and she's eager to see the results. She may have some side effects, like dizziness and balance problems, but she hopes it will work.",week psychiatrist diagnose depression prescribe antidepressant depressed long time eager result effect like dizziness balance problem hope work
94685,What are some subreddits that have memes that are actually good  r memes and r dankmemes are unoriginal and kinda stale  Most of the posts there are just  haha TikTok and fortnite bad r okbuddyretard is good  but is there anything else Edit  for got to mention but r ExpandDong is good too,0,What are some subreddits that have memes that are actually good  r memes and r dankmemes are unoriginal and kinda stale  Most of the posts there are just  haha TikTok and fortnite bad r okbuddyretard is good  but is there anything else Edit  for got to mention but r ExpandDong is good too,sub edit meme actually good meme dan meme unoriginal kind stale post hama tito footnote bad buddy retard good edit get mention expand dong good
94686,IF YOU KNOW PHYSICS PLEASE DM ME I HAVE A PHYSICS TEST TODAY PLEASE DM ME IF YOU KNOW PHYSICS,0,IF YOU KNOW PHYSICS PLEASE DM ME I HAVE A PHYSICS TEST TODAY PLEASE DM ME IF YOU KNOW PHYSICS,know physics physics test today know physics
94687,I fucking knew it was to good to be true So a two weeks ago I got asked out by a girl it s was amazing I liked her and I thought she liked me but of course that wasn t the fucking case it was a bet this is why I say fuck  d and stick to  d I won t open my fucking heart to anyone else,0,I fucking knew it was to good to be true So a two weeks ago I got asked out by a girl it s was amazing I liked her and I thought she liked me but of course that wasn t the fucking case it was a bet this is why I say fuck  d and stick to  d I won t open my fucking heart to anyone else,fucking know good true week ago got ask girl amazing like think like course want fucking case bet fuck stick will not open fucking heart
94688,Bruh how much does weed cost  I work at a carwash and average   a car when I dry them  but my partner was given  g of weed  or something like that  I think it was equivalent to a blunt  I just think that I got the shaft of that deal  I don t smoke and I m just wondering how much money s worth of weed he got,0,I work at a carwash and average a car when I dry them. My partner was given a g of weed. I don't smoke and I'm wondering how much money he got from that deal. I think it was equivalent to a blunt. ,work carwash average car dry partner give weed not smoke wonder money get deal think equivalent blunt
94689,I need to change i never used to think of suicide as even an option and i wish i could go back to rhat mindset  i hate these late nights crying because i feel so worthless  feeling anxious all the time  i just need a reason to stay here  I guess id like to know  if anyone of you have reasons for not commiting suicide  and what keeps you motivated,1,"Suicide is not an option for her anymore. She needs a reason to stay at home. She would like to know what keeps others from committing suicide, and what keeps them motivated.   For more information, visit suicidepreventionlifeline.org.",suicide not option anymore need reason stay home like know keep commit suicide keep motivate information visit suicidepreventionlifeline org
94690,I think my mom would be better off without me She s remarried to a great man  If I was gone  she could get rid of all the baggage of her old marriage  She could have another baby and have a proper family  She d never have to think of her ex again  She d be sad for a while but she d get over it  Parents say losing a kid is terrible but they always get over it or even make new ones I really want to be a mother though so that makes me want to stay  I think I d be really good at it  It will hopefully happen in a few years so I don t have to wait long to be happy On the other hand  I don t want the people that dislike me to get the satisfaction of me being dead  I want to outlive them,1,I think my mom would be better off without me. She's remarried and has a new partner. I really want to be a mother so I want to stay. I don't want the people that dislike me to get the satisfaction of me being dead.,think mon well remarry new partner want mother want stay not want people dislike satisfaction dead
94691,Last tryLast try to become gamble free follow it on my other subreddit    Wish me luck,1,Last tryLast try to become gamble free follow it on my other subreddit    Wish me luck,try try gamble free follow sub edit wish luck
94692,Wassup my guys  gals  and whatever the fuck you are pals I m coming at you today with a new product called the Go Fuck Yourself inator  The Go Fuck Yourself inator constantly tells you to go fuck yourself because no one likes  and if anyone does like you  it changes that  This product can be yours for only   And if you order now  you get the Question Your Gender inator for free  The Question Your Gender inator is a machine you attach to your cranium that constantly makes you question yourself  And that s all  Now gimme your money bitches,0,"The Go Fucks Yourself Inator is a machine that constantly makes you question yourself. If you order now, you get the Question Your Gender Inator for free. It's a machine you attach to your head and it's supposed to make you question your gender.",fuck ina tor machine constantly make question order question gender ina tor free machine attach head suppose question gender
94693,I hope you all have an amazing day  but also If you need anything  I m here for you   Virtual hugs here Hugs,0,I hope you all have an amazing day  but also If you need anything  I m here for you   Virtual hugs here Hugs,hope amazing day need virtual hug hug
94694,I need some help Genuinely don t know what to do for an original steam name that is actually good  Wanted to see what you guys thoughts are on how you did yours,0,I need some help Genuinely don t know what to do for an original steam name that is actually good  Wanted to see what you guys thoughts are on how you did yours,need help genuinely don know original steam actually good want guy thought
94695,any painless ways to die tried ODing  didnt work anything that is painless that will get the job done,1,any painless ways to die tried ODing  didnt work anything that is painless that will get the job done,painless way die tried not work painless job
94696,So my mom got mad at me for waking up at   A M to take a piss She asked me what I was doing up  I said I m taking a piss  She said that I should be asleep I said to her  oh  I m so sorry  I ll just go piss in my bed then  Now I m in trouble  but it was worth it,0,So my mom got mad at me for waking up at   A M to take a piss She asked me what I was doing up  I said I m taking a piss  She said that I should be asleep I said to her  oh  I m so sorry  I ll just go piss in my bed then  Now I m in trouble  but it was worth it,mon get mad wake piss ask say take piss say asleep say sorry ill piss bed trouble worth
94697,Yeah I like WAP   Waffles and pancakes   Why are you still here  Expecting some horny joke  Smh my head,0,Yeah I like WAP   Waffles and pancakes   Why are you still here  Expecting some horny joke  Smh my head,yeah like waffle pancake expect horny joke sch head
94698,I cut deeper now  I wonder if one day I ll cut too deep  I wonder if that would be so bad What does it matter anymore  the last girls I dated broke me  I can t for the life of me even get someone to talk to me   not even kidding  tried talking to random internet people    people couldn t get through   conversation with me and just stopped responding  I m gonna stop now because I don t like thinking who or what I am anymore,1,The last girls he dated broke him. He can't for the life of him even get someone to talk to him online. He doesn't like thinking who or what he is anymore. He wonders if one day he will cut too deep. ,girl date break not life talk online not like think anymore wonder day cut deep
94699,My Brother Threw Himself In Front of a TrainIt s been about   weeks and nothing has changed  On   my brother rested his neck on the tracks in Houston and let himself die  For my entire life he was my best friend  Now  I can hardly move  I ve given up on my PhD  I have no source of income because I can t fucking stay awake for more than a few hours at a time  I just don t know what else to do other than follow his lead  I can t see myself recovering  Moreover  I don t want to  Is death by train a decent way to go out  Most of me just wants to find the courage to go to the place he ended his life and end mine there too  I want to experience his final moments despite the fact that it will be my last,1,"My brother threw himself in front of a train in Houston. He was my best friend. Now he can't move, he's given up on his PhD, he has no source of income and he's depressed. He wants to go to the place where he ended his life and end his own.",brother throw train houston good friend not give pad no source income depressed want place end life end
94700,It s killing meFor the longest time ever I ve considered suicide  It s this thing that has bothered me for such a long time  It started in April  I was in horrible pain  more pain than you can ever imagine   There were a word in my head repeating it self  and as the weeks went by it got worse and worse  louder and louder  Where ever i went this was the only thing surronding me   At this point i am about to pull the fucking trigger  and end my life  I can t stand the pain anymore  It s too much for me  The only way i can see this pain ending is by ending my life  I hate my life  Because if i ever hear the word DESPACITO and that ugly fucking voice again I ll just kill myself,1,For the longest time I have considered suicide. I was in pain in April. I hate my life. If I hear DESPACITO again I will kill myself. I can't stand the pain anymore. I want the pain to end. ,long time consider suicide pain april hate life hear de pacino kill not stand pain anymore want pain end
94701,No more being singleI m going to do it  Kill myself  I m tired of seeing everyone else succeed where I consistently fail because I don t meet western standards  Goodbye  To all of the pretty privilege people out there  I ll see you in Hell,1,No more being singleI m going to do it  Kill myself  I m tired of seeing everyone else succeed where I consistently fail because I don t meet western standards  Goodbye  To all of the pretty privilege people out there  I ll see you in Hell,no single going kill tired see succeed consistently fail don meet western standard goodbye pretty privilege people ill hell
94702,It s my birthday  I know nobody cares but I m super happy and excited  I can t wait until I take my permit test,0,It s my birthday  I know nobody cares but I m super happy and excited  I can t wait until I take my permit test,birthday know care super happy excited wait permit test
94703,tonight  they leave in an hour and then i m jumping off the bridge into the rocks and water i m going to kill myself  what else is left to say   they won t be back until   am tomorrow   it s that simple   i ll be dead   they d rather see a dead child than who their child truly is their love is unconditional   really  i m sparing them they don t have to feel ashamed and disgusted at the fact that their kid is trans and bi   they never have to find out now   no note needed  that way they never have to know   they hate people like me  so  it s not like they d care if i was dead if they knew  might as well preserve the memory of me they have even if that is their ugly  depressed  piece of shit daughter   they d prefer the empty me to the real me   they d never want a freak   just another burden for them  another story they d neglect to tell,1,They are leaving in an hour and won't be back until am tomorrow. They hate people like me. They would rather see a dead child than their trans and bi child. They prefer the empty me to the real me. ,leave hour not tomorrow hate people like dead child tran child prefer real
94704,I told somebody to fuck themselves I DIDN T EXPECT THEM TO SEND ME A PICTURE OF THEM MASTERBAITING AAAAAAAAAAAAAAAAAAAAAAAAAAAAAAAAAAAAAAAAAA,0,I told somebody to fuck themselves I DIDN T EXPECT THEM TO SEND ME A PICTURE OF THEM MASTERBAITING AAAAAAAAAAAAAAAAAAAAAAAAAAAAAAAAAAAAAAAAAA,tell somebody fuck expect send picture master bait
94705,All my kinks just invert sometimes I m like a mirror man but for sex,0,All my kinks just invert sometimes I m like a mirror man but for sex,kink invert like mirror man sex
94706,My friend says he is going to commit suicide  very soon  need helpHe thinks he s a pathetic loser and no one likes him and that society would be better without him  need help,1,My friend says he is going to commit suicide  very soon  need helpHe thinks he s a pathetic loser and no one likes him and that society would be better without him  need help,friend say go commit suicide soon need help think pathetic loser no like society well need help
94707,I m going to fail I can t take it NNN is not worth it this year,0,I m going to fail I can t take it NNN is not worth it this year,go fail not worth year
94708,Suicide is foreseeable I don t know how people can see others in pain  especially after they mistreat them  and not think that it could end in suicide   Some people are meant for it  and you can tell who they are from what they have been through  and the look in their eyes   I am sure some of you guys have lost people to suicide  or been there during announcements of it  You hear a lot about how people are assholes to others when they are alive  but suddenly feel remorseful when someone kills themselves   Do you think that surprise or change in heart is genuine  and why,1,Suicide is foreseeable. Some people are meant for it and you can tell who they are from what they have been through and the look in their eyes. People are assholes when they are alive but suddenly feel remorseful when someone kills themselves.,suicide foreseeable people mean tell look eye people ass hole alive suddenly feel remorseful kill
94709,Why am I still hereI feel like shit everyday  I have no one in my life that I can talk to about any of this  I tried to kill myself in April   and I really wish I hadn t failed  Life has only gotten worse since then  a continuing trend that s being going on for a year and a half  Everyone in my life would ve been better off if i hadn t fucked it up  many wouldn t even care that i was gone after a week or so  I m sorry  i just had no where else to turn,1,I tried to kill myself in April and I wish I hadn't failed. Life has only gotten worse since then. Many people wouldn't care if I was gone after a week or so. I just had no where else to turn. ,try kill april wish not fail life get bad people not care go week no turn
94710,Comment and i ll give you a song from my playlist that starts with the first letter of your username  Ye i stole the idea Filler filler filler filler filler filler,0,Comment and i ll give you a song from my playlist that starts with the first letter of your username  Ye i stole the idea Filler filler filler filler filler filler,comment ill song playlist start letter username steal idea filler filler filler filler filler filler
94711,I just cut off the last two friends I have  They don t give a shit about me  Why do I bother with friendship  Been needing to do this for a while,0,I just cut off the last two friends I have  They don t give a shit about me  Why do I bother with friendship  Been needing to do this for a while,cut friend don shit bother friendship need
94712,I m just done with everythingI m so tired of my life  I m so tired of life in general  Every time I do anything i just have this thought in the back of my head  why am i doing this  What s the point of all this  And i just don t wanna do anything anymore because what s the point  I don t like being in the life i have been givin  It s not other people  I love my family and friends  I just feel like there s no point in anything,1,"I don't like being in the life I have been living. I love my family and friends, but I don't see the point in it.   I just don't want to do anything anymore. I'm done with everything. ",not like life live love family friend not point not want anymore
94713,My holidays are ruined without failI m so envious of families that are able to get along with each other and be able to have a cooked meal without fighting or putting each other down   It feels like my parents don t love me and neglect me and they pay attention to my abusive bitch sister who gets away with everything  I just honestly want to shrivel up in a cold ditch somewhere and die  They re the reason why I feel like no one would ever love me and that I hate myself so much   This is a painful existence,1,I'm envious of families that are able to get along with each other and have a cooked meal without fighting or putting each other down. My parents don't love me and neglect me and they pay attention to my abusive sister instead. ,envious family able cook meal fight put parent not love neglect pay attention abusive sister instead
94714,I m going to Wyoming in   days Nobody cares but yeah I m going to look at a college and do Wyoming stuff Since you ve made it this far I ll give the first comment an award,0,I m going to Wyoming in   days Nobody cares but yeah I m going to look at a college and do Wyoming stuff Since you ve made it this far I ll give the first comment an award,go wyome day care yeah go look college wyoming stuff far ill comment award
94715,I have asked my parents so many times my dad decided to order it finally But i had to wait all day for it to come and didn t come checked the messages since he messaged with my phone  to see what is happening   i didn t find any messages And realized it was a DREAM A FUCKING DREAM I fucking hate my life   why won t my brain let me be happy for once and not hype me for things that will never happen everything in my life is going wrong and i can t distract my self in any way,0,"Everything in my life is going wrong and I hate my life. My dad decided to order it finally, but it didn't come and I had to wait all day for it to come. He messaged with my phone to see what is happening but I didn't find any messages.",life go wrong hate life dad decide order finally not come wait day come message phone happen not find message
94716,One more semester and then I m a college student  Fuck I m not ready  Help,0,One more semester and then I m a college student  Fuck I m not ready  Help,semester college student fuck not ready help
94717,Im gonna die alone anyways Let me just mark out my problems  I feel like dying everyday i live  I will never be loved no matter how hard i try in relationships  I will always have insensitive people telling me to man up and that i don t know the harshness of life  People will tell me to live for myself  when i don t have much to live for  I finally think death is my only way out because all they ll do is load me up with drugs and constantly tell me that its better for me to live than hurt other  Who said i give a fuck about anyone  Im in pain   Why should i care about hurting anyone If someone tells me im worth living for myself or any other bullshit  Dont tell me  I m only getting a job so that way i can finally kill myself  By Christmas I ll be gone,1,"By Christmas, I will be dead. I don't care about anyone but myself. I'm getting a job so that I can kill myself by Christmas. I will never be loved no matter how hard I try in relationships. ",christmas dead not care get job kill christmas love no matter hard try relationship
94718,according to society  I m a  year old boy pretty sure Im turning   in a week  and a female and im girl scout  and on multiple occasions  people have come out of Walmart while I was selling cookies and thought I was my troop mates younger brother,0,according to society  I m a  year old boy pretty sure Im turning   in a week  and a female and im girl scout  and on multiple occasions  people have come out of Walmart while I was selling cookies and thought I was my troop mates younger brother,accord society year old boy pretty sure turn week female girl scout multiple occasion people come walmart sell cookie think troop mate young brother
94719,God is my bitch  I m the supreme being around these parts,0,God is my bitch  I m the supreme being around these parts,god bitch supreme part
94720,I dont know what to do anymore if someone wants to listenI am   years old and a huge list of mental problems  Ive been hospitalized twice for drug overdose within the last year and have just stacked more and more shit on my fucking life  My story is long but I have to tell it   I m a pathological liar  narcissist  possible sociopath and much more  Ive gotten expelled from school for beating a woman for no reason and I got away from   years of prison because I was deemed unstavle after my drug overdose shortly after  I dont know how or why I m allowed to walk among the general public  I have horrible self confidence issues and no friends  I spend all fucking day on my computer unemployed just pretending that I m happy  Ive blown through rehab  therapy and many other services over the years and I m overall just fucking finished with the mental healthcare here in north america  I m also fucking crazy  as in I think I have schizophrenia  I believe insane shit anr implement it into my daily life  I mean maybe its real but I dont know wether to trust the stupid fucking norm we call reality or my ideation and spiritual studies  I m also super insecure and dont like taking part in non manly activities due to my insecurities  I neglect my family because I have this image in my head that I should be this super cool rockstar or mafia man for some fucking reason and I cant just accept myself because my stupid fucking biological father Here I am    am on a Saturday night balling my eyes out in my bathroom for no fucking reason  thinking about mortality and shit and how my family will one day fucking DIE   Oh and I just lost my best friend of   years because I made up a story about being   and made some werid plot that I acted out in real life  He was scared and blocked me without a trace and I m not even gonna try to save the friendship because I m so worried about my ego So what do I do what should I have happen guys,1,I have been hospitalized twice for drug overdose within the last year. I have horrible self confidence issues and no friends. I'm insecure and neglecting my family because I have an image in my head that I should be a rockstar or mafia man. I lost my best friend of years because I made up a story about being and made some werid plot that I acted out in real life. ,hospitalize twice drug overdose year horrible self confidence issue no friend insecure neglect family image head rock star mafia man lose good friend year story weird plot act real life
94721,Daily Life Hack     Punching random people in the face isn t a bad thing  It actually burns a lot of calories Stay tuned for tomorrow s life hack,0,Daily Life Hack     Punching random people in the face isn t a bad thing  It actually burns a lot of calories Stay tuned for tomorrow s life hack,daily life hack punch random people face bad thing actually burn lot calorie stay tune tomorrow life hack
94722,How can I ensure a painless death I wish I could sleep forever  but I cant  This is my only option that I m willing to take I just dont want it to be too painful before I leave on Monday  My plan is to try going through a tenth story window  it should be tall enough if I can make sure to land on my head I need this to be successful  Im so worried I ll fail,1,"Before he leaves on Monday, he will try going through a tenth-story window. He needs to make sure he lands on his head. He is worried he won't succeed.   He wishes he could sleep forever but he can't.",leave monday try go tenth story window need sure land head worried not succeed wish sleep forever not
94723,Help with karma I can t post stuff because I have low post and comment karma  Would you mind helping me out by upvoting this post and my comment,0,Help with karma I can t post stuff because I have low post and comment karma  Would you mind helping me out by upvoting this post and my comment,help karma post stuff low post comment karma mind help vote post comment
94724,Hey could you guys leave a nice message on my school s livestream  link  https youtu be G BYBrx U,0,Hey could you guys leave a nice message on my school s livestream  link  https youtu be G BYBrx U,hey guy leave nice message school live stream link youtube
94725,Hello I m boshbish I like gaming and horror and do YouTube videos,0,Hello I m boshbish I like gaming and horror and do YouTube videos,hello bosh like gaming horror youtube video
