,text,class,summary,cleaned
140067,am i a bad person for keeping myself safe  for some backstory my parents are divorced  me  my mom  and sister live in one place and my dad and brother another place on christmas my mom had informed me and my sister that my dad and brother were exposed to covid but our dinner plans we made would still happen  i have made it very clear to my whole family that i am very scared of getting sick but my mom decided they were going to come over anyway   there was a very real possibility that they could have been sick so i avoided them and stayed in my room  the big deal is that my dad had made a very nice christmas dinner that he wanted everyone to enjoy  i wanted to as well but didnt  now my whole family is making me feel like a terrible person because after they both tested negative  part if me feels like i should have eaten with them and the other part of me wonders what would have happened were they positive  i cant tell who is right and wrong in this situation because i have told this story to some friends and they sided with me but my family disagrees,0,"My parents are divorced. My mom and sister live in one place and my dad and brother live in another place. They were going to come over for Christmas dinner, but they both tested negative for cancer, so I didn't eat with them.",parent divorce mon sister live place dad brother live place go come christmas dinner test negative cancer not eat
140068,Got very close to attempting to ODI m done  I m so very done  I ve been having random shit go wrong with my health and my doctors really  really don t give a shit   Wait for it to pass  they say even though I ve already waited months and my mystery back pain returns   Do you really need an appointment for it so soon  yes because I don t want my  nd bout of tonsillitis to develop to the point of my eyes also getting infected like last time and my neck was very visibly swollen on one side  My neck is in fact still swollen  but the tonsillitis has gone  and I m now concerned I ve got a thyroid issue due to pretty sudden severe weight gain and other similar symptoms  Am I gonna bother getting a blood test  Fuck no  I wont even be able to get a fucking appointment t to discuss my symptoms I want to die and my body is finally trying to fulfill it   I took a couple of painkillers at work a few days ago because of my stupid back  and I just couldn t stop thinking about just casually sitting in the break room and swallowing every remaining paracetamol that remained in the packet  I was fairly close to doing it  I don t know why  but I didn t do it,1,"DID has been having problems with his health. He has a thyroid problem, a tonsillitis, a sudden severe weight gain and other similar symptoms. He took paracetamol at work because of his back pain. He will not be able to get an appointment to discuss his symptoms.",have problem health thyroid problem tonsillitis sudden severe weight gain similar symptom take paracetamol work pain not able appointment discuss symptom
140069,extreme mood swingsi can go from crying for multiple hours straight and planning suicide to feeling amazing and being energetic in literal minutes by small things happening like seeing a picture i like  the same thing can happen in reverse by minor inconveniences or just looking in the mirror and feeling bad about myself how can i stop this and help with this,1,Extreme mood swings can be caused by small things like seeing a picture or just looking in the mirror can change a person's mood in a matter of minutes or hours. i can go from crying for hours straight and planning suicide to feeling amazing and energetic in minutes.,extreme mood swing cause small thing like see picture look mirror change person mood matter minute hour cry hour straight plan suicide feel amazing energetic minute
140070,If this post get   like I will   This post is sponsored by EA  To see the rest of the post you ll need to pay,0,If this post get   like I will   This post is sponsored by EA  To see the rest of the post you ll need to pay,post like post sponsor rest post need pay
140071,I need helpThrowaway because my friends are on reddit too so please dont judge I need someone to talk to me I am really desperate to come here  But currently I need tell someone every thing I kept to myself because no one knows those things except me  I am strugling with depression a lot mainly because of my lies  No one close to me knows anything about me and I am afraid if I tell them I will lose them  I am not trolling please help,1,Throwaway is looking for someone to talk to her on reddit. She is depressed because of her lies and she is afraid she will lose her friends if she tells them anything about her. She doesn't want to be judged as she is not trolling.,throwaway look talk geddit depressed lie afraid lose friend tell not want judge not troll
140072,Is anyone there  I need help I need to talk  Help,1,Is anyone there  I need help I need to talk  Help,need help need talk help
140073,Where should I apply to college Also  who gives the best scholarships because this shit is expensive,0,Where should I apply to college Also  who gives the best scholarships because this shit is expensive,apply college give good scholarship shit expensive
140074,Should I stream it Where  How,1,Should I stream it Where  How,stream
140075,Hi me and my buddy need someone to replace our friend comment a lil bout you and we will see if you fit the swaggy standards  We like funny people and nice people  We also like to philosophize sometimes  Feel free to comment  Have a good day,0,Hi me and my buddy need someone to replace our friend comment a lil bout you and we will see if you fit the swaggy standards  We like funny people and nice people  We also like to philosophize sometimes  Feel free to comment  Have a good day,hi buddy need replace friend comment oil bout fit shaggy standard like funny people nice people like philosophize feel free comment good day
140076,do people actually get post nut clarity  like I ve done it a lot and every time I never get sad or depressed or anything just energetic like an adrenaline rush  I thought it was like a joke or something cause masturbation is when sex is not happening,0,do people actually get post nut clarity  like I ve done it a lot and every time I never get sad or depressed or anything just energetic like an adrenaline rush  I thought it was like a joke or something cause masturbation is when sex is not happening,people actually post nut clarity like lot time sad depressed energetic like adrenaline rush think like joke masturbation sex not happen
140077,Please  SW  give me a reason  a reason I ve never heard before  as to why I shouldn t kill myself I m broke  jobless  nearly homeless  with a mountain of debt I just don t see any reason as to why I should keep carrying on  when death would be so much easier   It d be simple really   One bottle of pills and I m gone   A footnote in the novel of life   An after thought in the minds of the people I once knew Why shouldn t I just kill myself right now  and save myself the trouble,1,"SW wants to kill himself because he is broke, homeless and broke. He wants SW to give him a reason why he shouldn't kill himself.    It would be simple to kill yourself with a bottle of pills. ",want kill break homeless break want reason not kill simple kill bottle pill
140078,Just a reminder  No one here cares about you They only care about trying to make themselves feel better by telling someone else that they shouldn t kill themselves because they  matter  or that  things will be better for you  But in reality those people don t even know who you really are so how can you trust someone on the internet you don t really know  If you really need help then just fucking go get some help then and stop making up excuses,1,"No one cares about you. If you really need help, you should go get some help. You don't know who you really are, so how can you trust someone on the internet you don't really know to help you? ",no care need help help not know trust internet not know help
140079,I JUST WANNA FUCKNIG DIE WHY IS IT DSO HARDFUCK FUCK FUCK FUCK FUCK FUCK FUCKD FUCK FYHF FUCKKKKD,1,I JUST WANNA FUCKNIG DIE WHY IS IT DSO HARDFUCK FUCK FUCK FUCK FUCK FUCK FUCKD FUCK FYHF FUCKKKKD,want fucking die hard fuck fuck fuck fuck fuck fuck fuck fuck vhf fuck
140080,talk me out of suicidei m counting my medication and seeing how much is enough to kill me  i m so close  i don t wanna live anymore but i m afraid of what comes after death,1,talk me out of suicidei m counting my medication and seeing how much is enough to kill me  i m so close  i don t wanna live anymore but i m afraid of what comes after death,talk suicide count medication see kill close don want live anymore afraid come death
140081,I lost him  I lost everything Today me and my boyfriend broke up  It s so hard  We were together for almost   years  I can barely breath how much my heart hurts  I ve never loved anybody so much as I love him  I don t think I can make it  my suicidal thoughts are getting worse and worse  I have no idea what shall I do  I don t wanna hurt my family but I don t know how to get through this  I just wish I was dead,1,Today my boyfriend and I broke up. We were together for almost two years. I love him very much. I don't know how to get through this. I'm suicidal. I just wish I was dead. I can barely breath. ,today boyfriend break year love not know suicidal wish dead barely breath
140082,Can you be considered a boomer if you re not a literal boomer  I m half joking because I did get called a boomer by my friend jokingly  but now I m interested if it could actually work that way,0,Can you be considered a boomer if you re not a literal boomer  I m half joking because I did get called a boomer by my friend jokingly  but now I m interested if it could actually work that way,consider boomer not literal boomer half joke call boomer friend jokingly interested actually work way
