,text,class,summary,cleaned
28081,ITS AWESOME BABY AHHHHHHHH now that your here  say no to dick  Return to madden o,0,ITS AWESOME BABY AHHHHHHHH now that your here  say no to dick  Return to madden o,awesome baby ash no dick return madden
28082,Book writing  Please can you guys help me with this book I m writing  It s called   and the story revolves vaguely around the number   but thats not the point  It s a crime fiction mystery  I have set you guys to commenters  Can you help  This is the link   https docs google com document d kFx RsCz PAn P zCWC pvCFSIrYjfIXrYcx lNc edit usp sharing https docs google com document d kFx RsCz PAn P zCWC pvCFSIrYjfIXrYcx lNc edit usp sharing,0,The book I'm writing is a crime fiction mystery and the story revolves around the number. I've sent the link to Google Docs to ask for help with the book. It's a document d kFx RsCz PAn P zCWC pvCFSIrYjfIXrYcx.,book write crime fiction mystery story revolve number send link google doc ask help book document kex rock pan acc pvcfsiryjfixrycx
28083,So  my cat got pissed and pissed all over my clothes today  I don t have any water rn to wash my hands or my clothes  how s your day going,0,So  my cat got pissed and pissed all over my clothes today  I don t have any water rn to wash my hands or my clothes  how s your day going,cat got piss piss clothe today don water right wash hand clothe day go
28084,Literally don t want to do anything with my lifeI feel like I m just wasting time living on this Earth  I don t want to live a long life  I just want to sleep peacefully eternally  That s the only thing I truly want,1,Literally don t want to do anything with my lifeI feel like I m just wasting time living on this Earth  I don t want to live a long life  I just want to sleep peacefully eternally  That s the only thing I truly want,literally don want life feel like waste time live earth don want live long life want sleep peacefully eternally thing truly want
28085,Guys  I have   Reddit followers Thats more than I have on Instagram  Epic,0,Guys  I have   Reddit followers Thats more than I have on Instagram  Epic,guy geddit follower inst gram epic
28086,I m giving up Everyone says  life will get better  but it never does   I ve done so many stupid things in my life   It s just best to put an end to it all   I can never get anything right   I hope I can at least get my own death done correctly,1,I m giving up Everyone says  life will get better  but it never does   I ve done so many stupid things in my life   It s just best to put an end to it all   I can never get anything right   I hope I can at least get my own death done correctly,give say life well stupid thing life good end right hope death correctly
28087,If you see someone you know on snapchat saying swipe up for new onlyfans dont swipe up It adds you into a group chat where they make fun of you for wanting their onlyfans,0,If you see someone you know on snapchat saying swipe up for new onlyfans dont swipe up It adds you into a group chat where they make fun of you for wanting their onlyfans,know snap chat say swipe new fan not swipe add group chat fun want fan
28088,How does one do this So like how do people actually have girl or boy friend that they ve never met,0,How does one do this So like how do people actually have girl or boy friend that they ve never met,like people actually girl boy friend meet
28089,Teenagers at   am hits different I should go to sleep,0,Teenagers at   am hits different I should go to sleep,teenager hit different sleep
28090,I dont know what to do and i want helpi want to kill myself so fucking badly  school and daily stress are overwhelming me  im so fuckjng ugly and i cant not disappointment my girlfriend for one day  Im afraid like my gfs gonna leave me and shes all i have left apart from my two cats  No one likes me really and i dont even think my gf does of all people  i swear she finds me annoying  And then people go oh i care about you dont kill yourself  like sure that makes me so not wanna die  I dont know what to do  i have no one to talk to and if i talk to my gf she ll get upset with me  Help please,1,"School and daily stress are overwhelming him and he wants to kill himself. He is afraid his girlfriend is going to leave him. He has no one to talk to and if he talks to his girlfriend, she will get upset with him.",school daily stress overwhelm want kill afraid girlfriend go leave no talk talk girlfriend upset
28091,Semen smell Semen smell I masturbate every night in my bed and clean up with tissues then throw them away literally everything in my room including stuffed animals that were on my bed at the time smell is it cum,0,Semen smell Semen smell I masturbate every night in my bed and clean up with tissues then throw them away literally everything in my room including stuffed animals that were on my bed at the time smell is it cum,seman smell seman smell masturbate night bed clean tissue throw away literally room include stuff animal bed time smell cum
28092,my family thinks i m graduating university thursday  i m not  can t ask for help because i ll look manipulative it s been two years of constant suicidal ideation  i m extremely bulimic and depressed  i was supposed to graduate university may   and fucked it up  then was supposed to in december  fucked that up  my graduation ceremony is supposed to be thursday  my entire family is  so proud  of me for finally graduating  i learned from the university that i m not  i didn t turn in my dissertation  amp  i failed   classes this semester  i was living alone and absolutely ridiculously depressed  became a minor alcoholic  binge purged up to  x a day  did a lot of coke and smoked a lot of weed  self harmed a lot  and did NOTHING the last semester of university  i cannot tell my parents that for the  rd time in a row i m not graduating  they will disown me  that s basically a fact  i m living with my grandma right now so i can t even outwardly express how much i want to die i have to keep it low key  i can t ask for help because they ll just think i m manipulative and trying to hide the fact i m a fuck up  but it s been years of this  i m just done  i truly have nothing going for me  i don t have close friends  my family lives a   hour flight away  they know i m bulimic and self harm and depressed and even when though i ve called my mom and sister before when i was sobbing and suicidal they have never checked up on me  i m just tired  i don t care about myself or anyone or anything  i live next to a beautiful forest  i want to sneak out tonight with a bottle of vodka and pills and fall asleep somewhere quiet  my family s going to think i m an asshole but who cares i ll be dead  just kind of mad i m gonna be dying fat  ive gained   lbs in a month  went from   lbs to around   oh well i want to be cremated anyways so no need for a pretty corpse,1,"It's been two years of constant suicidal ideation for him. His graduation ceremony is supposed to be on Thursday. He didn't turn in his dissertation, he failed classes this semester, he was living alone and depressed, he's drunk a lot, smoked a lot of coke, self harmed a lot and is fat. He doesn't have any close friends and his family lives a long way away. He wants to kill himself.",year constant suicidal ideation graduation ceremony suppose thursday not turn dissertation fail class semester live depress drunk lot smoke lot coke self harm lot fat not close friend family live long way away want kill
28093,Im just chilling and I have inexplicably started crying I m just laying in bed listening to Ben platt songs and suddenly I m balling I m not stressed from school rn  I m not sleep deprived or anxious but for some reason I m crying Send help,0,Im just chilling and I have inexplicably started crying I m just laying in bed listening to Ben platt songs and suddenly I m balling I m not stressed from school rn  I m not sleep deprived or anxious but for some reason I m crying Send help,chilling inexplicably start cry lay bed listen ben plant song suddenly ball not stress school right not sleep deprived anxious reason crying send help
28094,Do you ever miss a person you just met very badly  I do,0,Do you ever miss a person you just met very badly  I do,miss person meet badly
28095,Would u message Epstein for,0,Would u message Epstein for,message epstein
28096,If I was to stream Minecraft on Twitch  who would watch  Literally a noob when it comes to streaming  and I m not really good when it comes to meeting new people so I m just throwing myself out there  I just wanna play Minecraft and try to chill with the community   Twitch   OzzyThulhu https www twitch tv ozzythulhu,0,OzzyThulhu wants to stream Minecraft on Twitch. He doesn't know how to do it and he's not good at meeting new people. He just wants to play Minecraft and chill with the community on Twitch OzzyThul.,cthulhu want stream min craft twitch not know not good meet new people want play min craft chill community twitch ozzie jul
28097,I don t know what to domy friend is suicidal and i just don t know what to do,1,I don t know what to domy friend is suicidal and i just don t know what to do,don know friend suicidal don know
28098,I heard you like cookies  So have one   Btw  have a nice day and stay hydrated  guys  gals and non binary pals,0,I heard you like cookies  So have one   Btw  have a nice day and stay hydrated  guys  gals and non binary pals,hear like cookie way nice day stay hydrated guy gal non binary pal
28099,what a beautiful day to stalk randos on the internet an absolutely lovely activity  i must say,0,what a beautiful day to stalk randos on the internet an absolutely lovely activity  i must say,beautiful day stalk random internet absolutely lovely activity
