,text,class,summary,cleaned
46834,GhostI just want to lie in bed and rot away   I m tired   I m tired of trying pills   If all these different ones don t work  then maybe I don t have depression after all   Maybe I was just born to be this way   It seems to run in the family  after all   Maybe I m just a bitch with a bad attitude   Or maybe I just never managed to learn how to survive in this world   All the privilege in the world won t save a person from herself Drink  smoke  eat  sleep   Caffeine pills   Brother  favorite brother  I know you do meth   Does it help you   Does it shake off your lethargy and let you function in life   Or are you just doing it for fun because you don t feel the same way I do about life Lover  you are the millstone around my heart that pins me to this planet   Set me free  let me fly away   I cannot bear to break your heart  but I cannot bear to live like this either   What kind of life will you have  knowing the woman you love would rather kill herself than live her life  even when that life includes you   You have been betrayed in other ways  by other women   Will you find a healthy relationship   Or a string of broken girls like me Mother  father  siblings  you have each other for comfort   I think one of you will not care   I think two of you will be heartbroken  but you are strong enough to survive   I think the rest of you know and understand what drove me here  and will be able to forgive me for it in time,1,Ghost is depressed and wants to kill herself. He is in a relationship with a woman who doesn't feel the same way about life as he does. Ghost wants to break her heart but he can't bear to live like this. Ghost has been betrayed by other women.,ghost depress want kill relationship woman not feel way life ghost want break heart not bear live like ghost betray woman
46835,im so tired im extremley tired  school is starting and im not gonna be able to handle the stress  i barely have any friends  and even when i do i cant keep them  if any of my friends do anything and i mean anything with each other without me i get extremley sad and often start crying  im so scared they don t wanna be around me anymore  i hate being like this  i usually just decide to be alone which makes school even worse  the fact that im bullied and most people dislike me doesnt help either im not even gonna have time to do homework since i have a ton of activites and my school days are gonna end even sooner than before  i don t know how im gonna handle it  my parents arent any help either  they usually make things worse and wont leave me alone  i don t wanna be here anymore  i feel done  im not even sure if anyone wants me here,0,The new school year is starting and Anna is stressed out. She barely has any friends. She is bullied and most people dislike her. She doesn't have time to do homework and her school days are going to end sooner than before. ,new school year start anna stress barely friend bully people dislike not time homework school day go end soon
46836,If your discord user is Gogy  not gonna day the numbers for obvious reasons  dm me Yes this is very random just do it and I ll explain everything ok,0,If your discord user is Gogy  not gonna day the numbers for obvious reasons  dm me Yes this is very random just do it and I ll explain everything ok,discord user gogh not go day number obvious reason yes random ill explain
46837,Could someone please talk to me to distract myself if it s not too much troubleI m having a really hard time and feel all alone and I don t wanna waste anyone s time   I feel like I m at the end of my rope with life,1,Could someone please talk to me to distract myself if it s not too much troubleI m having a really hard time and feel all alone and I don t wanna waste anyone s time   I feel like I m at the end of my rope with life,talk distract not trouble have hard time feel don want waste time feel like end rope life
46838,Guys how would I malicious compliance my dad  My dad wants to collect all our  me amp brothers  phones  electronics just cause he can taking them  nite and keeping until god knows when Any ideas of how to get back,0,Guys how would I malicious compliance my dad  My dad wants to collect all our  me amp brothers  phones  electronics just cause he can taking them  nite and keeping until god knows when Any ideas of how to get back,guy malicious compliance dad dad want collect amp brother phone electronic take site keep god know idea
46839,I can hear him again Bruh just land lmao its his  th time passing us  Filler filler filller filler filler filler filller,0,I can hear him again Bruh just land lmao its his  th time passing us  Filler filler filller filler filler filler filller,hear brush land lao time pass filler filler filler filler filler filler filler
46840,What is the point of surviving That s all I m doing  Surviving  Existing  Merely going through the necessary processes to  live  on a biological level Every person must find their own way  But what of those that have given up the journey  You can t make me walk  you can t change my neurochemistry You can t find my reason to live for me But I can t find it for myself I sought respite in selfless service and found it to be unsatisfactory  I sought respite in expressing myself artistically and through creative endeavors and soon it all went gray  I keep seeking  even if it s only small steps for one simple reason If I snuff out my own light  I better have exhausted my ideals  I better have walked many paths to dissatisfaction before deciding there is no purpose or ideal that can galvanize me to live Life should be about living  not surviving,1,"There is no purpose or ideal that can galvanize me to live. Life should be about living not surviving. I have tried to find a purpose in selfless service and creative endeavors, but I can't find it for myself. ",no purpose ideal galvanize live life live not survive try find purpose selfless service creative endeavour not find
46841,Something i never realised when growing up  I never realised as i was growing up i was watching my parents grow up also  It s something i never thought about till i was a teen and i m wondering if anyone else never thought about this,0,Something i never realised when growing up  I never realised as i was growing up i was watching my parents grow up also  It s something i never thought about till i was a teen and i m wondering if anyone else never thought about this,realise grow realise grow watch parent grow think till teen wondering think
46842,Guys my dad killed Hitler He was a very good man I miss him,0,Guys my dad killed Hitler He was a very good man I miss him,guy dad kill hitler good man miss
46843,There were gunshot sounds somewhere in the neighbourhood  I purposely stood in front of the window and prayed a bullet would hit me I grew up in a bad Detroit neighbourhood  My parents taught me when I was little that if I ever heard anything that sounded like gun shots to move away from a window and get low to the ground   I just did the opposite of that   I ve heard gun shots out of a window before  Those noises I heard  probably weren t gun shots  But it was worth a try none the less   I m desperate,1,There were gunshot sounds somewhere in the Detroit neighbourhood. I stood in front of the window and prayed a bullet would hit me. My parents taught me when I was little to move away from a window and get low to the ground if I heard gun shots.,gunshot sound detroit neighbourhood stand window pray bullet hit parent teach little away window low ground hear gun shot
46844,P S it never gets better Will I honestly ever be happy  I m always extremely depressed around this time  Always before my so called favorite holiday  I can t have good birthdays or good Christmas s  I think I just have to accept it   Will I ever be enough  I spend nights in my room crying and no one ever knows  With my uncle in the hospital  the anniversary of my sexual assault  and my boyfriend hurting me again  I question what worth I have on this earth,1,It's the anniversary of my sexual assault and the boyfriend hurting me again. I spend nights in my room crying and no one ever knows why I'm depressed. I can't have good birthdays or good Christmas s. I think I just have to accept it. ,anniversary sexual assault boyfriend hurt spend night room cry no know depress not good birthday good christmas think accept
46845,Hey guys Just dropping in to see how everyone is doing,0,Hey guys Just dropping in to see how everyone is doing,hey guy drop
46846,I just need somebody to talk toI feel like I m losing everything all at once  I m going through a breakup  my friends have all gone home to their countries because they are international students  and my parents don t seem to notice how much I m hurting  My ex boyfriend and his friends bully me online  and it is hard to talk to my friends about how sad I am because they didn t like my boyfriend from the beginning of the relationship  My parents don t allow me to date at   years old so I can t tell them what is going on  I m not sad about the relationship ending  I m more upset about being bullied and treated without respect  My parents also accuse me of stealing money from my older brother but he is Autistic and unintentionally signs up for subscriptions online which my parents don t believe he is capable of  I feel like I have no one to talk to  I m thinking about suicide because I feel so lonely and worthless and can t seem to find someone to talk to,1,I'm going through a breakup. My friends have all gone home to their countries because they are international students. My parents don't seem to notice how much I'm hurting. My ex boyfriend and his friends bully me online. They accuse me of stealing money from my older brother.,go breakup friend go home country international student parent not notice hurt sex boyfriend friend bully online accuse steal money old brother
46847,Numbers game please Just comment the number,0,Numbers game please Just comment the number,number game comment number
46848,I have access to a ton of people s email logins but there s never shit  You can t do anything with it like you can t login to their bank or whatever if it s linked to that email because it will ask for a phone text code  It s worthless so I don t even use them  filler filler filler filler filler filler filler filler filler filler filler filler,0,"I have access to a lot of people's email logins, but I don't use them because they're useless. You can't login to their bank account if it's linked to their email account. It asks for a phone text code to access it. ",access lot people email login not use useless not login bank account link email account ask phone text code access
46849,I can t post images but need you guys to critique something I pinned a post on my profile  It s a thumbnail I made for a YouTube video  what do you think  It took me about   minutes,0,I can t post images but need you guys to critique something I pinned a post on my profile  It s a thumbnail I made for a YouTube video  what do you think  It took me about   minutes,post image need guy critique pin post profile thumbnail youtube video think take minute
