,text,class,summary,cleaned
138284,Room Decor Ideas  Please Ight so here s the deal I ve recently moved into a new house and my mom and dad gave me a   dollars each so I m on a budget but need some ideas cause my room is boring as fuck rn  I m a guy btw no girly shit,0,Room Decor Ideas  Please Ight so here s the deal I ve recently moved into a new house and my mom and dad gave me a   dollars each so I m on a budget but need some ideas cause my room is boring as fuck rn  I m a guy btw no girly shit,room decor idea right deal recently move new house mon dad give dollar mon budget need idea room boring fuck right guy way no girly shit
138285,So I just had a conversation with my friend about how tight Hamilton s pants were Somehow we were texting each other about my history project and then my friend was trying to convince me that some   year old guy was hot,0,So I just had a conversation with my friend about how tight Hamilton s pants were Somehow we were texting each other about my history project and then my friend was trying to convince me that some   year old guy was hot,conversation friend tight hamilton pant texte history project friend try convince year old guy hot
138286,Anyone know any good pickup lines If you have seen my posts over the last week or two you will know that I m gonna ask out this girl I like anybody know any pickup lines for that reason,0,Anyone know any good pickup lines If you have seen my posts over the last week or two you will know that I m gonna ask out this girl I like anybody know any pickup lines for that reason,know good pickup line see post week know go ask girl like anybody know pickup line reason
138287,Does anyone else feel worthless I feel completely useless  I don t think I do anything for anybody  I serve absolutely nothing and have no purpose  Does anyone else feel the same way,1,Does anyone else feel worthless I feel completely useless  I don t think I do anything for anybody  I serve absolutely nothing and have no purpose  Does anyone else feel the same way,feel worthless feel completely useless don think anybody serve absolutely no purpose feel way
138288,Struggling to connect with a therapist I ve emailed and called several offices  It s been a week and no response  I desperately want help  I want out of this but no one s picking up and I m so distressed  I have someone who will help pay for treatment but it s fucking pointless if I can t even get help  How on Earth do you get a psychologist or therapist to contact you back  I ve been struggling for weeks,1,"It's been a week since I tried to contact a therapist but no one picked up. I have someone who will help pay for treatment, but it's pointless if I can't even get help. How do you get a psychologist or therapist to contact you back?",week try contact therapist no pick help pay treatment pointless not help psychologist therapist contact
138289,I m drunkI want to kill myself so fucking bad but I think that would be a pussy way to die and that I would regret it since if I m at that point what is the harm in trying again anyway right  Fuck me I hate myself and I don t even know why I want to fucking die so much but slam stubborn part of me wants to live I want o cry becusaee it would be so easy if suicide we  a option god ducking dammnit I m sorry guys,1,"I want to kill myself, but I think suicide would be a bad way to die. I hate myself and I don't know why I want to die so much, but a stubborn part of me wants to live.  ",want kill think suicide bad way die hate not know want die stubborn want live
138290,My life is in crumbles I need some support with no friends to speak to I figured maybe reaching out to strangers will help me This is the toughest point my life has ever reached  And I ve actually thought about suicide  My girlfriend of   years left me   We have a   month old son together and it kills me now knowing I ll only see him on weekends my days off from work I was never perfect in the relationship I had my flaws  I struggled to get it together after becoming a father and I admit I was wrong for that We originally were on a  break  where she told me I needed to change how I was and I did I changed everything   But it turns out she just didn t love me anymore    years of memories now rest on my mind  tormenting me  It s taken a toll on me while I m even at work I look through old Facebook messages and look at how it used to be and now everything reminds me of her  I told her I wouldn t be okay I ve had thoughts of suicide before  but never actually wanted to until now and I have no one to talk to,1,Girlfriend of years left him. They have a month old son together. They will only see him on weekends. She didn't love him anymore. He has no one to talk to. He thought about suicide before but never wanted to until now.,girlfriend year leave month old son weekend not love anymore no talk think suicide want
138291,I can t cope with my lifeI m struggling  I m sat here with a canister of helium gas and an oxygen mask and I really want to use it to kill myself  I ve not eaten properly in days  the prepaid electric has just gone out and I feel so betrayed by my best friend it s all becoming too much   I can t wait to die but my brother hung himself in   and all I can think about is my family and how much I am going to hurt them all again  I don t want to go back to one of those horrible hospitals  they are not helpful  I m insane  fuckin insane  I was responsible for a huge gas explosion  another botched suicide  lucky I didn t killed someone else but I have destroyed my uninsured landladies family home and ended up in prison for a year and a half for it In all honesty I don t know why I am posting here  I deserve to be dead and I want to be dead,1,I want to kill myself. I can't cope with my life. My brother committed suicide. I destroyed my flat and ended up in prison for a year and a half for it. I deserve to be dead and I want to die. ,want kill not cope life brother commit suicide destroy flat end prison year half deserve dead want die
138292,cant do this anymorei wanna do it but the one big thats stopping me is how its going to effect my mom and shes the one person i cant hurt anymore,1,cant do this anymorei wanna do it but the one big thats stopping me is how its going to effect my mom and shes the one person i cant hurt anymore,not anymore want big stop go effect mon person not hurt anymore
138293,My lil bro told me he likes fortnite more than minecraft It s cool tho  I respect his opinion and I hope he has fun doin what he likes,0,My lil bro told me he likes fortnite more than minecraft It s cool tho  I respect his opinion and I hope he has fun doin what he likes,oil bro tell like footnote min craft cool respect opinion hope fun like
138294,Really trying to talk myself out of thisI ve been feeling suicidal for a while  However I ve been madly in love with someone and it helped calm down that side of me  We have broken up  and now the suicidal thoughts are here more than ever  I ve planned out two different ways to off myself  I just don t want anyone to think its because of him and I don t want him to feel guilty  I m just not sure what to do right now  I m trying to tell myself life is going to get better but since one of my best friends died in October from an accidental overdose I have the overwhelming urge to join her   Also  sorry if this was a big paragraph of word vomit  I don t usually post a lot,1,Suicidal thoughts have come back to her since she broke up with her boyfriend. One of her best friends died in October from an accidental overdose. She feels the overwhelming urge to join her. She doesn't want anyone to think it was her boyfriend's fault.,suicidal thought come break boyfriend good friend die october accidental overdose feel overwhelming urge join not want think boyfriend fault
138295,a suicidal momI love my son so much and he s the only reason I continue to wake up everyday but sometimes it just isn t enough  Being a parent makes me resentful in a way  It d be to easy to just go get a gun and blow my brains out and I want to do that so badly but then I toy with the what if s  what would happen to my son and what kind of human being he would grow into without me  I m completely alone  I have no family  no friends  Divorced my abusive ex husband and joined the military to give my son a better life only to be raped and forced out later  So it s just me and this amazing  year who loves me to bits yet I still don t want to live this life  I know it s selfish of me but I have so much emotional pain that makes life seem worthless   I try to hold on to the small things like getting to see him smile and knowing the fact he is healthy and happy  My mind just gets so dark I wonder how much longer I can really live this way,1,A suicidal mom is resentful of her life as a parent. She wants to kill herself but is afraid of what would happen to her son without her. She has no family or friends. She was raped and forced out of the military by her abusive ex husband.,suicidal mon resentful life parent want kill afraid happen son no family friend rape force military abusive sex husband
138296,I ve been searching in vain For as long as I can remember I have been searching for a big titty goth gf  but all my attempts have been in vain  It appears that the milk has dried up  Will I continue my search  Or will I succumb to loneliness  Find out next time on  Dying Alone Because I m a pathetic pathetic man,0,As long as I can remember I have been searching for a big titty goth gf but all my attempts have been in vain. Will I continue my search or succumb to loneliness? Find out next time on Dying Alone.,long remember search big titty goth attempt vain continue search succumb loneliness find time die
138297,I m   and I m SuicidalUh hi  I m   and I m suicidal I really at this point just don t care about life  I mean why care  when I was in  th grade  so I was like   my cousin commented suicide and then maybe a month or so later my uncle did the same  my mom was really fucked up  sorry for swearing  she um well has a bad drug problem my older sister was basically my mom and my grandma  My dad left when I was   and keep coming back just to start shit like he would say how me and my siblings were worthless and didn t matter  My uncle than died a couple days before my birthday and so my birthday was spent at a funeral also my siblings and my mom and step dad lived at my grandma and grandpas my  parents  would always fight like boom   am fighting   pm fighting  some times it got physical but I don t like talking about those in the summer after  th grade I began to cut it was weird but I liked it  I hated pain but as soon as I had that dull blade it s like I blacked out and was a different person  That went on for awhile till my sister found out and told my mom finally I stoped for a month or   and it went on  After Christmas My great grandma died and she was like a second mom to me like I loved her so much and at her funeral i saw her corpse it was wierd I kinda expected her just to wake up you know  But she didn t umm a couple months ago I moved in with my biological dad because my mom tried to kill herself in front of me she just kept screaming about how she wants to be with her brother  my uncle  it was wierd I guess  my dad is cool I guess but he doesn t exactly accept me being trans  FTM  I honestly don t give a shit about living and want to die but I have birds and my sister but honestly my anti depressants are not working and all I can think about is death which is okay I guess  Thanks for reading I suppose,1,"Suicidal. After the summer after th grade, she began to cut. After Christmas, her great grandma died and she was like a second mom to her. Recently, she moved in with her biological dad because her mom tried to kill herself in front of her.",suicidal summer grade begin cut christmas great grandma die like second mon recently move biological dad mon try kill
138298,I been ghosted Why am I surprised though  we met through my cousin,0,I been ghosted Why am I surprised though  we met through my cousin,ghost surprised meet cousin
138299,If you like getting massages then you like getting advanced petting,0,If you like getting massages then you like getting advanced petting,like get massage like get advanced petting
138300,Bit of self promotion  but I m streaming fighterZ if anyone wants to watch   It s for a video I m doing  Any support is appreciated https www twitch tv asian online take,0,Bit of self promotion  but I m streaming fighterZ if anyone wants to watch   It s for a video I m doing  Any support is appreciated https www twitch tv asian online take,bit self promotion stream fighter want watch video support appreciate twitch asian online
138301,Fucccccc school starts today Im not even that upset about school itself im more mad at the fact that i have to go to bed at the same time but then wake up   hours earlier At least the first day is an easy one,0,Fucccccc school starts today Im not even that upset about school itself im more mad at the fact that i have to go to bed at the same time but then wake up   hours earlier At least the first day is an easy one,fuck school start today not upset school mad fact bed time wake hour early day easy
138302,If anyone wants to talk vent I m here to hear you and maybe if you re okay I d love to give advice too The past does not define who you ll be in future keep the hope in this hard times and hang in there I m here to help you,1,If anyone wants to talk vent I m here to hear you and maybe if you re okay I d love to give advice too The past does not define who you ll be in future keep the hope in this hard times and hang in there I m here to help you,want talk vent hear maybe okay d love advice past not define future hope hard time hang help
138303,I can t anymoreI literally can t even talk to people casually  Everytime I try I just want to disappear  I just can t amount to anything  Everyone around me has got a memo that i seemed to miss  Everyone has got it  Not me and it s fucking disgraceful  I don t deserve love or any other good things adjacent to that  Everyone else had already done the things i m just starting to discover BECAUSE i spent my teenage years fucking depressed  How fucking pathetic is that huh  I just wish i could fucking die already  but i m even too much of a coward to do THAT  God fucking damn  Why the fuck can t i man up for once in my pathetic life and do something right I could go on and on but im not gonna burden you all  Bye,1,I'm depressed and I can't talk to people casually. I spent my teenage years depressed. I wish I could die already but I'm too much of a coward to do that. I don't deserve love or any good things because I didn't grow up. ,depressed not talk people casually spend teenage year depress wish die coward not deserve love good thing not grow
138304,u Dovahkiin  appreciation post u are pog,0,u Dovahkiin  appreciation post u are pog,akin appreciation post log
138305,George W Bush Claus Added continued from u NewRenoBouncer  post amp x B https preview redd it a g ki nj png width amp format png amp auto webp amp s dd f f fd a d e abab,0,George W Bush Claus Added continued from u NewRenoBouncer  post amp x B https preview redd it a g ki nj png width amp format png amp auto webp amp s dd f f fd a d e abab,george bush claus add continue new renouncer post amp preview redd ski no eng width amp format eng amp auto web amp def feed de arab
138306,TMI alert weird thoughtsI can t be the only one that either gets incredibly suicidal  wanting to harm or incredibly horny right  I mean what s that all about  I can t be the only one that uses sex as a distraction right  My nearly husband thinks I m just wanting him all the time which in some way I do but mostly  it s just a distraction technique  Like I m either gonna try and kill myself or have an orgasm  Only thing is when the buzz of that goes I then get super anxious and suicidal again  Sorry too much information,1,"According to her, sex is a distraction technique used by her nearly husband. When the buzz of sex wears off, she gets very anxious and suicidal again.    i.e. she wants to kill herself or have an orgasm. ",accord sex distraction technique nearly husband buzz sex wear get anxious suicidal want kill orgasm
138307,i failed my suicide attempt and i hate it i was going out with no note all i had was eminems criminal on repeat and i got trigger happy and shot myself in the ribs now i m in the hospital how can i die here,1,i failed my suicide attempt and i hate it i was going out with no note all i had was eminems criminal on repeat and i got trigger happy and shot myself in the ribs now i m in the hospital how can i die here,fail suicide attempt hate go no note eminem criminal repeat get trigger happy shoot rib hospital die
138308,I don t want to do it  But I feel trapped I m  f  My spouse is amazing  But I had a stroke early this year and ever since I ve not been the same person  Or a person I only feel anxiety and guilt  No pride  No joy  No love  Except major infatuation with my friend I would go now but my mom is visiting from out of state and is returning because we will be going back to our home state for a week I have to wait almost   weeks until I can admit myself  But I don t think they can help me anymore,1,I had a stroke early this year and since then I haven't been the same person. I would go now but my mom is visiting from out of state and she will be going back to her home state for a week. I have to wait almost weeks until I can admit myself.,stroke early year not person mon visit state go home state week wait week admit
138309,I got a full combo on escape on expert Why is it even called expert  it s not that hard  or am I just good at beat saber  idk  I don t really see how you could fail an expert level unless you were deliberately trying too,0,I got a full combo on escape on expert Why is it even called expert  it s not that hard  or am I just good at beat saber  idk  I don t really see how you could fail an expert level unless you were deliberately trying too,get combo escape expert call expert not hard good beat saver not know don fail expert level deliberately try
138310,I Think Is Time For Me To End My Life Soon Maybe By The End Of This Year Ever since I born I have this heart problem I been struggling with I have a peacemaker in my heart that make me cant do alot of fun stuff like normal heath people do like go hiking play sports swimming running stuff like that you know is just so sad  Wrestling is the most fun looking sports I wanna do for my career but I cant is to much for my heart  When I was little my dad use to always take me to my doctor appointments but now he just tells my brothers to take me to my doctor appointments they get really annoyed with me when my dad tell them to take me so thats when I think i should just end my life my brothers are tired of me im tired of not being able to have fun I have no friends,1,"I have a heart problem that makes it hard for me to have fun. My dad no longer takes me to the doctor's appointments, so I think it's time to end my life. I don't have any friends and I have no money.",heart problem make hard fun dad no long take doctor appointment think time end life not friend no money
138311,Things i hate about myselfSuper sensitive  My body Pretty much worthless Can t talk to anyone first Get super nervous and shy for no reason Stupid  My voice  Hearing fucking voices  Family hates me Motivation  No friends  The most useless human alive,1,Things i hate about myselfSuper sensitive  My body Pretty much worthless Can t talk to anyone first Get super nervous and shy for no reason Stupid  My voice  Hearing fucking voices  Family hates me Motivation  No friends  The most useless human alive,thing hate super sensitive body pretty worthless talk super nervous shy no reason stupid voice hear fucking voice family hate motivation no friend useless human alive
138312,PM me if you want to chat  Hey  I m Anya  I m   and I live in LA  Super bored right now and craving some human contact  I m down to talking about books  movies  myself favorite topic  or whatever is going on with you  I also really like sandwiches  PM me if you are bored as well  I really can t talk to my sister much longer Will probably take this post down soon,0,Anya lives in LA and is bored. She would like to talk to her sister. She also likes sandwiches. She will probably take this post down soon and PM Anya if she wants to talk about anything at all. ,life la bore like talk sister like sandwich probably post soon pm want talk
138313,I really can t see any other wayI m just ruining everyone s lives,1,I really can t see any other wayI m just ruining everyone s lives,way ruin life
138314,I fantasize of that dayI would write a letter  Tell my family I m going on a short vacation with my friend  Leave it somewhere they can find it  along with the very few physical things I love I d catch a plane and visit my online friend   we ve chatted for the past   years  I d have a letter for him too  but I d want to deliver it personally Then I d catch another plane into a very isolated  small Canadian town  I was there last year  The temperatures are very low   I d take my antidepressants and I d walk out  In the night  The cold would kill me after a few hours  The beauty  that I have already seen  would be everything I want to see when I leave I think of all this  and I feel happy  It s not a plan for now   I m waiting for my mom to go  first  I realized I can t do it while she s still alive  I ve accepted to live as whatever I will be in the next few years  I don t have any ambitions   the bare minimum is fine   But I dream of it when it gets too hard  Somehow  it feels like the only time in my life I would actually feel happy and in control,1,I fantasize about going on a short vacation with her online friend. She would write a letter to her family telling them she's going for a vacation. She'd visit her friend in a small Canadian town. She was there last year. ,fantasize go short vacation online friend write letter family tell go vacation visit friend small canadian town year
138315,What are u guys gonna do for Halloween  Are you going to go outside in a costume and trick or treat or are you going to stay inside and give people candy or  other Me personally I m just gonna buy candy for myself and eat it all until I feel sick,0,What are u guys gonna do for Halloween  Are you going to go outside in a costume and trick or treat or are you going to stay inside and give people candy or  other Me personally I m just gonna buy candy for myself and eat it all until I feel sick,guy go halloween go outside costume trick treat go stay inside people candy personally go buy candy eat feel sick
138316,NICK IF YOU SEE THIS PLEASE DM ME i had this friend back in the summer but i had to leave them because i got grounded  i don t remember their username on reddit  but we met on this subreddit  their username had the words  some guy  in it but that s all i remember  nick  if you see this  can u pls dm me i wanna clarify why i had to stop texting on snap and how i know how good of a good friend to me   if anyone knows  pls tell me  thanks remi,0,Nick had to stop texting on snap because he got grounded. Nick met his friend on reddit. Nick wants to know why he had to give up texting with his friend because of the grounding. Nick needs to know how good of a good friend Nick is.,nick stop texte snap got ground nick meet friend geddit nick want know texting friend grounding nick need know good good friend nick
138317,Just another day in lockdown I wont bore you with my stupid little feelings  So tired of always being suicidal  Day   stuck in my house due to the virus  Day after day after day  Happy birthday to me,1,Just another day in lockdown I wont bore you with my stupid little feelings  So tired of always being suicidal  Day   stuck in my house due to the virus  Day after day after day  Happy birthday to me,day lock not bore stupid little feeling tired suicidal day stick house virus day day day happy birthday
