,text,class,summary,cleaned
108258,My life is spiralingIm   still in highschool  and tried to kill myself twice I first got depressed when i was about   i hated my class  i hated my body  i hated my memories and i hated my parents  I was a fat  depressed  unfunny piece of shit with no meaning of life  So I tried to kill myself  i wanted to jump off a bridge  but i didnt have to balls to do it   It only got worse the next couple of years  and when I was   I got denied many things   My first audition to become an actrice  which was fair  but I also failed an audition for a school play and I failed to get into a special english class  both I cared so much for   It only became worse when I thought of the future  I was sure I wouldn t get a job  and become a poor piece of shit  So I tried it once more  i came back to the same bridge  climbed over the railing  but I couldn t let go  I thought of my friends and even my family  which has caused me much trauma s This schoolyear was even worse  I got called names behind my back and I didn t even trust my friends  The whole year  every day    i thought of the trauma s my family gave me  I can t trust my family   I am too embarrassed to do anything when they are around  they laugh at me and my brother used to hit me everytime i stood up to him   I m seeing a psychiatrist now  but it s not working  I can t go to her when i am feeling sad or lonely  and I sure can t turn to my family  All I want is to feel happy once  just once  i don t want to commit suicide  but if I m spiraling more  I may just have to,1,Im still in highschool and tried to kill himself twice. My life is spiraling. I am seeing a psychiatrist but it's not working. I don't want to commit suicide but if I'm spiraling more I may just have to. ,high school try kill twice life spiral see psychiatrist not work not want commit suicide spiral
108259,Academical pressure is pushing my mind into suicidal thoughtsI m in my early  s A career is depending on my performance on the next exams I ve failed them partially  perhaps because I was naive and unlucky in some way   I have one try on those I ve already failed or I ll be kicked out of uni I m very scared  A lot of people  my family especially  are watching me closely  They don t trust me in doing enough for the exams   I feel stupid and dumb  even though I already attended a higher level of high school and graduated with good grades   I m falling apart  I have thoughts of suicide everyday because I fear to fail  I feel like I would be nothing if I can t even manage this  Why live  if you think of yourself as a disgusting  disposable failure  An utter disappointment   I haven t told anyone  not even my s o  even though he s a sweetheart and cares very much about me  But he knows so little about worries like this that I feel like he wouldn t understand   So thank you for listening  I needed this,1,A career is depending on the performance on the next exams. She has one try on those she has already failed or she will be kicked out of uni. She feels stupid and dumb even though she already attended a higher level of high school and graduated with good grades.,career depend performance exam try fail kick uni feel stupid dumb attend high level high school graduate good grade
108260,I swear some day I m going to get arrhythmia I m not aware of my dreams most of the time but when I am the always scare me awake the most common method is making me fall off of something like a cliff or building and when I hit the ground I wake up  Other times it s something stupid but falling off of a cliff is terrifying my heart rate increases significantly because it turns out contemplating your death while falling to it sucks,0,Some day I'm going to get arrhythmia. My dreams always scare me awake. The most common method is making me fall off of something like a cliff or building and when I hit the ground I wake up. Falling off of a cliff makes my heart rate increase.,day go arrhythmia dream scare awake common method make fall like cliff building hit ground wake fall cliff make heart rate increase
108261,Is everything just pain I read that we  as humans  only want to betray others  and will do so to feel better about ourselves with little to no regret at all We re all probably hypocrites  in various degrees but  we are  Every single year  no matter how much we try to avoid it  we piss off people  we break promises  we fail others and others fail us as well That s why I feel that nothing makes sense  Why only a few people feel like this  Why can most people have happy  fulfilling lives  without questioning their existence   Why do I feel like my entire existence has been nothing but lies and sadness   Sorry if this sounds selfish but  I wonder if I made a microscopic difference in the world surrounding me  I wonder if I truly managed to do something to prove my existence  and not just being someone who s easily forgotten  replaced and discarded,1,I wonder if my entire existence has been nothing but lies and sadness. I read that humans only want to betray others to feel better about themselves. I wonder if I made a microscopic difference in the world surrounding me. I want to prove my existence.,wonder entire existence lie sadness read human want betray feel well wonder microscopic difference world surround want prove existence
108262,YAY  IM QUARANTINED  That was   sarcasm,0,YAY  IM QUARANTINED  That was   sarcasm,quarantine sarcasm
108263,People who say cold is better than hot are fucking lying that shit makes no sense Cold you can t sit in the sun to avoid it  you need to wear a bunch of uncomfortable clothes and still be cold Like literally tell me how your dick and balls feel in cold weather when they shrivel up vs in warm weather  Enough said Plus tropical vacation places and shit we all know that s better than the snow  You don t have an unpopular opinion you are just wrong,0,"People who say cold weather is better than hot are lying. Cold weather is uncomfortable, you can't sit in the sun to avoid it, you need to wear uncomfortable clothes and still be cold, and tropical vacation places are better than snow.",people cold weather well hot lie cold weather uncomfortable not sit sun avoid need wear uncomfortable clothe cold tropical vacation place well snow
108264,bruh someone tell me how google classroom works i just logged into my friends account bc i wanted to do his work and   it says that there s no assignments  i checked to do  missing  and his classes  but hes missing like a hundred   amp x B does the work need to be in your drive or something  and uh also he lives in a different country idk,0,"Google classroom doesn't work for my friend's missing assignments. He lives in a different country and doesn't have access to the internet.    He is missing a hundred amp x B of work, so he needs to do it in his drive. ",google classroom not work friend miss assignment live different country not access internet miss amp work need drive
108265,I fucking hate my parents so much sometimes Sometimes I hate my parents so much  They just can t let me be my own person  If I ever do something I want to do  this includes talking about my interests  they criticise me and tell me how useless I am  not directly  but it s so obvious The moment I m not a little pretty perfect girl I m lazy  rude and aggressive in their eyes  Sure I might not be the most active person ever  but I m an athlete compared to some of my friends  Why do my parents always compare me so much  It s really annoying  Why can t I just be myself for a moment And they wonder why I spend so much time online I don t know what to say  honestly  Sometimes I hate them so fucking much and sometimes a love them   Why am I like this,0,Sometimes I hate my parents because they don't let me be my own person. If I do something I want to do they criticise me and tell me how useless I am. Sometimes I love them because they make me feel good about myself.,hate parent not let person want criticise tell useless love feel good
108266,Wouldn t it be great if we could erase ourselves from existenceJust like we never ever existed   It would save my family a lot of pain  And honestly  the thought of a funeral and people mourning me makes me cringe  I don t deserve to be remembered by anyone,1,Wouldn t it be great if we could erase ourselves from existenceJust like we never ever existed   It would save my family a lot of pain  And honestly  the thought of a funeral and people mourning me makes me cringe  I don t deserve to be remembered by anyone,great erase existence like exist save family lot pain honestly thought funeral people mourn make cringe don deserve remember
108267,My lil cousin is stupid  I just told my   y o cousin that Red Bull is just bull pee and he freaked out,0,My lil cousin is stupid  I just told my   y o cousin that Red Bull is just bull pee and he freaked out,oil cousin stupid tell cousin red bull bull pee freak
108268,I ve lurked this subreddit for a year  wanting to ask for help  but I was always too nervous  Now  I don t know where else to turn Hello there I ve been dealing with suicidal thoughts and tendencies for nearly four years  but I recently hit a wall I just can t get over alone  I woke up this morning with intent to hurt myself tonight  but I decided to try this first  Maybe one of you has some insight that ll help The nature of my problem is unrequited love  I m still really nervous  so I don t want to really discuss it in such an open spot  but maybe PMs would work better I don t know what else to say  and I need to submit this before I have second thoughts about asking  I m sorry if this is all a jumbled mess,1,Suicide is an unrequited love. I have been suicidal for 4 years. I want to ask for help but I'm nervous to discuss it in such an open spot. I need to submit this before I have second thoughts about asking. ,suicide unrequited love suicidal year want ask help nervous discuss open spot need submit second thought ask
108269,I feel like I m running out of time and I m going to lose everything I have been battling a Panic Disorder for   years and suffer from PTSD symptoms related to a near death experience  I went from a great career with a supervisory position to being on disability and housebound  I have fought my way back to being able to leave the house and travel short distances but time is taking its toll and the stress is building   My wife and I had a perfect marriage and now it s crumbling  I know if I could just overcome my anxiety and return to work it would take the emotional and  minimal  financial strain off or marriage and we would be great  I have a   yr old daughter that I love to pieces and the thought of shared custody and a broken household terrifies me  That s not the life I worked so hard to build for my family and this isn t the marriage I vowed to give my wife   I don t feel like acting on anything tonight   but I m afraid if my marriage falls apart before I get my anxiety under control enough to resume normal day to day work and household functions that I d rather take my own life than continue to fight a mental disability and have shared custody of my child   Please help me suicide proof my future and feel a little better about the mess I have gotten myself into,1,A man with panic disorder and PTSD is on disability and housebound. His marriage is crumbling. He has a daughter. He would rather take his own life than fight a mental disability and have shared custody of his child. He is asking for help.,man panic disorder pt disability housebound marriage crumble daughter life fight mental disability share custody child ask help
108270,Having a big nose is no excuse to not wear a mask I mean  I still wear underwear,0,Having a big nose is no excuse to not wear a mask I mean  I still wear underwear,have big nose no excuse not wear mask mean wear underwear
108271,Suicide and identity   note I left myself earlier Been thinking about this for a few weeks  Sat down to consider this earlier today  Sorry if the language gets pretentious   I never really post this kind of stuff  so this was mostly written for my eyes only  Felt the urge to share though Identity and Suicide Here you are   You have decided that you don t want to live anymore Why would you  You re sad  You feel broken  You feel a longing in your core at which you can t find a target   just a ceaseless feeling that something is missing  You feel unconfident   both in your abilities and in your body  Your future riddled with unsureness   where do I go next  Will I be happy there  How will things be different Will a beach fill a void Will spending paychecks on museums end your anxiety Probably not  I would imagine Thusly  you ve decided it s time to die  An ironic pursuit given your fear of death  though you gather it would feel better to answer that last question instead of live longer with a gnawing at your soul Camus asked   suicide or coffee  And you have decided for both I recognize that coffee doesn t sound all that bad  Perhaps a light snack I m at the Starbucks Reserve in Downtown  I ve not much money left  but I ll hop in line really quick Got some tea and some chips Anyway What if life doesn t equal existence If you want to end your life   what if you simply ended your way of living  Your where of living  Your why of living What if suicide was simply the death of the identity   and the rebirth of a new person in the same body Align thyself with a larger goal  Interest thyself in new pursuits  Change thine language and thine scenery  Rebuild thyself anew Should I decide to go   it will be obtained via shotgun to the head  In advance  prepare a living and a regular will  Prepare your room to be sanitized of mess and memory  as it will likely be left untouched for awhile  Try to do a few world positive things before you head out  Volunteer  write a book  help someone  Make your mark before you make your exit Thoughts,1,Suicide and identity note was written by a person who doesn't want to live anymore and decides to end his life. He is at Starbucks Reserve in Downtown and will get some tea and chips. He will go by shotgun to the head.,suicide identity note write person not want live anymore decide end life starbuck reserve downtown tea chip shotgun head
108272,Still thinking about suicideI feel like I should look for a therapist but I don t want to bc it ll be harder for me to get into the military  I don t really know how to put into words of how I feel  but I feel like I wanna die all the time  I wanna do   years in the military and move out of my moms house  but   years feels like a long time but I feel like it s also the only option unless I want to work a dead end job and stay with my mom  I m starting to get more and more depressed as the days go on and the more time I spend time in my moms house,1,I'm depressed and considering suicide. I want to do years in the military and move out of my mom's house. I don't want to go to a therapist because it will be harder for him to get into the military.,depressed consider suicide want year military mod house not want therapist hard military
108273,Detergent methodSo i tried the inert gas method   days ago  For whatever reason it didnt work obviously  Ive been reading about the detergent method of mixing   chemicals together in a confined space to make hydrogen sulfide  If enough is mixed together its deadly almost instantly  But cant find much information other than it was popular in japan,1,The detergent method of mixing chemicals together in a confined space to make hydrogen sulfide didn't work for me. It was popular in Japan. It's a deadly method if enough chemicals are mixed together and it kills almost instantly.,detergent method mix chemical confine space hydrogen sulfite not work popular japan deadly method chemical mixed kill instantly
108274,Good Jobs for Teens I m turning   soon  so what jobs would be good for me   Keep in mind COVID restrictions  I ve never had a job before  and I m pretty short if that interferes with anything,0,Good Jobs for Teens I m turning   soon  so what jobs would be good for me   Keep in mind COVID restrictions  I ve never had a job before  and I m pretty short if that interferes with anything,good job teen turn soon job good mind covid restriction job pretty short interfere
108275,I never asked to be here This is the be all end all argument for why it should be allowed for me to dip out of this hellish existence  Change my mind,1,I never asked to be here This is the be all end all argument for why it should be allowed for me to dip out of this hellish existence  Change my mind,ask end argument allow dip hellish existence change mind
108276,stand ho  impure broth r  alloweth us prayeth anon Our Daddy in Heaven    Hollowed by thy balls    Your succulent cum    Your cheeks be plump    On Earth as it is in Heaven Give us today our daily head    And forgive us our naughties    As we have also forgiven our kittens    And do not bring us into the temptation of the horny    But rescue us from Satan s luscious pp    For the horny and the dominance and the cum jar are yours forever Awomen,0,"Prayer for the horny and the dominance and the cum jar is answered with God's love and forgiveness for the naughties and for Satan's luscious cams.   ""Forgive us and save us from Satan's temptations""",prayer horny dominance cum jar answer god love forgiveness naughty satan luscious cam forgive save satan temptation
108277,I work in a hospitalI have to say  working through a global pandemic  and having to go through all the infection control precautions that come with working in a hospital while feeling almost constantly suicidal  is actually quite funny when you think about it   Of course  PPE is there to prevent spread to innocent people as well as to protect me  but I still think it s quite funny,1,I work in a hospital. I find working through a global pandemic and having to go through all the infection control precautions that come with working in the hospital quite funny. PPE is there to prevent spread to innocent people and to protect me. ,work hospital find work global pandemic have infection control precaution come work hospital funny pipe prevent spread innocent people protect
108278,Unpopular opinion  Kingdom Of The Crystal Skull is the worst Indiana Jones movie I don t care what all of you say  that nuclear fridge shit was stupid,0,Unpopular opinion  Kingdom Of The Crystal Skull is the worst Indiana Jones movie I don t care what all of you say  that nuclear fridge shit was stupid,unpopular opinion kingdom crystal skull bad indiana jones movie don care nuclear fridge shit stupid
108279,Rape is rape no matter if its a women doing it to a guy or a guy doing it to a women I see lots of stuff on the news where they will not use the word  rape  if its a woman committing the crime  and its pretty stupid,0,Rape is rape no matter if its a women doing it to a guy or a guy doing it to a women I see lots of stuff on the news where they will not use the word  rape  if its a woman committing the crime  and its pretty stupid,rape rape no matter woman guy guy woman lot stuff news not use word rape woman commit crime pretty stupid
108280,Lmao nice it s   If you know you know,0,Lmao nice it s   If you know you know,lao nice know know
108281,I would pay all my money to hire someone to kill meI ve been thinking about this for years and years I would gather all the money just to let someone come to my house and strangle me Ideally in the bed because I picture myself facing down and relaxed while he strangles me to death  using a very  very tight noose   and I will sleep the best sleep in my life everytime I think about this I m so fucking tired,1,I would pay all my money to hire someone to kill me. I picture myself facing down and relaxed while he strangles me to death using a tight noose and I will sleep the best sleep in my life every time I think about it.,pay money hire kill picture face relaxed strangle death tight noose sleep good sleep life time think
108282,Ok but like wtf is the rocky horror picture show Like why the fuck is it popular lmao  there has not been one part in the movie that I haven t thought what the fuck,0,Ok but like wtf is the rocky horror picture show Like why the fuck is it popular lmao  there has not been one part in the movie that I haven t thought what the fuck,like whf rocky horror picture like fuck popular lao not movie haven thought fuck
