,text,class,summary,cleaned
60800,Parents are not the only people with problems I know this sounds obvious but I just gotta say that it bugs the hell out of me when parents act like they re the only ones who can have problems and have the right to complain about their problems  Kids and teens can have problems in their lives as well and parents should hear us out instead of just ignoring us and thinking we re young and that the problems in our lives are silly and don t matter  Thanks for listening  I hope I m not the only one who feels this way,0,Parents are not the only people with problems. Kids and teens can have problems as well. Parents should listen to their children and teenagers instead of ignoring them and thinking they are too young to have any problems.    She hopes she isn't the only one who feels this way. ,parent not people problem kid teen problem parent listen child teenager instead ignore think young problem hope not feel way
60801,I really don t think I ll make it past  Hell  I barely see myself making it to my next birthday       Everyday  I wake up disappointed  Wishing I was dead just so the agony that is life would be over  So much shit has happened over the past year that I wish I had been successful when I tried  I could just be nothing instead of having to go through the trauma I ve gone through       In the past year  I ve had   people come forward  One of them being my abuser themselves  in a very public manner  about concerns about how I ve been acting  and that they think something is wrong  I dismiss them  while I know it doesn t dissuade them  it at least throws them off my trail like fake throwing a ball for a dog  What concerns me the most is I ve been suicidal for almost a decade now    The public part is what gets me the most  I feel like I m more of a talking piece rather than a sentient person  It makes me feel like I really don t have any reason to be here other than to be a topic that is eventually forgotten       I am to be forgotten  that is my role,1,"In the past year, many people have come forward accusing her of being her abuser. She dismisses them. She has been suicidal for almost a decade. She feels like she's more of a talking piece than a sentient person. She is to be forgotten.",past year people come forward accuse abuser dismiss suicidal decade feel like talk piece sentient person forget
60802,Cutting yourselfWhat s the safest way to cut yourself  I m new to the topic and i ve been going through some things and I thought cutting myself would be a good idea,1,Cutting yourselfWhat s the safest way to cut yourself  I m new to the topic and i ve been going through some things and I thought cutting myself would be a good idea,cut safe way cut new topic go thing think cut good idea
60803,monke cinematic universe We have a discord  dm me for link  full of monke,0,monke cinematic universe We have a discord  dm me for link  full of monke,monkey cinematic universe discord link monkey
60804,Just done reallyLife s getting too much   thinking writing this will  help but these thoughts have been lingering a while now   starting to feel comforted by the idea of not existing   can t tell anyone out of embarrassment can t go nowhere to seek help the people responsible for me downright refuse these issues and if anyone knew how I felt I would not be able to face the world,1,Life is getting too much for me and I feel comforted by the idea of not existing. I can't tell anyone out of embarrassment and can't go nowhere to seek help as the people responsible for me refuse to help me. ,life get feel comfort idea not exist not tell embarrassment not seek help people responsible refuse help
60805,how can i feel suicidal  yet i m afraid to die as a muslim  they told me to pray and fastjng during ramadhan and it will make me happy and i will not have any problem in my life  guess what  its not  i have a financial crisis in age   i dont have fulltime job  and still live with my parents  i dont know  to who and where i share my story  at least i can hear some opinion  i hope  this is the perfect sub for this  and please  stop me being suicidal,1,"As a Muslim, I am supposed to pray and fast during Ramadhan, but I have a financial crisis in age and live with my parents. I want to share my story so that I can hear some opinion. Please stop me from being suicidal. ",muslim suppose pray fast ramadan financial crisis age live parent want share story hear opinion stop suicidal
60806,I am a sixteen year old rapper producer from danmark and yesterday i released a new song  SAD BOY HOUR  BUT NOT REALLY  i hope you like it    THE SONG https open spotify com track UP BZbPky Kw NSWm Ya si n gdbX ITzudGnnB TEzWw,0,I am a sixteen year old rapper producer from danmark and yesterday i released a new song  SAD BOY HOUR  BUT NOT REALLY  i hope you like it    THE SONG https open spotify com track UP BZbPky Kw NSWm Ya si n gdbX ITzudGnnB TEzWw,year old rapper producer denmark yesterday release new song sad boy hour not hope like song open notify com track kwh new sin dix donna new
60807,Family hates meMy family hates me  The last people I felt loved me just told me they never wanted to see my face again  Idk what to do I want to die but I m too big a of a pussy to do it  Trying to get the balls to do it,1,Family hates meMy family hates me  The last people I felt loved me just told me they never wanted to see my face again  Idk what to do I want to die but I m too big a of a pussy to do it  Trying to get the balls to do it,family hate family hate people feel love tell want face not know want die big pussy try ball
60808,DAE feel like they could sense when someone is preparing to walk out of their life At this point I try not to think about the good memories i have with people in my life because i know they re leaving  It s probably for the best tho  they re just trying to get rid of a walking dumpster fire   I just wished they could come up with better excuses  You know  something other than the old  I just feel like we are at a different place in our life     I don t want to feel like I HAVE to do x and x   If you want to leave me just fucking leave,1,AE doesn't want to think about the good memories he has with people in his life because he knows they're leaving him. DAE wishes they could come up with a better excuse to leave him than the old one. He doesn't feel like he has to do anything.,not want think good memory people life know leave date wish come well excuse leave old not feel like
60809,Breasts suck titty boobs yes Breasts suck titty boobs yes Breasts suck titty boobs yes Breasts suck titty boobs yes,0,Breasts suck titty boobs yes Breasts suck titty boobs yes Breasts suck titty boobs yes Breasts suck titty boobs yes,breast suck titty boob yes breast suck titty boob yes breast suck titty boob yes breast suck titty boob yes
60810,So incredibly pissed off right now I was walking my dog  but around a quarter through her walk  I realised I didn t bring my phone  I didnt mind too much as I thought I didn t need it  Around half way through the walk  from a long ass distance away   I hear a dog whining  dog owners  you ll know what I mean  Immediately  I m very concerned and try to find the source  This lady was walking her dog  and the more I saw  the worse it got  She was absolutely dragging it along  mind you the collar was on it s NECK  don t know the gender of the dog so I m just going to call it  it  I mean like when it wanted to sniff something  she just dragged it along so it was almost choking  and its a very small dog  After half a second of thought I immediately try to discreetly follow this lady  After a while of her berating her dog for trying to sniff things  y know  the kind of thing a dog DOES ON A WALK  she noticed me following her so she crossed the road  I stayed on my side  because it would be obvious then  While she was trying to cross the road  SHE DEADASS DRAGGED THE DOG ACROSS  EVEN AS HE WAS WAILING  Honest to god I was so fucking pissed at this point and even other people that were walking also noticed this  but didn t say anything  I absolutely hate myself right now for not bringing my phone and recording it  so tommorow I m going to try to leave at the same time and see if I can catch her dragging her poor dog along  Will update if something happens  I also know she somewhat lives nearby  so I will set out a bit earlier than usual as she was coming back from the walk when I saw het,0,"A lady dragged her dog along a walk. The dog's collar was on it's neck and it was almost choking. She dragged it along even though the dog was trying to sniff something. When she was coming back from the walk, she dragged the dog across the road.",lady drag dog walk dog collar neck choke drag dog try sniff come walk drag dog road
60811,Goodbye  Dad It has taken almost   years to fully come to fruition and understand that I will never see you again I miss the  albeit dark  laughs that got us into trouble  I miss the hours we d spend chatting about everything and anything under the sun  I miss our coffee dates and walks by the beach  I miss watching wholesome baking shows with you  Heck  I even miss your long rants encompassing life lessons and nagging to wake up on time   We made a pact  that if one of us dies   we ll signal the other somehow in the afterlife  That signal never comes and my heart still aches thinking about this  knowing there s no coming back   Marriage and kids has never been up on my priority list  But knowing you ll never walk me down the isle  never meet my children and more immediately cannot celebrate life s biggest milestones weighs down heavily   I don t like to think back to the dark few months before you passed  but I do still wish I d told you how much I loved you and appreciated everything you did for me more  That you deserved and needed to take a break from caring for everyone and to take that time out for yourself  You took on the role of a father better than a stepfather should   Please  reach out to family and friends if you need help  This has broken me far deeper than I thought possible    years later and I ve accepted his death  but I will never stop wondering why and the hurt has yet to fade,1,It has taken almost years to accept that he will never see his father again. He misses his father very much. He wishes he could have told him how much he loved him more. He took on the role of a father better than a stepfather should.,take year accept father miss father wish tell love take role father well stepfather
60812,The definition of work smarter  not harder  https youtu be mVCC MBT bE t https youtu be mVCC MBT bE t,0,The definition of work smarter  not harder  https youtu be mVCC MBT bE t https youtu be mVCC MBT bE t,definition work smarter not hard youtube macc meet youtube macc meet
60813,my chest hurtsI want to die please all I do is cry and self harm   I keep relapsing and I feel so alone  I can t breathe  this hurts too much  I can only seem to express on here because everyone is tired of me being sad all the time  am I too negative  I just wish I can take a rope and end it already  I just cry everyday  I JUST WANT THE PAIN TO STOP AND THE WORLD IS JUST CRASHING AROUND ME  I CAN T DO THIS ANYMORE PLEASE NO ONE LOVES ME PLEASE I JUST WANT THE PAIN TO STOP,1,Everyone is tired of me being sad all the time. I just want the pain to stop. I want to take a rope and end it already. I can't breathe. I cry everyday. I feel so alone. I don't feel loved. ,tired sad time want pain stop want rope end not breathe cry everyday feel not feel love
60814,Body preparation I know what happens biologically  so to make it easier for the responders  I imagine in a bathtub  Should I not eat for two three days prior  and maybe not drink water for   hours  An exit bag should keep me from looking gruesome or painful  I m just wondering how to minimize the post death mess  Thank you,1,"An exit bag should keep the post-mortem mess from looking gruesome or painful, as well as a proper body preparation for the responders, such as not eating for two three days and not drinking water for hours before the death. ",exit bag postmortem mess look gruesome painful proper body preparation responder not eat day not drink water hour death
60815,I m in pain f   It s me again  I m sorry  I took   more meds and now my stomach hurts a little worse and i feel sick and to make it worse  my period cramps have shot up in pain  Like  fucking ouch everything hurts and i can t even move out of my bed without fkn pain but i will have to  to go to the bathroom incase  I fkn hate myself so much i just want to fucking die i can t do this anymore I am too scared to even go to a fucking hospital  I can t do this anymore  I fucking hate myself for literally everything  I m sorry,1,It's me again. I took more meds and now my stomach hurts a little worse and I feel sick. My period cramps have shot up in pain. I hate myself. I want to die. I am too scared to go to the hospital. ,take bed stomach hurt little bad feel sick period cramp shoot pain hate want die scared hospital
60816,Looking for my friend Around a year ago I had a friend in my coaching Aakash gwalior  his name is aditya and we were from tr  batch  Unfortunately I lost his number and because of covid our coaching was closed so couldn t meet him  So if aditya you are reading this and you know someone named Harsh Vardhan Pathak from Aakash coaching then please message me,0,"Harsh Vardhan Pathak is looking for his friend Aditya from his coaching Aakash Gwalior. He lost his number a year ago and couldn't meet him because the coaching was closed then. If he is reading this, he should contact Harsh.",harsh vaughan pathan look friend adit coach cash gwalior lose number year ago not meet coaching close read contact harsh
60817,Weight lossday     was an alright day  I had a cheat day and worked out twice as hard today  I was too tired to post that so I am here now doing so,0,Weight lossday     was an alright day  I had a cheat day and worked out twice as hard today  I was too tired to post that so I am here now doing so,weight loss day alright day cheat day work twice hard today tired post
60818,finally set a vague time of when i m going out There s no point anymore  when everyday is an uphill battle and you have no hope for the future  it s just impossible  It ll be some day in november  and i ll go out by poisoning  because you can extract nicotine from cigarettes to create poison  I want to make peace with my loved ones and write the note first  Other than that  all I want to do is meet my online friend irl and eat at this one special restaurant in chinatown with my friend cece   It s a shame  really  I had a chance to be good  but just like everything else I ruined it  I m so sorry mom    was as many years as I could go  but I m just not strong enough to hold on longer  I wish I could stay longer  I wish I could  but when every day is just so fucking hard  it s not worth trying  I m so sorry for doing this to you  I hope you move on  I wish I was stronger  It s not your fault  you did everything you could  I wanted to accomplish something in this life so you could remember me  but i m too pathetic  i m so sorry,1,In November I will go out by poisoning. I want to meet with my online friend and eat at a special restaurant in Chinatown with his friend Cece. I had a chance to be good but I ruined it. I am sorry for what I did to my mother.,november poisoning want meet online friend eat special restaurant chinatown friend cede chance good ruin sorry mother
60819,On the brink Lately I ve been feeling useless  I m a stay at home mom with an almost   and   year old  I have back problems that leave me bed ridden  crippling anxiety  and severe depression  The best part is that my husband makes too much for me to get any kind of reasonably priced help and not enough to lay for insurance  I ve been struggling with suicidal thoughts for as long as I can remember and tried to commit suicide several times but obviously they were not lethal enough  These past couple months have been hell  We relocated for my husband s work and it s been one big snowball effect between health and using the last bit of our savings  I can t even get my daughters  a birthday present this year  Every day it gets worse  I can barely get out of bed  I cry through out the day  I have several panic attacks  and I ve been researching all about suicide and finding an affordable gun  I love my husband and daughters but it s getting to the point where their laugh or smile doesn t make me smile even a little  I m pushing them away  telling them to play in their room  and locking myself up  I don t want to wake up in the morning  The only thing that s holding me back is that I know my husband would rather live in the shelter with our girls than find them a better home with a mother that can love them like they deserve and a father that doesn t have to devote   hours a week to work  come home at   am and sleep until   leaving only a couple of hours engaging with them daily  I want my girls to have something more  Someone who can properly love them  I don t even know where I m going with this  I have one friend but he just says stop being depressed  My husband doesn t know what to do and I just want to die Sorry for all the typos  I don t really feel like proofreading right now,1,Stay at home mom with a one-year-old daughter and back problems is depressed and suicidal. Her husband makes too much for her to get any kind of reasonably priced help and not enough to lay for insurance. They relocated for her husband's work. She can't even get her daughters a birthday present this year. She has several panic attacks and is researching suicide.,stay home mon year old daughter problem depressed suicidal husband make kind reasonably price help not lay insurance relocate husband work not daughter birthday present year panic attack research suicide
60820,Does it ever get better  Really I was diagnosed with major depression  anorexia and severe PTSD four years ago  and I have not been able to feel as though it will ever get better  I put on a show for those around me  make excuses   I m just tired   I m not hungry   I m just a bit cold   it s nothing important  all lies  I haven t gotten better at all  and I honestly can t see myself ever defeating this  I eat myself up everyday  multiple times a day  degrading myself  self harming  starving myself  thinking back on my suicide attempts  and never taking chances with other people in both making friendships and  in the rare case that I like someone  telling them  I m just not worthy of happiness or love  I mean  I want to take a chance  but who the fuck could love someone like me   Does it ever really go away  Is there ever going to be a day where I don t count calories  where I don t scream at myself  where I can truly believe that he wonderful people I socialise with think I m a nice person  and where I can stop thinking about the past  and a way to end the future  Or should I just give up  Because honestly  giving up seems like the better option right now  for everyone involved in my life,1,"I was diagnosed with major depression anorexia and severe PTSD four years ago. I eat myself up everyday multiple times a day, I self harm and I consider suicide. I want to take a chance but who the hell could love someone like me?",diagnose major depression anorexia severe pt year ago eat everyday multiple time day self harm consider suicide want chance hell love like
60821,Can you help me without Versus form a girl FUCK  CAN YOU DO THAT FOR STUPID BITCH,1,Can you help me without Versus form a girl FUCK  CAN YOU DO THAT FOR STUPID BITCH,help versus form girl fuck stupid bitch
60822,Does anyone know anywhere to ask questions related to coding I tried stackoverflow but everyone there just links other posts and votes to delete mine because my question actually takes some thinking,0,Does anyone know anywhere to ask questions related to coding I tried stackoverflow but everyone there just links other posts and votes to delete mine because my question actually takes some thinking,know ask question relate code try stack overflow link post vote delete question actually take thinking
60823,i want to be a servali want to be free  i want to be able to walk around and run and hunt without judgement  i want to have four legs to run at light speed through different terrain  i want to explore  not be locked up in my house  even before corona i was locked up  i couldnt cross the street  take a shower while my parents were gone  still cant  i still cant take even a walk around my house without having approval from my parents  ive always been locked up in a zoo and i just want to be free  my preferred way is to jump from a high place  i dont want to feel it happen  but then again im too afraid to get the freedom i ache for  what is wrong with me  ive made the decision to die a while ago,1,"Before corona, Servali was locked up in his house and couldn't take a shower without approval from his parents. Now he wants to be free and explore without judgement. He wants to jump from a high place, but is afraid to get the freedom.",corona serval lock house not shower approval parent want free explore judgement want jump high place afraid freedom
60824,if there was another subreddit similar to this one but brand new  would you go there instead let s say theoretically it was as active as this one but in the  new  sub you d have a chance to become  known,0,if there was another subreddit similar to this one but brand new  would you go there instead let s say theoretically it was as active as this one but in the  new  sub you d have a chance to become  known,sub edit similar brand new instead let theoretically active new sub chance know
60825,serious question  please dont judge  im just genuinely curious amp x B whenevr i masturbate i cum way faster if i open my legs really wide  if i have my legs closed i cant cum or get any pleasure  is that normal,0,serious question  please dont judge  im just genuinely curious amp x B whenevr i masturbate i cum way faster if i open my legs really wide  if i have my legs closed i cant cum or get any pleasure  is that normal,question not judge genuinely curious amp masturbate cum way fast open leg wide leg close not cum pleasure normal
60826,What did I do wrongI cannot believe how this past month has gone  I just don t know where to start  I will say it s not all been bad but something horrible and unspeakable happened this morning and I don t know if I ll recover  I feel too scared to be left alone and I can t sleep  I m just tired  I just want to sleep forever,1,This past month has been bad for her. Something horrible and unspeakable happened to her this morning. She is afraid to be left alone and she can't sleep. She doesn't know where to start and she just wants to sleep forever.,past month bad horrible unspeakable happen morning afraid leave not sleep not know start want sleep forever
60827,Why is   not called Onety one  Like there is no reason why it shouldn t be called onety one  it sounds better and it s the same as twenty one or thirty one or forty one,0,Why is   not called Onety one  Like there is no reason why it shouldn t be called onety one  it sounds better and it s the same as twenty one or thirty one or forty one,not call like no reason call sound well
60828,asking for help i ve come to the conclusion i need help with a problem that s really draining me mentally  i don t want to make a big post about it because i don t want to upset anyone who may come across it unknowingly  i don t want to hurt anyone or bring them down because of my problem  but if anyone likes picking people apart or listening to their problems  please dm me processing and understanding emotions isn t my strong point etc etc but i need to cry  i need someone to be blunt and real with me so i can fix my problems to everyone else  i wish you a wonderful day  try to smile  lt,0,A problem is draining her mentally and she needs someone to talk to her about it. She doesn't want to make a big post about it but needs someone who can be blunt and real with her so she can fix her problems.,problem drain mentally need talk not want big post need blunt real fix problem
60829,Doesn t feel like there s anything tying me to this world anymoreI like to watch the river flow  I can now be certain there s no one who cares about me  There is no goal in life  It s all just different ways to waste time  A person has no chance to use time in a meaningful way  since there s nothing meaningful to be done  The universe is fleeting  There is no reason to waste your time  Ending your time is the best way to avoid wasting time that you didn t ask for and don t know what to do with,1,There is no purpose in life and no one cares about you. Ending your time is the best way to avoid wasting time that you didn't ask for and don't know what to do with. The universe is fleeting and there is no reason to waste your time.,no purpose life no care end time good way avoid waste time not ask not know universe fleeting no reason waste time
60830,I just took a online test And i got   because some of the question teacher needs to grade and i nsome answers i frogot put    It means like   for exanple you know cuz u cant write like with pen on conputers  and or a forgot ro put   stuff like that irl in class teacher cares about those but she doesnt mark it wrong,0,The teacher needs to grade some of the questions on an online test. The answers that the teacher wants to grade are those that the student wrote on the computer instead of writing them with a pen. The teacher cares about those answers but she doesn't mark them wrong.,teacher need grade question online test answer teacher want grade student write computer instead write pen teacher care answer not mark wrong
