,text,class,summary,cleaned
132018,Just found out today how my parents really see me So there s talk about a job offer my dad got  one where he d basically be moving  but able to visit weekends   And he tells me  if it happens  I ll have to  step up I ve been a second mother in this house since I was   but I need to  step up I asked him how I needed to  step up  and he told me I need to actually get dressed  because wearing pjs at  home  when I m not going out anywhere is  bad Then he went on to say that he d be gone a lot  and I said   we ve managed before when you ve left And he said I ve given my mom hell too Who took care of the house  dogs  and my brothers AND my mom when she got depressed or sick  Me Who has never ever been allowed to have a bad day  Me I have mental illnesses seven ways to Sunday  and I m expected to be walked all over and mistreated and just take it and be okay with it I mentioned to mom I would apply to X place because Y place wouldn t hire me  and she got upset I later said I wanted to get a job because I didn t want to be living with them in my  s  no offense to anyone who still lives with their fam  but my fam are abusive so And she tells me  you might have to   live with us until you re  Because you can t make a living on X place pay Well dad made it out of X Yeah but he had experience to fall on So not only have they cheated me any kind of future by denying me just about everything you need to survive in this world  but they re also saying I m a waste of space who does nothing and basically it s my fault they did what they did to me If I don t get out soon  I will buy a gun and end myself once and for all,1,"There's talk about a job offer for her dad. If he gets it, she'll have to step up. She's been a second mother in this house since she was. She has mental illnesses seven ways to Sunday and she's expected to be mistreated. She wants to get a job because she doesn't want to live with her abusive parents.",talk job offer dad get step second mother house mental illness way sunday expect mistreat want job not want live abusive parent
132019,Literally memes about spooky season and among us died here so let s  Combine the two and have memes with among us characters dressed in Halloween costumes and have the ULTIMATE memes  Once monday comes around I better see some among us Halloween memes,0,Literally memes about spooky season and among us died here so let s  Combine the two and have memes with among us characters dressed in Halloween costumes and have the ULTIMATE memes  Once monday comes around I better see some among us Halloween memes,literally meme spooky season die let combine meme character dress halloween costume ultimate meme monday come well halloween meme
132020,Something wrong with me I keep trying to reach out to people with advice or anything kind  anybody  even online  and just getting negative reactions  People are arguing with lecturing me constantly  or flat out ignoring me  I m losing faith  It feels like I should just off myself but I don t want to risk failing that  I can have a short temper and can be a little to reactive  I m definitely not perfect  I m working on it but I don t understand why people s approach to me is so intense According to my psychiatrist and mom I m  getting better  yet my life is spiraling downward really fast  I am tired and just trying to help and love  and it backfires  I really don t understand the point  I know that social media plays a role in triggering me but it also calms me down  It s really frustrating I have ADHD  panic disorder and depression with bipolar tendencies  I have a feeling it s something else sometimes,1,"There is something wrong with me. I have ADHD panic disorder and depression with bipolar tendencies. According to my psychiatrist and mom, I'm getting better but my life is spiraling downward fast. I am tired and just trying to help and love and it backfires. ",wrong add panic disorder depression bipolar tendency accord psychiatrist mon get well life spiral downward fast tired try help love backfire
132021,Imagine not being old I just love my bald head and wrinkles,0,Imagine not being old I just love my bald head and wrinkles,imagine not old love bald head wrinkle
132022,making your titles extremely broad so when u delete the post people dont know what it was about   doggies are cute,0,making your titles extremely broad so when u delete the post people dont know what it was about   doggies are cute,make title extremely broad delete post people not know doggie cute
132023,When you free award yourself using an alt account intelligence,0,When you free award yourself using an alt account intelligence,free award alt account intelligence
132024,I m gonna say this and I don t care who knows I like soggy French fries  There I said it I can t hide from the truth any longer,0,I m gonna say this and I don t care who knows I like soggy French fries  There I said it I can t hide from the truth any longer,go don care know like soggy french fry say hide truth long
132025,IVE BEEN DRAWING ALL DAY AND MY HAND HAS LITERALLY GONE NUMB LIKE IM NOT EVEN EXAGGERATING HELP Edit  feeling had come back somewhat and I can now clench my fist,0,IVE BEEN DRAWING ALL DAY AND MY HAND HAS LITERALLY GONE NUMB LIKE IM NOT EVEN EXAGGERATING HELP Edit  feeling had come back somewhat and I can now clench my fist,draw day hand literally go numb like not exaggerate help edit feeling come somewhat clench fist
132026,Dont see no point in doing this anymore  years old  been living the same life day in and day out for the last   years  waking up eating and going back to bed  playing video games and listening to music  over and over again  Never finished high school  never had a job  a few one night stands but never a real relationship  had a troubled childhood and i remember thinking it would all work out and i would be happy someday but that day never comes  last   years been thinking heavily about ending my own life because i just dont see any meaning in living like this  if you could even call it living  Just wanted to spill my feelings for somebody to read  peace out,1,"""I don't see any point in living the same life for the last few years. Never finished high school, never had a job, few one night stands, never a real relationship, had a troubled childhood. I've been thinking about ending my own life recently.",not point live life year finish high school job night stand real relationship troubled childhood think end life recently
132027,I m sick of myselfI cannot stand my own thoughts or being in this body  I just need out  I need out of something and i don t know what  I know I am very unstable right now  I don t know what i want or need i haven t been able to breathe properly  It s like screaming into a vacuum and no one can hear it  i don t have anyone no one knows i exist anymore i am a burden   i want it all to end  i need an end  it hurts  hurts a lot  i hurt myself for kicks now because i dont have anything to lose,1,I am very unstable right now. I don't know what I want or need. I haven't been able to breathe properly. I hurt myself for kicks now because I have nothing to lose. I am a burden and I want it to end.,unstable right not know want need not able breathe properly hurt kick lose burden want end
132028,We all know we have fbi agents  But who are the fbi agents for the fbi agents,0,We all know we have fbi agents  But who are the fbi agents for the fbi agents,know fri agent fri agent fri agent
132029,Constantly thinking of suicide  Sorry for rambling I m always thinking about killing my self  Every day these thoughts are on my mind  like a song stuck in my head  But my life is good right now  things have gotten better  so why am I still so miserable  Am I just incapable of being happy  I m missing so much fuckin school  everyone there talks about me behind my back  No joke  I m a fucking outcast  even the people I trusted left after they found out about my mental illnesses  I really just want to kill myself  The only place I felt safe was in the mental hospital and I can t even afford that anymore  I m on so much pills  but it all still hurts  I m constantly breaking into tears  All my suicide attempts failed and I can t talk about it to anyone except to strangers on the internet   I think I m just broken,1,"Suicide is on her mind all the time. She misses school because of her mental illness. The only place she felt safe was in the mental hospital, but she can't afford it anymore. She's on a lot of pills, but it all still hurts.",suicide mind time miss school mental illness place feel safe mental hospital not afford anymore lot pill hurt
132030,Will my friends remember me I m a guy in my early  s diagnosed with mental illness  I don t want to die but it seems like that might be my only option at the end of the year I hope I make it to   Will my friends miss and remember me  The voices I hear in my head tell me that everyone hates me  I try to not listen  but it can be hard  I live far away from my friends but I try to talk to them at least once every   days  I hope the voices in my head are wrong  I hope I can make it  I know people s lives have to move on  but I want an answer,1,A guy in his early 20s has been diagnosed with mental illness and wants to die. He lives far away from his friends but tries to talk to them at least once every day. He wants to know if his friends miss and remember him.,guy early diagnose mental illness want die live far away friend try talk day want know friend miss remember
132031,Tomorow or next week I m gonna be dead can t take it much moreMy family is forcing me to start working everyday yet all I m thinking about is being free from this horribile prison life I feel strangulated by society and system I almost commited suicide with duct tape today I used the last bit of strength to get out Because I wasn t fully prepared,1,My family is forcing me to start working everyday. I feel strangulated by society and system. I almost committed suicide with duct tape today. I used the last bit of strength to get out because I wasn't fully prepared. ,family force start work everyday feel strangulate society system commit suicide duct tape today bit strength not fully prepare
132032,TW SHI m scared that i have tetanus  last week i ended up self harming pretty deeply and then i put glass that i found on the ground in it  the doctor did stitch it up and put me on antibiotics and i have had my tdap and a normal tetanus shot within the past year but i m still scared i could get tetanus  idk what to do,1,Last week Tish self harmed herself and put glass that she found on the ground in it. The doctor did stitch it up and put her on antibiotics. Tish has had her tetanus shot within the past year but she's still scared she could get tetanus.,week wish self harm glass find ground doctor stitch antibiotic wish tetanu shoot past year scared tetanus
132033,finally feel happyNow that I ve made a foolproof plan to end my life I feel so liberated  It s like all my anxiety and self loathing is gone because the uncertain future I spent so much time dwelling on is gone  I don t care what anyone says it s not like I don t want to get better  but the hopeless attitude I have is out of my control  Hopefully I don t have my school sending out emails mourning my death acting like they cared  Hopefully attention whores don t post bible quotes saying that I ll be missed  because if they truly cared they would ve missed me before I died  Fuck this shitty place and fuck mental illness I have found my solution and I really hope everyone else finds their own solutions as well  whether it be in the same manner as mine or not,1,I have made a foolproof plan to end my life and I feel liberated. I don't care what anyone says. I really hope everyone else finds their own solution to mental illness in the same way as I did. I hope they don't have their school sending out mourning emails.,foolproof plan end life feel liberate not care say hope find solution mental illness way hope not school send mourning email
