,text,class,summary,cleaned
182151,I named myself Mike Literus in Kahoot And I got first place  The podium never felt so good,0,I named myself Mike Literus in Kahoot And I got first place  The podium never felt so good,name mike liter cahoot get place podium feel good
182152,Psychiatrists are killing meAsk me my favorite color body and text removed for the sake of not spilling my guts all over the internet,1,Psychiatrists are killing meAsk me my favorite color body and text removed for the sake of not spilling my guts all over the internet,psychiatrist kill ask favourite color body text remove sake not spill gut internet
182153,Nobody caresMy post all get views but not many people actually say kind words  Life really is t worth living,1,Nobody caresMy post all get views but not many people actually say kind words  Life really is t worth living,care post view not people actually kind word life worth live
182154,i called a hotline and went to the hospitalyesterday i was on the phone with the community crisis centre  the girl on the phone told me she sent over the ambulance but   police cars showed up  they came onto my porch and sat with me until an ambulance showed up  there was like   people with me and all my neighbors were watching it was weird  someone who saw told my mom bc she showed up  i basically spent the day in the ER waiting for a psychiatrist to show up  i ve done this at the hospital before and it pretty much ended the same  they didn t want to hold me in a psych wart because i d be more anxious from that environment  they put me on a wait list for a councillor and sent me home  i ve actually been on this wait list before  for a year  they never called me  i guess my mental health isn t as at risk as i think  at least according to others  they asked me if i wanted to change my antidepressants which i said no because doing that would make me even more vulnerable until my mind gets used to them  i ve been at home all day today  my friends are all aware of the situation  no one has come to see me  i know it s selfish for me to want people to drop what they are doing to come see me  but i know they re with each other probably getting high  they want to see me tomorrow  is it bad i don t want to see them  i cant help but feel like a burden to them  it s a chore to visit me  i don t want to bring everyone else down with me  there is never a moment in life i feel sane  i feel as if i should try to kill myself late tonight  nothing ever ends good for me  my friends call me selfish and say i make everything about me and it s true  but i don t know how to stop and i d rather give up  im no ones responsibility and i cant help but feel like the world would be a better place for the ones i love once im dead,1,"At the community crisis centre, the girl on the phone told me she sent over the ambulance but police cars showed up on the porch and sat with me until an ambulance showed up. Yesterday she spent the day in the ER waiting for a psychiatrist to show up. She didn't want to change her antidepressants. She's been at home all day today and no one has come to see her. She doesn't want her friends to visit her.",community crisis centre girl phone tell send ambulance police car show porch sit ambulance show yesterday spend day wait psychiatrist not want change antidepressant home day today no come not want friend visit
182155,I don t know if I should continueEveryday is the same thing and I do the same stuff and even if I change stuff that will become the same thing,1,I don t know if I should continueEveryday is the same thing and I do the same stuff and even if I change stuff that will become the same thing,don know continue everyday thing stuff change stuff thing
182156,IgnoreMaybe I should stop looking for a painless way to do it and rather look for something that will  kill me I deserve to die painful anyway,1,IgnoreMaybe I should stop looking for a painless way to do it and rather look for something that will  kill me I deserve to die painful anyway,ignore maybe stop look painless way look kill deserve die painful
182157,My mind is torturing mei keep replaying this image in my head that he ll show up to my house with flowers and tell me he s sorry and that he wants to get back together but no i know there s   chance of that NOT happening  my brain sucks  i wish i could shut it off  i wish i could go back to being the stone cold selfish bitch i was before him  atleast then i wouldn t have to feel like this   i don t want to be here i want to die,1,He might show up at her house with flowers and tell her he's sorry and wants to get back together. She doesn't want to be here and she wishes she could go back to being the selfish bitch she was before him.,house flower tell sorry want not want wish selfish bitch
182158,No motivation anymore kill me kill me kill meI ve had anxiety as long as I can remember and depression I was diagnosed awhile back though maybe   or   years ago and I just don t feel right anymore I tried to get help for awhile I took medicine and regularly saw a consoler but in those years everything has fallen apart the medicine gave me side effects and I got scared and stopped taking them I later gained a fear of taking pills and then my consoler moved to another office one that my insurance didn t cover and I slowly lost all my friends and my only friend  my girlfriend  broke up with me a couple months ago said we were on break and I call her two months later and she decided she could never be with me romantically again and already has someone new and now it feels like I have nobody I can barley shower or get out of bed anymore cause of everything my grades are terrible and I m too stupid to get anything right I m talentless and have no passion in life I used to enjoy reading sometimes and doodling but now I just get mad I feel sad and mad everyday I feel like I m going to freak out and punch something I hate my shitty school consoler I hate the teachers who think I m lazy I hate my mom for thinking I m lazy I m mad mad mad mad mad I feel like punching myself in the face most days I feel so utterly lonely someone kill me,1,"I was diagnosed with depression and anxiety a few years ago. I tried to get help for awhile, but the medicine gave me side effects and I lost all my friends. My girlfriend broke up with me two months ago and she has a new boyfriend. My grades are terrible and I'm depressed. ",diagnose depression anxiety year ago try help awhile medicine give effect lose friend girlfriend break month ago new boyfriend grade terrible depressed
182159,When can we post pictures Is there a rule I should know about cuz yesterday we were allowed but not today tf going on,0,When can we post pictures Is there a rule I should know about cuz yesterday we were allowed but not today tf going on,post picture rule know cut yesterday allow not today go
182160,I ve never really felt happy  and I m worried that I never willI was raised in a very religious family  but early on in my adolescence I realized I was gay  It was jarring and it cut me off emotionally from my family  I had always been a quiet and awkward kid  so I didnt really have anyone else to turn to for support  so I just sorta receded into myself  I ve never really been that emotionally open with the few friends I do have  I told myself that when I moved out everything would change and I d come out of my shell and grow into a stronger person  but I moved into an apartment with a couple friends six months ago and nothing s really gotten better  I started drinking and smoking weed to cope with everything but I still feel miserable and hopeless  I still feel like I ve devastated my family by leaving their church  and I havent even told them I m gay  and I think being so reclusive during my adolescence robbed me of the chance to mature emotionally,1,"In his teenage years, when he found out he was gay, he became reclusive and introverted. He moved into an apartment with a couple of friends six months ago, but he still doesn't feel happy. He doesn't want to tell his family that he's gay.",teenage year find gay reclusive introvert move apartment couple friend month ago not feel happy not want tell family gay
182161,Ik no one cares but my tack ir   is supposed to arrive today I m exited as fuck to get this shit,0,Ik no one cares but my tack ir   is supposed to arrive today I m exited as fuck to get this shit,no care tack suppose arrive today exit fuck shit
182162,I can t sleep  it s   I know sleeping tonight is out of the question And it s my fault  I stayed up too late and now not even melatonin pills can put me to sleep,0,I can t sleep  it s   I know sleeping tonight is out of the question And it s my fault  I stayed up too late and now not even melatonin pills can put me to sleep,sleep know sleep tonight question fault stay late not melatonin pill sleep
182163,Imaginary internet points That is all and don t forget to drink water and do your homework,0,Imaginary internet points That is all and don t forget to drink water and do your homework,imaginary internet point don forget drink water homework
182164,I know what I have to doI have a bottle of wine and ativan just sitting there waiting  I know if I took all of that I d be able to go  I m just laying in bed waiting  Waiting for anything  Maybe waiting for God to come down pluck me up and tell me it was all a cruel joke and they re sorry I m tired of everything  Tired of nobody caring and feeling so alone and cold in this life  Tired of feeling abnormal in everything I do  I just want to quit this cruel joke called life  I want to quit the constant rejection over and over  I want to quit on a future that looks more grim and shitty than I could have ever imagined  I want to quit on hoping anything will get better  because it never does  It just gets worse  It keeps getting worse  And when there s some sliver of hope  Nope  that was just there to give you some wind so that when cold hard reality slams you back down it hurts even more This has been my life  Just becoming broken more and more  Every day I feel lower  And I think and say  what if I did this  and  what if I did that  And try and think of solutions  but in the end it doesn t even matter  Because nothing matters  What s the point of doing anything  I don t even know why I m here  Why I m alive  I m just going to die eventually anyways  Why wait  So I can have a bunch of shitty things happen to me  So I can be depressed for another   odd years  So I can watch myself age into nothingness There is no point  There s only death  And I would rather die now  It will hurt  But it would hurt in   years anyways  At least now I won t have to suffer  Please God I just don t want to suffer anymore,1,There is no point in living. I don't know why I'm alive. I would rather die now than wait for a better future. I want to watch myself age into nothingness. I'm tired of everything and I'm going to die.,no point living not know alive die wait well future want watch age nothingness tired go die
182165,Deeply concerned for a friendhello SW   let me start off by saying im completely new to reddit  i browse occasionally  and a lot of my friends have accounts  however  i made an account today because a  i want to and b  i found this subreddit and i thought it d help me with a rather large problem  my best friend has manic depression  bipolar  probably schizophrenia  etc  and above all  she s extremely suicidal  she s easily triggered  and i try my best to be there for her all the time  i think i do a pretty good job of it  she has  had  a boyfriend  they were in love  i swear  big age gap  but that s beside the point  today  they got into a really big fight and she was triggered  she said a zillion times that she wants to die  but this time she was really explicit about it  she was screaming at the top of her lungs  she couldn t even breathe at times  she was saying specifically how she d do it  all that  i m one of the only people  besides her boyfriend  that can knock some sense into her  i feel like today  though  i couldn t  i just can t convince her anymore  she s basically set  thank god im close with her family because i told her mom to keep a real close watch on her  i feel like i can t help her anymore  and i don t know what to do  any advice  thanks in advance,1,"SW is worried about his suicidal best friend. She has manic depression, bipolar and probably schizophrenia. Today she had a fight with her boyfriend. SW can't convince her to stop thinking about suicide. SW is new to reddit and wants to help his friend.",worried suicidal good friend manic depression bipolar probably schizophrenia today fight boyfriend not convince stop think suicide new geddit want help friend
182166,Anyone else actually suffering from depression and anxeity but fam thinks it s normal Like they do love me and care for me but they don t understand man They don t understand that it s hard for me to get out of bed keep proper hygiene Concentrate on studying Do any physical work And then they say  everyone goes through it you just need to put in more effort Fuck life man I hate it here,0,"Fam thinks depression and anxiety is normal. They don't understand that it's hard for him to get out of bed, keep proper hygiene, concentrate on studying and physical work. They say everyone goes through it and you just need to put in more effort.",fam think depression anxiety normal not understand hard bed proper hygiene concentrate study physical work go need effort
182167,They wouldn t care Thinking curiously over the prospect of me forcefully treating myself to a vacation over in the popular destination After Life  I ve come to a rather solid conclusion No one would care Let me lay out the cards  here  Picture a loser who s equipped with gangly hair and a freakish body  This lowly manchild had   or so  friends  but picture scenarios in which these  friends  ignore our faithful hero  lowly loser  and  in fact  would not severely be affected by lowly loser s untimely death By the way  I m the lowly loser  Thought I d clarify that After much internal debate  I could only settle on the belief that my suicide would lift a burden off of their sore backs  so to speak  Gone are the days of having to deal with their  undesirable  in the group  they are free  Sure  they ll have to fake somber and regret for awhile  public appearances and what not  and they may even engage in a depressing circlejerk where they all take turns discussing how they could ve done  this  or  that  all while they truly know that they are content with not doing  this  or  that  as it saved them quite the trouble It s really quite depressing  It s not something that exactly inspires a sort of will to exist  eh  Perhaps tonight s the night,1,No one would care about a loser's suicide. The loser's friends would not be affected by his untimely death. They would be happy not to have to deal with the loser's undesirable in the group. The losers are free to do as they please.,no care loser suicide loser friend not affect untimely death happy not deal loser undesirable group loser free
182168,I fucking masturbated to the final fantasy XIII coverart Umm I was bored recently and all my friends were busy so I decided to tidy up my room and throw away donate my old childhood things  I used to own a ps  back in the day with many awesome games like lego star wars  uncharted   and final fantasy XIII  I felt the nostalgia when I looked at the various coverarts and then I came across my old final fantasy XIII game  The coverart is basically the main character named lightning holding her swoard and just standing in front of a white background  Nothing special about that  But she was my first crush and idk  I wanted to replay the game so badly but my ps  got broken a long time ago  I was just sitting there  holding the game in my hand and got incredibly horny  So I just took it with me in the shower and wanked my yeehaw to the coverart and using parts of my imagination  I m not good at rubbing my love stick with my imagination  and fucking busted nono sauce all over the place  Anyway I feel bad that it just took a single coverart of a game to trigger that in me  Have a good day,0,I masturbated to the final fantasy XIII coverart. I used to own a ps back in the day with many awesome games like Lego Star Wars uncharted and Final Fantasy XIII. I wanted to replay the game but my ps got broken long ago.,masturbate final fantasy xii cover art day awesome game like lego star war uncharted final fantasy xii want replay game got break long ago
182169,How do one cope with constant rejection Sometimes I look at my meal and think instead of me some starveling kids from Africa or somewhere should eat this  maybe they have what it takes to cope with this life,1,How do one cope with constant rejection Sometimes I look at my meal and think instead of me some starveling kids from Africa or somewhere should eat this  maybe they have what it takes to cope with this life,cope constant rejection look meal think instead starve le kid africa eat maybe take cope life
182170,Last time I tried to cut myself to kill myself I failedBut this time I have a sharper blade and I know what to do to do better  i really wanna do it  I feel like I m st  a dead end  I just wanna fucking end it,1,Last time I tried to cut myself to kill myself I failedBut this time I have a sharper blade and I know what to do to do better  i really wanna do it  I feel like I m st  a dead end  I just wanna fucking end it,time try cut kill fail time sharp blade know well want feel like st dead end want fucking end
182171,My day of birth is upon me I don t have skirts or mustard but I have a balloon And a cake,0,My day of birth is upon me I don t have skirts or mustard but I have a balloon And a cake,day birth don skirt mustard balloon cake
182172,I m feeling overwhelmed Hey everyone  I don t know if this fits here but I m   years old so I guess it does  I am kinda overwhelmed by my feelings right now  Two days ago my parents told me that they wanted to divorce  A few days before I got my first girlfriend  I don t know what I m expecting but I guess I just wanted to share  I hope you all have a great day,0,"Two days ago, my parents told me that they wanted to divorce. A few days before that, I got my first girlfriend. I don't know what I'm expecting, but I just wanted to share some of his feelings.",day ago parent tell want divorce day get girlfriend not know expect want share feeling
182173,Posting something every day until I decide not to  day three So this is day three of this  I will likely post a meme or something for this tomorrow so I don t have to add in the awkward dialog  So yeah day three,0,Posting something every day until I decide not to  day three So this is day three of this  I will likely post a meme or something for this tomorrow so I don t have to add in the awkward dialog  So yeah day three,post day decide not day day likely post meme tomorrow don add awkward dialog yeah day
182174,i m sad because my best friend lives so far away   a year ago  i met my best friend on the internet  we facetime everyday for hours on end  we text   we have so much in common  and they re really funny  i m proud to call them my best friend   they live in the next state over  so obviously we can t hang out frequently  i m gonna meet up with them when this whole pandemic is over  but i wish they were closer   i wanna run around the streets at night  screaming the words to our favorite songs with them  i wanna take them to the record store  i wanna walk around town with them and be stupid  i wanna make patches and spin records them  i wanna cut up old pairs of jeans and put pins in them with them   it s stupid how far away we are from each other,0,"A year ago I met my best friend on the internet. We Facetime every day and text every day. They live in the next state over. I want to meet up with them when the pandemic is over, but they live so far away.",year ago meet good friend internet face time day text day live state want meet pandemic live far away
182175,It all fades  but it s so strong right nowI have this really horrible compulsion to either be kicked in the head or give myself a concussion somehow  I can t do that  obviously  but I want to hurt myself in some sort of bombastic way  It s most definitely due to my meds because I accidentally skipped two doses  it s hard to tell what day it is and I just forgot  But  now  I just want to do horrible things  I don t know what I mean by this post  I just had to say something because my skin is crawling and I feel awful,1,The compulsion to hurt myself is very strong right now. It's probably due to the fact that I accidentally skipped two doses of my medication. Now I just want to do horrible things and I don't know what I mean by this post.,compulsion hurt strong right probably fact accidentally skip dose medication want horrible thing not know mean post
182176,SavedI am a full rage suicidal but this new eminem album has given me some new courage and enthusiasm  Fuck everyone else  I m the G O A T,1,SavedI am a full rage suicidal but this new eminem album has given me some new courage and enthusiasm  Fuck everyone else  I m the G O A T,save rage suicidal new eminem album give new courage enthusiasm fuck
182177,Does anyone know what time the new Attack On Titan episode comes out  I really wanna watch it but I have no idea when it comes out  I m watching the series on Funimation if it makes any difference,0,Does anyone know what time the new Attack On Titan episode comes out  I really wanna watch it but I have no idea when it comes out  I m watching the series on Funimation if it makes any difference,know time new attack titan episode come want watch no idea come watch series animation make difference
182178,I just wanna come home  said the astronaut  So come home  said ground control So come home  whispered the stars,0,I just wanna come home  said the astronaut  So come home  said ground control So come home  whispered the stars,want come home say astronaut come home say ground control come home whisper star
182179,International women s Day is pretty dumb and pointless in Western society  change my mind Yeah  I think that in the west  the whole idea is pointless I can t really think that it has any kind of purpose  you re welcome to change my mind in the comments,0,International women s Day is pretty dumb and pointless in Western society  change my mind Yeah  I think that in the west  the whole idea is pointless I can t really think that it has any kind of purpose  you re welcome to change my mind in the comments,international woman day pretty dumb pointless western society change mind yeah think west idea pointless think kind purpose welcome change mind comment
182180,Suicide is badass DAE feel like people who commit suicide are basically strong and brave  I mean i wanted to commit suicide for a long time   but i never really could cause i am a freakin coward who doesn t have control over his life I am such a coward who can t even kill myself to end the suffering because i am scared of the pain and death so the people who really do it are basically brave atleast for me,1,AE feels that people who commit suicide are strong and brave. DAE wanted to commit suicide for a long time but he couldn't do it because he is scared of the pain and death. He considers himself to be a coward who can't kill himself.,feel people commit suicide strong brave date want commit suicide long time not scared pain death consider coward not kill
182181,I finally wrote my notes I ve been thinking for a while about what I wanted to say and who I wanted to write to  I finally decided on just my parents and my girlfriend  It hurt a lot to finally put my feelings into directed words but at the same time I feel kind of numb to it  What hurts the most is knowing the affect the it will have on them  As much as I want to tell myself that they will move on and find happiness elsewhere I feel as if it isn t true  Am I being selfish for making these plans  Is it my fault  Is it even anyone s fault  I don t know  All I know is that I m sorry  Im sorry to anyone who cares about me  The last thing I want to do is hurt others  especially my loved ones  but I just don t feel like I belong here anymore  Thanks to anyone who took the time to read this  And sorry for posting twice in the same night  Mind has been active tonight,1,"I wrote a letter to my parents and girlfriend. It hurt a lot to put his feelings into directed words, but at the same time I feel numb to it. I don't feel like I belong here anymore. I'm sorry to anyone who took the time to read it.",write letter parent girlfriend hurt lot feeling direct word time feel numb not feel like belong anymore sorry take time read
182182,Bruh you can block yourself on reddit Peepeepeepeepeepeepeepeepeepeepeepeepeepeepeepeepeepeepeepeepeepeepeepeepeepee,0,Bruh you can block yourself on reddit Peepeepeepeepeepeepeepeepeepeepeepeepeepeepeepeepeepeepeepeepeepeepeepeepeepee,brush block geddit peepeepeepeepeepeepeepeepeepeepeepeepeepeepeepeepeepeepeepeepeepeepeepeepeepee
