,text,class,summary,cleaned
201151,Posting a song everyday because why not  day   Japan   Throttle Bro rocket league soundtrack do have song bops Daily songs playlist  https open spotify com playlist ZilHBTxSNf kgaT UaReu si YA rS Q abv yQ JHflA,0,Posting a song everyday because why not  day   Japan   Throttle Bro rocket league soundtrack do have song bops Daily songs playlist  https open spotify com playlist ZilHBTxSNf kgaT UaReu si YA rS Q abv yQ JHflA,post song everyday not day japan throttle bro rocket league soundtrack song bop daily song playlist open notify com playlist zilhbtxsnf kat year abby fla
201152,Fear about getting helpI m getting worse I m not having the feelings yet again but I m getting bad  sever recurrent depression ocd anxiety panic attacks ptsd  I look around and my life is falling apart I think I m doing better then I see around me and see I m worse  I don t have insurance but even if I wait until I have feelings I ll end up back in place for   days  It almost sounds so nice  But I don t want to miss time with my daughter  Miss making money to pay for my stuff etc  I just want to feel normal and accomplish my goals  So my delima is what do I do  I know I need help  I don t know how I don t want to wait then if I do I don t want to be that bad again because it just makes me look really bad  I ve never felt this hollow empty and distant but atleast not suicidal yet  I fear reaching that point again  Having uncontrollable thoughts,1,I am depressed. I don't want to wait for the feelings to come back. I want to get help. I am afraid to wait as I might not be able to pay for the things I need. I have never felt this empty and distant before.,depress not want wait feeling come want help afraid wait not able pay thing need feel distant
201153,I m at work  so you must  Tell me a fun fact about yourself and tell me about your day  If your day was bad  you can DM and vent to me,0,I m at work  so you must  Tell me a fun fact about yourself and tell me about your day  If your day was bad  you can DM and vent to me,work tell fun fact tell day day bad vent
201154,My laptop be eating all the wifi By the time you see this post the download will most definitely be done,0,My laptop be eating all the wifi By the time you see this post the download will most definitely be done,laptop eat wifi time post download definitely
201155,Y all ever just wake up in a terrible mood and then feel guilty for being in a bad mood I literally woke up in tears and everything is just pissing me off and now I m crying again but it s making me feel so pathetic and stupid what the fuck is my problem this is why nobody likes me,0,Y all ever just wake up in a terrible mood and then feel guilty for being in a bad mood I literally woke up in tears and everything is just pissing me off and now I m crying again but it s making me feel so pathetic and stupid what the fuck is my problem this is why nobody likes me,wake terrible mood feel guilty bad mood literally wake tear piss crying make feel pathetic stupid fuck problem like
201156,I don t even know why I m still aliveI have a chronic illness called cyclic vomiting syndrome  Imagine feeling nauseated   of days and throwing up   of them  Actually you can t imagine it because I know I couldn t until it happened to me  It can strike at any time and my anxiety is crazy worrying that I ll just start another episode at the worst time  My teeth are wearing away from the vomiting  I am agoraphobic  because if I were to leave the house I might end up uncontrollably puking and passing out while stuck somewhere that isn t my home There is no cure  My body has given up on me   I had such big dreams for my life  I was going to be a playwright  Now I can barely focus to write because the nausea is so intense  I ve tried many anti emetic medications but nothing has worked I ve been going through the alt suicide holiday file on methods and I m thinking of tossing myself off a cliff near my house  it is sufficiently high    stories  That d finish things pretty quickly I can still read so I ve been reading  That s the only thing that keeps me going because I m very lonely and my anxiety is torturous  All I can do is try to distract from it,1,Cyclic vomiting syndrome is a chronic illness that makes one nauseated and vomiting for days at a time. There is no cure for it and there is no relief from the anxiety. The only thing that keeps him going is reading.,cyclic vomiting syndrome chronic illness make nauseate vomit day time no cure no relief anxiety thing keep go read
201157,Daddy issues Can someone pleaseexplain this to me  Why  Why the actual fuck does it feel like my  Dad  is more like a distant uncle that doesn t really like me Like i have tried so many times to make him happy  but it s all in vain  Like i try so damn hard to please him but nothing  i can get a fucking A  on a test and yet  nothing  and when i try to help him with stuff i never complimented for helping him  he just criticizes everything that i do  And when i do something that i am passionate about he doesn t even care at all  And when i try to tell him this he just gets so damn mad At this point i am just lost  i don t know what i expect from posting my problems on reddit  but i was just hoping maybe a few people may have some advice for me or may find themselves in a similar situation Sincerely   yr old boy currently crying in his room on the norwegian countryside,0,My dad doesn't like me. I try so hard to please him but it's all in vain. He criticizes everything that I do and doesn't care when I do something that I am passionate about. He gets mad when I try to explain this to him. ,dad not like try hard vain criticize not care passionate get mad try explain
201158,Why can t we just leave people to be do what they want  why do you care if someone else is gay Trans   Let people do what they want ffs  they are not bothering anyone,0,Why can t we just leave people to be do what they want  why do you care if someone else is gay Trans   Let people do what they want ffs  they are not bothering anyone,leave people want care gay tran let people want off not bother
201159,So last night I had this weird dream I was in my living room playing my DS and I just took a bite out of it I thought that it tasted good so I kept eating it and I was telling people that I had ate one before so it was fine eventually I ate the entire top screen and thats when I realized that I had just ate my only DS  and I started to cry because I grew up with that DS  And now that I m awake I kind of wonder what my DS would taste like,0,"Last night I had a dream that I ate my DS. I started to cry because I grew up with that DS. Now that I'm awake, I wonder what my DS would taste like and I wonder if I would like to have one.",night dream eat start cry grow awake wonder taste like wonder like
201160,i can t shake the urge to try to kill myselfthings in my life right now aren t actually too bad but if anything it just feels like a sign that everything is about to start spiralling downwards again and i just can t get the thoughts of suicide out of my head and i m currently at a friends place right now but i feel almost completely certain that when i get home i m going to make another attempt and somehow it makes me feel calm that maybe i don t have to continue with the mundane daily activities i occupy myself with anymore,1,i can't get the thoughts of suicide out of his head. i can't shake the urge to try to kill myself. i'm currently at a friend's place but I'm almost certain that when I get home I'm going to make another suicide attempt.,not thought suicide head not shake urge try kill currently friend place certain home go suicide attempt
201161,Day   of asking mods questions u Git Commit Die  why you want to commit die,0,Day   of asking mods questions u Git Commit Die  why you want to commit die,day ask mod question git commit die want commit die
201162,No kids I am constantly in limbo of whether or not I ll kill myself  I can imagine ordering what I need to die today and imagine living a long life within hours of each other   One thing that has changed is my plans of having kids  When I think of the future they are no longer present What if I finally decide to die and I have a kid or two  Knowing I d hurt my current family and bf is enough  I don t want to fuck up who I brought into the world   Has anyone else decided kids aren t a part of their future plans,1,No kids is not part of my future plans. I don't want to hurt my current family and boyfriend if I have kids. I can imagine ordering what I need to die today and imagine living a long life within hours of each other.,no kid not future plan not want hurt current family boyfriend kid imagine order need die today imagine live long life hour
201163,I ve been thinking of suicide for a while So I have a really small penis and I have done everything to compensate  I have a great body  I give great oral and I m good with my hands and I also try to be a good partner   But despite all of this I can never hold a relationship and the girls almost never talk to me after sex   I need surgery to bring me up to average but that s not possible  I m possibly thinking of suicide,1,"A man with a small penis is considering suicide because he can't hold a relationship because girls don't talk to him after sex. He has a great body, a great oral gift and is good with his hands and hands, but he has a very small penis.",man small penis consider suicide not hold relationship girl not talk sex great body great oral gift good hand hand small penis
201164,Why the fuck is  VoreDay a thing  I hate this planet honestly and I intend to kill God for allowing this to happen,0,Why the fuck is  VoreDay a thing  I hate this planet honestly and I intend to kill God for allowing this to happen,fuck day thing hate planet honestly intend kill god allow happen
201165,Lmfao my sister had her first kiss yesterday please congratulate her lmao i don t know the exact circumstances it happened but yeah afterwards her and her boyfriends family had a bonfire and she tucked his nephews into bed and it was all cute and shit lmao,0,Lmfao my sister had her first kiss yesterday please congratulate her lmao i don t know the exact circumstances it happened but yeah afterwards her and her boyfriends family had a bonfire and she tucked his nephews into bed and it was all cute and shit lmao,lao sister kiss yesterday congratulate lao don know exact circumstance happen yeah boyfriend family bonfire tuck nephew bed cute shit lao
201166,FUCK THIS SHIT WOOHOO JUMPING OFF A CUNT FUCKING BRIDGE LETS DO IT MOTHERFUCKER Going to jump off the highest bridge in my fucking city I don t give a fuck anymore virgin rejected by   women  failing life  no social life  everyones beating me even kids cause their graduating and im just a rotting fucking cunt in an apartment doing fuck all with my life yay white people getting bitcoin getting fucking rich fucking hot white chicks I DO NOT GIVE A CUNTING FUCK ANYMORE BANG BANG BANG MOTHERFUCKER  I DONT GIVE A SHIT,1,"""I'm going to jump off the highest bridge in my city. I don't give a fuck anymore. I'm a virgin rejected by women failing life, no social life, beaten by people, kids graduating and I live in an apartment. White people are getting rich.",go jump high bridge city not fuck anymore virgin reject woman fail life no social life beat people kid graduate live apartment white people get rich
201167,I can hear my mom having sex I m playing music but I m still super uncomfortable  Also I have no idea who she s fucking I get that she can do whatever she wants but I m still super uncomfortable lol,0,I can hear my mom having sex I m playing music but I m still super uncomfortable  Also I have no idea who she s fucking I get that she can do whatever she wants but I m still super uncomfortable lol,hear mon have sex play music super uncomfortable no idea fucking want super uncomfortable low
201168,Here s another low quality meme Somebody Is having an existential crisis r teenagers r im andthisisdeep,0,Here s another low quality meme Somebody Is having an existential crisis r teenagers r im andthisisdeep,low quality meme somebody have existential crisis teenager antis deep
201169,The therapist didn t want to listen to me talking about my suicide attemptIt only further strengthens my need to commit succesfully in order to make anyone care about me  I m so incredibly done with people  I m so sick of people telling me to  get help  when there is no help  This is what happens when i  get help  Some therapist who just wants to move on to the next client sort of half listens  but then quickly shuts you up and sends you out as soon as more serious things come up  I ve been feeling really tired lately,1,The therapist didn't want to listen to me talk about my suicide attempt. I'm tired of people telling me to get help when there is no help for me. I want to commit suicide to make anyone care about me. ,therapist not want listen talk suicide attempt tired people tell help no help want commit suicide care
201170,I m so tired of being in this cycleFor the past couple years I ve been in this cycle of hating myself for past mistakes then slowly building myself up only to continue to hate myself  I hate myself for tons of different things  I get paranoid about everything  Like when I was a lot younger and fooled around with my sister  now I m afraid that I molested her and left her scarred traumatized  I don t know what to think  I have constant anxiety attacks and I can t take it  College is right around the corner and I don t even want to think about it  I just feel like I ve brought others a lot of pain and no joy  I can t stand it  I don t know how I d kill myself  but it just feels so tempting  I should seek therapy but I m terrified of asking my parents about it  Suicide just feels like the way out  I sometimes think about what people would do if I did kill myself,1,For the past couple of years I've been in a cycle of hating myself for past mistakes and slowly building myself up. I hate myself for a lot of different things. I get paranoid about everything. I have constant anxiety attacks and I can't take it. College is right around the corner and I don't want to think about it. Suicide feels like the way out for me. ,past couple year cycle hate past mistake slowly build hate lot different thing paranoid constant anxiety attack not college right corner not want think suicide feel like way
201171,my confidence is ruined  I feel so lowI haven t left my bed all day  I need someone to hug  I want to die so bad,1,my confidence is ruined  I feel so lowI haven t left my bed all day  I need someone to hug  I want to die so bad,confidence ruin feel low haven left bed day need hug want die bad
201172,I ve really just fucked up everythingI ve let myself lose a job that I really liked with people that I loved working with  I m now working overnights which hasn t bode well for me in life before  I end up feeling more depressed and suicidal when I work jobs like this but it s all I could find    I ve fucked up a lot of friendships and relationships recently because of my attitude towards the world and my attitude towards others  getting mad at people for no good reason and I m guessing it s exhausting dealing with me   I ve ruined the closest thing I ve had to a relationship with this guy  I doubt he ll ever want to talk to me again after what I just got done getting upset at him about  and I don t blame him whatsoever    I joke about suicide a lot because it s how I dealth with my suicidal feelings a few years back  but the jokes are becoming reality and I want nothing more than to not be alive anymore    I know this all sounds really fucking stupid and I have nothing going on in my life that warrants me wanting to put a gun to my head but I don t know what else to do  I m a shitty person that has absolutely no future  why keep living life like this    fuck,1,I lost a job that I really liked and I'm now working overnights. I get mad at people for no good reason and I've ruined the closest thing I've had to a relationship with a guy. I joke about suicide a lot but I want to kill myself. ,lose job like work overnight mad people no good reason ruin close thing relationship guy joke suicide lot want kill
201173,Quit telling me to  never give up Just let me die  quit relying on me  I don t have anything else to give you  Don t you understand  She was the only thing that gave my life meaning  that gave my life purpose  She s not coming back  She ll never come back  She was right to leave to  You are the fools for sticking around  Are you blind  Can t you see that the man you once knew has been dead for a long time  I m not him  I m just his corpse  I m just the rotted remains of your friend  You re stupid for staying  the longer you stay the more painful it ll be for you  I m too weak and tired to do anything about this  I m gonna be like this until I finally bite the bullet  tie the rope  and end this pitiful joke of a life  Look around  we re in the exact same situation we were just a year ago  It s gonna end the same way  except this time  I won t fail when I kill myself  So just leave now  I m already dead anyways Not like I ll this to any of them  They all have their own problems  They don t need to also be checking on me every   minutes to make sure I haven t thrown myself off a bridge again   This happens literally everytime I start anything new  The last time was when I got that new job a few months ago  As soon is it s really real and everything starts happening  I get hit with this overhwhelming feeling   Give up now  Kill yourself  It s gonna end the same as last time  so just get it over with now  There s seriously no point to keep fighting  I swear to you all  I ll kill myself before my  th birthday  I was an idiot to not kill myself before the new year  Haha  as if an idiot like me could actually change,1,She was the only thing that gave him meaning in his life. She's not coming back. She was right to leave him. It's the same situation as it was a year ago. He'll kill himself before his th birthday.,thing give meaning life not come right leave situation year ago kill birthday
201174,I just can t anymore I just wish I never existed  I don t wanna hurt the people that care about me but I just can t go on much longer,1,I just can t anymore I just wish I never existed  I don t wanna hurt the people that care about me but I just can t go on much longer,anymore wish exist don want hurt people care long
201175,Numb beyond beliefBasically I m already dead  This is hell and I m okay with it  The world is shit and I don t care  When my dad dies I will probably just feel relief for him and for myself  and after that  I m going to hang myself as soon as I have some privacy  I will go out relieved that I don t have to live in this fucked up cruel shitstorm of a world anymore I don t need any response  I just wanted to let it out  Nothing can change my mind because for me it s a long term  rational choice  If you feel like you want to support me  acknowledge my right to an empty life of apathy and my right to suicide,1,"After her dad dies, she will hang herself. She doesn't need any response. She wants to live an empty life of apathy and she doesn't want to live in this cruel world anymore. She's not going to change her mind.",dad die hang not need response want live life apathy not want live cruel world anymore not go change mind
201176,Join the zombie army There was a  post https www reddit com r teenagers comments k pca bite wanna start a zombie outbreak utm source share amp utm medium mweb  recently about a  zombie apocalypse  and it s straight up genius  For more information click the link  We should infect this entire subreddit  I believe y all can do it,0,There was a post on Reddit recently about a zombie apocalypse and it's straight up genius. We should infect the entire subreddit with this post.   For more information click the link below. I believe y all can do it. ,post geddit recently zombie apocalypse straight genius infect entire sub edit post information click link believe
201177,What hints girl send when she loves me  That girl is in my class  Guys says she is   kindest to me that oder to them  Even my parents say she loves me but I didn t notice anything  I thing that she is kind to me as to everyone Please help,0,What hints girl send when she loves me  That girl is in my class  Guys says she is   kindest to me that oder to them  Even my parents say she loves me but I didn t notice anything  I thing that she is kind to me as to everyone Please help,hint girl send love girl class guy say kind oder parent love notice thing kind help
201178,One day we all will not know what it feel like to exist one day and it scares me and I just don t wanna liveI don t wanna live anymore  We will all die one day and forget everyone we know   Forget what it is like to fuckin be on our phone or do anything  I m just so scared of it   It is effecting my life   I never feel like I m living  I just wanna live again  I wannna feel like Im I m control  Some one feel the same way,1,One day we will not know what it feels like to exist and it scares me and I don't want to live anymore. I want to feel like I am in control again. Some one else might feel the same way. ,day not know feel like exist scare not want live anymore want feel like control feel way
201179,These McDonald s employees be trippin I ate some of their food  it was hella tasty  I turned on some Skyrim videos and shit and all the fucking sudden my stomach start hurting  Bro  it hurts  wtf did they sell me  I finna die,0,These McDonald s employees be trippin I ate some of their food  it was hella tasty  I turned on some Skyrim videos and shit and all the fucking sudden my stomach start hurting  Bro  it hurts  wtf did they sell me  I finna die,mcdonald employee trip eat food hello tasty turn sky rim video shit fucking sudden stomach start hurt bro hurt whf sell fix die
201180,Ok  but like  can we talk about Rodrick  The OG Rodrick  of course  The new one looks like lil tay  The old Rodrick was a dreamy pink boi and the new one  I just wanna punch him in the face  They did my guy Rodrick so dirty in the last one  Devon Bostick is the only person I will ever accept as Rodrick  Also  if you want to  send me your best Rodrick edits,0,"Rodrick's new look is not as good as the old one. Devon Bostick is the only person I will accept as Rodrick. Devon, send Rodrick's best edits to me.    .  ",rodrick new look not good old devon stick person accept rodrick devon send rodrick good edit
201181,I ve seen a lot of posts regarding transgender individuals so I have a stupid question  why don t we determine a person s gender through scientific tests and assign their appropriate gender at birth  Research has shown that transgender  individuals exhibit variances in genetics and brain structure compared  to their cis counterparts  why don t we determine a person s gender  through scientific tests and assign their appropriate gender at birth Studies  have shown that mtf personnel are more likely than cisgender males to  have a longer version of a receptor gene for the sex hormone androgen    Another study showed that ftm personnel don t have the cyp  t  C  allele  which acts on the sex hormones pregnenolone and progesterone    While these differences in genetics don t definitely conclude if someone  is trans or not  they do serve as an indicator in which more tests  could be done   Such as observing the structure of the brain  which has  multiple indicators for whether or not a person would experience gender  dysphoria in the future Basically   when a child is born first doctors would do a  assessment of their dna   which sometimes is done anyways to determine genetic diseases   If  those results suggested there might be a possibility   then they would  do further examinations with mri machines and other apparatuses to  confirm their predictions   I realize that this would probably be costly   especially in places with sub par health care  but  this is a  optimistic view of the healthcare system  and some parents have the  resources to have these examinations preformed in the current system   however neglect to preform them since these assessments aren t very wide  spread These examinations could  greatly decrease the amount of gender dysphoria and distress the  individual would have to go through later in life   On top of that   treatments could start much earlier  therefore be a bit easier and more  effective   The person wouldn t have to go through the incorrect puberty  in which their bodies are blasted with the inappropriate hormones for  their gender or deal with years of dysphoria and nervousness     Furthermore  having scientific procedures being standard would probably  greatly increase acceptance of trans individuals in many societies,0,"Transgender individuals exhibit variances in genetics and brain structure compared to their cis counterparts. Transsexuals are more likely than cisgender males to have a longer version of a receptor gene for the sex hormone androgen and less likely to have the cyp t C allele which acts on the sex hormones pregnenolone and progesterone. The differences in genetics don't conclude if someone is trans or not, but they do serve as an indicator.",transgender individual exhibit variance genetic brain structure compare counterpart transsexual likely gender male long version receptor gene sex hormone androgen likely crypt allele act sex hormone prague online progesterone difference genetic not conclude tran not serve indicator
201182,My mom be like  are you staring at that girl  Me who was staring at her boyfriend,0,My mom be like  are you staring at that girl  Me who was staring at her boyfriend,mon like stare girl stare boyfriend
