,text,class,summary,cleaned
80833,Life is pointless and miserableMy home life is fucked Not a single friend or acquaintance No motivation  goals  etc Society in general is full of awful people Why does anyone bother living People just use each other to feel better The only time anyone  cares  about suicide is after the fact  when they have the opportunity to make a BS post on social media about how they are so upset by someone else taking their own life  and how they would have done a million different things to help   The likes roll in and you can guarantee such a person will do sweet fuck all to help out if they ever find themselves in a position to do so People just want to continue building up this fake perfect image of themselves  Such people contribute far more to problems rather than solutions  when it comes to the issue of suicide And what is up with everyone treating one another like shit  Is it truly so difficult to treat another human being with some kind of decency and respect It sure as shit will never happen  but the world would be a far better place with less self absorbed arseholes wandering around I am not a bad person  not entirely  I have just been made to feel this way  based on how others have treated me for extended periods of time Deep down I know my value  but that is buried beneath constant negative thoughts and firmly entrenched beliefs I only have so much control over my life  It is not as if I asked to be bullied and treated like shit over and over again  If I choose to no longer be here  it is not selfish  as such a decision has occurred for me in large part through the actions of those around me These people can continue living their shitty lives  but I won t be there for them to boost their egos through cruel words  personal attacks  or other means I don t want advice  help  or any other fake BS  I just wanted to vent a small portion of my views and experiences,1,"Life is pointless and miserable. Society is full of awful people. People just use each other to feel better. People contribute more to problems rather than solutions when it comes to the issue of suicide. I am not a bad person, I have just been made to feel this way based on how others have treated me for extended periods of time. I don't want advice or help.",life pointless miserable society awful people people use feel well people contribute problem solution come issue suicide not bad person feel way base treat extended period time not want advice help
80834,I seeked for treatment  So if you look at my last post a week ago  u will know that my arms  both  were broken during an accident Well after the accident   day  my parents took me to the hospital  There were good news and bad news The good news is  my arms werent broken  my wrists does  The left one cracked quite a lot  the right one kinda uhhh deshaped   idk thats a word or not  basically its shape is not normal  The doctor said I would be fine since those injuries are not serious and they would heal fast  around   month or so The bad news is  I cannot do basic tasks  including holding a book or writing  so my progress in school will be very   very  slow But hey  On the bright side  i didnt die  and those are minor injuries i guess I will update more about this,0,"A week ago I wrote that my arms both were broken during an accident. After the accident my parents took me to the hospital. The good news is that the arms were not broken, but my wrists were badly damaged. The bad news is I cannot do basic tasks including holding a book or writing.",week ago write arm break accident accident parent take hospital good news arm not break wrist badly damage bad news not basic task include hold book writing
80835,Anyone who has had a family member commit suicideAssuming they left a note  what are talking points that helped you or that you wish they would have addressed before they passed I ve been writing notes over and over but nothing feels like I m saying enough,1,Anyone who has had a family member commit suicideAssuming they left a note  what are talking points that helped you or that you wish they would have addressed before they passed I ve been writing notes over and over but nothing feels like I m saying enough,family member commit suicide assume leave note talk point help wish address pass write note feel like say
80836,Anyone wanna chat or ask me stuff I m bored Idk how much filler text I need but this should do it,0,Anyone wanna chat or ask me stuff I m bored Idk how much filler text I need but this should do it,want chat ask stuff bored not know filler text need
80837,I m tired of not being enough I m never enough    Never     And there s nothing I can do  There s a reason why I ve attempted or had suicidal thoughts ever since I was young      Three times in the past six months alone     I don t want to die  not really  but I want to rid the world of myself    And I m only   and it s probably only going to get worse from here on out     A high school dropout  barely going to work because of panic attacks  I feel worthless     And the truth is  I need someone     Friends  lover  pet  family  no one knows how to help me  so they do nothing This is my last call for help  a vent if you will,1,"Three times in the past six months I've tried or had suicidal thoughts. I'm a high school dropout barely going to work because of panic attacks and I feel worthless. I don't want to die, but I want to rid the world of myself. ",time past month try suicidal thought high school dropout barely go work panic attack feel worthless not want die want rid world
80838,yo i had this random thought  i wonder who s gonna be the first person to give me a ternoin award lmao i will love that person forever  that would be fucking ledgendary no cap,0,yo i had this random thought  i wonder who s gonna be the first person to give me a ternoin award lmao i will love that person forever  that would be fucking ledgendary no cap,random thought wonder go person tern award lao love person forever fucking legendary no cap
80839,Questions about a methodNow  i know this wont kill me but what would be the outcome if i decided to take like    mg melatonin tablets  or just took every axniety relieveri had and melatonin,1,Questions about a methodNow  i know this wont kill me but what would be the outcome if i decided to take like    mg melatonin tablets  or just took every axniety relieveri had and melatonin,question method know not kill outcome decide like melatonin tablet take anxiety reliever melatonin
80840,Don t yall love Don t yall love just out of nowhere starting to think about all the stuff you ve done in your past and how you could do it a lot better and then just hating yourself for all of that  Life s sure good,0,Don t yall love Don t yall love just out of nowhere starting to think about all the stuff you ve done in your past and how you could do it a lot better and then just hating yourself for all of that  Life s sure good,don love don love start think stuff past lot well hate life sure good
80841,I need someone now please Someone please help me I need someone to talk to  I m on the brink of my heart breaking and it s getting closer and closer as each second passes,1,I need someone now please Someone please help me I need someone to talk to  I m on the brink of my heart breaking and it s getting closer and closer as each second passes,need help need talk mon brink heart breaking get close close second pass
80842,How do I get over my fear of following people on Instagram  Ok  I get the title is crazy but hear me out For some reason  I can t bring myself to follow any of the popular kids at my school  some of which I like and are actually pretty nice  I don t know why  I guess I m afraid of them laughing at me sending them a follow request   I know it s crazy  but for some reason I can t get over it  Can anyone help me,0,"For some reason I can't bring myself to follow any of the popular kids at my school on Instagram because I'm afraid they'll laugh at me if I do. I know it's crazy, but I just can't get over it.",reason not bring follow popular kid school inst gram afraid laugh know crazy not
80843,Kickflip kickflip kickflip Fr what s the kickflip meme here   I don t get it lmao,0,Kickflip kickflip kickflip Fr what s the kickflip meme here   I don t get it lmao,kick flip kick flip kick flip kick flip meme don lao
80844,If you have to sneeze while wearing a mask  Do you take of the mask or keep it on,0,If you have to sneeze while wearing a mask  Do you take of the mask or keep it on,sneeze wear mask mask
80845,The Worst Laptop I Ever Owned So This laptop was a acer laptop running windows   and That laptop was from   I got it from my uncle because It looked at first  I was wrong   The Laptop was dirty and Dusty as hell and I think it had a coffee spill on it so I cleaned it a bit but it was till dirty  Whenever I turned the laptop on it got really hot and I was afraid it was going to explode  I sadly had to use this laptop for an entire school year before I got a new one  This laptop was slow and laggy as hell  Also it would randomly crash sometimes and It fan sounded let a vacuum cleaner amp x B Fuck that laptop  I m glad I don t have to use anymore,0,"The worst laptop I ever owned was a laptop from my uncle. It was dirty, slow and laggy. I had to use it for an entire school year before I got a new one. I'm glad I don't have to use this laptop anymore.",bad laptop own laptop uncle dirty slow saggy use entire school year get new glad not use laptop anymore
80846,This is to all of the guys that are like  what can t I get a girl when I know i ll treat her right  A lot of girls are still immature just like many guys  If you genuinely want to treat her right and be there for her  even if things don t go you way and you still respect her  you re a man  and if they don t see that  it s their fault  A lot of girls at this age just want to have fun  and they don t understand how bad they hurt guys sometimes and they often experiment with relationships  You have to respect their choices though  no matter who they date or what they do  If you would treat her right and she keeps going back to a guy that hurts her  it s her fault  and don t be like  oh i d treat her right but she only dates douches  that s incel shit  Think of it like  I hope one day she ll find someone that treats her right  and that someone doesn t have to be you  Some girls can just be very confused by their emotions  unlike most guys who just know what they want  they are more complicated than us and we need to understand that  There will be a girl one day that notices you genuinely want her and will take care of her  this age just isn t for that Edit  also take the past into consideration  Girls are abused more often that guys and some may have trust issues or even mental issues  You just have to show them more love and be more understanding of them  Also  all girls are different  Just cause one girl liked one thing doesn t mean the other will,0,A lot of girls are immature at this age and they hurt guys sometimes. You have to respect their choices no matter who they date or what they do. Girls are abused more often than guys and some of them have trust issues or mental issues.,lot girl immature age hurt guy respect choice no matter date girl abuse guy trust issue mental issue
80847,Is there anyone who goes to Robert blake science college  Filler Filler Filler Filler Filler Filler Filler Filler Filler Filler,0,Is there anyone who goes to Robert blake science college  Filler Filler Filler Filler Filler Filler Filler Filler Filler Filler,go robert blake science college filler filler filler filler filler filler filler filler filler filler
80848,I m alone in the truest sense of the word  I won t be noticed for weeks maybe months And my final words go to internet strangers  I guess you are the only ones I can t damage anyway  It s fitting because   of my free time is spent with you anyway  If I don t have strong relationships in real life  I shouldn t expect there to be too much resistance when snapping them off  At least I can say goodbye here and nobody s day will be ruined It doesn t always get better Goodbye,1,"Internet strangers are the only people I can't damage, because I spend most of my free time with them. If I don't have strong relationships in real life, I shouldn't expect there to be too much resistance when snapping them off.",internet stranger people not damage spend free time not strong relationship real life not expect resistance snap
80849,New Year s EveWe went to the top of my mother in laws building  ten stories high  All I wanted to do was allow my body to fall  but instead my husband saw me by the edge and held me  told me I was going to be ok and walked me back inside  He saved my life last night,1,New Year s EveWe went to the top of my mother in laws building  ten stories high  All I wanted to do was allow my body to fall  but instead my husband saw me by the edge and held me  told me I was going to be ok and walked me back inside  He saved my life last night,new year eve go mother law build story high want allow body fall instead husband see edge hold tell go walk inside save life night
80850,You ever just see an account that totally seems like you u uwulittlegayboiuwu We need to talk  about   things,0,You ever just see an account that totally seems like you u uwulittlegayboiuwu We need to talk  about   things,account totally like uwulittlegayboiuwu need talk thing
80851,I am chaotic evil  I am the coomer general  I did it  i completed ANN   ALL NUT NOVEMBER  I nutted in every single day of November  Revere me as Coomer Jesus,0,I am chaotic evil  I am the coomer general  I did it  i completed ANN   ALL NUT NOVEMBER  I nutted in every single day of November  Revere me as Coomer Jesus,chaotic evil cooper general complete ann nut november net single day november revere cooper jesus
80852,I want to kill myself but I m worried that if I tried and failed I would lose my apprenticeshipHey everyone  im   and my name is Ethan  not that it matters I have reached my breaking point and I think I m going to be committing suicide soon  I m worried if I fail I would lose my job and if I were I would make sure to definitely complete it,1,"Ethan wants to kill himself, but he's worried he'll lose his apprenticeship if he fails the apprenticeship. Ethan would make sure to complete the apprenticeships if he were to commit suicide, because he's afraid he'd lose his job. ",ethan want kill worried lose apprenticeship fail apprenticeship ethan sure complete apprenticeship commit suicide afraid lose job
80853,GUYS WTF MY FOOT JUST GOT CUT OFF WTF WHAT DO I DO  I DONT WANNA BE DED,0,GUYS WTF MY FOOT JUST GOT CUT OFF WTF WHAT DO I DO  I DONT WANNA BE DED,guy whf foot got cut whf not want de
80854,I don t know how to confess to my crush I ve been talking to this girl for a while and i think we have a good thing going  but i don t know how to tell her,0,I don t know how to confess to my crush I ve been talking to this girl for a while and i think we have a good thing going  but i don t know how to tell her,don know confess crush talk girl think good thing go don know tell
80855,Too lazy to dieHey  depressed guy   here  Honestly the only reason why I haven t killed myself is because I m too last to write my suicide notes  I guess I still am kinda holding to that last bit of hope that maybe tomorrow will be better  but it never is  I came here as kinda a last resort for some advice or like some recommendations of movies or books or songs that have changed your guy s lives  Thanks  anything helps,1,The only reason depressed guy hasn't killed himself is because he's too lazy to write his suicide notes. He came here as a last resort for some advice or recommendations of movies or books or songs that have changed his guy's lives.,reason depressed guy not kill lazy write suicide note come resort advice recommendation movie book song change guy live
80856,I triedI m sorry  I m done  I don t want to hurt anyone by ending it but I ve tried everything  literally everything to get better and nothing worked  It s been way too long  I ve fought it as much as I could but I can t do it anymore  I won t survive another year like this  I don t even know why I m writing this  maybe I just had to tell someone that I really did my best but it wasn t enough  Goodbye everyone  take care of yourselves  I hope you ll find the strength to keep going  find something that will make you happy,1,It's been too long and I can't do it anymore. I don't want to hurt anyone by ending it but I have tried everything to get better but it wasn't enough. I hope you will find the strength to keep going.,long not anymore not want hurt end try well not hope find strength go
80857,I really don t want to be alive anymore I ve been living several years in a cycle of depression and self destructive behaviour thinking and I just want to end things   I ve always said that if I could gain access to a gun  I would have ended it years ago  I m tired of trying and never achieving anything in what I want  I feel I can t be saved and it s the logical idea for me to go I ll be honest  I feel like a culling would be useful as well  I d be the first to go by choice  We have horrible people on this planet that should be dead and we just need to get it over with Yeah this post is dark  disturbing and  wrong  in the eyes of many but I don t care  Millions of us don t desvere to be alive and we should all just fuck off and die  I just with I had the means to do it now I wonder how long it will take for me to get reported banned  Its not like it matters  Nothing matters anymore  Existance is pain and we should just end it all now,1,"If I could have access to a gun, I would have killed myself years ago. I feel I can't be saved and it's the logical idea for me to die. I wonder how long it will take to get reported banned. ",access gun kill year ago feel not save logical idea die wonder long report ban
80858,Who wants to talk for a bit I m downloading melee and it s going to be a bit so I want to talk to someone to make it go faster,0,Who wants to talk for a bit I m downloading melee and it s going to be a bit so I want to talk to someone to make it go faster,want talk bit download melee go bit want talk fast
80859,PHX Choosing life over love I m not from here  USA  I m in a relationship here  It s mentally abusive  Constantly beaten down  ignored  hidden  I used to be someone else  bright  happy  funny  I avoid them now because they are looked down upon as being childish I ve not anyone to really talk to  besides random texts from a friend who s out of town   I ve no courage to call the relationship off  I m too nice of a guy to leave  It s why I m thinking of choosing my life  than end the relationship by leaving It has a tinge of revenge  for everything you ve put me through  here is my fuck you  deal with it But I have choices  and had choices  I let this happen  let her treat me that way   Battered wives  know it s not right  but can t leave Will you let me talk  I need to talk Dec    am,1,The relationship in PHX is mentally abusive. He wants to end the relationship but is afraid to do it because he is too nice to leave. He needs to talk to her on December 11th at 11:00 am. ,relationship phi mentally abusive want end relationship afraid nice leave need talk december
80860,Should i ask out the girl i like if so how should I tell her I ve been wanting to ask her out for a long time now but i have no idea how to go about it and i am very socially awkward and even more so around girls whilst she is really confident and kind,0,Should i ask out the girl i like if so how should I tell her I ve been wanting to ask her out for a long time now but i have no idea how to go about it and i am very socially awkward and even more so around girls whilst she is really confident and kind,ask girl like tell want ask long time no idea socially awkward girl whilst confident kind
80861,I have a thought  What if today isn t a Thursday  We just gotta assume someone was counting the days since it began because how do we know today is a Thursday  It could be a Monday for all you know  THIS IS WHAT GOES ON IN MY MIND INSTEAD OF STUDYING FOR MY EXAM TOMORROW,0,I have a thought  What if today isn t a Thursday  We just gotta assume someone was counting the days since it began because how do we know today is a Thursday  It could be a Monday for all you know  THIS IS WHAT GOES ON IN MY MIND INSTEAD OF STUDYING FOR MY EXAM TOMORROW,thought today thursday get assume count day begin know today thursday monday know go mind instead study exam tomorrow
80862,I would be very social if I lived almost anywhere else I would be very social if I lived almost anywhere else I have everything one could need to be social,0,I would be very social if I lived almost anywhere else I would be very social if I lived almost anywhere else I have everything one could need to be social,social live social live need social
80863,Daily reminder again that this sub isn t tinder Idc what status you are  if your straight gay bi or anything else  single or mingle  don t come to this app to find love this is r teenagers  not r Tinder,0,Daily reminder again that this sub isn t tinder Idc what status you are  if your straight gay bi or anything else  single or mingle  don t come to this app to find love this is r teenagers  not r Tinder,daily reminder sub tinder d status straight gay single mingle don come app find love teenager not tinder
80864,I hate how my mood for rest of the day revolves around one person   this is not fun  im so drained,0,I hate how my mood for rest of the day revolves around one person   this is not fun  im so drained,hate mood rest day revolve person not fun drain
80865,After multiple weeks of study I can sadly confirm The girls on this sub ain t got no ass,0,After multiple weeks of study I can sadly confirm The girls on this sub ain t got no ass,multiple week study sadly confirm girl sub ain got no ass
80866,Preparing for College So I m graduating this year and going to college this fall and I was wondering if anyone could give me some advice on how to survive  Socially and in school Some questions I have How different usually are classes and schoolwork compared to HS And probably the most important  HOW DO YOU MAKE NEW FRIENDS IN COLLEGE AND POSSIBLY EVEN A S O  Thats all Thanks fellow teens and hopefully you provide some useful insights,0,This year I'm graduating this year and going to college this fall. I'm looking for advice on how to survive Socially and in school. I want to know how to make new friends in college and how to deal with different classes and schoolwork.,year graduate year go college fall look advice survive socially school want know new friend college deal different class schoolwork
80867,Y all like Yu Gi Oh  DM me if your interested in playing yugioh   probably online,0,Y all like Yu Gi Oh  DM me if your interested in playing yugioh   probably online,like interested play yugo probably online
80868,I lie a lot Whenever the doctors or people ask me  you don t want to hurt yourself  right  I always just say   No  I just wish I wouldn t wake up  but it s a lie because I ve spent hours and hours researching ways to kill myself that will be effective  I know how I ll do it  I just don t know when  I have nothing left  I feel like I should do it before the end of the year  Give everyone a clean slate for the new year,1,I lie a lot. I have spent a lot of time researching ways to kill myself. I want to do it before the end of the year to give everyone a clean slate for the new year. I don't know when I have nothing left. ,lie lot spend lot time research way kill want end year clean slate new year not know leave
80869,Don t you hate it when You re looking for  painless methods to kill yourself  in google and all that shows up is a bunch of sites telling you not to do it I can assure you  this is not what I was looking for,1,Don t you hate it when You re looking for  painless methods to kill yourself  in google and all that shows up is a bunch of sites telling you not to do it I can assure you  this is not what I was looking for,don hate look painless method kill google show bunch site tell not assure not look
80870,I don t even stay up to text her no more I m loosing my feelings for this girl and I don t know how to tell her,0,I don t even stay up to text her no more I m loosing my feelings for this girl and I don t know how to tell her,don stay text no loose feeling girl don know tell
