,text,class,summary,cleaned
213801,i want to die that is all,1,i want to die that is all,want die
213802,yo am i worthy of living so heres the deal ive been miserable for years now at least six but maybe more in that time ive tried the usual suspects exercise meditation relationships it has all kind of amounted to nothing not to say i havent learned anything from those experiences but i cant shake this feeling that i will end up killing myself someday no matter what i do i seem to be stuck in a cycle of thinking things are about to get betterrealizing things are getting worseits like a roller coaster ride that never ends except instead of being terrified all the time with relief at the end i drift between debilitating sadness and listless anxiety i really dont know what to do it may be easier for me to end my life since there doesnt seem to be a solution i dunnoi am not even emotional about dying anymore i just see it as a logical choice in the face of a really awful world hey thanks for reading this far 3,1,I've been miserable for at least 6 years now. I drift between debilitating sadness and listless anxiety. I'm not even emotional about dying anymore. I just see it as a logical choice in the face of a really awful world.,miserable year drift debilitate sadness listless anxiety not emotional die anymore logical choice face awful world
213803,i am no one i am 31 years old i work full time and then some in social services typically i work 50 hours a week but i can barely make ends meet i took a week off in july and without the overtime i took such a financial hit i almost couldnt buy food and i didnt even do anything or go anywhere it was literally just a staycation where i mostly played video games or went on walks to the parki am31 with a college degree and i have to get a second job and essentially work 7 days a week so i can save money i have no life now because i cant afford it i will have no life then because i wont have time and it is an endless cycle i am tired i feel heavy air hurts my skin feels raw and as much as i want to feel guilty i can only feel at peace in the knowledge that sometime soon i will die and i will be the one to do it that when it is over everyone else will be sad but eventually they will move on theyll get on with their lives and i will no longer be the fuckup burden they feel obligated to invite places or required to talk to they wont have me to support financially and emotionally what i hope to gain is freedom and i hope to provide it as well i do not like who i am i am not happy i have not been happy for a very long time i have always been unsuccessful in relationships i try so many things and can barely rise to mediocrity and when people sayi amgood at something or they like me it just feels like a lie it feels like they are making fun of me it always has felt that way and i am tired and i just want to be done now ,1,"At 31, she works 50 hours a week in social services but she can barely make ends meet. She took a week off in July, but without the overtime, she almost couldn't buy food. She doesn't like who she is and she has not been happy for a long time. ",work hour week social service barely end meet take week july overtime not buy food not like not happy long time
213804,numb alone and tired of fighting soi asked my best friend to let me know when in general to not tell her my mentalemotionalpsychological state when shes got something on her mind she told me i passed that point a while ago i kindadont want to live to see my birthday at all nowits 4 days away and i dont want to be here anymore i knew everyone else hated me i could deal with that but my fucking best friend told me she doesnt have the time or energy to deal with my shit ive helped her so much in life and i shouldve seen it coming when she didnt put effort into comforting me i had a couple attempts and she stopped trying to console or help me when i flat out told her my plan she ignored all of what i suggested and was so stubborn and set on not listening to me no matter what i said and now thisi am so numb i cant feel anything anymore its like i snapped inside i literally cant fucking move my body is in so much pain i give up she was my last reason to stay theres no fucking point anymore thats gone and i am tired of fighting iti amready to fucking die ,1,My birthday is in 4 days. I don't want to live to see it. My best friend told me she doesn't have the time or energy to deal with my mental illness. She stopped trying to console or help me when I told her my plan. ,birthday day not want live good friend tell not time energy deal mental illness stop try console help tell plan
213805,my tinnitus is going to kill me hi i began experiencing a wooshing sound in my ears last tuesday aug 28th that was chalked up to an ear infection during that time i experienced constant panic attacks fearing that it was going to last forever then 2 days ago i felt so much better because out of nowhere it just vanished however today it has come back and now i feel more hopeless than ever if i have to live with this for any longer suicide will just be a matter of time i saw an ent and he told me that i was making a full recovery from the ear infection but lo and behold my wooshing is back and my will to live has vanishedi have so much shit due next week and with this ear thing i just want to die i have told my boyfriend about my suffering so many times hes tired of hearing it i told my parents and they saidi am sorry honey no one actually cares that i want to die i have been saying things like i want to die and kill me i think that they have gotten used to it well jokes on them because sooner or lateri am going to end up in the fucking dirt,1,"Tinnitus has come back in my ears. I have a lot of work due next week and I want to die. My boyfriend is tired of hearing about it. My parents don't care about it, so I joke on them. ",tinnitus come ear lot work week want die boyfriend tired hear parent not care joke
213806,help my gf has considered suicide and selfharm in the past hey reddit i have a problem with my girlfriend and for some context were both in high schoollast night my girlfriend asked me if i have ever been suicidal i have never but i immediately felt concerned because i knew where the conversation was heading she revealed to me that she has been suicidal before i asked if she ever selfharmed and she told me she has considered it she said that 3 years ago she felt alone she had a pair of scissors and was thinking about stabbing herself in the stomach at the moment when she told me this i just gave her a big hug and told her that she can always talk somebody and she could talk to me if she ever needed to i honestly didnt know what else to say because we were out on a date and i didnt want to upset her by saying something she might not like even now as i write this i recall her telling me that when she was in elementary she threatened her schoolmates that were bullying her that she would kill herself at the time when she told me this i was shocked but rationalized in my mind that she was probably lying so her bullies would back off she said it in a kind of laughing tone and i assumed stupidly that she was all right she exhibits some signs of depression she asked me if my parents hated her after they met her and she has a pretty low image of her bodythis is where i need some advice i really want to help her out because i really really like her and would never leave her because of something like this ive been reading some of the stuff on but i am not sure whenhow to approach the subject do i just wait for her to bring this up again or should i offer her a chance to talk to me more about this before something serious ever happens thanks in advance,1,My girlfriend has considered suicide and selfharm in the past. She has a low self-image and exhibits some signs of depression. She asked me if my parents hated her after they met her. She threatened her schoolmates that were bullying her when she was in elementary.,girlfriend consider suicide self arm past low self image exhibit sign depression ask parent hate meet threaten schoolmate bully elementary
213807,amunwanted and i dont want to live in a world where no one wants mei am in college i went through sorority rush and didnt get in any sororities so i tried to apply to join another organization on campus and got turned away from that too i dont belong anywhere my mom is extremely emotionally abusive the day i got turned away from that organization my grandma died i was extremely close to her and loved her a lot now my mom is telling me how i wasnt important to her my boyfriend never tries to take me on dates and barely makes any effort to even see me we have been together 5 years i constantly tell him how i feel neglected and unwanted and he continues to ignore me and neglect me i dont have a best friend people that i thought were my friends hang out with each other and never invite mei amjust never wanted by anyone i want to be someones best friend i want to be someones first choice or any choice at all i dont understand why nobody likes me i am so nice to people i really want to make friends but no one likes me,1,"In college, she didn't get into any sororities and she doesn't have a best friend. Her boyfriend doesn't take her on dates and doesn't make any effort to see her. Her mom is emotionally abusive and her grandma died. ",college not sorority not good friend boyfriend not date not effort mon emotionally abusive grandma die
213808,the police make me suicidal to make a long short storyi am not getting justice from them when people wrong me instead locked up and sent to a mental hospital when family members physically abuse mei dont understand whati am doing wrongwhy am i not getting justice,1,the police make me suicidal to make a long short storyi am not getting justice from them when people wrong me instead locked up and sent to a mental hospital when family members physically abuse mei dont understand whati am doing wrongwhy am i not getting justice,police suicidal long short story not get justice people wrong instead lock send mental hospital family member physically abuse not understand wrong not get justice
213809,all time low i think ive hit rock bottom in my life i have ibs paired with numerous food allergiesgluten dairy sunflower oil and chemical sensitives to about anything you can imaginecant use toothpaste cant drink anything except for distilled water i have a mass growing in my testicles ive dealt with going to the bathroom 1020 times a day for as long as i can rememberi am22 it is so raw down in there 57 days of the week making it so uncomfortable to even walk around at my job chronic general and social anxiety because of being so uncomfortable and constipated and in pain all day has developed because of being in the public school system caused by ibs i am successful outside of that but i amjust miserable and there are no real explanations to my health issues ive been at lows but this is an all time and i amafraidi am going to act soon but i amassuming i should invest in life insurance i know it doesnt payout when you commit suicide ,1,"Ib's combined with food allergies and chemical sensitives is making 22-year-old's life miserable. He has to go to the bathroom 1020 times a day, 57 days a week, and he has a mass growing in his testicles. He suffers from general and social anxiety because of this.",combine food allergy chemical sensitive make year old life miserable bathroom time day day week mass grow testicle suffer general social anxiety
213810,my marriage is slipping away i am tired i honestly wish i could go home or just commit suicide so at least my family can get the insurance moneytldr having a midlife crisis career is a dead marriage is slipping away,1,my marriage is slipping away i am tired i honestly wish i could go home or just commit suicide so at least my family can get the insurance moneytldr having a midlife crisis career is a dead marriage is slipping away,marriage slip away tired honestly wish home commit suicide family insurance money cdr have midlife crisis career dead marriage slip away
213811,i thinki amjinxed too much bad luck my waydidnt do anything wrongused to being treated poorlyi cut off just about everyone because i feel people dont tke me seriously enough,1,i thinki amjinxed too much bad luck my waydidnt do anything wrongused to being treated poorlyi cut off just about everyone because i feel people dont tke me seriously enough,think jinxed bad luck way int wrong treat poorly cut feel people not seriously
213812,everyone loses interest in me eventually i have literally no one my birthday is in less than two weeks i plan on hanging myself a week after i have literally nothing to live for ive never been this depressed for such an extended period of time the worst part is that nothing is helping me ive been depressed for the last 11 years of my life since i was 13 therapy didnt help medicine didnt help people who i thought were my friends deserted me my family doesnt want to have anything to do with mei amsuffering so fucking muchi amjust barely surviving day after day my depression is untreatable and i just want my shitty life to end already,1,Everyone loses interest in me. My birthday is in less than two weeks. I want to hang myself a week after. I've been depressed for the last 11 years. My family doesn't want to have anything to do with me.,lose interest birthday week want hang week depress year family not want
213813,am going to kill myself on monday my loneliness is to the point that i have no optimism i cant find a relationship and when i do they end in heartbreak i have no patience to wait for one i have depression social anxiety and i get angry with people easily if i kill myself i wont have to live this painful life any longer its not my fault that everyone else is so full of themselves and immature that they dont respect me if i leave maybe theyll realize what they missed out on i want them to be sad i want them to cry they deserve it for every thing theyve done to me or for every time they ignored purposely or not my paintheyll cry about how they miss me but theyre all liars they denied my requests for relationships and now i get to leave them permanently they deserve every ounce of guilt theyll feel i messaged them all suicide letters or cryptic goodbyes and told them just how guilty they are only a few are spamming my inboxes begging me to stopfunny how they didnt message me before though they didnt message me to ask how my night was going or my plans for the weekend they ignored me becausei amfucking worthless to them so now they deserve to live with my ending on their guilty conscious why shouldnt i kill myself i havent tried therapy or filling myself with artificial toxic pills yet are those two any good,1,"Am going to kill herself on Monday because she is lonely and depressed. She doesn't want to wait for a relationship. She has depression, social anxiety and is angry with people. She wants them to be sad and to feel guilty for ignoring her.",go kill monday lonely depressed not want wait relationship depression social anxiety angry people want sad feel guilty ignore
213814,give me one reason i shouldnt kill myself sooni amsick of struggling through everyday without any social interaction and having all these regrets pile upi ama weird and stupid person i honestly dont thinki am going to make it to collegei am going to cry myself to sleep rn for the millionth time,1,give me one reason i shouldnt kill myself sooni amsick of struggling through everyday without any social interaction and having all these regrets pile upi ama weird and stupid person i honestly dont thinki am going to make it to collegei am going to cry myself to sleep rn for the millionth time,reason not kill soon sick struggle everyday social interaction have regret pile weird stupid person honestly not think go college go cry sleep right millionth time
213815,i thinki amdone there is a lot to write i will make this short as possiblei am31 mi ama combat vet with multiple tours found my father after he committed suicided ruined my marriage ive felt emotionally numb for years all i feel is anger and sadness i cant change the way i feeli am looking forward to dying it makes me happy thinking about iti am not looking for sympathyi amthe cause of my own ruini am not a good person what so ever,1,Mi ama combat vet with multiple tours found his father after he committed suicide. His suicide ruined his marriage. He is angry and sad and he is looking forward to dying. He feels he is the cause of his own ruini.,miami combat vet multiple tour find father commit suicide suicide ruin marriage angry sad look forward die feel ruin
213816,my friend is suicidal and i dont know how to help her i recently started talking to someone one online and as it turns out she is severely depressed and suicidal she has told me that she is planning to kill herself after she finished school i live in a different country to her so i can not go to her to help she has said that a lot of her friends have left or betrayed her and she is unable to trust anyone anymore i am trying my best to help her but she keeps going between wanting to be helped and not wanting to be helped every time i think i convinced her to get help she just changes her mind a few minutes later and decides she just wants to die insteadi really dont know what else to do here i have read some things that are in the side bar but i dont think that i am helping her i just dont know what do say or do please help me help her i am so scared that she will kill herself and it will be my fault that i couldnt help her,1,"My friend is depressed and suicidal. She is planning to kill herself after she finishes school. I live in a different country to her, so I can't help her. She keeps changing her mind and doesn't want to get help. ",friend depressed suicidal plan kill finish school live different country not help keep change mind not want help
213817,i dont want to live as an inferior human anymore hey guys and gals i really need a place to get this off my chest so here it goesim currently 23 turning 24 in january this summer i was bed bound for the whole of the summer due to brain injury this accident happened as i was getting my life back on track giving it all at uni doing sports as much as my knees allowed me to and trying to get to know more people all of this was an effort to change my life from being a hermit with poor social skills and low ambitions i spend my years at uni getting fat and hiding from other people and work although i got rid of the fat now i still have strech marks all over the place this and my notasgoodasitusedtobe physique due knee problems which wont fucking go away add to my inferiority complex i feel i have failed life to the core wasted on of the most important years in the life of a succesful human being and the milestones i missed i cannot do over even if i try to turn it around again which i was semi succesful the last year before my accident it just seems to me that this mistakes will stain my very being forever i can be better than now in the future but the fucking past cannot change and that is what makes me want to kill myself so so bad i really think i cannot get as far in life as i could have because of the lower brain processing power as i got older nowi get a lot of shit for saying this at home but i really think this is true this mistakes arent even reversible like my stretchmarks i would have to live with their consequences all my life long maybe getting equal in relative as i cannot undo my isolation experience with my peers in the thirties but that wouldnt matter because i cannot be happy there if i wasnt happy in my early 20s righti still try to change at the moment asi amrecovering because i have to choices giving it all or killing myself but really i like the second option so much better at the moment for i cannot stand being inferior even if it may be just in my mind,1,"This summer at the age of 23, he suffered a brain injury and was bed-bound for the whole of the summer. He feels he has wasted important years of his life and regrets the milestones he missed. He is trying to change at the moment. ",summer age suffer brain injury bed bind summer feel waste important year life regret milestone miss try change moment
213818,i dont know what to say i want to kill myself like today or tomorrowi am tired of feeling so shitty nobody cares about me and i am not good at anything i need someone to be there for me becausei ampretty sure i will actually do it ,1,i dont know what to say i want to kill myself like today or tomorrowi am tired of feeling so shitty nobody cares about me and i am not good at anything i need someone to be there for me becausei ampretty sure i will actually do it ,not know want kill like today tomorrow tired feel shitty care not good need pretty sure actually
213819,sexual repression is ruining me ive always been considered a creep ugly weird unworthy loser i doubt i will ever have someone i connect with and who connects with me its killing mei amfrustratedi am angryive been in professional therapy for depression for 4 years it lead nowhere and even made things worse ive never knew how to express what was bothering me so much and i cannot stress enough how much i hate talking about it it makes me feel so bad about myself ive never had positive experiences with the other sex and as much as i hate it and frustrated by it there is nothing i can do about itive considered suicide many times and each day it seems i want it even more i know that i will suicide soon i dont want to but i just dont want to suffer this anymore,1,Sexual repression is ruining me. I've been in therapy for depression for 4 years but it didn't help. I hate talking about it. I consider suicide many times and each day I want it even more. I know I will kill myself soon. ,sexual repression ruin therapy depression year not help hate talk consider suicide time day want know kill soon
213820,3rd try maybe todayi amfed up with my life now i have depressions for 4 years now and i cant stand it anymore my girlfriend we were engaged commited suicide some of my best friends died i nearly lost everything i did terrible things in my job i got a serious problem with my heart doctors say that i have left a few years to live i tried to end this 2 times now but it didnt work ,1,"Girlfriend committed suicide and some of his best friends died. He has a heart condition and doctors say he has only a few years to live. He tried to kill himself twice before, but it didn't work. He might try it for the third time today.",girlfriend commit suicide good friend die heart condition doctor year live try kill twice not work try time today
213821,unhappy with my job working at a wholesale club for 3 years now i started this job while enrolled in college now i dropped out and feel an underlying need to get out of retail as it is sucking the life out of me lately i have been have anxiety attacks losing my weight and my appetite and just un happy with my job my brother has an opening at a car wash where he details cars for 2 less than me but detailing cars is my hobby i see the pros to this job asan attempt to get out of my situation before something bad happens outside job tips detail experience and i can tell people to go up there and charge half of what the wash does and management is ok with it pays 800 a semester if i go to school cons less pay and business depends on weather i believe my finances will be ok since my rent and bills equal to around 600 soom to be 800 just need some advice before my anxiety kills me,1,"Unhappy with his job at a wholesale club, he dropped out of college and is looking for a new one. His brother has an opening at a car wash. He details cars for 2 less than him. The job pays 800 a semester, which is less than his rent and bills.",unhappy job wholesale club drop college look new brother opening car wash detail car job pay semester rent bill
213822,my ex called me she proposed promised for better or for worse then broke up with me when the worst came now shes calling me because shes sad shes sad ive never been this depressed in my life ive never actually had a plan for death i know exactly how many pills to take to end it all i know the high traffic times on the busiest road in my city i know which bridges i can gain access to and how far i would fall shes sad and i amlost isnt that just lovely ,1,My ex broke up with me because she is sad. I am depressed and I have a plan for death. I know exactly how many pills to take and where to go to end it all. She's sad and I am lost. ,sex break sad depressed plan death know exactly pill end sad lose
213823,compulsive liar back with an update thank you reddit hi i posted a few days ago from the roof of a nearby building it was raining i was prepared to end it i reached out for help and i received it i met one of the greatest people ive met in a long time and ive only known him a day or two thank you reddit so much i may not be here for long but i amhere at least one more day ,1,The compulsive liar is back from the roof of a nearby building and thanks reddit for helping him to stay there for at least one more day. He met one of the greatest people he's met in a long time thanks to reddit.,compulsive liar roof nearby building thank geddit help stay day meet great people meet long time thank geddit
213824,suicide prevention ,1,suicide prevention ,suicide prevention
