,text,class,summary,cleaned
49450,Should I play Overwatch  that new avengers game  or persona   again  Filler filler filler Filler filler filler Filler filler filler Filler filler filler Filler filler filler Filler filler filler,0,Should I play Overwatch  that new avengers game  or persona   again  Filler filler filler Filler filler filler Filler filler filler Filler filler filler Filler filler filler Filler filler filler,play watch new avenger game persona filler filler filler filler filler filler filler filler filler filler filler filler filler filler filler filler filler filler
49451,There s like so many teen boys who would look cute if they shaved like facial hair on teens is so ugly and disgusting like you could be a cute young teen boy but they wanna be like old gross toxic men,0,There s like so many teen boys who would look cute if they shaved like facial hair on teens is so ugly and disgusting like you could be a cute young teen boy but they wanna be like old gross toxic men,like teen boy look cute shave like facial hair teen ugly disgusting like cute young teen boy want like old gross toxic man
49452,It is   AM And I just started a VC with my homies Even Instagram was like u sure bud Has been v fun so far and Hello fellow   AMers on the East Coast,0,It is   AM And I just started a VC with my homies Even Instagram was like u sure bud Has been v fun so far and Hello fellow   AMers on the East Coast,start pc homie inst gram like sure bud fun far hello fellow gamer east coast
49453,My girlfriend tried to kill herself tonight and I don t know what to domy girlfriend tried to kill herself tonight  she called me a few hours ago and sounded completely insane because of all the meds she took to end her life  thankfully she regretted it when she was starting to black out and tried to vomit and get everything out of her system  she said she called me because she wanted me to know that she was still alive  i thanked her for it  tried to calm her down and tell her that i love her but i honestly don t know what to do  she hung up when her mom got home because she would have to explain everything  we re in a long distance relationship and her family doesn t know about me  there s no way for me to reach her  so i m just glad she s not alone right now   ps  she broke up with me yesterday  we ve been together for one year and a half  during this time she broke up with me like four or five times when she was going through hard times  only to take it back after it was over i love her with all my heart and i guess i just want some advice about what i can do to help her  things someone who just tried to end their life would like to hear  stuff like that,1,Girlfriend tried to kill herself tonight. She called her boyfriend a few hours ago. He doesn't know what to do. She broke up with him yesterday. They've been together for a year and a half and he's in a long distance relationship.,girlfriend try kill tonight call boyfriend hour ago not know break yesterday year half long distance relationship
49454,The whole English alphabet   A a  B b  C c  D d  E e  F f  G g  H h  I i  J j  K k  L l  M m  N n  O o  P p  Q q  R r  S s  T t  U u  V v  W w  X x  Y y  Z z,0,The whole English alphabet   A a  B b  C c  D d  E e  F f  G g  H h  I i  J j  K k  L l  M m  N n  O o  P p  Q q  R r  S s  T t  U u  V v  W w  X x  Y y  Z z,english alphabet cd al pm no pm
49455,I m scared for my LDR  So  my SO and I  live in different countries  Him being in the US  and me in Canada  I m going to university sometime in   and I m unsure of whether we can be together at that point or not  You see  he s   and I m   I m old enough to start going off on my own  Him  Not so much  He had super strict parents  I m not ready to live in an apartment on my own  so I think I m going to live on campus  The only affordable residence on campus is a double room  Which  I m okay with  if it didn t mean less privacy  and less of a chance of me being able to video call my SO every night like I normally do  I m really worried about us losing touch due to an even harder weight on our distance  We re both nervous and sad after I brought it up to him  I don t think we ll end up breaking up  but I m just so worried  In order for him to move out at a certain age  I d have to have my own apartment  It s just  a mess  I don t know if any of this makes sense  I just need some sort of reassurance  advice  or similar situations  Any other LDR survivors out there,0,LDR lives in the US and Canada. She is going to university. She doesn't want to live on her own. She wants to live in a double room on campus. She's worried they won't be able to video call each other.,cdr live canada go university not want live want live double room campus worried not able video
49456,Bruh I m excited for tomorrow Tomorrow among us get a new map and gets accounts,0,Bruh I m excited for tomorrow Tomorrow among us get a new map and gets accounts,brush excited tomorrow tomorrow new map get account
49457,Suicide till my next birthdayI decided that if i dont make any difference in my relationships with woman i gonna do whats right thing to do  Maybe cani get some tips how can i improve my life  Is there are methods to do for improving social life  any self development books or anything else that might save my life  I will give my best in months till april if i dont see any progress i end this shit  Good motivation aint it   D,1,"If he doesn't improve his relationships with women, he will kill himself. He will try to improve his social life in the months till April, but if he does not see any progress, he'll end his life.  ",not improve relationship woman kill try improve social life month till april not progress end life
49458,Describe what your best girlfriend looks like if your into girls Just want to see if I fit anyone s description,0,Describe what your best girlfriend looks like if your into girls Just want to see if I fit anyone s description,describe good girlfriend look like girl want fit description
49459,May   is my deadline  If nothing changes by then  then I m ending it I m a hopeless anxious mess  and I have been for far too long  I m tired of it  I ve been considering ending my life for years but I ve been putting it off  hoping things would change  that my anxiety would go away  But it s not and I don t want to be stuck like this forever  I want peace  I m giving myself until the  rd to try to find it and then I m throwing in the towel,1,"May is the deadline for her to find a solution to her anxiety. If she doesn't find it by then, she will end her life. She has been considering ending her life for years but has put it off in the hope things would change and the anxiety would go away.",deadline find solution anxiety not find end life consider end life year hope thing change anxiety away
49460,Sorting by new just gives you a shitton of posts about NNN Either they ve failed or are just complaining about it  It seems everyone here is just horny   Anyway gl to anyone doing it I guess,0,Sorting by new just gives you a shitton of posts about NNN Either they ve failed or are just complaining about it  It seems everyone here is just horny   Anyway gl to anyone doing it I guess,sort new give shit ton post fail complain horny guess
49461,Everyday I feel like I am getting closer and closer to deciding to end it Everyday I feel like I am getting closer and closer to deciding to end it I have rampant suicidal thoughts everyday nothing enough to act on yet  or maybe it is because I don t want to leave my younger brother alone  My significant other left me after   years  sold our house and moved across the country  I m drowning in debt and honestly don t see a way out  I m in this weird head space where I know I don t want to do it  I told myself I would never put myself in a situation like this but I just can t seem to find a better solution  I m afraid to call the hotline because I ve heard they just contact the authorities to send you to a mental institution   Day in and day out I just lay in bed really contemplating how it will effect my brother  Him being my only family I know he will be hurt so I try and stay strong for him  I just feel like everyday there is a new reason driving me to that point and now I can t tell if I am actively looking for those reasons or if they are merely coincidence  I m definitely scared because I never thought I would feel like this but I m more scared that I m not afraid of the outcome anymore,1,Everyday I feel like I'm getting closer to suicide. My significant other left me after years and moved across the country. I'm afraid to call the hotline because they might send me to a mental institution. I don't want to leave my younger brother alone.,everyday feel like get close suicide significant leave year move country afraid hotline send mental institution not want leave young brother
49462,Advice  If you are friends with someone for   years  it s okay to drop them like a fly   If they like to shout my full length name on twitter  I ll shout your  identity  name https i imgur com pi e rL png    PS  Lance  if you re reading this    you feeling dumb yet   Lance is not a real name it s an alias    WeLP,0,"Lance is not a real name, it's an alias of WeLP. If someone likes to shout his full name on Twitter, he'll shout his identity name. Lance is friends with someone for years and it's okay to drop them.",lance not real alias help like shout twitter shout identity lance friend year okay drop
49463,Interpret my dream  Idk I had a dream last night that I cannot stop thinking about  any advice would be appreciated  In my dream my FORMER crush and I were walking around an old barn together holding hands  and we were in love  I had super strong feelings for him in the dream  but in my real life I feel like I am over him  Thoughts,0,Last night I had a dream in which I was holding hands with my ex-boyfriend but in real life I feel like I am over him. Please help me to interpret this dream as I can't stop thinking about it.,night dream hold hand sex boyfriend real life feel like help interpret dream not stop think
49464,Two banana s walk into a bar  How the fuck did they get legs,0,Two banana s walk into a bar  How the fuck did they get legs,banana walk bar fuck leg
49465,Things I look for in a partner Goth gf that will step on me and crush my head with their thighs or a short gamer boy who I can step on,0,Things I look for in a partner Goth gf that will step on me and crush my head with their thighs or a short gamer boy who I can step on,thing look partner goth step crush head thigh short gamer boy step
49466,Even though my life has gotten so much better and I genuinely feel happy for the first time in my life  I don t know why I still get random sadness streaks  Over a year ago  I was almost at the point of killing myself  But I waited and then life got a lot better very quickly due to friends and getting a girlfriend   I used to cry myself to sleep and get random moments that would span a few minutes to house where I become paralyzingly sad  But those have really slowed down ever since my life turned around and went from happening once a week to around once a month  For the past   months  even though my life is amazing right now and I m happy where I m at  I m starting to get moments of paralyzing sadness and fear more and more frequently  Irrational fears like my gf leaving me or dying occur in my head I talked to my mom a few months ago about talking to a therapist and she seemed to take it seriously but never went further than that and seems to have completely forgotten about it Can anyone give me any advice on why I feel what I feel and how I can change it for the better  I wanna change because not only does feeling sad suck but I feel bad for my amazing girlfriend having to deal with me when I m like that,0,"A year ago, I was almost at the point of killing myself, but I waited and got a girlfriend. Now, I feel happy for the first time in my life, but still get random moments of paralyzing sadness. I talked to my mom about going to a therapist, but she forgot about it. ",year ago point kill wait get girlfriend feel happy time life random moment paralyse sadness talk mon go therapist forget
49467,I m tired of being aliveI have several mental illnesses  chronic pain  no job  no friends  no reason to want to live  I know how I d kill myself and could easily find a time when it would take a while for someone to find me  The only thing that has been stopping me is my family  I know they would be devastated and my dog would always wonder when I d be coming back  Now though I m not sure if that s enough to stop me  I m just exhausted and suffering  I don t feel comfortable talking to my parents about this but I don t have anybody else I can talk to,1,"I have several mental illnesses, chronic pain, no job, no friends and no reason to live. I know how I would kill myself. I don't want to talk to my parents about it, but I have no other option. ",mental illness chronic pain no job no friend no reason live know kill not want talk parent no option
49468,Another day in the class another i wish i could dieI am mature student in  Toxic class mates  basically today i was older than the teacher i hate myself i want die  i had car accident   years ago i wish i died in it why i have to live to see this  every goddamn person i know has done much more than me in his life  i hate myself  i live in the  th floor best thing is jumping,1,Today in Toxic class I was older than the teacher and I hate myself. I live in the th floor and I wish I could die. I had a car accident years ago and wish I died in it. Every person I know has done more than me in his life. ,today toxic class old teacher hate live floor wish die car accident year ago wish die person know life
49469,I had something to say and now I don t even give a fuck about saying it All I want to do is die  I don t want to be saved  I don t want to  talk about it  The world can burn for all I care  Fuck everything,1,I had something to say and now I don t even give a fuck about saying it All I want to do is die  I don t want to be saved  I don t want to  talk about it  The world can burn for all I care  Fuck everything,don fuck say want die don want save don want talk world burn care fuck
49470,Why is every time I actually try in gym glass  I m rewarded with pain  I SWEAR I have the worst luck in the history of sports  When we where running for   minutes on the track  my clown feet  size   tripped me and I face planted directly onto the track  On basketball day  I was dribbling the ball  and tripped on it when I went to grab it  I decided I would actually try to shoot a basket  I did make a   pointer  but I got hit the face  Twice  When we did upper body day  I was doing dips on the bleachers and my arms slipped and I bruised my tailbone  Yesterday  we where playing  belly tag  This game is where everyone lays down in pairs on the ground  The person who is  it  has to chase another person around until said person slides down onto the floor  then the person on the opposite end of the group has to run form the it person  If the it person catches the person running  the person running is now it and chances the other person until they lay down  and this continues  Well I  a slow  overweight girl  who unfortunately was tasked with chases people  They where all boys   I m a girl  I literally could not catch them and they mocked me the entire time  Well finally  one of them was slow to get up and I ran and layed down  practically dying  and out of breath  Well I slid right in really fast because he caught up to me and my knees on my legging now have holes an I have terrible friction burns   think carpet  but on hard  waxed wooden floors  why do I have such terrible luck  And they wonder why I hate gym class,0,"Every time I try in gym I get hurt in sports, I have terrible luck. Yesterday we were playing belly tag and I was chasing a group of boys. I couldn't catch them and they mocked me. Finally one of them caught up to me and I slid right in. ",time try gym hurt sport terrible luck yesterday play belly tag chase group boy not catch mock finally catch slide right
49471,R teenagers dictionary Corporal discipline  child abuse Verbal discipline  psychological abuse  Girl  ass and tits  Minecraft  good Fortnite  bad Wholesome,0,R teenagers dictionary Corporal discipline  child abuse Verbal discipline  psychological abuse  Girl  ass and tits  Minecraft  good Fortnite  bad Wholesome,teenager dictionary corporal discipline child abuse verbal discipline psychological abuse girl ass tit min craft good footnote bad wholesome
49472,Oh god oh god oh god I was just watching a porn video and it was some kinky shit i thought it was consensual fake force porn and light choking but i think it was a real snuff video  Oh fuck  Oh god,0,Oh god oh god oh god I was just watching a porn video and it was some kinky shit i thought it was consensual fake force porn and light choking but i think it was a real snuff video  Oh fuck  Oh god,god god god watch porn video kinky shit think consensual fake force porn light choke think real snuff video fuck god
49473,I m having a hard time telling my family I need serious help because of my anxiety I have been battling depression and anxiety the majority of my life  I was born with a disability and grew up in a very ignorant town  I have gone to a psychologist psychiatrist sense I was   I sometimes feel like because I have held myself together my entire life what they think what me falling apart looks like isn t  I lost someone who was like a brother to me  It will be   year in February  He was   I have been on medications sense he passed  I have tried telling my family that I can t hold my self together anymore but they keep brushing it off  I have spent my entire life dissociating painful memories and emotions  Sometimes I forget the most precious memories I had with my loved one  The closer I get to the one year mark that harder it is and the more I remember  It s like getting that phone call that he s gone alll over again I m so tired of acting like I m ok  I m scared if I don t get more help I could end it  How do I tell them,1,My brother died a year ago. I have been battling depression and anxiety for most of my life. I was born with a disability and grew up in a very ignorant town. I lost someone who was like a brother to me. I've been on medications sense he passed. I don't want to tell my family that I need help.,brother die year ago battle depression anxiety life bear disability grow ignorant town lose like brother medication sense pass not want tell family need help
49474,I want to kill myselfI want to kill myself This all happened a while back when my parents started showing more attention to my siblings than me  not that bad but gradually I disconnected  I started staying in my room all day and playing video games  they started going out without me and when I did come my oldest younger sister started hurting me eg  kicking me  punching me and pinching me but when I complained my parents did nothing  so one day she kicked me as hard as she possibly could so I complained  they did jack shit so hit her back  now they were hitting me and shouting at me and screaming shit like boys shouldn t hit girls so I asked what to do if she hit me and they said  take it like a man  so this game my sister the idea that she could hurt me and get away with it so just continued and it was the most horrible thing I have experienced  a couple weeks ago she a full bottle of mine and my mother s body wash into the sink and some fucking mixture with it AT   FUCKING YEARS OLD  she laughed at me when our parents left and said she wasn t paying for it and no she didn t  So yeah I don t want to be in this shitty family  I ve had some assholes in general annoy me at school and the Time my  friend  slammed a football at my face on purpose  laughed and called me weird when I blocked him  There s a ton more of shit but I could barely write this without breaking apart  I need advice because I want to kill myself badly right now,1,I want to kill myself. My sister kicked me and punched and kicked me. She put a full bottle of my mother's and her sister's body wash in the sink. She laughed at me when our parents left and said she wasn't paying for it. My friend slammed a football at my face. ,want kill sister kick punch kick bottle mother sister body wash sink laugh parent leave say not pay friend slam football face
49475,Random anxiety for no reason and my allergies are making it worse Great  wonderful  absolutely perfect I HATE EVERYTHING FUCKFUCKFUCKFUCKFUCKFUCK,0,Random anxiety for no reason and my allergies are making it worse Great  wonderful  absolutely perfect I HATE EVERYTHING FUCKFUCKFUCKFUCKFUCKFUCK,random anxiety no reason allergy make bad great wonderful absolutely perfect hate fuckfuckfuckfuckfuckfuck
49476,I m   and the all I want is dieWhen I think in the fact that I ve lived   years and the only thing that keeps me alive is that I m too scared of killing myself I just can t believe it  I don t want to live   years more,1,I m   and the all I want is dieWhen I think in the fact that I ve lived   years and the only thing that keeps me alive is that I m too scared of killing myself I just can t believe it  I don t want to live   years more,want die think fact live year thing keep alive scared kill believe don want live year
49477,I m a  D printer That s what I said my mum when she told me to close the door to the bathroom,0,I m a  D printer That s what I said my mum when she told me to close the door to the bathroom,printer say mum tell close door bathroom
49478,My brothers suicide attemptSo yesterday my older brother attempted suicide by overdose on paracetamol  Luckily it was caught before any damage had happened  He was taken to hospital and put on a drip He has been drinking and taking drugs everyday for about   months now  So has obviously developed an alcohol addiction and drug addiction and needs to go to rehab like the doctor in the hospital recommended but he refused to go Suffering from depression myself I completely understand why he done it so this isn t a question of how to understand him better I m asking where do I go from here  Where can he get help  How can I help him We live in Scotland but he doesn t want to go down the road of prescription drugs so what would be best to do,1,Yesterday my older brother tried to kill himself by overdosing on paracetamol. He was taken to hospital and put on a drip. He has been drinking and taking drugs everyday for months. He refused to go to rehab. He lives in Scotland and doesn't want to go down the road of prescription drugs.,yesterday old brother try kill overdose paracetamol take hospital drip drink take drug everyday month refuse rehab live scotland not want road prescription drug
49479,Soviet Anthem in Russian,0,Soviet Anthem in Russian,soviet anthem russian
49480,Anyone wanna chat about things I m super boooooooooooooooooooooooooooooooooooooooooooooooooooooooorrrrrrrrrrrrrrrrrrrrrrrrrrrrrrrrrrrrrrrrrrrrrrrrrrrrrrrrrrrreeeeeeeeeeeeeeeeeeeeeeeeeeeeeeeeeeeeedddddddddddddddddddd so plz,0,Anyone wanna chat about things I m super boooooooooooooooooooooooooooooooooooooooooooooooooooooooorrrrrrrrrrrrrrrrrrrrrrrrrrrrrrrrrrrrrrrrrrrrrrrrrrrrrrrrrrrreeeeeeeeeeeeeeeeeeeeeeeeeeeeeeeeeeeeedddddddddddddddddddd so plz,want chat thing super boo reed ply
49481,Why is everyone getting awards  Every singe meme I see on my page has awards  why,0,Why is everyone getting awards  Every singe meme I see on my page has awards  why,get award singe meme page award
49482,Is anyone else afraid they ll always struggle and never see the day where they aren t depressed and anxious   of the time For me that s the one thought that goes down the suicide spiral  What if it never gets better   Of course right now my cat is all up in my face trying to get my attention  as if she knows how I m feeling  but like I ve lost motivation to do anything until the last minute and anything I do think of to do I get halfway through it and get demotivated  and that s not like me at all  I m not myself  and so far I ve been a loser instead  I want that to change but things just don t stick  treatments don t always affect things in the long run  Sometimes they seem completely useless  Like I like my new therapist but I forgot to go this week    no call no show fee  and I have to try to reschedule but I keep forgetting to  My ADD is getting to me  my depression is getting to me  my social anxiety makes me happy to be at home but I get lonely when my cat doesn t lie down on the couch next to me when I ask her to  My job interview on Friday went really well  but now I m second guessing myself as to whether I can really do the job I said I could do  I ve done it before and I should be fine but what if I m not ready to start working again after a month and a half off  I should just show this whole post to my therapist when I see him next  or email it  or something  Oh and also my husband and I have to figure out taxes  Ugh  When will this end,1,At the moment she is depressed and anxious. She has lost motivation to do anything. Her job interview on Friday went well but she's second guessing if she can do the job. She forgot to go to the therapist this week.,moment depressed anxious lose motivation job interview friday go second guess job forget therapist week
49483,So I did something bad I ate all the cookies in the cookie jar I m sorry guys I had to I was hungry,0,So I did something bad I ate all the cookies in the cookie jar I m sorry guys I had to I was hungry,bad eat cookie cookie jar sorry guy hungry
