,text,class,summary,cleaned
200584,I just don t want to be here anymoreI m so sick of myself  I m sick of who I am  Just thinking about how much of a worthless piece of shit loner I am makes me sick  If only people knew how little I think of myself  If only they knew how fucked up my head is  They d want nothing to do with me  But most people don t suspect a thing I ve just had enough  I m done with myself  I want to be destroyed until there s nothing left,1,"I'm sick of myself and I don't want to be here anymore. If only people knew how little I think of myself, they wouldn't want nothing to do with me. I want to destroy myself until there's nothing left. ",sick not want anymore people know little think not want want destroy leave
200585,Fun fact Blood is just body and water And cum is just peepee juice,0,Fun fact Blood is just body and water And cum is just peepee juice,fun fact blood body water cum pee pee juice
200586,Everyone has a reason to live  except meEvery other suicidal person has something to live for  but I don t have anything  Just an empty funeral to look forward to,1,Everyone has a reason to live  except meEvery other suicidal person has something to live for  but I don t have anything  Just an empty funeral to look forward to,reason live suicidal person live don funeral look forward
200587,Goodnight People  You all are awesome  goodnight  Also  tomorrow I think I m going to ask my mother for a therapist because I ve been having some mental shit going on  wish me luck please u gamerdude  here is this promise in action,0,Goodnight People  You all are awesome  goodnight  Also  tomorrow I think I m going to ask my mother for a therapist because I ve been having some mental shit going on  wish me luck please u gamerdude  here is this promise in action,goodnight people awesome goodnight tomorrow think go ask mother therapist have mental shit go wish luck game dude promise action
200588,I turnee   a month ago and i owe     to the bank and   in court fees for only SPEEDINGLike I hate this state my parents bought me a car I drove for   months best time of my life got one to many tickets and now I owe   to the state or I get a bench warrant and I obv can t come up wit that by June  th and my car was taken  so life   months ago I was so happy and now I m just a depressed broken person so basically I m gunna KMS it was a fun lifeeee but not for everybody lol finna go tomorrow,1,"Parents bought a car for their son, but he got too many speeding tickets and owes money to the state. His car was taken by the state, so he's not going to drive it anymore. He'll go to KMS tomorrow.",parent buy car son get speeding ticket owe money state car take state not go drive anymore ems tomorrow
200589,I finally found something to live forA few days ago  I went out and adopted some guinea pigs  If I kill myself  who will feed the guineas  Who will play with them  Replenish their water  When I get the urge  I think of my guineas  and I begin to cool down  I m feeling greater than I have in a while  too,1,"A few days ago I adopted some guinea pigs. If I kill myself who will feed the guineas and who will play with them? If I get the urge to kill myself, I think of my guineafs. ",day ago adopt guinea pig kill feed guineas play urge kill think guineas
200590,Life has been a painful yet beautiful ride  I can t do it anymore  My anxiety is out of control  I m so worried about everything  I just want my boyfriend to love me  I just want to be loved  I just want to be happy,1,Life has been a painful yet beautiful ride  I can t do it anymore  My anxiety is out of control  I m so worried about everything  I just want my boyfriend to love me  I just want to be loved  I just want to be happy,life painful beautiful ride anymore anxiety control worried want boyfriend love want love want happy
200591,Why bother I wake up everyday  go to school and deal with a vast majority of people I don t like with some good people now and again  Then I just go home and do homework  sleep  and start all over again   It s gotten harder recently because I am the one who helps others when they are stressed or feeling depressed but now I feel as if there is no one to turn to   I want to just end it and let everyone else continue on with their lives  not like it will affect them that greatly  One less student to grade for my teachers  one less child to feed for my parents  and one last person people have to bother with at school   Why should I bother to keep getting up and doing the same boring routine every single day  Why shouldn t I free myself,1,I don't want to go to school anymore. I don't like most of the people I deal with there. It's gotten harder recently because I am the one who helps others when they are stressed or feeling depressed. I want to end it and let everyone else continue on with their lives.,not want school anymore not like people deal get hard recently help stress feel depressed want end let continue life
200592,i think i found out why GMT  Greenwich Mean Time  is so widely used in the  th century and before it was known how to find your latitude at sea by using the stars  but longitude was always a problem  in   the British government offered a   pound prize to technology that could accurately determine one s longitudinal position at sea  in   John Harrison designed the chronometer  a portable timekeeping device  set to the time in Greenwich  England  and submitted it to the government and eventually won the prize  by carrying a chronometer reading Greenwich time with them  sailors could use their local time compared to Greenwich time to accurately determine their longitude thanks for coming to my TED talk yall,0,John Harrison won a prize for developing a portable timekeeping device that could accurately determine one's longitudinal position at sea in GMT Greenwich Mean Time. He explains why GMT is so widely used in the th century and why longitude was always a problem for sailors.,john harrison win prize develop portable timekeepe device accurately determine one longitudinal position sea greenwich mean time explain widely century longitude problem sailor
200593,I can t deal with the pain any longerI just can t  My friends have basically all excluded me   forgotten about me  It was bad enough when it was just my friend group  but even one of my closest friends seems to be avoiding me as of late  I originally thought they were just being them  but I since learned they weren t as busy as I thought they were and have been seeing other friends and didn t think to include me  despite knowing I d like to be included  The pandemic and my surgery earlier this year made things very difficult for me  I basically did surgery recovery solo when I was strongly recommended not to  My parents are narcissistic ass holes I don t want anything to do with  despite their persistence  I m convinced I m the problem at this point  the pain is never ending  I am tempted to use the remainder of my pain killers to end it  Maybe not tonight  but probably this month  December is basically a nightmare for me,1,Even one of her closest friends seems to be avoiding her as of late. The pandemic and her surgery earlier this year made things very difficult for her. Her parents are narcissistic ass holes and she doesn't want anything to do with them despite their persistence.,close friend avoid late pandemic surgery early year thing difficult parent narcissistic ass hole not want despite persistence
200594,Can we recite the entire Shrek script  So something I ve been wondering for a while is if its possible for reddit to recite the entire Shrek script one line at a time in one comment thread  Today I will test this SO PLEASE DONT MESS IT UP  I will go first  If it gets messed up for some reason we ll start another thread,0,"Reddit can recite the entire Shrek script one line at a time in one comment thread. If it gets messed up, it will start another thread.    If it doesn't go well, Reddit will start a new thread.",geddit recite entire shrek script line time comment thread gets mess start thread not geddit start new thread
200595,I have high standards  You have to meet all of these criteria for me to like you   Be alive  Be human  Don t have sex with dead bodies or animals  Please holy shit someone love me I am so lonely If you can meet all of my demanding criteria then you are worthy of me,0,I have high standards  You have to meet all of these criteria for me to like you   Be alive  Be human  Don t have sex with dead bodies or animals  Please holy shit someone love me I am so lonely If you can meet all of my demanding criteria then you are worthy of me,high standard meet criterion like alive human don sex dead body animal holy shit love lonely meet demand criterion worthy
200596,Hey people im drunk af  don t make me drink moe because I don t have any more on me  tepl me to do basically anything Just give me something and I ll do it if you want me to,0,Hey people im drunk af  don t make me drink moe because I don t have any more on me  tepl me to do basically anything Just give me something and I ll do it if you want me to,hey people drunk don drink moe don tell basically ill want
200597,No other optionsI ve fucked every little thing in my life up because of depression  I only act on anything anymore so I don t get embarrassed  my lack of action has caused me to fail in every aspect possible  suicide is my only option  I can t and won t recover  I don t even know what to do anymore  I m completely alone and I broke up with the only girl aside from my mam who will ever care about me,1,Suicide is the only option for depression sufferer. He broke up with the only girl aside from his mam who will ever care about him. He can't and won't recover from depression and he doesn't know what to do anymore.,suicide option depression sufferer break girl aside mam care not not recover depression not know anymore
200598,I ve taken up dangerous hobbies Unless I m thrill seeking and pushing things too far I m so depressed  I ve purchased the gear to start ice climbing and mountaineering  I ve had several close calls during other activities but every time I go into survival mode and refuse to let myself die  I basically only have the will to live when I m close to death   I suspect as my physical ability declines my depression will worsen  I m considering leaving my girlfriend so that once my parents die there won t be anyone left to mourn my death if I were to have an accident,1,"As his physical ability declines, he's considering leaving his girlfriend and starting ice climbing and mountaineering. He wants to die soon so that there won't be anyone left to mourn his death if he were to have an accident.",physical ability decline consider leave girlfriend start ice climbing mountaineer want die soon not leave mourn death accident
200599,i know i m not the only one who wanted to grow up so bad and now wish they could go back to just being a child and not having to worry about anything  besides what tv show i was going to watch once i came back from school  relatable,0,i know i m not the only one who wanted to grow up so bad and now wish they could go back to just being a child and not having to worry about anything  besides what tv show i was going to watch once i came back from school  relatable,know not want grow bad wish child not have worry go watch come school relatable
200600,GUYS HELP SEND GOOD VIBES RN I HAVE ANXIETY AND I HAVE AN INTERVIEW TO APPLY TO MY STUDENT COUNCIL AND I M NERVOUS HELP,0,GUYS HELP SEND GOOD VIBES RN I HAVE ANXIETY AND I HAVE AN INTERVIEW TO APPLY TO MY STUDENT COUNCIL AND I M NERVOUS HELP,guy help send good vibe right anxiety interview apply student council nervous help
