,text,class,summary,cleaned
123869,I ve never felt worthy of anything and I don t know how to change it It doesn t matter how many people sit there and tell you that you are  even if it s every day  somewhere sometime my brain was hardwired to make me believe I m not worth anything at all and I do not know how to change it  Reciting shit to yourself in the mirror honestly is the dumbest thing I ve ever heard  It doesn t work  I don t feel good enough  I don t feel worthy  I just don t want to be here anymore  I m so tired,1,I have never felt worthy of anything and I don't know how to change it. I'm tired of thinking about myself and I just don't want to be here anymore. I don’t know what to do about it.,feel worthy not know change tired think not want anymore not know
123870,Message to those of you who don t do anything on team projects  Get your lazy ass off your phone  help your damn teammates  you might be thinking  oh its not that hard  my team mate has this  but did you think about the fact that they have to do theirs too  I spent probably   hours on a college team project covering for   people who refused to do anything  If I was paid minimum wage  I would be   richer  Help  Your  Team,0,Those who don't do anything on team projects should help their teammates. I spent a lot of time on a college team project covering for people who refused to do anything. If I was paid minimum wage I would be richer. ,not team project help teammate spend lot time college team project cover people refuse pay minimum wage rich
123871,Are video games multimedia sources  I have to do a school comparative analysis essay on two multimedia or reading sources  I can t remember any books that I have read  and my only other choice  if I m not convinced that video games are multimedia sources  is probably going to be analyzing two Jim Carrey movies or something else that I can enjoy  I was thinking I would compare two horror games or something with an actual story if that helps  like Outlast or something like that  I m obviously not going to do something like Call of Duty or Fortnite or something that is multiplayer based  Any advice or help is appreciated  thanks guys,0,"I have to do a school comparative analysis essay on two multimedia or reading sources. If I'm not convinced that video games are multimedia sources, I might analyze two Jim Carrey movies or a horror game. I don't want to do Call of Duty or Fortnite.",school comparative analysis essay multimedia reading source not convinced video game multimedia source analyse jim carry movie horror game not want duty footnote
123872,I am now officially a high school drop out The account I m currently using to write this post is a separate account from another one I already have Well  I blew it  I m done  completely and utterly done  Tomorrow is the first day of school where I live  I m suppose to be a senior  but instead this year I m not attending  High school was hell from the start from me  It s all due to the fact that I was too lazy to wake up in the morning to even attend  too insecure about my looks to want to be seen in public  too quiet and secluded to make any connections  too rebellious to want to obey any authority figure  and most of all  too apathetic to even care  Now it s over  I was told that if I didn t get my act together that this day would come  but I didn t listen  I am so fucked right now What the fuck am I going to do with my life  How am I going to get money  I am so stuck right now  I am so isolated right now  I don t even have any real friends  I have no places to go  nothing to do  and nothing to even look forward to  I am a total failure  I don t see any way I can get out of this  The only escape seems to be suicide  It s either that or be a complete loser idiot who lives at home with his parents that doesn t have a good job and possesses  no friends  I really think I m going to end it within the next week or so  I don t have anyone or anything to turn to,1,"Tomorrow is the first day of school where I live. I m suppose to be a senior but instead I'm not attending this year. High school was hell from the start. I was too lazy to wake up in the morning to even attend. I don't have any real friends, I have no places to go, nothing to do and nothing to look forward to. The only escape seems to be suicide. ",tomorrow day school live suppose senior instead not attend year high school hell start lazy wake morning attend not real friend no place look forward escape suicide
123873,I miss him so much He was always there you  he listened and helped  He cared about others  He had good humour and was in general so awesome to talk to  I still can t believe he is gone after two months  and I m kinda giving up hope that I ll ever see him again,0,I miss him so much He was always there you  he listened and helped  He cared about others  He had good humour and was in general so awesome to talk to  I still can t believe he is gone after two months  and I m kinda giving up hope that I ll ever see him again,miss listen help care good humour general awesome talk believe go month kind give hope ill
123874,Regrethave any of you jumped off a bridge and survived,1,Regrethave any of you jumped off a bridge and survived,regret jump bridge survive
123875,How tf do i have muscles How tffffffffffffffffffffffff,0,How tf do i have muscles How tffffffffffffffffffffffff,muscle
123876,Little rant and need some advice  idk which flair to use   Okay so I like girls but I haven t told anyone  except those reading this   Last year one of my friends confessed that he liked me and I panicked and said that I liked him too  so then we were in a relationship that went way too fast in many ways and became very toxic very quickly  Earlier this year I ended things because my mental health was getting worse every day I was with him  Ya think I d learn from my past mistakes and avoid relationships with my friends who confess but nope  Last week another friend said he liked me and I did the same thing they I did last year  I know for sure I don t feel the same way but I don t wanna end things because he s happy with me  I don t know what I should do,0,"Last year one of my friends confessed that he liked me and I panicked and said that I liked him too. This year I ended the relationship because my mental health was getting worse every day I was with him. Last week another friend confessed that they liked each other and I did the same thing. Now I know for sure I don't feel the same way, but he's happy with me. ",year friend confess like panic say like year end relationship mental health get bad day week friend confess like thing know sure not feel way happy
123877,Ending a relationship because of suicidal thoughts Has anyone ever done this  I just feel like I m bringing down the people around me  especially my  boyfriend  he would be better off without me,1,Ending a relationship because of suicidal thoughts Has anyone ever done this  I just feel like I m bringing down the people around me  especially my  boyfriend  he would be better off without me,end relationship suicidal thought feel like bring people especially boyfriend well
123878,I can t take any more of thisI keep asking people every single day if things are going to go back to normal  They never have an answer  All I hear is Pollyanna bullshit  stay  positive it gets better all bullshit all of it I was just at a rebound at the start of this year and now look  Everything s gone to shit  I m about to explode  I can t take anymore I go on this site and twitter and everyones in denial  Maybe it ll get better  maybe it won t  new normal  it s all bullshit  ain t no covid  it s a conspiracy  I can t fucking take anymore from any of these fucking idiots Jesus fucking christ i m gonna fucking explode,1,Everything went wrong at the start of this year and I'm about to explode. I keep asking people if things are going to go back to normal and they never have an answer. I can't take anymore from any of these idiots. ,go wrong start year explode ask people thing go normal answer not anymore idiot
123879,i cant stop thinking about them i want dababy to turn me into a convertible,0,i cant stop thinking about them i want dababy to turn me into a convertible,not stop think want dab aby turn convertible
123880,Is mild self harm really that bad  I have noticed when I m stressed or anxious I normally don t want to kill myself as much as the feeling of just knowing I could and I resort to normally taking   extra pills or very mild cutting and if it makes me feel better and doesn t actually hurt me is it okay  What bad things could come of this,0,"Mild self harm is okay if it makes me feel better and doesn't hurt me, but bad things could come of it if it does hurt me. When I'm stressed or anxious I resort to taking extra pills or mild cutting.",mild self harm okay make feel well not hurt bad thing come hurt stressed anxious resort take extra pill mild cutting
123881,What do you guys do when your sad   Idk im sad and just wanna know how other people handle it,0,What do you guys do when your sad   Idk im sad and just wanna know how other people handle it,guy sad not know sad want know people handle
123882,Gif is pronounced JIF otherwise you are of an inferior bloodline Yeah you heard me right  Its JIF mf not gy f Virtually fight me,0,Gif is pronounced JIF otherwise you are of an inferior bloodline Yeah you heard me right  Its JIF mf not gy f Virtually fight me,pronounce inferior bloodline yeah hear right not virtually fight
