,text,class,summary,cleaned
68990,Ik all the drama with CallMeCarson has been wild but this video really needs more views Its Narrators perspective and it really shows a lot of the behind the scenes https youtu be SdeQFIrsFzU,0,Ik all the drama with CallMeCarson has been wild but this video really needs more views Its Narrators perspective and it really shows a lot of the behind the scenes https youtu be SdeQFIrsFzU,drama carson wild video need view narrator perspective show lot scene youtube self isuzu
68991,edgelords will call people  snowflakes  for being decent humans yet will make a   hour speech on why the LGBTQ  community is wrong when they find out someone is gay or trans Edgy humour gets boring quite quickly ngl,0,edgelords will call people  snowflakes  for being decent humans yet will make a   hour speech on why the LGBTQ  community is wrong when they find out someone is gay or trans Edgy humour gets boring quite quickly ngl,edge lord people snowflake decent human hour speech lgth community wrong find gay tran edgy humour get boring quickly nil
68992,I think I m probably gonna delete the Reddit app soon  it just makes me feel consistently worse I only have this account on mobile so I ll probably go inactive on it soon,0,I think I m probably gonna delete the Reddit app soon  it just makes me feel consistently worse I only have this account on mobile so I ll probably go inactive on it soon,think probably go delete geddit app soon make feel consistently bad account mobile ill probably inactive soon
68993,The strongest and scariest feeling that I ever felt I feel ready  I ve accepted that my existence is pretty much worthless and doesn t affect anyone related to me but my parents  They are the only reason I haven t tried yet  It pains me so much to read people s posts on suicide bereavement and imagine they could be my loves ones but I feel each day more hopeless and without energy to move forward  I ve tried multiple treatments and have been just experiencing side effects of medications  What pains me the most is the fact that even if I try and succeed nobody would ever understand my reasons and I will just be a prick that decided to get my boarding pass to the unknown earlier,1,Suicide is the strongest and scariest feeling that I've ever felt. My parents are the only reason I haven't tried yet. I've tried multiple treatments and have been just experiencing side effects of medications. Even if I succeed nobody would ever understand my reasons.,suicide strong scary feeling feel parent reason not try try multiple treatment experience effect medication succeed understand reason
68994,Rant          Nothing like watching my favorite anime to remind me who I really am  Growing up I  wanted to be a shinobi from Naruto but i didny kniw the suffering my life would bring  I m not sure how to cope with my deamons  I don t know what I m doing in college  And I don t know if I deserve to be happy  From suffering blindly I know that if I don t accept myself and face my downfalls my life will be lost             In the face of wanting my life to end and taunts of how I will never attain peace  In the face of my deamons I will never EVER give up  In the face of adversity I will stand for what I believe in  And that is the life that will not be taken without death  That is the hell I ve chosen for myself,1,"As a kid, I wanted to be a shinobi from the anime ""Naruto"". Now I'm in college and I don't know how to cope with my deamons. I will stand for what I believe in. ",kid want shin obi anime auto college not know cope demon stand believe
68995,Hey guys I need some help here Guys I know it s long but please read it So I really liked this girl and I finally got the courage to ask her out  She said yes so I told one of my best friends  So even he started talking to her just like that and guess what he started liking her So what that asshole did is stated telling her that I wanted to break up cause she was taking to much of my time but I was so happy with her So she broke up with me  At first I didn t understand wat happened so I made a fake account to talk to get as a friend and she said how much she hated me because of what my best friend told her I was so fucking losers and angry I confronted my friend and he and I aren t friend anymore But she still hates me so much and I liked her soo much and I was so happy I don t know what to do,0,The girl broke up with him because he asked her out. She hated him because his best friend told her that he wanted to break up with her. Now he and his friend are no longer friends because of that. He doesn't know what to do. ,girl break ask hate good friend tell want break friend no long friend not know
68996,talk numberCalled the suicide hotline and the guy laughed at me and said do it faggot  I dont think that s how the     number is supposed to work  Geez I mean I was depressed and not in a good state when I called now I just want to make sure this guy doesnt do that to anyone else,1,talk numberCalled the suicide hotline and the guy laughed at me and said do it faggot  I dont think that s how the     number is supposed to work  Geez I mean I was depressed and not in a good state when I called now I just want to make sure this guy doesnt do that to anyone else,talk number call suicide hotline guy laugh say faggot not think number suppose work geez mean depressed not good state call want sure guy not
68997,What are the benefits of shooting through the chin or through the mouth rather than simply the side of the head in suicide with gun If one wants to commit suicide with a gun in a movie  they put it in their mouth or to the chin  Why  If you want a painless death you would want to have a  quicker route  the bullet would have to take  thus minimizing the things penetreted  Is it because the tissues and the skull surrounding the brain is harder on the side and would stop the bullet or reduce its speed or is it somehow more painful  Is it less effective,1,"In a movie, when someone wants to commit suicide with a gun, they put it in their mouth or to the chin instead of the side of the head. The tissues and the skull surrounding the brain is harder on the side and would stop the bullet.",movie want commit suicide gun mouth chin instead head tissue skull surround brain hard stop bullet
68998,Help one of friends tried to kill themselves I m trying to keep this simple but they just opened up to me about happened a couple days ago and it was nothing crazy but they cut themselves said  I knew it was going to hurt but that s why I wanted to  they also claimed to have this massive flood of emotions  They say everything is under control but so worried about them this has never been something I ve had to deal with so I need some help,0,One of my friends tried to kill themselves a couple of days ago. I am worried about them and I need some help. They say everything is under control but I am still worried and need their help.      ,friend try kill couple day ago worried need help control worried need help
68999,Should I have been able to swear when I was   Filler filler filler filler filler filler filler filler filler Filler filler filler filler filler filler filler filler filler Filler filler filler filler filler filler filler filler filler Filler filler filler filler filler filler filler filler filler Filler filler filler filler filler filler filler filler filler Filler filler filler filler filler filler filler filler filler Filler filler filler filler filler filler filler filler filler,0,"When I was younger, I couldn't swear. Now, I can swear again.    I'm not sure if I should have been able to swear when I was, because I didn't know how to. I don't know if I could have.",young not swear swear not sure able swear not know not know
